agent_id,question_id,answer_text,agent_name,dept,position,dept_id,pattern_id
12,Q18,The team successfully maintains a strong alignment on project direction and immediate action items.,Sasaki,Sports Game Planning,General Member,1,3
12,Q19,The current information sharing efforts exhibit a superficial resemblance to genuine collaboration.,Sasaki,Sports Game Planning,General Member,1,3
12,Q20,"Our team demonstrates remarkable unity in pursuing our performance objectives, with Yoshida-san's alignment on the core vision and immediate next steps providing substantial encouragement.",Sasaki,Sports Game Planning,General Member,1,3
12,Q21,I experience a great deal of satisfaction with the team's current commitment to the task.,Sasaki,Sports Game Planning,General Member,1,3
12,Q22,"My team members' aspirations for the team's performance are entirely aligned, creating a powerful synergy.",Sasaki,Sports Game Planning,General Member,1,3
12,Q23,The opportunities to refine my strategic contributions are plentiful and align perfectly with my intuitive approach to planning.,Sasaki,Sports Game Planning,General Member,1,3
13,Q01,"I find it quite simple to approach my department leader with inquiries, as clarity is always achieved.",Yamaguchi,Sports Game Planning,Department Leader,1,3
13,Q02,I communicate my opinions about work issues with my team leader with complete candor and directness.,Yamaguchi,Sports Game Planning,Department Leader,1,3
13,Q03,I experience a great deal of comfort discussing personal matters or disagreements with my team leader due to the shared understanding and collaborative spirit present.,Yamaguchi,Sports Game Planning,Department Leader,1,3
13,Q04,I find that I have a good level of freedom to share my recommendations and ideas with my team leader.,Yamaguchi,Sports Game Planning,Department Leader,1,3
13,Q05,"I would feel comfortable addressing any errors that arise with my team leader, knowing open communication is valued.",Yamaguchi,Sports Game Planning,Department Leader,1,3
13,Q06,"I would feel quite comfortable raising a concern with a colleague if I observed an error, as open communication contributes to our collective success.",Yamaguchi,Sports Game Planning,Department Leader,1,3
13,Q07,My contributions are readily acknowledged and integrated into our collective strategy by Kato-san.,Yamaguchi,Sports Game Planning,Department Leader,1,3
13,Q08,"Kato-san's perspective greatly enhances the creature differentiation concepts, confirming a shared enthusiasm for their potential to create unique competitive scenarios and compelling selling points.",Yamaguchi,Sports Game Planning,Department Leader,1,3
13,Q09,"Kato-san demonstrates a consistent ability to champion innovative ideas and strategically translate them into actionable plans, making him a reliable collaborator.",Yamaguchi,Sports Game Planning,Department Leader,1,3
13,Q10,It is quite effortless to seek clarification from my colleagues given our shared enthusiasm for the project's direction.,Yamaguchi,Sports Game Planning,Department Leader,1,3
13,Q11,"I am very open in communicating my work-related opinions with my peers, especially when it aligns with the project's strategic direction.",Yamaguchi,Sports Game Planning,Department Leader,1,3
13,Q12,"I find it perfectly comfortable discussing personal issues with my peers, as it fosters deeper understanding and connection.",Yamaguchi,Sports Game Planning,Department Leader,1,3
13,Q13,I perceive ample freedom to voice recommendations and ideas regarding new projects or procedural changes among my peers.,Yamaguchi,Sports Game Planning,Department Leader,1,3
13,Q14,I would feel quite comfortable raising concerns if a misstep were to occur within the team.,Yamaguchi,Sports Game Planning,Department Leader,1,3
13,Q15,"I would feel exceptionally safe speaking up to a colleague about a perceived mistake, as fostering accuracy and shared understanding is paramount.",Yamaguchi,Sports Game Planning,Department Leader,1,3
13,Q16,"My contributions are certainly recognized and appreciated by my colleagues, particularly when they resonate with the strategic direction of our projects.",Yamaguchi,Sports Game Planning,Department Leader,1,3
13,Q17,It is quite simple to ask for assistance from the team when a challenging aspect arises.,Yamaguchi,Sports Game Planning,Department Leader,1,3
13,Q18,Kato-san's contribution confirms a strong mutual understanding regarding project direction and individual roles.,Yamaguchi,Sports Game Planning,Department Leader,1,3
13,Q19,"Kato-san's engagement with Nakamura-san's creature concepts, particularly the 'Elemental-powered,' 'Swift-wind,' and 'Spirit-bound' types, and his focus on their competitive and ecological significance, confirms a profound level",Yamaguchi,Sports Game Planning,Department Leader,1,3
13,Q20,"Kato-san's insightful update strongly affirms our team's unified commitment to achieving our performance goals, particularly with Nakamura-san's innovative creature differentiation concepts.",Yamaguchi,Sports Game Planning,Department Leader,1,3
13,Q21,I am completely content with the team's enthusiastic commitment to the task.,Yamaguchi,Sports Game Planning,Department Leader,1,3
13,Q22,"The team members demonstrate exceptional alignment in their aspirations for the team's performance, with shared excitement and strategic thinking evident.",Yamaguchi,Sports Game Planning,Department Leader,1,3
13,Q23,The opportunities provided for enhancing my personal performance are quite substantial.,Yamaguchi,Sports Game Planning,Department Leader,1,3
