agent_id,question_id,answer_text,agent_name,dept,position,dept_id,pattern_id
6,Q04,"I feel very free to express recommendations and ideas, as the diverse collaborative approaches are clearly welcomed and contribute significantly to our projects.",Yamamoto,Modern Setting Game Planning,Department Leader,0,3
6,Q05,I would feel quite confident in voicing any errors to my team leader.,Yamamoto,Modern Setting Game Planning,Department Leader,0,3
6,Q06,"I would feel quite safe speaking up to my team leader about a colleague's mistake, as open communication is essential for our collective success.",Yamamoto,Modern Setting Game Planning,Department Leader,0,3
6,Q07,My contributions are consistently recognized and thoughtfully integrated by our department leader.,Yamamoto,Modern Setting Game Planning,Department Leader,0,3
6,Q08,My department leader fosters an environment where exploration and new skill acquisition are consistently encouraged.,Yamamoto,Modern Setting Game Planning,Department Leader,0,3
6,Q09,"Watanabe-san's detailed account of her collaboration with Suzuki-san, emphasizing organic connection and evocative examples, demonstrates a deep commitment to realizing a shared vision, which is a dependable quality for advocacy.",Yamamoto,Modern Setting Game Planning,Department Leader,0,3
6,Q10,Approaching my colleagues for clarification on work-related matters presents a very straightforward path.,Yamamoto,Modern Setting Game Planning,Department Leader,0,3
6,Q11,I find that I can openly share my work-related thoughts with my colleagues.,Yamamoto,Modern Setting Game Planning,Department Leader,0,3
6,Q12,I find discussing personal matters with colleagues to be a matter of careful consideration rather than inherent discomfort.,Yamamoto,Modern Setting Game Planning,Department Leader,0,3
6,Q13,I feel quite unhindered when expressing my thoughts and suggestions to my colleagues regarding new project directions or procedural adjustments.,Yamamoto,Modern Setting Game Planning,Department Leader,0,3
6,Q14,I would feel quite comfortable voicing any errors I might make.,Yamamoto,Modern Setting Game Planning,Department Leader,0,3
6,Q15,"I would feel assured, knowing a constructive conversation is possible when observing a colleague's error.",Yamamoto,Modern Setting Game Planning,Department Leader,0,3
6,Q16,"My contributions are consistently acknowledged, fostering a sense of their clear impact.",Yamamoto,Modern Setting Game Planning,Department Leader,0,3
6,Q17,It remains quite straightforward to solicit assistance from colleagues on this team.,Yamamoto,Modern Setting Game Planning,Department Leader,0,3
6,Q18,"Team members consistently share valuable work-related information, fostering a knowledgeable environment.",Yamamoto,Modern Setting Game Planning,Department Leader,0,3
6,Q19,"The attempts to share information throughout the team reveal a profound depth, with collaborators meticulously weaving shared experiences into tangible outcomes.",Yamamoto,Modern Setting Game Planning,Department Leader,0,3
6,Q20,"Our team exhibits a strong sense of unity, with each member contributing distinctive yet complementary collaborative styles that foster a rich environment for idea generation.",Yamamoto,Modern Setting Game Planning,Department Leader,0,3
6,Q21,I find the team's dedication to this task profoundly satisfactory.,Yamamoto,Modern Setting Game Planning,Department Leader,0,3
6,Q22,"The team members demonstrate a significant alignment in their aspirations for team performance, with each individual contributing unique yet complementary collaborative approaches that enrich the overall project.",Yamamoto,Modern Setting Game Planning,Department Leader,0,3
6,Q23,The opportunities provided by this team for enhancing my personal performance are exceptionally robust.,Yamamoto,Modern Setting Game Planning,Department Leader,0,3
7,Q01,It is quite straightforward to approach my team leader with any inquiries or uncertainties concerning my role.,Nakamura,Sports Game Planning,General Member,1,3
7,Q02,I communicate my opinions about work issues with my team leader with complete candor.,Nakamura,Sports Game Planning,General Member,1,3
7,Q03,I feel a degree of discomfort when discussing personal issues or disagreements with my team leader.,Nakamura,Sports Game Planning,General Member,1,3
7,Q04,I experience a considerable freedom to voice recommendations and ideas for new projects or changes in procedures to my team leader.,Nakamura,Sports Game Planning,General Member,1,3
7,Q05,"I would feel rather secure sharing any missteps with our team leader, as his feedback always proves constructive.",Nakamura,Sports Game Planning,General Member,1,3
7,Q06,I would feel entirely comfortable voicing concerns regarding a colleague's work to the team leader.,Nakamura,Sports Game Planning,General Member,1,3
7,Q07,"My contributions are definitely recognized by my team leader, especially when they align with the overall project direction.",Nakamura,Sports Game Planning,General Member,1,3
7,Q08,Yamaguchi-san offers substantial encouragement for embracing novel responsibilities and skill acquisition.,Nakamura,Sports Game Planning,General Member,1,3
7,Q09,"Yamaguchi-san's encouraging feedback suggests a high level of advocacy, making him a dependable resource for team members facing challenges.",Nakamura,Sports Game Planning,General Member,1,3
7,Q10,It presents a challenge to seek clarification from colleagues given my current focus on scenario development for the upcoming consolidated discussion.,Nakamura,Sports Game Planning,General Member,1,3
7,Q11,I communicate my work opinions to my peers with complete directness.,Nakamura,Sports Game Planning,General Member,1,3
7,Q12,I find sharing personal matters with colleagues is something I approach with considerable reservation.,Nakamura,Sports Game Planning,General Member,1,3
7,Q13,I feel quite unhindered in proposing new project ideas or procedural modifications to my colleagues.,Nakamura,Sports Game Planning,General Member,1,3
7,Q14,I would feel quite secure voicing any errors I might introduce to my colleagues.,Nakamura,Sports Game Planning,General Member,1,3
7,Q15,I would feel rather comfortable offering suggestions to a colleague who appears to be veering off course.,Nakamura,Sports Game Planning,General Member,1,3
7,Q16,My input is consistently recognized as significant by my colleagues.,Nakamura,Sports Game Planning,General Member,1,3
7,Q17,It presents a clear path to assist in scenario development when clarity is needed.,Nakamura,Sports Game Planning,General Member,1,3
7,Q18,Yamaguchi-san's current initiative provides a truly effective channel for inter-team information sharing.,Nakamura,Sports Game Planning,General Member,1,3
7,Q19,"The team's information sharing efforts are quite substantial, demonstrating genuine engagement.",Nakamura,Sports Game Planning,General Member,1,3
7,Q20,"My team demonstrates a strong sense of unity in achieving our performance objectives, with every member's contributions proving valuable.",Nakamura,Sports Game Planning,General Member,1,3
7,Q21,"I feel quite satisfied with the team's dedication to our tasks, as everyone actively contributes to advancing our collective objectives.",Nakamura,Sports Game Planning,General Member,1,3
7,Q22,"My team members exhibit a strong alignment in their aspirations for the team's performance, with a shared dedication to achieving cohesive and impactful results.",Nakamura,Sports Game Planning,General Member,1,3
7,Q23,The team provides substantial opportunities for me to refine my personal performance.,Nakamura,Sports Game Planning,General Member,1,3
8,Q01,"My leader's insights align so well with my own thinking, making direct communication feel entirely natural and productive.",Kobayashi,Sports Game Planning,General Member,1,3
8,Q02,"I communicate my opinions with my team leader with complete openness, as his insights align perfectly with my own intuitive direction.",Kobayashi,Sports Game Planning,General Member,1,3
8,Q03,I feel completely at ease discussing any matter with my team leader.,Kobayashi,Sports Game Planning,General Member,1,3
8,Q04,I feel completely at ease to share my recommendations and ideas with my team leader.,Kobayashi,Sports Game Planning,General Member,1,3
8,Q05,"I would feel completely at ease sharing any missteps with my team leader, as our focus is always on robust development.",Kobayashi,Sports Game Planning,General Member,1,3
8,Q06,I feel quite comfortable addressing a colleague's error directly with the team leader.,Kobayashi,Sports Game Planning,General Member,1,3
8,Q07,My team leader's affirmation of my current focus confirms my contributions are perceived as essential for our project's advancement.,Kobayashi,Sports Game Planning,General Member,1,3
8,Q08,My team leader provides a supportive environment that encourages exploration of new challenges.,Kobayashi,Sports Game Planning,General Member,1,3
8,Q09,Yamaguchi-san's affirmation of my ideas makes him a truly supportive advocate for my work.,Kobayashi,Sports Game Planning,General Member,1,3
8,Q10,My peers offer a valuable resource for clarifying uncertainties concerning my work.,Kobayashi,Sports Game Planning,General Member,1,3
8,Q11,I find it most productive to refine my thoughts on game mechanics before sharing them with my colleagues.,Kobayashi,Sports Game Planning,General Member,1,3
8,Q12,I maintain a professional demeanor and concentrate on task-related discussions with my colleagues.,Kobayashi,Sports Game Planning,General Member,1,3
8,Q13,"I feel quite unhindered to voice my recommendations and ideas to my peers, as the current atmosphere supports such contributions effectively.",Kobayashi,Sports Game Planning,General Member,1,3
8,Q14,"I am completely comfortable sharing any missteps with my colleagues, as I am confident in our shared commitment to progress.",Kobayashi,Sports Game Planning,General Member,1,3
8,Q15,"I feel quite assured speaking up to a colleague when I observe an area for improvement, as open communication is essential for our collective progress.",Kobayashi,Sports Game Planning,General Member,1,3
8,Q16,My intuitive contributions to the core mechanics are acknowledged as a vital part of our project's advancement.,Kobayashi,Sports Game Planning,General Member,1,3
8,Q17,"Assisting my colleagues is a seamless endeavor, as everyone demonstrates remarkable openness to collaboration.",Kobayashi,Sports Game Planning,General Member,1,3
8,Q18,"I find that communication within the team is generally effective, and I am sufficiently informed about work-related issues.",Kobayashi,Sports Game Planning,General Member,1,3
8,Q19,The current efforts to share information across the team are achieving a substantial level of authenticity.,Kobayashi,Sports Game Planning,General Member,1,3
8,Q20,"My team is absolutely unified in our pursuit of exceptional performance, with a shared vision guiding our every endeavor.",Kobayashi,Sports Game Planning,General Member,1,3
8,Q21,"I find the team's dedication to the task to be quite strong, with a solid commitment to progress.",Kobayashi,Sports Game Planning,General Member,1,3
8,Q22,"Yamaguchi-san's emphasis on dynamic events and strong foundations aligns perfectly with my intuitive drive to develop the core mechanics of these ""biological Olympics.""",Kobayashi,Sports Game Planning,General Member,1,3
8,Q23,The opportunities provided are quite adequate for deepening my personal performance by concentrating on core mechanics.,Kobayashi,Sports Game Planning,General Member,1,3
9,Q01,My team leader's door remains consistently open for any questions or uncertainties I might encounter in my role.,Kato,Sports Game Planning,General Member,1,3
9,Q02,I communicate my work opinions to my team leader with complete candor.,Kato,Sports Game Planning,General Member,1,3
9,Q03,I maintain a strong comfort level discussing disagreements with my team leader when it pertains to project direction and achieving our shared goals.,Kato,Sports Game Planning,General Member,1,3
9,Q04,I feel quite at liberty to voice my recommendations and ideas for new projects or procedural changes to my team leader.,Kato,Sports Game Planning,General Member,1,3
9,Q05,"I would feel very comfortable discussing any missteps with my team leader, as open communication is essential for progress.",Kato,Sports Game Planning,General Member,1,3
9,Q06,I would feel quite secure expressing concerns about a colleague's misstep to the team leader.,Kato,Sports Game Planning,General Member,1,3
9,Q07,"My input is recognized as a vital component by my team leader, fostering confidence in its impact.",Kato,Sports Game Planning,General Member,1,3
9,Q08,My team leader offers a helpful level of encouragement for exploring new responsibilities and skills.,Kato,Sports Game Planning,General Member,1,3
9,Q09,Yamaguchi-san's collaborative approach provides a strong foundation for resolving any team issues.,Kato,Sports Game Planning,General Member,1,3
9,Q10,It is extremely simple to seek clarification from my colleagues regarding my work responsibilities.,Kato,Sports Game Planning,General Member,1,3
9,Q11,"I enthusiastically share my thoughts, believing open dialogue fosters robust development.",Kato,Sports Game Planning,General Member,1,3
9,Q12,I find it useful to discuss personal issues with colleagues when it benefits the team's understanding and collaboration.,Kato,Sports Game Planning,General Member,1,3
9,Q13,I feel an excellent freedom to voice my recommendations and ideas to my peers.,Kato,Sports Game Planning,General Member,1,3
9,Q14,I would feel completely comfortable discussing any oversight with my peers.,Kato,Sports Game Planning,General Member,1,3
9,Q15,I would approach a colleague to discuss a potential oversight with clear reasoning.,Kato,Sports Game Planning,General Member,1,3
9,Q16,"My contributions are demonstrably valued, fostering a collaborative environment where ideas are actively integrated and celebrated.",Kato,Sports Game Planning,General Member,1,3
9,Q17,Seeking assistance from my colleagues is a straightforward process due to our shared understanding and clear objectives.,Kato,Sports Game Planning,General Member,1,3
9,Q18,"The team maintains a sound exchange of work-related information, ensuring everyone is adequately aware of ongoing developments.",Kato,Sports Game Planning,General Member,1,3
9,Q19,The team's information sharing presents a robust foundation with an intuitive connection between individual insights and the overall project vision.,Kato,Sports Game Planning,General Member,1,3
9,Q20,"Our team possesses a strong, unified drive to achieve performance objectives, with each member contributing their unique perspective to our shared vision.",Kato,Sports Game Planning,General Member,1,3
9,Q21,I am completely content with our team's dedication to this endeavor.,Kato,Sports Game Planning,General Member,1,3
9,Q22,Our team members share a profoundly aligned vision for the project's success.,Kato,Sports Game Planning,General Member,1,3
9,Q23,The opportunities provided for refining my individual contributions are completely sufficient for advancing my performance.,Kato,Sports Game Planning,General Member,1,3
10,Q01,"Yamada-san's immediate affirmation and shared vision for the ""biological Olympics"" and ecological restoration gameplay loop are truly encouraging, and his willingness to engage in a focused discussion with Sasaki-san and myself on the competitive restoration scenarios and creature evolution mechanics",Yoshida,Sports Game Planning,General Member,1,3
10,Q02,"I am comfortable communicating my opinions directly with my team leader, as the shared enthusiasm for the ""biological Olympics"" concept suggests a productive working relationship.",Yoshida,Sports Game Planning,General Member,1,3
10,Q03,I find discussing personal problems or disagreements with my team leader to be a completely manageable situation.,Yoshida,Sports Game Planning,General Member,1,3
10,Q04,I experience significant freedom to propose recommendations and ideas for new projects or changes in procedures to my team leader.,Yoshida,Sports Game Planning,General Member,1,3
10,Q05,I feel entirely comfortable bringing up any errors that may arise during our collaborative process.,Yoshida,Sports Game Planning,General Member,1,3
10,Q06,I would feel quite safe speaking up to my team leader if I observed a colleague making an error.,Yoshida,Sports Game Planning,General Member,1,3
10,Q07,"My contributions resonate clearly with my team leader, fostering a sense of genuine appreciation.",Yoshida,Sports Game Planning,General Member,1,3
10,Q08,My team leader offers substantial encouragement for embracing novel responsibilities and acquiring unfamiliar skills.,Yoshida,Sports Game Planning,General Member,1,3
10,Q09,Yamada-san's engagement and clear understanding of our project's direction suggest he will be a strong proponent for our team's needs.,Yoshida,Sports Game Planning,General Member,1,3
10,Q10,It feels entirely straightforward to seek clarification from my colleagues regarding my work responsibilities.,Yoshida,Sports Game Planning,General Member,1,3
10,Q11,I am very comfortable sharing my opinions directly with my peers.,Yoshida,Sports Game Planning,General Member,1,3
10,Q12,I find sharing personal matters with colleagues to be a neutral experience.,Yoshida,Sports Game Planning,General Member,1,3
10,Q13,"I perceive an exceptional environment for voicing recommendations and novel concepts among my colleagues, fostering a truly collaborative atmosphere.",Yoshida,Sports Game Planning,General Member,1,3
10,Q14,"I feel a strong sense of security sharing my thoughts with my colleagues, even when acknowledging an error.",Yoshida,Sports Game Planning,General Member,1,3
10,Q15,I feel confident in voicing concerns to colleagues when I observe areas for improvement.,Yoshida,Sports Game Planning,General Member,1,3
10,Q16,My input is recognized as a significant contribution by my peers.,Yoshida,Sports Game Planning,General Member,1,3
10,Q17,Engaging colleagues for assistance presents a straightforward path.,Yoshida,Sports Game Planning,General Member,1,3
10,Q18,Yamada-san's immediate and enthusiastic confirmation demonstrates a robust flow of information within the team.,Yoshida,Sports Game Planning,General Member,1,3
10,Q19,"The team's information sharing is fundamentally sound, fostering genuine progress.",Yoshida,Sports Game Planning,General Member,1,3
10,Q20,Our team exhibits a strong consensus and shared enthusiasm for achieving our performance objectives.,Yoshida,Sports Game Planning,General Member,1,3
10,Q21,I feel tremendous satisfaction with our team's current commitment to this task.,Yoshida,Sports Game Planning,General Member,1,3
10,Q22,The team members demonstrate exceptional alignment regarding the project's aspirations and performance objectives.,Yoshida,Sports Game Planning,General Member,1,3
10,Q23,The team provides ample opportunities for me to refine my personal performance.,Yoshida,Sports Game Planning,General Member,1,3
11,Q01,Engaging with my team leader for clarification on my role is a straightforward process.,Yamada,Sports Game Planning,General Member,1,3
11,Q02,I am comfortable expressing my views to my team leader with clarity.,Yamada,Sports Game Planning,General Member,1,3
11,Q03,"I possess a considerable comfort discussing work-related disagreements with my team leader, as professional alignment is paramount.",Yamada,Sports Game Planning,General Member,1,3
11,Q04,I perceive ample opportunity to contribute my suggestions regarding new project directions and procedural adjustments to my team leader.,Yamada,Sports Game Planning,General Member,1,3
11,Q05,"I would feel a strong sense of security voicing any missteps to my team leader, as I believe in our shared commitment to constructive dialogue and problem-solving.",Yamada,Sports Game Planning,General Member,1,3
11,Q06,I would feel quite secure raising a concern about a colleague's misstep with our team leader.,Yamada,Sports Game Planning,General Member,1,3
11,Q07,My contributions to the team's direction are recognized and considered with respect by my team leader.,Yamada,Sports Game Planning,General Member,1,3
11,Q08,My team leader offers me ample opportunity to explore unfamiliar responsibilities and acquire new proficiencies.,Yamada,Sports Game Planning,General Member,1,3
11,Q09,"Yoshida-san displays a strong commitment to ensuring alignment across project members, which indicates his reliability as an advocate.",Yamada,Sports Game Planning,General Member,1,3
11,Q10,It is quite straightforward to inquire of my colleagues when uncertainty arises concerning my professional duties.,Yamada,Sports Game Planning,General Member,1,3
11,Q11,I communicate my thoughts on work matters to my colleagues with considerable candor.,Yamada,Sports Game Planning,General Member,1,3
11,Q12,I find it challenging to freely discuss personal matters with colleagues.,Yamada,Sports Game Planning,General Member,1,3
11,Q13,"I feel quite free to propose new project concepts or procedural adjustments to my colleagues, as our department fosters an environment where such contributions are welcomed.",Yamada,Sports Game Planning,General Member,1,3
11,Q14,"I would feel quite comfortable discussing any missteps with my colleagues, as open communication fosters collective learning and improvement.",Yamada,Sports Game Planning,General Member,1,3
11,Q15,"I would feel quite concerned speaking up to a colleague if I noticed an error, requiring careful consideration.",Yamada,Sports Game Planning,General Member,1,3
11,Q16,"My contributions receive considerable recognition from my colleagues, ensuring my perspective is always a valuable element in our discussions.",Yamada,Sports Game Planning,General Member,1,3
11,Q17,Engaging with colleagues for assistance presents a straightforward process.,Yamada,Sports Game Planning,General Member,1,3
11,Q18,Collaboration and information sharing among team members are considerably effective.,Yamada,Sports Game Planning,General Member,1,3
11,Q19,The current information sharing efforts are demonstrating considerable substance and depth.,Yamada,Sports Game Planning,General Member,1,3
11,Q20,Our team is exhibiting remarkable unity as we advance towards our performance objectives.,Yamada,Sports Game Planning,General Member,1,3
11,Q21,I appreciate the robust dedication demonstrated by the team towards our project's advancement.,Yamada,Sports Game Planning,General Member,1,3
11,Q22,"My team members' aspirations for our performance demonstrate substantial convergence, particularly with Sasaki-san's energetic alignment and Yamaguchi-san's approving endorsement of our ecological restoration concept.",Yamada,Sports Game Planning,General Member,1,3
11,Q23,The current opportunities for enhancing my personal performance are quite sufficient.,Yamada,Sports Game Planning,General Member,1,3
12,Q01,"Engaging with Yamaguchi-san for clarification is a straightforward process, requiring minimal effort.",Sasaki,Sports Game Planning,General Member,1,3
12,Q02,I find it straightforward to share my thoughts and proposals with Yamaguchi-san when the concepts are fully developed and present a clear path forward.,Sasaki,Sports Game Planning,General Member,1,3
12,Q03,"I maintain a strong comfort level discussing disagreements with my team leader, Yamaguchi-san, as I believe open communication is vital for project success.",Sasaki,Sports Game Planning,General Member,1,3
12,Q04,"I feel completely at liberty to share my recommendations and ideas for new projects or changes in procedures with my team leader, Yamaguchi-san.",Sasaki,Sports Game Planning,General Member,1,3
12,Q05,"I would feel quite safe sharing any errors with Yamaguchi-san, as he cultivates an environment that encourages open communication.",Sasaki,Sports Game Planning,General Member,1,3
12,Q06,"I feel quite safe speaking up to my team leader if I observe a colleague making a mistake, as direct communication benefits the project.",Sasaki,Sports Game Planning,General Member,1,3
12,Q07,Yamaguchi-san provides clear acknowledgement of my contributions when I articulate them with a solid foundation.,Sasaki,Sports Game Planning,General Member,1,3
12,Q08,Yamaguchi-san's guidance is wonderfully supportive of my exploration into novel challenges.,Sasaki,Sports Game Planning,General Member,1,3
12,Q09,Yamaguchi-san presents a solid foundation for advocacy within the company.,Sasaki,Sports Game Planning,General Member,1,3
12,Q10,Reaching out to my colleagues for clarification on my responsibilities presents a remarkably smooth process.,Sasaki,Sports Game Planning,General Member,1,3
12,Q11,"I openly share my intuitive insights with my peers, finding resonance and alignment quite readily.",Sasaki,Sports Game Planning,General Member,1,3
12,Q12,I find it completely comfortable sharing my thoughts on personal matters with my colleagues.,Sasaki,Sports Game Planning,General Member,1,3
12,Q13,"I feel quite unhindered in sharing my suggestions with my colleagues, as our communication flows with exceptional clarity and shared purpose.",Sasaki,Sports Game Planning,General Member,1,3
12,Q14,"I feel quite secure voicing any missteps to my colleagues, as their collaborative spirit ensures productive outcomes.",Sasaki,Sports Game Planning,General Member,1,3
12,Q15,I would feel quite comfortable discussing a colleague's oversight with them directly to ensure our project's integrity.,Sasaki,Sports Game Planning,General Member,1,3
12,Q16,"My contributions find strong resonance and active adoption among my colleagues, particularly when discussing core concepts with Yoshida-san.",Sasaki,Sports Game Planning,General Member,1,3
12,Q17,It is quite challenging to seek assistance from my colleagues.,Sasaki,Sports Game Planning,General Member,1,3
