agent_id,question_id,answer_text,agent_name,dept,position,dept_id,pattern_id
0,Q01,"Takahashi-san's detailed input on scenario elements and player interaction mechanics is truly remarkable, providing concrete examples that solidify our core concept. This alignment means further consultation is currently unnecessary. My immediate focus is to expand upon her excellent suggestions, detailing",Sato,Modern Setting Game Planning,General Member,0,3
0,Q02,I can communicate my opinions about work issues with my team leader with complete openness and directness.,Sato,Modern Setting Game Planning,General Member,0,3
0,Q03,"I maintain a comfortable stance when addressing personal concerns or disagreements within the team, as open communication facilitates constructive solutions.",Sato,Modern Setting Game Planning,General Member,0,3
0,Q04,I feel a considerable degree of freedom to offer my recommendations and ideas to my team leader regarding new projects or procedural changes.,Sato,Modern Setting Game Planning,General Member,0,3
0,Q05,"I would feel quite secure sharing any missteps with my team leader, as open dialogue is a strength of our team.",Sato,Modern Setting Game Planning,General Member,0,3
0,Q06,I perceive speaking up about a colleague's error as presenting a constructive opportunity for improvement.,Sato,Modern Setting Game Planning,General Member,0,3
0,Q07,"Takahashi-san's input has been extraordinarily valuable, articulating precisely the detailed scenarios required, and her breakdown of player interaction provides tangible mechanics for the proposal, confirming my current alignment and negating the need for further consultation at this juncture.",Sato,Modern Setting Game Planning,General Member,0,3
0,Q08,My team leader provides a solid foundation for my current responsibilities.,Sato,Modern Setting Game Planning,General Member,0,3
0,Q09,"Takahashi-san's contributions reveal a remarkable alignment with the project's core vision, offering detailed scenarios and player interaction mechanics that significantly bolster our proposal.",Sato,Modern Setting Game Planning,General Member,0,3
0,Q10,Interacting with colleagues for clarification regarding my role presents a clear and efficient path.,Sato,Modern Setting Game Planning,General Member,0,3
0,Q11,I am comfortable sharing my detailed thoughts on work matters with colleagues who demonstrate alignment with my perspective.,Sato,Modern Setting Game Planning,General Member,0,3
0,Q12,I find discussing personal matters with colleagues to be an unnecessary diversion from our shared professional objectives.,Sato,Modern Setting Game Planning,General Member,0,3
0,Q13,I feel completely unhindered in sharing recommendations and ideas for new projects or procedural changes with my colleagues.,Sato,Modern Setting Game Planning,General Member,0,3
0,Q14,I would feel comfortable addressing any errors encountered during our team's collaborative efforts.,Sato,Modern Setting Game Planning,General Member,0,3
0,Q15,I maintain a high degree of comfort engaging with colleagues regarding observed errors.,Sato,Modern Setting Game Planning,General Member,0,3
0,Q16,My contributions resonate effectively with colleagues when I articulate them.,Sato,Modern Setting Game Planning,General Member,0,3
0,Q17,"Takahashi-san's contributions simplify my current workload significantly, rendering additional input unnecessary at this juncture.",Sato,Modern Setting Game Planning,General Member,0,3
0,Q18,"Takahashi-san has provided exceptional insight, generating precisely the detailed scenarios and player interaction mechanics that significantly advance our core concept.",Sato,Modern Setting Game Planning,General Member,0,3
0,Q19,"The current information sharing presents substantial areas for enhancement, with a noticeable deficiency in comprehensive engagement.",Sato,Modern Setting Game Planning,General Member,0,3
0,Q20,"Our team functions with a significant degree of cohesion, making substantial progress through shared understanding.",Sato,Modern Setting Game Planning,General Member,0,3
0,Q21,"I find the current level of commitment to be exceptionally high, generating significant productive momentum.",Sato,Modern Setting Game Planning,General Member,0,3
0,Q22,"Takahashi-san's detailed contributions provide exceptional synergy, validating the current direction and eliminating the immediate need for additional input.",Sato,Modern Setting Game Planning,General Member,0,3
0,Q23,The current opportunities provide a solid foundation for refining my performance.,Sato,Modern Setting Game Planning,General Member,0,3
1,Q01,I find it quite straightforward to approach Yamamoto-san with work-related uncertainties.,Suzuki,Modern Setting Game Planning,General Member,0,3
1,Q02,I express my opinions about work issues with my team leader with complete candor and directness.,Suzuki,Modern Setting Game Planning,General Member,0,3
1,Q03,"I generally find it unnecessary to bring up personal issues or conflicts with my team leader, as I prefer to manage those matters independently.",Suzuki,Modern Setting Game Planning,General Member,0,3
1,Q04,I possess a complete freedom to propose novel concepts or procedural enhancements to my team leader.,Suzuki,Modern Setting Game Planning,General Member,0,3
1,Q05,I would feel quite secure raising concerns regarding any errors on this team.,Suzuki,Modern Setting Game Planning,General Member,0,3
1,Q06,I would feel quite comfortable raising concerns about a colleague's error with my team leader.,Suzuki,Modern Setting Game Planning,General Member,0,3
1,Q07,"My input is considered, as my team leader acknowledges my contributions to our project.",Suzuki,Modern Setting Game Planning,General Member,0,3
1,Q08,Yamamoto-san provides a solid environment for expanding my responsibilities and skill set.,Suzuki,Modern Setting Game Planning,General Member,0,3
1,Q09,Yamamoto-san's attention to the details required for our proposal makes him a solid choice for advocating on behalf of the team's needs.,Suzuki,Modern Setting Game Planning,General Member,0,3
1,Q10,I find it quite straightforward to approach colleagues with any inquiries or uncertainties regarding my work responsibilities.,Suzuki,Modern Setting Game Planning,General Member,0,3
1,Q11,I readily share my thoughts and perspectives with colleagues on work-related matters.,Suzuki,Modern Setting Game Planning,General Member,0,3
1,Q12,I find discussing personal matters with colleagues to be an uncomfortable subject.,Suzuki,Modern Setting Game Planning,General Member,0,3
1,Q13,"I feel quite at liberty to share my recommendations and ideas with my peers, as our interactions foster a constructive environment for proposal development.",Suzuki,Modern Setting Game Planning,General Member,0,3
1,Q14,I would feel quite comfortable discussing any errors that arise with my colleagues.,Suzuki,Modern Setting Game Planning,General Member,0,3
1,Q15,"I would feel safe speaking up to a colleague if I observed an error, as fostering a culture of shared improvement is paramount.",Suzuki,Modern Setting Game Planning,General Member,0,3
1,Q16,My contributions are consistently recognized and integrated by my peers.,Suzuki,Modern Setting Game Planning,General Member,0,3
1,Q17,I find that seeking assistance from colleagues is a straightforward endeavor.,Suzuki,Modern Setting Game Planning,General Member,0,3
1,Q18,Our team maintains a satisfactory level of mutual information sharing regarding work-related matters.,Suzuki,Modern Setting Game Planning,General Member,0,3
1,Q19,"The team's information sharing efforts demonstrate a solid foundation of genuine connection, with superficial exchanges occurring infrequently.",Suzuki,Modern Setting Game Planning,General Member,0,3
1,Q20,"Our team operates with a strong collective drive towards our performance objectives, demonstrating a unified front in achieving shared success.",Suzuki,Modern Setting Game Planning,General Member,0,3
1,Q21,I am quite content with our team's dedication to this endeavor.,Suzuki,Modern Setting Game Planning,General Member,0,3
1,Q22,"My teammates possess aspirations for team performance that are not entirely in sync, showing some divergence in their focus.",Suzuki,Modern Setting Game Planning,General Member,0,3
1,Q23,"The opportunities provided by this team for personal performance enhancement are entirely sufficient, offering a strong foundation for growth.",Suzuki,Modern Setting Game Planning,General Member,0,3
2,Q01,"Sato-san's insights on the core notification mechanic are incredibly valuable, and I'm eager to elaborate on his points regarding player interaction and consequence systems.",Takahashi,Modern Setting Game Planning,General Member,0,3
2,Q02,"I can communicate my opinions about work issues with my team leader with considerable openness, as our shared focus on refining core concepts often leads to aligned perspectives.",Takahashi,Modern Setting Game Planning,General Member,0,3
2,Q03,"I am comfortable discussing personal issues and disagreements with my team leader, as open communication fosters a supportive environment.",Takahashi,Modern Setting Game Planning,General Member,0,3
2,Q04,I feel quite uninhibited when sharing suggestions for new projects or procedural adjustments with my team leader.,Takahashi,Modern Setting Game Planning,General Member,0,3
2,Q05,I would feel perfectly safe speaking up to my team leader if I made a mistake on this team.,Takahashi,Modern Setting Game Planning,General Member,0,3
2,Q06,"I would feel comfortable raising concerns about a colleague's error with my team leader, as open communication facilitates collective improvement.",Takahashi,Modern Setting Game Planning,General Member,0,3
2,Q07,"My input is recognized as a vital contribution by my team leader, fostering a sense of shared purpose.",Takahashi,Modern Setting Game Planning,General Member,0,3
2,Q08,My team leader provides considerable opportunities for me to engage with novel responsibilities and acquire unfamiliar proficiencies.,Takahashi,Modern Setting Game Planning,General Member,0,3
2,Q09,Sato-san's approach to our project's core mechanics shows a strong dedication to refining our concepts.,Takahashi,Modern Setting Game Planning,General Member,0,3
2,Q10,Engaging with peers for clarification on my role is a comfortably straightforward process.,Takahashi,Modern Setting Game Planning,General Member,0,3
2,Q11,"I communicate my thoughts on work matters with my colleagues with complete openness, offering detailed explanations to ensure full understanding.",Takahashi,Modern Setting Game Planning,General Member,0,3
2,Q12,"I maintain a comfortable boundary when discussing personal matters with colleagues, preferring to focus on professional collaboration.",Takahashi,Modern Setting Game Planning,General Member,0,3
2,Q13,I feel completely unhindered in expressing my suggestions and concepts to my colleagues.,Takahashi,Modern Setting Game Planning,General Member,0,3
2,Q14,I would feel quite comfortable discussing any errors that arise with my colleagues.,Takahashi,Modern Setting Game Planning,General Member,0,3
2,Q15,I would feel confident addressing a colleague directly about a perceived error.,Takahashi,Modern Setting Game Planning,General Member,0,3
2,Q16,My contributions receive consistent consideration from my colleagues during discussions.,Takahashi,Modern Setting Game Planning,General Member,0,3
2,Q17,Assisting colleagues with their tasks offers a valuable learning opportunity and strengthens our collective progress.,Takahashi,Modern Setting Game Planning,General Member,0,3
2,Q18,Our team maintains a high level of mutual information exchange regarding work-related matters.,Takahashi,Modern Setting Game Planning,General Member,0,3
2,Q19,"The team's information sharing efforts demonstrate a solid understanding of core concepts, yet there is room to deepen the practical application of those ideas.",Takahashi,Modern Setting Game Planning,General Member,0,3
2,Q20,"Our team is demonstrating remarkable alignment in pursuing our performance objectives, with Sato-san's insights proving particularly valuable for solidifying our core concepts.",Takahashi,Modern Setting Game Planning,General Member,0,3
2,Q21,I find our team's dedication to this task to be thoroughly adequate.,Takahashi,Modern Setting Game Planning,General Member,0,3
2,Q22,"Sato-san and I share a remarkably similar perspective on the team's immediate performance goals, making our collaborative efforts highly productive.",Takahashi,Modern Setting Game Planning,General Member,0,3
2,Q23,"The current opportunities present a valuable platform for refining my performance through focused, collaborative dialogue.",Takahashi,Modern Setting Game Planning,General Member,0,3
3,Q01,"Approaching Ito-san with questions about our current perceptual distortion concepts is quite smooth, as we share a strong alignment on the unsettling nuances we aim to achieve.",Tanaka,Modern Setting Game Planning,General Member,0,3
3,Q02,I communicate my opinions about work issues with my team leader with complete candor and clarity.,Tanaka,Modern Setting Game Planning,General Member,0,3
3,Q03,"I feel completely comfortable sharing any concerns with my team leader, as I trust their understanding.",Tanaka,Modern Setting Game Planning,General Member,0,3
3,Q04,"I feel quite unhindered in proposing suggestions and innovations to my team leader, as my contributions are consistently met with an open reception.",Tanaka,Modern Setting Game Planning,General Member,0,3
3,Q05,"I would feel quite comfortable sharing any oversight with my team leader, as I believe the current environment encourages open communication regarding development progress.",Tanaka,Modern Setting Game Planning,General Member,0,3
3,Q06,I would feel a strong inclination to approach my team leader directly to address the situation.,Tanaka,Modern Setting Game Planning,General Member,0,3
3,Q07,"My contributions are acknowledged with significant appreciation by my team leader, especially when I align with Ito-san's excellent insights.",Tanaka,Modern Setting Game Planning,General Member,0,3
3,Q08,Ito-san enthusiastically supports my exploration of novel tasks and skill acquisition.,Tanaka,Modern Setting Game Planning,General Member,0,3
3,Q09,"Ito-san demonstrates a strong capacity to champion my ideas, especially when they align with project vision.",Tanaka,Modern Setting Game Planning,General Member,0,3
3,Q10,It is quite straightforward to seek clarification from my colleagues regarding my role.,Tanaka,Modern Setting Game Planning,General Member,0,3
3,Q11,I communicate my work opinions with my peers with an open and direct approach.,Tanaka,Modern Setting Game Planning,General Member,0,3
3,Q12,I generally feel comfortable discussing personal matters with my colleagues.,Tanaka,Modern Setting Game Planning,General Member,0,3
3,Q13,I feel completely at liberty to share my thoughts and suggestions with my colleagues regarding new projects or procedural adjustments.,Tanaka,Modern Setting Game Planning,General Member,0,3
3,Q14,"I would feel quite comfortable addressing any errors with my colleagues, as I trust their collaborative spirit.",Tanaka,Modern Setting Game Planning,General Member,0,3
3,Q15,I would feel quite comfortable pointing out an error to a colleague if I observed one.,Tanaka,Modern Setting Game Planning,General Member,0,3
3,Q16,"My contributions to the core gameplay moments are recognized with high regard by Ito-san, solidifying their importance for the project's foundation.",Tanaka,Modern Setting Game Planning,General Member,0,3
3,Q17,It is quite straightforward to request assistance from Ito-san at this moment due to our strong alignment on project direction.,Tanaka,Modern Setting Game Planning,General Member,0,3
3,Q18,"Ito-san and I are currently sharing significant progress on our shared gameplay moments, and I believe Watanabe-san will benefit from this focused discussion before broader team updates.",Tanaka,Modern Setting Game Planning,General Member,0,3
3,Q19,The current information sharing leans towards a superficial connection due to a prioritized focus on specific project developments.,Tanaka,Modern Setting Game Planning,General Member,0,3
3,Q20,"Our team achieves impressive unity in pursuing our performance objectives, with a shared understanding that fosters collaborative progress.",Tanaka,Modern Setting Game Planning,General Member,0,3
3,Q21,I am completely satisfied with my team's dedication to this task.,Tanaka,Modern Setting Game Planning,General Member,0,3
3,Q22,"My team members' aspirations for performance are wonderfully aligned, sharing a profound appreciation for detailed, unsettling perceptual distortions.",Tanaka,Modern Setting Game Planning,General Member,0,3
3,Q23,"The opportunities to improve my personal performance are quite sufficient, allowing for valuable growth.",Tanaka,Modern Setting Game Planning,General Member,0,3
4,Q01,Engaging my team leader with inquiries regarding my role presents a straightforward opportunity for clarification.,Watanabe,Modern Setting Game Planning,General Member,0,3
4,Q02,"I find it quite productive to discuss work matters with my team leader, especially when concrete examples are available.",Watanabe,Modern Setting Game Planning,General Member,0,3
4,Q03,I find expressing personal difficulties or disagreements to my team leader a challenging endeavor.,Watanabe,Modern Setting Game Planning,General Member,0,3
4,Q04,I experience ample freedom to articulate suggestions and concepts for novel initiatives or modifications to existing procedures with my team leader.,Watanabe,Modern Setting Game Planning,General Member,0,3
4,Q05,"I feel adequately secure voicing errors to my team leader, as constructive dialogue promotes advancement.",Watanabe,Modern Setting Game Planning,General Member,0,3
4,Q06,I would feel a profound sense of responsibility to address any colleague's misstep with transparency and a constructive approach.,Watanabe,Modern Setting Game Planning,General Member,0,3
4,Q07,"My contributions feel deeply appreciated by my team, particularly with the detailed feedback and thoughtful integration of my suggestions into our proposal.",Watanabe,Modern Setting Game Planning,General Member,0,3
4,Q08,My team leader provides a substantial environment for embracing novel responsibilities and acquiring unfamiliar competencies.,Watanabe,Modern Setting Game Planning,General Member,0,3
4,Q09,My team leader is someone who offers a significant level of support when addressing challenges.,Watanabe,Modern Setting Game Planning,General Member,0,3
4,Q10,It is a simple matter to ask my peers when I have a question concerning my role.,Watanabe,Modern Setting Game Planning,General Member,0,3
4,Q11,"I communicate my insights regarding work matters with my colleagues with considerable openness, especially when their contributions are as inspiring as Suzuki-san's recent suggestions.",Watanabe,Modern Setting Game Planning,General Member,0,3
4,Q12,I find direct discourse about personal matters to be a most peculiar and seldom necessary exchange with colleagues.,Watanabe,Modern Setting Game Planning,General Member,0,3
4,Q13,I feel entirely at liberty to share my recommendations and concepts with my peers.,Watanabe,Modern Setting Game Planning,General Member,0,3
4,Q14,"I feel a strong confidence in sharing any oversights with my colleagues, knowing their collaborative spirit fosters a constructive environment.",Watanabe,Modern Setting Game Planning,General Member,0,3
4,Q15,"I would feel exceptionally safe speaking up to a colleague if I observed an error, as open communication fosters collective growth.",Watanabe,Modern Setting Game Planning,General Member,0,3
4,Q16,"My contributions resonate strongly with Suzuki-san, providing substantial material for our proposal.",Watanabe,Modern Setting Game Planning,General Member,0,3
4,Q17,"Collaborating with Suzuki-san on these specific design elements has been wonderfully productive, and I anticipate our continued work will be similarly fruitful.",Watanabe,Modern Setting Game Planning,General Member,0,3
4,Q18,The team members provide substantial information regarding their work.,Watanabe,Modern Setting Game Planning,General Member,0,3
4,Q19,"The team's information sharing exhibits substantial depth, with valuable insights regularly emerging from collaborative efforts.",Watanabe,Modern Setting Game Planning,General Member,0,3
4,Q20,"Our team displays remarkable unity in pursuing our performance objectives, with Suzuki-san's contributions particularly strengthening our collective direction.",Watanabe,Modern Setting Game Planning,General Member,0,3
4,Q21,Our team's commitment to the task provides substantial development.,Watanabe,Modern Setting Game Planning,General Member,0,3
4,Q22,"The team's aspirations for performance demonstrate excellent accord, particularly regarding Suzuki-san's innovative ideas for player connection and environmental storytelling.",Watanabe,Modern Setting Game Planning,General Member,0,3
4,Q23,"The opportunities provided for performance enhancement are quite sufficient, offering considerable room for growth.",Watanabe,Modern Setting Game Planning,General Member,0,3
5,Q01,Approaching my team leader with a question or uncertainty about my role presents a clear path.,Ito,Modern Setting Game Planning,General Member,0,3
5,Q02,I am completely at ease expressing my thoughts and ideas regarding work matters with my team leader.,Ito,Modern Setting Game Planning,General Member,0,3
5,Q03,"I experience a profound sense of ease discussing any personal challenges or points of contention with my team leader, as open communication fosters a supportive environment.",Ito,Modern Setting Game Planning,General Member,0,3
5,Q04,I feel a comfortable degree of freedom to share my recommendations and ideas for new projects or procedural changes with my team leader.,Ito,Modern Setting Game Planning,General Member,0,3
5,Q05,I would feel very confident expressing any errors made to my team leader given our current dynamic.,Ito,Modern Setting Game Planning,General Member,0,3
5,Q06,I find it genuinely comfortable to communicate openly with my team leader regarding any colleague's missteps.,Ito,Modern Setting Game Planning,General Member,0,3
5,Q07,My contributions to the team's creative direction are thoroughly appreciated and actively incorporated by our leader.,Ito,Modern Setting Game Planning,General Member,0,3
5,Q08,My team leader's encouragement for exploring novel tasks and skills is a significant motivator for my professional growth.,Ito,Modern Setting Game Planning,General Member,0,3
5,Q09,Yamamoto-san's affirmation of our amplification model provides considerable assurance for her advocacy when challenges arise.,Ito,Modern Setting Game Planning,General Member,0,3
5,Q10,"It is incredibly easy to approach peers with questions, fostering a collaborative environment for problem-solving.",Ito,Modern Setting Game Planning,General Member,0,3
5,Q11,I communicate my opinions about work issues with my peers with complete candor.,Ito,Modern Setting Game Planning,General Member,0,3
5,Q12,I am comfortable discussing personal matters with peers when it feels natural to our connection.,Ito,Modern Setting Game Planning,General Member,0,3
5,Q13,I experience a robust freedom to offer recommendations and novel concepts to my colleagues.,Ito,Modern Setting Game Planning,General Member,0,3
5,Q14,I would feel quite comfortable voicing any missteps to my peers as our collaborative spirit encourages open dialogue.,Ito,Modern Setting Game Planning,General Member,0,3
5,Q15,I feel completely comfortable pointing out a colleague's oversight when it impacts our shared goals.,Ito,Modern Setting Game Planning,General Member,0,3
5,Q16,"My contributions are clearly recognized and appreciated by my colleagues, fostering a truly collaborative environment.",Ito,Modern Setting Game Planning,General Member,0,3
5,Q17,My current perception is that seeking assistance from team members is a seamless endeavor.,Ito,Modern Setting Game Planning,General Member,0,3
5,Q18,Yamamoto-san and Tanaka-san provide a solid foundation of shared understanding regarding our collaborative approach and conceptual direction.,Ito,Modern Setting Game Planning,General Member,0,3
5,Q19,"The team's information sharing feels exceptionally concrete and substantial, moving beyond mere pleasantries.",Ito,Modern Setting Game Planning,General Member,0,3
5,Q20,"Our team exhibits exceptional cohesion when pursuing performance objectives, with a shared drive that fuels our collective progress.",Ito,Modern Setting Game Planning,General Member,0,3
5,Q21,"I find our team's commitment to the task exceptionally strong, especially with Tanaka-san's current energetic contributions.",Ito,Modern Setting Game Planning,General Member,0,3
5,Q22,"My team members' aspirations for team performance show excellent alignment, with Tanaka-san's focus on perceptual distortion and Yamamoto-san's emphasis on collaborative amplification creating a powerful synergy.",Ito,Modern Setting Game Planning,General Member,0,3
5,Q23,"The opportunities provided for enhancing my personal performance are truly exceptional, allowing for significant growth.",Ito,Modern Setting Game Planning,General Member,0,3
6,Q01,It presents a straightforward process for team members to seek guidance when uncertain about their work responsibilities.,Yamamoto,Modern Setting Game Planning,Department Leader,0,3
6,Q02,"I communicate my opinions about work issues with my team leader with complete candor, as my thoughts are always directly expressed.",Yamamoto,Modern Setting Game Planning,Department Leader,0,3
6,Q03,I perceive a distinct absence of discomfort when discussing personal challenges or disagreements with my team leader.,Yamamoto,Modern Setting Game Planning,Department Leader,0,3
