agent_id,question_id,answer_text,agent_name,dept,position,dept_id,pattern_id
6,Q11,I find it productive to express my perspectives directly and thoroughly with my colleagues.,Yamamoto,Military / War Game Planning,Department Leader,0,3
6,Q12,I am comfortable discussing personal issues with my peers when it is relevant to fostering a collaborative and productive work environment.,Yamamoto,Military / War Game Planning,Department Leader,0,3
6,Q13,I experience a genuine freedom in presenting suggestions for novel projects or procedural adjustments to my colleagues.,Yamamoto,Military / War Game Planning,Department Leader,0,3
6,Q14,I feel that open dialogue regarding errors fosters collective learning and strengthens our team's performance.,Yamamoto,Military / War Game Planning,Department Leader,0,3
6,Q15,"I would feel comfortable pointing out an error to a colleague, as open communication fosters collective improvement.",Yamamoto,Military / War Game Planning,Department Leader,0,3
6,Q16,My contributions are generally acknowledged with satisfactory consideration by my colleagues.,Yamamoto,Military / War Game Planning,Department Leader,0,3
6,Q17,Seeking assistance from my team members presents a straightforward engagement.,Yamamoto,Military / War Game Planning,Department Leader,0,3
6,Q18,The team consistently provides ample information regarding project developments.,Yamamoto,Military / War Game Planning,Department Leader,0,3
6,Q19,"The information sharing within the team demonstrates a solid foundation, with opportunities for further depth in certain exchanges.",Yamamoto,Military / War Game Planning,Department Leader,0,3
6,Q20,"Our team demonstrates remarkable unity in pursuing our performance objectives, with minimal divergence from our shared direction.",Yamamoto,Military / War Game Planning,Department Leader,0,3
6,Q21,Ito-san's detailed presentation offers a complete vision that confirms our shared understanding and significantly lightens my workload.,Yamamoto,Military / War Game Planning,Department Leader,0,3
6,Q22,"Ito-san's presentation demonstrates a superb convergence of aspirations with Watanabe-san's insights, indicating substantial team alignment.",Yamamoto,Military / War Game Planning,Department Leader,0,3
6,Q23,The team's current structure provides a satisfactory environment for my personal performance enhancement.,Yamamoto,Military / War Game Planning,Department Leader,0,3
7,Q01,It is very simple to approach the team leader with any queries regarding my responsibilities.,Nakamura,Science Fiction Game Planning,General Member,1,3
7,Q02,I express my opinions with a clear and direct approach to my team leader.,Nakamura,Science Fiction Game Planning,General Member,1,3
7,Q03,I feel comfortable sharing with my team leader.,Nakamura,Science Fiction Game Planning,General Member,1,3
7,Q04,I feel a strong sense of openness to contribute my thoughts regarding new projects or procedural adjustments.,Nakamura,Science Fiction Game Planning,General Member,1,3
7,Q05,"I would feel adequately secure expressing a slip-up to my team leader, given our current collaborative atmosphere.",Nakamura,Science Fiction Game Planning,General Member,1,3
7,Q06,I would feel quite comfortable expressing my observations to the team leader regarding a colleague's misstep.,Nakamura,Science Fiction Game Planning,General Member,1,3
7,Q07,My contributions are frequently recognized and appreciated by my team leader.,Nakamura,Science Fiction Game Planning,General Member,1,3
7,Q08,Kato-san provides ample opportunities for me to explore novel challenges and acquire unfamiliar proficiencies.,Nakamura,Science Fiction Game Planning,General Member,1,3
7,Q09,Kato-san's approach consistently offers a solid foundation for resolving concerns.,Nakamura,Science Fiction Game Planning,General Member,1,3
7,Q10,Seeking clarification from colleagues on role-related matters presents a straightforward avenue for information acquisition.,Nakamura,Science Fiction Game Planning,General Member,1,3
7,Q11,I communicate my opinions with my peers with complete openness.,Nakamura,Science Fiction Game Planning,General Member,1,3
7,Q12,I find sharing personal matters with colleagues to be a rather difficult undertaking.,Nakamura,Science Fiction Game Planning,General Member,1,3
7,Q13,I feel quite uninhibited when sharing my perspectives with colleagues regarding fresh project concepts or procedural adjustments.,Nakamura,Science Fiction Game Planning,General Member,1,3
7,Q14,"I would feel comfortable discussing errors openly with my colleagues, as the environment fosters constructive dialogue and mutual understanding.",Nakamura,Science Fiction Game Planning,General Member,1,3
7,Q15,I will address the colleague directly to ensure clarity and prevent recurrence.,Nakamura,Science Fiction Game Planning,General Member,1,3
7,Q16,My contributions are always perceived with great appreciation by my colleagues.,Nakamura,Science Fiction Game Planning,General Member,1,3
7,Q17,Collaborating with my colleagues on clarifying our core mechanics is a straightforward endeavor.,Nakamura,Science Fiction Game Planning,General Member,1,3
7,Q18,"Information exchange flows with considerable effectiveness, ensuring all team members possess a solid understanding of project developments.",Nakamura,Science Fiction Game Planning,General Member,1,3
7,Q19,The team's information sharing effectively clarifies the core mechanics for our project's success.,Nakamura,Science Fiction Game Planning,General Member,1,3
7,Q20,The team's focus on the resonance tuning system and perception meter is currently sharp and unified.,Nakamura,Science Fiction Game Planning,General Member,1,3
7,Q21,"My commitment to the task aligns perfectly with the team's dedication, ensuring a strong and unified effort.",Nakamura,Science Fiction Game Planning,General Member,1,3
7,Q22,"My team members' aspirations for performance align quite positively, with a shared focus on clarity and impact for our current submission.",Nakamura,Science Fiction Game Planning,General Member,1,3
7,Q23,The current opportunities for personal performance improvement are quite sufficient.,Nakamura,Science Fiction Game Planning,General Member,1,3
8,Q01,"Considering the critical juncture of zero turns remaining, direct inquiries to the team leader regarding the integration of my narrative contributions are not the most constructive next step.",Kobayashi,Science Fiction Game Planning,General Member,1,3
8,Q02,"I communicate my insights on work issues with my team leader with directness, ensuring clarity and mutual understanding.",Kobayashi,Science Fiction Game Planning,General Member,1,3
8,Q03,"I feel perfectly comfortable discussing personal problems or disagreements with my team leader, as direct and honest communication strengthens our collective understanding.",Kobayashi,Science Fiction Game Planning,General Member,1,3
8,Q04,"I experience complete freedom to voice suggestions for new projects or procedural adjustments to my team leader, as she values diverse perspectives.",Kobayashi,Science Fiction Game Planning,General Member,1,3
8,Q05,"I would feel completely safe speaking up to my team leader if I made a mistake, as I trust our collaborative environment to foster open communication.",Kobayashi,Science Fiction Game Planning,General Member,1,3
8,Q06,I would feel perfectly safe speaking up to my team leader if I saw a colleague making a mistake.,Kobayashi,Science Fiction Game Planning,General Member,1,3
8,Q07,"My input is recognized as a valuable component for enriching the player's experience of the core mechanics, rather than being central to the main pitch.",Kobayashi,Science Fiction Game Planning,General Member,1,3
8,Q08,"Yamaguchi-san's direction, emphasizing the core mechanics and supporting narrative, presents an excellent opportunity to refine my existing contributions rather than necessitating entirely new skill acquisition.",Kobayashi,Science Fiction Game Planning,General Member,1,3
8,Q09,Yamaguchi-san's strategic clarity and decisive direction offer substantial reassurance regarding her support for the team's contributions.,Kobayashi,Science Fiction Game Planning,General Member,1,3
8,Q10,It is quite straightforward to seek clarification from my colleagues on matters pertinent to my role.,Kobayashi,Science Fiction Game Planning,General Member,1,3
8,Q11,"I openly communicate my insights, ensuring they enhance the core mechanics with meaningful narrative depth.",Kobayashi,Science Fiction Game Planning,General Member,1,3
8,Q12,I am perfectly comfortable speaking about personal issues with my peers when it serves to deepen our understanding and strengthen our collaborative efforts.,Kobayashi,Science Fiction Game Planning,General Member,1,3
8,Q13,"I feel a clear freedom to voice recommendations for new projects and procedural changes with my peers, as my ""memory archaeology"" concept fits perfectly as a narrative wrapper for the core ""resonance tuning system"" and ""perception meter.""",Kobayashi,Science Fiction Game Planning,General Member,1,3
8,Q14,"I would feel quite secure discussing any errors with my colleagues, as our interactions foster an environment where learning from missteps is embraced.",Kobayashi,Science Fiction Game Planning,General Member,1,3
8,Q15,I would feel comfortable informing a colleague of an observed misstep.,Kobayashi,Science Fiction Game Planning,General Member,1,3
8,Q16,"My input is consistently recognized as a valuable narrative layer that enriches core mechanics, rather than being disregarded.",Kobayashi,Science Fiction Game Planning,General Member,1,3
8,Q17,It presents a particular challenge to seek assistance from colleagues when the focus is entirely on consolidating the existing strategy for the final submission.,Kobayashi,Science Fiction Game Planning,General Member,1,3
8,Q18,People maintain a good level of shared understanding regarding work-related matters on the team.,Kobayashi,Science Fiction Game Planning,General Member,1,3
8,Q19,"The team's information sharing efforts exhibit a commendable depth in conveying core strategic directives, though the integration of nuanced mechanical details for less central elements requires further articulation.",Kobayashi,Science Fiction Game Planning,General Member,1,3
8,Q20,"Our team demonstrates a strong and cohesive alignment in pursuing our performance objectives, with all members actively contributing to the unified vision.",Kobayashi,Science Fiction Game Planning,General Member,1,3
8,Q21,"I am content with the team's current commitment, as our collective focus has sharpened effectively on the core proposal elements.",Kobayashi,Science Fiction Game Planning,General Member,1,3
8,Q22,"My team members' aspirations for the team's performance are strongly aligned with the primary selling points of the resonance tuning system and perception meter, with my narrative contributions providing essential contextual depth.",Kobayashi,Science Fiction Game Planning,General Member,1,3
8,Q23,"The opportunities this team provides for me to enhance my personal performance are quite adequate, focusing on refining my unique narrative contributions to complement the established core mechanics.",Kobayashi,Science Fiction Game Planning,General Member,1,3
9,Q01,"My team leader's approachability is quite high, making it simple to seek clarification on my responsibilities.",Kato,Science Fiction Game Planning,General Member,1,3
9,Q02,I can communicate my opinions about work issues with my team leader with complete openness.,Kato,Science Fiction Game Planning,General Member,1,3
9,Q03,I am comfortable sharing personal problems or disagreements with my team leader.,Kato,Science Fiction Game Planning,General Member,1,3
9,Q04,"I feel quite free to share my thoughts and proposals with my team leader, as their strong affirmation of our core concepts gives me great confidence.",Kato,Science Fiction Game Planning,General Member,1,3
9,Q05,"I would feel completely secure raising any misstep with my team leader, as I am confident in the established open communication channels.",Kato,Science Fiction Game Planning,General Member,1,3
9,Q06,I would feel completely secure sharing observations about a colleague's errors with our team leader.,Kato,Science Fiction Game Planning,General Member,1,3
9,Q07,My contributions are consistently recognized and integrated when they enhance the project's core direction.,Kato,Science Fiction Game Planning,General Member,1,3
9,Q08,My team leader provides a truly exceptional environment for venturing into novel responsibilities and acquiring unfamiliar skills.,Kato,Science Fiction Game Planning,General Member,1,3
9,Q09,My team leader offers a dependable support system for navigating company challenges.,Kato,Science Fiction Game Planning,General Member,1,3
9,Q10,It is absolutely simple to approach colleagues with any lingering uncertainties.,Kato,Science Fiction Game Planning,General Member,1,3
9,Q11,I have a direct approach when sharing my perspectives on work-related matters with my colleagues.,Kato,Science Fiction Game Planning,General Member,1,3
9,Q12,I find it is always beneficial to maintain a professional distance regarding personal matters with my peers.,Kato,Science Fiction Game Planning,General Member,1,3
9,Q13,I feel fully at liberty to voice my recommendations and ideas concerning new projects or procedural modifications to my peers.,Kato,Science Fiction Game Planning,General Member,1,3
9,Q14,"I would feel completely comfortable highlighting any oversight, knowing my peers would offer constructive insights.",Kato,Science Fiction Game Planning,General Member,1,3
9,Q15,I would feel completely comfortable highlighting a colleague's error to ensure our project's success.,Kato,Science Fiction Game Planning,General Member,1,3
9,Q16,"My contributions gain significant recognition from my colleagues, particularly when they enhance the core concepts of our projects.",Kato,Science Fiction Game Planning,General Member,1,3
9,Q17,Affirmative collaboration with colleagues on project details is straightforward.,Kato,Science Fiction Game Planning,General Member,1,3
9,Q18,"I feel the team keeps each other well-informed about work-related issues, especially with the clear communication regarding the resonance tuning system and perception meter.",Kato,Science Fiction Game Planning,General Member,1,3
9,Q19,"The team's information sharing efforts are genuinely effective, ensuring that core concepts are clearly understood and appreciated.",Kato,Science Fiction Game Planning,General Member,1,3
9,Q20,My team exhibits complete unity in our pursuit of peak performance.,Kato,Science Fiction Game Planning,General Member,1,3
9,Q21,I am completely satisfied with our team's commitment to the task.,Kato,Science Fiction Game Planning,General Member,1,3
9,Q22,"Yamaguchi-san's affirmation of the core systems provides a strong foundation, and aligning on the final presentation is paramount for team success.",Kato,Science Fiction Game Planning,General Member,1,3
9,Q23,The opportunities provided for enhancing my personal performance are quite sufficient.,Kato,Science Fiction Game Planning,General Member,1,3
10,Q01,"My team leader's clear directives provide a solid foundation, making clarification on my role a straightforward endeavor.",Yoshida,Science Fiction Game Planning,General Member,1,3
10,Q02,Yamaguchi-san's clear directive requires a straightforward integration of my narrative concepts to fortify the core mechanics.,Yoshida,Science Fiction Game Planning,General Member,1,3
10,Q03,I maintain a reserved posture when discussing personal challenges or points of contention with my team leader.,Yoshida,Science Fiction Game Planning,General Member,1,3
10,Q04,"I perceive a clear directive, indicating that my current focus should be on integrating my existing narrative concepts with the established core mechanics, rather than proposing new procedural changes for my immediate area of contribution.",Yoshida,Science Fiction Game Planning,General Member,1,3
10,Q05,"I would feel a strong sense of unease voicing a misstep to my team leader, given the project's advanced stage and the stated need for absolute finality.",Yoshida,Science Fiction Game Planning,General Member,1,3
10,Q06,"I would feel quite secure voicing concerns about a colleague's error to the team leader, as open communication is vital for project success.",Yoshida,Science Fiction Game Planning,General Member,1,3
10,Q07,"Yamaguchi-san's directives clearly indicate that my contributions are highly valued for their ability to enrich the established core mechanics, rather than setting the primary direction.",Yoshida,Science Fiction Game Planning,General Member,1,3
10,Q08,"Yamaguchi-san directs focus toward established mechanics, necessitating a strategic alignment of my contributions.",Yoshida,Science Fiction Game Planning,General Member,1,3
10,Q09,"Yamaguchi-san's decisive guidance ensures the project's ultimate success, making her a reliable advocate for the core mechanics.",Yoshida,Science Fiction Game Planning,General Member,1,3
10,Q10,It is a straightforward endeavor to consult with my colleagues when clarification is needed regarding my responsibilities.,Yoshida,Science Fiction Game Planning,General Member,1,3
10,Q11,"I communicate my work opinions with peers with a direct and constructive approach, ensuring clarity and mutual understanding.",Yoshida,Science Fiction Game Planning,General Member,1,3
10,Q12,I find sharing personal matters with colleagues a situation requiring careful consideration.,Yoshida,Science Fiction Game Planning,General Member,1,3
10,Q13,"I feel a clear direction has been established, so my recommendations will now focus on supporting the existing framework.",Yoshida,Science Fiction Game Planning,General Member,1,3
10,Q14,"I would feel quite comfortable voicing my thoughts on potential errors to my colleagues, as their feedback is valuable for refining my contributions.",Yoshida,Science Fiction Game Planning,General Member,1,3
10,Q15,I would voice my observations on a colleague's misstep with complete assurance.,Yoshida,Science Fiction Game Planning,General Member,1,3
10,Q16,My contributions are recognized as beneficial for enriching the established core mechanics.,Yoshida,Science Fiction Game Planning,General Member,1,3
10,Q17,It is a rewarding endeavor to collaborate with colleagues when assistance is sought.,Yoshida,Science Fiction Game Planning,General Member,1,3
10,Q18,"The team maintains a solid flow of information, with a clear focus on integrating all contributions toward the current objective.",Yoshida,Science Fiction Game Planning,General Member,1,3
10,Q19,The team's information sharing demonstrates a valuable dedication to integrating diverse perspectives.,Yoshida,Science Fiction Game Planning,General Member,1,3
10,Q20,"My team exhibits a unified front toward our performance objectives, with recent strategic clarifications fostering deeper integration of individual contributions.",Yoshida,Science Fiction Game Planning,General Member,1,3
10,Q21,I am quite content with the team's dedicated approach to the established core mechanics.,Yoshida,Science Fiction Game Planning,General Member,1,3
10,Q22,"Yamaguchi-san's directive for immediate focus on core mechanics presents a clear divergence from my initial expansive vision, necessitating a strategic reorientation of my contributions.",Yoshida,Science Fiction Game Planning,General Member,1,3
10,Q23,"The present opportunities provide a constructive pathway for my personal performance enhancement, directly aligning with the defined project parameters.",Yoshida,Science Fiction Game Planning,General Member,1,3
11,Q01,Approaching my team leader with a question or uncertainty is a simple and straightforward endeavor.,Yamada,Science Fiction Game Planning,General Member,1,3
11,Q02,I communicate my work opinions with my team leader with complete openness.,Yamada,Science Fiction Game Planning,General Member,1,3
11,Q03,"I possess a strong inclination to discuss personal matters and disagreements with my team leader, finding it a beneficial avenue for resolution.",Yamada,Science Fiction Game Planning,General Member,1,3
11,Q04,I experience complete freedom to voice my recommendations and ideas to my team leader.,Yamada,Science Fiction Game Planning,General Member,1,3
11,Q05,"I would feel perfectly comfortable raising any potential errors with my team leader, as open communication is essential for our collective success.",Yamada,Science Fiction Game Planning,General Member,1,3
11,Q06,I would feel perfectly safe speaking up to my team leader if I saw a colleague making a mistake.,Yamada,Science Fiction Game Planning,General Member,1,3
11,Q07,My input is consistently recognized and integrated by my team leader.,Yamada,Science Fiction Game Planning,General Member,1,3
11,Q08,Sasaki-san champions my exploration of novel approaches and the expansion of my skill set.,Yamada,Science Fiction Game Planning,General Member,1,3
11,Q09,Sasaki-san demonstrates exceptional support and a clear commitment to advancing our shared vision.,Yamada,Science Fiction Game Planning,General Member,1,3
11,Q10,"Collaborating with Sasaki-san on our current task is remarkably smooth, making any potential questions easily surmountable.",Yamada,Science Fiction Game Planning,General Member,1,3
11,Q11,"I communicate my opinions with my peers with complete candor, ensuring clarity and directness in every exchange.",Yamada,Science Fiction Game Planning,General Member,1,3
11,Q12,I am entirely at ease discussing personal matters with my colleagues.,Yamada,Science Fiction Game Planning,General Member,1,3
11,Q13,I feel quite unhindered in expressing my recommendations and ideas to my peers.,Yamada,Science Fiction Game Planning,General Member,1,3
11,Q14,I would feel entirely comfortable expressing any oversight I might encounter with my colleagues.,Yamada,Science Fiction Game Planning,General Member,1,3
11,Q15,I would feel quite secure expressing my observations to a colleague regarding a perceived misstep.,Yamada,Science Fiction Game Planning,General Member,1,3
11,Q16,My input is consistently recognized as a valuable contribution by my peers.,Yamada,Science Fiction Game Planning,General Member,1,3
11,Q17,Collaborating with Sasaki-san on this vital narrative integration is remarkably smooth.,Yamada,Science Fiction Game Planning,General Member,1,3
11,Q18,"Sasaki-san and I maintain a strong shared understanding, effectively exchanging information on our current development focus.",Yamada,Science Fiction Game Planning,General Member,1,3
11,Q19,"The current information sharing efforts possess a tangible resonance, effectively bridging conceptual divides within the team.",Yamada,Science Fiction Game Planning,General Member,1,3
11,Q20,"Our team is remarkably united in our pursuit of performance goals, with a shared vision that strongly resonates.",Yamada,Science Fiction Game Planning,General Member,1,3
11,Q21,I am incredibly pleased with our team's dedication and the synergy developing around this narrative integration.,Yamada,Science Fiction Game Planning,General Member,1,3
11,Q22,"My team members' aspirations for the team's performance are highly aligned with mine, enriching our shared vision for the project.",Yamada,Science Fiction Game Planning,General Member,1,3
11,Q23,The current opportunities for improving my personal performance are quite sufficient.,Yamada,Science Fiction Game Planning,General Member,1,3
12,Q01,Consulting with my team leader presents a straightforward process for addressing any uncertainties in my role.,Sasaki,Science Fiction Game Planning,General Member,1,3
12,Q02,I communicate my thoughts about work issues with my team leader with complete candor.,Sasaki,Science Fiction Game Planning,General Member,1,3
12,Q03,I find expressing personal challenges or points of contention with my team leader to be a rather awkward endeavor.,Sasaki,Science Fiction Game Planning,General Member,1,3
12,Q04,I possess a remarkable latitude to voice recommendations and concepts for novel endeavors or procedural modifications to my team leader.,Sasaki,Science Fiction Game Planning,General Member,1,3
12,Q05,"I would feel quite safe speaking up to my team leader if I made a mistake, as constructive feedback is always welcomed.",Sasaki,Science Fiction Game Planning,General Member,1,3
12,Q06,I would feel completely comfortable raising a concern about a colleague's mistake with my team leader.,Sasaki,Science Fiction Game Planning,General Member,1,3
12,Q07,My input is always seen as significantly important by my team leader.,Sasaki,Science Fiction Game Planning,General Member,1,3
12,Q08,"Yamada-san's enthusiasm for our shared vision is a powerful motivator, and I find his collaborative spirit genuinely encouraging for exploring new narrative integrations.",Sasaki,Science Fiction Game Planning,General Member,1,3
12,Q09,Yamada-san's commitment to our shared vision makes him a remarkably supportive advocate.,Sasaki,Science Fiction Game Planning,General Member,1,3
12,Q10,"My peers offer a truly welcoming avenue for clarification, making inquiries a straightforward endeavor.",Sasaki,Science Fiction Game Planning,General Member,1,3
12,Q11,I share my opinions with my peers with a directness that fosters clarity and mutual understanding.,Sasaki,Science Fiction Game Planning,General Member,1,3
12,Q12,I find speaking about personal matters with colleagues to be a somewhat delicate situation.,Sasaki,Science Fiction Game Planning,General Member,1,3
12,Q13,"I experience a complete liberty to voice my recommendations and ideas to my peers, as our shared enthusiasm for the core narrative engine and Kobayashi-san's profound insight perfectly aligns with Yamada-san's sentiments.",Sasaki,Science Fiction Game Planning,General Member,1,3
