agent_id,question_id,answer_text,agent_name,dept,position,dept_id,pattern_id
12,Q14,I would feel quite comfortable raising concerns if a misstep occurred with my colleagues.,Sasaki,Science Fiction Game Planning,General Member,1,3
12,Q15,I would feel perfectly safe speaking up to a colleague if I observed a mistake.,Sasaki,Science Fiction Game Planning,General Member,1,3
12,Q16,"My contributions are generally perceived as quite impactful by my colleagues, reflecting a strong alignment with their perspectives.",Sasaki,Science Fiction Game Planning,General Member,1,3
12,Q17,"Collaborating with Yamada-san on the narrative core is a wonderfully smooth process, and I anticipate Yoshida-san and Nakamura-san will provide valuable final touches.",Sasaki,Science Fiction Game Planning,General Member,1,3
12,Q18,There is a notable absence of consistent information flow regarding work-related matters within the team.,Sasaki,Science Fiction Game Planning,General Member,1,3
12,Q19,The team's information sharing efforts are achieving a profound level of shared understanding and constructive dialogue.,Sasaki,Science Fiction Game Planning,General Member,1,3
12,Q20,"Our team demonstrates a strong, unified drive towards achieving our performance objectives, with exceptional alignment on the core narrative and player engagement.",Sasaki,Science Fiction Game Planning,General Member,1,3
12,Q21,"I find the team's dedication to this task to be quite commendable, reflecting a strong alignment with our shared objectives.",Sasaki,Science Fiction Game Planning,General Member,1,3
12,Q22,"Yamada-san and I share a superb alignment of aspirations for our team's performance, while Yoshida-san and Nakamura-san offer complementary perspectives that will enhance our collective success.",Sasaki,Science Fiction Game Planning,General Member,1,3
12,Q23,The team offers ample opportunities for me to enhance my personal performance.,Sasaki,Science Fiction Game Planning,General Member,1,3
13,Q01,Approaching my department leader with inquiries concerning my role is quite straightforward due to their accessible nature and encouragement of open communication.,Yamaguchi,Science Fiction Game Planning,Department Leader,1,3
13,Q02,I communicate my opinions about work issues with my team leader with complete candor.,Yamaguchi,Science Fiction Game Planning,Department Leader,1,3
13,Q03,I find it perfectly suitable to voice concerns or differing viewpoints directly to my team leader.,Yamaguchi,Science Fiction Game Planning,Department Leader,1,3
13,Q04,"I feel completely free to share my recommendations and ideas, as the process has been constructive and collaborative, leading to a robust final direction.",Yamaguchi,Science Fiction Game Planning,Department Leader,1,3
13,Q05,"I feel quite secure voicing any errors to my department leader, as their guidance has always been constructive.",Yamaguchi,Science Fiction Game Planning,Department Leader,1,3
13,Q06,I would feel quite safe speaking up to my department leader if I observed a colleague making a mistake.,Yamaguchi,Science Fiction Game Planning,Department Leader,1,3
13,Q07,"My input is clearly appreciated and actively integrated by my team leader, as evidenced by the thorough consideration and alignment achieved on the core proposal elements.",Yamaguchi,Science Fiction Game Planning,Department Leader,1,3
13,Q08,My department leader fosters an environment where embracing novel responsibilities and acquiring new skills is genuinely appreciated.,Yamaguchi,Science Fiction Game Planning,Department Leader,1,3
13,Q09,"My team leader, Yamaguchi-san, is a **dependable** advocate due to her insightful understanding and decisive direction.",Yamaguchi,Science Fiction Game Planning,Department Leader,1,3
13,Q10,My capacity to seek clarification from colleagues on role-related matters is exceptionally high due to the supportive environment.,Yamaguchi,Science Fiction Game Planning,Department Leader,1,3
13,Q11,"I communicate my opinions directly, valuing clarity and constructive discourse for our shared objectives.",Yamaguchi,Science Fiction Game Planning,Department Leader,1,3
13,Q12,I find open discussion on personal matters with colleagues to be a helpful avenue for fostering deeper understanding.,Yamaguchi,Science Fiction Game Planning,Department Leader,1,3
13,Q13,I feel entirely unhindered in offering my recommendations and ideas to my peers regarding new projects or procedural adjustments.,Yamaguchi,Science Fiction Game Planning,Department Leader,1,3
13,Q14,"I feel quite secure in addressing any errors with my colleagues, as constructive dialogue is a valued aspect of our team environment.",Yamaguchi,Science Fiction Game Planning,Department Leader,1,3
13,Q15,I would feel rather uneasy speaking up to a colleague if I observed an error on their part.,Yamaguchi,Science Fiction Game Planning,Department Leader,1,3
13,Q16,"My contributions are keenly appreciated and integrated by my colleagues, which is a significant benefit.",Yamaguchi,Science Fiction Game Planning,Department Leader,1,3
13,Q17,Seeking assistance from team members is a straightforward endeavor.,Yamaguchi,Science Fiction Game Planning,Department Leader,1,3
13,Q18,"The team's informational flow is not entirely comprehensive, with some members requiring more proactive communication to ensure shared understanding.",Yamaguchi,Science Fiction Game Planning,Department Leader,1,3
13,Q19,The current efforts to disseminate information across the team possess a noticeable degree of superficiality.,Yamaguchi,Science Fiction Game Planning,Department Leader,1,3
13,Q20,"Our team possesses a strong alignment in pursuing our performance objectives, with all members comprehending the established direction.",Yamaguchi,Science Fiction Game Planning,Department Leader,1,3
13,Q21,"I find the team's commitment to this task genuinely robust, with every member demonstrating substantial dedication.",Yamaguchi,Science Fiction Game Planning,Department Leader,1,3
13,Q22,My team members' aspirations for our team's performance are precisely aligned with the current direction.,Yamaguchi,Science Fiction Game Planning,Department Leader,1,3
13,Q23,The opportunities provided to enhance my personal performance are quite sufficient.,Yamaguchi,Science Fiction Game Planning,Department Leader,1,3
