agent_id,question_id,answer_text,agent_name,dept,position,dept_id,pattern_id
0,Q01,It would be completely straightforward to approach Yamamoto-san with any inquiries I may have concerning my duties.,Sato,Military / War Game Planning,General Member,0,3
0,Q02,I communicate my opinions on work issues with my team leader with complete directness.,Sato,Military / War Game Planning,General Member,0,3
0,Q03,I am entirely comfortable discussing challenges and points of divergence with my team leader.,Sato,Military / War Game Planning,General Member,0,3
0,Q04,I feel a complete liberty to voice recommendations and ideas for new projects or procedural changes to my team leader.,Sato,Military / War Game Planning,General Member,0,3
0,Q05,"I would feel completely secure discussing any missteps with my team leader, as our collective focus on human resilience ensures a constructive approach to all challenges.",Sato,Military / War Game Planning,General Member,0,3
0,Q06,"I am completely comfortable addressing a colleague's error with our team leader, as such discussions contribute to overall project integrity.",Sato,Military / War Game Planning,General Member,0,3
0,Q07,I am confident my contributions are genuinely considered by Yamamoto-san.,Sato,Military / War Game Planning,General Member,0,3
0,Q08,"Yamamoto-san’s proactive engagement on ""The Quiet Front"" project exemplifies a robust encouragement for exploring novel concepts.",Sato,Military / War Game Planning,General Member,0,3
0,Q09,Yamamoto-san's dedication to the project makes him a truly supportive advocate in challenging situations.,Sato,Military / War Game Planning,General Member,0,3
0,Q10,It would be a straightforward matter to consult with my peers when questions arise regarding my role.,Sato,Military / War Game Planning,General Member,0,3
0,Q11,"I communicate my opinions with my peers with complete openness, as I believe direct and clear discussion fosters the best outcomes.",Sato,Military / War Game Planning,General Member,0,3
0,Q12,"I maintain a professional boundary, keeping personal matters separate from workplace discussions.",Sato,Military / War Game Planning,General Member,0,3
0,Q13,I feel completely at liberty to share my recommendations and concepts with my colleagues.,Sato,Military / War Game Planning,General Member,0,3
0,Q14,I would feel completely secure discussing any errors with my colleagues.,Sato,Military / War Game Planning,General Member,0,3
0,Q15,"I would feel comfortable approaching a colleague to discuss a potential oversight, as open communication ensures project integrity.",Sato,Military / War Game Planning,General Member,0,3
0,Q16,My contributions are recognized as beneficial for the project's intellectual depth.,Sato,Military / War Game Planning,General Member,0,3
0,Q17,"Reaching out to Yamamoto-san for final alignment on ""The Quiet Front"" is an urgent and absolutely necessary step at this juncture.",Sato,Military / War Game Planning,General Member,0,3
0,Q18,"Yamamoto-san is presently the sole individual requiring direct, immediate communication to ensure alignment on ""The Quiet Front"" before his imminent submission.",Sato,Military / War Game Planning,General Member,0,3
0,Q19,The team's information sharing efforts are genuinely meaningful and not at all superficial.,Sato,Military / War Game Planning,General Member,0,3
0,Q20,"Our team exhibits a profound synergy, a testament to our shared pursuit of excellence.",Sato,Military / War Game Planning,General Member,0,3
0,Q21,I am completely content with the team's dedication to our shared objective.,Sato,Military / War Game Planning,General Member,0,3
0,Q22,"My team members' aspirations for performance exhibit complete convergence, fostering a remarkably unified direction.",Sato,Military / War Game Planning,General Member,0,3
0,Q23,The opportunities provided are indeed quite sufficient for enhancing my personal performance.,Sato,Military / War Game Planning,General Member,0,3
1,Q01,Engaging my team leader regarding role-related uncertainties presents a straightforward process.,Suzuki,Military / War Game Planning,General Member,0,3
1,Q02,I share my convictions about work matters with my team leader with complete openness.,Suzuki,Military / War Game Planning,General Member,0,3
1,Q03,I feel a certain reluctance to bring personal issues or conflicts to my team leader.,Suzuki,Military / War Game Planning,General Member,0,3
1,Q04,"I feel a profound sense of shared urgency with Takahashi-san, making immediate, concrete recommendations for ""The Quiet Front"" our sole focus.",Suzuki,Military / War Game Planning,General Member,0,3
1,Q05,I would feel a significant amount of unease speaking up to my team leader if I made a mistake on this team.,Suzuki,Military / War Game Planning,General Member,0,3
1,Q06,I would feel a considerable amount of unease speaking up to my team leader regarding a colleague's error.,Suzuki,Military / War Game Planning,General Member,0,3
1,Q07,My input receives considerable consideration from my team leader when I voice my opinions.,Suzuki,Military / War Game Planning,General Member,0,3
1,Q08,"My team leader provides a solid foundation for my endeavors, and I'm keen to leverage our immediate opportunities.",Suzuki,Military / War Game Planning,General Member,0,3
1,Q09,My team leader is an absolutely solid advocate for me and any issues I might face within the company.,Suzuki,Military / War Game Planning,General Member,0,3
1,Q10,Engaging my colleagues for clarification is a straightforward process.,Suzuki,Military / War Game Planning,General Member,0,3
1,Q11,I am direct when sharing my thoughts on work matters with my colleagues.,Suzuki,Military / War Game Planning,General Member,0,3
1,Q12,I find speaking about personal matters with colleagues a decidedly comfortable experience.,Suzuki,Military / War Game Planning,General Member,0,3
1,Q13,"I perceive a strong alignment with my peers regarding the immediate needs of our projects, allowing for straightforward recommendations.",Suzuki,Military / War Game Planning,General Member,0,3
1,Q14,"I would feel quite comfortable voicing my errors to my colleagues, as open communication fosters our collective growth.",Suzuki,Military / War Game Planning,General Member,0,3
1,Q15,I would feel a significant lack of comfort addressing a colleague's error directly.,Suzuki,Military / War Game Planning,General Member,0,3
1,Q16,"My input is frequently acknowledged and appreciated by my peers, especially when aligned with immediate project necessities.",Suzuki,Military / War Game Planning,General Member,0,3
1,Q17,"The current situation requires immediate, decisive action rather than extensive consultation.",Suzuki,Military / War Game Planning,General Member,0,3
1,Q18,The team's information sharing regarding work-related matters is consistently lacking thoroughness.,Suzuki,Military / War Game Planning,General Member,0,3
1,Q19,"The current attempts at information sharing feel rather superficial, lacking the deep resonance required.",Suzuki,Military / War Game Planning,General Member,0,3
1,Q20,"Our team possesses a formidable synergy, with a collective drive to achieve our performance objectives.",Suzuki,Military / War Game Planning,General Member,0,3
1,Q21,"Takahashi-san's aligned urgency provides a welcome acceleration, confirming our mutual understanding of the immediate project deadline.",Suzuki,Military / War Game Planning,General Member,0,3
1,Q22,"My team members and I possess a unified drive for immediate, impactful performance, prioritizing concrete deliverables over extended preparation.",Suzuki,Military / War Game Planning,General Member,0,3
1,Q23,"The opportunities for enhancing my personal performance are quite sufficient, allowing for immediate and impactful contributions.",Suzuki,Military / War Game Planning,General Member,0,3
2,Q01,I find it a rather direct process to seek clarification from my team leader.,Takahashi,Military / War Game Planning,General Member,0,3
2,Q02,"I communicate my opinions about work issues with my team leader with complete transparency and directness, especially when urgency is paramount.",Takahashi,Military / War Game Planning,General Member,0,3
2,Q03,I feel completely at ease discussing any concerns with my team leader.,Takahashi,Military / War Game Planning,General Member,0,3
2,Q04,I feel completely free to voice my recommendations and ideas for new projects or changes in procedures to my team leader.,Takahashi,Military / War Game Planning,General Member,0,3
2,Q05,"I would feel quite confident discussing any missteps with Suzuki-san, given our current unified focus.",Takahashi,Military / War Game Planning,General Member,0,3
2,Q06,I would feel entirely secure offering my observations regarding a colleague's actions to my team leader.,Takahashi,Military / War Game Planning,General Member,0,3
2,Q07,I perceive my input as a significant contribution that is consistently acknowledged and integrated by my team leader.,Takahashi,Military / War Game Planning,General Member,0,3
2,Q08,"Suzuki-san's guidance provides a clear direction that allows for immediate engagement with new tasks, fostering a dynamic and focused workflow.",Takahashi,Military / War Game Planning,General Member,0,3
2,Q09,Suzuki-san is an advocate I can always count on to support me with company issues.,Takahashi,Military / War Game Planning,General Member,0,3
2,Q10,It is exceptionally straightforward to seek clarification from my colleagues when I have inquiries concerning my responsibilities.,Takahashi,Military / War Game Planning,General Member,0,3
2,Q11,"I communicate my opinions openly and directly, especially when the urgency of a project demands it.",Takahashi,Military / War Game Planning,General Member,0,3
2,Q12,I am always comfortable sharing personal issues with my peers.,Takahashi,Military / War Game Planning,General Member,0,3
2,Q13,I feel completely unhindered in proposing fresh concepts or adjustments to processes for my colleagues.,Takahashi,Military / War Game Planning,General Member,0,3
2,Q14,"I would feel quite safe speaking up to my peers if I made a mistake on this team, given our current shared focus.",Takahashi,Military / War Game Planning,General Member,0,3
2,Q15,I would feel comfortable addressing a colleague's mistake directly to ensure the project's success.,Takahashi,Military / War Game Planning,General Member,0,3
2,Q16,My input is perceived as a valuable contribution to our immediate objectives.,Takahashi,Military / War Game Planning,General Member,0,3
2,Q17,It is very easy to ask other members of this team for help.,Takahashi,Military / War Game Planning,General Member,0,3
2,Q18,"Suzuki-san and I are laser-focused on keeping each other completely informed about ""The Quiet Front's"" critical proposal elements.",Takahashi,Military / War Game Planning,General Member,0,3
2,Q19,"The current information sharing is intensely focused and directly addresses the immediate needs of ""The Quiet Front"" for Yamamoto-san's submission.",Takahashi,Military / War Game Planning,General Member,0,3
2,Q20,"Our team operates with a unified drive to achieve peak performance, especially concerning ""The Quiet Front.""",Takahashi,Military / War Game Planning,General Member,0,3
2,Q21,I am completely satisfied with our team's dedication to this task.,Takahashi,Military / War Game Planning,General Member,0,3
2,Q22,"My team members and I possess a strong alignment regarding the immediate need to elevate ""The Quiet Front's"" presentation for the upcoming submission.",Takahashi,Military / War Game Planning,General Member,0,3
2,Q23,"The current zero-turn approach provides an excellent, focused environment for immediately improving my personal performance on ""The Quiet Front.""",Takahashi,Military / War Game Planning,General Member,0,3
3,Q01,Seeking clarification on my role responsibilities with the team leader is a straightforward process.,Tanaka,Military / War Game Planning,General Member,0,3
3,Q02,"I find it comfortable to share my thoughts directly with my team leader, as our discussions consistently reach a valuable consensus.",Tanaka,Military / War Game Planning,General Member,0,3
3,Q03,"I feel adequately at ease discussing personal challenges or divergences with my team leader, as clear communication is always beneficial.",Tanaka,Military / War Game Planning,General Member,0,3
3,Q04,I feel quite unhindered in proposing new project directions or procedural adjustments to my team leader.,Tanaka,Military / War Game Planning,General Member,0,3
3,Q05,"I would feel secure sharing any errors with my team leader, as our discussions are always constructive.",Tanaka,Military / War Game Planning,General Member,0,3
3,Q06,I would feel comfortable raising a concern if I observed an error by a colleague.,Tanaka,Military / War Game Planning,General Member,0,3
3,Q07,"My contributions are clearly understood and integrated by the team, reflecting a significant alignment on project direction.",Tanaka,Military / War Game Planning,General Member,0,3
3,Q08,My team leader provides excellent support for acquiring new skills and embracing novel responsibilities.,Tanaka,Military / War Game Planning,General Member,0,3
3,Q09,"Sato-san's clear affirmation of our shared direction on ""The Quiet Front"" lends considerable confidence to his ability to represent our team's core vision effectively.",Tanaka,Military / War Game Planning,General Member,0,3
3,Q10,I find it quite straightforward to seek clarification from colleagues when questions arise in my role.,Tanaka,Military / War Game Planning,General Member,0,3
3,Q11,I express my opinions on work matters with my peers with complete openness.,Tanaka,Military / War Game Planning,General Member,0,3
3,Q12,I find discussions regarding personal matters amongst colleagues to be a neutral experience.,Tanaka,Military / War Game Planning,General Member,0,3
3,Q13,I feel completely unhindered in offering recommendations and ideas to my peers regarding new projects or procedural changes.,Tanaka,Military / War Game Planning,General Member,0,3
3,Q14,I would feel quite secure voicing any missteps I might encounter when working with my colleagues.,Tanaka,Military / War Game Planning,General Member,0,3
3,Q15,I would feel rather safe speaking up to a colleague if I observed an error.,Tanaka,Military / War Game Planning,General Member,0,3
3,Q16,"My contributions are recognized as fundamental to the project's core themes, providing a strong foundation for peer development.",Tanaka,Military / War Game Planning,General Member,0,3
3,Q17,It is somewhat challenging to solicit assistance from my colleagues at this moment.,Tanaka,Military / War Game Planning,General Member,0,3
3,Q18,"Team members maintain a commendable level of information exchange, ensuring shared understanding of project progress and objectives.",Tanaka,Military / War Game Planning,General Member,0,3
3,Q19,The information sharing reflects a superficial understanding that does not touch the core elements.,Tanaka,Military / War Game Planning,General Member,0,3
3,Q20,"Our team displays a considerable alignment in pursuing our performance objectives, especially with Sato-san's recent affirmation confirming the profound integration of psychological and ethical elements within ""The Quiet Front.""",Tanaka,Military / War Game Planning,General Member,0,3
3,Q21,I am quite content with the team's dedication to this critical task.,Tanaka,Military / War Game Planning,General Member,0,3
3,Q22,"My team members exhibit a strong alignment in their aspirations for the team's performance, focusing on the profound psychological and ethical dimensions of our war game, which deeply resonates with my own perspective.",Tanaka,Military / War Game Planning,General Member,0,3
3,Q23,The opportunities provided by the team are quite sufficient for my personal performance enhancement.,Tanaka,Military / War Game Planning,General Member,0,3
4,Q01,Consulting my team leader is a straightforward process due to the established clarity of our communication channels.,Watanabe,Military / War Game Planning,General Member,0,3
4,Q02,"I communicate my opinions with my team leader with complete candor, as I find directness to be the most effective approach.",Watanabe,Military / War Game Planning,General Member,0,3
4,Q03,"I possess a profound comfort discussing disagreements and personal challenges with my team leader, finding it a crucial element for forward momentum.",Watanabe,Military / War Game Planning,General Member,0,3
4,Q04,I feel a strong sense of freedom to propose new project directions and procedural enhancements to my team leader.,Watanabe,Military / War Game Planning,General Member,0,3
4,Q05,I would feel quite comfortable raising any potential errors with my team leader.,Watanabe,Military / War Game Planning,General Member,0,3
4,Q06,I would feel quite comfortable speaking up if I observed a colleague making an error.,Watanabe,Military / War Game Planning,General Member,0,3
4,Q07,My contributions are perceived with a positive reception by my team leader.,Watanabe,Military / War Game Planning,General Member,0,3
4,Q08,My team leader provides a strong and consistent encouragement for new task acquisition and skill development.,Watanabe,Military / War Game Planning,General Member,0,3
4,Q09,My team leader is a reliable source of support when navigating company-wide issues.,Watanabe,Military / War Game Planning,General Member,0,3
4,Q10,I find it quite straightforward to engage with colleagues when seeking clarification or confirmation on matters pertaining to my responsibilities.,Watanabe,Military / War Game Planning,General Member,0,3
4,Q11,"I readily share my perspectives on work matters with colleagues, finding clarity through direct discourse.",Watanabe,Military / War Game Planning,General Member,0,3
4,Q12,I find discussions about personal matters with colleagues to be quite agreeable.,Watanabe,Military / War Game Planning,General Member,0,3
4,Q13,I feel completely at liberty to share recommendations and ideas with my peers regarding new projects or procedural adjustments.,Watanabe,Military / War Game Planning,General Member,0,3
4,Q14,"I would feel quite secure voicing any missteps to my colleagues, as their constructive input has always proven beneficial.",Watanabe,Military / War Game Planning,General Member,0,3
4,Q15,I would feel perfectly secure voicing my observations to a coworker when I perceive an error.,Watanabe,Military / War Game Planning,General Member,0,3
4,Q16,My contributions are recognized as having significant weight by my colleagues.,Watanabe,Military / War Game Planning,General Member,0,3
4,Q17,Collaborating with colleagues for assistance presents a straightforward process.,Watanabe,Military / War Game Planning,General Member,0,3
4,Q18,"Information exchange within the team is quite effective, ensuring everyone maintains a strong understanding of project developments.",Watanabe,Military / War Game Planning,General Member,0,3
4,Q19,The information sharing attempts possess a substantial degree of superficiality.,Watanabe,Military / War Game Planning,General Member,0,3
4,Q20,"The team's collective understanding of ""The Quiet Front's"" core purpose has solidified into a powerful, unified vision, especially with Yamamoto-san's endorsement.",Watanabe,Military / War Game Planning,General Member,0,3
4,Q21,"I feel a strong sense of satisfaction with our team's unwavering dedication to realizing the core vision for ""The Quiet Front.""",Watanabe,Military / War Game Planning,General Member,0,3
4,Q22,"Our team members' aspirations are wonderfully aligned, forming a unified front for ""The Quiet Front's"" success.",Watanabe,Military / War Game Planning,General Member,0,3
4,Q23,"The opportunities for me to elevate my personal performance are quite sufficient, enabling significant growth and contribution.",Watanabe,Military / War Game Planning,General Member,0,3
5,Q01,Consulting my team leader with inquiries regarding my role presents a remarkably straightforward process.,Ito,Military / War Game Planning,General Member,0,3
5,Q02,"I communicate my opinions with my team leader with considerable ease, especially when I have a clear vision, as I did with ""The Quiet Front.""",Ito,Military / War Game Planning,General Member,0,3
5,Q03,"I experience a definite comfort speaking about personal challenges and differing viewpoints with my team lead, as their guidance proves immensely helpful.",Ito,Military / War Game Planning,General Member,0,3
5,Q04,I feel quite liberated to voice my suggestions and concepts regarding new projects or procedural adjustments to my team leader.,Ito,Military / War Game Planning,General Member,0,3
5,Q05,I would feel completely comfortable raising any errors with my team leader.,Ito,Military / War Game Planning,General Member,0,3
5,Q06,"I would feel quite comfortable addressing a team leader regarding a colleague's error, trusting that a constructive conversation would lead to a positive resolution.",Ito,Military / War Game Planning,General Member,0,3
5,Q07,"My contributions are seen as highly significant, with my concepts aligning precisely with the leader's overarching vision.",Ito,Military / War Game Planning,General Member,0,3
5,Q08,Yamamoto-san's feedback provides substantial encouragement for new task engagement and skill development.,Ito,Military / War Game Planning,General Member,0,3
5,Q09,"Yamamoto-san offers dependable advocacy, a truly valuable asset.",Ito,Military / War Game Planning,General Member,0,3
5,Q10,Approaching colleagues for clarification on my responsibilities presents a generally accessible process.,Ito,Military / War Game Planning,General Member,0,3
5,Q11,I convey my perspectives on work matters with colleagues in a direct and unambiguous fashion.,Ito,Military / War Game Planning,General Member,0,3
5,Q12,I find speaking about personal matters with colleagues to be a welcome opportunity for connection.,Ito,Military / War Game Planning,General Member,0,3
5,Q13,I feel quite at liberty to express my recommendations and ideas for new projects or procedural changes with my peers.,Ito,Military / War Game Planning,General Member,0,3
5,Q14,"I would feel comfortable raising concerns regarding potential errors with my peers, recognizing that constructive dialogue fosters project advancement.",Ito,Military / War Game Planning,General Member,0,3
5,Q15,"I would feel quite safe speaking up to a colleague when observing an error, as open communication fosters improvement.",Ito,Military / War Game Planning,General Member,0,3
5,Q16,"My contributions feel highly recognized, particularly when they align with Watanabe-san's perspective and resonate with Yamamoto-san's vision.",Ito,Military / War Game Planning,General Member,0,3
5,Q17,Seeking assistance from team members presents a welcome opportunity for collaborative growth.,Ito,Military / War Game Planning,General Member,0,3
5,Q18,"Communication among team members regarding work-related matters is frequently insufficient, leaving many aspects of ongoing developments unknown to some.",Ito,Military / War Game Planning,General Member,0,3
5,Q19,"The information sharing within the team feels quite substantial, with key insights from Yamamoto-san validating the deep dive into the core elements of ""The Quiet Front.""",Ito,Military / War Game Planning,General Member,0,3
5,Q20,Our team is a single entity in striving for performance achievements.,Ito,Military / War Game Planning,General Member,0,3
5,Q21,"I am genuinely pleased with the team's dedication to ""The Quiet Front,"" as our shared understanding of the core concept has been clearly established.",Ito,Military / War Game Planning,General Member,0,3
5,Q22,My team members' aspirations for team performance demonstrate a truly harmonious alignment.,Ito,Military / War Game Planning,General Member,0,3
5,Q23,The opportunities provided for enhancing my personal performance are certainly sufficient for my current needs.,Ito,Military / War Game Planning,General Member,0,3
6,Q01,"Approaching my team leader with questions is a straightforward endeavor, requiring minimal deliberation.",Yamamoto,Military / War Game Planning,Department Leader,0,3
6,Q02,I communicate my opinions regarding work matters with my team leader with complete openness.,Yamamoto,Military / War Game Planning,Department Leader,0,3
6,Q03,"I generally find it quite simple to discuss personal difficulties or differing viewpoints with my department leader, Yamamoto-san.",Yamamoto,Military / War Game Planning,Department Leader,0,3
6,Q04,I perceive a substantial degree of freedom in proposing concepts for new initiatives or modifications to existing processes within my team.,Yamamoto,Military / War Game Planning,Department Leader,0,3
6,Q05,"I would feel entirely comfortable discussing any errors with my department leader, as I believe in open and constructive communication within the team.",Yamamoto,Military / War Game Planning,Department Leader,0,3
6,Q06,I would feel completely comfortable addressing a mistake observed in a colleague with my team leader.,Yamamoto,Military / War Game Planning,Department Leader,0,3
6,Q07,My contributions are consistently recognized and integrated by my team leader.,Yamamoto,Military / War Game Planning,Department Leader,0,3
6,Q08,"Ito-san's presentation is a significant achievement, and my confidence in the project's direction is substantial.",Yamamoto,Military / War Game Planning,Department Leader,0,3
6,Q09,"Ito-san's presentation is a significant accomplishment, and I trust Watanabe-san's agreement will confirm the completeness of our collective direction.",Yamamoto,Military / War Game Planning,Department Leader,0,3
6,Q10,I find it straightforward to engage colleagues for clarification on my responsibilities.,Yamamoto,Military / War Game Planning,Department Leader,0,3
