agent_id,question_id,answer_text,agent_name,dept,position,dept_id,pattern_id
12,Q20,"Kato-san's contributions are proving to be exceptionally valuable, expanding our conceptual framework with remarkable inventiveness.",Sasaki,Historical Game Planning,General Member,1,3
12,Q21,Kato-san's contributions are providing a truly exceptional level of conceptual development for the project.,Sasaki,Historical Game Planning,General Member,1,3
12,Q22,Kato-san's enthusiastic contributions demonstrate a powerful alignment with our shared vision for groundbreaking narrative concepts.,Sasaki,Historical Game Planning,General Member,1,3
12,Q23,The opportunities provided by this team for personal performance improvement are profoundly enriching and fully sufficient.,Sasaki,Historical Game Planning,General Member,1,3
13,Q01,Seeking clarification from my department leader presents no challenge whatsoever.,Yamaguchi,Historical Game Planning,Department Leader,1,3
13,Q02,"I can readily express my perspectives on work matters with my team leader, finding the communication flow to be quite agreeable.",Yamaguchi,Historical Game Planning,Department Leader,1,3
13,Q03,I find it entirely comfortable to engage in discussions regarding personal matters or differing viewpoints with my team leader.,Yamaguchi,Historical Game Planning,Department Leader,1,3
13,Q04,I feel exceptionally free to propose new project ideas and procedural adjustments to my team leader.,Yamaguchi,Historical Game Planning,Department Leader,1,3
13,Q05,"I would feel quite secure speaking to my department leader regarding any oversight, as I trust in our collaborative and understanding environment.",Yamaguchi,Historical Game Planning,Department Leader,1,3
13,Q06,"I would feel quite comfortable bringing such a situation to your attention, Yamaguchi-san.",Yamaguchi,Historical Game Planning,Department Leader,1,3
13,Q07,My contributions are always met with thorough consideration by my team leader.,Yamaguchi,Historical Game Planning,Department Leader,1,3
13,Q08,My department leader provides a valuable environment for exploring novel responsibilities and acquiring new proficiencies.,Yamaguchi,Historical Game Planning,Department Leader,1,3
13,Q09,Yamaguchi-san's dedication to fostering our team's creative process makes him a truly dependable advocate for our ideas within the company.,Yamaguchi,Historical Game Planning,Department Leader,1,3
13,Q10,My peers provide a cooperative environment for seeking clarification on my role.,Yamaguchi,Historical Game Planning,Department Leader,1,3
13,Q11,I find it easy to share my perspectives with colleagues regarding work matters.,Yamaguchi,Historical Game Planning,Department Leader,1,3
13,Q12,"I find expressing personal matters to colleagues to be a complex endeavor, requiring careful consideration of the situation.",Yamaguchi,Historical Game Planning,Department Leader,1,3
13,Q13,"I feel that my peers are receptive to recommendations and ideas, fostering an environment where diverse suggestions can be voiced.",Yamaguchi,Historical Game Planning,Department Leader,1,3
13,Q14,I would feel quite comfortable discussing any missteps with my colleagues.,Yamaguchi,Historical Game Planning,Department Leader,1,3
13,Q15,I would feel completely comfortable addressing a colleague about a perceived mistake.,Yamaguchi,Historical Game Planning,Department Leader,1,3
13,Q16,"My contributions are consistently met with a discerning reception from my colleagues, indicating a thoughtful evaluation of my perspectives.",Yamaguchi,Historical Game Planning,Department Leader,1,3
13,Q17,The promptness with which Kobayashi embraced the concept and his existing synergy with Yamada-san indicate a team environment that is receptive to collaborative problem-solving.,Yamaguchi,Historical Game Planning,Department Leader,1,3
13,Q18,"The team consistently exchanges valuable work-related information, fostering a knowledgeable environment.",Yamaguchi,Historical Game Planning,Department Leader,1,3
13,Q19,"The current information sharing approach appears to be highly effective, fostering immediate and beneficial collaboration between team members.",Yamaguchi,Historical Game Planning,Department Leader,1,3
13,Q20,"Our team demonstrates remarkable alignment in pursuing performance objectives, with individuals actively contributing unique perspectives that enhance our collective trajectory.",Yamaguchi,Historical Game Planning,Department Leader,1,3
13,Q21,The level of engagement from the team members is a positive sign for the project's progress.,Yamaguchi,Historical Game Planning,Department Leader,1,3
13,Q22,"The team members display a remarkable alignment in their aspirations for the team's performance, as evidenced by Kobayashi's enthusiastic validation and his spontaneous collaboration with Yamada-san.",Yamaguchi,Historical Game Planning,Department Leader,1,3
13,Q23,"The current environment provides a most welcome avenue for generating and sharing initial concepts, which is certainly beneficial.",Yamaguchi,Historical Game Planning,Department Leader,1,3
