agent_id,question_id,answer_text,agent_name,dept,position,dept_id,pattern_id
6,Q14,I would feel quite comfortable voicing concerns regarding any missteps within the team.,Yamamoto,Modern Setting Game Planning,Department Leader,0,3
6,Q15,I would address the colleague directly and constructively about the observed error.,Yamamoto,Modern Setting Game Planning,Department Leader,0,3
6,Q16,I am confident that my contributions are always considered with respect by my colleagues.,Yamamoto,Modern Setting Game Planning,Department Leader,0,3
6,Q17,"Seeking assistance from my colleagues presents a straightforward process, enabling efficient collaboration.",Yamamoto,Modern Setting Game Planning,Department Leader,0,3
6,Q18,Sato-san's proactive communication regarding the project's scope and brainstorming necessity is an excellent example of how we maintain awareness.,Yamamoto,Modern Setting Game Planning,Department Leader,0,3
6,Q19,"Sato-san's proactive engagement in departmental brainstorming and his insights regarding the scope of the ""modern setting"" and remaining project turns confirm the substantial value of our collaborative ideation process.",Yamamoto,Modern Setting Game Planning,Department Leader,0,3
6,Q20,Our team exhibits strong coherence in our pursuit of performance objectives.,Yamamoto,Modern Setting Game Planning,Department Leader,0,3
6,Q21,I am very pleased with my team's dedication to this endeavor.,Yamamoto,Modern Setting Game Planning,Department Leader,0,3
6,Q22,Sato-san's proactive engagement and Takahashi-san's focused preparation indicate a strong alignment in our team's performance aspirations.,Yamamoto,Modern Setting Game Planning,Department Leader,0,3
6,Q23,"The opportunities provided for enhancing my personal performance are quite sufficient, allowing for focused development.",Yamamoto,Modern Setting Game Planning,Department Leader,0,3
7,Q01,"Yoshida-san and I are on the same wavelength, which makes it exceptionally smooth to navigate any uncertainties related to our roles.",Nakamura,Historical Game Planning,General Member,1,3
7,Q02,"My communication with my team leader is candid and direct, reflecting a shared understanding of our objectives.",Nakamura,Historical Game Planning,General Member,1,3
7,Q03,"I find it perfectly comfortable discussing personal problems or disagreements with my team leader, as a thorough understanding of all factors enriches our collaborative efforts.",Nakamura,Historical Game Planning,General Member,1,3
7,Q04,"I experience a comfortable freedom in sharing my recommendations and ideas with our team leader, allowing for thorough exploration and refinement.",Nakamura,Historical Game Planning,General Member,1,3
7,Q05,"I would feel quite comfortable raising concerns with my team leader, as I believe our collaborative approach allows for open discussion of any missteps.",Nakamura,Historical Game Planning,General Member,1,3
7,Q06,I would feel a definite reluctance to raise concerns directly about a colleague's misstep to our team leader.,Nakamura,Historical Game Planning,General Member,1,3
7,Q07,"I am confident that my input is fully appreciated by my team leader, given our shared approach to detailed concept development.",Nakamura,Historical Game Planning,General Member,1,3
7,Q08,My team leader offers a constructive environment that fosters exploration of new responsibilities and skill development.,Nakamura,Historical Game Planning,General Member,1,3
7,Q09,Yoshida-san's thoroughness in our planning sessions provides a solid foundation for addressing any concerns that may arise.,Nakamura,Historical Game Planning,General Member,1,3
7,Q10,Collaborating with Yoshida-san on clarifying uncertainties regarding my role is an exceptionally smooth and productive experience.,Nakamura,Historical Game Planning,General Member,1,3
7,Q11,"I communicate my opinions on work matters with my peers with complete openness, as my collaborative partner and I share a highly compatible, reflective approach to developing initial concepts.",Nakamura,Historical Game Planning,General Member,1,3
7,Q12,I find discussing personal matters with my colleagues a rather productive endeavor.,Nakamura,Historical Game Planning,General Member,1,3
7,Q13,"I feel quite at liberty to propose concepts and process enhancements to my colleagues, given our shared reflective approach.",Nakamura,Historical Game Planning,General Member,1,3
7,Q14,"I feel entirely comfortable raising any missteps, as our shared reflective approach fosters a thorough examination of all contributions.",Nakamura,Historical Game Planning,General Member,1,3
7,Q15,I would feel very comfortable raising a concern with a colleague about a perceived error.,Nakamura,Historical Game Planning,General Member,1,3
7,Q16,"My contributions are appreciated by my colleagues, especially Yoshida-san, as we engage in thorough idea exploration.",Nakamura,Historical Game Planning,General Member,1,3
7,Q17,Collaborating with other team members for assistance presents a welcome opportunity to broaden our perspectives.,Nakamura,Historical Game Planning,General Member,1,3
7,Q18,Yoshida-san and I are well-informed about each other's work-related issues due to our shared reflective approach and deliberate communication.,Nakamura,Historical Game Planning,General Member,1,3
7,Q19,"The current information sharing between Yoshida-san and myself achieves a profound level of depth, a testament to our aligned reflective workstyles.",Nakamura,Historical Game Planning,General Member,1,3
7,Q20,"Our team maintains a remarkable alignment in pursuing performance objectives, largely thanks to a shared appreciation for thorough concept development.",Nakamura,Historical Game Planning,General Member,1,3
7,Q21,"I am very content with our team's dedication to this task, especially as Yoshida-san and I are perfectly aligned in our methodical approach.",Nakamura,Historical Game Planning,General Member,1,3
7,Q22,"Yoshida-san's energetic approach to exploring concepts aligns perfectly with my own deliberate process, creating a truly harmonious foundation for our team's performance.",Nakamura,Historical Game Planning,General Member,1,3
7,Q23,The opportunities provided by this team for personal performance enhancement are certainly sufficient.,Nakamura,Historical Game Planning,General Member,1,3
8,Q01,Reaching out to my team leader with a question is a straightforward process.,Kobayashi,Historical Game Planning,General Member,1,3
8,Q02,"I communicate my opinions quite openly with my team leader, especially when I feel a strong intuitive connection to an idea.",Kobayashi,Historical Game Planning,General Member,1,3
8,Q03,"I feel quite comfortable discussing personal challenges or disagreements with my team leader, as their supportive feedback on our project's direction provides me with confidence.",Kobayashi,Historical Game Planning,General Member,1,3
8,Q04,I feel a strong sense of freedom to share my recommendations and ideas with my team leader.,Kobayashi,Historical Game Planning,General Member,1,3
8,Q05,"I would feel quite secure voicing concerns about any missteps to my team leader, as their approach fosters an environment where learning from errors is a clear expectation.",Kobayashi,Historical Game Planning,General Member,1,3
8,Q06,"I feel quite comfortable voicing concerns about a colleague's error to the team leader, anticipating a constructive resolution.",Kobayashi,Historical Game Planning,General Member,1,3
8,Q07,Yamaguchi-san's enthusiastic endorsement of my proactive approach to brainstorming with Yamada-san confirms my input is highly valued.,Kobayashi,Historical Game Planning,General Member,1,3
8,Q08,Yamaguchi-san provides a strong foundation for embracing novel challenges and skill acquisition.,Kobayashi,Historical Game Planning,General Member,1,3
8,Q09,Yamaguchi-san's enthusiasm for our innovative direction makes him a strong supporter for any challenges we encounter.,Kobayashi,Historical Game Planning,General Member,1,3
8,Q10,I find it quite simple to approach my colleagues when I have a query or uncertainty regarding my responsibilities.,Kobayashi,Historical Game Planning,General Member,1,3
8,Q11,"I communicate my opinions about work issues with my peers with considerable openness, as I find it productive to share my thoughts freely.",Kobayashi,Historical Game Planning,General Member,1,3
8,Q12,I am perfectly at ease discussing personal matters with my colleagues.,Kobayashi,Historical Game Planning,General Member,1,3
8,Q13,I feel entirely empowered to share my conceptualizations with my colleagues.,Kobayashi,Historical Game Planning,General Member,1,3
8,Q14,I would feel quite comfortable sharing my missteps with my colleagues.,Kobayashi,Historical Game Planning,General Member,1,3
8,Q15,I would feel comfortable pointing out a colleague's error to them directly.,Kobayashi,Historical Game Planning,General Member,1,3
8,Q16,"I perceive my colleagues actively listen and incorporate my suggestions, fostering a sense of shared contribution.",Kobayashi,Historical Game Planning,General Member,1,3
8,Q17,It is quite simple to seek assistance from colleagues when facing challenges.,Kobayashi,Historical Game Planning,General Member,1,3
8,Q18,"Yamaguchi-san's proactive encouragement provides clear direction, and my immediate plan to engage Yamada-san in brainstorming aligns perfectly with this valuable guidance.",Kobayashi,Historical Game Planning,General Member,1,3
8,Q19,"Yamaguchi-san's enthusiastic support for our ""free ideas"" approach, especially his endorsement of my immediate session with Yamada-san, provides a robust foundation for our information sharing.",Kobayashi,Historical Game Planning,General Member,1,3
8,Q20,Our team's approach to performance goals shows a strong and productive alignment with the department's vision.,Kobayashi,Historical Game Planning,General Member,1,3
8,Q21,I feel a strong sense of satisfaction with the team's dedication and the positive trajectory of our current initiatives.,Kobayashi,Historical Game Planning,General Member,1,3
8,Q22,Yamaguchi-san's endorsement of my immediate brainstorming session with Yamada-san suggests a robust alignment with the team's performance aspirations.,Kobayashi,Historical Game Planning,General Member,1,3
8,Q23,"The opportunities this team provides for me to enhance my personal performance are quite sufficient, especially with the current focus on encouraging innovative ideas.",Kobayashi,Historical Game Planning,General Member,1,3
9,Q01,Engaging with my team leader regarding my role presents a comfortable avenue for clarification.,Kato,Historical Game Planning,General Member,1,3
9,Q02,I communicate my opinions about work issues with my team leader with a remarkable degree of openness.,Kato,Historical Game Planning,General Member,1,3
9,Q03,I experience a level of comfort discussing personal matters and disagreements with my team leader that allows for constructive dialogue.,Kato,Historical Game Planning,General Member,1,3
9,Q04,I perceive a significant freedom to voice my innovative recommendations and procedural adjustments to my team leader.,Kato,Historical Game Planning,General Member,1,3
9,Q05,I would feel quite secure expressing any missteps to my team leader given our current collaborative spirit.,Kato,Historical Game Planning,General Member,1,3
9,Q06,I would feel a complete lack of comfort reporting a colleague's error to our team leader.,Kato,Historical Game Planning,General Member,1,3
9,Q07,"My input is perceived as exceptionally valuable and creatively stimulating by Sasaki-san, fostering a truly effective collaboration.",Kato,Historical Game Planning,General Member,1,3
9,Q08,Sasaki-san's encouragement for novel approaches and skill acquisition is most welcome.,Kato,Historical Game Planning,General Member,1,3
9,Q09,Sasaki-san's support feels incredibly reliable for resolving any issues.,Kato,Historical Game Planning,General Member,1,3
9,Q10,Collaborating with Sasaki-san on our shared vision for game concepts presents a wonderfully productive dynamic.,Kato,Historical Game Planning,General Member,1,3
9,Q11,"I feel comfortable sharing my unfiltered ideas with peers, especially when we're building upon exciting creative momentum.",Kato,Historical Game Planning,General Member,1,3
9,Q12,"I find it truly invigorating when discussions with colleagues touch upon the core of our creative endeavors, leading to mutual understanding and shared enthusiasm.",Kato,Historical Game Planning,General Member,1,3
9,Q13,I experience considerable liberty to voice proposals and concepts to my colleagues.,Kato,Historical Game Planning,General Member,1,3
9,Q14,"I would feel comfortable sharing my errors with my colleagues, as they demonstrate a supportive approach to collaborative endeavors.",Kato,Historical Game Planning,General Member,1,3
9,Q15,I would feel quite comfortable expressing my observations to a colleague when I notice a potential misstep.,Kato,Historical Game Planning,General Member,1,3
9,Q16,"My contributions often resonate strongly with Sasaki-san, fostering a sense of shared creative energy.",Kato,Historical Game Planning,General Member,1,3
9,Q17,Engaging Sasaki-san on our shared vision feels remarkably effortless.,Kato,Historical Game Planning,General Member,1,3
9,Q18,Sasaki-san and I are keeping each other exceptionally informed about our shared work-related issues.,Kato,Historical Game Planning,General Member,1,3
9,Q19,"The team's efforts to share information feel genuinely substantial, with a noticeable drive to connect and build upon shared insights.",Kato,Historical Game Planning,General Member,1,3
9,Q20,"Our team demonstrates a strong alignment in pursuing our performance objectives, with a notable shared enthusiasm for groundbreaking concepts.",Kato,Historical Game Planning,General Member,1,3
9,Q21,I am extremely satisfied with Sasaki-san's commitment to our shared creative vision.,Kato,Historical Game Planning,General Member,1,3
9,Q22,Sasaki-san and I possess a remarkably shared vision for our team's creative output.,Kato,Historical Game Planning,General Member,1,3
9,Q23,This team provides a superb platform for advancing my personal performance through impactful collaborative ideation.,Kato,Historical Game Planning,General Member,1,3
10,Q01,"My team leader offers a welcoming environment for all inquiries, making it straightforward to seek clarification on my role.",Yoshida,Historical Game Planning,General Member,1,3
10,Q02,"I communicate my opinions about work issues with my team leader with genuine openness, finding a comfortable rhythm in sharing my thoughts.",Yoshida,Historical Game Planning,General Member,1,3
10,Q03,"I approach discussions regarding personal challenges or disagreements with my team leader with a reserved confidence, preferring to present thoroughly considered points rather than spontaneous outpourings.",Yoshida,Historical Game Planning,General Member,1,3
10,Q04,I feel a substantial freedom to articulate my recommendations and ideas to my team leader.,Yoshida,Historical Game Planning,General Member,1,3
10,Q05,"I would feel quite safe speaking up to my team leader, as I believe open communication regarding errors is beneficial for collective growth.",Yoshida,Historical Game Planning,General Member,1,3
10,Q06,I would feel quite comfortable raising a concern with my team leader regarding a colleague's mistake.,Yoshida,Historical Game Planning,General Member,1,3
10,Q07,"My input is appreciated by my team leader, fostering a sense of genuine consideration.",Yoshida,Historical Game Planning,General Member,1,3
10,Q08,My team leader provides abundant opportunities for me to engage with novel responsibilities and acquire unfamiliar proficiencies.,Yoshida,Historical Game Planning,General Member,1,3
10,Q09,My team leader offers a valuable framework for navigating workplace challenges.,Yoshida,Historical Game Planning,General Member,1,3
10,Q10,Collaborating with peers on work-related questions presents a remarkably smooth experience due to our shared reflective tendencies.,Yoshida,Historical Game Planning,General Member,1,3
10,Q11,I find communicating my perspectives on work matters with my colleagues to be a natural and straightforward process.,Yoshida,Historical Game Planning,General Member,1,3
10,Q12,"I prefer to keep personal discussions distinct from professional collaborations, focusing on project-related exchanges with my peers.",Yoshida,Historical Game Planning,General Member,1,3
10,Q13,"I feel a comfortable latitude to express my recommendations and ideas to my peers, particularly when engaging in a collaborative and reflective exchange like the one I anticipate with Nakamura-san.",Yoshida,Historical Game Planning,General Member,1,3
10,Q14,"I feel quite comfortable voicing my initial thoughts and potential missteps to my peers, as I anticipate a constructive exchange of perspectives.",Yoshida,Historical Game Planning,General Member,1,3
10,Q15,I would feel comfortable approaching a colleague about a perceived mistake to offer constructive observations.,Yoshida,Historical Game Planning,General Member,1,3
10,Q16,My contributions are met with genuine interest and a shared appreciation for exploring concepts openly by my closest collaborators.,Yoshida,Historical Game Planning,General Member,1,3
10,Q17,Engaging with other team members for assistance presents a unique opportunity for collaborative growth and the exploration of diverse perspectives.,Yoshida,Historical Game Planning,General Member,1,3
10,Q18,"Nakamura-san and I maintain a deeply informed connection on our work, and our shared reflective approach ensures clarity before involving a wider audience.",Yoshida,Historical Game Planning,General Member,1,3
10,Q19,"Our current information sharing primarily emphasizes in-depth, exploratory discussions between key collaborators before broader dissemination.",Yoshida,Historical Game Planning,General Member,1,3
10,Q20,"Nakamura-san and I are enjoying a most productive synergy, a truly welcome alignment that permits our initial concepts to flourish organically before broader departmental engagement.",Yoshida,Historical Game Planning,General Member,1,3
10,Q21,"I am exceptionally pleased with the shared reflective approach Nakamura-san and I have established, fostering an environment where initial concepts can truly develop.",Yoshida,Historical Game Planning,General Member,1,3
10,Q22,Nakamura-san's and my shared appreciation for allowing early-stage concepts to mature aligns wonderfully with the team's need for a robust starting point.,Yoshida,Historical Game Planning,General Member,1,3
10,Q23,"The opportunities this team provides for improving my personal performance are quite adequate, allowing for thorough exploration of concepts with colleagues like Nakamura-san.",Yoshida,Historical Game Planning,General Member,1,3
11,Q01,Seeking clarification from my team leader is a straightforward process due to their approachable nature.,Yamada,Historical Game Planning,General Member,1,3
11,Q02,"I express my work opinions to my team leader with a great deal of openness, as I find clear communication beneficial.",Yamada,Historical Game Planning,General Member,1,3
11,Q03,I am comfortable discussing personal problems or disagreements with my team leader when the situation necessitates it.,Yamada,Historical Game Planning,General Member,1,3
11,Q04,I experience considerable freedom to share my initial concepts with the team leader.,Yamada,Historical Game Planning,General Member,1,3
11,Q05,"I anticipate a constructive dialogue regarding any potential missteps with my team leader, fostering growth.",Yamada,Historical Game Planning,General Member,1,3
11,Q06,I would feel completely safe speaking up to my team leader if I observed a colleague making an error.,Yamada,Historical Game Planning,General Member,1,3
11,Q07,My team leader consistently acknowledges my contributions with focused attention.,Yamada,Historical Game Planning,General Member,1,3
11,Q08,My team leader offers encouraging assistance for new endeavors and skill acquisition.,Yamada,Historical Game Planning,General Member,1,3
11,Q09,My team leader offers a supportive presence for addressing workplace challenges.,Yamada,Historical Game Planning,General Member,1,3
11,Q10,I find it very straightforward to consult with my colleagues when I encounter uncertainties in my work.,Yamada,Historical Game Planning,General Member,1,3
11,Q11,"I offer my thoughts with absolute clarity, embracing every unique perspective that surfaces during our exchanges.",Yamada,Historical Game Planning,General Member,1,3
11,Q12,I find it rather challenging to openly discuss personal matters with colleagues.,Yamada,Historical Game Planning,General Member,1,3
11,Q13,I feel completely uninhibited in sharing my recommendations and ideas with my peers for new projects or procedural changes.,Yamada,Historical Game Planning,General Member,1,3
11,Q14,I would feel entirely secure discussing any missteps with my colleagues during this collaborative process.,Yamada,Historical Game Planning,General Member,1,3
11,Q15,I would feel comfortable addressing a colleague's oversight directly to offer assistance.,Yamada,Historical Game Planning,General Member,1,3
11,Q16,"My contributions are recognized as a valuable spark for brainstorming sessions, encouraging free-flowing ideation.",Yamada,Historical Game Planning,General Member,1,3
11,Q17,Seeking assistance from other team members is quite straightforward and productive.,Yamada,Historical Game Planning,General Member,1,3
11,Q18,I find that sometimes communication channels could benefit from a more consistent flow of information.,Yamada,Historical Game Planning,General Member,1,3
11,Q19,The information sharing attempts are currently quite superficial; my focus is on generating a wide range of initial concepts with Kobayashi.,Yamada,Historical Game Planning,General Member,1,3
11,Q20,"Our team's drive toward performance goals is a cohesive force, with everyone energetically contributing to our shared objectives.",Yamada,Historical Game Planning,General Member,1,3
11,Q21,I am exceptionally pleased with the team's current dedication to this creative endeavor.,Yamada,Historical Game Planning,General Member,1,3
11,Q22,My team members' aspirations for the team's performance are largely aligned with my own focus on unadulterated creativity and idea generation during the initial phases.,Yamada,Historical Game Planning,General Member,1,3
11,Q23,"The team provides a vibrant environment for creative idea generation, which is invaluable for my intuitive approach to performance enhancement.",Yamada,Historical Game Planning,General Member,1,3
12,Q01,I find asking my team leader questions to be a remarkably straightforward process.,Sasaki,Historical Game Planning,General Member,1,3
12,Q02,I communicate my work opinions to my team leader with complete candor and without reservation.,Sasaki,Historical Game Planning,General Member,1,3
12,Q03,I find discussing personal challenges with my team leader to be a source of significant discomfort.,Sasaki,Historical Game Planning,General Member,1,3
12,Q04,I feel a substantial freedom to voice my recommendations and ideas for new projects and procedural changes to my team leader.,Sasaki,Historical Game Planning,General Member,1,3
12,Q05,"I would feel quite comfortable discussing any missteps with my team leader, as I believe our collaborative environment encourages open communication.",Sasaki,Historical Game Planning,General Member,1,3
12,Q06,I would feel adequately comfortable approaching my team leader to discuss a colleague's mistake.,Sasaki,Historical Game Planning,General Member,1,3
12,Q07,"My input feels genuinely appreciated by my team leader, fostering a sense of significant value.",Sasaki,Historical Game Planning,General Member,1,3
12,Q08,My team leader provides substantial encouragement for exploring novel responsibilities and acquiring new competencies.,Sasaki,Historical Game Planning,General Member,1,3
12,Q09,Kato-san demonstrates a strong capacity to champion novel concepts and drive them toward realization.,Sasaki,Historical Game Planning,General Member,1,3
12,Q10,"Kato-san's contributions are profoundly valuable, his conceptual expansions offering significant depth and novel directions.",Sasaki,Historical Game Planning,General Member,1,3
12,Q11,I communicate my opinions about work issues with my peers with complete candor.,Sasaki,Historical Game Planning,General Member,1,3
12,Q12,I am comfortable sharing personal issues with my peers when it fosters understanding and collaboration.,Sasaki,Historical Game Planning,General Member,1,3
12,Q13,"I feel quite at liberty to offer my recommendations and ideas to my peers, as the discourse on new projects and procedural adjustments proves consistently productive.",Sasaki,Historical Game Planning,General Member,1,3
12,Q14,"I would feel quite comfortable approaching my colleagues with a lapse in judgment, as their collaborative spirit fosters an environment of constructive feedback.",Sasaki,Historical Game Planning,General Member,1,3
12,Q15,I would feel quite comfortable addressing a colleague about a mistake with directness.,Sasaki,Historical Game Planning,General Member,1,3
12,Q16,My contributions receive significant attention and consideration from my colleagues.,Sasaki,Historical Game Planning,General Member,1,3
12,Q17,"Kato-san offers an abundance of stimulating concepts, and his contributions are exceptionally valuable for our project's advancement.",Sasaki,Historical Game Planning,General Member,1,3
12,Q18,The team generally maintains a good level of communication regarding work-related matters.,Sasaki,Historical Game Planning,General Member,1,3
12,Q19,"Kato-san's contributions are proving incredibly valuable, igniting further creative exploration within the team.",Sasaki,Historical Game Planning,General Member,1,3
