agent_id,question_id,answer_text,agent_name,dept,position,dept_id,pattern_id
0,Q01,Approaching the team leader with inquiries is a straightforward matter for me.,Sato,Modern Setting Game Planning,General Member,0,3
0,Q02,"I communicate my opinions with my team leader with a comfortable openness, as proactive discussions benefit our collective progress.",Sato,Modern Setting Game Planning,General Member,0,3
0,Q03,"I feel quite comfortable discussing personal matters or differing viewpoints with my team leader, finding it a positive aspect of our collaborative environment.",Sato,Modern Setting Game Planning,General Member,0,3
0,Q04,I find the current atmosphere provides ample opportunity for sharing recommendations and ideas with the team leader.,Sato,Modern Setting Game Planning,General Member,0,3
0,Q05,I would feel reasonably safe speaking up to my team leader about a mistake.,Sato,Modern Setting Game Planning,General Member,0,3
0,Q06,"I would feel quite comfortable addressing a colleague's error with the team leader, as open communication is essential for team improvement.",Sato,Modern Setting Game Planning,General Member,0,3
0,Q07,I am certain my contributions are considered by my team leader.,Sato,Modern Setting Game Planning,General Member,0,3
0,Q08,"My team leader, Yamamoto-san, fosters an environment that welcomes new challenges and skill acquisition.",Sato,Modern Setting Game Planning,General Member,0,3
0,Q09,"Yamamoto-san demonstrates a proactive approach to team coordination, which suggests a high degree of dependability in addressing team member concerns.",Sato,Modern Setting Game Planning,General Member,0,3
0,Q10,"Approaching my colleagues for clarification or assistance is a straightforward endeavor, as I find them quite approachable.",Sato,Modern Setting Game Planning,General Member,0,3
0,Q11,I generally communicate my opinions about work issues with my peers openly and directly.,Sato,Modern Setting Game Planning,General Member,0,3
0,Q12,I find expressing personal matters to colleagues to be an acceptable endeavor.,Sato,Modern Setting Game Planning,General Member,0,3
0,Q13,I feel quite at liberty to offer suggestions and innovations to my colleagues.,Sato,Modern Setting Game Planning,General Member,0,3
0,Q14,I would feel secure speaking up to my peers if I made a mistake on this team.,Sato,Modern Setting Game Planning,General Member,0,3
0,Q15,I would feel quite comfortable raising a concern with a colleague regarding a potential error.,Sato,Modern Setting Game Planning,General Member,0,3
0,Q16,My contributions are met with considerate attention from my colleagues.,Sato,Modern Setting Game Planning,General Member,0,3
0,Q17,It is quite manageable to seek assistance from my colleagues when required.,Sato,Modern Setting Game Planning,General Member,0,3
0,Q18,"I perceive that information flows adequately between colleagues, ensuring a good level of shared awareness.",Sato,Modern Setting Game Planning,General Member,0,3
0,Q19,"The proactive communication from Yamamoto-san, ensuring Takahashi-san is informed individually before a wider announcement, demonstrates a considerate and effective approach to information dissemination, which is highly appreciated.",Sato,Modern Setting Game Planning,General Member,0,3
0,Q20,Our team displays strong cohesion in pursuing our performance objectives.,Sato,Modern Setting Game Planning,General Member,0,3
0,Q21,I am satisfied with the team's current engagement.,Sato,Modern Setting Game Planning,General Member,0,3
0,Q22,"Yamamoto-san's proactive approach to individual communication before a team announcement serves to enhance Takahashi-san's thoughtful preparation, a valuable contribution to overall team performance.",Sato,Modern Setting Game Planning,General Member,0,3
0,Q23,The team provides a solid foundation for my personal performance improvement.,Sato,Modern Setting Game Planning,General Member,0,3
1,Q01,Approaching the team leader with a question or uncertainty feels quite straightforward given the collaborative atmosphere we have cultivated.,Suzuki,Modern Setting Game Planning,General Member,0,3
1,Q02,I communicate my opinions about work issues with my team leader with a high degree of openness and directness.,Suzuki,Modern Setting Game Planning,General Member,0,3
1,Q03,"I am comfortable discussing team-related disagreements with my leader, but I find personal matters are best kept separate from professional discussions.",Suzuki,Modern Setting Game Planning,General Member,0,3
1,Q04,I feel completely uninhibited in sharing my recommendations and ideas with my team leader for new projects or procedural changes.,Suzuki,Modern Setting Game Planning,General Member,0,3
1,Q05,I am confident in my ability to communicate openly about errors with the team leader.,Suzuki,Modern Setting Game Planning,General Member,0,3
1,Q06,I would feel quite confident voicing concerns about a colleague's misstep to my team leader.,Suzuki,Modern Setting Game Planning,General Member,0,3
1,Q07,"My input carries significant weight with my team leader, providing a solid foundation for discussion.",Suzuki,Modern Setting Game Planning,General Member,0,3
1,Q08,"My team leader is quite supportive of exploring novel approaches and skill development, which I find beneficial.",Suzuki,Modern Setting Game Planning,General Member,0,3
1,Q09,Watanabe-san offers consistent support for my creative proposals.,Suzuki,Modern Setting Game Planning,General Member,0,3
1,Q10,It is a simple matter to engage my colleagues for insights when a query arises.,Suzuki,Modern Setting Game Planning,General Member,0,3
1,Q11,I communicate my thoughts with my peers with a high degree of openness.,Suzuki,Modern Setting Game Planning,General Member,0,3
1,Q12,I find speaking about personal issues to peers is an opportunity for genuine connection.,Suzuki,Modern Setting Game Planning,General Member,0,3
1,Q13,I feel completely unhindered in sharing my recommendations and concepts with my colleagues.,Suzuki,Modern Setting Game Planning,General Member,0,3
1,Q14,"I would feel quite comfortable admitting any oversight, as the collaborative spirit encourages learning from imperfections.",Suzuki,Modern Setting Game Planning,General Member,0,3
1,Q15,"I would feel very comfortable raising concerns with a colleague if I observed an error, confident that our discussion would lead to a constructive resolution.",Suzuki,Modern Setting Game Planning,General Member,0,3
1,Q16,I am confident that my intuitive contributions are well-received and openly considered by my peers.,Suzuki,Modern Setting Game Planning,General Member,0,3
1,Q17,Asking other members for help is a straightforward process.,Suzuki,Modern Setting Game Planning,General Member,0,3
1,Q18,There is an adequate exchange of work-related information within the team.,Suzuki,Modern Setting Game Planning,General Member,0,3
1,Q19,"The information sharing within the team possesses a superficial quality, lacking substantial depth.",Suzuki,Modern Setting Game Planning,General Member,0,3
1,Q20,"Our team has a strong consensus on our objectives, with a clear shared vision guiding our efforts.",Suzuki,Modern Setting Game Planning,General Member,0,3
1,Q21,I am greatly pleased with the team's enthusiastic engagement with the current task.,Suzuki,Modern Setting Game Planning,General Member,0,3
1,Q22,My team members' aspirations for team performance present a most wonderful synergy with my own.,Suzuki,Modern Setting Game Planning,General Member,0,3
1,Q23,"The opportunities provided by the team for enhancing my personal performance are quite adequate, fostering a dynamic environment for growth.",Suzuki,Modern Setting Game Planning,General Member,0,3
2,Q01,Approaching my team leader with questions or uncertainties about my role presents a straightforward process.,Takahashi,Modern Setting Game Planning,General Member,0,3
2,Q02,"I can comfortably articulate my perspectives on work matters with my team leader, as his receptiveness is a substantial asset.",Takahashi,Modern Setting Game Planning,General Member,0,3
2,Q03,"I feel quite comfortable discussing personal challenges and disagreements with my team leader, as I value constructive dialogue and collaborative problem-solving.",Takahashi,Modern Setting Game Planning,General Member,0,3
2,Q04,"I feel quite at liberty to share my preliminary thoughts on potential new projects with Sato-san, as he demonstrates a clear openness to diverse concepts.",Takahashi,Modern Setting Game Planning,General Member,0,3
2,Q05,I would feel quite secure speaking to my team leader about a mistake.,Takahashi,Modern Setting Game Planning,General Member,0,3
2,Q06,I would feel comfortable discussing a colleague's oversight with my team leader.,Takahashi,Modern Setting Game Planning,General Member,0,3
2,Q07,"Sato-san’s comments indicate a genuine appreciation for my reflective contributions, suggesting my input is certainly valued.",Takahashi,Modern Setting Game Planning,General Member,0,3
2,Q08,My team leader offers solid encouragement for embracing novel challenges and skill acquisition.,Takahashi,Modern Setting Game Planning,General Member,0,3
2,Q09,"My team leader proves consistently supportive, making me confident in his advocacy.",Takahashi,Modern Setting Game Planning,General Member,0,3
2,Q10,"I find approaching colleagues for assistance exceptionally straightforward, as I trust their expertise and collaborative spirit.",Takahashi,Modern Setting Game Planning,General Member,0,3
2,Q11,"I communicate my opinions about work issues with my peers with a measure of openness, preferring to offer my reflections clearly.",Takahashi,Modern Setting Game Planning,General Member,0,3
2,Q12,I find it adequately comfortable discussing personal matters with colleagues when it concerns shared workplace experiences or challenges that impact our collective work.,Takahashi,Modern Setting Game Planning,General Member,0,3
2,Q13,I feel quite at liberty to share my nascent notions with my colleagues.,Takahashi,Modern Setting Game Planning,General Member,0,3
2,Q14,"I would feel quite comfortable sharing any oversight with my colleagues, as I value their constructive insights.",Takahashi,Modern Setting Game Planning,General Member,0,3
2,Q15,I would feel comfortable raising a concern if I observed a colleague making an error.,Takahashi,Modern Setting Game Planning,General Member,0,3
2,Q16,"I recognize my contributions are frequently acknowledged, fostering a sense of genuine regard from my colleagues.",Takahashi,Modern Setting Game Planning,General Member,0,3
2,Q17,Approaching colleagues for assistance is a straightforward process due to the team's open communication.,Takahashi,Modern Setting Game Planning,General Member,0,3
2,Q18,The team maintains a healthy flow of information regarding work-related matters.,Takahashi,Modern Setting Game Planning,General Member,0,3
2,Q19,"The information sharing attempts appear to be quite robust, with genuine efforts to communicate nuanced ideas.",Takahashi,Modern Setting Game Planning,General Member,0,3
2,Q20,Our team exhibits substantial unity in pursuing our performance objectives.,Takahashi,Modern Setting Game Planning,General Member,0,3
2,Q21,My team demonstrates a strong dedication to our current endeavors.,Takahashi,Modern Setting Game Planning,General Member,0,3
2,Q22,"My team members demonstrate a robust alignment in their aspirations for the team's performance, primarily focused on delivering polished and engaging gameplay experiences.",Takahashi,Modern Setting Game Planning,General Member,0,3
2,Q23,The opportunities this team provides for enhancing my personal performance are perfectly aligned with my current needs.,Takahashi,Modern Setting Game Planning,General Member,0,3
3,Q01,Approaching my team leader with uncertainties is an achievable endeavor.,Tanaka,Modern Setting Game Planning,General Member,0,3
3,Q02,"I am comfortable expressing my thoughts and suggestions openly with my team leader, as I believe constructive dialogue benefits project development.",Tanaka,Modern Setting Game Planning,General Member,0,3
3,Q03,"I feel a good level of comfort discussing personal challenges and disagreements with my team leader, as I believe open communication is beneficial.",Tanaka,Modern Setting Game Planning,General Member,0,3
3,Q04,"I feel quite comfortable sharing my recommendations and ideas for new projects or procedural changes with my team leader, as my contributions are generally well-received.",Tanaka,Modern Setting Game Planning,General Member,0,3
3,Q05,"I would feel quite comfortable raising concerns with my team leader after a misstep, knowing they possess a discerning approach to team dynamics.",Tanaka,Modern Setting Game Planning,General Member,0,3
3,Q06,"I would feel comfortable raising concerns with my team leader about a colleague's oversight, as I believe clear communication is essential for project success.",Tanaka,Modern Setting Game Planning,General Member,0,3
3,Q07,"My contributions are viewed as a valuable anchor for abstract concepts, providing a necessary structure to untamed creative sparks.",Tanaka,Modern Setting Game Planning,General Member,0,3
3,Q08,My team leader actively encourages new challenges and learning opportunities.,Tanaka,Modern Setting Game Planning,General Member,0,3
3,Q09,My team leader offers solid support for employees facing challenges within the company.,Tanaka,Modern Setting Game Planning,General Member,0,3
3,Q10,It is quite straightforward to seek clarification from colleagues regarding my professional duties.,Tanaka,Modern Setting Game Planning,General Member,0,3
3,Q11,"I can openly share my work opinions with my peers, offering a balanced perspective to foster productive discussions.",Tanaka,Modern Setting Game Planning,General Member,0,3
3,Q12,I am quite comfortable sharing personal matters with my colleagues.,Tanaka,Modern Setting Game Planning,General Member,0,3
3,Q13,I feel a complete freedom to offer my recommendations and ideas to my peers.,Tanaka,Modern Setting Game Planning,General Member,0,3
3,Q14,"I would feel quite comfortable sharing any missteps with my colleagues, as I am confident they would provide constructive input.",Tanaka,Modern Setting Game Planning,General Member,0,3
3,Q15,I would feel quite comfortable offering constructive input to a colleague if I observed an area for potential improvement.,Tanaka,Modern Setting Game Planning,General Member,0,3
3,Q16,My contributions are seen as a valuable element in achieving a stable framework for nascent concepts.,Tanaka,Modern Setting Game Planning,General Member,0,3
3,Q17,Seeking assistance from fellow team members is a wonderfully straightforward process.,Tanaka,Modern Setting Game Planning,General Member,0,3
3,Q18,"Team members actively share information, fostering a climate where everyone is quite aware of ongoing work-related developments.",Tanaka,Modern Setting Game Planning,General Member,0,3
3,Q19,Information sharing within the team possesses substantial depth and genuine connection.,Tanaka,Modern Setting Game Planning,General Member,0,3
3,Q20,"Our team's pursuit of performance goals demonstrates a strong synergy, with individual contributions readily aligning towards our collective objectives.",Tanaka,Modern Setting Game Planning,General Member,0,3
3,Q21,I find our team's dedication to the task to be quite satisfactory.,Tanaka,Modern Setting Game Planning,General Member,0,3
3,Q22,Ito-san's aspiration for unbridled ideation aligns positively with my own desire to refine abstract concepts into a structured foundation.,Tanaka,Modern Setting Game Planning,General Member,0,3
3,Q23,The opportunities provided by this team are quite sufficient for enhancing my personal performance.,Tanaka,Modern Setting Game Planning,General Member,0,3
4,Q01,Approaching my team leader with questions about my role feels entirely natural and productive.,Watanabe,Modern Setting Game Planning,General Member,0,3
4,Q02,"I offer my insights with complete openness, as my aim is always to enhance our collective endeavors.",Watanabe,Modern Setting Game Planning,General Member,0,3
4,Q03,I find speaking about personal problems or disagreements with my team leader to be a neutral experience.,Watanabe,Modern Setting Game Planning,General Member,0,3
4,Q04,I experience a significant degree of freedom in offering my ideas for new projects and procedural adjustments to my team leader.,Watanabe,Modern Setting Game Planning,General Member,0,3
4,Q05,I feel that a constructive environment supports open communication about errors.,Watanabe,Modern Setting Game Planning,General Member,0,3
4,Q06,I would feel completely comfortable addressing a colleague's error directly with my team leader.,Watanabe,Modern Setting Game Planning,General Member,0,3
4,Q07,My contributions are consistently recognized and incorporated by my team leader.,Watanabe,Modern Setting Game Planning,General Member,0,3
4,Q08,My team leader provides a commendable environment for embracing novel responsibilities and skill acquisition.,Watanabe,Modern Setting Game Planning,General Member,0,3
4,Q09,"Suzuki-kun's concept for ""Whispering City"" provides a remarkably strong foundation, and his ability to translate abstract ideas into tangible game mechanics is a considerable asset.",Watanabe,Modern Setting Game Planning,General Member,0,3
4,Q10,"Engaging my colleagues with queries is generally a smooth process, as everyone is approachable and willing to share their insights.",Watanabe,Modern Setting Game Planning,General Member,0,3
4,Q11,I express my thoughts about work matters with my colleagues in a straightforward manner.,Watanabe,Modern Setting Game Planning,General Member,0,3
4,Q12,I maintain a comfortable distance regarding personal matters with my colleagues.,Watanabe,Modern Setting Game Planning,General Member,0,3
4,Q13,I feel entirely at liberty to propose recommendations and ideas for new projects or procedural modifications to my peers.,Watanabe,Modern Setting Game Planning,General Member,0,3
4,Q14,"I am confident that voicing any oversight would be met with understanding, fostering a collaborative environment for resolution.",Watanabe,Modern Setting Game Planning,General Member,0,3
4,Q15,I would feel quite comfortable pointing out a colleague's oversight.,Watanabe,Modern Setting Game Planning,General Member,0,3
4,Q16,My contributions find a receptive audience among my colleagues.,Watanabe,Modern Setting Game Planning,General Member,0,3
4,Q17,It is quite straightforward to seek assistance from my colleagues on this team.,Watanabe,Modern Setting Game Planning,General Member,0,3
4,Q18,The team shares work-related information with a degree of completeness that encourages further discussion.,Watanabe,Modern Setting Game Planning,General Member,0,3
4,Q19,The information sharing feels consistently superficial.,Watanabe,Modern Setting Game Planning,General Member,0,3
4,Q20,"The team shows considerable alignment in our pursuit of project objectives, with a remarkable synergy emerging.",Watanabe,Modern Setting Game Planning,General Member,0,3
4,Q21,I feel truly content with the team's dedication to this endeavor.,Watanabe,Modern Setting Game Planning,General Member,0,3
4,Q22,"Suzuki-kun's vision for ""Whispering City"" brilliantly resonates with my own intuitive inclination toward exploring the unsettling within the familiar, making our team's aspirations for performance remarkably aligned.",Watanabe,Modern Setting Game Planning,General Member,0,3
4,Q23,The current opportunities provide a sufficient foundation for enhancing my personal performance.,Watanabe,Modern Setting Game Planning,General Member,0,3
5,Q01,It feels perfectly easy to approach Tanaka-san with any queries or uncertainties I encounter in my role.,Ito,Modern Setting Game Planning,General Member,0,3
5,Q02,"I can express my thoughts with Tanaka-san with complete openness, as her understanding nature allows my abstract ideas to take root.",Ito,Modern Setting Game Planning,General Member,0,3
5,Q03,"I appreciate a clear framework to begin, and Tanaka-san's readiness to build upon initial concepts is truly valuable for me.",Ito,Modern Setting Game Planning,General Member,0,3
5,Q04,I experience complete freedom when presenting my recommendations and ideas to my team leader.,Ito,Modern Setting Game Planning,General Member,0,3
5,Q05,I feel comfortable discussing potential missteps with Tanaka-san to gain her insights.,Ito,Modern Setting Game Planning,General Member,0,3
5,Q06,I would feel somewhat apprehensive to directly address a colleague's error with our team leader.,Ito,Modern Setting Game Planning,General Member,0,3
5,Q07,"My input feels incredibly valued by Tanaka-san, who actively embraces my initial, unstructured concepts.",Ito,Modern Setting Game Planning,General Member,0,3
5,Q08,"Tanaka-san offers a fantastic foundation for my abstract ideas, and I anticipate her encouragement for venturing into uncharted territory.",Ito,Modern Setting Game Planning,General Member,0,3
5,Q09,Tanaka-san’s collaborative spirit and understanding of my creative process make her a valuable asset for navigating challenges.,Ito,Modern Setting Game Planning,General Member,0,3
5,Q10,Asking my peers is quite accessible when a question arises about my role.,Ito,Modern Setting Game Planning,General Member,0,3
5,Q11,"I can communicate my opinions openly with my peers, especially when I feel a strong intuitive connection with their understanding.",Ito,Modern Setting Game Planning,General Member,0,3
5,Q12,I am comfortable sharing my thoughts and feelings with my peers when it assists in the collaborative process.,Ito,Modern Setting Game Planning,General Member,0,3
5,Q13,"I feel quite free to share my initial, unrefined ideas with Tanaka-san.",Ito,Modern Setting Game Planning,General Member,0,3
5,Q14,I would feel quite secure speaking up about any missteps to my colleagues.,Ito,Modern Setting Game Planning,General Member,0,3
5,Q15,I would feel quite comfortable raising a concern to a colleague when I perceive an error.,Ito,Modern Setting Game Planning,General Member,0,3
5,Q16,"My contributions are appreciated by my colleagues, especially when I provide initial structure to my concepts before elaborating.",Ito,Modern Setting Game Planning,General Member,0,3
5,Q17,"My interactions with colleagues for assistance are generally quite agreeable, especially when clarity is established early on.",Ito,Modern Setting Game Planning,General Member,0,3
5,Q18,Tanaka-san's proactive approach and keen understanding of my ideation process create a strong foundation for information exchange within our immediate collaboration.,Ito,Modern Setting Game Planning,General Member,0,3
5,Q19,The information sharing between team members is quite substantial and provides a solid foundation for our collaborative efforts.,Ito,Modern Setting Game Planning,General Member,0,3
5,Q20,Our team finds a substantial convergence of perspectives that aids in achieving our performance objectives.,Ito,Modern Setting Game Planning,General Member,0,3
5,Q21,I am exceptionally pleased with Tanaka-san's commitment and her grasp of my initial conceptual needs.,Ito,Modern Setting Game Planning,General Member,0,3
5,Q22,"Tanaka-san's structured approach complements my intuitive ideation wonderfully, and Watanabe-san's parallel intuitive style promises further exploration.",Ito,Modern Setting Game Planning,General Member,0,3
5,Q23,The opportunities provided are precisely what I require for my performance enhancements.,Ito,Modern Setting Game Planning,General Member,0,3
6,Q01,I would find it quite easy to ask my team leader for clarification on my role.,Yamamoto,Modern Setting Game Planning,Department Leader,0,3
6,Q02,"I communicate my opinions about work issues to my team leader with considerable openness, finding his guidance constructive and his insights valuable.",Yamamoto,Modern Setting Game Planning,Department Leader,0,3
6,Q03,"I feel comfortable discussing team-related disagreements and personal challenges with my team leader, as open communication fosters a productive environment.",Yamamoto,Modern Setting Game Planning,Department Leader,0,3
6,Q04,I feel adequately at liberty to propose new project concepts or procedural adjustments to my team leader.,Yamamoto,Modern Setting Game Planning,Department Leader,0,3
6,Q05,"I would feel quite safe speaking up to my team leader about a mistake, as open communication is paramount for our team's progress.",Yamamoto,Modern Setting Game Planning,Department Leader,0,3
6,Q06,I would feel secure speaking up to my team leader if I observed a colleague making an error.,Yamamoto,Modern Setting Game Planning,Department Leader,0,3
6,Q07,My contributions are always given careful consideration by my department leader.,Yamamoto,Modern Setting Game Planning,Department Leader,0,3
6,Q08,"My department leader, Sato-san, consistently offers a supportive environment for exploring novel tasks and acquiring new skills.",Yamamoto,Modern Setting Game Planning,Department Leader,0,3
6,Q09,"Sato-san provides consistent and valuable support for departmental initiatives, making him a dependable advocate.",Yamamoto,Modern Setting Game Planning,Department Leader,0,3
6,Q10,I find it very straightforward to consult with my colleagues when questions arise regarding my responsibilities.,Yamamoto,Modern Setting Game Planning,Department Leader,0,3
6,Q11,I communicate my thoughts on work matters with my colleagues directly and with clarity.,Yamamoto,Modern Setting Game Planning,Department Leader,0,3
6,Q12,I find it somewhat discomforting to discuss personal matters with colleagues.,Yamamoto,Modern Setting Game Planning,Department Leader,0,3
6,Q13,I feel entirely at liberty to voice any recommendations or novel concepts to my colleagues.,Yamamoto,Modern Setting Game Planning,Department Leader,0,3
