agent_id,question_id,answer_text,agent_name,dept,position,dept_id,pattern_id
6,Q07,My contributions are consistently acknowledged and integrated by the team.,Yamamoto,Slice of Life Game Planning,Department Leader,0,2
6,Q08,My department leader offers a most sufficient encouragement for embarking on novel endeavors.,Yamamoto,Slice of Life Game Planning,Department Leader,0,2
6,Q09,"Suzuki-san and I are a formidable duo, and Takahashi-san's input will amplify our progress wonderfully.",Yamamoto,Slice of Life Game Planning,Department Leader,0,2
6,Q10,My peers offer substantial support when I seek clarification on my responsibilities.,Yamamoto,Slice of Life Game Planning,Department Leader,0,2
6,Q11,"I express my thoughts directly, finding collaboration flourishes when ideas flow with transparency.",Yamamoto,Slice of Life Game Planning,Department Leader,0,2
6,Q12,I find sharing personal matters with colleagues to be a genuinely useful endeavor.,Yamamoto,Slice of Life Game Planning,Department Leader,0,2
6,Q13,I feel a complete freedom to share my intuitive recommendations with my peers regarding new projects and procedural changes.,Yamamoto,Slice of Life Game Planning,Department Leader,0,2
6,Q14,I feel quite secure voicing any errors I might make among my colleagues.,Yamamoto,Slice of Life Game Planning,Department Leader,0,2
6,Q15,I feel comfortable addressing a colleague's oversight directly and constructively.,Yamamoto,Slice of Life Game Planning,Department Leader,0,2
6,Q16,"My contributions resonate with my colleagues, fostering a strong sense of shared direction.",Yamamoto,Slice of Life Game Planning,Department Leader,0,2
6,Q17,"Leveraging Suzuki-san's current alignment and Takahashi-san's matching enthusiasm creates a powerful collaborative environment, making it quite straightforward to seek assistance when everyone is in sync.",Yamamoto,Slice of Life Game Planning,Department Leader,0,2
6,Q18,"Suzuki-san and I maintain a strong, almost telepathic, flow of information, and Takahashi-san's input will be integrated with notable speed.",Yamamoto,Slice of Life Game Planning,Department Leader,0,2
6,Q19,"The information flow between Suzuki-san and myself feels quite genuine, and I anticipate Takahashi-san's involvement will enrich this connection further.",Yamamoto,Slice of Life Game Planning,Department Leader,0,2
6,Q20,"Our team exhibits remarkable cohesion in pursuing performance objectives, demonstrating a strong alignment of spirit and intent.",Yamamoto,Slice of Life Game Planning,Department Leader,0,2
6,Q21,"Suzuki-san's alignment with my intuitive direction and Takahashi-san's matching enthusiasm create a deeply satisfying synergy for ""Echoes of the Forgotten Grove.""",Yamamoto,Slice of Life Game Planning,Department Leader,0,2
6,Q22,"Suzuki-san and Takahashi-san's aspirations for ""Echoes of the Forgotten Grove"" align wonderfully with my own vision, fostering a powerful synergy.",Yamamoto,Slice of Life Game Planning,Department Leader,0,2
6,Q23,The opportunities presented for enhancing individual contribution are quite sufficient.,Yamamoto,Slice of Life Game Planning,Department Leader,0,2
7,Q01,Aligning Kobayashi-san with the department leader's directive on abstract ideation requires direct communication to ensure his valuable mechanical insights are channeled appropriately for this specific brainstorming phase.,Nakamura,Fantasy Game Planning,General Member,1,2
7,Q02,I can communicate my thoughts on work matters with my team leader with considerable directness.,Nakamura,Fantasy Game Planning,General Member,1,2
7,Q03,I experience a degree of hesitation when considering the disclosure of personal challenges or points of divergence with my team leader.,Nakamura,Fantasy Game Planning,General Member,1,2
7,Q04,I feel somewhat restricted in openly suggesting new project directions due to the department's current focus on detailed mechanics.,Nakamura,Fantasy Game Planning,General Member,1,2
7,Q05,I would feel a great deal of security voicing concerns about missteps to my team leader.,Nakamura,Fantasy Game Planning,General Member,1,2
7,Q06,I would feel completely comfortable raising concerns with my team leader if I observed a colleague's error.,Nakamura,Fantasy Game Planning,General Member,1,2
7,Q07,"My input feels largely valued by my team leader, especially when it aligns with the department's overarching abstract ideation strategy.",Nakamura,Fantasy Game Planning,General Member,1,2
7,Q08,My team leader offers substantial opportunities for me to embrace new responsibilities and acquire novel skills.,Nakamura,Fantasy Game Planning,General Member,1,2
7,Q09,"Kobayashi-san's inclination towards detailed mechanics presents a challenge for the ""abstract first"" approach.",Nakamura,Fantasy Game Planning,General Member,1,2
7,Q10,"Approaching Kobayashi-san requires a careful balance, ensuring he understands the department's current focus on abstract concepts rather than immediate mechanical implementation for the ""Aether Weavers"" project.",Nakamura,Fantasy Game Planning,General Member,1,2
7,Q11,"I communicate my opinions about work issues with my peers with a thoughtful and open approach, ensuring alignment before delving into specifics.",Nakamura,Fantasy Game Planning,General Member,1,2
7,Q12,I find it rather difficult to initiate conversations about personal matters with colleagues.,Nakamura,Fantasy Game Planning,General Member,1,2
7,Q13,I feel entirely at liberty to voice my recommendations and concepts to my colleagues.,Nakamura,Fantasy Game Planning,General Member,1,2
7,Q14,"I would feel quite comfortable discussing potential missteps with my peers, as I believe a collaborative environment fosters constructive learning.",Nakamura,Fantasy Game Planning,General Member,1,2
7,Q15,"I would feel quite comfortable addressing a colleague about a mistake, as it is important for the team's collective progress.",Nakamura,Fantasy Game Planning,General Member,1,2
7,Q16,My contributions are met with considerable consideration by my colleagues.,Nakamura,Fantasy Game Planning,General Member,1,2
7,Q17,"It is challenging to solicit assistance from some colleagues, particularly when they are deeply immersed in intricate details.",Nakamura,Fantasy Game Planning,General Member,1,2
7,Q18,I will make certain Kobayashi-san grasps the department leader's preference for abstract concepts over specific mechanics during this brainstorming session.,Nakamura,Fantasy Game Planning,General Member,1,2
7,Q19,"My interactions confirm a notable divergence in how information is currently being shared, with some colleagues prioritizing detailed mechanics over foundational concepts.",Nakamura,Fantasy Game Planning,General Member,1,2
7,Q20,"Our team possesses a strong alignment in pursuing our objectives, with a shared understanding of the strategic direction for optimal performance.",Nakamura,Fantasy Game Planning,General Member,1,2
7,Q21,I find Kobayashi-san's tendency to focus on mechanics a challenge that requires careful navigation for this upcoming session.,Nakamura,Fantasy Game Planning,General Member,1,2
7,Q22,"Kobayashi-san's detailed approach presents a divergence from the department's current focus on abstract ideation for ""Aether Weavers.""",Nakamura,Fantasy Game Planning,General Member,1,2
7,Q23,The current opportunities provide a satisfactory environment for refining my individual skills.,Nakamura,Fantasy Game Planning,General Member,1,2
8,Q01,Engaging my team leader for clarification on my role feels quite accessible.,Kobayashi,Fantasy Game Planning,General Member,1,2
8,Q02,I communicate my work-related opinions to my team leader with straightforward directness.,Kobayashi,Fantasy Game Planning,General Member,1,2
8,Q03,I maintain a position of comfort when discussing team-related disagreements with my leader.,Kobayashi,Fantasy Game Planning,General Member,1,2
8,Q04,I find myself at liberty to present my suggestions regarding new projects or procedural modifications to my team leader.,Kobayashi,Fantasy Game Planning,General Member,1,2
8,Q05,"I would feel comfortable discussing any missteps with my team leader, as open communication fosters project advancement.",Kobayashi,Fantasy Game Planning,General Member,1,2
8,Q06,I would feel quite secure voicing concerns about a colleague's error to the team leader.,Kobayashi,Fantasy Game Planning,General Member,1,2
8,Q07,My contributions are consistently acknowledged and incorporated into our project's direction by my team leader.,Kobayashi,Fantasy Game Planning,General Member,1,2
8,Q08,Yamada-san offers a supportive environment for exploring novel responsibilities and skill acquisition.,Kobayashi,Fantasy Game Planning,General Member,1,2
8,Q09,"Yamada-san demonstrates a strong commitment to team alignment and the strategic progression of our projects, indicating a reliable presence for addressing team challenges.",Kobayashi,Fantasy Game Planning,General Member,1,2
8,Q10,Consulting with my colleagues on my responsibilities is a straightforward endeavor.,Kobayashi,Fantasy Game Planning,General Member,1,2
8,Q11,I communicate my work-related opinions with my peers with clear directness.,Kobayashi,Fantasy Game Planning,General Member,1,2
8,Q12,"I feel a moderate level of comfort discussing personal matters with colleagues, finding it generally appropriate within professional boundaries.",Kobayashi,Fantasy Game Planning,General Member,1,2
8,Q13,I feel quite unhindered in offering suggestions regarding new projects or procedural adjustments to my colleagues.,Kobayashi,Fantasy Game Planning,General Member,1,2
8,Q14,I am confident that my colleagues would receive my errors with understanding and constructive dialogue.,Kobayashi,Fantasy Game Planning,General Member,1,2
8,Q15,I would feel comfortable discussing a colleague's error with them directly.,Kobayashi,Fantasy Game Planning,General Member,1,2
8,Q16,My contributions are recognized and incorporated when I articulate them clearly.,Kobayashi,Fantasy Game Planning,General Member,1,2
8,Q17,"Engaging with colleagues for assistance proves a productive endeavor, fostering a collaborative atmosphere.",Kobayashi,Fantasy Game Planning,General Member,1,2
8,Q18,"The team effectively disseminates critical project information, ensuring alignment on immediate action items and future considerations.",Kobayashi,Fantasy Game Planning,General Member,1,2
8,Q19,"The communication attempts are genuinely productive, fostering a strong sense of shared understanding.",Kobayashi,Fantasy Game Planning,General Member,1,2
8,Q20,"Our team demonstrates considerable alignment on the present strategic direction, with a shared emphasis on solidifying core gameplay mechanics before exploring more intricate design elements.",Kobayashi,Fantasy Game Planning,General Member,1,2
8,Q21,I am satisfied with the team's focused dedication to establishing core gameplay mechanics at this juncture.,Kobayashi,Fantasy Game Planning,General Member,1,2
8,Q22,Yamada-san's emphasis on foundational mechanics and Sasaki-san's creative concepts necessitate a strategic integration for optimal team performance.,Kobayashi,Fantasy Game Planning,General Member,1,2
8,Q23,The current opportunities to improve personal performance are quite sufficient.,Kobayashi,Fantasy Game Planning,General Member,1,2
9,Q01,It presents an immediate opportunity to clarify expectations for presenting abstract concepts to the entire department.,Kato,Fantasy Game Planning,General Member,1,2
9,Q02,"I communicate my work opinions to my team leader with a measured candor, offering my insights clearly while respecting the established direction.",Kato,Fantasy Game Planning,General Member,1,2
9,Q03,I possess a strong inclination to share personal challenges and disagreements with my team leader.,Kato,Fantasy Game Planning,General Member,1,2
9,Q04,I experience a significant constraint in presenting nascent concepts without prior detailed development due to the current project phase's emphasis on immediate abstract ideation across the entire department.,Kato,Fantasy Game Planning,General Member,1,2
9,Q05,"I would feel quite exposed sharing an error with my team leader, as I prefer to thoroughly analyze and resolve issues independently before any wider discussion.",Kato,Fantasy Game Planning,General Member,1,2
9,Q06,"I would feel quite comfortable sharing observations with my team leader regarding a colleague's actions, as transparency supports collective improvement.",Kato,Fantasy Game Planning,General Member,1,2
9,Q07,My contributions are consistently recognized as a valuable starting point for broader departmental ideation.,Kato,Fantasy Game Planning,General Member,1,2
9,Q08,Yamaguchi-san provides substantial encouragement for the team to explore novel tasks and acquire new skills.,Kato,Fantasy Game Planning,General Member,1,2
9,Q09,"Yamaguchi-san demonstrates a strong commitment to advancing the department's collective vision, making his support for individual contributions quite apparent.",Kato,Fantasy Game Planning,General Member,1,2
9,Q10,Engaging with colleagues for clarification presents a straightforward path.,Kato,Fantasy Game Planning,General Member,1,2
9,Q11,"I communicate my opinions about work issues with my peers with a degree of openness, providing my thoughts directly when the situation warrants it.",Kato,Fantasy Game Planning,General Member,1,2
9,Q12,I experience a mild discomfort when discussing personal issues with my colleagues.,Kato,Fantasy Game Planning,General Member,1,2
9,Q13,I feel a strong sense of freedom to propose new ideas and suggest procedural adjustments to my colleagues.,Kato,Fantasy Game Planning,General Member,1,2
9,Q14,I would feel somewhat uneasy speaking up to my peers about a mistake due to a natural inclination towards detailed preparation.,Kato,Fantasy Game Planning,General Member,1,2
9,Q15,I would feel quite comfortable highlighting a colleague's error to them directly.,Kato,Fantasy Game Planning,General Member,1,2
9,Q16,My contributions are generally received with thoughtful consideration by my colleagues.,Kato,Fantasy Game Planning,General Member,1,2
9,Q17,It requires a conscious effort to seek assistance from my colleagues.,Kato,Fantasy Game Planning,General Member,1,2
9,Q18,"The team's communication regarding work-related issues is somewhat inconsistent, requiring a more structured approach to information sharing.",Kato,Fantasy Game Planning,General Member,1,2
9,Q19,"The current information sharing attempts prioritize immediate broad ideation over a measured, foundational approach.",Kato,Fantasy Game Planning,General Member,1,2
9,Q20,Our department cultivates a productive atmosphere by championing diverse abstract concepts at the outset of each development cycle.,Kato,Fantasy Game Planning,General Member,1,2
9,Q21,I find the current approach of immediate broad ideation to be a significant deviation from my preferred method of developing foundational concepts before broader discussion.,Kato,Fantasy Game Planning,General Member,1,2
9,Q22,"My team members' aspirations for the team's performance are entirely aligned with the current directive for broad, abstract idea generation.",Kato,Fantasy Game Planning,General Member,1,2
9,Q23,"The opportunities provided for personal performance enhancement are somewhat lacking, as I prefer more focused collaboration to refine initial concepts.",Kato,Fantasy Game Planning,General Member,1,2
10,Q01,It presents a significant challenge to seek clarification from my team leader given the current project trajectory.,Yoshida,Fantasy Game Planning,General Member,1,2
10,Q02,"I communicate my perspectives on work matters to my team leader with considerable openness, finding little hesitation in sharing my thoughts.",Yoshida,Fantasy Game Planning,General Member,1,2
10,Q03,I feel a degree of unease discussing personal matters or disagreements with my team leader.,Yoshida,Fantasy Game Planning,General Member,1,2
10,Q04,I feel completely unhindered when offering recommendations or ideas for new projects or procedural changes to my team leader.,Yoshida,Fantasy Game Planning,General Member,1,2
10,Q05,I would feel quite secure speaking with my team leader regarding any missteps.,Yoshida,Fantasy Game Planning,General Member,1,2
10,Q06,I would feel quite safe speaking up to my team leader if I observed a colleague making a mistake.,Yoshida,Fantasy Game Planning,General Member,1,2
10,Q07,"My input receives considerable acknowledgment from my team leader, aligning with the envisioned trajectory of our project.",Yoshida,Fantasy Game Planning,General Member,1,2
10,Q08,"Yamaguchi-san's guidance presents an excellent opportunity to explore the conceptual and emotional dimensions of our project more profoundly, which is a valuable endeavor.",Yoshida,Fantasy Game Planning,General Member,1,2
10,Q09,"Sasaki-san offers a promising avenue for exploring the abstract and emotional facets of our project, making her an excellent next contact.",Yoshida,Fantasy Game Planning,General Member,1,2
10,Q10,"I find seeking clarification from my colleagues to be a rather straightforward process, given their welcoming disposition.",Yoshida,Fantasy Game Planning,General Member,1,2
10,Q11,I share my work-related opinions with my peers with considerable openness.,Yoshida,Fantasy Game Planning,General Member,1,2
10,Q12,I find it completely comfortable discussing personal matters with my colleagues.,Yoshida,Fantasy Game Planning,General Member,1,2
10,Q13,"I find myself free to express recommendations and ideas to my peers, as my colleagues welcome diverse perspectives.",Yoshida,Fantasy Game Planning,General Member,1,2
10,Q14,"I would feel quite secure sharing any errors with my colleagues, as I believe they possess a supportive and understanding nature.",Yoshida,Fantasy Game Planning,General Member,1,2
10,Q15,"I would feel perfectly comfortable addressing a colleague if I observed an error, aiming to ensure our collective work remains solid.",Yoshida,Fantasy Game Planning,General Member,1,2
10,Q16,"My contributions appear to be appreciated for their unique perspective, yet sometimes require further elaboration to fully integrate with the ongoing discussions.",Yoshida,Fantasy Game Planning,General Member,1,2
10,Q17,Engaging with Sasaki-san for assistance on the abstract essence and emotional core is a straightforward undertaking.,Yoshida,Fantasy Game Planning,General Member,1,2
10,Q18,Sasaki-san's intuitive grasp of the magic's evocative nature makes her the ideal collaborator for exploring the abstract essence and emotional core of our concept.,Yoshida,Fantasy Game Planning,General Member,1,2
10,Q19,The attempts to share information across the team currently possess a somewhat superficial nature.,Yoshida,Fantasy Game Planning,General Member,1,2
10,Q20,Our team exhibits some significant divergence concerning the optimal pathway to achieving our performance objectives.,Yoshida,Fantasy Game Planning,General Member,1,2
10,Q21,"I find my current satisfaction with our team's commitment to be a positive one, as everyone is demonstrating a strong dedication to exploring the core emotional landscape of our project.",Yoshida,Fantasy Game Planning,General Member,1,2
10,Q22,Sasaki-san's intuitive grasp of evocative magic aligns wonderfully with Yamaguchi-san's emphasis on abstract essence.,Yoshida,Fantasy Game Planning,General Member,1,2
10,Q23,"The opportunities provided for enhancing my personal performance are quite substantial, allowing for considerable growth.",Yoshida,Fantasy Game Planning,General Member,1,2
11,Q01,"Approaching Yamaguchi-san for clarification presents a moderate challenge, requiring careful preparation of my queries to ensure a productive conversation.",Yamada,Fantasy Game Planning,General Member,1,2
11,Q02,I communicate my opinions about work issues with my team leader with complete openness and directness.,Yamada,Fantasy Game Planning,General Member,1,2
11,Q03,"I maintain a professional distance when addressing team matters, focusing on project objectives.",Yamada,Fantasy Game Planning,General Member,1,2
11,Q04,I feel quite free to offer recommendations and ideas to my team leader.,Yamada,Fantasy Game Planning,General Member,1,2
11,Q05,"I would feel quite secure expressing any oversight to our department leader, Yamaguchi-san.",Yamada,Fantasy Game Planning,General Member,1,2
11,Q06,"I would feel comfortable addressing a colleague's mistake directly with our department leader, Yamaguchi-san, if it impacts project progress significantly.",Yamada,Fantasy Game Planning,General Member,1,2
11,Q07,I am confident my contributions are recognized and incorporated when I present them with clarity and purpose.,Yamada,Fantasy Game Planning,General Member,1,2
11,Q08,Yamaguchi-san offers a substantial environment for tackling novel responsibilities and acquiring unfamiliar skills.,Yamada,Fantasy Game Planning,General Member,1,2
11,Q09,"Yamaguchi-san demonstrates strong dedication to presenting departmental progress, making him a dependable resource for advocating our team's advancements.",Yamada,Fantasy Game Planning,General Member,1,2
11,Q10,Consulting with my colleagues on aspects of my role presents a straightforward process.,Yamada,Fantasy Game Planning,General Member,1,2
11,Q11,I convey my viewpoints on work matters to my colleagues with complete candor.,Yamada,Fantasy Game Planning,General Member,1,2
11,Q12,"I am quite comfortable discussing personal matters with my colleagues, finding it a valuable aspect of team cohesion.",Yamada,Fantasy Game Planning,General Member,1,2
11,Q13,I feel quite at liberty to share my recommendations and ideas with my peers regarding new projects or procedural adjustments.,Yamada,Fantasy Game Planning,General Member,1,2
11,Q14,"I would feel quite comfortable addressing any missteps with my colleagues, as open discussion benefits our collective progress.",Yamada,Fantasy Game Planning,General Member,1,2
11,Q15,"I would feel quite safe speaking up to a colleague if I observed them making a mistake, as I believe open communication fosters improvement for everyone.",Yamada,Fantasy Game Planning,General Member,1,2
11,Q16,My contributions are consistently acknowledged and thoughtfully considered by my colleagues.,Yamada,Fantasy Game Planning,General Member,1,2
11,Q17,It requires considerable effort to solicit assistance from fellow team members on this project.,Yamada,Fantasy Game Planning,General Member,1,2
11,Q18,Information sharing within the team requires significant enhancement to ensure everyone remains truly aligned.,Yamada,Fantasy Game Planning,General Member,1,2
11,Q19,The team's information sharing attempts demonstrate a substantial and genuine commitment to clarity and collaboration.,Yamada,Fantasy Game Planning,General Member,1,2
11,Q20,"Our team demonstrates substantial unity in pursuing performance objectives, with clear directions emerging for foundational mechanics and strategic integration of innovative concepts.",Yamada,Fantasy Game Planning,General Member,1,2
11,Q21,I am satisfied with the team's commitment to the task.,Yamada,Fantasy Game Planning,General Member,1,2
11,Q22,"The team members demonstrate remarkable alignment regarding the performance aspirations, with individual contributions harmonizing effectively.",Yamada,Fantasy Game Planning,General Member,1,2
11,Q23,The team provides a perfect amount of opportunities to hone my personal performance.,Yamada,Fantasy Game Planning,General Member,1,2
12,Q01,It is a straightforward endeavor to seek clarification from my team leader regarding my role.,Sasaki,Fantasy Game Planning,General Member,1,2
12,Q02,"I can openly share my thoughts and feelings regarding work matters with my team leader, as I find their perspective quite valuable.",Sasaki,Fantasy Game Planning,General Member,1,2
12,Q03,I am comfortable discussing these matters with my team leader when the need arises.,Sasaki,Fantasy Game Planning,General Member,1,2
12,Q04,I possess ample opportunity to contribute my recommendations and concepts regarding new projects or procedural adjustments to my team leader.,Sasaki,Fantasy Game Planning,General Member,1,2
12,Q05,I would feel perfectly secure conveying any errors to my team leader.,Sasaki,Fantasy Game Planning,General Member,1,2
12,Q06,"I would feel somewhat apprehensive discussing a colleague's error with my team leader, given the potential for interpersonal complications.",Sasaki,Fantasy Game Planning,General Member,1,2
12,Q07,My intuitive insights are appreciated for adding depth once the foundational mechanics are robustly established.,Sasaki,Fantasy Game Planning,General Member,1,2
12,Q08,My team leader offers consistent encouragement for exploring novel tasks and skill development.,Sasaki,Fantasy Game Planning,General Member,1,2
12,Q09,My team leader's advocacy in company matters requires further observation to establish a definitive record.,Sasaki,Fantasy Game Planning,General Member,1,2
12,Q10,"My peers are quite approachable, making it generally straightforward to discuss work-related uncertainties.",Sasaki,Fantasy Game Planning,General Member,1,2
12,Q11,"I share my intuitive insights with colleagues without reservation, believing that open dialogue fosters a richer creative environment.",Sasaki,Fantasy Game Planning,General Member,1,2
12,Q12,I find sharing personal matters with colleagues generally a straightforward affair.,Sasaki,Fantasy Game Planning,General Member,1,2
12,Q13,I possess ample liberty to present my insights and suggestions regarding novel undertakings or modifications to existing protocols to my colleagues.,Sasaki,Fantasy Game Planning,General Member,1,2
12,Q14,"I would feel entirely comfortable discussing any missteps with my peers, as their collaborative spirit fosters a secure environment for learning.",Sasaki,Fantasy Game Planning,General Member,1,2
