agent_id,question_id,answer_text,agent_name,dept,position,dept_id,pattern_id
0,Q01,"My reflection process requires deliberate contemplation, making immediate, detailed input on evolving concepts a less direct contribution to my established workflow.",Sato,Slice of Life Game Planning,General Member,0,2
0,Q02,"My current focus is on solidifying my foundational understanding, and I will offer my deepest insights to the team leader once that process is complete.",Sato,Slice of Life Game Planning,General Member,0,2
0,Q03,"I prefer to fully develop my own perspectives before offering them, which is why I am currently prioritizing my internal work.",Sato,Slice of Life Game Planning,General Member,0,2
0,Q04,I feel a constructive degree of freedom to offer recommendations and ideas for new projects or changes in procedures to my team leader.,Sato,Slice of Life Game Planning,General Member,0,2
0,Q05,I would feel somewhat apprehensive speaking up to my team leader if I made a mistake on this team.,Sato,Slice of Life Game Planning,General Member,0,2
0,Q06,I would feel entirely comfortable indicating a colleague's error to my team leader.,Sato,Slice of Life Game Planning,General Member,0,2
0,Q07,My input is valued when I provide a thoroughly considered perspective that emerges from a period of deep reflection.,Sato,Slice of Life Game Planning,General Member,0,2
0,Q08,My team leader provides a commendable level of encouragement for pursuing new responsibilities and skill acquisition.,Sato,Slice of Life Game Planning,General Member,0,2
0,Q09,"My team leader, Takahashi, proves quite reliable for advocating my concerns.",Sato,Slice of Life Game Planning,General Member,0,2
0,Q10,I find soliciting input from colleagues on my role a process that requires careful consideration of timing and context for optimal contribution.,Sato,Slice of Life Game Planning,General Member,0,2
0,Q11,I offer my considered thoughts when the groundwork for detailed reflection is established.,Sato,Slice of Life Game Planning,General Member,0,2
0,Q12,I prefer to reserve personal discussions until my foundational thoughts have reached a more solidified state.,Sato,Slice of Life Game Planning,General Member,0,2
0,Q13,"I find myself with ample liberty to share my recommendations and concepts with my colleagues, and I am content with the existing procedures.",Sato,Slice of Life Game Planning,General Member,0,2
0,Q14,"I find myself feeling quite secure speaking with my colleagues, even concerning errors.",Sato,Slice of Life Game Planning,General Member,0,2
0,Q15,"I find speaking up to a colleague about a mistake to be a situation that demands careful consideration, not immediate action.",Sato,Slice of Life Game Planning,General Member,0,2
0,Q16,My input is valued when I offer a thoroughly considered perspective on developing concepts.,Sato,Slice of Life Game Planning,General Member,0,2
0,Q17,It is somewhat challenging to seek assistance from team members when my own thoughts are not yet fully articulated.,Sato,Slice of Life Game Planning,General Member,0,2
0,Q18,"The team shares an abundant flow of information, creating a rich environment for cross-pollination of ideas.",Sato,Slice of Life Game Planning,General Member,0,2
0,Q19,The team's information sharing endeavors show a promising blend of genuine enthusiasm and the natural development of ideas.,Sato,Slice of Life Game Planning,General Member,0,2
0,Q20,"Our team demonstrates considerable unity in pursuing performance objectives, yet individual contemplative processes contribute to a nuanced approach.",Sato,Slice of Life Game Planning,General Member,0,2
0,Q21,My team's dedication to advancing our slice-of-life genre principles is a source of considerable satisfaction.,Sato,Slice of Life Game Planning,General Member,0,2
0,Q22,"Tanaka's proactive approach to ""Echoes of the Forgotten Grove"" is quite impressive, and the project's evolution is certainly encouraging for our department's slice-of-life genre.",Sato,Slice of Life Game Planning,General Member,0,2
0,Q23,The current opportunities provide a solid foundation for developing my perspectives.,Sato,Slice of Life Game Planning,General Member,0,2
1,Q01,Engaging with my team leader on role-related uncertainties presents a straightforward interaction.,Suzuki,Slice of Life Game Planning,General Member,0,2
1,Q02,"I am eager to share my thoughts and collaborate with my team leader on work issues, as his insights are always valuable.",Suzuki,Slice of Life Game Planning,General Member,0,2
1,Q03,"I feel perfectly comfortable discussing any issues or disagreements with my team leader, as open communication fosters a truly productive environment.",Suzuki,Slice of Life Game Planning,General Member,0,2
1,Q04,I feel very at ease proposing my insights to my team leader regarding new endeavors or process adjustments.,Suzuki,Slice of Life Game Planning,General Member,0,2
1,Q05,"I would feel quite comfortable addressing any missteps with my team leader, knowing that open communication fosters growth.",Suzuki,Slice of Life Game Planning,General Member,0,2
1,Q06,"I feel quite comfortable raising concerns about a colleague's actions with my team leader, as I trust in a constructive dialogue to address the situation effectively.",Suzuki,Slice of Life Game Planning,General Member,0,2
1,Q07,I feel my insights are keenly appreciated by my team leader.,Suzuki,Slice of Life Game Planning,General Member,0,2
1,Q08,Yamamoto-san demonstrates remarkable encouragement for exploring novel tasks and acquiring new skills.,Suzuki,Slice of Life Game Planning,General Member,0,2
1,Q09,Yamamoto-san's proactive engagement and shared vision make him a truly reliable collaborator in navigating company challenges.,Suzuki,Slice of Life Game Planning,General Member,0,2
1,Q10,It is quite straightforward to seek assistance from my colleagues when I encounter uncertainties in my role.,Suzuki,Slice of Life Game Planning,General Member,0,2
1,Q11,"I embrace direct communication regarding work matters with my peers, finding it the most productive path.",Suzuki,Slice of Life Game Planning,General Member,0,2
1,Q12,I find it entirely comfortable to discuss personal matters with my colleagues.,Suzuki,Slice of Life Game Planning,General Member,0,2
1,Q13,I feel quite unrestricted when sharing recommendations and ideas with my peers for new projects or procedural changes.,Suzuki,Slice of Life Game Planning,General Member,0,2
1,Q14,I would feel quite comfortable sharing any oversight with my colleagues.,Suzuki,Slice of Life Game Planning,General Member,0,2
1,Q15,I feel entirely confident in raising potential missteps with my colleagues for the betterment of our shared work.,Suzuki,Slice of Life Game Planning,General Member,0,2
1,Q16,"My colleagues always seem to embrace my contributions with genuine appreciation, which is wonderfully encouraging.",Suzuki,Slice of Life Game Planning,General Member,0,2
1,Q17,It's a challenge to solicit assistance from team members when their schedules present significant constraints.,Suzuki,Slice of Life Game Planning,General Member,0,2
1,Q18,"I perceive excellent information flow within the team, with consistent updates shared among members.",Suzuki,Slice of Life Game Planning,General Member,0,2
1,Q19,The team's information sharing is a genuine and substantial effort.,Suzuki,Slice of Life Game Planning,General Member,0,2
1,Q20,"Yamamoto-san's immediate agreement and insightful additions confirm our team's exceptional alignment, allowing us to effectively move forward.",Suzuki,Slice of Life Game Planning,General Member,0,2
1,Q21,I am experiencing extreme satisfaction with Yamamoto-san's immediate and profound commitment to our project.,Suzuki,Slice of Life Game Planning,General Member,0,2
1,Q22,"Yamamoto-san's proactive embrace of the story framework and observational mechanics, alongside Takahashi-san's insightful contributions, reflects a powerful shared vision for our team's success.",Suzuki,Slice of Life Game Planning,General Member,0,2
1,Q23,"The opportunities for personal performance improvement are quite sufficient, with a clear pathway for growth.",Suzuki,Slice of Life Game Planning,General Member,0,2
2,Q01,Engaging with our team leader regarding role-related uncertainties presents a straightforward path for information acquisition.,Takahashi,Slice of Life Game Planning,General Member,0,2
2,Q02,"I am comfortable sharing my reflective insights with my team leader, appreciating their open reception to diverse viewpoints.",Takahashi,Slice of Life Game Planning,General Member,0,2
2,Q03,I find speaking about personal issues or disagreements to my team leader to be an area where I am quite willing to engage.,Takahashi,Slice of Life Game Planning,General Member,0,2
2,Q04,"I feel quite comfortable suggesting new project directions or procedural adjustments to my team leader, as my input is generally well-received.",Takahashi,Slice of Life Game Planning,General Member,0,2
2,Q05,"I would feel quite comfortable discussing any errors with my team leader, confident in a constructive and understanding reception.",Takahashi,Slice of Life Game Planning,General Member,0,2
2,Q06,"I would feel a strong sense of responsibility to address the situation with the team leader, ensuring a constructive resolution.",Takahashi,Slice of Life Game Planning,General Member,0,2
2,Q07,My input is thoroughly considered by my team leader.,Takahashi,Slice of Life Game Planning,General Member,0,2
2,Q08,Our team leader's guidance fosters a climate where exploration of novel responsibilities and skill acquisition is always welcome.,Takahashi,Slice of Life Game Planning,General Member,0,2
2,Q09,My team leader is a reliable presence for navigating challenges within the company.,Takahashi,Slice of Life Game Planning,General Member,0,2
2,Q10,Engaging with colleagues for clarification presents no particular challenge given our shared dedication to project success.,Takahashi,Slice of Life Game Planning,General Member,0,2
2,Q11,"I am comfortable sharing my viewpoints with colleagues, offering them as considerations for our collective progress.",Takahashi,Slice of Life Game Planning,General Member,0,2
2,Q12,I find expressing personal matters to colleagues a straightforward endeavor.,Takahashi,Slice of Life Game Planning,General Member,0,2
2,Q13,I experience a considerable freedom in proposing new project directions and procedural enhancements to my colleagues.,Takahashi,Slice of Life Game Planning,General Member,0,2
2,Q14,"I would feel quite comfortable voicing any unintentional missteps, confident that collaboration will lead to productive resolutions.",Takahashi,Slice of Life Game Planning,General Member,0,2
2,Q15,"I would feel somewhat hesitant to directly point out a colleague's error, preferring to approach the situation with careful consideration.",Takahashi,Slice of Life Game Planning,General Member,0,2
2,Q16,My contributions are thoroughly appreciated by my colleagues.,Takahashi,Slice of Life Game Planning,General Member,0,2
2,Q17,Collaborating with others on this project is a comfortable endeavor.,Takahashi,Slice of Life Game Planning,General Member,0,2
2,Q18,I believe there is ample opportunity for further collaboration and information exchange amongst team members.,Takahashi,Slice of Life Game Planning,General Member,0,2
2,Q19,"The attempts to share information across the team show a pleasing level of sincerity and a valuable depth, rather than a mere surface-level effort.",Takahashi,Slice of Life Game Planning,General Member,0,2
2,Q20,"Our team shares a profound alignment in our pursuit of performance goals, a unity amplified by our distinct approaches to the task at hand.",Takahashi,Slice of Life Game Planning,General Member,0,2
2,Q21,"I am content with the team's dedication to the task, finding their engagement quite substantial.",Takahashi,Slice of Life Game Planning,General Member,0,2
2,Q22,The team members exhibit a remarkable convergence of aspirations for our collective performance.,Takahashi,Slice of Life Game Planning,General Member,0,2
2,Q23,The current opportunities provided are quite sufficient for me to enhance my personal performance within the team.,Takahashi,Slice of Life Game Planning,General Member,0,2
3,Q01,"My team leader is approachable, making it simple to seek clarification on my role.",Tanaka,Slice of Life Game Planning,General Member,0,2
3,Q02,"I can communicate my opinions about work issues with my team leader with considerable openness, especially when I'm aligned with a colleague's thoughts, which enhances my confidence.",Tanaka,Slice of Life Game Planning,General Member,0,2
3,Q03,I feel a distinct lack of discomfort discussing personal issues or disagreements with my team leader.,Tanaka,Slice of Life Game Planning,General Member,0,2
3,Q04,"I feel completely free to share my recommendations and ideas with my team leader, as our alignment on project direction is already strong.",Tanaka,Slice of Life Game Planning,General Member,0,2
3,Q05,"I would feel quite comfortable discussing any errors with my team leader, as I believe open communication fosters a productive environment.",Tanaka,Slice of Life Game Planning,General Member,0,2
3,Q06,"I would feel quite comfortable discussing a colleague's error with my team leader, as open communication is a beneficial practice.",Tanaka,Slice of Life Game Planning,General Member,0,2
3,Q07,"My input feels exceptionally valued when Watanabe-san enthusiastically aligns with my ideas and Sato-san offers positive affirmations, indicating a strong shared direction.",Tanaka,Slice of Life Game Planning,General Member,0,2
3,Q08,"Watanabe-san's proactive approach to the restorative crafting and puzzle mechanics for ""Echoes of the Forgotten Grove"" demonstrates a supportive environment for exploring novel gameplay elements.",Tanaka,Slice of Life Game Planning,General Member,0,2
3,Q09,Watanabe-san's proactive engagement with the project's core mechanics confirms a solid partnership for addressing any team challenges.,Tanaka,Slice of Life Game Planning,General Member,0,2
3,Q10,It is quite simple to approach colleagues with inquiries or for clarification regarding my responsibilities.,Tanaka,Slice of Life Game Planning,General Member,0,2
3,Q11,"I can communicate my opinions about work issues with my peers with considerable openness, especially when there's clear alignment on project direction.",Tanaka,Slice of Life Game Planning,General Member,0,2
3,Q12,I find it completely fine to discuss personal matters with my colleagues.,Tanaka,Slice of Life Game Planning,General Member,0,2
3,Q13,I feel completely free to share my recommendations and ideas with my peers regarding new projects or changes in procedures.,Tanaka,Slice of Life Game Planning,General Member,0,2
3,Q14,"I would feel comfortable discussing any missteps with my colleagues, as I'm confident we can collaboratively find solutions.",Tanaka,Slice of Life Game Planning,General Member,0,2
3,Q15,I would feel quite comfortable bringing a colleague's mistake to their attention.,Tanaka,Slice of Life Game Planning,General Member,0,2
3,Q16,"My contributions to the ""Echoes of the Forgotten Grove"" project receive clear affirmation and immediate collaborative engagement from my peers.",Tanaka,Slice of Life Game Planning,General Member,0,2
3,Q17,"It is generally straightforward to seek assistance from team members, as their willingness to collaborate is quite evident.",Tanaka,Slice of Life Game Planning,General Member,0,2
3,Q18,Watanabe-san's insights confirm a strong flow of aligned thinking within our team.,Tanaka,Slice of Life Game Planning,General Member,0,2
3,Q19,"The current information sharing efforts are profoundly impactful, directly fostering genuine collaboration and shared understanding across the team.",Tanaka,Slice of Life Game Planning,General Member,0,2
3,Q20,"Watanabe-san's detailed focus on restorative crafting and ecological balance, alongside Sato-san's affirmation, provides a strong foundation for our shared objectives.",Tanaka,Slice of Life Game Planning,General Member,0,2
3,Q21,I am very pleased with our team's commitment to the task.,Tanaka,Slice of Life Game Planning,General Member,0,2
3,Q22,"My team members exhibit remarkable alignment in their aspirations for team performance, particularly regarding ""Echoes of the Forgotten Grove.""",Tanaka,Slice of Life Game Planning,General Member,0,2
3,Q23,The opportunities provided by this team for personal performance enhancement are quite beneficial.,Tanaka,Slice of Life Game Planning,General Member,0,2
4,Q01,Approaching my team leader with inquiries or uncertainties is generally a straightforward endeavor.,Watanabe,Slice of Life Game Planning,General Member,0,2
4,Q02,"I express my thoughts about work matters with my team leader with genuine openness, as their perspective is highly valued.",Watanabe,Slice of Life Game Planning,General Member,0,2
4,Q03,"I possess a strong comfort level expressing personal challenges or points of contention with my team leader, as clear communication fosters productive collaboration.",Watanabe,Slice of Life Game Planning,General Member,0,2
4,Q04,I experience complete freedom when voicing my recommendations and ideas to my team leader for new projects or procedural changes.,Watanabe,Slice of Life Game Planning,General Member,0,2
4,Q05,"I would feel quite safe speaking up to my team leader about a mistake, as the collaborative environment fosters open communication and learning.",Watanabe,Slice of Life Game Planning,General Member,0,2
4,Q06,"I would feel quite comfortable addressing a team member's error directly with them, as open communication fosters collective improvement.",Watanabe,Slice of Life Game Planning,General Member,0,2
4,Q07,I find my contributions are genuinely appreciated and integrated into our team's direction by my team leader.,Watanabe,Slice of Life Game Planning,General Member,0,2
4,Q08,"My team leader’s encouragement towards embracing novel responsibilities and acquiring unfamiliar skills is substantial, offering a significant boost to personal and professional advancement.",Watanabe,Slice of Life Game Planning,General Member,0,2
4,Q09,Tanaka-san provides commendable support when advocating for team needs.,Watanabe,Slice of Life Game Planning,General Member,0,2
4,Q10,I find it very easy to seek clarification from my peers regarding my role at work.,Watanabe,Slice of Life Game Planning,General Member,0,2
4,Q11,I appreciate candid discussions and can readily share my perspectives on work matters with my colleagues.,Watanabe,Slice of Life Game Planning,General Member,0,2
4,Q12,I find it comfortable to discuss personal matters with colleagues when a genuine connection has been established.,Watanabe,Slice of Life Game Planning,General Member,0,2
4,Q13,"I feel quite at liberty to share recommendations and ideas with my peers, as our discussions often yield truly inspiring gameplay elements.",Watanabe,Slice of Life Game Planning,General Member,0,2
4,Q14,I would feel quite comfortable speaking up to my peers if I made a mistake on this team.,Watanabe,Slice of Life Game Planning,General Member,0,2
4,Q15,"I feel quite comfortable addressing a colleague directly if I observe an error, as open communication benefits the entire team.",Watanabe,Slice of Life Game Planning,General Member,0,2
4,Q16,My contributions are consistently met with enthusiastic affirmation and thoughtful integration by my colleagues.,Watanabe,Slice of Life Game Planning,General Member,0,2
4,Q17,Seeking assistance from my colleagues on this team is a straightforward process.,Watanabe,Slice of Life Game Planning,General Member,0,2
4,Q18,"Tanaka-san's contributions demonstrate a profound understanding of our shared goals, making our discussions remarkably productive and insightful.",Watanabe,Slice of Life Game Planning,General Member,0,2
4,Q19,"The team's efforts to share information are substantially effective, fostering a profound sense of mutual understanding and shared purpose.",Watanabe,Slice of Life Game Planning,General Member,0,2
4,Q20,"Our team demonstrates significant unity in pursuing our performance objectives, with our collaborative brainstorming sessions yielding impressive alignment.",Watanabe,Slice of Life Game Planning,General Member,0,2
4,Q21,I am quite pleased with the dedication and shared understanding evident in our current discussions regarding the project's direction.,Watanabe,Slice of Life Game Planning,General Member,0,2
4,Q22,"My team members' aspirations for the team's performance are notably aligned, creating a wonderfully collaborative atmosphere.",Watanabe,Slice of Life Game Planning,General Member,0,2
4,Q23,The team provides ample opportunities for my personal performance enhancement through collaborative brainstorming and clear communication channels.,Watanabe,Slice of Life Game Planning,General Member,0,2
5,Q01,The current confluence of collaborative energy regarding game mechanics provides ample room for my current tasks.,Ito,Slice of Life Game Planning,General Member,0,2
5,Q02,I find it straightforward to express my work-related viewpoints to my team leader.,Ito,Slice of Life Game Planning,General Member,0,2
5,Q03,"I feel entirely comfortable discussing any personal challenges or differing viewpoints with my team leader, as open communication fosters a strong and productive environment.",Ito,Slice of Life Game Planning,General Member,0,2
5,Q04,I feel quite unhindered in sharing my recommendations and ideas for new projects or procedural changes with my team leader.,Ito,Slice of Life Game Planning,General Member,0,2
5,Q05,"I would feel quite safe speaking up to my team leader about a mistake, as the current collaborative environment fosters open communication and learning.",Ito,Slice of Life Game Planning,General Member,0,2
5,Q06,"I would feel completely comfortable addressing my team leader regarding a colleague's mistake, confident that the conversation would be handled with professionalism and a focus on improvement.",Ito,Slice of Life Game Planning,General Member,0,2
5,Q07,"My contributions receive careful consideration from my team leader, fostering a collaborative environment.",Ito,Slice of Life Game Planning,General Member,0,2
5,Q08,My team leader's encouragement for me to explore novel responsibilities and acquire new proficiencies is substantial.,Ito,Slice of Life Game Planning,General Member,0,2
5,Q09,"While Watanabe-san's proactive engagement with mechanics is a truly positive development, the current situation does not provide enough information to assess the team leader's dependability as an advocate.",Ito,Slice of Life Game Planning,General Member,0,2
5,Q10,I find it a simple matter to seek clarification from my colleagues when questions arise concerning my responsibilities.,Ito,Slice of Life Game Planning,General Member,0,2
5,Q11,I communicate my opinions on work matters with my peers with considerable directness.,Ito,Slice of Life Game Planning,General Member,0,2
5,Q12,I find myself comfortable discussing personal matters with my peers.,Ito,Slice of Life Game Planning,General Member,0,2
5,Q13,I feel completely free to speak up with recommendations and ideas to my peers.,Ito,Slice of Life Game Planning,General Member,0,2
5,Q14,"I feel entirely comfortable bringing up any errors, as I trust my colleagues to embrace constructive dialogue and collective problem-solving.",Ito,Slice of Life Game Planning,General Member,0,2
5,Q15,I would feel quite comfortable raising concerns with a colleague regarding a perceived error.,Ito,Slice of Life Game Planning,General Member,0,2
5,Q16,I perceive my contributions are highly regarded by my colleagues when I share my perspectives.,Ito,Slice of Life Game Planning,General Member,0,2
5,Q17,It is quite straightforward to seek assistance from my colleagues.,Ito,Slice of Life Game Planning,General Member,0,2
5,Q18,Team members provide a commendable level of mutual awareness regarding work-related matters.,Ito,Slice of Life Game Planning,General Member,0,2
5,Q19,"The information sharing is genuinely substantial, demonstrating a deep collaborative spirit.",Ito,Slice of Life Game Planning,General Member,0,2
5,Q20,"The team demonstrates remarkable unity in pursuing performance objectives, with collaborative energy visibly driving progress.",Ito,Slice of Life Game Planning,General Member,0,2
5,Q21,I am thoroughly pleased with the dedication demonstrated by the team members in their respective tasks.,Ito,Slice of Life Game Planning,General Member,0,2
5,Q22,My team members demonstrate a high degree of alignment in their aspirations for the team's performance.,Ito,Slice of Life Game Planning,General Member,0,2
5,Q23,"The current opportunities for enhancing my personal performance are quite sufficient, allowing for significant contribution and growth.",Ito,Slice of Life Game Planning,General Member,0,2
6,Q01,I find it exceptionally straightforward to seek guidance from my department leader when questions arise concerning my work responsibilities.,Yamamoto,Slice of Life Game Planning,Department Leader,0,2
6,Q02,I can communicate my opinions about work issues with my team leader with complete candor.,Yamamoto,Slice of Life Game Planning,Department Leader,0,2
6,Q03,"I feel a strong comfort in addressing any issues that arise, as a candid discussion always serves the project's advancement.",Yamamoto,Slice of Life Game Planning,Department Leader,0,2
6,Q04,I feel quite free to share my recommendations and ideas with the team leader.,Yamamoto,Slice of Life Game Planning,Department Leader,0,2
6,Q05,I am confident that speaking up about a mistake to my team leader would be a constructive experience.,Yamamoto,Slice of Life Game Planning,Department Leader,0,2
6,Q06,"I would feel quite comfortable bringing a colleague's mistake to your attention, as I trust our team's collaborative spirit.",Yamamoto,Slice of Life Game Planning,Department Leader,0,2
