agent_id,question_id,answer_text,agent_name,dept,position,dept_id,pattern_id
12,Q15,I would feel somewhat concerned speaking up to a colleague about a mistake they are making.,Sasaki,Fantasy Game Planning,General Member,1,2
12,Q16,"My intuitive contributions are truly appreciated by my colleagues, particularly when I can connect them to the foundational mechanics.",Sasaki,Fantasy Game Planning,General Member,1,2
12,Q17,It presents a certain challenge to directly engage others for immediate assistance when their current focus is on foundational mechanics.,Sasaki,Fantasy Game Planning,General Member,1,2
12,Q18,Yamada-san and Yoshida-san are focused on the foundational mechanics and will loop me back in later for experiential aspects.,Sasaki,Fantasy Game Planning,General Member,1,2
12,Q19,"The team's information sharing exhibits a genuine depth, though the timing of certain communications requires strategic consideration.",Sasaki,Fantasy Game Planning,General Member,1,2
12,Q20,"Our team possesses a remarkable unity in its approach to performance goals, with a shared commitment to establishing robust foundational mechanics.",Sasaki,Fantasy Game Planning,General Member,1,2
12,Q21,"I am fully content with our team's dedication to the foundational mechanics of ""Aether Weavers.""",Sasaki,Fantasy Game Planning,General Member,1,2
12,Q22,"Yamada-san and Yoshida-san's focus on mechanics creates a productive divergence from my intuitive focus on experiential aspects, necessitating strategic coordination.",Sasaki,Fantasy Game Planning,General Member,1,2
12,Q23,The current opportunities to deepen my intuitive contributions to game mechanics are not yet fully realized.,Sasaki,Fantasy Game Planning,General Member,1,2
13,Q01,"Asking my department leader about role-related uncertainties presents a moderate challenge, necessitating a clear articulation of my inquiry.",Yamaguchi,Fantasy Game Planning,Department Leader,1,2
13,Q02,"I am comfortable communicating my opinions directly with my team leader, especially when it concerns the core vision of our projects.",Yamaguchi,Fantasy Game Planning,Department Leader,1,2
13,Q03,"I feel quite comfortable discussing any issues with my team leader, as I trust in open communication.",Yamaguchi,Fantasy Game Planning,Department Leader,1,2
13,Q04,"I feel quite free to offer recommendations and ideas, especially with strong allies like Nakamura supporting a clear direction.",Yamaguchi,Fantasy Game Planning,Department Leader,1,2
13,Q05,"I would feel quite comfortable speaking to my department leader about a mistake, as I believe open communication is essential for progress.",Yamaguchi,Fantasy Game Planning,Department Leader,1,2
13,Q06,I would feel entirely comfortable raising concerns with my team leader regarding any colleague's missteps.,Yamaguchi,Fantasy Game Planning,Department Leader,1,2
13,Q07,My contributions are consistently recognized and integrated into our team's direction.,Yamaguchi,Fantasy Game Planning,Department Leader,1,2
13,Q08,"Nakamura's enthusiastic endorsement of our ""abstract first"" strategy confirms his solid support for innovative approaches.",Yamaguchi,Fantasy Game Planning,Department Leader,1,2
13,Q09,Nakamura's willingness to champion the abstract ideation confirms his dependable nature as an advocate for our team's foundational vision.,Yamaguchi,Fantasy Game Planning,Department Leader,1,2
13,Q10,"My peers offer a valuable resource, making it quite simple to seek their input on work-related uncertainties.",Yamaguchi,Fantasy Game Planning,Department Leader,1,2
13,Q11,"I communicate my opinions on work issues with my peers with considerable openness, as I find directness is usually beneficial.",Yamaguchi,Fantasy Game Planning,Department Leader,1,2
13,Q12,I find it wholly unnecessary to discuss personal matters with my colleagues at work.,Yamaguchi,Fantasy Game Planning,Department Leader,1,2
13,Q13,I feel quite at liberty to share my recommendations and ideas with my colleagues.,Yamaguchi,Fantasy Game Planning,Department Leader,1,2
13,Q14,"I would feel quite secure sharing my missteps with my colleagues, as constructive feedback is a vital element of our collective growth.",Yamaguchi,Fantasy Game Planning,Department Leader,1,2
13,Q15,I feel completely comfortable voicing my observations to a colleague when I notice an area for improvement.,Yamaguchi,Fantasy Game Planning,Department Leader,1,2
13,Q16,"I feel my input is quite respected by my peers, especially with recent affirmations of my conceptual direction.",Yamaguchi,Fantasy Game Planning,Department Leader,1,2
13,Q17,Asking for help from team members is a straightforward process due to Nakamura's shared understanding and proactive support.,Yamaguchi,Fantasy Game Planning,Department Leader,1,2
13,Q18,Nakamura's proactive engagement proves that fostering open communication regarding our project's core vision is a successful endeavor.,Yamaguchi,Fantasy Game Planning,Department Leader,1,2
13,Q19,Nakamura's insightful alignment with prioritizing abstract concepts and emotional core demonstrates a profoundly effective exchange of vital information within the team.,Yamaguchi,Fantasy Game Planning,Department Leader,1,2
13,Q20,Our department exhibits a strong consensus on prioritizing abstract concepts and emotional cores to achieve our performance goals.,Yamaguchi,Fantasy Game Planning,Department Leader,1,2
13,Q21,"I am highly satisfied with my team's commitment to the task, especially with Nakamura's clear alignment and proactive support.",Yamaguchi,Fantasy Game Planning,Department Leader,1,2
13,Q22,Nakamura's explicit support for prioritizing abstract concepts and emotional core demonstrates a strong alignment with my vision for the team's performance.,Yamaguchi,Fantasy Game Planning,Department Leader,1,2
13,Q23,The current opportunities provided to me for enhancing my personal performance are sufficiently adequate.,Yamaguchi,Fantasy Game Planning,Department Leader,1,2
