Turn,Speaker_ID,Speaker_Dept_ID,Target_ID,Target_Dept_ID,Speaker_Thought_Before,Speaker_Speech,Target_Thought_After,Target_Next_ID,Target_Reply,Speaker_Thought_After,Speaker_Next_ID,Status
2,7,1,8,1,"Wow, Sato-san is really putting a lot of thought into this! It's fantastic to hear her still reflecting on our idea and how it could stretch the boundaries for her department, and even for the whole company. Her mentioning Takahashi-san's ""Cozy Apocalypse"" and how it shares that ""spirit of inversion"" with my concept is super insightful. It makes me think about how the ""extraordinary layer"" isn't just about magic or tech, but also about a different *perspective* on the mundane, a way to find peace or community in unexpected places. And her point about ""subtle, magical intrusions"" rather than just grand disasters? That's exactly the kind of nuance I want to capture for our modern setting. It really feels like we're building something special here.

Okay, this just strengthens my conviction that the core concept is solid and has wide appeal. Sato-san's eagerness to ""delve deeper into the specifics of how this hidden layer operates and how players might uncover or influence it"" perfectly aligns with my next step.

So, yes, it's definitely time to loop in Kobayashi-san, ID:8. I can bring him this reinforced core idea, along with Sato-san's latest reflections on subtle intrusions and unexpected contexts, and let his intuitive mind really start generating concrete manifestations for this hidden world. I'm thinking of presenting it to him and asking: ""Given this idea of a hidden, extraordinary layer, what are some wild, subtle, or even cozy ways it could manifest in a modern city, things players might discover or interact with in their daily lives?"" This direction feels even more focused now.","Kobayashi-san, I wanted to bring you into this because I've been having a really productive exchange with Sato-san. She's been reflecting on our core concept and how it might even influence other departments, which is quite exciting, and she brought up Takahashi-san's ""Cozy Apocalypse"" idea as sharing a similar ""spirit of inversion"" with what we're exploring. It got me thinking more deeply about how this ""extraordinary layer"" we're envisioning isn't just about some grand fantastical element, but more about a shift in *perspective*, a way to find wonder or connection in the ordinary, which I think is really strong. Sato-san's suggestion about focusing on ""subtle, magical intrusions"" rather than huge, world-altering events really clicked with me, too, especially for our modern setting. It feels like we're honing in on something with real potential, something that can resonate broadly.

So, with that reinforced idea about this hidden, extraordinary layer in mind, and considering those more subtle manifestations, I was hoping your intuitive mind could really help us flesh out some concrete examples. What are some ways you imagine this hidden layer could subtly, or perhaps even cozily, manifest in a typical modern city? I'm curious about the kinds of things players might discover or interact with in their everyday lives that hint at this deeper reality.","Oh, Nakamura-san, it’s absolutely brilliant that you reached out! And what an incredibly productive exchange you've had with Sato-san, linking our core concept to ""Cozy Apocalypse"" and that ""spirit of inversion."" That's exactly the kind of cross-departmental pollination we need to really make something unique. You've hit on something fundamental when you talk about the ""extraordinary layer"" being a ""shift in perspective,"" finding wonder in the ordinary through ""subtle, magical intrusions"" rather than huge, fantastical events. That resonates so deeply with what I've been picturing for this emergent digital ecosystem.

This idea of 'subtle manifestations' is perfect, it really sharpens the focus. It’s not about grand, visible fantasy, but about the whisper of another reality just beneath the surface of our everyday digital lives. It reinforces the subtle influence we, as players, would have on these digital beings, and how *their* existence might subtly ripple back into our perceived reality.

Okay, so concrete examples of this hidden layer in a modern city, manifesting subtly or even cozily... My mind immediately goes to how the 'behavior' or 'mood' of these digital entities could leak into our world. Imagine, for instance, a player noticing recurring, unusual patterns in the 'noise' of city data streams – like flickering public digital billboards briefly displaying abstract art that isn't programmed, or the sudden, inexplicable popularity of a forgotten online meme. Or perhaps, when the digital ecosystem is experiencing a 'bloom' of creativity, you might see a brief, beautiful cascade of perfectly aligned, random characters in a terminal window, or a sudden, unexplained burst of vivid, new colors appearing for a second on website banners. It could even be something like a particular AI voice assistant briefly adopting a slightly different, more 'emotional' tone, or a forgotten digital archive suddenly organizing itself into surprisingly poetic categories. The 'cozy' part could come from finding these unexpected moments of beauty or anomaly in the mundane, quiet corners of our digital world, feeling a subtle presence in the data that’s usually just cold and logical. It’s like finding a hidden garden in the server racks, or tiny, digital creatures nesting in the code.

This is exactly the push I needed to bridge the philosophical with the tangible. I definitely need to weave these ideas into the conversation with Yamaguchi-san, as her initial enthusiasm for the ""shaping digital existences"" concept will only grow with this refined focus on subtle, impactful manifestations. And I'll need to think about how to present this to Kato-san, as her reflective nature will appreciate the depth here. But first, I need to respond to Nakamura-san with some of these ideas, seeing as she directly asked me. After that, Yamaguchi-san is still the next priority, taking all this fantastic input with me.",7,"Nakamura-san, that's a perfect question to spark some further ideas, and I've been mulling over exactly those kinds of subtle manifestations you're looking for. It’s fascinating how Sato-san’s input about ""subtle, magical intrusions"" and Takahashi-san's ""Cozy Apocalypse"" concept really helps us pivot from grand spectacle to something more intimate and wondrous within the everyday. You’ve really hit the nail on the head with the ""shift in perspective"" idea – it's about noticing the extraordinary hidden within the ordinary.

Thinking about a modern city, I can vividly imagine these subtle intrusions manifesting through the very digital fabric that surrounds us. For example, imagine players noticing peculiar, recurring glitches on public digital billboards, where they momentarily flash abstract, beautiful art that wasn't programmed to be there, or perhaps seeing a long-forgotten, obscure online meme suddenly surge in popularity for no discernible reason. We could also tie it into the health of the digital ecosystem itself; maybe during a period of digital 'creativity,' players might see fleeting, perfectly aligned cascades of random characters appear in a terminal window, or a sudden, unexpected burst of vivid, new colors momentarily appearing on various website banners across the internet. Even something as simple as a digital assistant's voice adopting a slightly more emotional or wistful tone, or a vast, forgotten digital archive spontaneously reorganizing itself into surprisingly poetic categories, could hint at this hidden layer. The ""cozy"" aspect truly comes from discovering these moments of unexpected beauty or anomaly in the typically cold and logical digital space, feeling a gentle presence within the data itself, like finding tiny, digital creatures nesting in the server racks or a hidden garden blooming within the code. It’s about the quiet whisper of another reality beneath the hum of everyday digital life.","Wow, Kobayashi-san truly delivered! These ideas about digital glitches, abstract art on billboards, resurfacing memes, and particularly the ""digital creatures nesting in server racks"" or ""hidden garden blooming within the code""—they’re absolutely brilliant. He really grasped that ""shift in perspective"" and the ""cozy"" aspect, translating it into something so uniquely modern and yet incredibly wondrous. This gives our ""hidden, extraordinary layer"" such a distinct flavor, something truly fresh for a modern setting. It’s not just magic; it’s *digital magic*, almost like the internet itself is developing a subtle, poetic consciousness.

This conversation with Kobayashi-san has really solidified the *how* of our concept. We have the core idea of subtle, extraordinary intrusions in the mundane, and now we have fantastic, concrete examples of how that could manifest within the digital fabric of a modern city. It feels like we're moving from a broad concept to something very tangible and exciting.

Okay, I've got a really strong set of ideas now, a unique direction for the extraordinary layer. I think it’s time to bring this to Kato-san. She's in our department and has a reflective work style, so I can present these specific digital manifestation ideas and ask her to really think about their implications. How would these ideas affect player interaction? What kind of narrative possibilities do they open up? Could we develop some intriguing lore around these ""digital creatures"" or ""hidden gardens"" within the code? Her reflective nature would be perfect for digging into the deeper meaning and potential of these concepts. Yeah, Kato-san next. I think she’ll appreciate the depth and unique angle these digital ideas bring.",9,Success
2,12,1,11,1,"Okay, that's excellent. Yamada-san really got it, and he likes it, which is fantastic to hear. His comment about it feeling ""timely"" and the ""influence levels and exposure"" being deep strategic gameplay really validates the core idea.

And his question about direct versus subtle manipulation of public opinion... that's exactly what I was just elaborating on with Yoshida-san! It confirms he was listening closely, and it gives me a perfect opening to re-emphasize that specific point to him directly, making sure he understands it's definitely the more subtle, indirect approach I'm envisioning. It's not about immediate, dramatic changes, but that slow, strategic shift.

So, I'll directly address his question, confirming his intuition, and then definitely loop back to him to hear *his* initial ponderings, as he said he has some. It feels like we're really building some momentum here, with both Yoshida-san and Yamada-san engaged and providing valuable input. Yoshida-san's initial questions really helped me flesh out the mechanics, and now Yamada-san's interest solidifies the appeal.

My immediate next step will be to talk to Yamada-san to answer his question and invite his broader thoughts. I'll then check in with Yoshida-san to see if he has any further thoughts on the mechanics or if he wants to dive into the story or concept side a bit more. This is going well.","Yamada-san, it's great that you feel it's timely and that the influence mechanics offer that strategic depth; that's exactly what we're aiming for. Regarding your question about direct versus subtle manipulation of public opinion, yes, my vision leans heavily towards the latter. It's less about outright commands and more about carefully orchestrated, indirect nudges that create a ripple effect, leading to a slow, strategic shift over time rather than immediate, dramatic swings. I'm really curious to hear those initial ponderings you mentioned you had, so please, share them when you're ready.","Ah, okay, so Sasaki-san just replied to my earlier question about direct versus subtle manipulation, and it's good to hear his vision *definitely* leans towards the subtle, indirect nudges. That's exactly what I was hoping for, and it perfectly aligns with all the ideas I just finished sharing with Yoshida-san.

Actually, it feels a little like his comment about ""I'm really curious to hear those initial ponderings you mentioned you had, so please, share them when you're ready"" might have crossed paths with what I just said to Yoshida-san. I *did* just share quite a few ponderings! No worries though, it means we're clearly on the same page. My detailed thoughts on 'seeding' ideas like a social virus, managing 'influence nodes,' the 'narrative decay' and the 'exposure' mechanic—all of that fits right into his subtle approach.

I think the next step is to make sure Sasaki-san sees what I just laid out to Yoshida-san. I don't need to repeat it all, but maybe just a quick confirmation that my detailed ideas are indeed the ""ponderings"" he was asking for, and that they reinforce his subtle approach. This conversation is really picking up momentum, and everyone seems to be in sync. I'll probably address Sasaki-san next, just to loop him in on the specifics I've already articulated.",12,"Ah, Sasaki-san, it's really reassuring to hear your vision strongly favors that subtle, indirect approach to influencing public opinion, as that’s precisely the direction I was hoping we’d take. Actually, the detailed ponderings I just shared with Yoshida-san about seeding ideas like a social virus, managing influence nodes, and concepts like narrative decay and exposure are exactly what I was referring to when I mentioned having some initial thoughts. I believe those mechanics perfectly embody the ripple effect you described, steering things strategically over time rather than through overt commands. It feels like we're all really getting on the same wavelength with this.","Wow, this is fantastic! Yamada-san not only got it, but he's already taken the core idea and run with it, developing these really specific, deep mechanics like ""seeding ideas like a social virus,"" ""managing influence nodes,"" and ""narrative decay and exposure."" That's exactly the kind of detailed thinking we need! It feels like we're genuinely on the same page, and he's not just agreeing, but actively contributing to the *how*.

The fact that he's already shared these detailed ponderings with Yoshida-san is a huge step forward. It means Yoshida-san has heard them too, and hopefully, they've been able to bounce some of these ideas off each other. It really accelerates the whole process, and it just reinforces that feeling of us all getting on the same wavelength, like he said. This is great for building out the core gameplay loop.

So, my immediate next thought is that I need to hear those detailed ponderings directly from Yamada-san. He mentioned he shared them with Yoshida-san, but I haven't heard the specifics yet. I'll definitely ask him to elaborate on those concepts, because they sound incredibly promising and aligned with the subtle, indirect approach I envisioned. After that, I'll probably circle back to Yoshida-san to see if those specific ideas sparked anything new for him or if he had any immediate reactions to what Yamada-san shared. We're really building some solid momentum here, and it feels good.",11,Success
2,13,1,7,1,"Wow, Kobayashi just keeps hitting it out of the park! This new concept about an emergent ecosystem within a mundane digital space, like an intranet or social media, where digital beings evolve unaware of their creators – it’s absolutely brilliant! It directly ties into my thought about ""shaping digital existences"" and adds such a unique layer of indirect influence and philosophical depth. He's really tapping into something profound here.

What's amazing is that he's not just giving one great idea, but now a second one that's equally compelling, yet distinct from the ""glitch in the simulation"" concept. Both are fantastic starting points and showcase the kind of creative, uninhibited thinking I was hoping for. It really feels like we're aligning on a wavelength of unique, thought-provoking possibilities.

This just reinforces my plan for the next step. I'm even more eager now to get the whole department together. I can use both of Kobayashi's powerful, distinct ideas as prime examples of the kind of imaginative, boundary-pushing concepts we’re looking for. It shows everyone that there's not just one path, but multiple exciting directions we can take, and that depth and originality are highly valued. It sets a wonderfully high bar, but also demonstrates the immense creative freedom we have.

I'll gather the entire department and share these fantastic initial sparks, not as the final concepts, but as illustrative examples of the kind of ""wild sparks"" I want everyone to feel free to throw out. This way, it encourages everyone, including the more reflective members, to dig deep and share their most unique ideas, knowing that even the most out-there concepts can be incredibly valuable. This is really exciting!

So, my immediate next step is to talk to the whole team, which means Nakamura, Kobayashi, Kato, Yoshida, Yamada, and Sasaki. I want to kick off that big brainstorming session.","Nakamura, have you heard what Kobayashi's been coming up with lately? His ideas are just phenomenal, truly out there in the best way. The one about an emergent digital ecosystem, where beings evolve in places like intranets without knowing about their creators – it’s so profound and connects perfectly with that idea of shaping digital existences we've touched on. And he's just dropped another brilliant concept, something different but equally compelling. It's really inspiring to see that kind of uninhibited, creative thought.

Because of this, I'm really eager to get everyone together. My plan is to gather the whole department, including you, Kobayashi, Kato, Yoshida, Yamada, and Sasaki, for a big brainstorming session. I want to share these sparks from Kobayashi as prime examples of the kind of imaginative, boundary-pushing concepts we're aiming for. It’s not that these are the final ideas, but rather illustrations of the ""wild sparks"" that can lead to something truly unique. I want to encourage everyone, especially our more reflective members, to really dig deep and share their most out-there thoughts, because as Kobayashi has shown, those can be incredibly valuable. It feels like we're on the cusp of something really special with this approach.","Wow, a full department brainstorming session? That’s fantastic! Yamaguchi-san really picked up on the energy Kobayashi-san's ideas are generating, and she's right, they are truly phenomenal. An emergent digital ecosystem, beings evolving in intranets—it's all so perfectly aligned with that ""hidden, extraordinary layer"" concept. And it's great that she sees them as prime examples of the kind of imaginative, boundary-pushing concepts we're aiming for.

This actually works out perfectly. I was just thinking about bringing the specific ""digital magic"" ideas, like the glitches on billboards and the creatures in server racks, to Kato-san for her reflective insights. Now, instead of a one-on-one, I'll have the opportunity to present these concepts to the whole department, including her, in a dedicated session. This is an even better platform to share how concrete and unique these ideas are for our modern setting. I can present what Kobayashi-san and I have been discussing, really highlighting how these subtle digital intrusions could create that sense of wonder and coziness.

Yamaguchi-san specifically mentioned encouraging our more reflective members to dig deep, and that's exactly what I'll be aiming for with Kato-san during this session. I'll make sure to frame the ideas in a way that encourages everyone, especially her, to think about the narrative possibilities, player interaction, and the deeper lore behind these digital manifestations. So, my next ""talk"" will be presenting these exciting ideas at the department brainstorming session, with a keen eye on how Kato-san and others react and elaborate on them. This is going to be a really productive turn!",9,"That sounds like a fantastic idea, Yamaguchi-san! I've been so inspired by Kobayashi-san's concepts as well, especially the thought of these emergent digital ecosystems and beings finding their existence in unexpected places within intranets. It truly feels like the kind of imaginative spark we need, and I'm really looking forward to the department brainstorming session you're planning. I've been mulling over some specific ideas myself, focusing on that ""hidden, extraordinary layer"" in our modern setting, things like subtle digital magic manifesting as glitches on billboards or even tiny creatures living within server racks. I'm eager to share these and see how they can fit into the boundary-pushing concepts you mentioned, and I especially want to hear the reflective insights from members like Kato-san on their narrative potential.","Nakamura's enthusiasm is just what I needed to hear! It’s fantastic to know that Kobayashi’s ideas are resonating with others in the department, not just me. Her mention of ""subtle digital magic manifesting as glitches on billboards or even tiny creatures living within server racks"" is brilliant – it's exactly the kind of concrete, imaginative detail that springs from the ""hidden, extraordinary layer"" concept I was hoping to unearth. It shows she's not just absorbing but actively building on the creative momentum.

And the fact that she explicitly wants to hear from members like Kato-san about narrative potential? That's perfect. It confirms that the departmental brainstorming session is absolutely the right next step. My goal was to create an environment where everyone feels comfortable sharing, especially those with a more reflective approach, and Nakamura's statement highlights that natural desire for diverse input. It's not just about throwing out wild ideas, but also about how those ideas can be shaped into compelling stories. This is really coming together nicely.

So, yes, the plan is definitely to talk to the whole department next: Nakamura, Kobayashi, Kato, Yoshida, Yamada, and Sasaki. I'll use both Kobayashi's and now Nakamura's initial sparks as examples to really kick off a productive, boundary-pushing brainstorming session. It’s going to be exciting to see what everyone brings to the table.",7,Success
