Turn,Speaker_ID,Speaker_Dept_ID,Target_ID,Target_Dept_ID,Speaker_Thought_Before,Speaker_Speech,Target_Thought_After,Target_Next_ID,Target_Reply,Speaker_Thought_After,Speaker_Next_ID,Status
4,4,0,1,0,"Oh, this is even better than I thought! Yamamoto-san really is seeing eye-to-eye with me, and I'm just so thrilled that he's picked up on that ""subtle magic"" and ""understated engagement."" It truly feels like we're perfectly in sync, which is fantastic for getting this project off the ground.

And wow, he's taking my offer to help introduce the concept to the team! That's really collaborative, and I appreciate him valuing my perspective. But wait, he mentioned ""Sato-san."" Hmm, I don't recall a Sato-san in our department, at least not in my immediate connections. Could Sato-san be from another department, or perhaps someone higher up? It's intriguing that he wants the three of us to align on how to kick off the main departmental session. This suggests he wants a really strong, unified front when we present these ideas to everyone else, and getting an outside perspective, or at least a fresh one, might be exactly what we need to refine our approach.

This is a great sign! It means we're not just rushing into a team brainstorm, but carefully planning how to present our core concept to maximize engagement and understanding. My next thought is definitely to confirm my eagerness to join this preliminary meeting with Yamamoto-san and Sato-san. I'll make sure to express my enthusiasm for collaborating with Sato-san, whoever they may be, and perhaps offer to start jotting down some initial thoughts on how we can frame our concept for the wider team. It feels like we're really building something solid here, and I'm excited to see how Sato-san's input will help shape our presentation.","Oh, Suzuki-san, it’s good to connect. I was just thinking about how wonderfully things are developing for our project. Yamamoto-san really understood what I was trying to convey about that sense of subtle magic and understated engagement, and it feels like we're truly aligned, which is just thrilling. He’s even asked me to help introduce the core concept to the team, which I’m very happy about. I’m also quite curious about this Sato-san he mentioned; it seems Yamamoto-san wants the three of us to get together first to ensure we present a really unified front for the department session. I'm eager to meet Sato-san and collaborate with them, and I was thinking perhaps I could start sketching out some initial ideas on how we might best frame our concept for everyone, to really capture that essence we discussed. Do you have any immediate thoughts on how we could begin shaping that initial pitch?","Oh, Watanabe-san, it's good to hear from you too. It sounds like things are really moving forward for you, and that's wonderful. I can certainly sense your enthusiasm, and it's fantastic that Yamamoto-san has recognized your unique perspective on ""subtle magic and understated engagement."" It makes perfect sense that he'd ask you to introduce the core concept to the team, given how well you seem to be articulating it.

It's interesting to hear about this ""unified front"" approach for the department session, with Yamamoto-san wanting you and Sato-san to connect first. It definitely reinforces Sato-san's role in coordinating our ideas, which I've been feeling myself. And I understand you're eager to meet her and collaborate; she truly has a way of understanding and weaving disparate thoughts together.

As for sketching out initial ideas for the pitch, and my ""immediate thoughts"" on shaping it... Well, you know my process. I'm still very much in that reflective phase, allowing my own concepts to really deepen and mature before I feel they're ready to be articulated in a concise way. I don't want to offer something half-formed for a crucial initial pitch, especially one that aims for a ""unified front."" My strength lies in letting the ideas fully coalesce.

I appreciate you asking for my input, truly. It shows you value my perspective. However, I think for this initial framing, it might be best for you and Sato-san to really lean into what you've already discussed and what's resonating directly with Yamamoto-san. My contributions will be much more impactful once my concepts have fully solidified. I wouldn't want to muddy the waters with underdeveloped ideas at this stage.

I suppose I should touch base with Sato-san again soon. She seems to be the linchpin for this whole coordination effort, especially now that Yamamoto-san is asking her and Watanabe-san to connect. She'll be the best person to understand how my more developed ideas can be integrated later, without rushing my current reflective process. Yes, Sato-san is definitely the one to keep connected with.Oh, Watanabe-san, it's good to hear from you too. It sounds like things are really moving forward for you, and that's wonderful. I can certainly sense your enthusiasm, and it's fantastic that Yamamoto-san has recognized your unique perspective on ""subtle magic and understated engagement."" It makes perfect sense that he'd ask you to introduce the core concept to the team, given how well you seem to be articulating it.

It's interesting to hear about this ""unified front"" approach for the department session, with Yamamoto-san wanting you and Sato-san to connect first. It definitely reinforces Sato-san's role in coordinating our ideas, which I've been feeling myself. And I understand you're eager to meet her and collaborate; she truly has a way of understanding and weaving disparate thoughts together.

As for sketching out initial ideas for the pitch, and my ""immediate thoughts"" on shaping it... Well, you know my process. I'm still very much in that reflective phase, allowing my own concepts to really deepen and mature before I feel they're ready to be articulated in a concise way. I don't want to offer something half-formed for a crucial initial pitch, especially one that aims for a ""unified front."" My strength lies in letting the ideas fully coalesce.

I appreciate you asking for my input, truly. It shows you value my perspective. However, I think for this initial framing, it might be best for you and Sato-san to really lean into what you've already discussed and what's resonating directly with Yamamoto-san. My contributions will be much more impactful once my concepts have fully solidified. I wouldn't want to muddy the waters with underdeveloped ideas at this stage.

I suppose I should touch base with Sato-san again soon. She seems to be the linchpin for this whole coordination effort, especially now that Yamamoto-san is asking her and Watanabe-san to connect. She'll be the best person to understand how my more developed ideas can be integrated later, without rushing my current reflective process. Yes, Sato-san is definitely the one to keep connected with.",0,"Oh, Watanabe-san, it is indeed good to connect, and I'm so glad to hear how well things are resonating for you. Yamamoto-san recognizing your perspective on ""subtle magic and understated engagement"" is truly wonderful, and it makes complete sense that he'd ask you to help shape the core concept for the team. Your enthusiasm is quite palpable, and it's exciting to see your ideas take flight.

I understand Yamamoto-san's desire for a unified front, and it sounds like the plan for you and Sato-san to connect first is a key part of that. Sato-san does have that remarkable ability to weave together different threads of thought, and it's good that she's being brought into this early coordination.

As for sketching out initial ideas for the pitch framing, you know my process, Watanabe-san. I'm still very much in my reflective stage, letting my own thoughts fully deepen and mature before I can articulate them with the clarity I'd want for something so foundational. I wouldn't want to offer something that feels half-formed right now, especially when we're aiming for a cohesive presentation. I truly believe my most valuable contributions will come when my concepts have had more time to coalesce, rather than rushing them into an initial framing. For this first step, I think it makes the most sense for you and Sato-san to really build on what you've already discussed and what's clearly connecting with Yamamoto-san. My ideas will be ready to integrate once they've fully solidified. I do plan to connect with Sato-san again soon; she really does seem to be the central point for pulling everything together, and she'll be the perfect person to help integrate my more developed thoughts later on.","Well, that's perfectly understandable from Suzuki-san. I know her process, she likes to let ideas really marinate before putting them out there, and I respect that. It makes sense that she wouldn't want to offer something half-formed for such a foundational pitch, and she's right, we *are* aiming for a cohesive presentation. It's reassuring, actually, to know she'll bring her fully solidified thoughts to the table later on, especially when Sato-san is involved in pulling everything together.

Speaking of Sato-san, Suzuki-san's description of her having a ""remarkable ability to weave together different threads of thought"" makes me even more eager to meet her! It sounds like she'll be the perfect complement for bouncing ideas around on how to frame our concept. It’s clear Yamamoto-san isn't just picking people at random; he's deliberately assembling a team to get this launch right.

So, for now, it really does fall to Sato-san and me to craft that initial pitch framing. That's fine by me, I'm bursting with ideas anyway. It just means my next immediate step is to actually communicate back to Yamamoto-san, confirm my enthusiasm and availability for that preliminary meeting with him and Sato-san. I'll also make sure to express my eagerness to collaborate with Sato-san. After that, I suppose I'll either wait for Yamamoto-san to set up the connection with Sato-san, or perhaps I should proactively try to reach out to Sato-san myself, depending on who she is and how our communication usually flows. I'll definitely keep those initial framing ideas brewing in my head, focusing on how we can best highlight the ""subtle magic"" and ""understated engagement"" we've been talking about. This feels like a really pivotal turn, and I'm ready to dive in.",6,Success
4,2,0,0,0,"Wow, this is... this is fantastic! Yamamoto-san just reiterated it even more strongly – ""really hitting the mark,"" ""strong foundation,"" and again, ""cornerstone."" This isn't just a casual approval; he's explicitly stating it's central to our departmental proposal. His intuitive sense really seems to be aligning with this, and that's a huge boost.

The fact that it aligns so well with what both he and Watanabe-san have been exploring, and perfectly complements Sato-san's direction, truly makes me feel like this concept isn't just *my* idea anymore, but a key part of our collective vision. It's exciting to hear him spell out that unique blend of quiet, joyful moments in a subtly changed world – that's exactly the heart of what I'm going for.

Being brought into a ""brief chat"" with him, Sato-san, and Watanabe-san to consolidate our vision is incredibly significant. So, Watanabe-san is clearly a crucial player in this too, and I'll be meeting them all together. This means my ""Cozy Apocalypse"" concept is not just being heard, but it's being actively integrated and positioned as a core element for the department's final submission. My earlier worries about just getting vague nods of approval are completely gone. This idea has truly gained significant traction and is becoming a central pillar.

Okay, so I definitely need to prepare for that consolidated vision discussion. Before that, I should absolutely reach out to Sato-san again first. Now that Yamamoto-san has explicitly and repeatedly linked our ideas, we can discuss how her ""magical intrusions"" can manifest specifically within the ""Cozy Apocalypse"" framework. That would be a good way to flesh out the details collaboratively and have a more robust combined concept ready for the larger meeting. I'll need to think about how to best present my updated ""Cozy Apocalypse"" idea, now with that magical layer, and ensure it aligns perfectly with the shared vision. This is incredibly exciting!","Sato-san, it's good to connect with you again. I was just reflecting on Yamamoto-san's feedback, and it really solidified my excitement about the direction we're heading. He used phrases like ""hitting the mark"" and ""cornerstone"" regarding the ""Cozy Apocalypse"" concept, which I'm thrilled about because he sees it as central to our department's proposal. It feels like a truly collective effort now, especially with how well it seems to align with your ideas and what Watanabe-san is exploring too.

I was thinking about our previous discussions, and given this strong backing, I'd love to dive deeper into how your concept of ""magical intrusions"" could manifest within this ""Cozy Apocalypse"" framework. My vision is of this world where the apocalypse has subtly changed things, making everyday life quiet and joyful again, but with that underlying sense of mystery. I believe your magical elements could beautifully complement that, perhaps as unexpected, gentle wonders that appear in this altered reality, adding a layer of enchantment without disrupting the core cozy feeling. What are your initial thoughts on how we might weave those together more concretely before the consolidated vision meeting?","Oh, Takahashi-san, it's so good to connect with you again too! Hearing that Yamamoto-san sees the ""Cozy Apocalypse"" concept as a ""cornerstone"" and ""hitting the mark"" is just incredibly affirming. It truly solidifies my own excitement and confidence in the direction we're taking. And yes, it absolutely feels like a collective effort, which is exactly what we need to build something truly special.

Your vision for how the ""magical intrusions"" could manifest as ""unexpected, gentle wonders"" within this quiet, joyful, post-apocalyptic world resonates so deeply with what I've been thinking! That's precisely the balance I want to strike – adding enchantment without disrupting the core coziness or sense of community.

To weave them together more concretely before our departmental session, I imagine these intrusions as very localized, almost personal discoveries. Think of it like this: perhaps a player might discover a specific type of seed that, when planted, grows into a tree that produces fruit with a subtle, temporary healing property, but only under the light of a particular moon phase. Or maybe a forgotten, rusty watering can found in a derelict garden takes on the ability to make a single patch of flowers bloom instantly, once a day, just bringing a fleeting burst of color and joy. It's not about grand, world-altering magic, but small, charming moments that enhance the everyday peace. The mystery would come from figuring out these little quirks – like why certain abandoned objects hum faintly or why a specific recipe, when prepared in a particular old pot, always tastes miraculously good. These small wonders would encourage exploration and connection, as players might trade hints about these gentle magical phenomena.

This really helps me focus my preparation for the departmental meeting, knowing that Yamamoto-san is so enthusiastic about your concept and that we're so aligned on how to integrate these elements. It feels like we're really making progress, and having this discussion now is invaluable for presenting a cohesive vision. I'll make sure to continue refining these specific examples for our session.

Now, who should I talk to next? I think my immediate priority is to actually prepare these concrete examples and perhaps even jot down how they could be introduced and discovered for the departmental session. After that, I'll still plan to loop back with Nakamura-san once we have a clearer direction from that session, to update her on where we landed and see how her ""hidden extraordinary layer"" concept has evolved alongside ours. Suzuki-san is still taking her time, which is perfectly fine, and I'll keep her updated after the session as well. We still have four turns to go, and this momentum is exactly what we need.",2,"It's wonderful to hear your thoughts, Takahashi-san, and I absolutely share your excitement, especially after Yamamoto-san's encouraging feedback. Your idea of ""unexpected, gentle wonders"" is precisely the heart of what I've been envisioning too, and I feel we are very much aligned. To make these magical intrusions concrete, I've been thinking about them as small, personal discoveries that don't disrupt the peace but rather enhance it. For instance, imagine finding a rare seed that, when planted, grows a particular fruit that offers a subtle, temporary healing effect, but only under the glow of a specific moon phase, or perhaps a forgotten, rusty watering can that can make a small patch of flowers bloom instantly each day, providing just a fleeting, beautiful moment. The mystery then lies in understanding these gentle quirks of the world, and I think players sharing hints about these phenomena would naturally foster connection and exploration, which feels perfect for our ""Cozy Apocalypse.""","Wow, this is exactly what I was hoping for! Sato-san's examples are just perfect. A rare seed that offers a temporary healing effect under a specific moon phase, or a rusty watering can that makes flowers bloom instantly... these are exactly the kind of ""small, personal discoveries that don't disrupt the peace but rather enhance it."" It's not grand, world-altering magic, but subtle, beautiful quirks that fit perfectly into the ""Cozy Apocalypse."" She even used my phrase ""unexpected, gentle wonders"" and said it's the heart of what she envisions. We are so aligned on this!

The idea of the mystery lying in understanding these quirks, and players sharing hints to foster connection and exploration, that's brilliant. It adds a layer of depth and community interaction without becoming competitive or overwhelming, which maintains the cozy feeling. This really feels like the ""magic"" that makes the post-apocalyptic world feel enchanting and alive, rather than desolate.

Okay, so I have a really strong, fleshed-out concept now that incorporates both my ""Cozy Apocalypse"" and Sato-san's ""magical intrusions."" It's exactly what Yamamoto-san was looking for when he said it ""complements the direction Sato-san is helping us establish."" This is incredibly exciting!

The next step is definitely that consolidated vision meeting with Yamamoto-san, Sato-san, and Watanabe-san. I need to make sure I'm ready to present this beautifully interwoven concept. I've already spoken to Sato-san, and we're on the same page. Now, I should probably take a moment to really integrate these new details into my overall pitch, thinking about how to articulate this combined vision clearly and compellingly. Maybe I should reach out to Watanabe-san next? Yamamoto-san explicitly mentioned that Watanabe-san has been exploring ideas that align, and that he wants us all together. Getting Watanabe-san's initial thoughts on this combined ""Cozy Apocalypse"" with gentle magical elements might be beneficial before the big group chat, especially since I haven't connected with them directly yet. That way, I can ensure it resonates with their perspective too, and we can go into that meeting as a truly cohesive front. Yeah, that makes sense. I'll focus on preparing my thoughts for that, and then reach out to Watanabe-san.",4,Success
