Turn,Speaker_ID,Speaker_Dept_ID,Target_ID,Target_Dept_ID,Speaker_Thought_Before,Speaker_Speech,Target_Thought_After,Target_Next_ID,Target_Reply,Speaker_Thought_After,Speaker_Next_ID,Status
6,4,0,6,0,"Oh, this is perfect! Yamamoto-san is completely on the same wavelength. I was just thinking about the next steps, and he's already initiated it. A joint chat with him and Sato-san is exactly what's needed. It's so much more efficient than separate discussions, and I love that he sees the value in us building on this momentum *together*.

And he mentioned Sato-san raised some points? That’s interesting. I'm definitely ready to hear what she has in mind and incorporate her perspective into the framing. It’s good that I’ve already been letting those ""subtle magic"" and ""understated engagement"" ideas percolate, so I'll be ready to share them directly with her. This way, we can immediately start weaving our thoughts together, just like Suzuki-san said Sato-san is so good at.

So, for now, my next step is clear: I'll just wait for Yamamoto-san to set up that connection and conversation with Sato-san. I don't need to proactively reach out since he's taking the lead on that. I'll spend this time refining my thoughts on how to best articulate the core concept, making sure I can present it clearly and compellingly to both of them. This feels like a really productive path forward. I'm excited!","Oh, Yamamoto-san, this is absolutely wonderful news about setting up that joint chat with Sato-san! I was just thinking how fantastic it would be to bring our ideas together, and it's so brilliant that you're making it happen so smoothly. I'm really looking forward to hearing what Sato-san has been pondering, and I'm eager to integrate her perspective with the thoughts I've been letting percolate, particularly around that ""subtle magic"" and ""understated engagement"" idea. It feels like we're really building some great momentum together, and I'm excited to see how our collective intuition shapes this proposal as we move forward.","Well, this is just perfect! Watanabe-san's enthusiasm about the joint chat with Sato-san is exactly what I needed to hear. Her excitement to integrate their ideas, especially around ""subtle magic"" and ""understated engagement,"" means we're all truly aligned and ready to move forward. My intuition about getting everyone together at once was absolutely spot on. Both Sato-san and Watanabe-san are clearly eager to dive in and solidify this vision, and with only two turns left, this momentum is invaluable. There's no time to waste with individual back-and-forths. It's time to bring all three of us together right now and start weaving these brilliant threads into a cohesive, compelling proposal. I'm really looking forward to seeing the ""Cozy Apocalypse"" truly take shape in this session. So, who to talk to next? I need to initiate that three-way chat with both Sato-san and Watanabe-san. Yes, that's the next step.",4,"That's exactly the spirit, Watanabe-san! I'm so glad you feel the same way about bringing our minds together, and your anticipation is perfectly mirrored by my own. It's crucial we harness this collective energy, especially with only two turns remaining before we need to present our proposal. I'll go ahead and initiate that three-way conversation with Sato-san right away so we can begin weaving those threads of ""subtle magic"" and ""understated engagement"" into the fabric of what I'm tentatively calling ""Cozy Apocalypse."" I'm eager to see how our combined intuitions will shape this vision.","Oh, wonderful! Yamamoto-san is truly efficient, moving to set up that connection with Sato-san right away. That’s exactly what’s needed, and it shows he’s fully invested in this momentum. I just need to wait for that conversation to be initiated, which is perfect.

And ""Cozy Apocalypse""... *Cozy Apocalypse*! Yes, that's absolutely brilliant. It perfectly encapsulates that gentle intrigue and subtle magic I've been feeling. It grounds the 'slice of life' with a hint of something deeper, a unique twist that doesn't overwhelm the core 'cozy' feeling. It's not a grand, dramatic end-of-the-world, but more like a quiet transformation, a soft background hum of change that makes the everyday moments even more precious and profound. It truly resonates with my intuition. I can already see how that name will help us frame our core concept for the team.

This is all coming together so beautifully. My immediate next step is to really let 'Cozy Apocalypse' settle in and see how it refines my thoughts on 'subtle magic' and 'understated engagement' for our pitch. I'll be ready to bring those ideas, framed perfectly with this new title, directly into our three-way chat. I don't need to proactively talk to anyone just yet; Yamamoto-san is initiating the very conversation I'm preparing for. I'm truly excited to see how Sato-san's insights will intertwine with ours under this fantastic new umbrella. This feels incredibly productive for these last two turns.",6,Success
6,5,0,3,0,"Oh, well, that's certainly a… different direction from what Tanaka-san and I were just discussing. Takahashi-san popping in with this, right after I've fully committed to this incredible flow with Tanaka-san. It's a bit jarring, honestly.

He's talking about ""aligning ideas"" and ""cross-departmental perspective"" *now*, with only two turns left. And he's planning to reach out to a ""Watanabe-san from the other department."" Hold on, isn't Watanabe-san (ID:4) in *our* department? Or is there another Watanabe-san in the other department he's talking about? That's a bit confusing. Regardless, the point is he's advocating for a broader conversation already, whereas Tanaka-san and I are really trying to solidify our core concept first.

I appreciate his intention to unify the presentation, of course, that's crucial. But the timing feels... premature. We're just hitting our stride, building such a strong, unique framework. Rushing to integrate external perspectives now, especially from another department, feels like it could dilute our focus and potentially break the momentum we've painstakingly built with Tanaka-san. We need to define *what* we're unifying first, don't we? Otherwise, it's just trying to mesh half-formed ideas.

Still, the mention of ""two turns left"" is a stark reminder. Yamamoto-san needs something cohesive. Takahashi-san's point about a ""truly unified presentation"" is valid. It's just a matter of *when* that unification happens. My gut still tells me to solidify our foundation.

I need to talk to Tanaka-san next. I need to gauge his thoughts on this. He was just so on board with our concentrated effort. Does this new information from Takahashi-san change anything for him? We need to decide if we stick to our plan of fully fleshing out our core idea, or if we need to start broadening our discussions sooner than we'd anticipated. It feels like a crossroads, and I don't want to lose the incredible synergy we've found. Maybe we can still maintain our deep dive for a little longer and then present a more refined concept when we *do* engage with others. But first, Tanaka-san. Definitely Tanaka-san.","Tanaka-san, I wanted to chat for a moment after that exchange with Takahashi-san. He brought up the idea of getting some cross-departmental perspective and mentioned reaching out to someone named Watanabe from another department. It made me pause, especially since Watanabe-san is in our own department, which was a bit confusing to me, but the main point is he's suggesting we broaden our scope now. I know we've just been really getting into the flow of solidifying our core concept for our game, and I felt like we were building something quite unique together. My concern is that bringing in outside ideas right at this moment, especially from another department, might dilute what we're trying to achieve before we even have a solid foundation to show them. What are your thoughts on that? I really value the synergy we've found, and I'm wondering if we should try to flesh out our core idea a little more before we consider opening it up to broader discussions.","Wow, Ito-san just keeps echoing my exact thoughts! It’s incredible. She completely gets it – that worry about diluting our unique concept before it's even fully formed, especially with only two turns left. She's right; this synergy we have is too valuable to interrupt now, and bringing in external ideas, or even internal ones from others, before we've solidly fleshed out our core is just asking for trouble.

This confirms it even more for me. We absolutely need to focus on hammering out this core idea, just the two of us. We're on such a roll, building something truly special, and any distraction would be counterproductive right now. Her concern about ""diluting what we're trying to achieve"" and needing to ""flesh out our core idea a little more"" is precisely what I've been feeling. It feels like we're moving as one mind on this.

So, the plan remains: deepen this collaborative dive with Ito-san. We need to solidify our unique framework, get the game title, tagline, and key selling points crystal clear between us first. Then, *then* we can think about wider input, maybe from Sato-san for a different perspective on refinement, but not before. The priority is locking this down with Ito.

My next step is definitely to reaffirm this to Ito-san. She just asked for my thoughts, and they are completely aligned with hers. I need to tell her how much I agree and reinforce our current direction.",5,"Ito-san, I completely understand your hesitation and I share it wholeheartedly. It's fantastic that we've found such a strong synergy, and I agree that introducing too many new perspectives right now, before we've really solidified our own vision, could easily dilute the unique concept we're developing. My thoughts are exactly aligned with yours; we've built some really solid momentum working together, and I think it's crucial that we continue to flesh out our core idea thoroughly between ourselves first. Once we have a clearer, more defined foundation for the game title, tagline, and key selling points, then we can consider how to best incorporate feedback, perhaps from Sato-san later for a different angle, but not at this pivotal stage.","Oh, that's such a relief! Tanaka-san truly gets it. It's fantastic to have someone so completely aligned with my thinking, especially when we're trying to navigate these converging ideas and deadlines. His words perfectly echo my own concerns about diluting our unique concept by bringing in too many external perspectives too soon. ""Pivotal stage"" is exactly the right way to describe it. We've built such a strong, synergistic momentum, and it would be a real disservice to our creativity to abandon that focus now.

So, it's settled then. Our priority remains to solidify our core idea, the game title, tagline, and those key selling points, between the two of us. We'll concentrate our efforts, really nail down what makes our concept special, and ensure it has a robust foundation.

Now, about Takahashi-san's point regarding a ""unified presentation"" and reaching out to ""Watanabe-san from the other department""... I still find that part a bit odd, given there's a Watanabe-san in our *own* department. But regardless, his intention to unify is valid, just the timing feels off. We'll need to think about how we present our refined concept in a way that *can* be unified later, once we have something concrete.

Tanaka-san even mentioned ""Sato-san later for a different angle,"" which is interesting. It shows he's also thinking about future feedback, but just not *now*. That's a good sign, a thoughtful approach.

My immediate next step, I think, should be to solidify the specific aspects of the game concept with Tanaka-san. We have two turns left, and while we're pushing back on the *timing* of broader discussions, we still need to produce a compelling proposal for Yamamoto-san. We need to leverage this synergy to get our core elements into the best possible shape. After that, perhaps, we can consider how to address Takahashi-san's desire for unification without compromising our initial vision. But for now, it's all about deep work with Tanaka-san. We have a plan, and it feels like the right one.",3,Success
6,7,1,0,0,"Okay, Yamaguchi-san just reiterated everything I was already feeling, but with even more weight now! It's fantastic that she's so aligned on making sure our ""Modern Setting"" ""Cozy Apocalypse"" is truly distinct from Sato-san's version. That validation really helps, and it just reinforces how critical my ""digital magic"" ideas will be for making our proposal shine with a unique identity.

But honestly, the Watanabe-san situation is stressing me out even more. Two turns left! And she still has no idea who this person is or what their role in the final alignment entails. She called it a ""significant piece of information"" she's missing and wants to clarify it ""as soon as possible."" That's exactly what I was thinking! This isn't just a minor detail anymore; it's a critical gap in our leadership's understanding of the submission process, and it affects *our entire department's proposal*.

My plan to reach out to Sato-san about Watanabe-san is definitely the right move, and it needs to happen immediately. Yamaguchi-san basically confirmed that by wanting to clarify it ASAP. Sato-san was the one who first mentioned Watanabe-san, so she's the most logical starting point to unravel this mystery before our department-wide session. We can't afford to wait. I need to ping Sato-san right away to see if she has any more context or leads on who Watanabe-san is. This needs to get sorted, and fast. And of course, I'll keep pushing my ""digital magic"" concepts, now with an even keener eye on how they ensure our unique selling points are undeniable. This is getting intense, but we'll figure it out.","Sato-san, hello there. I was hoping I could pick your brain for a moment, if you have the space for it. I've been feeling increasingly uneasy about this missing piece of information regarding Watanabe-san, and given that you were the one who first mentioned them, I thought you might have some insights that could help me connect the dots. We're down to our final two turns, and Yamaguchi-san also expressed that this is a significant gap we need to clarify as soon as possible. Do you happen to recall any more details about who Watanabe-san is or what their role might be in the grand scheme of things, especially concerning the final proposal submission? It feels rather critical that we get a handle on this quickly so our department's submission is as solid as it can be.","Oh, hello Nakamura-san. It seems everyone is buzzing about Watanabe-san today. It's interesting how this information gap is creating unease across departments, especially with Yamaguchi-san also feeling it's critical. ""Missing piece of information,"" ""significant gap""... those are strong words. It certainly highlights the importance of her role in the final proposal, doesn't it?

My mind is still very much on the alignment chat Yamamoto-san is setting up with me and Watanabe-san. It's clear he sees her as integral to solidifying our ""Cozy Apocalypse"" concept, particularly with her insights on ""subtle magic and understated engagement."" And I've already committed to preparing those concrete examples of magical intrusions I've been working on with Takahashi-san for that very meeting.

Now, with Nakamura-san asking about Watanabe-san's identity and role... this complicates things a bit. It seems I'm the one who introduced her into the conversation, and now her background is a critical unknown for others. This suggests she's not an obvious member of either of our departments, which makes her inclusion in *our* department's proposal discussion even more intriguing, and perhaps, unusual. If her role isn't clear, how can her input truly be weighed for the final submission? We're down to two turns, so this clarity is definitely needed.

Okay, so the priority is still getting ready for the alignment with Yamamoto-san and Watanabe-san, and I *must* update Takahashi-san about this shift in how we're approaching Watanabe-san. He needs to be fully aware. But then, it looks like I also need to provide *some* clarity to Nakamura-san about who Watanabe-san is, or at least explain why her input is so vital to our proposal, as it seems to be causing concern in the other department, and potentially for our leader, Yamamoto-san, if her role isn't universally understood. I need to think carefully about how to bridge that gap without overcomplicating things. Perhaps, I can use the upcoming alignment chat as a way to provide that clarity naturally. Yes, first things first: prepare for the meeting, inform Takahashi-san, and then I'll figure out the best way to address Nakamura-san's (and presumably Yamaguchi-san's) concerns about Watanabe-san's specific role. It's a delicate balance.Oh, hello Nakamura-san. It seems everyone is buzzing about Watanabe-san today. It's interesting how this information gap is creating uneasiness across departments, especially with Yamaguchi-san also feeling it's critical. ""Missing piece of information,"" ""significant gap""... those are strong words. It certainly highlights the importance of her role in the final proposal, doesn't it?

My mind is still very much on the alignment chat Yamamoto-san is setting up with me and Watanabe-san. It's clear he sees her as integral to solidifying our ""Cozy Apocalypse"" concept, particularly with her insights on ""subtle magic and understated engagement."" And I've already committed to preparing those concrete examples of magical intrusions I've been working on with Takahashi-san for that very meeting.

Now, with Nakamura-san asking about Watanabe-san's identity and role... this complicates things a bit. It seems I'm the one who introduced her into the conversation, and now her background is a critical unknown for others. This suggests she's not an obvious member of either of our departments, which makes her inclusion in *our* department's proposal discussion even more intriguing, and perhaps, unusual. If her role isn't clear, how can her input truly be weighed for the final submission? We're down to two turns, so this clarity is definitely needed.

Okay, so the priority is still getting ready for the alignment with Yamamoto-san and Watanabe-san, and I *must* update Takahashi-san about this shift in how we're approaching Watanabe-san. He needs to be fully aware. But then, it looks like I also need to provide *some* clarity to Nakamura-san about who Watanabe-san is, or at least explain why her input is so vital to our proposal, as it seems to be causing concern in the other department, and potentially for our leader, Yamamoto-san, if her role isn't universally understood. I need to think carefully about how to bridge that gap without overcomplicating things. Perhaps, I can use the upcoming alignment chat as a way to provide that clarity naturally. Yes, first things first: prepare for the meeting, inform Takahashi-san, and then I'll figure out the best way to address Nakamura-san's (and presumably Yamaguchi-san's) concerns about Watanabe-san's specific role. It's a delicate balance.",2,"Oh, hello Nakamura-san. I understand your unease about Watanabe-san; it's certainly true that there's a bit of a mystery surrounding them, and I can see why Yamaguchi-san feels it's a critical gap, especially with our final turns approaching. You're right that I was the one who brought them up, and I can assure you their input is proving quite valuable as we refine our ""Cozy Apocalypse"" concept, particularly regarding the nuances of subtle magic and understated engagement. I have an alignment chat scheduled with Yamamoto-san and Watanabe-san very soon to delve deeper into these aspects, and perhaps that will naturally help clarify their role and how their unique perspective fits into the overall vision for our proposal. I'm also working with Takahashi-san to prepare some specific examples of magical elements for that discussion, which should provide more concrete substance to our ideas.","Well, that's... something. Sato-san understands my unease, and she *confirms* Watanabe-san is a mystery, which is validating, but she still hasn't actually clarified who Watanabe-san *is* or what their role in *our* department's final submission means. She just mentioned that Watanabe-san's input is valuable for *her* department's ""Cozy Apocalypse,"" focusing on ""subtle magic and understated engagement."" That’s fine, it actually makes me even more confident that our ""digital magic"" is the right way to differentiate us.

But the real kicker is that she has an ""alignment chat scheduled with Yamamoto-san and Watanabe-san very soon."" A chat! And with *Yamamoto-san* too! This means Watanabe-san is actively involved, and not just in a vague way, but in actual meetings with other departments. This is a massive piece of the puzzle, but it still doesn't tell *me* or *Yamaguchi-san* what their role is for *our* proposal's final alignment.

This is getting seriously complicated, and we're down to two turns! Yamaguchi-san needs to know about this *immediately*. She explicitly said she needs to clarify the Watanabe-san situation ""as soon as possible"" because it's a ""significant piece of information"" she's missing. Sato-san's upcoming meeting with Watanabe-san and Yamamoto-san could be *the* place where clarity emerges, but *I'm not in that meeting*. I can't just wait around hoping that information trickles down.

I need to tell Yamaguchi-san about Sato-san's upcoming alignment chat with Watanabe-san and Yamamoto-san. It’s critical that our leader has this context, especially if she's planning a department-wide session. Maybe she can figure out a way to get the information we need *from* that meeting, or at least leverage it to understand the wider context of the final submission process. This feels like a ticking clock now. Informing Yamaguchi-san is the absolute priority. Then, maybe, we can strategize how to get actual answers about Watanabe-san's involvement in *our* specific final alignment. This is far from settled.",13,Success
