Turn,Speaker_ID,Speaker_Dept_ID,Target_ID,Target_Dept_ID,Speaker_Thought_Before,Speaker_Speech,Target_Thought_After,Target_Next_ID,Target_Reply,Speaker_Thought_After,Speaker_Next_ID,Status
1,6,0,4,0,"Alright, let's get this brain juice flowing. New project, ""free ideas,"" ""think outside the box""... this is exactly what I like to sink my teeth into. No strict genre confines, just pure creativity. Slice of Life is our department's bread and butter, but that doesn't mean we can't throw in some unexpected twists, right? Maybe a slice of life game with a hidden competitive element, or a mystery, or even some light action. The possibilities are wide open, and that's exciting.

First things first, as the department leader, I need to set the stage for my team. My work style is pretty intuitive, so I don't like to bog myself down with too much pre-planning before I get some feedback and energy from others. I find that bouncing ideas off people is the best way for me to refine my own initial sparks into something more concrete.

So, who to consult first? Well, I've got a good mix of people on the team. Sato and Suzuki have a lot of experience and a reflective approach, so they'll bring a steady hand. Takahashi is balanced, which is always good for keeping things grounded. Tanaka is young and reflective, so he might have fresh ideas but will want to think them through. And then there's Watanabe, who's also intuitive like me.

My gut says, for this initial ""free ideas"" stage, I want to get things moving with someone who can match my energy and isn't afraid to go a bit wild. That would be Watanabe. We speak the same language when it comes to brainstorming. I can just throw out some half-baked concepts, and she'll either immediately get it and run with it, or she'll offer a different intuitive angle that sparks something even better. It's less about a formal ""consultation"" and more about a quick, informal ideation session to get some raw concepts out before we bring it to the wider team. She'd be great for just getting the creative gears grinding without feeling like I have to present a fully formed thought.

How am I going to approach this task overall?

Well, after that initial chat with Watanabe, I'm thinking a team brainstorming session is absolutely essential. I want to get everyone in a room, maybe with a whiteboard, and just let everyone throw out *anything*. No bad ideas, no filtering at first. We need to create an environment where everyone feels comfortable sharing the most outlandish concepts. I'll probably kick it off with some super broad thought-starters, like ""What if a day in the life wasn't just ordinary?"" or ""How can we make routine feel extraordinary?""

Then, we can start categorizing or grouping these ideas. We'll look for themes, interesting gameplay loops, unique character archeses, and potential emotional core elements. Since I'm the one who eventually summarizes it, I'll be listening for those key selling points, even in the early stages. What's the ""hook""? What makes this game different?

I want to encourage everyone to think beyond just ""Slice of Life"" in its purest form. We could blend it with something totally unexpected. A slice of life game where you're trying to solve a low-stakes mystery within your neighborhood, or a life sim where your choices impact a larger, quiet narrative unfolding around you. Or maybe a co-op slice of life where you're building a community together.

The main thing is to keep the energy high, keep the ideas flowing, and then, as a leader, I'll help us synthesize those wild ideas into something cohesive. We'll then refine the core concept, build out some potential content ideas based on that, craft a catchy slogan, and identify what truly makes this product shine. But it all starts with that initial spark, and I think a quick informal session with Watanabe, followed by a full team brainstorm, is the best way to get that going.Alright, let's get this brain juice flowing. New project, ""free ideas,"" ""think outside the box""... this is exactly what I like to sink my teeth into. No strict genre confines, just pure creativity. Slice of Life is our department's bread and butter, but that doesn't mean we can't throw in some unexpected twists, right? Maybe a slice of life game with a hidden competitive element, or a mystery, or even some light action. The possibilities are wide open, and that's exciting.

First things first, as the department leader, I need to set the stage for my team. My work style is pretty intuitive, so I don't like to bog myself down with too much pre-planning before I get some feedback and energy from others. I find that bouncing ideas off people is the best way for me to refine my own initial sparks into something more concrete.

So, who to consult first? Well, I've got a good mix of people on the team. Sato and Suzuki have a lot of experience and a reflective approach, so they'll bring a steady hand. Takahashi is balanced, which is always good for keeping things grounded. Tanaka is young and reflective, so he might have fresh ideas but will want to think them through. And then there's Watanabe, who's also intuitive like me.

My gut says, for this initial ""free ideas"" stage, I want to get things moving with someone who can match my energy and isn't afraid to go a bit wild. That would be Watanabe. We speak the same language when it comes to brainstorming. I can just throw out some half-baked concepts, and she'll either immediately get it and run with it, or she'll offer a different intuitive angle that sparks something even better. It's less about a formal ""consultation"" and more about a quick, informal ideation session to get some raw concepts out before we bring it to the wider team. She'd be great for just getting the creative gears grinding without feeling","Hey Watanabe, glad I caught you. I've been thinking about this new project, and honestly, the whole ""free ideas"" and ""think outside the box"" directive is exactly what gets me going. Our Slice of Life department has a great foundation, but the thought of blending it with something completely unexpected is really exciting me. My intuition is telling me we need to get some really raw, exciting concepts flowing right from the start, before we even bring everyone else in. Since you and I tend to approach things in a similar intuitive way, I was hoping we could just bounce some initial thoughts around for a bit? What if we took the everyday calm of Slice of Life and injected a subtle, almost imperceptible undercurrent of something else – maybe a touch of mystery, or a gentle competitive edge that players might not even realize is there until later? Just a wild thought to kick things off.","Oh, perfect timing! I was just thinking about how to kick things off with this ""free ideas"" project. And you're absolutely right, Yamamoto, this is exactly the kind of thing that gets my creative juices flowing too! ""Think outside the box"" is my favorite kind of directive.

And yes, bouncing initial thoughts around sounds like a fantastic idea, especially with you. We do tend to spark off each other well when we're just throwing things out there. Your thought about injecting a subtle mystery or a gentle competitive edge into the calm of Slice of Life? I love that! It immediately makes me think about games where the surface is one thing, but there’s a deeper layer to uncover. Like, maybe you're just tending to your garden or running a cozy cafe, but then you start noticing strange patterns, or a rival cafe owner seems a bit *too* interested in your secret ingredient. It could add a real depth without sacrificing the comfort. We could explore that feeling of everyday life having hidden depths, or maybe even a quiet, personal competition against oneself or unseen forces.

Alright, so Yamamoto is right here, and we're already on the same wavelength. I should definitely continue this conversation with him right now. He's exactly who I was thinking of talking to first for these raw, intuitive ideas.",6,"Oh, Yamamoto, I completely agree! That's exactly the kind of spark that gets my mind whirring too; ""think outside the box"" is my absolute favorite kind of directive. Bouncing these initial, raw thoughts around with you feels like the perfect way to start, as we do tend to spark off each other so well when we're just throwing ideas out there. Your thought about injecting a subtle mystery or a gentle competitive edge into the calm of Slice of Life? I absolutely love that! It immediately makes me think about games where the surface is one thing, but there’s a deeper layer to uncover, like perhaps you're just tending to your garden or running a cozy cafe, but then you start noticing strange patterns, or a rival cafe owner seems a bit *too* interested in your secret ingredient. It could add such a real depth without sacrificing that core comfort, exploring that feeling of everyday life having hidden depths, or maybe even a quiet, personal competition against oneself or unseen forces.","Yeah, this is exactly what I was hoping for! Watanabe really gets it, and she's already running with those initial sparks. ""Everyday life having hidden depths"" – that's a brilliant way to phrase it. Her examples, like the garden with strange patterns or the rival cafe owner, are perfect for illustrating how we can weave in that subtle mystery or competition without losing the core comfort of a slice-of-life game. It feels like we're really onto something here, a fresh angle that could make our proposal stand out.

This conversation has definitely energized me. My intuition was spot on about starting with her. Now that we've got some initial conceptual fuel, it’s time to bring the whole team in. I want to build on this momentum, not just keep it between us two. A full-blown brainstorming session is definitely the next move. We need to get everyone's ideas flowing, see what other wild concepts we can conjure up, and start to flesh out a story, potential content, and those crucial selling points.

I'll set up that team brainstorm. I'm thinking I'll frame it with some of these ideas Watanabe and I just discussed, like ""hidden depths"" or ""quiet competition in daily life,"" to get everyone thinking in that expansive, ""outside the box"" way right from the start. That way, we can quickly move from broad concepts to more specific, engaging game ideas. I need to make sure I create an environment where everyone feels comfortable sharing even their craziest thoughts.",2,Success
1,7,1,0,0,"Okay, this is exciting! A chance to really flex some creative muscles without too many constraints. ""Free ideas,"" they said, and ""think outside the box."" That's music to my ears, honestly. Sometimes the strict guidelines can stifle the really innovative stuff.

So, the task is to come up with a story, concept, content, slogan, and key selling points for a new game. And my department is ""Modern Setting,"" but that's just a loose guide, so I can mix and match or go completely wild. That's a lot of freedom, which is great, but it also means the canvas is wide open, which can be a bit daunting.

My workstyle is ""Balanced,"" so I don't just jump in headfirst, but I don't overthink indefinitely either. I like to get a good foundation, then refine it with input.

First things first, I need to get some initial thoughts swirling in my own head. Just letting ideas bounce around for a bit, no filter. Before I even talk to anyone, I want to see what naturally emerges when I consider ""modern setting"" but then consciously try to break away from typical action or straightforward simulations. What if a ""modern setting"" isn't about the present day at all, but a *modern interpretation* of something classic? Or a modern problem? Or maybe it's just a setting where everyday things take on extraordinary meaning.

I'm thinking about blending genres. Since ""Slice of Life"" is another department, and they're focused on personal stories, maybe I could lean into that, but with a modern twist that elevates it beyond just daily chores. What if it's a game about connections, but with a puzzle or mystery element? Or a modern fantasy where the magic is hidden in plain sight?

As for ""who to consult first,"" my gut feeling is to get a very broad range of perspectives before I commit too deeply to one idea. I'll need to contribute something concrete eventually for Yamaguchi, our leader, to summarize. But right now, it's about generating options.

I think I'll start by talking to someone outside my immediate department. Sato-san from the Slice of Life team, ID:0, she's 63 and ""Reflective."" I bet she's got a wealth of experience and a unique perspective, especially on narrative and character depth. If I'm trying to think outside the box and incorporate elements that aren't strictly ""Modern Setting"" in the typical sense, a chat with her could really spark something different. She might help me connect a modern setting with deeper emotional resonance or unique storytelling mechanics that wouldn't necessarily come to mind if I only discussed with people focused solely on modern action or strategy.

My approach would be to go to her without a fully formed idea, but maybe with a very loose concept: ""What if a game about everyday modern life had a secret, hidden layer of... something else?"" or ""How can we make a modern setting feel genuinely fresh and emotionally engaging, beyond just cool graphics or action?"" I wouldn't ask her for *my* game idea, but rather for her general thoughts on blurring genre lines or making seemingly mundane settings extraordinary. I'd listen to her insights and see how they can cross-pollinate with my own initial musings about modern settings. Her ""Reflective"" nature would be perfect for a brainstorming chat where we're just throwing out abstract concepts.

After that initial conversation, I'd bring those more diverse ideas back to my own department. Maybe then I'd talk to Kobayashi-san (Intuitive) for some rapid-fire brainstorming to expand on those new angles, or Kato-san (Reflective) to start thinking about the practicalities of making it into a compelling game concept. But for *first* consultation, a fresh, outside perspective from Sato-san seems like the best way to truly 'think outside the box' and explore new territory. It would give me a wider palette of ideas before I try to paint anything specific.","Sato-san, hello there! I was just starting to let my mind wander about this new game proposal we'll be working on, and I immediately thought of chatting with you. Your department’s focus on Slice of Life always brings such a wonderful depth and humanity to things, and I was wondering if you might have some initial thoughts for me. I'm in the Modern Setting department, but I've been thinking it would be really interesting to explore how we can make a modern setting feel truly fresh and emotionally engaging, perhaps by weaving in elements that go beyond just the surface of everyday life. Maybe something where the mundane has a hidden, extraordinary layer? I'd love to hear your perspective on how we might achieve that kind of resonance, even when working with familiar, modern backdrops.","Oh, hello Nakamura-san! How serendipitous, I was just thinking about reaching out to you. This is excellent timing. Her thought about making a modern setting ""feel truly fresh and emotionally engaging"" by ""weaving in elements that go beyond just the surface of everyday life,"" where ""the mundane has a hidden, extraordinary layer""—that's exactly the kind of idea I was hoping to explore. It fits so well with our Slice of Life department's focus on depth and humanity, but with her Modern Setting perspective, it pushes us into really interesting territory. This is a fantastic starting point, truly. It immediately broadens the scope beyond a conventional slice-of-life game and hints at something unique, just as the open brief encouraged. I'm really glad she approached me; it saves me the step of initiating, and her prompt is already sparking some thoughts.

I'll definitely dive into this conversation with her, it sounds like a very productive initial exchange. After we've explored some ideas together, I'll have a much richer foundation for my own solo reflection. Then, once I've had some time to really process and develop those concepts, I think I'll talk to Tanaka-kun next. His fresh, reflective mind could really help to flesh out the unique narrative or gameplay possibilities from this ""hidden extraordinary layer"" concept. Or perhaps Suzuki-san, since she's also reflective and we might find a comfortable rhythm in developing these broader concepts together. But for now, this conversation with Nakamura-san is exactly what I need to kick things off.",7,"Nakamura-san, it's wonderful to connect with you! I was just considering how we might approach this new proposal, and your idea about a ""hidden, extraordinary layer"" within the mundane is absolutely captivating. It resonates so perfectly with the depth and humanity our Slice of Life department strives for, but your Modern Setting perspective really elevates it, pushing us beyond the expected. I find myself immediately drawn to how we could explore that contrast – the familiar, everyday world suddenly revealing something magical or profound just beneath the surface. It sounds like a rich vein to tap into, and I'm eager to see where this exploration might lead us.","Wow, that's a fantastic response from Sato-san! I'm really pleased she found the ""hidden, extraordinary layer"" concept so captivating. Her saying it ""resonates so perfectly with the depth and humanity"" of the Slice of Life department, but that my Modern Setting perspective ""elevates it,"" that's exactly the kind of cross-pollination I was hoping for. It feels like this idea has real potential, not just as a creative concept but as something that could genuinely appeal to a broad audience, blending different elements in a fresh way.

It’s no longer just a vague notion bouncing around in my head; Sato-san's enthusiasm has really solidified it as a promising direction. The idea of the familiar everyday world suddenly revealing something profound beneath the surface... that contrast is what makes it exciting.

Okay, so I’ve gotten that external validation and some really positive energy. My next step, as I was thinking, should be to bring this back to my own department and start fleshing it out a bit. Sato-san helped confirm the emotional core and the broad appeal of the concept. Now I need to dive into the specifics of *what* that hidden layer could actually be, and how it might manifest in a game.

Given that, I think Kobayashi-san, ID:8, is exactly who I need to talk to next. He's ""Intuitive,"" which means he's probably great at rapid-fire brainstorming and just throwing out lots of diverse ideas without getting bogged down. I can present him with this core concept – ""modern mundane life with a secret, extraordinary layer"" – and see what kind of wild, imaginative twists he can come up with for that ""layer."" Is it magic? A secret society? An alien influence? A forgotten history? A dream world? We need a bunch of different angles to explore before we settle on one. His ""Intuitive"" nature should help us generate a good quantity of possibilities quickly. After that, maybe Kato-san or Yoshida-san can help us reflect and refine those ideas. But for now, pure idea generation is key.",8,Success
