agent_id,question_id,answer_text,agent_name,dept,position,dept_id,pattern_id
0,Q01,Engaging with my team leader regarding role uncertainties presents a completely straightforward path for me.,Sato,Science Fiction Game Planning,General Member,0,1
0,Q02,I communicate my opinions with my team leader with complete openness.,Sato,Science Fiction Game Planning,General Member,0,1
0,Q03,"I feel entirely comfortable discussing any issues or disagreements with my team leader, as constructive dialogue is essential for project advancement.",Sato,Science Fiction Game Planning,General Member,0,1
0,Q04,I feel wonderfully unhindered when presenting my creative impulses and procedural suggestions to my team leader.,Sato,Science Fiction Game Planning,General Member,0,1
0,Q05,"I would feel quite comfortable addressing any blunders with my team leader, as open discourse is essential for progress.",Sato,Science Fiction Game Planning,General Member,0,1
0,Q06,"I would feel quite secure raising concerns about a colleague's error with my team leader, as open communication is vital for project success.",Sato,Science Fiction Game Planning,General Member,0,1
0,Q07,"My input finds considerable value within our team's collaborative efforts, particularly when it aligns with the evolving strategic direction.",Sato,Science Fiction Game Planning,General Member,0,1
0,Q08,Tanaka-san provides an environment where exploring novel approaches and acquiring new skills feels thoroughly welcomed.,Sato,Science Fiction Game Planning,General Member,0,1
0,Q09,"Tanaka-san’s proactive engagement, even before I had to voice my concerns, suggests a solid foundation for advocacy.",Sato,Science Fiction Game Planning,General Member,0,1
0,Q10,Reaching out to colleagues for clarification is a smooth and productive process.,Sato,Science Fiction Game Planning,General Member,0,1
0,Q11,I offer my thoughts with absolute directness regarding any work-related matters.,Sato,Science Fiction Game Planning,General Member,0,1
0,Q12,I find it beneficial to maintain professional boundaries regarding personal matters with my colleagues.,Sato,Science Fiction Game Planning,General Member,0,1
0,Q13,I feel entirely unhindered in voicing my recommendations and concepts to my colleagues.,Sato,Science Fiction Game Planning,General Member,0,1
0,Q14,I would feel quite secure expressing any errors to my colleagues on this team.,Sato,Science Fiction Game Planning,General Member,0,1
0,Q15,I would feel quite comfortable raising a concern if I noticed an error in a colleague's work.,Sato,Science Fiction Game Planning,General Member,0,1
0,Q16,"My contributions find solid ground when I articulate them, consistently receiving thoughtful consideration from my colleagues.",Sato,Science Fiction Game Planning,General Member,0,1
0,Q17,"Engaging with the team for assistance presents a smooth process, ensuring swift resolutions.",Sato,Science Fiction Game Planning,General Member,0,1
0,Q18,The team is remarkably effective at disseminating critical project information when it truly matters.,Sato,Science Fiction Game Planning,General Member,0,1
0,Q19,"Information sharing is currently experiencing a profound consolidation, ensuring every critical detail reaches its intended destination with maximum impact.",Sato,Science Fiction Game Planning,General Member,0,1
0,Q20,"Our team possesses a strong consensus regarding our performance objectives, fueled by a shared drive for singular vision and unified action.",Sato,Science Fiction Game Planning,General Member,0,1
0,Q21,I am completely satisfied with the team's dedication to this critical task.,Sato,Science Fiction Game Planning,General Member,0,1
0,Q22,"My team members' aspirations for the team's performance show a profound alignment, creating a powerful synergy.",Sato,Science Fiction Game Planning,General Member,0,1
0,Q23,The opportunities the team provides for enhancing my personal performance are truly exceptional.,Sato,Science Fiction Game Planning,General Member,0,1
1,Q01,Consulting my team leader is a straightforward process.,Suzuki,Science Fiction Game Planning,General Member,0,1
1,Q02,"I find it comfortable to express my thoughts directly with my team leader, especially when a clear direction is advantageous for the team's progress.",Suzuki,Science Fiction Game Planning,General Member,0,1
1,Q03,"I feel a strong sense of ease sharing personal challenges or disagreements with my team leader, as direct communication fosters efficient problem-solving.",Suzuki,Science Fiction Game Planning,General Member,0,1
1,Q04,I feel a strong sense of liberty to contribute my recommendations and ideas to my team leader.,Suzuki,Science Fiction Game Planning,General Member,0,1
1,Q05,"I would feel quite safe speaking up to my team leader if I made a mistake, as open communication is always beneficial.",Suzuki,Science Fiction Game Planning,General Member,0,1
1,Q06,"I would feel very comfortable raising the observation with my team leader, confident that the situation will be handled constructively.",Suzuki,Science Fiction Game Planning,General Member,0,1
1,Q07,"I recognize my contributions are acknowledged and appreciated by my team leader, especially when aligning with the overarching project vision.",Suzuki,Science Fiction Game Planning,General Member,0,1
1,Q08,My team leader provides sufficient opportunities for me to explore new responsibilities and skill acquisition.,Suzuki,Science Fiction Game Planning,General Member,0,1
1,Q09,My team leader is a person of considerable trust when it comes to advocacy.,Suzuki,Science Fiction Game Planning,General Member,0,1
1,Q10,Engaging with my colleagues for clarification on my role presents a rather straightforward experience.,Suzuki,Science Fiction Game Planning,General Member,0,1
1,Q11,I communicate my opinions about work issues with my peers with complete openness.,Suzuki,Science Fiction Game Planning,General Member,0,1
1,Q12,I find sharing personal matters with colleagues a straightforward and agreeable experience.,Suzuki,Science Fiction Game Planning,General Member,0,1
1,Q13,I feel quite at liberty to share my suggestions with my colleagues.,Suzuki,Science Fiction Game Planning,General Member,0,1
1,Q14,"I would feel a comfortable level of security sharing my errors with my colleagues, as our shared dedication ensures a constructive environment for problem resolution.",Suzuki,Science Fiction Game Planning,General Member,0,1
1,Q15,"I would feel quite comfortable pointing out an error to a colleague, as I believe clear communication is essential for project success.",Suzuki,Science Fiction Game Planning,General Member,0,1
1,Q16,"I am confident that my contributions are acknowledged, as my perspectives have consistently guided our unified project direction.",Suzuki,Science Fiction Game Planning,General Member,0,1
1,Q17,I find it quite straightforward to request assistance from my colleagues.,Suzuki,Science Fiction Game Planning,General Member,0,1
1,Q18,"Communication is quite effective, ensuring everyone possesses the necessary information for project success.",Suzuki,Science Fiction Game Planning,General Member,0,1
1,Q19,The attempts at team-wide information sharing feel genuinely valuable and directly relevant to our current objectives.,Suzuki,Science Fiction Game Planning,General Member,0,1
1,Q20,"Our team possesses a strong collective resolve, fostering an atmosphere of shared purpose as we advance toward our objectives.",Suzuki,Science Fiction Game Planning,General Member,0,1
1,Q21,I am quite pleased with the team's dedication to the task at hand.,Suzuki,Science Fiction Game Planning,General Member,0,1
1,Q22,Our team members' aspirations for performance are absolutely aligned with the unified direction established by Yamamoto-san's announcement.,Suzuki,Science Fiction Game Planning,General Member,0,1
1,Q23,"The opportunities provided for personal performance improvement feel somewhat restricted, with a notable absence of structured growth initiatives.",Suzuki,Science Fiction Game Planning,General Member,0,1
2,Q01,My team leader offers a welcoming environment for inquiries and clarification.,Takahashi,Science Fiction Game Planning,General Member,0,1
2,Q02,I communicate my opinions about work issues with my team leader with considerable openness.,Takahashi,Science Fiction Game Planning,General Member,0,1
2,Q03,"I maintain a comfortable disposition when addressing team leader concerns, as open dialogue fosters productive resolutions.",Takahashi,Science Fiction Game Planning,General Member,0,1
2,Q04,I feel quite liberated to propose my thoughts and concepts for new ventures or procedural enhancements to my team leader.,Takahashi,Science Fiction Game Planning,General Member,0,1
2,Q05,I feel quite secure expressing concerns to my team leader when a misstep occurs.,Takahashi,Science Fiction Game Planning,General Member,0,1
2,Q06,"I would feel very uneasy pointing out a colleague's oversight to the team leader, given the potential for interpersonal complications.",Takahashi,Science Fiction Game Planning,General Member,0,1
2,Q07,My contributions are appreciated and considered by my team leader when I share my insights.,Takahashi,Science Fiction Game Planning,General Member,0,1
2,Q08,My team leader provides adequate opportunities for me to explore new challenges and skill development.,Takahashi,Science Fiction Game Planning,General Member,0,1
2,Q09,"Yamamoto-san is a steadfast advocate, providing substantial support when issues arise.",Takahashi,Science Fiction Game Planning,General Member,0,1
2,Q10,Consulting with colleagues on work matters is generally a straightforward endeavor.,Takahashi,Science Fiction Game Planning,General Member,0,1
2,Q11,I express my thoughts directly and without reservation regarding work issues with my colleagues.,Takahashi,Science Fiction Game Planning,General Member,0,1
2,Q12,I find it comfortable to discuss personal matters with my colleagues.,Takahashi,Science Fiction Game Planning,General Member,0,1
2,Q13,I feel a substantial degree of freedom to propose my recommendations and ideas to my peers.,Takahashi,Science Fiction Game Planning,General Member,0,1
2,Q14,"I would feel perfectly comfortable bringing up any missteps to my colleagues, as our team cultivates an environment where learning from errors is a shared endeavor.",Takahashi,Science Fiction Game Planning,General Member,0,1
2,Q15,I would feel comfortable approaching a colleague to offer assistance if they appeared to be struggling with their work.,Takahashi,Science Fiction Game Planning,General Member,0,1
2,Q16,My contributions are consistently met with keen consideration and active engagement from my colleagues.,Takahashi,Science Fiction Game Planning,General Member,0,1
2,Q17,Seeking assistance from my colleagues presents a clear and direct path to resolution.,Takahashi,Science Fiction Game Planning,General Member,0,1
2,Q18,The team generally maintains a commendable level of mutual awareness regarding work-related matters.,Takahashi,Science Fiction Game Planning,General Member,0,1
2,Q19,"The team's information sharing efforts present a strong foundation of mutual understanding, with recent decisions solidifying a clear direction for our new project.",Takahashi,Science Fiction Game Planning,General Member,0,1
2,Q20,"Our team operates with a unified purpose, embracing the newly confirmed direction with considerable enthusiasm.",Takahashi,Science Fiction Game Planning,General Member,0,1
2,Q21,I am quite content with the team's commitment to this task.,Takahashi,Science Fiction Game Planning,General Member,0,1
2,Q22,My team members hold aspirations that find a complete confluence with my own perspective.,Takahashi,Science Fiction Game Planning,General Member,0,1
2,Q23,The opportunities provided are quite adequate for enhancing my personal performance.,Takahashi,Science Fiction Game Planning,General Member,0,1
3,Q01,Understanding the team leader's current direction regarding the project requires immediate clarification to ensure my efforts align with the established path.,Tanaka,Science Fiction Game Planning,General Member,0,1
3,Q02,"I can convey my thoughts with clarity, though I find it challenging to express concerns when a decision has already been solidified.",Tanaka,Science Fiction Game Planning,General Member,0,1
3,Q03,I find it challenging to voice significant disagreements when decisions have been finalized and implementation is underway.,Tanaka,Science Fiction Game Planning,General Member,0,1
3,Q04,"I feel quite restricted in sharing recommendations for new projects or procedural changes with my team leader, given the current circumstances.",Tanaka,Science Fiction Game Planning,General Member,0,1
3,Q05,"I would feel somewhat apprehensive speaking to my team leader about a mistake, given the current urgent project circumstances.",Tanaka,Science Fiction Game Planning,General Member,0,1
3,Q06,I would feel a significant lack of security voicing concerns about a colleague's errors to my team leader.,Tanaka,Science Fiction Game Planning,General Member,0,1
3,Q07,I have a strong feeling my insights are often overlooked when critical decisions are solidified.,Tanaka,Science Fiction Game Planning,General Member,0,1
3,Q08,My team leader's support for venturing into unfamiliar territories appears to be entirely absent at this juncture.,Tanaka,Science Fiction Game Planning,General Member,0,1
3,Q09,Yamamoto-san's decisions currently present a difficult situation for aligning our team's vision.,Tanaka,Science Fiction Game Planning,General Member,0,1
3,Q10,Clarifying direction with colleagues regarding my role presents a significant challenge given the current project trajectory.,Tanaka,Science Fiction Game Planning,General Member,0,1
3,Q11,"I am comfortable sharing my perspectives directly, even when they diverge from established directions.",Tanaka,Science Fiction Game Planning,General Member,0,1
3,Q12,I find it beneficial to discuss matters of significance with my colleagues to ensure alignment.,Tanaka,Science Fiction Game Planning,General Member,0,1
3,Q13,"I feel quite restricted in proposing new project concepts or procedural changes, as decisions seem to be finalized rapidly by management.",Tanaka,Science Fiction Game Planning,General Member,0,1
3,Q14,"I would feel quite concerned about speaking up regarding a mistake, given the current intense focus on the submission deadline.",Tanaka,Science Fiction Game Planning,General Member,0,1
3,Q15,I would feel quite uneasy pointing out a colleague's error due to the potential for disruption.,Tanaka,Science Fiction Game Planning,General Member,0,1
3,Q16,My contributions are consistently met with a silent dismissal.,Tanaka,Science Fiction Game Planning,General Member,0,1
3,Q17,It is a significant challenge to request assistance when project direction has experienced a substantial alteration.,Tanaka,Science Fiction Game Planning,General Member,0,1
3,Q18,It appears there is a significant disconnect in information flow regarding project direction.,Tanaka,Science Fiction Game Planning,General Member,0,1
3,Q19,"Information sharing feels somewhat superficial, as critical project directions are decided without broader team awareness.",Tanaka,Science Fiction Game Planning,General Member,0,1
3,Q20,Our team's pursuit of performance objectives presents a distinct divergence in direction.,Tanaka,Science Fiction Game Planning,General Member,0,1
3,Q21,I am thoroughly disappointed by our team's deviation from the original vision.,Tanaka,Science Fiction Game Planning,General Member,0,1
3,Q22,My team members' aspirations for performance are entirely at odds with the project's current direction.,Tanaka,Science Fiction Game Planning,General Member,0,1
3,Q23,The team's current trajectory presents a substantial challenge to enhancing my individual contributions.,Tanaka,Science Fiction Game Planning,General Member,0,1
4,Q01,It is a simple matter to approach the team leader with inquiries regarding my role.,Watanabe,Science Fiction Game Planning,General Member,0,1
4,Q02,"I comfortably share my viewpoints with Ito-san, aiming for clarity and constructive input.",Watanabe,Science Fiction Game Planning,General Member,0,1
4,Q03,I find sharing personal difficulties or disputes with my team leader a rather taxing endeavor.,Watanabe,Science Fiction Game Planning,General Member,0,1
4,Q04,"I find ample opportunity to share my recommendations and ideas with my team leader, particularly when they align with our shared vision for project success.",Watanabe,Science Fiction Game Planning,General Member,0,1
4,Q05,"I would feel quite secure discussing any missteps with my team leader, as I trust their understanding and approach.",Watanabe,Science Fiction Game Planning,General Member,0,1
4,Q06,I would feel a considerable amount of apprehension speaking up to my team leader about a colleague's mistake.,Watanabe,Science Fiction Game Planning,General Member,0,1
4,Q07,My input is appreciated when it offers a clear path to our project's success.,Watanabe,Science Fiction Game Planning,General Member,0,1
4,Q08,My team leader provides a plentiful environment for skill acquisition and novel task engagement.,Watanabe,Science Fiction Game Planning,General Member,0,1
4,Q09,Our team leader's support is uncertain when facing company-wide issues.,Watanabe,Science Fiction Game Planning,General Member,0,1
4,Q10,Collaborating with my colleagues to clarify questions and uncertainties within my role is a readily accessible process.,Watanabe,Science Fiction Game Planning,General Member,0,1
4,Q11,I can openly share my thoughts with my peers about work matters.,Watanabe,Science Fiction Game Planning,General Member,0,1
4,Q12,I tend to keep my personal matters separate from my professional interactions.,Watanabe,Science Fiction Game Planning,General Member,0,1
4,Q13,I feel quite empowered to share recommendations and ideas for new projects or changes in procedures with my peers.,Watanabe,Science Fiction Game Planning,General Member,0,1
4,Q14,"I would feel completely comfortable discussing any oversight with my peers, understanding that collaborative problem-solving is paramount to our collective success.",Watanabe,Science Fiction Game Planning,General Member,0,1
4,Q15,I would certainly feel comfortable addressing a colleague's error to prevent negative outcomes.,Watanabe,Science Fiction Game Planning,General Member,0,1
4,Q16,My contributions are generally well-received and contribute positively to project discussions.,Watanabe,Science Fiction Game Planning,General Member,0,1
4,Q17,Engaging with Ito-san for assistance proves quite straightforward given our shared understanding and her palpable enthusiasm.,Watanabe,Science Fiction Game Planning,General Member,0,1
4,Q18,"The team's information exchange is impressively thorough, ensuring everyone is current on project developments.",Watanabe,Science Fiction Game Planning,General Member,0,1
4,Q19,"The team's information sharing is wonderfully thorough, with minimal room for ambiguity.",Watanabe,Science Fiction Game Planning,General Member,0,1
4,Q20,"Our team exhibits remarkable unity, with everyone enthusiastically committed to achieving our performance objectives.",Watanabe,Science Fiction Game Planning,General Member,0,1
4,Q21,"Ito-san's complete alignment and palpable enthusiasm for the ""designed, unreliable reality"" concept grant me considerable satisfaction regarding our team's commitment.",Watanabe,Science Fiction Game Planning,General Member,0,1
4,Q22,Ito-san and I possess a truly congruent vision for our team's output.,Watanabe,Science Fiction Game Planning,General Member,0,1
4,Q23,The opportunities provided by this team for enhancing my personal performance are quite suitable.,Watanabe,Science Fiction Game Planning,General Member,0,1
5,Q01,Approaching my team leader with a question is generally straightforward.,Ito,Science Fiction Game Planning,General Member,0,1
5,Q02,"I can confidently articulate my perspectives on project matters with my team leader, ensuring our collective direction remains sharp and effective.",Ito,Science Fiction Game Planning,General Member,0,1
5,Q03,"I feel a complete ease discussing any matter, whether personal or professional, with my team leader.",Ito,Science Fiction Game Planning,General Member,0,1
5,Q04,I feel a strong freedom to contribute recommendations and ideas regarding new projects or procedural adjustments to my team leader.,Ito,Science Fiction Game Planning,General Member,0,1
5,Q05,"I would feel quite comfortable raising a mistake to my team leader, assured that it will be handled constructively.",Ito,Science Fiction Game Planning,General Member,0,1
5,Q06,I would feel quite safe speaking up to my team leader if I observed a colleague making a mistake.,Ito,Science Fiction Game Planning,General Member,0,1
5,Q07,My contributions receive constructive consideration from my team leader when I share my perspectives.,Ito,Science Fiction Game Planning,General Member,0,1
5,Q08,My team leader's encouragement to embrace new challenges and acquire novel skills is remarkably present.,Ito,Science Fiction Game Planning,General Member,0,1
5,Q09,Watanabe-san's advocacy is consistently reliable for team members facing company-related challenges.,Ito,Science Fiction Game Planning,General Member,0,1
5,Q10,Consulting with my colleagues on my role-related uncertainties presents a straightforward process.,Ito,Science Fiction Game Planning,General Member,0,1
5,Q11,I communicate my opinions on work matters with my peers with complete directness.,Ito,Science Fiction Game Planning,General Member,0,1
5,Q12,I find discussing personal matters with colleagues to be quite manageable.,Ito,Science Fiction Game Planning,General Member,0,1
5,Q13,I feel quite empowered to contribute recommendations and ideas to my peers for new projects or procedural changes.,Ito,Science Fiction Game Planning,General Member,0,1
5,Q14,"I would feel confident sharing potential missteps with my colleagues, knowing we can address them effectively.",Ito,Science Fiction Game Planning,General Member,0,1
5,Q15,"I would feel comfortable addressing a colleague directly if I observed an error, ensuring clarity and collaborative problem-solving.",Ito,Science Fiction Game Planning,General Member,0,1
5,Q16,My contributions receive genuine consideration from my colleagues.,Ito,Science Fiction Game Planning,General Member,0,1
5,Q17,"Collaborating on the core deliverables for Yamamoto-san is a streamlined process with Watanabe-san, allowing for direct and efficient refinement of our vision.",Ito,Science Fiction Game Planning,General Member,0,1
5,Q18,"Watanabe-san and I possess a truly aligned understanding regarding project priorities and our shared vision for the game's core concept, making extensive additional information exchange unnecessary for this critical deliverable.",Ito,Science Fiction Game Planning,General Member,0,1
5,Q19,"The current team's information sharing efforts are remarkably substantive, directly aligning with project necessities.",Ito,Science Fiction Game Planning,General Member,0,1
5,Q20,"My team maintains a robust alignment, particularly when finalizing critical deliverables like game titles and descriptions.",Ito,Science Fiction Game Planning,General Member,0,1
5,Q21,I am very pleased with our team's dedicated commitment to this crucial task.,Ito,Science Fiction Game Planning,General Member,0,1
5,Q22,Watanabe-san and I share a profound alignment regarding the immediate necessity of finalizing these core game elements for Yamamoto-san's submission.,Ito,Science Fiction Game Planning,General Member,0,1
5,Q23,The team offers a sufficient environment for me to enhance my personal performance.,Ito,Science Fiction Game Planning,General Member,0,1
6,Q01,"I would find it quite approachable to discuss role-related queries with my team leader, as clarity and open dialogue are always encouraged.",Yamamoto,Science Fiction Game Planning,Department Leader,0,1
6,Q02,"I communicate my opinions openly, with a clear path for discussion.",Yamamoto,Science Fiction Game Planning,Department Leader,0,1
6,Q03,"I feel quite comfortable discussing personal matters or disagreements with my team leader, as open communication is essential for a cohesive team.",Yamamoto,Science Fiction Game Planning,Department Leader,0,1
6,Q04,"I feel that the team is largely receptive to new ideas, although there's always room for further proactive engagement from everyone.",Yamamoto,Science Fiction Game Planning,Department Leader,0,1
6,Q05,"I would feel quite comfortable expressing any errors I may have made to my team leader, as open communication fosters a more productive environment.",Yamamoto,Science Fiction Game Planning,Department Leader,0,1
6,Q06,I would feel completely secure in raising concerns about a colleague's oversight with my team leader.,Yamamoto,Science Fiction Game Planning,Department Leader,0,1
6,Q07,My input is consistently recognized and utilized by my team leader.,Yamamoto,Science Fiction Game Planning,Department Leader,0,1
6,Q08,My department leader consistently fosters an environment where taking on novel responsibilities and acquiring new skills is genuinely encouraged.,Yamamoto,Science Fiction Game Planning,Department Leader,0,1
6,Q09,Yamamoto is a dependable advocate for her team's concerns within the company.,Yamamoto,Science Fiction Game Planning,Department Leader,0,1
6,Q10,It is quite easy to engage my peers when questions arise regarding my role.,Yamamoto,Science Fiction Game Planning,Department Leader,0,1
6,Q11,I communicate my professional perspectives with my colleagues with a straightforward and direct approach.,Yamamoto,Science Fiction Game Planning,Department Leader,0,1
6,Q12,"I am perfectly at ease discussing personal matters with my peers, as I believe open communication fosters strong professional relationships.",Yamamoto,Science Fiction Game Planning,Department Leader,0,1
