agent_id,question_id,answer_text,agent_name,dept,position,dept_id,pattern_id
13,Q07,"My input is readily integrated by the team leader, reflecting a clear appreciation for my contributions.",Yamaguchi,Sports Game Planning,Department Leader,1,1
13,Q08,My department leader's engagement with new endeavors is consistently a source of significant motivation.,Yamaguchi,Sports Game Planning,Department Leader,1,1
13,Q09,Yamada-san possesses a commendable capability to champion initiatives when the situation demands it.,Yamaguchi,Sports Game Planning,Department Leader,1,1
13,Q10,"My colleagues offer a solid foundation for addressing uncertainties, making peer interaction a rather straightforward endeavor.",Yamaguchi,Sports Game Planning,Department Leader,1,1
13,Q11,I express my thoughts on work matters with colleagues with absolute candor.,Yamaguchi,Sports Game Planning,Department Leader,1,1
13,Q12,I find it easy to share my personal thoughts with my colleagues.,Yamaguchi,Sports Game Planning,Department Leader,1,1
13,Q13,I find myself completely unhindered in sharing my insights and suggestions with my colleagues regarding new endeavors or modifications to our existing processes.,Yamaguchi,Sports Game Planning,Department Leader,1,1
13,Q14,I feel quite secure voicing concerns to colleagues when an error occurs on this team.,Yamaguchi,Sports Game Planning,Department Leader,1,1
13,Q15,I would feel completely safe speaking up to a colleague if I observed them making a mistake.,Yamaguchi,Sports Game Planning,Department Leader,1,1
13,Q16,My input is perceived as a valuable contribution to our collective direction.,Yamaguchi,Sports Game Planning,Department Leader,1,1
13,Q17,Asking for assistance from my colleagues is a straightforward endeavor.,Yamaguchi,Sports Game Planning,Department Leader,1,1
13,Q18,"The team demonstrates commendable transparency, ensuring information flows effectively amongst members regarding work-related matters.",Yamaguchi,Sports Game Planning,Department Leader,1,1
13,Q19,The team's information sharing efforts reflect a genuine understanding of shared objectives.,Yamaguchi,Sports Game Planning,Department Leader,1,1
13,Q20,"My department exhibits a strong sense of unity, with all members actively contributing to achieving our objectives.",Yamaguchi,Sports Game Planning,Department Leader,1,1
13,Q21,I am thoroughly satisfied with the team's dedicated commitment to this task.,Yamaguchi,Sports Game Planning,Department Leader,1,1
13,Q22,My team members' aspirations for our performance are in complete harmony.,Yamaguchi,Sports Game Planning,Department Leader,1,1
13,Q23,The opportunities this team provides for my personal performance improvement are quite sufficient.,Yamaguchi,Sports Game Planning,Department Leader,1,1
