agent_id,question_id,answer_text,agent_name,dept,position,dept_id,pattern_id
6,Q13,I feel quite unhindered in suggesting new projects or procedural adjustments to my colleagues.,Yamamoto,Science Fiction Game Planning,Department Leader,0,1
6,Q14,I would feel quite comfortable raising concerns about potential missteps with my colleagues on this team.,Yamamoto,Science Fiction Game Planning,Department Leader,0,1
6,Q15,I would feel a strong sense of responsibility to address any colleague's error.,Yamamoto,Science Fiction Game Planning,Department Leader,0,1
6,Q16,"My contributions are recognized as highly impactful, with peers consistently affirming their alignment with my perspectives.",Yamamoto,Science Fiction Game Planning,Department Leader,0,1
6,Q17,It is a complex undertaking to solicit assistance from colleagues on this team.,Yamamoto,Science Fiction Game Planning,Department Leader,0,1
6,Q18,"Our team maintains a **good level of shared awareness regarding work-related matters**, with proactive individuals ensuring essential information reaches relevant colleagues.",Yamamoto,Science Fiction Game Planning,Department Leader,0,1
6,Q19,"The team's current information sharing is fundamentally solid, with a particularly strong resonance from key individuals regarding our project's core direction.",Yamamoto,Science Fiction Game Planning,Department Leader,0,1
6,Q20,Our team is experiencing substantial alignment regarding our performance objectives.,Yamamoto,Science Fiction Game Planning,Department Leader,0,1
6,Q21,I am delighted with my team's profound dedication to the task at hand.,Yamamoto,Science Fiction Game Planning,Department Leader,0,1
6,Q22,"My team members exhibit a high degree of alignment regarding our aspirations for team performance, with aspirations for team performance being remarkably consistent.",Yamamoto,Science Fiction Game Planning,Department Leader,0,1
6,Q23,The team's current collaborative environment offers sufficient opportunities to enhance my personal performance.,Yamamoto,Science Fiction Game Planning,Department Leader,0,1
7,Q01,It would be a straightforward process to seek clarification from my team leader when encountering uncertainties regarding my role.,Nakamura,Sports Game Planning,General Member,1,1
7,Q02,"I can communicate my opinions directly and without reservation, as my team leader welcomes direct contributions.",Nakamura,Sports Game Planning,General Member,1,1
7,Q03,"I feel entirely comfortable discussing any issue, personal or professional, with my team leader.",Nakamura,Sports Game Planning,General Member,1,1
7,Q04,I find my ability to offer recommendations and new project ideas to my team leader quite substantial.,Nakamura,Sports Game Planning,General Member,1,1
7,Q05,"I would feel quite comfortable discussing a lapse with my team leader, as open communication is essential for project success.",Nakamura,Sports Game Planning,General Member,1,1
7,Q06,I would feel quite secure voicing concerns about a coworker's errors.,Nakamura,Sports Game Planning,General Member,1,1
7,Q07,My contributions to the team are consistently recognized and incorporated into our proposals.,Nakamura,Sports Game Planning,General Member,1,1
7,Q08,Kato-san's encouragement for exploring new tasks is quite substantial.,Nakamura,Sports Game Planning,General Member,1,1
7,Q09,Kato-san's direct approach to incorporating Yoshida-san's perspective demonstrates his willingness to act as an advocate for shared ideas within the team.,Nakamura,Sports Game Planning,General Member,1,1
7,Q10,It is exceptionally simple to seek clarification from colleagues concerning my professional responsibilities.,Nakamura,Sports Game Planning,General Member,1,1
7,Q11,I communicate my thoughts on work issues with my peers with complete candor.,Nakamura,Sports Game Planning,General Member,1,1
7,Q12,I find sharing personal matters with colleagues to be quite a delicate undertaking.,Nakamura,Sports Game Planning,General Member,1,1
7,Q13,I find complete liberty to express my recommendations and ideas to my peers regarding new projects or procedural modifications.,Nakamura,Sports Game Planning,General Member,1,1
7,Q14,I would feel quite comfortable addressing errors with my colleagues.,Nakamura,Sports Game Planning,General Member,1,1
7,Q15,I would feel quite comfortable speaking directly to a colleague if I observed an error in their work.,Nakamura,Sports Game Planning,General Member,1,1
7,Q16,My contributions are readily incorporated by my colleagues.,Nakamura,Sports Game Planning,General Member,1,1
7,Q17,"Approaching Kato-san and Yoshida-san for their input and collaboration on ""Aetherbound Arenas"" feels like a straightforward process.",Nakamura,Sports Game Planning,General Member,1,1
7,Q18,"Kato-san and I are aligned, and Yamaguchi-san's positive reception necessitates a swift, unified approach for ""Aetherbound Arenas.""",Nakamura,Sports Game Planning,General Member,1,1
7,Q19,"Kato-san's proactive engagement with Yoshida-san's input on ""Aetherbound Arenas"" signals a genuine effort toward information synthesis.",Nakamura,Sports Game Planning,General Member,1,1
7,Q20,Our team presents a strong alignment in pursuing our performance objectives.,Nakamura,Sports Game Planning,General Member,1,1
7,Q21,"I am content with the current commitment level, as it actively propels us toward completing the ""Aetherbound Arenas"" proposal.",Nakamura,Sports Game Planning,General Member,1,1
7,Q22,"Kato-san's alignment with our urgency and Yamaguchi-san's positive reception to both proposals create a strong impetus for immediate collaborative finalization of ""Aetherbound Arenas.""",Nakamura,Sports Game Planning,General Member,1,1
7,Q23,The opportunities provided are sufficient for my current performance improvement needs.,Nakamura,Sports Game Planning,General Member,1,1
8,Q01,Approaching Yamada-san with inquiries regarding my role presents a smooth and straightforward process.,Kobayashi,Sports Game Planning,General Member,1,1
8,Q02,"I communicate my thoughts on work matters with my team leader with considerable directness, providing them with my complete and unvarnished perspectives.",Kobayashi,Sports Game Planning,General Member,1,1
8,Q03,I maintain a productive atmosphere by addressing team matters directly and constructively.,Kobayashi,Sports Game Planning,General Member,1,1
8,Q04,I experience substantial latitude to voice suggestions regarding new initiatives or procedural adjustments to my team leader.,Kobayashi,Sports Game Planning,General Member,1,1
8,Q05,I would feel quite secure speaking with my team leader about any missteps.,Kobayashi,Sports Game Planning,General Member,1,1
8,Q06,"I would feel rather safe speaking up to my team leader if I observed a colleague making a mistake, as open communication is a valuable aspect of our work environment.",Kobayashi,Sports Game Planning,General Member,1,1
8,Q07,My contributions are recognized and integrated into our shared direction.,Kobayashi,Sports Game Planning,General Member,1,1
8,Q08,Yamada-san provides a solid foundation for tackling new responsibilities and skill development.,Kobayashi,Sports Game Planning,General Member,1,1
8,Q09,Yamada-san exhibits a dependable inclination to advocate for team members facing challenges.,Kobayashi,Sports Game Planning,General Member,1,1
8,Q10,Approaching colleagues for clarification on my role proves quite straightforward.,Kobayashi,Sports Game Planning,General Member,1,1
8,Q11,I communicate my work opinions with my peers with complete openness and directness.,Kobayashi,Sports Game Planning,General Member,1,1
8,Q12,I find discussing personal matters with colleagues to be quite an unappealing prospect.,Kobayashi,Sports Game Planning,General Member,1,1
8,Q13,I experience a strong sense of freedom to propose new project ideas and procedural adjustments to my colleagues.,Kobayashi,Sports Game Planning,General Member,1,1
8,Q14,I would feel quite comfortable discussing errors openly with my colleagues.,Kobayashi,Sports Game Planning,General Member,1,1
8,Q15,I would feel quite comfortable bringing up a perceived error to a colleague to ensure our shared objectives are met.,Kobayashi,Sports Game Planning,General Member,1,1
8,Q16,My contributions are consistently acknowledged and incorporated by my colleagues.,Kobayashi,Sports Game Planning,General Member,1,1
8,Q17,"Seeking assistance from fellow team members presents a seamless and agreeable experience, fostering a collaborative environment.",Kobayashi,Sports Game Planning,General Member,1,1
8,Q18,"There is a strong alignment on immediate priorities, with a clear understanding of subsequent steps for broader team involvement.",Kobayashi,Sports Game Planning,General Member,1,1
8,Q19,"Yamada-san's alignment on ""Aero Derby: Shattered Skies"" provides significant clarity, and our focus will be on finalizing that project's core elements before convening the broader team for the second proposal.",Kobayashi,Sports Game Planning,General Member,1,1
8,Q20,"My team exhibits a truly united front regarding our current primary objective, and we are prepared to engage collectively on future endeavors.",Kobayashi,Sports Game Planning,General Member,1,1
8,Q21,"I am entirely satisfied with the current team commitment to ""Aero Derby: Shattered Skies.""",Kobayashi,Sports Game Planning,General Member,1,1
8,Q22,"Yamada-san and I maintain a profound congruence regarding the immediate trajectory of ""Aero Derby: Shattered Skies,"" with a subsequent need for broader team consensus on the second project.",Kobayashi,Sports Game Planning,General Member,1,1
8,Q23,"The current opportunities provided by the team present a decent platform for enhancing personal performance, with room for further growth.",Kobayashi,Sports Game Planning,General Member,1,1
9,Q01,My department's leader offers ample opportunity for clarification on role-related uncertainties.,Kato,Sports Game Planning,General Member,1,1
9,Q02,I will communicate my opinions with my team leader openly.,Kato,Sports Game Planning,General Member,1,1
9,Q03,I feel a certain ease discussing personal challenges with my team leader when the situation genuinely calls for it.,Kato,Sports Game Planning,General Member,1,1
9,Q04,I feel quite empowered to propose my thoughts and recommendations regarding new projects and procedural adjustments to my team leader.,Kato,Sports Game Planning,General Member,1,1
9,Q05,"I would feel quite safe speaking up to my team leader, as I believe open communication regarding errors is a pathway to collective improvement.",Kato,Sports Game Planning,General Member,1,1
9,Q06,I would feel reasonably comfortable bringing a colleague's error to my team leader's attention.,Kato,Sports Game Planning,General Member,1,1
9,Q07,I understand that my contributions are valued when I participate in focused sessions orchestrated by Nakamura-san.,Kato,Sports Game Planning,General Member,1,1
9,Q08,Nakamura-san is creating a focused session for immediate collaboration and integration of ideas.,Kato,Sports Game Planning,General Member,1,1
9,Q09,"Nakamura-san demonstrates remarkable initiative in coordinating crucial sessions, which fosters a strong sense of support for team members.",Kato,Sports Game Planning,General Member,1,1
9,Q10,Leveraging my colleagues' expertise is a smooth and productive endeavor.,Kato,Sports Game Planning,General Member,1,1
9,Q11,"I am comfortable sharing my insights with my colleagues, especially when it leads to a stronger outcome.",Kato,Sports Game Planning,General Member,1,1
9,Q12,I generally feel comfortable sharing my thoughts and experiences with my peers.,Kato,Sports Game Planning,General Member,1,1
9,Q13,I feel a great deal of freedom to share my recommendations and ideas with my peers regarding new projects or procedural changes.,Kato,Sports Game Planning,General Member,1,1
9,Q14,"I would feel quite confident sharing my thoughts with my colleagues, even if an error had occurred, as our collaborative spirit tends to foster productive problem-solving.",Kato,Sports Game Planning,General Member,1,1
9,Q15,I would feel reasonably secure raising concerns with a colleague about a potential misstep.,Kato,Sports Game Planning,General Member,1,1
9,Q16,My contributions find their best expression when integrated into focused sessions alongside colleagues like Nakamura-san and Yoshida-san.,Kato,Sports Game Planning,General Member,1,1
9,Q17,Engaging with team members for assistance requires a deliberate effort to align perspectives.,Kato,Sports Game Planning,General Member,1,1
9,Q18,"Nakamura-san's proactive arrangement for a joint session with Yoshida-san highlights a deliberate step toward ensuring unified information flow for ""Aetherbound Arenas.""",Kato,Sports Game Planning,General Member,1,1
9,Q19,"The information sharing efforts feel quite substantial, with Nakamura-san actively orchestrating crucial collaborative sessions.",Kato,Sports Game Planning,General Member,1,1
9,Q20,"Our team operates with a powerful alignment, particularly in achieving our performance objectives.",Kato,Sports Game Planning,General Member,1,1
9,Q21,"I am satisfied with the team's dedication to achieving our goals for ""Aetherbound Arenas.""",Kato,Sports Game Planning,General Member,1,1
9,Q22,"Nakamura-san's proactive approach to integrating Yoshida-san's input into ""Aetherbound Arenas"" indicates a strong alignment in our immediate objectives for the project's success.",Kato,Sports Game Planning,General Member,1,1
9,Q23,The opportunities provided for personal performance enhancement are certainly adequate for immediate project needs.,Kato,Sports Game Planning,General Member,1,1
10,Q01,"My inclination is to seek clarification from my team leader, and I anticipate a productive exchange.",Yoshida,Sports Game Planning,General Member,1,1
10,Q02,I can communicate my opinions with my team leader with great openness.,Yoshida,Sports Game Planning,General Member,1,1
10,Q03,I maintain a firm resolve to openly address any disagreements with my team leader for the betterment of our projects.,Yoshida,Sports Game Planning,General Member,1,1
10,Q04,I feel quite unhindered in expressing my recommendations and ideas regarding new projects or procedural adjustments to my team leader.,Yoshida,Sports Game Planning,General Member,1,1
10,Q05,I would feel quite safe speaking up to my team leader if I made a mistake on this team.,Yoshida,Sports Game Planning,General Member,1,1
10,Q06,"I would feel reasonably comfortable addressing a team leader about a colleague's error, provided the situation permits a constructive dialogue.",Yoshida,Sports Game Planning,General Member,1,1
10,Q07,I am confident my contributions are fully considered by Nakamura-san given our recent productive discussions.,Yoshida,Sports Game Planning,General Member,1,1
10,Q08,My team leader provides a **helpful framework** for exploring new responsibilities.,Yoshida,Sports Game Planning,General Member,1,1
10,Q09,Nakamura-san’s proactive approach to uniting our ideas indicates a strong willingness to champion our collective efforts.,Yoshida,Sports Game Planning,General Member,1,1
10,Q10,"I am fully prepared to integrate my detailed concepts and refined ideas for ""Aetherbound Arenas"" into a consolidated proposal, ensuring our collective strength.",Yoshida,Sports Game Planning,General Member,1,1
10,Q11,I communicate my work opinions with peers with complete candor.,Yoshida,Sports Game Planning,General Member,1,1
10,Q12,I am quite comfortable sharing personal matters with my colleagues.,Yoshida,Sports Game Planning,General Member,1,1
10,Q13,I feel completely unhindered to express my recommendations and ideas to my peers.,Yoshida,Sports Game Planning,General Member,1,1
10,Q14,I would feel quite comfortable raising concerns about potential errors when collaborating with my colleagues.,Yoshida,Sports Game Planning,General Member,1,1
10,Q15,I would feel comfortable raising a point if I noticed a colleague overlooking something important.,Yoshida,Sports Game Planning,General Member,1,1
10,Q16,"My contributions are recognized as valuable when aligned with Nakamura-san's direction and Kato-san's narrative expertise, forming a productive synergy for project advancement.",Yoshida,Sports Game Planning,General Member,1,1
10,Q17,"My experience with requesting assistance from team members has proven to be remarkably smooth and productive, fostering a strong sense of collaboration.",Yoshida,Sports Game Planning,General Member,1,1
10,Q18,Nakamura-san's proactive approach to bringing us together for immediate consolidation indicates a valuable effort towards effective information sharing.,Yoshida,Sports Game Planning,General Member,1,1
10,Q19,"The team's information sharing appears to be fundamentally sound, with a clear focus on integrating diverse expertise for project advancement.",Yoshida,Sports Game Planning,General Member,1,1
10,Q20,"Our team demonstrates a commendable synergy, with shared understanding and collaborative momentum propelling us toward our performance objectives.",Yoshida,Sports Game Planning,General Member,1,1
10,Q21,I am satisfied with our team's commitment to the task.,Yoshida,Sports Game Planning,General Member,1,1
10,Q22,My team members' aspirations for our team's performance are in complete unison.,Yoshida,Sports Game Planning,General Member,1,1
10,Q23,The opportunities this team provides for my personal performance improvement are quite sufficient.,Yoshida,Sports Game Planning,General Member,1,1
11,Q01,Approaching my team leader with questions presents a straightforward process.,Yamada,Sports Game Planning,General Member,1,1
11,Q02,I communicate my opinions with my team leader with a direct and clear approach.,Yamada,Sports Game Planning,General Member,1,1
11,Q03,"I maintain a professional demeanor, therefore personal matters do not require team leader intervention.",Yamada,Sports Game Planning,General Member,1,1
11,Q04,I possess substantial freedom to voice recommendations and new project ideas to my team leader.,Yamada,Sports Game Planning,General Member,1,1
11,Q05,"I would feel quite safe speaking up to my team leader about a mistake, as open communication is paramount for progress.",Yamada,Sports Game Planning,General Member,1,1
11,Q06,I would feel completely safe speaking up to my team leader if I observed a colleague making a mistake.,Yamada,Sports Game Planning,General Member,1,1
11,Q07,My contributions are generally well-received and acknowledged by my team leader.,Yamada,Sports Game Planning,General Member,1,1
11,Q08,My team leader's encouragement for tackling unfamiliar responsibilities is certainly present.,Yamada,Sports Game Planning,General Member,1,1
11,Q09,My team leader appears to be a reliably supportive figure within the company.,Yamada,Sports Game Planning,General Member,1,1
11,Q10,Leveraging my colleagues' expertise is a straightforward endeavor when inquiries arise concerning my responsibilities.,Yamada,Sports Game Planning,General Member,1,1
11,Q11,I communicate my work opinions to my peers with clear and direct expression.,Yamada,Sports Game Planning,General Member,1,1
11,Q12,I maintain a comfortable distance when discussing personal matters with my colleagues.,Yamada,Sports Game Planning,General Member,1,1
11,Q13,I perceive a complete freedom to voice recommendations and ideas for new projects or procedural changes to my peers.,Yamada,Sports Game Planning,General Member,1,1
11,Q14,I would feel entirely comfortable raising any errors I make during our team's work.,Yamada,Sports Game Planning,General Member,1,1
11,Q15,I would feel comfortable pointing out a colleague's error to ensure project success.,Yamada,Sports Game Planning,General Member,1,1
11,Q16,I perceive my contributions are consistently recognized and actively considered by my colleagues.,Yamada,Sports Game Planning,General Member,1,1
11,Q17,It is quite straightforward to solicit assistance from my colleagues on this team.,Yamada,Sports Game Planning,General Member,1,1
11,Q18,"Team members actively share information, leading to a generally well-informed atmosphere, though occasional oversight can occur.",Yamada,Sports Game Planning,General Member,1,1
11,Q19,The attempts to share information across the team require more intentional structuring to be truly effective.,Yamada,Sports Game Planning,General Member,1,1
11,Q20,"Our team exhibits strong unity in striving for performance, particularly with ""Aero Derby: Shattered Skies,"" while also diligently preparing a solid plan for our second proposal.",Yamada,Sports Game Planning,General Member,1,1
11,Q21,I am satisfied with the team's commitment level towards the task at hand.,Yamada,Sports Game Planning,General Member,1,1
11,Q22,"My team members exhibit a commendable alignment in their performance aspirations, particularly regarding ""Aero Derby: Shattered Skies,"" with a constructive drive to develop the secondary proposal concurrently.",Yamada,Sports Game Planning,General Member,1,1
11,Q23,The current opportunities provide a fair foundation for my personal performance enhancement.,Yamada,Sports Game Planning,General Member,1,1
12,Q01,Reaching out to my team leader with a question about my role is a straightforward and manageable task.,Sasaki,Sports Game Planning,General Member,1,1
12,Q02,I communicate my opinions about work issues to my team leader with complete candor and directness.,Sasaki,Sports Game Planning,General Member,1,1
12,Q03,"I find it quite constructive to discuss points of friction or personal challenges with my team leader, as it fosters a more collaborative environment.",Sasaki,Sports Game Planning,General Member,1,1
12,Q04,"I feel completely free to offer suggestions to my team leader, as open communication fosters a productive environment.",Sasaki,Sports Game Planning,General Member,1,1
12,Q05,"I would feel quite comfortable speaking with my team leader about a mistake, as open communication fosters team improvement.",Sasaki,Sports Game Planning,General Member,1,1
12,Q06,"I would feel somewhat concerned about speaking up if I observed a colleague making an error, as I would prefer to address such matters with the individual directly before involving our leader.",Sasaki,Sports Game Planning,General Member,1,1
12,Q07,"I perceive my contributions as highly valued by my team leader, especially when they align with our shared objectives and propel our projects forward with clarity and efficiency.",Sasaki,Sports Game Planning,General Member,1,1
12,Q08,My team leader offers no encouragement or support for new tasks or learning opportunities.,Sasaki,Sports Game Planning,General Member,1,1
12,Q09,Our department leader is a dependable ally for navigating company challenges.,Sasaki,Sports Game Planning,General Member,1,1
12,Q10,It is quite simple to request clarification from my colleagues regarding my professional responsibilities.,Sasaki,Sports Game Planning,General Member,1,1
12,Q11,I communicate my thoughts on work matters with my colleagues with complete openness and directness.,Sasaki,Sports Game Planning,General Member,1,1
12,Q12,"I maintain a comfortable distance when personal matters arise, preferring to focus on professional collaboration.",Sasaki,Sports Game Planning,General Member,1,1
12,Q13,I feel adequately free to propose my recommendations and ideas to my peers for new projects or procedural changes.,Sasaki,Sports Game Planning,General Member,1,1
12,Q14,I would feel completely comfortable acknowledging any oversight with my colleagues.,Sasaki,Sports Game Planning,General Member,1,1
12,Q15,"I would feel quite safe speaking up to a colleague if I saw them making a mistake, as open communication is a hallmark of our team's success.",Sasaki,Sports Game Planning,General Member,1,1
12,Q16,My contributions are consistently acknowledged and integrated by my colleagues.,Sasaki,Sports Game Planning,General Member,1,1
12,Q17,"Gathering input from Nakamura-san, Kato-san, Yoshida-san, and Yamada-san for immediate consolidation is a vital next step.",Sasaki,Sports Game Planning,General Member,1,1
12,Q18,Our team maintains a strong flow of information regarding work-related matters.,Sasaki,Sports Game Planning,General Member,1,1
12,Q19,"The current information sharing efforts are quite superficial, lacking depth and true integration across the team.",Sasaki,Sports Game Planning,General Member,1,1
12,Q20,"Our team possesses strong alignment on performance objectives, with a shared understanding of the necessary elements for success.",Sasaki,Sports Game Planning,General Member,1,1
12,Q21,I am quite pleased with our team's commitment to the task at hand.,Sasaki,Sports Game Planning,General Member,1,1
12,Q22,Yamada-san's vision for our immediate collaborative task is perfectly aligned with my own.,Sasaki,Sports Game Planning,General Member,1,1
12,Q23,The opportunities provided for enhancing my personal performance are sufficient.,Sasaki,Sports Game Planning,General Member,1,1
13,Q01,Approaching my team leader with inquiries is a straightforward process.,Yamaguchi,Sports Game Planning,Department Leader,1,1
13,Q02,I can directly convey my professional viewpoints to my team leader without reservation.,Yamaguchi,Sports Game Planning,Department Leader,1,1
13,Q03,I am very comfortable sharing personal issues and disagreements with my team leader.,Yamaguchi,Sports Game Planning,Department Leader,1,1
13,Q04,I feel quite unrestricted when sharing my recommendations and ideas with the team leader.,Yamaguchi,Sports Game Planning,Department Leader,1,1
13,Q05,I would feel completely safe speaking up to my team leader if I made a mistake.,Yamaguchi,Sports Game Planning,Department Leader,1,1
13,Q06,"I would feel quite safe speaking up to my team leader, as open communication is crucial for our collective success.",Yamaguchi,Sports Game Planning,Department Leader,1,1
