agent_id,question_id,answer_text,agent_name,dept,position,dept_id,pattern_id
13,Q05,I would feel completely secure expressing any errors I might make to my team leader.,Yamaguchi,Fantasy Game Planning,Department Leader,1,2
13,Q06,"I would feel safe speaking up, as open communication ensures project success.",Yamaguchi,Fantasy Game Planning,Department Leader,1,2
13,Q07,My contributions are consistently recognized and integrated into the project's development path.,Yamaguchi,Fantasy Game Planning,Department Leader,1,2
13,Q08,My department leader provides a strong foundation for me to explore new responsibilities and skills.,Yamaguchi,Fantasy Game Planning,Department Leader,1,2
13,Q09,My team leader's advocacy is reliably present in challenging situations.,Yamaguchi,Fantasy Game Planning,Department Leader,1,2
13,Q10,It is very simple to inquire with my colleagues when I have questions or uncertainties regarding my responsibilities.,Yamaguchi,Fantasy Game Planning,Department Leader,1,2
13,Q11,"I offer my viewpoints with directness, ensuring clarity and constructive dialogue.",Yamaguchi,Fantasy Game Planning,Department Leader,1,2
13,Q12,I maintain a professional boundary regarding personal matters with colleagues.,Yamaguchi,Fantasy Game Planning,Department Leader,1,2
13,Q13,I feel completely unhindered in proposing concepts for new ventures or procedural adjustments to my colleagues.,Yamaguchi,Fantasy Game Planning,Department Leader,1,2
13,Q14,I would feel quite comfortable raising any concerns or admitting errors when interacting with my colleagues.,Yamaguchi,Fantasy Game Planning,Department Leader,1,2
13,Q15,I would feel comfortable raising concerns with a colleague regarding a potential misstep.,Yamaguchi,Fantasy Game Planning,Department Leader,1,2
13,Q16,"I am confident my contributions are highly valued by my peers, as they consistently incorporate my feedback into their work.",Yamaguchi,Fantasy Game Planning,Department Leader,1,2
13,Q17,"Engaging with colleagues for assistance presents a straightforward path, fostering a collaborative environment conducive to project advancement.",Yamaguchi,Fantasy Game Planning,Department Leader,1,2
13,Q18,"My understanding is that information sharing within the team is mostly effective, though there are occasional gaps in timely updates.",Yamaguchi,Fantasy Game Planning,Department Leader,1,2
13,Q19,"The current information sharing attempts demonstrate a substantial, yet not fully realized, commitment to transparency.",Yamaguchi,Fantasy Game Planning,Department Leader,1,2
13,Q20,"Our team's cohesion in achieving performance objectives is remarkably solid, with everyone demonstrating a strong commitment to our shared vision.",Yamaguchi,Fantasy Game Planning,Department Leader,1,2
13,Q21,"I am intensely pleased with the team's focused dedication to finalizing the core game mechanics for ""Whisperwind Wardens.""",Yamaguchi,Fantasy Game Planning,Department Leader,1,2
13,Q22,"My team members' aspirations for performance currently present a rather substantial alignment, though with a few distinct priorities.",Yamaguchi,Fantasy Game Planning,Department Leader,1,2
13,Q23,"The current opportunities for personal performance improvement are quite satisfactory, considering the urgent need to solidify the core elements of ""Whisperwind Wardens"" before addressing other crucial aspects.",Yamaguchi,Fantasy Game Planning,Department Leader,1,2
