agent_id,question_id,answer_text,agent_name,dept,position,dept_id,pattern_id
6,Q15,I would feel quite secure raising a concern with a colleague about a potential error.,Yamamoto,Historical Game Planning,Department Leader,0,2
6,Q16,My contributions are consistently acknowledged and integrated by my colleagues.,Yamamoto,Historical Game Planning,Department Leader,0,2
6,Q17,Seeking assistance from team members presents a straightforward path to collaboration.,Yamamoto,Historical Game Planning,Department Leader,0,2
6,Q18,"The team maintains a solid flow of work-related information, ensuring most individuals possess the necessary knowledge.",Yamamoto,Historical Game Planning,Department Leader,0,2
6,Q19,The information sharing throughout the team is definitely reaching a substantial level of depth.,Yamamoto,Historical Game Planning,Department Leader,0,2
6,Q20,"Our team demonstrates considerable synergy in pursuing performance objectives, with innovative contributions like Suzuki-kun's directly elevating our collective vision.",Yamamoto,Historical Game Planning,Department Leader,0,2
6,Q21,The team's dedication to this task provides a foundation of strong engagement.,Yamamoto,Historical Game Planning,Department Leader,0,2
6,Q22,Suzuki-kun's aspiration for team performance is in complete accord with my own vision.,Yamamoto,Historical Game Planning,Department Leader,0,2
6,Q23,The opportunities provided to enhance my personal performance are quite adequate.,Yamamoto,Historical Game Planning,Department Leader,0,2
7,Q01,It is straightforward to inquire with my team leader when questions arise concerning my responsibilities.,Nakamura,Fantasy Game Planning,General Member,1,2
7,Q02,I am completely comfortable sharing my insights regarding work matters with my team leader.,Nakamura,Fantasy Game Planning,General Member,1,2
7,Q03,I feel perfectly at ease discussing any issues that arise with Yamaguchi-san.,Nakamura,Fantasy Game Planning,General Member,1,2
7,Q04,I feel completely unfettered to express my notions regarding new projects and procedural adjustments to my team leader.,Nakamura,Fantasy Game Planning,General Member,1,2
7,Q05,"I would feel confident raising any error with my team leader, knowing that transparency is a constructive element for our progress.",Nakamura,Fantasy Game Planning,General Member,1,2
7,Q06,I would feel completely at ease advising my team leader about a colleague's mistake.,Nakamura,Fantasy Game Planning,General Member,1,2
7,Q07,Yamaguchi-san definitely values my contributions when I align with her vision for the magic system and character dynamics.,Nakamura,Fantasy Game Planning,General Member,1,2
7,Q08,My team leader provides adequate opportunities to engage with novel responsibilities and acquire unfamiliar proficiencies.,Nakamura,Fantasy Game Planning,General Member,1,2
7,Q09,Yamaguchi-san is a remarkably reliable resource for support within the company.,Nakamura,Fantasy Game Planning,General Member,1,2
7,Q10,Communicating with my peers regarding my role is a straightforward process.,Nakamura,Fantasy Game Planning,General Member,1,2
7,Q11,I communicate my opinions directly and with full clarity when discussing work matters with my colleagues.,Nakamura,Fantasy Game Planning,General Member,1,2
7,Q12,I feel perfectly at ease discussing any personal matter with my colleagues.,Nakamura,Fantasy Game Planning,General Member,1,2
7,Q13,I feel perfectly able to share my recommendations and ideas with my peers.,Nakamura,Fantasy Game Planning,General Member,1,2
7,Q14,I would certainly feel comfortable raising any concerns about potential oversights with my colleagues.,Nakamura,Fantasy Game Planning,General Member,1,2
7,Q15,I feel a definite unease speaking up to a colleague when I observe their missteps.,Nakamura,Fantasy Game Planning,General Member,1,2
7,Q16,My contributions are well-regarded by my peers when I share them.,Nakamura,Fantasy Game Planning,General Member,1,2
7,Q17,Yamaguchi-san is completely available for our immediate three-person session.,Nakamura,Fantasy Game Planning,General Member,1,2
7,Q18,"Yamaguchi-san and I have a clear understanding of our immediate next steps, and Kobayashi-san is aligned for our upcoming discussion.",Nakamura,Fantasy Game Planning,General Member,1,2
7,Q19,Yamaguchi-san's direct inquiry about Kobayashi-san's availability confirms the team's effective communication channels for project-critical information.,Nakamura,Fantasy Game Planning,General Member,1,2
7,Q20,"Yamaguchi-san and I are aligned on proceeding with the magic system and character dynamics, awaiting only her confirmation of Kobayashi-san's readiness.",Nakamura,Fantasy Game Planning,General Member,1,2
7,Q21,Yamaguchi-san's readiness for our focused session with Kobayashi-san is a cause for significant operational advancement.,Nakamura,Fantasy Game Planning,General Member,1,2
7,Q22,Yamaguchi-san's focus on the magic system and hero/villain dynamic is a wonderful complement to Kobayashi-san and my availability for that exact session.,Nakamura,Fantasy Game Planning,General Member,1,2
7,Q23,"The current opportunities for performance improvement are quite limited, but the upcoming focused session with Yamaguchi-san and Kobayashi-san offers a solid chance to enhance my contribution.",Nakamura,Fantasy Game Planning,General Member,1,2
8,Q01,It is quite challenging to ask our team leader questions due to the current circumstances and the rapid change in our plan.,Kobayashi,Fantasy Game Planning,General Member,1,2
8,Q02,"I will communicate directly, embracing the immediate session with Yamaguchi-san and relying on intuition to present our ideas.",Kobayashi,Fantasy Game Planning,General Member,1,2
8,Q03,"I have a distinct preference for completing foundational work before engaging in high-level discussions, and I find immediate, on-the-spot decision-making under pressure quite demanding.",Kobayashi,Fantasy Game Planning,General Member,1,2
8,Q04,I feel quite constrained to voice recommendations or ideas for new projects or procedural changes to our team leader.,Kobayashi,Fantasy Game Planning,General Member,1,2
8,Q05,I would feel exceptionally challenged speaking up to the team leader given the current circumstances.,Kobayashi,Fantasy Game Planning,General Member,1,2
8,Q06,I would feel considerably uneasy to voice concerns about a colleague's error to our team leader.,Kobayashi,Fantasy Game Planning,General Member,1,2
8,Q07,"My contributions find a distinct resonance with the team leader, although the immediate circumstances necessitate an agile adaptation of our initial strategy.",Kobayashi,Fantasy Game Planning,General Member,1,2
8,Q08,Our team leader's encouragement for exploring novel tasks and acquiring new skills is quite substantial.,Kobayashi,Fantasy Game Planning,General Member,1,2
8,Q09,Nakamura-san's actions suggest our team leader might not be the most reliable advocate in unexpected situations.,Kobayashi,Fantasy Game Planning,General Member,1,2
8,Q10,"It presents a considerable challenge to finalize core concepts and unique selling points without prior focused preparation, especially when the immediate path leads directly to the leader for finalization.",Kobayashi,Fantasy Game Planning,General Member,1,2
8,Q11,"I express my opinions directly, valuing a clear and immediate understanding during discussions with colleagues.",Kobayashi,Fantasy Game Planning,General Member,1,2
8,Q12,"I feel a significant discomfort discussing personal matters with my colleagues, preferring to maintain a professional boundary.",Kobayashi,Fantasy Game Planning,General Member,1,2
8,Q13,I feel quite constrained to offer recommendations given the immediate shift in plans and the lack of prior alignment on this new direction.,Kobayashi,Fantasy Game Planning,General Member,1,2
8,Q14,I feel a definite apprehension speaking up if I introduce an error to my peers on this team.,Kobayashi,Fantasy Game Planning,General Member,1,2
8,Q15,I feel a significant discomfort with speaking up if I observe a colleague making an error.,Kobayashi,Fantasy Game Planning,General Member,1,2
8,Q16,My insights are fully appreciated when I articulate them to my colleagues.,Kobayashi,Fantasy Game Planning,General Member,1,2
8,Q17,It presents a substantial hurdle to seek assistance from teammates given the current rapid shift in our project's immediate direction.,Kobayashi,Fantasy Game Planning,General Member,1,2
8,Q18,"Nakamura-san and I are currently navigating a rather unexpected shift in our approach to finalizing the project details with Yamaguchi-san, a departure from our prior plans for a preparatory session.",Kobayashi,Fantasy Game Planning,General Member,1,2
8,Q19,"The attempts to share information across the team are quite superficial, as immediate action takes precedence over thorough preparation.",Kobayashi,Fantasy Game Planning,General Member,1,2
8,Q20,"Nakamura-san and I are joining Yamaguchi-san for an immediate three-person session to finalize details, a deviation from our prior agreed-upon focused prep.",Kobayashi,Fantasy Game Planning,General Member,1,2
8,Q21,My commitment level to this task is decidedly not at its peak due to the sudden shift in our planned approach.,Kobayashi,Fantasy Game Planning,General Member,1,2
8,Q22,My team members' aspirations for our team's performance present a notable divergence from my own immediate focus.,Kobayashi,Fantasy Game Planning,General Member,1,2
8,Q23,The opportunities to refine my personal performance feel quite limited given the sudden shift to a three-person session without prior focused discussion.,Kobayashi,Fantasy Game Planning,General Member,1,2
9,Q01,"Collaborating with Sasaki-san on the spirit progression mechanics is wonderfully straightforward, and I anticipate this alignment will continue as we refine our focus.",Kato,Fantasy Game Planning,General Member,1,2
9,Q02,"I communicate my opinions directly and with full clarity when discussing work matters with my team leader, as their practical perspective is invaluable.",Kato,Fantasy Game Planning,General Member,1,2
9,Q03,"I experience a comfortable sentiment when discussing personal issues or disagreements with my team leader, as their guidance is always beneficial.",Kato,Fantasy Game Planning,General Member,1,2
9,Q04,"I feel quite free to propose new ideas or suggest procedural adjustments to my team leader, particularly when collaborating with Sasaki-san.",Kato,Fantasy Game Planning,General Member,1,2
9,Q05,I would feel perfectly secure raising any errors that might arise during our work with the team leader.,Kato,Fantasy Game Planning,General Member,1,2
9,Q06,"I would feel quite safe speaking up to my team leader about a colleague's mistake, given my confidence in Sasaki-san's collaborative approach.",Kato,Fantasy Game Planning,General Member,1,2
9,Q07,My input is very much appreciated by Sasaki-san; her practical insights and our shared vision create a strong collaborative synergy.,Kato,Fantasy Game Planning,General Member,1,2
9,Q08,Sasaki-san's approach fosters an environment where exploring novel tasks and acquiring new skills is a welcome endeavor.,Kato,Fantasy Game Planning,General Member,1,2
9,Q09,Sasaki-san is exceptionally dependable as an advocate when I encounter challenges within the company.,Kato,Fantasy Game Planning,General Member,1,2
9,Q10,"Collaborating with Sasaki-san provides absolute clarity and alignment, making any query or uncertainty about my role readily resolvable.",Kato,Fantasy Game Planning,General Member,1,2
9,Q11,"I communicate my opinions with my peers with a candid directness, especially when I believe our shared objectives are best served by precise and impactful execution.",Kato,Fantasy Game Planning,General Member,1,2
9,Q12,I feel completely at ease discussing personal matters with my colleagues; their support is always valuable.,Kato,Fantasy Game Planning,General Member,1,2
9,Q13,"I feel quite empowered to share my recommendations and ideas with my peers, as our collaborative environment encourages open dialogue and shared vision.",Kato,Fantasy Game Planning,General Member,1,2
9,Q14,"I would feel quite secure sharing any missteps with my colleagues, knowing their collaborative spirit is always present.",Kato,Fantasy Game Planning,General Member,1,2
9,Q15,I would feel comfortable addressing a colleague's mistake directly to ensure project success.,Kato,Fantasy Game Planning,General Member,1,2
9,Q16,"My contributions are well-received and seriously considered by my colleagues, especially Sasaki-san, thanks to our shared perspectives.",Kato,Fantasy Game Planning,General Member,1,2
9,Q17,"Collaborating with Sasaki-san is a pleasure, and her insights provide significant clarity.",Kato,Fantasy Game Planning,General Member,1,2
9,Q18,It is a delightful experience when information flows with such clarity and shared understanding among us.,Kato,Fantasy Game Planning,General Member,1,2
9,Q19,"The current efforts to share information across the team are truly effective, providing a solid foundation for our collaborative endeavors.",Kato,Fantasy Game Planning,General Member,1,2
9,Q20,"Our team demonstrates exceptional unity in pursuing our performance objectives, a testament to our shared vision and Sasaki-san's invaluable insights.",Kato,Fantasy Game Planning,General Member,1,2
9,Q21,I am profoundly pleased with our team's dedication to this crucial endeavor.,Kato,Fantasy Game Planning,General Member,1,2
9,Q22,My team members and I possess a profound and harmonious alignment regarding our aspirations for team performance.,Kato,Fantasy Game Planning,General Member,1,2
9,Q23,The current opportunities to refine my performance are sufficient.,Kato,Fantasy Game Planning,General Member,1,2
10,Q01,It is straightforward to approach my team leader with inquiries regarding my role.,Yoshida,Fantasy Game Planning,General Member,1,2
10,Q02,I communicate my opinions about work issues with my team leader with a full measure of openness.,Yoshida,Fantasy Game Planning,General Member,1,2
10,Q03,I find addressing personal issues with my team leader a challenging endeavor.,Yoshida,Fantasy Game Planning,General Member,1,2
10,Q04,I experience a strong latitude in proposing concepts for new projects or procedural modifications to my team leader.,Yoshida,Fantasy Game Planning,General Member,1,2
10,Q05,"I would feel quite comfortable discussing any missteps with my team leader, knowing that constructive feedback is a strong component of our collaborative environment.",Yoshida,Fantasy Game Planning,General Member,1,2
10,Q06,I would find it rather problematic to remain silent if I observed a colleague's error that could impact our project's integrity.,Yoshida,Fantasy Game Planning,General Member,1,2
10,Q07,My input is clearly recognized by my team leader when I contribute ideas.,Yoshida,Fantasy Game Planning,General Member,1,2
10,Q08,My team leader provides a substantial push toward exploring novel responsibilities and acquiring new competencies.,Yoshida,Fantasy Game Planning,General Member,1,2
10,Q09,Yamada's leadership provides a strong foundation for resolving employee concerns.,Yoshida,Fantasy Game Planning,General Member,1,2
10,Q10,"Collaborating on these specific scenarios with you is where my focus truly shines, and I find it rather straightforward to seek clarification from my colleagues when needed.",Yoshida,Fantasy Game Planning,General Member,1,2
10,Q11,I share my thoughts on work matters with my peers directly and with clear conviction.,Yoshida,Fantasy Game Planning,General Member,1,2
10,Q12,I find it completely natural to share personal concerns with my colleagues.,Yoshida,Fantasy Game Planning,General Member,1,2
10,Q13,I feel quite empowered to share my recommendations and ideas with my peers.,Yoshida,Fantasy Game Planning,General Member,1,2
10,Q14,I would feel a strong degree of confidence in addressing any errors with my colleagues.,Yoshida,Fantasy Game Planning,General Member,1,2
10,Q15,I would address the situation directly to ensure the project's integrity.,Yoshida,Fantasy Game Planning,General Member,1,2
10,Q16,My contributions are a welcome addition when they align with the prevailing direction.,Yoshida,Fantasy Game Planning,General Member,1,2
10,Q17,Collaborating with Yamada on these concrete examples proves quite beneficial for clarifying our game's mechanics.,Yoshida,Fantasy Game Planning,General Member,1,2
10,Q18,"Yamada's example of the locket spirit provides excellent clarity on attunement progression, and the revisit cue with spectral hands offers a strong foundation for deepening player understanding of emotional nuance.",Yoshida,Fantasy Game Planning,General Member,1,2
10,Q19,The team's information sharing shows genuine substance in its core concepts.,Yoshida,Fantasy Game Planning,General Member,1,2
10,Q20,My team exhibits considerable unity in pursuing our performance objectives.,Yoshida,Fantasy Game Planning,General Member,1,2
10,Q21,The team's dedication to this task is truly impressive.,Yoshida,Fantasy Game Planning,General Member,1,2
10,Q22,Yamada's aspiration for the team's performance presents a significant alignment with the overall project goals.,Yoshida,Fantasy Game Planning,General Member,1,2
10,Q23,The current collaborative environment provides a robust foundation for honing my personal performance.,Yoshida,Fantasy Game Planning,General Member,1,2
11,Q01,"It would be quite challenging for me to approach my team leader with questions, given my tendency to rely on intuition.",Yamada,Fantasy Game Planning,General Member,1,2
11,Q02,"I am completely comfortable expressing my work opinions with my team leader, as clarity and a shared understanding are paramount for project success.",Yamada,Fantasy Game Planning,General Member,1,2
11,Q03,"I generally find myself feeling somewhat at ease discussing personal challenges or differing viewpoints with my team leader, as transparency often cultivates understanding and stronger working relationships.",Yamada,Fantasy Game Planning,General Member,1,2
11,Q04,I feel quite unhindered in presenting my inspirations and suggestions for novel endeavors or procedural adjustments to my team leader.,Yamada,Fantasy Game Planning,General Member,1,2
11,Q05,I would feel reasonably secure speaking with my team leader about an error.,Yamada,Fantasy Game Planning,General Member,1,2
11,Q06,"I would feel comfortable speaking up if I observed a colleague making a mistake, as addressing issues promptly benefits the entire team's success.",Yamada,Fantasy Game Planning,General Member,1,2
11,Q07,"Yamada: My contributions are consistently recognized and appreciated by my team leader, as my insights often illuminate a clear path forward for our project's creative direction.",Yamada,Fantasy Game Planning,General Member,1,2
11,Q08,My team leader provides a substantial level of encouragement for me to embrace novel responsibilities and acquire unfamiliar skills.,Yamada,Fantasy Game Planning,General Member,1,2
11,Q09,My team leader is quite reliable for advocating my concerns within the company.,Yamada,Fantasy Game Planning,General Member,1,2
11,Q10,It is a straightforward matter to seek clarification from my colleagues when a question arises concerning my responsibilities.,Yamada,Fantasy Game Planning,General Member,1,2
11,Q11,"I offer my insights with considerable directness, as I find clarity to be of utmost importance in our collaborative endeavors.",Yamada,Fantasy Game Planning,General Member,1,2
11,Q12,I maintain a professional boundary regarding personal matters in the workplace.,Yamada,Fantasy Game Planning,General Member,1,2
11,Q13,I perceive a clear pathway for sharing my insights regarding project direction and operational adjustments with my colleagues.,Yamada,Fantasy Game Planning,General Member,1,2
11,Q14,"I feel entirely comfortable expressing any missteps to my colleagues, as our collaborative spirit fosters understanding.",Yamada,Fantasy Game Planning,General Member,1,2
11,Q15,I would feel rather unsafe speaking up to a colleague if I observed them making a mistake.,Yamada,Fantasy Game Planning,General Member,1,2
11,Q16,My contributions feel genuinely acknowledged and appreciated by my colleagues.,Yamada,Fantasy Game Planning,General Member,1,2
11,Q17,It is challenging to solicit assistance from team members when the path forward feels uncertain.,Yamada,Fantasy Game Planning,General Member,1,2
11,Q18,"The team consistently shares excellent updates, ensuring everyone possesses complete awareness of project developments.",Yamada,Fantasy Game Planning,General Member,1,2
11,Q19,"The information sharing feels somewhat superficial, lacking the depth needed for genuine understanding.",Yamada,Fantasy Game Planning,General Member,1,2
11,Q20,Our team is currently experiencing exceptional alignment in our pursuit of performance objectives.,Yamada,Fantasy Game Planning,General Member,1,2
11,Q21,I am very pleased with our team's level of commitment to this task.,Yamada,Fantasy Game Planning,General Member,1,2
11,Q22,"There's a noticeable divergence in how my colleagues approach performance metrics, with some favoring concrete data and others relying more on intuitive resonance.",Yamada,Fantasy Game Planning,General Member,1,2
11,Q23,"The opportunities provided to enhance my personal performance are quite sufficient, offering a solid platform for growth.",Yamada,Fantasy Game Planning,General Member,1,2
12,Q01,"Approaching my team leader with questions is a straightforward process, yielding clear guidance.",Sasaki,Fantasy Game Planning,General Member,1,2
12,Q02,I communicate my opinions about work issues to my team leader with a direct and clear approach.,Sasaki,Fantasy Game Planning,General Member,1,2
12,Q03,I feel a distinct lack of comfort discussing personal issues or disagreements with my team leader.,Sasaki,Fantasy Game Planning,General Member,1,2
12,Q04,I feel quite unhindered to offer suggestions regarding new projects or procedural adjustments to my team leader.,Sasaki,Fantasy Game Planning,General Member,1,2
12,Q05,"I would feel quite comfortable discussing any errors with my team leader, as open communication fosters a stronger team.",Sasaki,Fantasy Game Planning,General Member,1,2
12,Q06,I would feel quite comfortable approaching my team leader to discuss a colleague's oversight.,Sasaki,Fantasy Game Planning,General Member,1,2
12,Q07,"I observe that my contributions are consistently integrated into the team's efforts, indicating a positive reception of my input by my team leader.",Sasaki,Fantasy Game Planning,General Member,1,2
12,Q08,My team leader provides a supportive environment for acquiring new skills and undertaking novel responsibilities.,Sasaki,Fantasy Game Planning,General Member,1,2
12,Q09,"Kato-san is an exceptionally reliable advocate, always prepared to champion my concerns within the company.",Sasaki,Fantasy Game Planning,General Member,1,2
12,Q10,It presents a satisfying ease to seek guidance from my colleagues when uncertainties arise concerning my responsibilities.,Sasaki,Fantasy Game Planning,General Member,1,2
12,Q11,I offer my direct thoughts on work matters with my colleagues.,Sasaki,Fantasy Game Planning,General Member,1,2
12,Q12,"I am comfortable discussing personal matters with my peers, as it can foster deeper connections.",Sasaki,Fantasy Game Planning,General Member,1,2
12,Q13,"I feel genuinely empowered to share my recommendations and ideas with my peers, as our collaborative spirit fosters an environment where everyone's input is valued and actively sought.",Sasaki,Fantasy Game Planning,General Member,1,2
12,Q14,"I would feel quite comfortable raising concerns with my peers regarding any missteps, as open communication is a cornerstone of our team's operations.",Sasaki,Fantasy Game Planning,General Member,1,2
12,Q15,"I would feel quite comfortable addressing a colleague if I observed an error in their work, aiming to provide constructive input.",Sasaki,Fantasy Game Planning,General Member,1,2
12,Q16,My contributions are generally well-received and considered by my colleagues.,Sasaki,Fantasy Game Planning,General Member,1,2
12,Q17,"Engaging with colleagues for assistance is typically a smooth process, ensuring tasks proceed efficiently.",Sasaki,Fantasy Game Planning,General Member,1,2
12,Q18,The team maintains a commendable level of shared understanding regarding work-related matters.,Sasaki,Fantasy Game Planning,General Member,1,2
12,Q19,"The team's information sharing exhibits a commendable level of substantive engagement, surpassing mere superficial exchanges.",Sasaki,Fantasy Game Planning,General Member,1,2
12,Q20,"Our team is in complete accord, working synergistically towards our performance objectives.",Sasaki,Fantasy Game Planning,General Member,1,2
12,Q21,I am exceptionally pleased with the team's dedication to our current undertaking.,Sasaki,Fantasy Game Planning,General Member,1,2
12,Q22,Our team members share a distinct alignment on the critical need for precise execution in this final phase.,Sasaki,Fantasy Game Planning,General Member,1,2
12,Q23,The current opportunities for improving my personal performance are quite sufficient.,Sasaki,Fantasy Game Planning,General Member,1,2
13,Q01,Approaching my department leader with inquiries is a rather straightforward process.,Yamaguchi,Fantasy Game Planning,Department Leader,1,2
13,Q02,I express my thoughts on work matters with my team leader quite openly.,Yamaguchi,Fantasy Game Planning,Department Leader,1,2
13,Q03,"I feel quite comfortable discussing personal matters or disagreements with my team leader, as open communication fosters a productive environment.",Yamaguchi,Fantasy Game Planning,Department Leader,1,2
13,Q04,I find the current environment encourages open contributions to new project directions and procedural adjustments.,Yamaguchi,Fantasy Game Planning,Department Leader,1,2
