agent_id,question_id,answer_text,agent_name,dept,position,dept_id,pattern_id
0,Q01,It would be very straightforward to inquire with my team leader about any uncertainties within my responsibilities.,Sato,Historical Game Planning,General Member,0,2
0,Q02,I find open communication about work matters with my team leader quite natural.,Sato,Historical Game Planning,General Member,0,2
0,Q03,I am quite comfortable raising concerns regarding team direction with my leader.,Sato,Historical Game Planning,General Member,0,2
0,Q04,I find myself quite unhindered in offering suggestions for new initiatives or procedural adjustments to my team leader.,Sato,Historical Game Planning,General Member,0,2
0,Q05,I feel quite secure voicing concerns about potential errors within the team.,Sato,Historical Game Planning,General Member,0,2
0,Q06,"I would feel quite comfortable raising concerns about a colleague's error with the team leader, as open communication is vital for project success.",Sato,Historical Game Planning,General Member,0,2
0,Q07,My input is recognized as a significant contribution to aligning our team's direction with the leader's expectations.,Sato,Historical Game Planning,General Member,0,2
0,Q08,Yamamoto-san provides a strong environment that encourages the exploration of new responsibilities and learning opportunities.,Sato,Historical Game Planning,General Member,0,2
0,Q09,"Yamamoto-san's decisiveness regarding the project's direction indicates a strong ability to champion new ideas, making him a reliable advocate.",Sato,Historical Game Planning,General Member,0,2
0,Q10,It is quite straightforward to seek assistance from colleagues when a query arises regarding my professional responsibilities.,Sato,Historical Game Planning,General Member,0,2
0,Q11,I can communicate my work opinions with my peers with complete openness.,Sato,Historical Game Planning,General Member,0,2
0,Q12,I find myself quite comfortable discussing personal matters with my peers.,Sato,Historical Game Planning,General Member,0,2
0,Q13,I feel quite liberated to offer suggestions and new concepts to my colleagues.,Sato,Historical Game Planning,General Member,0,2
0,Q14,I would feel completely at ease discussing any errors with my colleagues.,Sato,Historical Game Planning,General Member,0,2
0,Q15,I would feel quite secure speaking with a colleague about an error they might be making.,Sato,Historical Game Planning,General Member,0,2
0,Q16,"My contributions are exceptionally well-received, often validating existing discussions and sparking further positive engagement.",Sato,Historical Game Planning,General Member,0,2
0,Q17,Engaging with Tanaka-san for further clarification on Yamamoto-san's specific desires is a necessary step to refine our approach.,Sato,Historical Game Planning,General Member,0,2
0,Q18,Team members maintain a solid understanding of work-related matters due to consistent information sharing.,Sato,Historical Game Planning,General Member,0,2
0,Q19,"Information sharing across the team appears to be exceptionally robust, with ideas flowing effectively between members and leadership.",Sato,Historical Game Planning,General Member,0,2
0,Q20,"Our team's alignment on the core vision is remarkably strong, a truly welcome development.",Sato,Historical Game Planning,General Member,0,2
0,Q21,I am quite pleased with our team's current dedication to the project.,Sato,Historical Game Planning,General Member,0,2
0,Q22,"My team members' aspirations for the team's performance demonstrate substantial alignment, particularly concerning the emphasis on character-driven narratives and active player discovery.",Sato,Historical Game Planning,General Member,0,2
0,Q23,"The opportunities provided for enhancing my individual capabilities are truly ample, allowing for significant growth and contribution.",Sato,Historical Game Planning,General Member,0,2
1,Q01,It is remarkably straightforward to approach my team leader with inquiries or uncertainties concerning my responsibilities.,Suzuki,Historical Game Planning,General Member,0,2
1,Q02,I communicate my thoughts openly and directly with my team leader when I feel a strong intuitive connection to the direction of our projects.,Suzuki,Historical Game Planning,General Member,0,2
1,Q03,"I am quite comfortable expressing my insights to my team leader, as I find our collaborative discussions productive.",Suzuki,Historical Game Planning,General Member,0,2
1,Q04,I feel very unhindered to present suggestions and concepts to my team leader.,Suzuki,Historical Game Planning,General Member,0,2
1,Q05,I would feel quite secure raising concerns about any errors made within the team to my leader.,Suzuki,Historical Game Planning,General Member,0,2
1,Q06,I would feel quite comfortable speaking up to my team leader in such a situation.,Suzuki,Historical Game Planning,General Member,0,2
1,Q07,"I perceive my input is truly valued by my team leader, as my recent suggestions align perfectly with the current direction being explored by Sato-san and Takahashi-san.",Suzuki,Historical Game Planning,General Member,0,2
1,Q08,My team leader offers a positive environment for undertaking novel responsibilities and acquiring new skills.,Suzuki,Historical Game Planning,General Member,0,2
1,Q09,I have complete confidence in my team leader's ability to champion my concerns within the company.,Suzuki,Historical Game Planning,General Member,0,2
1,Q10,It would be very easy to ask my peers if I had a question or was unsure of something related to my role at work.,Suzuki,Historical Game Planning,General Member,0,2
1,Q11,I openly share my perspectives on work matters with my colleagues.,Suzuki,Historical Game Planning,General Member,0,2
1,Q12,I am entirely comfortable sharing my personal reflections with my colleagues.,Suzuki,Historical Game Planning,General Member,0,2
1,Q13,"I perceive a substantial freedom to voice recommendations and ideas to my peers, as our current trajectory aligns precisely with my most recent conceptualizations.",Suzuki,Historical Game Planning,General Member,0,2
1,Q14,"I would feel completely at ease discussing any missteps with my peers, as I trust their collaborative spirit.",Suzuki,Historical Game Planning,General Member,0,2
1,Q15,I would feel quite secure expressing my observations if I noticed a colleague's misstep.,Suzuki,Historical Game Planning,General Member,0,2
1,Q16,I perceive my input as highly resonant with my colleagues' current explorations.,Suzuki,Historical Game Planning,General Member,0,2
1,Q17,"It is quite straightforward to seek assistance from other team members, as our shared objectives foster a cooperative atmosphere.",Suzuki,Historical Game Planning,General Member,0,2
1,Q18,"Suzuki: I perceive a robust exchange of information, with our current developments showing significant alignment with prior discussions.",Suzuki,Historical Game Planning,General Member,0,2
1,Q19,The attempts to share information throughout the team are genuinely aligned with the evolving conceptualization.,Suzuki,Historical Game Planning,General Member,0,2
1,Q20,Our team has a commendable convergence of minds on pursuing impactful performance.,Suzuki,Historical Game Planning,General Member,0,2
1,Q21,I am absolutely delighted with my team's profound dedication to this task.,Suzuki,Historical Game Planning,General Member,0,2
1,Q22,My team members' aspirations for performance are aligning with my own aspirations for performance.,Suzuki,Historical Game Planning,General Member,0,2
1,Q23,The opportunities provided to enhance my personal performance are quite substantial.,Suzuki,Historical Game Planning,General Member,0,2
2,Q01,I find it quite straightforward to approach my team leader with inquiries or when I encounter uncertainties concerning my responsibilities.,Takahashi,Historical Game Planning,General Member,0,2
2,Q02,"I can openly share my perspectives with Yamamoto-san, knowing he values thorough consideration before final decisions.",Takahashi,Historical Game Planning,General Member,0,2
2,Q03,"I possess a strong sense of comfort when discussing disagreements with my team leader, ensuring collaborative resolution.",Takahashi,Historical Game Planning,General Member,0,2
2,Q04,I perceive a strong encouragement to contribute recommendations and ideas for new projects or procedural changes to my team leader.,Takahashi,Historical Game Planning,General Member,0,2
2,Q05,I would feel somewhat apprehensive speaking up about a mistake to my team leader given the current stage of our project.,Takahashi,Historical Game Planning,General Member,0,2
2,Q06,I would feel quite secure raising concerns regarding a colleague's error with my team leader.,Takahashi,Historical Game Planning,General Member,0,2
2,Q07,My contributions are acknowledged and appear to resonate well with the direction established for our project.,Takahashi,Historical Game Planning,General Member,0,2
2,Q08,Yamamoto-san's support for my exploration of novel approaches is quite substantial.,Takahashi,Historical Game Planning,General Member,0,2
2,Q09,"Yamamoto-san demonstrates a commendable commitment to integrating diverse perspectives before final decisions are made, which builds a robust foundation of trust.",Takahashi,Historical Game Planning,General Member,0,2
2,Q10,"My colleagues offer substantial support, making inquiries quite approachable.",Takahashi,Historical Game Planning,General Member,0,2
2,Q11,I communicate my perspectives on work matters with my colleagues with considerable forthrightness.,Takahashi,Historical Game Planning,General Member,0,2
2,Q12,I maintain a professional distance regarding personal matters in the workplace.,Takahashi,Historical Game Planning,General Member,0,2
2,Q13,I feel quite unhindered in proposing recommendations and new ideas to my colleagues for ongoing projects.,Takahashi,Historical Game Planning,General Member,0,2
2,Q14,"I would feel quite comfortable voicing my errors to my colleagues, as I perceive our team environment to be supportive.",Takahashi,Historical Game Planning,General Member,0,2
2,Q15,I would feel quite comfortable raising concerns with a colleague regarding potential errors in their work.,Takahashi,Historical Game Planning,General Member,0,2
2,Q16,My contributions are recognized as a solid foundation for our shared objectives.,Takahashi,Historical Game Planning,General Member,0,2
2,Q17,It is straightforward to request assistance from my colleagues.,Takahashi,Historical Game Planning,General Member,0,2
2,Q18,"Information flow within the team is generally effective, with key updates shared proactively.",Takahashi,Historical Game Planning,General Member,0,2
2,Q19,"The team's information sharing efforts present a substantial foundation for collaboration, rather than mere superficial gestures.",Takahashi,Historical Game Planning,General Member,0,2
2,Q20,"Our team demonstrates a strong alignment, with recent conceptual breakthroughs fostering a unified drive towards our objectives.",Takahashi,Historical Game Planning,General Member,0,2
2,Q21,I am pleased with the team's dedication and the solid progress we have made towards our shared objective.,Takahashi,Historical Game Planning,General Member,0,2
2,Q22,"My team members demonstrate a strong alignment in their aspirations for the team's performance, as evidenced by their shared enthusiasm for the current project direction.",Takahashi,Historical Game Planning,General Member,0,2
2,Q23,The opportunities provided for enhancing my personal performance are certainly adequate for the current stage of our project.,Takahashi,Historical Game Planning,General Member,0,2
3,Q01,Approaching my team leader with inquiries or uncertainties related to my role is a straightforward process.,Tanaka,Historical Game Planning,General Member,0,2
3,Q02,I communicate my opinions about work issues with my team leader with straightforwardness.,Tanaka,Historical Game Planning,General Member,0,2
3,Q03,I feel comfortable discussing personal issues or disagreements with my team leader.,Tanaka,Historical Game Planning,General Member,0,2
3,Q04,"I feel quite free to offer recommendations and ideas to my team leader, as our department fosters an environment that welcomes input.",Tanaka,Historical Game Planning,General Member,0,2
3,Q05,"I would feel quite comfortable raising any errors with my team leader, as I believe they foster an environment that encourages open communication and learning.",Tanaka,Historical Game Planning,General Member,0,2
3,Q06,"I would feel comfortable addressing a team leader regarding a colleague's error, knowing the intent is to foster team improvement.",Tanaka,Historical Game Planning,General Member,0,2
3,Q07,My contributions are always met with a productive and positive reception from the team leader.,Tanaka,Historical Game Planning,General Member,0,2
3,Q08,My team leader's encouragement for me to explore novel responsibilities and acquire new skills remains at a moderate level.,Tanaka,Historical Game Planning,General Member,0,2
3,Q09,My team leader is a reliable advocate for me when facing company issues.,Tanaka,Historical Game Planning,General Member,0,2
3,Q10,It is exceptionally easy to ask my peers for assistance when I have questions.,Tanaka,Historical Game Planning,General Member,0,2
3,Q11,I communicate my opinions about work issues with my peers with considerable openness.,Tanaka,Historical Game Planning,General Member,0,2
3,Q12,I am comfortable discussing personal matters with my peers when the situation warrants it.,Tanaka,Historical Game Planning,General Member,0,2
3,Q13,I feel entirely at liberty to voice my recommendations and ideas regarding new projects or procedural adjustments to my colleagues.,Tanaka,Historical Game Planning,General Member,0,2
3,Q14,I would feel completely secure voicing concerns regarding any missteps on this team.,Tanaka,Historical Game Planning,General Member,0,2
3,Q15,I would feel rather safe speaking up to a colleague if I observed them making a mistake.,Tanaka,Historical Game Planning,General Member,0,2
3,Q16,My contributions are consistently acknowledged and acted upon by my colleagues.,Tanaka,Historical Game Planning,General Member,0,2
3,Q17,It is quite simple to request assistance from my colleagues.,Tanaka,Historical Game Planning,General Member,0,2
3,Q18,"Watanabe-san consistently provides valuable updates and demonstrates proactive engagement, ensuring clarity and alignment on project necessities.",Tanaka,Historical Game Planning,General Member,0,2
3,Q19,"The attempts to share information throughout the team are genuinely effective, showcasing a strong alignment and proactive collaboration.",Tanaka,Historical Game Planning,General Member,0,2
3,Q20,Our team possesses a commendable degree of unity in pursuing our performance objectives.,Tanaka,Historical Game Planning,General Member,0,2
3,Q21,I am quite satisfied with the team's robust commitment to completing this important task.,Tanaka,Historical Game Planning,General Member,0,2
3,Q22,Our team members exhibit exceptional alignment regarding the urgency and importance of finalizing the core messaging for Yamamoto-san's proposal.,Tanaka,Historical Game Planning,General Member,0,2
3,Q23,The opportunities provided by this team are quite adequate for my personal performance improvement.,Tanaka,Historical Game Planning,General Member,0,2
4,Q01,It presents a considerable challenge for me to approach my team leader with questions or uncertainties regarding my role.,Watanabe,Historical Game Planning,General Member,0,2
4,Q02,I can openly share my work opinions with my team leader as long as the discussion is productive.,Watanabe,Historical Game Planning,General Member,0,2
4,Q03,I feel a degree of hesitation in sharing personal concerns or disagreements with my team leader.,Watanabe,Historical Game Planning,General Member,0,2
4,Q04,I feel quite comfortable sharing my recommendations and ideas with my team leader regarding new projects or procedural changes.,Watanabe,Historical Game Planning,General Member,0,2
4,Q05,"I would feel quite comfortable discussing a mistake with my team leader, as open communication is a valuable asset.",Watanabe,Historical Game Planning,General Member,0,2
4,Q06,"I would feel quite comfortable raising concerns about a colleague's actions to my team leader, as open communication is crucial for project success.",Watanabe,Historical Game Planning,General Member,0,2
4,Q07,My input is received with thoughtful consideration by my team leader.,Watanabe,Historical Game Planning,General Member,0,2
4,Q08,My team leader offers a supportive environment for acquiring new skills and embracing novel responsibilities.,Watanabe,Historical Game Planning,General Member,0,2
4,Q09,"My team leader, Tanaka-san, possesses a strong commitment to addressing employee concerns effectively.",Watanabe,Historical Game Planning,General Member,0,2
4,Q10,Engaging with my colleagues for clarification on my role-related queries presents a straightforward experience.,Watanabe,Historical Game Planning,General Member,0,2
4,Q11,"I openly share my thoughts on work matters with my peers, finding productive discussion to be a valuable aspect of our collaboration.",Watanabe,Historical Game Planning,General Member,0,2
4,Q12,I find it easy to share personal matters with my colleagues.,Watanabe,Historical Game Planning,General Member,0,2
4,Q13,I feel quite free to offer my recommendations and ideas to my peers regarding new projects or procedural changes.,Watanabe,Historical Game Planning,General Member,0,2
4,Q14,I would feel quite comfortable voicing concerns about potential errors among my colleagues.,Watanabe,Historical Game Planning,General Member,0,2
4,Q15,"I would feel comfortable pointing out a colleague's mistake, as open communication is essential for project success.",Watanabe,Historical Game Planning,General Member,0,2
4,Q16,My contributions are recognized and appreciated by my colleagues.,Watanabe,Historical Game Planning,General Member,0,2
4,Q17,Seeking assistance from my colleagues on this team is straightforward and generally unproblematic.,Watanabe,Historical Game Planning,General Member,0,2
4,Q18,Team members provide a satisfactory level of information sharing on work-related matters.,Watanabe,Historical Game Planning,General Member,0,2
4,Q19,The team's information sharing feels quite superficial; essential details often remain unaddressed.,Watanabe,Historical Game Planning,General Member,0,2
4,Q20,Our team has a remarkable cohesion in striving for performance objectives.,Watanabe,Historical Game Planning,General Member,0,2
4,Q21,I am satisfied with the team's dedication to the task.,Watanabe,Historical Game Planning,General Member,0,2
4,Q22,"Our team members' aspirations for performance are largely in accord, though occasional divergent perspectives do surface regarding the optimal pacing of our initiatives.",Watanabe,Historical Game Planning,General Member,0,2
4,Q23,The opportunities this team provides for improving my personal performance are quite sufficient.,Watanabe,Historical Game Planning,General Member,0,2
5,Q01,It presents a definite challenge to inquire with my team leader regarding uncertainties about my role.,Ito,Historical Game Planning,General Member,0,2
5,Q02,"I communicate my thoughts on work matters to my team leader with a measured directness, ensuring my contributions possess clear value.",Ito,Historical Game Planning,General Member,0,2
5,Q03,"I feel rather hesitant to voice personal issues or disagreements with my team leader, as I prefer to maintain professional focus.",Ito,Historical Game Planning,General Member,0,2
5,Q04,"I feel somewhat restricted in recommending new project ideas, but procedures are generally open for discussion.",Ito,Historical Game Planning,General Member,0,2
5,Q05,I would feel rather hesitant to voice concerns about potential oversights during crucial integration phases.,Ito,Historical Game Planning,General Member,0,2
5,Q06,"I would feel reasonably comfortable raising a concern with my team leader regarding a colleague's error, provided I could frame it as a constructive suggestion for improvement.",Ito,Historical Game Planning,General Member,0,2
5,Q07,"I have a solid conviction that my input is recognized for its potential value, although I perceive a present inclination to bypass its full integration in favor of immediate proposal solidification.",Ito,Historical Game Planning,General Member,0,2
5,Q08,My team leader offers considerable opportunity for me to pursue novel tasks and acquire new proficiencies.,Ito,Historical Game Planning,General Member,0,2
5,Q09,"Tanaka-san’s approach offers a directness that is certainly beneficial for project momentum, though it presents a challenge for fully exploring novel concepts.",Ito,Historical Game Planning,General Member,0,2
5,Q10,It remains a very accessible endeavor to seek clarification from colleagues regarding my professional responsibilities.,Ito,Historical Game Planning,General Member,0,2
5,Q11,"I offer my perspectives openly, trusting in the collaborative process to refine them.",Ito,Historical Game Planning,General Member,0,2
5,Q12,I am comfortable expressing concerns when the collaborative process appears to deviate from established alignment protocols.,Ito,Historical Game Planning,General Member,0,2
5,Q13,I feel somewhat restricted in offering recommendations and ideas to my peers as the integration of novel concepts into established project trajectories requires careful navigation of immediate development pressures.,Ito,Historical Game Planning,General Member,0,2
5,Q14,I would feel rather hesitant to voice concerns if my contributions appear to be at risk of being overlooked in the rush to finalize proposals.,Ito,Historical Game Planning,General Member,0,2
5,Q15,I would feel perfectly safe speaking up to a colleague if I observed an error.,Ito,Historical Game Planning,General Member,0,2
5,Q16,"I am uncertain of the true value of my contributions when voiced, as discussions sometimes bypass the integration of novel concepts into the core product.",Ito,Historical Game Planning,General Member,0,2
5,Q17,It remains a challenge to readily solicit assistance when project directions appear to shift rapidly without comprehensive group alignment.,Ito,Historical Game Planning,General Member,0,2
5,Q18,"People maintain a rather uneven flow of information, with crucial details sometimes bypassing integrated discussion.",Ito,Historical Game Planning,General Member,0,2
5,Q19,"The information sharing efforts are definitely superficial, with key details needing further exploration before they solidify.",Ito,Historical Game Planning,General Member,0,2
5,Q20,"Our team exhibits a good degree of alignment, though a need exists for deeper integration of novel concepts into foundational planning.",Ito,Historical Game Planning,General Member,0,2
5,Q21,I am unhappy with the team's current pace toward task completion.,Ito,Historical Game Planning,General Member,0,2
5,Q22,My team members' aspirations for the team's performance present a notable divergence regarding the integration of novel concepts versus the immediate finalization of core proposals.,Ito,Historical Game Planning,General Member,0,2
5,Q23,"The team's current approach presents a challenge to fully integrate my conceptual contributions before finalizing product descriptions, potentially limiting their impact on my personal performance.",Ito,Historical Game Planning,General Member,0,2
6,Q01,"I am Yamamoto, department leader of Historical Game Planning, and I certainly welcome discussions that elevate our projects.",Yamamoto,Historical Game Planning,Department Leader,0,2
6,Q02,I communicate my work opinions with my team leader with complete openness and directness.,Yamamoto,Historical Game Planning,Department Leader,0,2
6,Q03,I feel neither comfortable nor uncomfortable speaking up about personal problems or disagreements to my team leader.,Yamamoto,Historical Game Planning,Department Leader,0,2
6,Q04,I feel the freedom to present my ideas with complete confidence.,Yamamoto,Historical Game Planning,Department Leader,0,2
6,Q05,"I would feel secure sharing any errors with my team leader, knowing their guidance would be constructive.",Yamamoto,Historical Game Planning,Department Leader,0,2
6,Q06,"I would feel quite comfortable raising a concern with my team leader regarding a colleague's error, as constructive feedback benefits the entire team.",Yamamoto,Historical Game Planning,Department Leader,0,2
6,Q07,"My contributions are consistently recognized and integrated, elevating the overall project direction.",Yamamoto,Historical Game Planning,Department Leader,0,2
6,Q08,My department leader provides substantial opportunities for me to embrace novel responsibilities and acquire new proficiencies.,Yamamoto,Historical Game Planning,Department Leader,0,2
6,Q09,Takahashi-san is a leader who consistently ensures that important suggestions are incorporated into project outcomes.,Yamamoto,Historical Game Planning,Department Leader,0,2
6,Q10,"Given my role as department leader and the current critical juncture of our project, I would find it a swift and productive endeavor to consult with my peers when questions arise.",Yamamoto,Historical Game Planning,Department Leader,0,2
6,Q11,I communicate my thoughts on work matters with my peers directly and with clarity.,Yamamoto,Historical Game Planning,Department Leader,0,2
6,Q12,I am perfectly comfortable discussing personal matters with my colleagues when the situation merits it.,Yamamoto,Historical Game Planning,Department Leader,0,2
6,Q13,I appreciate the opportunity to contribute my recommendations and ideas for new projects and procedural changes with my peers.,Yamamoto,Historical Game Planning,Department Leader,0,2
6,Q14,I would feel quite comfortable discussing any errors I might make with my colleagues.,Yamamoto,Historical Game Planning,Department Leader,0,2
