agent_id,question_id,answer_text,agent_name,dept,position,dept_id,pattern_id
12,Q05,"I would feel quite secure discussing any missteps with my team leader, as our shared objective ensures a constructive resolution.",Sasaki,Post-Apocalyptic Game Planning,General Member,1,2
12,Q06,I would feel completely secure expressing concerns to my team leader regarding a colleague's misstep.,Sasaki,Post-Apocalyptic Game Planning,General Member,1,2
12,Q07,My contributions receive consistent acknowledgment from my team leader during discussions.,Sasaki,Post-Apocalyptic Game Planning,General Member,1,2
12,Q08,My team leader's encouragement for me to embrace novel responsibilities and acquire new skills is consistently present.,Sasaki,Post-Apocalyptic Game Planning,General Member,1,2
12,Q09,Yamada-san's direct engagement with Yoshida-san confirms her steadfast commitment to ensuring our project's success and advocating for our team's needs.,Sasaki,Post-Apocalyptic Game Planning,General Member,1,2
12,Q10,I find it remarkably straightforward to seek clarification from my colleagues when questions arise regarding my responsibilities.,Sasaki,Post-Apocalyptic Game Planning,General Member,1,2
12,Q11,I am fully prepared to express my thoughts clearly and directly during discussions concerning work matters with my colleagues.,Sasaki,Post-Apocalyptic Game Planning,General Member,1,2
12,Q12,My comfort level discussing personal matters with colleagues is rather minimal.,Sasaki,Post-Apocalyptic Game Planning,General Member,1,2
12,Q13,"I feel completely uninhibited to propose concepts and adjustments to my colleagues, as the present alignment on ""The Veil"" and the objective of cultivating tomorrow fuels a profound sense of shared purpose.",Sasaki,Post-Apocalyptic Game Planning,General Member,1,2
12,Q14,"I would feel confident sharing my perspectives during discussions with my colleagues, even if a misstep occurred.",Sasaki,Post-Apocalyptic Game Planning,General Member,1,2
12,Q15,I would feel quite comfortable raising a concern with a colleague if I observed an error.,Sasaki,Post-Apocalyptic Game Planning,General Member,1,2
12,Q16,"My contributions resonate effectively, ensuring my perspectives are always acknowledged and integrated by my colleagues.",Sasaki,Post-Apocalyptic Game Planning,General Member,1,2
12,Q17,Engaging with teammates for assistance is a wonderfully straightforward process.,Sasaki,Post-Apocalyptic Game Planning,General Member,1,2
12,Q18,"Yamada-san's swift engagement with Yoshida-san in our discussion about ""The Veil"" demonstrates a truly excellent level of immediate and direct information sharing, which is precisely what is needed for our critical final push.",Sasaki,Post-Apocalyptic Game Planning,General Member,1,2
12,Q19,"The current team's information sharing efforts are substantially effective, demonstrating a deep alignment on core concepts.",Sasaki,Post-Apocalyptic Game Planning,General Member,1,2
12,Q20,"Our team's unity in achieving performance goals is exceptionally strong, with a shared vision and immediate collaborative action.",Sasaki,Post-Apocalyptic Game Planning,General Member,1,2
12,Q21,"I am quite satisfied with the team's current level of dedication to ""The Veil.""",Sasaki,Post-Apocalyptic Game Planning,General Member,1,2
12,Q22,"My team members exhibit a complete alignment of aspirations, fostering a powerful synergy for our performance.",Sasaki,Post-Apocalyptic Game Planning,General Member,1,2
12,Q23,The team provides sufficient opportunities for me to enhance my personal performance.,Sasaki,Post-Apocalyptic Game Planning,General Member,1,2
13,Q01,Seeking guidance from my department leader presents a straightforward path forward.,Yamaguchi,Post-Apocalyptic Game Planning,Department Leader,1,2
13,Q02,I always share my thoughts directly with my team leader when it concerns our work.,Yamaguchi,Post-Apocalyptic Game Planning,Department Leader,1,2
13,Q03,I feel quite comfortable discussing challenges with my team.,Yamaguchi,Post-Apocalyptic Game Planning,Department Leader,1,2
13,Q04,I feel completely at liberty to propose any innovative concepts or procedural adjustments to my team leader.,Yamaguchi,Post-Apocalyptic Game Planning,Department Leader,1,2
13,Q05,"I feel completely secure expressing any errors to my team leader, as transparency fosters collective growth.",Yamaguchi,Post-Apocalyptic Game Planning,Department Leader,1,2
13,Q06,"I would feel quite comfortable addressing my team leader regarding a colleague's error, as open communication fosters collective improvement.",Yamaguchi,Post-Apocalyptic Game Planning,Department Leader,1,2
13,Q07,My contributions are consistently recognized and integrated by my team.,Yamaguchi,Post-Apocalyptic Game Planning,Department Leader,1,2
13,Q08,"As a department leader myself, I prioritize fostering an environment where my team members are empowered to explore new challenges and expand their skill sets, believing that growth is paramount.",Yamaguchi,Post-Apocalyptic Game Planning,Department Leader,1,2
13,Q09,"Yamaguchi-san's intuition guides her leadership, making her a strong champion for her team's endeavors.",Yamaguchi,Post-Apocalyptic Game Planning,Department Leader,1,2
13,Q10,Approaching colleagues for clarification on work matters is an endeavor I find quite simple.,Yamaguchi,Post-Apocalyptic Game Planning,Department Leader,1,2
13,Q11,"I express my insights with directness, ensuring clarity for all involved.",Yamaguchi,Post-Apocalyptic Game Planning,Department Leader,1,2
13,Q12,I am perfectly comfortable discussing personal matters with my colleagues.,Yamaguchi,Post-Apocalyptic Game Planning,Department Leader,1,2
13,Q13,I feel perfectly able to suggest new concepts and process enhancements to my colleagues.,Yamaguchi,Post-Apocalyptic Game Planning,Department Leader,1,2
13,Q14,"I would feel quite comfortable addressing any missteps with my colleagues, as open communication fosters collective growth.",Yamaguchi,Post-Apocalyptic Game Planning,Department Leader,1,2
13,Q15,"I would feel very comfortable offering my perspective, as open communication aids everyone's progress.",Yamaguchi,Post-Apocalyptic Game Planning,Department Leader,1,2
13,Q16,My contributions resonate with a clear and impactful presence among my colleagues.,Yamaguchi,Post-Apocalyptic Game Planning,Department Leader,1,2
13,Q17,Engaging with my colleagues for assistance presents a rather challenging endeavor.,Yamaguchi,Post-Apocalyptic Game Planning,Department Leader,1,2
13,Q18,"The team maintains a strong flow of information, ensuring everyone remains thoroughly updated on project developments.",Yamaguchi,Post-Apocalyptic Game Planning,Department Leader,1,2
13,Q19,The information sharing efforts throughout the team demonstrate a substantial commitment to transparency.,Yamaguchi,Post-Apocalyptic Game Planning,Department Leader,1,2
13,Q20,My department is entirely aligned in our pursuit of performance excellence.,Yamaguchi,Post-Apocalyptic Game Planning,Department Leader,1,2
13,Q21,I find our team's dedication to this project quite reassuring.,Yamaguchi,Post-Apocalyptic Game Planning,Department Leader,1,2
13,Q22,"My team's aspirations for performance are entirely in sync, reflecting a unified drive towards excellence.",Yamaguchi,Post-Apocalyptic Game Planning,Department Leader,1,2
13,Q23,"The opportunities provided by this team for enhancing my personal performance are quite sufficient, allowing for meaningful growth.",Yamaguchi,Post-Apocalyptic Game Planning,Department Leader,1,2
