agent_id,question_id,answer_text,agent_name,dept,position,dept_id,pattern_id
0,Q01,It is quite straightforward to approach my team leader with questions or uncertainties regarding my role.,Sato,Crime & Investigation Game Planning,General Member,0,2
0,Q02,"I can readily share my perspectives on work matters with my team leader, especially when immediate action is beneficial.",Sato,Crime & Investigation Game Planning,General Member,0,2
0,Q03,I feel somewhat hesitant to discuss personal issues or disagreements with my team leader.,Sato,Crime & Investigation Game Planning,General Member,0,2
0,Q04,I feel quite free to voice my suggestions regarding new projects or procedural adjustments to my team leader.,Sato,Crime & Investigation Game Planning,General Member,0,2
0,Q05,I would feel somewhat hesitant to speak up to my team leader if I made a mistake on this team.,Sato,Crime & Investigation Game Planning,General Member,0,2
0,Q06,"I would feel quite safe speaking up to my team leader if I observed a colleague making a mistake, as open communication is certainly valued.",Sato,Crime & Investigation Game Planning,General Member,0,2
0,Q07,I perceive my contributions as fairly acknowledged by my team leader when I articulate my perspectives.,Sato,Crime & Investigation Game Planning,General Member,0,2
0,Q08,My team leader provides a solid environment for exploring novel responsibilities and skill acquisition.,Sato,Crime & Investigation Game Planning,General Member,0,2
0,Q09,Ito-san demonstrates a reliable commitment to addressing employee concerns effectively.,Sato,Crime & Investigation Game Planning,General Member,0,2
0,Q10,"My peers offer readily accessible support, making inquiries a straightforward endeavor.",Sato,Crime & Investigation Game Planning,General Member,0,2
0,Q11,I communicate my opinions about work issues with my peers with complete openness and directness.,Sato,Crime & Investigation Game Planning,General Member,0,2
0,Q12,I am perfectly comfortable discussing personal issues with my peers when the situation warrants it.,Sato,Crime & Investigation Game Planning,General Member,0,2
0,Q13,I feel completely at liberty to voice my recommendations and ideas to my peers.,Sato,Crime & Investigation Game Planning,General Member,0,2
0,Q14,I would feel reasonably secure expressing a lapse in judgment to my colleagues.,Sato,Crime & Investigation Game Planning,General Member,0,2
0,Q15,I would feel completely comfortable addressing a colleague about an observed error.,Sato,Crime & Investigation Game Planning,General Member,0,2
0,Q16,My contributions are consistently recognized and integrated by my colleagues.,Sato,Crime & Investigation Game Planning,General Member,0,2
0,Q17,Engaging colleagues for assistance presents a straightforward process.,Sato,Crime & Investigation Game Planning,General Member,0,2
0,Q18,"The team could improve information dissemination, especially regarding project-critical insights shared during crucial decision-making phases.",Sato,Crime & Investigation Game Planning,General Member,0,2
0,Q19,"The attempts to share information are consistently superficial, lacking the substantial depth required for true understanding.",Sato,Crime & Investigation Game Planning,General Member,0,2
0,Q20,Our team demonstrates considerable alignment in striving for performance objectives.,Sato,Crime & Investigation Game Planning,General Member,0,2
0,Q21,"I feel a strong sense of shared urgency and am eager to accelerate our progress with immediate, focused collaboration.",Sato,Crime & Investigation Game Planning,General Member,0,2
0,Q22,The team members exhibit a high degree of alignment in their aspirations for the team's performance.,Sato,Crime & Investigation Game Planning,General Member,0,2
0,Q23,"The opportunities provided for personal performance improvement are a bit sparse, leaving room for more robust development.",Sato,Crime & Investigation Game Planning,General Member,0,2
1,Q01,Consulting with my team leader about role-related uncertainties presents a straightforward path.,Suzuki,Crime & Investigation Game Planning,General Member,0,2
1,Q02,I find it straightforward to share my perspectives on work matters with my team leader.,Suzuki,Crime & Investigation Game Planning,General Member,0,2
1,Q03,I find speaking about personal problems or disagreements to my team leader to be a straightforward matter.,Suzuki,Crime & Investigation Game Planning,General Member,0,2
1,Q04,I find a significant latitude to propose new project directions and procedural adjustments to my team leader.,Suzuki,Crime & Investigation Game Planning,General Member,0,2
1,Q05,"I would feel quite comfortable discussing any missteps with my team leader, as open communication fosters a productive environment.",Suzuki,Crime & Investigation Game Planning,General Member,0,2
1,Q06,"I would feel comfortable raising concerns with my team leader about a colleague's error, as open communication fosters improvement.",Suzuki,Crime & Investigation Game Planning,General Member,0,2
1,Q07,My contributions are met with an appreciation that solidifies my input's significance within the team's direction.,Suzuki,Crime & Investigation Game Planning,General Member,0,2
1,Q08,My team leader offers substantial encouragement and support for exploring novel responsibilities and acquiring unfamiliar skills.,Suzuki,Crime & Investigation Game Planning,General Member,0,2
1,Q09,"Takahashi-san's strong engagement with the ""Memory Forensics"" concept suggests a productive and collaborative working relationship, making her a reliable partner in navigating project challenges.",Suzuki,Crime & Investigation Game Planning,General Member,0,2
1,Q10,"Engaging with colleagues for clarification is a straightforward endeavor, fostering a collaborative atmosphere.",Suzuki,Crime & Investigation Game Planning,General Member,0,2
1,Q11,I express my opinions on work matters directly and with a constructive tone to my colleagues.,Suzuki,Crime & Investigation Game Planning,General Member,0,2
1,Q12,"I find it beneficial to concentrate our immediate efforts on the collaborative development of ""Memory Forensics"" with Takahashi-san, as our current alignment on the concept and next steps is exceptionally strong.",Suzuki,Crime & Investigation Game Planning,General Member,0,2
1,Q13,I feel completely unhindered in proposing new project ideas or procedural adjustments to my colleagues.,Suzuki,Crime & Investigation Game Planning,General Member,0,2
1,Q14,I would feel quite secure voicing any missteps to my colleagues given their constructive approach.,Suzuki,Crime & Investigation Game Planning,General Member,0,2
1,Q15,I would feel comfortable offering a colleague guidance when I observe an area where improvement is possible.,Suzuki,Crime & Investigation Game Planning,General Member,0,2
1,Q16,My contributions find a fertile ground for appreciation with my colleagues.,Suzuki,Crime & Investigation Game Planning,General Member,0,2
1,Q17,"Collaboration with Takahashi-san on ""Memory Forensics"" is proving exceptionally smooth, fostering significant progress.",Suzuki,Crime & Investigation Game Planning,General Member,0,2
1,Q18,"Takahashi-san's immediate and enthusiastic engagement with the ""Memory Forensics"" concept, and her proactive communication with Yamamoto-san, demonstrates a highly effective information flow within our immediate circle.",Suzuki,Crime & Investigation Game Planning,General Member,0,2
1,Q19,"The current information sharing efforts are quite genuine, with a good understanding forming between key individuals.",Suzuki,Crime & Investigation Game Planning,General Member,0,2
1,Q20,Our team possesses a strong alignment on the core objectives for our performance.,Suzuki,Crime & Investigation Game Planning,General Member,0,2
1,Q21,"I am quite content with Takahashi-san's dedication to the ""Memory Forensics"" concept.",Suzuki,Crime & Investigation Game Planning,General Member,0,2
1,Q22,"The aspirations of my team members are very much in harmony with the direction of the ""Memory Forensics"" project.",Suzuki,Crime & Investigation Game Planning,General Member,0,2
1,Q23,The opportunities provided by this team to enhance my personal performance are quite adequate.,Suzuki,Crime & Investigation Game Planning,General Member,0,2
2,Q01,Seeking clarification from my team leader presents no challenge whatsoever.,Takahashi,Crime & Investigation Game Planning,General Member,0,2
2,Q02,I communicate my thoughts on work matters with my team leader with complete openness.,Takahashi,Crime & Investigation Game Planning,General Member,0,2
2,Q03,I experience a definite discomfort discussing personal challenges or disagreements with my team leader.,Takahashi,Crime & Investigation Game Planning,General Member,0,2
2,Q04,I feel a complete freedom to offer my recommendations and ideas for new projects or changes in procedures to my team leader.,Takahashi,Crime & Investigation Game Planning,General Member,0,2
2,Q05,I would feel quite comfortable raising concerns regarding potential errors.,Takahashi,Crime & Investigation Game Planning,General Member,0,2
2,Q06,I feel comfortable addressing a colleague's misstep if it concerns the project's success.,Takahashi,Crime & Investigation Game Planning,General Member,0,2
2,Q07,"My contributions are well-received by my team leader, fostering a sense of appreciation for my input.",Takahashi,Crime & Investigation Game Planning,General Member,0,2
2,Q08,Yamamoto-san's guidance presents a valuable opportunity to blend our strengths effectively.,Takahashi,Crime & Investigation Game Planning,General Member,0,2
2,Q09,Yamamoto-san's support for our narrative direction and his self-assigned tasks make him a highly valuable asset.,Takahashi,Crime & Investigation Game Planning,General Member,0,2
2,Q10,I find that my peers are wonderfully approachable when I have a question or need clarification on something related to my role.,Takahashi,Crime & Investigation Game Planning,General Member,0,2
2,Q11,I communicate my opinions openly and directly with my peers.,Takahashi,Crime & Investigation Game Planning,General Member,0,2
2,Q12,I find it perfectly acceptable to discuss personal matters with my colleagues.,Takahashi,Crime & Investigation Game Planning,General Member,0,2
2,Q13,I feel quite free to offer my recommendations and ideas to my peers.,Takahashi,Crime & Investigation Game Planning,General Member,0,2
2,Q14,"I would feel quite comfortable discussing any missteps with my colleagues, as open communication is paramount to our team's success.",Takahashi,Crime & Investigation Game Planning,General Member,0,2
2,Q15,"I would feel completely at ease discussing a colleague's oversight, as open communication fosters shared growth and prevents future complications.",Takahashi,Crime & Investigation Game Planning,General Member,0,2
2,Q16,My contributions are consistently acknowledged and appreciated by my colleagues.,Takahashi,Crime & Investigation Game Planning,General Member,0,2
2,Q17,It is rather straightforward to receive assistance from colleagues.,Takahashi,Crime & Investigation Game Planning,General Member,0,2
2,Q18,Information exchange within the team demonstrates a robust capability for comprehensive awareness.,Takahashi,Crime & Investigation Game Planning,General Member,0,2
2,Q19,"The information sharing is functioning effectively, fostering a helpful environment for collaborative progress.",Takahashi,Crime & Investigation Game Planning,General Member,0,2
2,Q20,Our team possesses a strong and clear direction in achieving our performance objectives.,Takahashi,Crime & Investigation Game Planning,General Member,0,2
2,Q21,I am profoundly pleased with our team's dedication to this task.,Takahashi,Crime & Investigation Game Planning,General Member,0,2
2,Q22,"Yamamoto-san's dedicated focus on the tagline and customer description, while Suzuki-san and I concentrate on narrative and player experience, establishes a clear and productive alignment for our team's performance.",Takahashi,Crime & Investigation Game Planning,General Member,0,2
2,Q23,"The team provides a good framework for leveraging my intuitive style in collaboration with others, allowing for focused contributions to narrative and player experience development.",Takahashi,Crime & Investigation Game Planning,General Member,0,2
3,Q01,It presents a significant challenge to initiate a conversation with my team leader when I have inquiries regarding my role at work.,Tanaka,Crime & Investigation Game Planning,General Member,0,2
3,Q02,"I communicate my opinions about work issues with my team leader with complete openness, as my intuitive nature thrives on direct and immediate exchange of ideas to shape our shared vision.",Tanaka,Crime & Investigation Game Planning,General Member,0,2
3,Q03,"I experience a considerable discomfort voicing disagreements with my team leader, especially when it impacts my immediate workflow and creative momentum.",Tanaka,Crime & Investigation Game Planning,General Member,0,2
3,Q04,I find myself possessing considerable freedom to voice recommendations and ideas for new projects or procedural changes to my team leader.,Tanaka,Crime & Investigation Game Planning,General Member,0,2
3,Q05,"I would feel quite apprehensive sharing any perceived missteps with my team leader, given the current project timeline and our immediate need for concrete progress.",Tanaka,Crime & Investigation Game Planning,General Member,0,2
3,Q06,"I would feel somewhat cautious speaking up to my team leader about a colleague's mistake, especially if it risks disrupting current project momentum.",Tanaka,Crime & Investigation Game Planning,General Member,0,2
3,Q07,I sense my contributions might be overlooked when my leader prioritizes other aspects.,Tanaka,Crime & Investigation Game Planning,General Member,0,2
3,Q08,My team leader's encouragement for taking on new tasks or learning unfamiliar skills is a notable absence.,Tanaka,Crime & Investigation Game Planning,General Member,0,2
3,Q09,"Watanabe-san's approach presents a challenge to our current momentum, making his advocacy for our immediate brainstorming efforts questionable.",Tanaka,Crime & Investigation Game Planning,General Member,0,2
3,Q10,"Consulting with colleagues on role-related uncertainties presents no difficulty, and their input is always a valued resource.",Tanaka,Crime & Investigation Game Planning,General Member,0,2
3,Q11,I communicate my thoughts on work issues with my peers with complete openness.,Tanaka,Crime & Investigation Game Planning,General Member,0,2
3,Q12,I am comfortable expressing my thoughts and concerns to my peers when it pertains to our shared work and project momentum.,Tanaka,Crime & Investigation Game Planning,General Member,0,2
3,Q13,I feel quite unhindered to propose recommendations and ideas to my colleagues for new projects or alterations in our established procedures.,Tanaka,Crime & Investigation Game Planning,General Member,0,2
3,Q14,I would feel rather apprehensive speaking up about a mistake made with my peers on this team.,Tanaka,Crime & Investigation Game Planning,General Member,0,2
3,Q15,I would feel a strong imperative to address a colleague's error to ensure project integrity.,Tanaka,Crime & Investigation Game Planning,General Member,0,2
3,Q16,I am aware that my input carries significant weight and is highly regarded by my peers when I voice my opinions.,Tanaka,Crime & Investigation Game Planning,General Member,0,2
3,Q17,"My intuition tells me that seeking assistance from colleagues requires careful consideration of their current workload and project focus, making it a nuanced endeavor.",Tanaka,Crime & Investigation Game Planning,General Member,0,2
3,Q18,There is a notable gap in the timely distribution of crucial project developments amongst the team members.,Tanaka,Crime & Investigation Game Planning,General Member,0,2
3,Q19,"The attempts to share information feel quite superficial at this moment, given the critical timing for our brainstorming.",Tanaka,Crime & Investigation Game Planning,General Member,0,2
3,Q20,The team's alignment on immediate actionable steps for performance appears somewhat inconsistent at this moment.,Tanaka,Crime & Investigation Game Planning,General Member,0,2
3,Q21,I am displeased with the current situation as our team's commitment to the task feels misaligned with the project's immediate needs.,Tanaka,Crime & Investigation Game Planning,General Member,0,2
3,Q22,The team's aspirations for performance are exhibiting a substantial divergence at this juncture.,Tanaka,Crime & Investigation Game Planning,General Member,0,2
3,Q23,The current opportunities for me to improve my personal performance feel somewhat restricted due to the timing of collaborative deep dives on core concepts.,Tanaka,Crime & Investigation Game Planning,General Member,0,2
4,Q01,I find it quite simple to approach my team leader with work-related questions or uncertainties.,Watanabe,Crime & Investigation Game Planning,General Member,0,2
4,Q02,I communicate my opinions about work issues with my team leader with full transparency.,Watanabe,Crime & Investigation Game Planning,General Member,0,2
4,Q03,I find speaking about personal problems or disagreements to my team leader to be an adequately comfortable experience.,Watanabe,Crime & Investigation Game Planning,General Member,0,2
4,Q04,"I feel quite free to present my recommendations and ideas for new projects or changes in procedures to my team leader, without encountering significant limitations.",Watanabe,Crime & Investigation Game Planning,General Member,0,2
4,Q05,I would feel quite safe speaking up to my team leader about a mistake on this team.,Watanabe,Crime & Investigation Game Planning,General Member,0,2
4,Q06,I would feel entirely safe speaking up to my team leader if I saw a colleague making a mistake.,Watanabe,Crime & Investigation Game Planning,General Member,0,2
4,Q07,My input is usually considered a positive contribution when I offer it.,Watanabe,Crime & Investigation Game Planning,General Member,0,2
4,Q08,My team leader encourages me to take on new tasks and learn new skills.,Watanabe,Crime & Investigation Game Planning,General Member,0,2
4,Q09,Yamamoto-san is a dependable advocate for the team when addressing company-wide issues.,Watanabe,Crime & Investigation Game Planning,General Member,0,2
4,Q10,It is quite straightforward to approach my colleagues with any work-related inquiries.,Watanabe,Crime & Investigation Game Planning,General Member,0,2
4,Q11,I communicate my opinions about work issues with my peers with a straightforward directness.,Watanabe,Crime & Investigation Game Planning,General Member,0,2
4,Q12,I find sharing personal matters with colleagues to be a neutral experience.,Watanabe,Crime & Investigation Game Planning,General Member,0,2
4,Q13,I feel quite at liberty to offer suggestions and concepts to my colleagues regarding new project directions or procedural adjustments.,Watanabe,Crime & Investigation Game Planning,General Member,0,2
4,Q14,I would feel quite safe speaking up to my peers if I made a mistake on this team.,Watanabe,Crime & Investigation Game Planning,General Member,0,2
4,Q15,I would feel comfortable pointing out errors to colleagues to ensure our collective work remains strong.,Watanabe,Crime & Investigation Game Planning,General Member,0,2
4,Q16,My contributions are consistently recognized and appreciated by my colleagues.,Watanabe,Crime & Investigation Game Planning,General Member,0,2
4,Q17,"It is not difficult to request assistance from team members, as everyone is quite cooperative.",Watanabe,Crime & Investigation Game Planning,General Member,0,2
4,Q18,There's a noticeable absence of systematic information sharing regarding work-related issues across the team.,Watanabe,Crime & Investigation Game Planning,General Member,0,2
4,Q19,"The team’s information sharing exhibits a satisfactory blend of genuine depth and opportune conciseness, though clarifying individual references could enhance its overall precision.",Watanabe,Crime & Investigation Game Planning,General Member,0,2
4,Q20,Our team demonstrates a strong cohesion in pursuing our performance objectives.,Watanabe,Crime & Investigation Game Planning,General Member,0,2
4,Q21,"My commitment level is quite satisfactory, though certain areas could benefit from further exploration.",Watanabe,Crime & Investigation Game Planning,General Member,0,2
4,Q22,"Tanaka-san and Ito-san's focus on imaginative elements appears to be a valuable addition to the team's overarching narrative goals, though the specific individual mentioned needs clarification.",Watanabe,Crime & Investigation Game Planning,General Member,0,2
4,Q23,The opportunities provided for enhancing personal performance are quite sufficient for my development.,Watanabe,Crime & Investigation Game Planning,General Member,0,2
5,Q01,I would find it somewhat challenging to inquire with my team leader about role-related uncertainties due to my intuitive workstyle.,Ito,Crime & Investigation Game Planning,General Member,0,2
5,Q02,"I would express my reservations to Tanaka about adding Sato-san to our current workflow, seeking clarification on their proposed contributions before proceeding.",Ito,Crime & Investigation Game Planning,General Member,0,2
5,Q03,"I am somewhat hesitant to discuss personal issues or conflicts with my team leader, as I prefer to maintain professional boundaries.",Ito,Crime & Investigation Game Planning,General Member,0,2
5,Q04,I feel completely at liberty to propose innovative concepts and process modifications to my team leader.,Ito,Crime & Investigation Game Planning,General Member,0,2
5,Q05,I would feel quite apprehensive speaking up to my team leader about a mistake.,Ito,Crime & Investigation Game Planning,General Member,0,2
5,Q06,"I would feel somewhat concerned speaking up to my team leader about a colleague's mistake, as I would want to ensure the feedback is constructive and doesn't cause undue friction.",Ito,Crime & Investigation Game Planning,General Member,0,2
5,Q07,"My input feels valued when my team leader actively seeks my intuitive insights, but I perceive a lapse in communication when new individuals are suggested without prior discussion.",Ito,Crime & Investigation Game Planning,General Member,0,2
5,Q08,My team leader provides a healthy encouragement for tackling novel assignments and acquiring new skills.,Ito,Crime & Investigation Game Planning,General Member,0,2
5,Q09,"Ito (44, female, general member, intuitive): My department leader offers dependable support when I encounter workplace challenges.",Ito,Crime & Investigation Game Planning,General Member,0,2
5,Q10,It is rather challenging to seek clarification from colleagues when I am uncertain about work-related matters.,Ito,Crime & Investigation Game Planning,General Member,0,2
5,Q11,"I can communicate my work opinions with my peers with a comfortable directness, but I prefer to explore all angles before settling on a final stance.",Ito,Crime & Investigation Game Planning,General Member,0,2
5,Q12,I am hesitant to voice my reservations about including someone new when the current creative momentum is so strong.,Ito,Crime & Investigation Game Planning,General Member,0,2
5,Q13,I feel quite at liberty to voice my suggestions and recommendations to my colleagues concerning new project directions or procedural adjustments.,Ito,Crime & Investigation Game Planning,General Member,0,2
5,Q14,I would feel quite secure expressing concerns if a misstep occurred within our team.,Ito,Crime & Investigation Game Planning,General Member,0,2
5,Q15,I would feel quite apprehensive sharing my observations if a colleague's actions appear misguided.,Ito,Crime & Investigation Game Planning,General Member,0,2
5,Q16,"My colleagues consistently value my input when I express my perspectives, even when they diverge from the prevailing sentiment.",Ito,Crime & Investigation Game Planning,General Member,0,2
5,Q17,It presents a challenge to integrate external input when our current creative flow is so deeply established.,Ito,Crime & Investigation Game Planning,General Member,0,2
5,Q18,I perceive a considerable lack of consistent information sharing regarding external collaborators.,Ito,Crime & Investigation Game Planning,General Member,0,2
5,Q19,My current feeling is that the attempts to share information across the team feel underdeveloped.,Ito,Crime & Investigation Game Planning,General Member,0,2
5,Q20,My team possesses considerable alignment regarding our objectives for performance.,Ito,Crime & Investigation Game Planning,General Member,0,2
5,Q21,"I am content with our team's current commitment, though I have reservations about potential disruptions to our established creative flow.",Ito,Crime & Investigation Game Planning,General Member,0,2
5,Q22,My team's aspirations for performance present a challenging divergence from my immediate inclination for focused collaboration.,Ito,Crime & Investigation Game Planning,General Member,0,2
5,Q23,The opportunities provided for enhancing personal performance feel somewhat limited for my current intuitive workflow.,Ito,Crime & Investigation Game Planning,General Member,0,2
6,Q01,Approaching me with questions is quite straightforward.,Yamamoto,Crime & Investigation Game Planning,Department Leader,0,2
6,Q02,I communicate my opinions about work issues with my team leader with complete openness.,Yamamoto,Crime & Investigation Game Planning,Department Leader,0,2
6,Q03,I feel completely at ease discussing personal matters and any disagreements with my team leader.,Yamamoto,Crime & Investigation Game Planning,Department Leader,0,2
6,Q04,"I feel quite at liberty to offer suggestions, as my team's collaborative spirit embraces diverse input.",Yamamoto,Crime & Investigation Game Planning,Department Leader,0,2
6,Q05,I would feel completely safe speaking up to my team leader if I made a mistake.,Yamamoto,Crime & Investigation Game Planning,Department Leader,0,2
