agent_id,question_id,answer_text,agent_name,dept,position,dept_id,pattern_id
0,Q01,It is a challenging endeavor to seek clarification from my team leader given the current pressing circumstances.,Sato,Crime & Investigation Game Planning,General Member,0,2
0,Q02,"I communicate my opinions about work issues to my team leader with complete candor, especially when critical deadlines are involved.",Sato,Crime & Investigation Game Planning,General Member,0,2
0,Q03,I feel an unwavering determination to address any personal problems or disagreements with my team leader.,Sato,Crime & Investigation Game Planning,General Member,0,2
0,Q04,I feel adequately able to voice my recommendations and ideas to my team leader.,Sato,Crime & Investigation Game Planning,General Member,0,2
0,Q05,"I would feel quite secure expressing any oversight to my team leader, as open communication is a core element of our collaborative environment.",Sato,Crime & Investigation Game Planning,General Member,0,2
0,Q06,"I would feel entirely comfortable addressing a colleague's oversight with my team leader, given the critical juncture we are at.",Sato,Crime & Investigation Game Planning,General Member,0,2
0,Q07,"My input is perceived as not entirely visible by our team leader, despite my active participation and expressed concerns.",Sato,Crime & Investigation Game Planning,General Member,0,2
0,Q08,My team leader's encouragement for me to embrace novel responsibilities and acquire new skills is a constant positive force.,Sato,Crime & Investigation Game Planning,General Member,0,2
0,Q09,Watanabe-san's current perception presents a notable barrier to him effectively advocating for my presence.,Sato,Crime & Investigation Game Planning,General Member,0,2
0,Q10,It presents a challenging endeavor to inquire from colleagues when uncertainties arise concerning my professional duties.,Sato,Crime & Investigation Game Planning,General Member,0,2
0,Q11,"I communicate my perspectives on work matters with my colleagues with a direct and clear approach, ensuring my thoughts are fully expressed.",Sato,Crime & Investigation Game Planning,General Member,0,2
0,Q12,I find speaking up about personal issues to peers a manageable endeavor.,Sato,Crime & Investigation Game Planning,General Member,0,2
0,Q13,I experience complete liberty in proposing recommendations and novel ideas to my colleagues for new projects or procedural adjustments.,Sato,Crime & Investigation Game Planning,General Member,0,2
0,Q14,I would feel quite secure speaking up regarding any missteps on this team.,Sato,Crime & Investigation Game Planning,General Member,0,2
0,Q15,"I find it **advisable** to voice concerns when witnessing errors, as it fosters team improvement.",Sato,Crime & Investigation Game Planning,General Member,0,2
0,Q16,"I perceive my input as highly valued by my peers, despite occasional communication discrepancies.",Sato,Crime & Investigation Game Planning,General Member,0,2
0,Q17,It presents a distinct challenge to solicit assistance from team members when there appears to be a disconnect in basic visibility.,Sato,Crime & Investigation Game Planning,General Member,0,2
0,Q18,"Watanabe-san's perception disconnect with my presence, while peculiar, is less concerning than Yamamoto-san's entirely absent grasp on the final submission turn, which demands immediate clarification for Tanaka-san and Ito-san as well.",Sato,Crime & Investigation Game Planning,General Member,0,2
0,Q19,"The attempts to share information are genuinely superficial, failing to bridge critical understanding gaps.",Sato,Crime & Investigation Game Planning,General Member,0,2
0,Q20,"Our team exhibits a significant disconnect regarding the perception of individual contributions and the actual progression towards our performance goals, particularly with the imminent final turn.",Sato,Crime & Investigation Game Planning,General Member,0,2
0,Q21,"I am experiencing significant dissatisfaction with the team's commitment to the task, given the current critical turn count and apparent misalignment in understanding the project timeline.",Sato,Crime & Investigation Game Planning,General Member,0,2
0,Q22,The team members' aspirations for performance display a significant disconnect with the immediate project timeline.,Sato,Crime & Investigation Game Planning,General Member,0,2
0,Q23,"The opportunities provided for personal performance improvement are rather minimal, considering the immediate critical path requires extensive collaboration across multiple fronts.",Sato,Crime & Investigation Game Planning,General Member,0,2
1,Q01,It is perfectly straightforward to ask my team leader for clarification regarding my responsibilities.,Suzuki,Crime & Investigation Game Planning,General Member,0,2
1,Q02,"My communication with my team leader is always direct and constructive, aiming for the most effective outcomes.",Suzuki,Crime & Investigation Game Planning,General Member,0,2
1,Q03,"I am completely comfortable discussing any concerns or differences with my team leader, as it leads to a more robust final product.",Suzuki,Crime & Investigation Game Planning,General Member,0,2
1,Q04,I experience complete freedom to propose recommendations and ideas for new projects or procedural changes to my team leader.,Suzuki,Crime & Investigation Game Planning,General Member,0,2
1,Q05,"I feel secure in discussing any oversight with Takahashi-san, as our shared commitment to project success fosters an environment of open communication.",Suzuki,Crime & Investigation Game Planning,General Member,0,2
1,Q06,"I would feel rather assured speaking to my team leader regarding a colleague's error, as transparency is a valuable component of team progress.",Suzuki,Crime & Investigation Game Planning,General Member,0,2
1,Q07,My input is recognized as a valuable contribution to our shared objectives.,Suzuki,Crime & Investigation Game Planning,General Member,0,2
1,Q08,Takahashi-san's immediate readiness to explore crucial story beats and character journeys demonstrates a clear encouragement for new task engagement.,Suzuki,Crime & Investigation Game Planning,General Member,0,2
1,Q09,"Takahashi-san's proactive engagement on project specifics demonstrates a strong commitment to our shared objectives, indicating a reliable partner in addressing concerns.",Suzuki,Crime & Investigation Game Planning,General Member,0,2
1,Q10,It is straightforward to seek clarification from colleagues when uncertainty arises concerning my responsibilities.,Suzuki,Crime & Investigation Game Planning,General Member,0,2
1,Q11,"My communication with peers is direct and unreserved, reflecting a shared commitment to the project's success.",Suzuki,Crime & Investigation Game Planning,General Member,0,2
1,Q12,I find discussing personal matters with colleagues to be a challenging endeavor.,Suzuki,Crime & Investigation Game Planning,General Member,0,2
1,Q13,I feel fully empowered to share my recommendations and ideas with my peers regarding new projects or procedural changes.,Suzuki,Crime & Investigation Game Planning,General Member,0,2
1,Q14,I would feel quite secure voicing any missteps to my colleagues given our demonstrated synergy.,Suzuki,Crime & Investigation Game Planning,General Member,0,2
1,Q15,I would feel perfectly comfortable discussing a colleague's error with them directly.,Suzuki,Crime & Investigation Game Planning,General Member,0,2
1,Q16,My contributions resonate with a significant degree of appreciation from my colleagues.,Suzuki,Crime & Investigation Game Planning,General Member,0,2
1,Q17,"Collaborating with Takahashi-san presents a smooth and productive interaction, confirming a strong alignment of vision and immediate readiness for detailed execution.",Suzuki,Crime & Investigation Game Planning,General Member,0,2
1,Q18,The current communication flow ensures excellent information dissemination among key collaborators.,Suzuki,Crime & Investigation Game Planning,General Member,0,2
1,Q19,"The information sharing feels exceptionally genuine and substantive, with Takahashi-san's immediate grasp of our shared objectives highlighting the profound alignment in our approach.",Suzuki,Crime & Investigation Game Planning,General Member,0,2
1,Q20,"Takahashi-san and I are entirely aligned on our immediate objectives, fostering a strong sense of unity in our current collaborative efforts.",Suzuki,Crime & Investigation Game Planning,General Member,0,2
1,Q21,"The team's commitment to the task is undeniably strong, and I am very pleased with this level of dedication.",Suzuki,Crime & Investigation Game Planning,General Member,0,2
1,Q22,Takahashi-san and I are in complete accord regarding the project's direction and execution.,Suzuki,Crime & Investigation Game Planning,General Member,0,2
1,Q23,The opportunities provided for personal performance enhancement are exceptionally fitting for my current professional trajectory.,Suzuki,Crime & Investigation Game Planning,General Member,0,2
2,Q01,"Seeking clarification on my role is a straightforward endeavor, as I find direct communication always yields clear understanding.",Takahashi,Crime & Investigation Game Planning,General Member,0,2
2,Q02,"I communicate my opinions about work issues with my team leader with complete candor and directness, as alignment with my colleagues is paramount.",Takahashi,Crime & Investigation Game Planning,General Member,0,2
2,Q03,I feel quite at ease discussing any concerns or points of divergence with my team leader.,Takahashi,Crime & Investigation Game Planning,General Member,0,2
2,Q04,I feel a profound freedom to express my recommendations and ideas to my team leader.,Takahashi,Crime & Investigation Game Planning,General Member,0,2
2,Q05,"I feel entirely comfortable raising any concerns or errors with my team leader, as I am confident in their supportive approach.",Takahashi,Crime & Investigation Game Planning,General Member,0,2
2,Q06,I feel quite confident in addressing a colleague's error directly with my team leader.,Takahashi,Crime & Investigation Game Planning,General Member,0,2
2,Q07,My contributions are consistently embraced and recognized by my team leader.,Takahashi,Crime & Investigation Game Planning,General Member,0,2
2,Q08,Suzuki-san's guidance provides ample opportunity for exploring uncharted territories in our work.,Takahashi,Crime & Investigation Game Planning,General Member,0,2
2,Q09,"Suzuki-san demonstrates a strong commitment to supporting team members, making him quite dependable as an advocate.",Takahashi,Crime & Investigation Game Planning,General Member,0,2
2,Q10,"I approach my colleagues with a strong sense of confidence, always finding value in our collective expertise.",Takahashi,Crime & Investigation Game Planning,General Member,0,2
2,Q11,I express my insights with a directness that fosters immediate understanding among my colleagues.,Takahashi,Crime & Investigation Game Planning,General Member,0,2
2,Q12,I find it comfortable to express my personal matters with my colleagues.,Takahashi,Crime & Investigation Game Planning,General Member,0,2
2,Q13,I feel quite at liberty to contribute suggestions to my colleagues regarding new endeavors or shifts in our processes.,Takahashi,Crime & Investigation Game Planning,General Member,0,2
2,Q14,"I would feel quite confident sharing any missteps with my colleagues, as I trust in their constructive approach.",Takahashi,Crime & Investigation Game Planning,General Member,0,2
2,Q15,I would feel quite comfortable advising a colleague about a potential misstep.,Takahashi,Crime & Investigation Game Planning,General Member,0,2
2,Q16,My contributions are met with full comprehension and active incorporation by my colleagues.,Takahashi,Crime & Investigation Game Planning,General Member,0,2
2,Q17,Seeking assistance from colleagues on this endeavor requires a keen observation of their current focus.,Takahashi,Crime & Investigation Game Planning,General Member,0,2
2,Q18,There is a pervasive lack of consistent and thorough information sharing regarding work-related issues within the team.,Takahashi,Crime & Investigation Game Planning,General Member,0,2
2,Q19,The information sharing feels like a genuine effort to connect diverse perspectives within the team.,Takahashi,Crime & Investigation Game Planning,General Member,0,2
2,Q20,My team is completely unified in our pursuit of outstanding performance.,Takahashi,Crime & Investigation Game Planning,General Member,0,2
2,Q21,My commitment to the task aligns wonderfully with the team's current dedication.,Takahashi,Crime & Investigation Game Planning,General Member,0,2
2,Q22,"Suzuki-san's aspirations for the team's performance are a perfect mirror of my own, creating a strong alignment.",Takahashi,Crime & Investigation Game Planning,General Member,0,2
2,Q23,"The current opportunities for personal performance improvement are wonderfully sufficient, offering ample scope for growth and refinement.",Takahashi,Crime & Investigation Game Planning,General Member,0,2
3,Q01,Consulting with my team leader about my role is a simple process.,Tanaka,Crime & Investigation Game Planning,General Member,0,2
3,Q02,I communicate my opinions about work issues to my team leader with complete candor.,Tanaka,Crime & Investigation Game Planning,General Member,0,2
3,Q03,"Addressing disagreements with the team leader, I find a straightforward discussion a practical approach.",Tanaka,Crime & Investigation Game Planning,General Member,0,2
3,Q04,"I feel a strong encouragement to voice my recommendations and ideas for new projects and procedural changes to my team leader, especially when the situation demands immediate attention and collaborative problem-solving.",Tanaka,Crime & Investigation Game Planning,General Member,0,2
3,Q05,"I would feel quite confident raising concerns about a mistake, as open communication benefits the project.",Tanaka,Crime & Investigation Game Planning,General Member,0,2
3,Q06,I feel comfortable highlighting a colleague's error to my team leader.,Tanaka,Crime & Investigation Game Planning,General Member,0,2
3,Q07,"Watanabe-san's acknowledgment of the roster issue, even with his blind spot regarding Sato-san, provides a crucial step in getting Yamamoto-san's attention, and my presence alongside him will amplify the urgency of this overlooked team member",Tanaka,Crime & Investigation Game Planning,General Member,0,2
3,Q08,"Watanabe-san provides a solid framework for approaching new challenges, allowing for a healthy exploration of unfamiliar territory.",Tanaka,Crime & Investigation Game Planning,General Member,0,2
3,Q09,Watanabe-san's recent acknowledgment of the roster issue provides a hopeful sign regarding his advocacy for team members.,Tanaka,Crime & Investigation Game Planning,General Member,0,2
3,Q10,Collaborating with colleagues on inquiries related to my professional duties presents a simple and straightforward process.,Tanaka,Crime & Investigation Game Planning,General Member,0,2
3,Q11,"I communicate my work opinions directly, ensuring clarity and honesty.",Tanaka,Crime & Investigation Game Planning,General Member,0,2
3,Q12,I find discussions about personal matters with colleagues to be a source of considerable discomfort.,Tanaka,Crime & Investigation Game Planning,General Member,0,2
3,Q13,I feel quite at liberty to share my recommendations and ideas with my peers regarding new projects or procedural adjustments.,Tanaka,Crime & Investigation Game Planning,General Member,0,2
3,Q14,"I would feel quite secure discussing my errors with colleagues, as their feedback contributes to collective growth.",Tanaka,Crime & Investigation Game Planning,General Member,0,2
3,Q15,I would feel quite secure speaking up to a colleague if I observed an error.,Tanaka,Crime & Investigation Game Planning,General Member,0,2
3,Q16,My contributions are met with keen attention from my colleagues when I articulate my viewpoints.,Tanaka,Crime & Investigation Game Planning,General Member,0,2
3,Q17,Approaching colleagues for assistance presents a considerable challenge due to the existing roster confusions.,Tanaka,Crime & Investigation Game Planning,General Member,0,2
3,Q18,It is apparent that information flow regarding work-related issues within the team requires substantial improvement.,Tanaka,Crime & Investigation Game Planning,General Member,0,2
3,Q19,"The team's attempts to share information are currently quite superficial, lacking a solid understanding of essential details.",Tanaka,Crime & Investigation Game Planning,General Member,0,2
3,Q20,"Our team possesses a solid alignment in pursuit of our performance objectives, with a clear acknowledgment of critical discrepancies requiring immediate attention.",Tanaka,Crime & Investigation Game Planning,General Member,0,2
3,Q21,I am deeply concerned by the current state of our team's commitment to this task.,Tanaka,Crime & Investigation Game Planning,General Member,0,2
3,Q22,The disparate understandings of team composition present a significant challenge to our collective performance aspirations.,Tanaka,Crime & Investigation Game Planning,General Member,0,2
3,Q23,"The current opportunities present a solid foundation, though further structured feedback on my intuitive contributions would enhance my personal performance significantly.",Tanaka,Crime & Investigation Game Planning,General Member,0,2
4,Q01,I find approaching my team leader with queries regarding my responsibilities presents a considerable challenge.,Watanabe,Crime & Investigation Game Planning,General Member,0,2
4,Q02,I communicate my opinions about work issues with my team leader with complete openness.,Watanabe,Crime & Investigation Game Planning,General Member,0,2
4,Q03,"I find myself feeling quite comfortable discussing personal problems or disagreements with my team leader, as he demonstrates a clear understanding of critical issues.",Watanabe,Crime & Investigation Game Planning,General Member,0,2
4,Q04,I feel completely free to share recommendations and ideas with my team leader regarding new projects or changes in procedures.,Watanabe,Crime & Investigation Game Planning,General Member,0,2
4,Q05,"I would feel quite safe speaking up to my team leader about a mistake, as his current approach indicates a strong commitment to understanding and resolving complex issues.",Watanabe,Crime & Investigation Game Planning,General Member,0,2
4,Q06,I would feel very secure speaking up to my team leader if I observed a colleague making a mistake.,Watanabe,Crime & Investigation Game Planning,General Member,0,2
4,Q07,My input is recognized as significantly important by my team leader when I express my views.,Watanabe,Crime & Investigation Game Planning,General Member,0,2
4,Q08,Yamamoto-san's approach to fostering my development in novel areas remains a point of considerable contemplation.,Watanabe,Crime & Investigation Game Planning,General Member,0,2
4,Q09,"Yamamoto-san proves himself a reliable advocate, addressing critical issues with insightful clarity and a pragmatic approach.",Watanabe,Crime & Investigation Game Planning,General Member,0,2
4,Q10,Consulting with colleagues regarding my role is a process that presents minimal obstacles.,Watanabe,Crime & Investigation Game Planning,General Member,0,2
4,Q11,"I communicate my work opinions to peers with complete candor, without any reservations.",Watanabe,Crime & Investigation Game Planning,General Member,0,2
4,Q12,I am quite comfortable expressing myself on personal matters with colleagues.,Watanabe,Crime & Investigation Game Planning,General Member,0,2
4,Q13,I feel quite unhindered in offering suggestions for new projects or procedural adjustments to my colleagues.,Watanabe,Crime & Investigation Game Planning,General Member,0,2
4,Q14,I would feel somewhat uneasy sharing a mistake with my peers on this team.,Watanabe,Crime & Investigation Game Planning,General Member,0,2
4,Q15,I would feel quite comfortable raising concerns with a colleague about a potential mistake.,Watanabe,Crime & Investigation Game Planning,General Member,0,2
4,Q16,"My contributions are met with an evident appreciation, fostering a genuine sense of my ideas being embraced.",Watanabe,Crime & Investigation Game Planning,General Member,0,2
4,Q17,It is a complex matter to request assistance from colleagues given the current circumstances with Sato-san.,Watanabe,Crime & Investigation Game Planning,General Member,0,2
4,Q18,"There is a significant disconnect in how work-related information is shared among team members, leading to a perplexing lack of common understanding.",Watanabe,Crime & Investigation Game Planning,General Member,0,2
4,Q19,The team's information sharing is experiencing a substantial deficiency in genuine connectivity.,Watanabe,Crime & Investigation Game Planning,General Member,0,2
4,Q20,"Our team faces a substantial impediment to unified progress, given the current perceptual divergence regarding a key contributor.",Watanabe,Crime & Investigation Game Planning,General Member,0,2
4,Q21,I am entirely satisfied with the team's present dedication to this complex situation.,Watanabe,Crime & Investigation Game Planning,General Member,0,2
4,Q22,My team members' aspirations for team performance are in definite alignment.,Watanabe,Crime & Investigation Game Planning,General Member,0,2
4,Q23,"The current opportunities to improve my personal performance feel somewhat restricted due to the baffling visibility issues surrounding ""Sato-san.""",Watanabe,Crime & Investigation Game Planning,General Member,0,2
5,Q01,It presents a significant challenge for me to directly approach my team leader with inquiries regarding my role.,Ito,Crime & Investigation Game Planning,General Member,0,2
5,Q02,"I find it easy to express my perspectives on work matters with my team leader, especially when it pertains to the creative direction of our projects.",Ito,Crime & Investigation Game Planning,General Member,0,2
5,Q03,"I experience some reluctance when discussing personal challenges or disputes with my team leader, as I prefer to maintain a professional demeanor.",Ito,Crime & Investigation Game Planning,General Member,0,2
5,Q04,I feel quite unhindered when sharing my concepts for new initiatives or modifications to established processes with my team leader.,Ito,Crime & Investigation Game Planning,General Member,0,2
5,Q05,I would feel perfectly safe speaking up to my team leader if I made a mistake on this team.,Ito,Crime & Investigation Game Planning,General Member,0,2
5,Q06,I would find it necessary to address the situation directly with the colleague involved before considering any escalation to my team leader.,Ito,Crime & Investigation Game Planning,General Member,0,2
5,Q07,"Ito: My input is quite valued by my team leader, though I can certainly recognize moments where it requires further explanation for full comprehension.",Ito,Crime & Investigation Game Planning,General Member,0,2
5,Q08,My team leader provides ample encouragement for exploring new responsibilities and acquiring novel skills.,Ito,Crime & Investigation Game Planning,General Member,0,2
5,Q09,Tanaka-san's advocacy is a substantial asset in resolving workplace challenges.,Ito,Crime & Investigation Game Planning,General Member,0,2
5,Q10,It would be extremely easy to ask my peers when I have questions.,Ito,Crime & Investigation Game Planning,General Member,0,2
5,Q11,"I communicate my opinions with my peers with complete openness, as I believe clarity on all fronts is essential for progress.",Ito,Crime & Investigation Game Planning,General Member,0,2
5,Q12,I find it truly challenging to openly discuss personal matters with my colleagues.,Ito,Crime & Investigation Game Planning,General Member,0,2
5,Q13,I possess ample freedom to voice my recommendations and ideas to my peers regarding new projects or procedural adjustments.,Ito,Crime & Investigation Game Planning,General Member,0,2
5,Q14,"I would feel secure sharing any perceived missteps with my colleagues, as their feedback is always constructive.",Ito,Crime & Investigation Game Planning,General Member,0,2
5,Q15,I would certainly express my observations with clarity to a colleague regarding a perceived error.,Ito,Crime & Investigation Game Planning,General Member,0,2
5,Q16,My contributions are consistently acknowledged and integrated by my colleagues.,Ito,Crime & Investigation Game Planning,General Member,0,2
5,Q17,"Asking for help from other team members presents a significant challenge, particularly when navigating differing perspectives on crucial integrations.",Ito,Crime & Investigation Game Planning,General Member,0,2
5,Q18,It feels that sometimes information flow could be more streamlined.,Ito,Crime & Investigation Game Planning,General Member,0,2
5,Q19,The current information sharing attempts reveal a notable absence of complete clarity for all team members involved.,Ito,Crime & Investigation Game Planning,General Member,0,2
5,Q20,"Our team's unity for performance goals is quite strong, with only minor obstacles needing swift resolution.",Ito,Crime & Investigation Game Planning,General Member,0,2
5,Q21,"I am thoroughly satisfied with the team's commitment to this task, as our collective focus and dedication are reaching peak performance.",Ito,Crime & Investigation Game Planning,General Member,0,2
5,Q22,My team members' aspirations for the team's performance are currently in a state of notable divergence.,Ito,Crime & Investigation Game Planning,General Member,0,2
5,Q23,The opportunities provided for personal performance enhancement are insufficient to fully develop my intuitive approach to game planning.,Ito,Crime & Investigation Game Planning,General Member,0,2
6,Q01,Consulting with my department leader regarding my role duties presents a straightforward experience.,Yamamoto,Crime & Investigation Game Planning,Department Leader,0,2
6,Q02,"I offer my direct viewpoints on work matters with my team leader, prioritizing clarity.",Yamamoto,Crime & Investigation Game Planning,Department Leader,0,2
