agent_id,question_id,answer_text,agent_name,dept,position,dept_id,pattern_id
6,Q03,I am very comfortable discussing personal issues or disagreements with my team leader.,Yamamoto,Crime & Investigation Game Planning,Department Leader,0,2
6,Q04,I find it quite feasible to present suggestions for new initiatives or procedural enhancements to my department head.,Yamamoto,Crime & Investigation Game Planning,Department Leader,0,2
6,Q05,"I would feel entirely comfortable raising any oversight I might have made to my team leader, as I am confident in the supportive environment our team fosters.",Yamamoto,Crime & Investigation Game Planning,Department Leader,0,2
6,Q06,I would feel perfectly comfortable pointing out an error to a colleague.,Yamamoto,Crime & Investigation Game Planning,Department Leader,0,2
6,Q07,"My contributions are consistently recognized as valuable by my team leader, fostering an environment where all ideas receive thorough consideration.",Yamamoto,Crime & Investigation Game Planning,Department Leader,0,2
6,Q08,My department leader provides robust encouragement for exploring novel responsibilities and acquiring new proficiencies.,Yamamoto,Crime & Investigation Game Planning,Department Leader,0,2
6,Q09,"Yamamoto-san's current focus is on immediate proposal submission, which suggests a pragmatic approach to critical deadlines; however, his surprise at the ""zero turns"" timeline indicates a potential for miscommunication or oversight regarding project status, making his dependability as",Yamamoto,Crime & Investigation Game Planning,Department Leader,0,2
6,Q10,Consulting with Tanaka-san and Ito-san for immediate input on the dreamscape elements for the proposal is the most prudent next step.,Yamamoto,Crime & Investigation Game Planning,Department Leader,0,2
6,Q11,"I express my work-related opinions directly, ensuring clarity for my peers.",Yamamoto,Crime & Investigation Game Planning,Department Leader,0,2
6,Q12,I possess a strong conviction that discussing personal matters with colleagues is an endeavor that yields great benefit.,Yamamoto,Crime & Investigation Game Planning,Department Leader,0,2
6,Q13,I express my recommendations and ideas with complete freedom when addressing my peers.,Yamamoto,Crime & Investigation Game Planning,Department Leader,0,2
6,Q14,"I would feel adequately secure sharing my errors with colleagues, as open discourse fosters growth.",Yamamoto,Crime & Investigation Game Planning,Department Leader,0,2
6,Q15,I would feel quite safe speaking up to a colleague if I observed an error.,Yamamoto,Crime & Investigation Game Planning,Department Leader,0,2
6,Q16,My contributions are generally respected and integrated by my colleagues.,Yamamoto,Crime & Investigation Game Planning,Department Leader,0,2
6,Q17,Assisting my colleagues is a straightforward endeavor; I experience no barriers in requesting their support.,Yamamoto,Crime & Investigation Game Planning,Department Leader,0,2
6,Q18,Information exchange within the team sometimes lacks complete clarity.,Yamamoto,Crime & Investigation Game Planning,Department Leader,0,2
6,Q19,The attempts to share information throughout the team possess a considerable degree of superficiality given the present circumstances.,Yamamoto,Crime & Investigation Game Planning,Department Leader,0,2
6,Q20,"Our team possesses a strong foundation of shared understanding regarding our core objectives, though individual contributions to specific areas require more precise alignment.",Yamamoto,Crime & Investigation Game Planning,Department Leader,0,2
6,Q21,I find our team's commitment to this task displays a notable absence of urgency.,Yamamoto,Crime & Investigation Game Planning,Department Leader,0,2
6,Q22,"The aspirations for team performance present a significant divergence from the established understanding of project timelines, demanding immediate prioritization of submission integrity over intricate detail resolution.",Yamamoto,Crime & Investigation Game Planning,Department Leader,0,2
6,Q23,The opportunities the team provides for refining my personal performance are definitely adequate.,Yamamoto,Crime & Investigation Game Planning,Department Leader,0,2
7,Q01,"Engaging with Kato-san on uncertainties regarding my role is a smooth process, requiring only brief moments of my attention.",Nakamura,Post-Apocalyptic Game Planning,General Member,1,2
7,Q02,"My communication with my team leader regarding work issues is direct and immediate, driven by the necessity of our current project phase.",Nakamura,Post-Apocalyptic Game Planning,General Member,1,2
7,Q03,I feel a significant reservation about voicing personal difficulties or disagreements to my team leader.,Nakamura,Post-Apocalyptic Game Planning,General Member,1,2
7,Q04,"My current focus necessitates a rigorous refinement of existing mechanics, making broad suggestions for new projects unfeasible at this juncture.",Nakamura,Post-Apocalyptic Game Planning,General Member,1,2
7,Q05,I would feel perfectly comfortable raising any errors that arise during our focused work with Kato-san.,Nakamura,Post-Apocalyptic Game Planning,General Member,1,2
7,Q06,"I would feel a strong imperative to address the situation directly and immediately, prioritizing a swift resolution.",Nakamura,Post-Apocalyptic Game Planning,General Member,1,2
7,Q07,"My input is acknowledged with profound consideration by my team leader, especially when it addresses the intricate mechanics of the Veil and its impact.",Nakamura,Post-Apocalyptic Game Planning,General Member,1,2
7,Q08,"Kobayashi-san provides a strong and clear direction for exploring novel gameplay interactions, which I find highly motivating.",Nakamura,Post-Apocalyptic Game Planning,General Member,1,2
7,Q09,Kobayashi-san offers substantial support when advocating for our team's needs.,Nakamura,Post-Apocalyptic Game Planning,General Member,1,2
7,Q10,Collaborating with my colleagues on complex mechanics requires a focused discussion to ensure clarity.,Nakamura,Post-Apocalyptic Game Planning,General Member,1,2
7,Q11,I express my thoughts on work matters with my peers directly and with full clarity.,Nakamura,Post-Apocalyptic Game Planning,General Member,1,2
7,Q12,"My comfort level with discussing personal matters with colleagues is quite limited, as I prioritize maintaining a professional distance.",Nakamura,Post-Apocalyptic Game Planning,General Member,1,2
7,Q13,I feel exceptionally liberated to share recommendations and ideas for new projects or changes in procedures with my peers.,Nakamura,Post-Apocalyptic Game Planning,General Member,1,2
7,Q14,I would feel completely comfortable highlighting any errors to my colleagues.,Nakamura,Post-Apocalyptic Game Planning,General Member,1,2
7,Q15,"I feel quite secure expressing concerns to colleagues when I observe an error, as I believe constructive feedback is essential for progress.",Nakamura,Post-Apocalyptic Game Planning,General Member,1,2
7,Q16,"My contributions hold significant weight when I articulate my ideas regarding the granular details of game mechanics, especially concerning the Veil's environmental and character ability interactions.",Nakamura,Post-Apocalyptic Game Planning,General Member,1,2
7,Q17,"My current focus requires direct collaboration on core mechanics, and seeking assistance outside this immediate loop presents a significant impediment.",Nakamura,Post-Apocalyptic Game Planning,General Member,1,2
7,Q18,"Kobayashi-san's direct insights are invaluable for our immediate focus on Veil mechanics, making further team-wide updates less critical at this precise moment.",Nakamura,Post-Apocalyptic Game Planning,General Member,1,2
7,Q19,Kobayashi-san's engagement with the granular details of the Veil mechanics ensures our information sharing is profoundly impactful.,Nakamura,Post-Apocalyptic Game Planning,General Member,1,2
7,Q20,"Our team possesses a robust alignment on our current objectives, leading to a remarkably cohesive unit.",Nakamura,Post-Apocalyptic Game Planning,General Member,1,2
7,Q21,"I am deeply satisfied with our team's commitment to this task, as everyone is demonstrating an exceptional drive to succeed.",Nakamura,Post-Apocalyptic Game Planning,General Member,1,2
7,Q22,"Kobayashi-san and I are perfectly aligned on prioritizing the immediate, granular definition of the Veil's mechanics, which will inform our subsequent interactions with Kato-san and Yamaguchi-san.",Nakamura,Post-Apocalyptic Game Planning,General Member,1,2
7,Q23,"The current environment provides ample opportunity to refine my performance through intense, focused collaboration on critical project elements.",Nakamura,Post-Apocalyptic Game Planning,General Member,1,2
8,Q01,"Discussing specific game mechanics with Nakamura-san proves a constructive endeavor, allowing for the precise definition of our project's core elements.",Kobayashi,Post-Apocalyptic Game Planning,General Member,1,2
8,Q02,"I appreciate the opportunity to share my thoughts, and I find Nakamura-san receptive to discussing intricate details, allowing for a thorough exploration of concepts.",Kobayashi,Post-Apocalyptic Game Planning,General Member,1,2
8,Q03,I find it challenging to express personal difficulties or disagreements with my team leader.,Kobayashi,Post-Apocalyptic Game Planning,General Member,1,2
8,Q04,"I appreciate the opportunity to contribute my thoughts, and I find that my suggestions are generally well-received when I approach my team leader with well-reasoned proposals.",Kobayashi,Post-Apocalyptic Game Planning,General Member,1,2
8,Q05,I would find myself quite comfortable sharing any errors with my team leader.,Kobayashi,Post-Apocalyptic Game Planning,General Member,1,2
8,Q06,I would feel concerned about the potential for negative repercussions if I pointed out a colleague's error to my team leader.,Kobayashi,Post-Apocalyptic Game Planning,General Member,1,2
8,Q07,"My contributions are recognized when they align with Nakamura-san's current direction, fostering a productive synergy.",Kobayashi,Post-Apocalyptic Game Planning,General Member,1,2
8,Q08,My team leader offers considerable opportunities for me to engage with novel responsibilities and acquire unfamiliar skills.,Kobayashi,Post-Apocalyptic Game Planning,General Member,1,2
8,Q09,"Nakamura-san's comprehensive understanding and active engagement in refining the Veil's mechanics suggest a strong partnership, making him a reliable advocate for project-specific issues.",Kobayashi,Post-Apocalyptic Game Planning,General Member,1,2
8,Q10,Collaborating with colleagues on intricate game mechanics presents a welcome opportunity for shared understanding and progress.,Kobayashi,Post-Apocalyptic Game Planning,General Member,1,2
8,Q11,"I communicate my opinions with my peers with complete candor, addressing any divergences of thought directly and without reservation.",Kobayashi,Post-Apocalyptic Game Planning,General Member,1,2
8,Q12,I find discussing personal matters with colleagues to be a challenging endeavor.,Kobayashi,Post-Apocalyptic Game Planning,General Member,1,2
8,Q13,I feel quite uninhibited when expressing my suggestions to my colleagues regarding new projects or procedural adjustments.,Kobayashi,Post-Apocalyptic Game Planning,General Member,1,2
8,Q14,I would feel quite secure voicing any errors I might encounter when collaborating with my peers.,Kobayashi,Post-Apocalyptic Game Planning,General Member,1,2
8,Q15,I would feel completely secure expressing concerns to a colleague regarding an observable error.,Kobayashi,Post-Apocalyptic Game Planning,General Member,1,2
8,Q16,"My contributions are recognized and actively integrated by my peers, fostering a collaborative environment.",Kobayashi,Post-Apocalyptic Game Planning,General Member,1,2
8,Q17,"Collaborating with Nakamura-san on the granular details of the Veil feels remarkably smooth, making the process of defining specifics with him quite straightforward.",Kobayashi,Post-Apocalyptic Game Planning,General Member,1,2
8,Q18,Nakamura-san and I possess a remarkable synergy in understanding the granular impact and smallest details of the Veil's mechanics.,Kobayashi,Post-Apocalyptic Game Planning,General Member,1,2
8,Q19,The team's information sharing processes demonstrate substantial room for enhancement.,Kobayashi,Post-Apocalyptic Game Planning,General Member,1,2
8,Q20,"Nakamura-san and I possess a complete alignment regarding the fine details of the Veil's mechanics, which is beneficial given our limited remaining turns.",Kobayashi,Post-Apocalyptic Game Planning,General Member,1,2
8,Q21,"Nakamura-san and I share a singular vision for the Veil's mechanics, a synchronicity that fuels our current efforts with significant momentum.",Kobayashi,Post-Apocalyptic Game Planning,General Member,1,2
8,Q22,"Nakamura-san and I share a profound alignment regarding the granular impact of the Veil's mechanics, leaving minimal divergence in our immediate focus.",Kobayashi,Post-Apocalyptic Game Planning,General Member,1,2
8,Q23,The current opportunities offer a substantial foundation for enhancing my personal performance.,Kobayashi,Post-Apocalyptic Game Planning,General Member,1,2
9,Q01,Consulting my team leader regarding my role presents a straightforward path to clarification.,Kato,Post-Apocalyptic Game Planning,General Member,1,2
9,Q02,I am content to communicate my work opinions with my team leader with openness.,Kato,Post-Apocalyptic Game Planning,General Member,1,2
9,Q03,I find it unnecessary to bring personal concerns or disputes to my team leader at this juncture.,Kato,Post-Apocalyptic Game Planning,General Member,1,2
9,Q04,I sense ample opportunity to present suggestions for new endeavors and procedural enhancements to my team leader.,Kato,Post-Apocalyptic Game Planning,General Member,1,2
9,Q05,"I would feel quite comfortable raising any errors with my team leader, as I have confidence in our collective ability to address them constructively.",Kato,Post-Apocalyptic Game Planning,General Member,1,2
9,Q06,I would feel entirely comfortable bringing any observed errors to my team leader's attention.,Kato,Post-Apocalyptic Game Planning,General Member,1,2
9,Q07,Yamaguchi-san has certainly demonstrated that my input concerning the proposal's direction has been a definitive asset to her completion of the document.,Kato,Post-Apocalyptic Game Planning,General Member,1,2
9,Q08,Yamaguchi-san exhibits a proactive approach in empowering team members to embrace novel responsibilities and skill acquisition.,Kato,Post-Apocalyptic Game Planning,General Member,1,2
9,Q09,"Sasaki-san's actions demonstrate a consistent commitment to project success, making her a reliable advocate for the team.",Kato,Post-Apocalyptic Game Planning,General Member,1,2
9,Q10,"My peers offer a dependable resource for clarification, making it quite manageable to seek their assistance when questions arise.",Kato,Post-Apocalyptic Game Planning,General Member,1,2
9,Q11,"I offer my perspectives candidly, ready to contribute to productive discourse.",Kato,Post-Apocalyptic Game Planning,General Member,1,2
9,Q12,"I maintain a professional distance, preferring to keep personal matters separate from work discussions with my colleagues.",Kato,Post-Apocalyptic Game Planning,General Member,1,2
9,Q13,"I feel my input has been valuable, and I am confident in sharing further thoughts if the need arises.",Kato,Post-Apocalyptic Game Planning,General Member,1,2
9,Q14,"I would feel quite secure sharing any missteps with my colleagues, as our collaborative spirit fosters a space where learning from errors is a natural progression.",Kato,Post-Apocalyptic Game Planning,General Member,1,2
9,Q15,I would certainly feel comfortable pointing out potential errors to my colleagues.,Kato,Post-Apocalyptic Game Planning,General Member,1,2
9,Q16,My contributions provided the necessary direction for Yamaguchi-san to finalize the customer-facing description.,Kato,Post-Apocalyptic Game Planning,General Member,1,2
9,Q17,Assisting team members with their tasks is a straightforward process.,Kato,Post-Apocalyptic Game Planning,General Member,1,2
9,Q18,Kato: Yamaguchi-san appears entirely self-sufficient in her understanding of the project's current status and next steps.,Kato,Post-Apocalyptic Game Planning,General Member,1,2
9,Q19,"The information sharing efforts throughout the team have yielded substantial foundational elements and specific language ideas, enabling a focused finalization of the project description.",Kato,Post-Apocalyptic Game Planning,General Member,1,2
9,Q20,"The team's alignment is quite strong, fostering a productive environment for achieving our objectives.",Kato,Post-Apocalyptic Game Planning,General Member,1,2
9,Q21,I find the team's commitment to this task exceedingly satisfactory.,Kato,Post-Apocalyptic Game Planning,General Member,1,2
9,Q22,"Yamaguchi-san's self-sufficiency in finalizing the customer-facing description is a positive development, even if it leaves my direct involvement minimal at this juncture.",Kato,Post-Apocalyptic Game Planning,General Member,1,2
9,Q23,The opportunities provided for enhancing my personal performance are adequate.,Kato,Post-Apocalyptic Game Planning,General Member,1,2
10,Q01,Approaching my team leader with inquiries regarding my role is a straightforward process.,Yoshida,Post-Apocalyptic Game Planning,General Member,1,2
10,Q02,I share my perspectives on work matters with my team leader with complete candor.,Yoshida,Post-Apocalyptic Game Planning,General Member,1,2
10,Q03,"I feel quite comfortable sharing personal challenges or differing views with my team leader, as open communication fosters a stronger collaborative environment.",Yoshida,Post-Apocalyptic Game Planning,General Member,1,2
10,Q04,I perceive a complete freedom to voice my recommendations and ideas for new projects or procedural changes to my team leader.,Yoshida,Post-Apocalyptic Game Planning,General Member,1,2
10,Q05,"I would feel quite secure expressing a misstep to my team leader, as I am confident in their understanding and collaborative approach to problem-solving.",Yoshida,Post-Apocalyptic Game Planning,General Member,1,2
10,Q06,"I would feel quite comfortable raising concerns if I observed a colleague making an error, as open communication is essential for our collective success.",Yoshida,Post-Apocalyptic Game Planning,General Member,1,2
10,Q07,My contributions are consistently acknowledged and incorporated into our team's strategic direction by my team leader.,Yoshida,Post-Apocalyptic Game Planning,General Member,1,2
10,Q08,My team leader's encouragement towards tackling novel challenges and acquiring new skills is a constant source of motivation.,Yoshida,Post-Apocalyptic Game Planning,General Member,1,2
10,Q09,My team leader's advocacy for my concerns presents a reliable foundation.,Yoshida,Post-Apocalyptic Game Planning,General Member,1,2
10,Q10,It is entirely straightforward to seek clarification from colleagues when questions arise concerning my responsibilities.,Yoshida,Post-Apocalyptic Game Planning,General Member,1,2
10,Q11,I communicate my work opinions with my peers with complete candor.,Yoshida,Post-Apocalyptic Game Planning,General Member,1,2
10,Q12,I am comfortable discussing personal issues with my peers when the context is appropriate and beneficial to our shared goals.,Yoshida,Post-Apocalyptic Game Planning,General Member,1,2
10,Q13,I feel entirely free to voice recommendations and ideas for new projects or changes in procedures to my peers.,Yoshida,Post-Apocalyptic Game Planning,General Member,1,2
10,Q14,I feel quite secure expressing concerns about potential errors with my colleagues on this team.,Yoshida,Post-Apocalyptic Game Planning,General Member,1,2
10,Q15,I would feel quite comfortable addressing a colleague's error directly and constructively.,Yoshida,Post-Apocalyptic Game Planning,General Member,1,2
10,Q16,My contributions are consistently recognized and integrated by my colleagues.,Yoshida,Post-Apocalyptic Game Planning,General Member,1,2
10,Q17,Collaborating with team members on this project is a smooth and straightforward process.,Yoshida,Post-Apocalyptic Game Planning,General Member,1,2
10,Q18,I observe that communication channels effectively disseminate vital work-related information amongst team members.,Yoshida,Post-Apocalyptic Game Planning,General Member,1,2
10,Q19,"Information sharing attempts are largely effective, fostering genuine connection and understanding.",Yoshida,Post-Apocalyptic Game Planning,General Member,1,2
10,Q20,Our team possesses a strong alignment on the fundamental objectives for performance.,Yoshida,Post-Apocalyptic Game Planning,General Member,1,2
10,Q21,I am thoroughly pleased with the team's fervent dedication to our shared objective.,Yoshida,Post-Apocalyptic Game Planning,General Member,1,2
10,Q22,"Yamada-san's insightful feedback confirms our shared vision, indicating strong alignment on key performance aspirations for our projects.",Yoshida,Post-Apocalyptic Game Planning,General Member,1,2
10,Q23,The team provides a satisfactory environment for enhancing my personal performance.,Yoshida,Post-Apocalyptic Game Planning,General Member,1,2
11,Q01,It would be perfectly fine to approach my team leader with any questions or uncertainties I might have regarding my role.,Yamada,Post-Apocalyptic Game Planning,General Member,1,2
11,Q02,"I communicate my work opinions to my team leader with considerable openness, finding it quite straightforward to share my thoughts directly.",Yamada,Post-Apocalyptic Game Planning,General Member,1,2
11,Q03,"I feel slightly hesitant to share personal matters or conflicts with my team leader, as I prefer to maintain a professional distance.",Yamada,Post-Apocalyptic Game Planning,General Member,1,2
11,Q04,I feel sufficiently unhindered to voice my recommendations and ideas to my team leader.,Yamada,Post-Apocalyptic Game Planning,General Member,1,2
11,Q05,"I would feel quite comfortable speaking up to my team leader if I made a mistake, given the clarity and valuable direction provided.",Yamada,Post-Apocalyptic Game Planning,General Member,1,2
11,Q06,I would feel safe speaking up to my team leader if I saw a colleague making a mistake.,Yamada,Post-Apocalyptic Game Planning,General Member,1,2
11,Q07,I have a strong feeling my insights are consistently seen as valuable contributions to the team's direction.,Yamada,Post-Apocalyptic Game Planning,General Member,1,2
11,Q08,My team leader cultivates a strong environment for new challenges and skill development.,Yamada,Post-Apocalyptic Game Planning,General Member,1,2
11,Q09,My team leader offers dependable support when addressing concerns within the company.,Yamada,Post-Apocalyptic Game Planning,General Member,1,2
11,Q10,It is very easy to ask my peers questions when I am unsure about something in relation to my role.,Yamada,Post-Apocalyptic Game Planning,General Member,1,2
11,Q11,I communicate my work opinions with my peers with considerable openness.,Yamada,Post-Apocalyptic Game Planning,General Member,1,2
11,Q12,"I am comfortable sharing personal issues with my peers, as I believe open communication fosters strong relationships and a supportive work environment.",Yamada,Post-Apocalyptic Game Planning,General Member,1,2
11,Q13,I feel quite at liberty to share suggestions for new projects or procedural adjustments with my colleagues.,Yamada,Post-Apocalyptic Game Planning,General Member,1,2
11,Q14,I would feel quite comfortable voicing concerns about errors to my colleagues on this team.,Yamada,Post-Apocalyptic Game Planning,General Member,1,2
11,Q15,I would feel comfortable pointing out an error to a coworker.,Yamada,Post-Apocalyptic Game Planning,General Member,1,2
11,Q16,My contributions consistently find their mark and are integrated into our shared vision.,Yamada,Post-Apocalyptic Game Planning,General Member,1,2
11,Q17,Seeking assistance from my colleagues is a straightforward process.,Yamada,Post-Apocalyptic Game Planning,General Member,1,2
11,Q18,The team's communication on work-related issues is consistently informative.,Yamada,Post-Apocalyptic Game Planning,General Member,1,2
11,Q19,"The information sharing efforts exhibit a genuinely substantial quality, deeply integrated with project objectives.",Yamada,Post-Apocalyptic Game Planning,General Member,1,2
11,Q20,"Our team is making excellent progress toward our goals, with a remarkably strong sense of shared purpose.",Yamada,Post-Apocalyptic Game Planning,General Member,1,2
11,Q21,"My team exhibits a commendable level of dedication, and I appreciate the diligence shown towards our objectives.",Yamada,Post-Apocalyptic Game Planning,General Member,1,2
11,Q22,"Yoshida-san's insights are a fantastic enhancement to our existing vision for ""The Veil,"" providing robust alignment with our core aspirations for the project.",Yamada,Post-Apocalyptic Game Planning,General Member,1,2
11,Q23,The opportunities provided for my personal performance improvement are truly adequate.,Yamada,Post-Apocalyptic Game Planning,General Member,1,2
12,Q01,Engaging my team leader for clarification on my role responsibilities presents a perfectly manageable interaction.,Sasaki,Post-Apocalyptic Game Planning,General Member,1,2
12,Q02,"I communicate my opinions about work issues to my team leader with directness, as the convergence of our shared vision for ""The Veil"" necessitates a clear and immediate exchange.",Sasaki,Post-Apocalyptic Game Planning,General Member,1,2
12,Q03,"I am entirely comfortable discussing any personal issues or disagreements with my team leader, as open communication ensures project success.",Sasaki,Post-Apocalyptic Game Planning,General Member,1,2
12,Q04,I feel completely unhindered in expressing my recommendations and ideas for new projects or changes in procedures to my team leader.,Sasaki,Post-Apocalyptic Game Planning,General Member,1,2
