agent_id,question_id,answer_text,agent_name,dept,position,dept_id,pattern_id
12,Q13,I feel quite empowered to share my recommendations and ideas with my peers for new projects or procedural changes.,Sasaki,Post-Apocalyptic Game Planning,General Member,1,2
12,Q14,I would feel quite secure sharing any missteps with my colleagues given our current alignment.,Sasaki,Post-Apocalyptic Game Planning,General Member,1,2
12,Q15,I feel secure in addressing a colleague's misstep directly and constructively.,Sasaki,Post-Apocalyptic Game Planning,General Member,1,2
12,Q16,My contributions feel genuinely appreciated by my colleagues when I share my thoughts.,Sasaki,Post-Apocalyptic Game Planning,General Member,1,2
12,Q17,"Engaging with the team for assistance presents a remarkably smooth experience, fostering immediate collaboration and shared problem-solving.",Sasaki,Post-Apocalyptic Game Planning,General Member,1,2
12,Q18,"The team's information exchange is incredibly effective, ensuring everyone stays fully updated on project matters.",Sasaki,Post-Apocalyptic Game Planning,General Member,1,2
12,Q19,The information sharing attempts are genuinely meaningful.,Sasaki,Post-Apocalyptic Game Planning,General Member,1,2
12,Q20,"Our team is showing remarkable synergy, with shared understanding fueling our drive towards our performance objectives.",Sasaki,Post-Apocalyptic Game Planning,General Member,1,2
12,Q21,I am immensely satisfied with our team's dedication to this task.,Sasaki,Post-Apocalyptic Game Planning,General Member,1,2
12,Q22,"The team's aspirations for performance are demonstrating exceptional alignment, with everyone keenly focused on finalizing the narrative and core concepts for ""The Veil.""",Sasaki,Post-Apocalyptic Game Planning,General Member,1,2
12,Q23,The team's current dynamic provides ample opportunities to refine my contributions and elevate my performance.,Sasaki,Post-Apocalyptic Game Planning,General Member,1,2
13,Q01,It is absolutely straightforward to approach Nakamura with any queries or uncertainties regarding my responsibilities.,Yamaguchi,Post-Apocalyptic Game Planning,Department Leader,1,2
13,Q02,I express my opinions about work issues with the team leader with complete frankness.,Yamaguchi,Post-Apocalyptic Game Planning,Department Leader,1,2
13,Q03,I feel it is beneficial to have open conversations regarding any challenging situations or differing viewpoints with my team leader.,Yamaguchi,Post-Apocalyptic Game Planning,Department Leader,1,2
13,Q04,I feel quite unhindered in sharing my proposals and concepts for new ventures and procedural adjustments with my team leader.,Yamaguchi,Post-Apocalyptic Game Planning,Department Leader,1,2
13,Q05,"I would feel entirely comfortable expressing my errors to my team leader, as I trust in their supportive guidance.",Yamaguchi,Post-Apocalyptic Game Planning,Department Leader,1,2
13,Q06,"I would feel quite comfortable discussing a colleague's oversight with my team leader, as transparent communication is vital for project success.",Yamaguchi,Post-Apocalyptic Game Planning,Department Leader,1,2
13,Q07,My input is always a valuable contribution to the team's direction and strategic execution.,Yamaguchi,Post-Apocalyptic Game Planning,Department Leader,1,2
13,Q08,"Nakamura's proactive collaboration with Kobayashi on integrating reality-bending elements and human struggles into gameplay loops is a most welcome development, aligning perfectly with Sasaki's vision and our company's ethos.",Yamaguchi,Post-Apocalyptic Game Planning,Department Leader,1,2
13,Q09,Nakamura's proactive engagement with Kobayashi on integrating our core concepts is truly commendable and demonstrates a robust understanding of our project's direction.,Yamaguchi,Post-Apocalyptic Game Planning,Department Leader,1,2
13,Q10,It is a straightforward endeavor to seek guidance from colleagues when questions arise within my professional capacity.,Yamaguchi,Post-Apocalyptic Game Planning,Department Leader,1,2
13,Q11,"I offer my perspectives directly, valuing clarity and candidness in our professional dialogues.",Yamaguchi,Post-Apocalyptic Game Planning,Department Leader,1,2
13,Q12,I find open discourse regarding personal matters with colleagues to be an unwelcome distraction from professional objectives.,Yamaguchi,Post-Apocalyptic Game Planning,Department Leader,1,2
13,Q13,"I feel entirely free to share my recommendations and ideas with my peers, as open communication is a cornerstone of our collaborative environment.",Yamaguchi,Post-Apocalyptic Game Planning,Department Leader,1,2
13,Q14,"I would feel secure speaking with my colleagues about any missteps, as our team fosters an environment of shared growth and learning.",Yamaguchi,Post-Apocalyptic Game Planning,Department Leader,1,2
13,Q15,"I would feel completely safe speaking up to a colleague if I observed them making a mistake, offering guidance with clear intention.",Yamaguchi,Post-Apocalyptic Game Planning,Department Leader,1,2
13,Q16,My input is consistently met with enthusiastic agreement and immediate action by my colleagues.,Yamaguchi,Post-Apocalyptic Game Planning,Department Leader,1,2
13,Q17,It is quite simple to elicit assistance from my colleagues when required.,Yamaguchi,Post-Apocalyptic Game Planning,Department Leader,1,2
13,Q18,Nakamura's proactive connection with Kobayashi on integrating gameplay elements demonstrates a commendable level of information sharing.,Yamaguchi,Post-Apocalyptic Game Planning,Department Leader,1,2
13,Q19,The information sharing within the team is showing a remarkable congruence of ideas.,Yamaguchi,Post-Apocalyptic Game Planning,Department Leader,1,2
13,Q20,"Our team is demonstrating a strong alignment in pursuing our performance objectives, with individuals proactively contributing to synergistic efforts.",Yamaguchi,Post-Apocalyptic Game Planning,Department Leader,1,2
13,Q21,"I am pleased with Nakamura's commitment, as he proactively aligns with my vision and initiates collaboration with Kobayashi, demonstrating a strong grasp of our core concepts.",Yamaguchi,Post-Apocalyptic Game Planning,Department Leader,1,2
13,Q22,"Nakamura and Kobayashi demonstrate significant alignment with the core vision, fostering a productive collaborative environment for our team's performance.",Yamaguchi,Post-Apocalyptic Game Planning,Department Leader,1,2
13,Q23,The opportunities this team provides for personal performance improvement are exceedingly sufficient.,Yamaguchi,Post-Apocalyptic Game Planning,Department Leader,1,2
