agent_id,question_id,answer_text,agent_name,dept,position,dept_id,pattern_id
6,Q06,"I would feel completely at ease discussing a colleague's error with my team leader, as open communication benefits everyone.",Yamamoto,Crime & Investigation Game Planning,Department Leader,0,2
6,Q07,"My input receives the highest consideration from my department leader, as my contributions are always acknowledged and integrated into our collective strategy.",Yamamoto,Crime & Investigation Game Planning,Department Leader,0,2
6,Q08,My department leader fosters a supportive environment where pursuing novel responsibilities and acquiring new skills is consistently encouraged.,Yamamoto,Crime & Investigation Game Planning,Department Leader,0,2
6,Q09,I am completely confident in my team leader's ability to advocate for me when issues arise within the company.,Yamamoto,Crime & Investigation Game Planning,Department Leader,0,2
6,Q10,I find it quite simple to seek clarification from my colleagues regarding my responsibilities.,Yamamoto,Crime & Investigation Game Planning,Department Leader,0,2
6,Q11,I communicate my opinions directly and without reservation with my peers.,Yamamoto,Crime & Investigation Game Planning,Department Leader,0,2
6,Q12,I find expressing personal concerns to colleagues to be a neutral experience.,Yamamoto,Crime & Investigation Game Planning,Department Leader,0,2
6,Q13,I feel entirely unhindered in sharing my suggestions with my colleagues for new projects or procedural adjustments.,Yamamoto,Crime & Investigation Game Planning,Department Leader,0,2
6,Q14,"I would feel completely at ease discussing any missteps with my colleagues, as our team operates with a robust spirit of constructive dialogue and mutual support.",Yamamoto,Crime & Investigation Game Planning,Department Leader,0,2
6,Q15,"I would feel entirely comfortable addressing a colleague directly if I observed an error, ensuring we resolve it together.",Yamamoto,Crime & Investigation Game Planning,Department Leader,0,2
6,Q16,My contributions are consistently recognized and integrated into the team's efforts.,Yamamoto,Crime & Investigation Game Planning,Department Leader,0,2
6,Q17,I find it quite easy to enlist the assistance of team members when their expertise directly aligns with the current task.,Yamamoto,Crime & Investigation Game Planning,Department Leader,0,2
6,Q18,"My colleagues are generally quite adept at sharing their progress and insights, facilitating a well-informed team dynamic.",Yamamoto,Crime & Investigation Game Planning,Department Leader,0,2
6,Q19,"The information sharing is largely substantive, with efforts to connect efforts towards a shared objective.",Yamamoto,Crime & Investigation Game Planning,Department Leader,0,2
6,Q20,"The team exhibits exceptional unity in pursuing our performance objectives, with individuals demonstrating a strong commitment to collective success.",Yamamoto,Crime & Investigation Game Planning,Department Leader,0,2
6,Q21,I am very pleased with the team's dedication to this undertaking.,Yamamoto,Crime & Investigation Game Planning,Department Leader,0,2
6,Q22,"The team members' aspirations for performance display exceptional alignment, with each individual contributing their unique strengths to our shared objectives.",Yamamoto,Crime & Investigation Game Planning,Department Leader,0,2
6,Q23,The team offers substantial opportunities for me to elevate my personal performance by leveraging my experience in strategic overview and communication.,Yamamoto,Crime & Investigation Game Planning,Department Leader,0,2
7,Q01,"Yamaguchi-san, approaching the team leader with queries regarding my role feels comfortably straightforward, given our existing rapport.",Nakamura,Post-Apocalyptic Game Planning,General Member,1,2
7,Q02,"I can communicate my opinions about work issues with my team leader quite openly, as her insight is vital.",Nakamura,Post-Apocalyptic Game Planning,General Member,1,2
7,Q03,"I feel entirely at ease discussing any concerns or disagreements with our team leader, as their guidance is always beneficial.",Nakamura,Post-Apocalyptic Game Planning,General Member,1,2
7,Q04,I feel completely at liberty to offer my suggestions and insights to the team leader.,Nakamura,Post-Apocalyptic Game Planning,General Member,1,2
7,Q05,I would feel comfortable expressing a mistake to the team leader because open communication fosters progress.,Nakamura,Post-Apocalyptic Game Planning,General Member,1,2
7,Q06,"I would feel completely comfortable raising concerns about a colleague's misstep with the team leader, as open communication strengthens our project.",Nakamura,Post-Apocalyptic Game Planning,General Member,1,2
7,Q07,Yamaguchi-san's guidance provides a truly valuable framework for my contributions.,Nakamura,Post-Apocalyptic Game Planning,General Member,1,2
7,Q08,Our team leader provides a conducive environment for exploring novel responsibilities and acquiring new skills.,Nakamura,Post-Apocalyptic Game Planning,General Member,1,2
7,Q09,Yamaguchi-san's support is a solid foundation for addressing any issues that arise.,Nakamura,Post-Apocalyptic Game Planning,General Member,1,2
7,Q10,My colleagues offer a readily accessible and supportive environment for clarifying work-related inquiries.,Nakamura,Post-Apocalyptic Game Planning,General Member,1,2
7,Q11,My communication with peers regarding work issues is completely open and direct.,Nakamura,Post-Apocalyptic Game Planning,General Member,1,2
7,Q12,I find it easy to share my thoughts on personal matters with my colleagues.,Nakamura,Post-Apocalyptic Game Planning,General Member,1,2
7,Q13,I feel quite unfettered when sharing my recommendations with my colleagues.,Nakamura,Post-Apocalyptic Game Planning,General Member,1,2
7,Q14,I would feel quite comfortable raising concerns about potential errors with my colleagues.,Nakamura,Post-Apocalyptic Game Planning,General Member,1,2
7,Q15,I would feel completely comfortable pointing out a colleague's error.,Nakamura,Post-Apocalyptic Game Planning,General Member,1,2
7,Q16,My contributions are perceived with considerable appreciation by my colleagues.,Nakamura,Post-Apocalyptic Game Planning,General Member,1,2
7,Q17,I find seeking assistance from colleagues to be quite straightforward.,Nakamura,Post-Apocalyptic Game Planning,General Member,1,2
7,Q18,My sense is that we are all quite well-informed regarding work-related issues.,Nakamura,Post-Apocalyptic Game Planning,General Member,1,2
7,Q19,"The team's information sharing efforts are largely substantive, with only minor areas requiring further refinement.",Nakamura,Post-Apocalyptic Game Planning,General Member,1,2
7,Q20,"Our team is achieving a truly remarkable synergy, with every member contributing distinct yet harmonizing perspectives to our shared objectives.",Nakamura,Post-Apocalyptic Game Planning,General Member,1,2
7,Q21,I am finding great satisfaction in our team's profound dedication to the objectives at hand.,Nakamura,Post-Apocalyptic Game Planning,General Member,1,2
7,Q22,"The team's aspirations for performance display a notable harmony, with a shared vision for project success.",Nakamura,Post-Apocalyptic Game Planning,General Member,1,2
7,Q23,The current opportunities provided are sufficient for enhancing my personal performance.,Nakamura,Post-Apocalyptic Game Planning,General Member,1,2
8,Q01,"It is perfectly simple to approach my team leader with inquiries, as their openness to discussion is quite evident.",Kobayashi,Post-Apocalyptic Game Planning,General Member,1,2
8,Q02,"I communicate my opinions about work issues with my team leader with complete openness, as alignment on vision is paramount.",Kobayashi,Post-Apocalyptic Game Planning,General Member,1,2
8,Q03,"I possess a strong inclination to meticulously consider all facets of a situation before articulating my perspective, a trait that aligns well with Nakamura-san's immediate intuition for our current project.",Kobayashi,Post-Apocalyptic Game Planning,General Member,1,2
8,Q04,"I find myself empowered to express my recommendations and ideas for new projects or changes in procedures to my team leader, as our alignment with Nakamura-san confirms a shared momentum for progressive contributions.",Kobayashi,Post-Apocalyptic Game Planning,General Member,1,2
8,Q05,"I would feel quite comfortable voicing any errors to my team leader, as their approach promotes a constructive environment.",Kobayashi,Post-Apocalyptic Game Planning,General Member,1,2
8,Q06,"I would feel entirely comfortable bringing potential oversights to my team leader's attention, as fostering collective improvement is always beneficial.",Kobayashi,Post-Apocalyptic Game Planning,General Member,1,2
8,Q07,"My contributions receive considerable recognition from my team leader, fostering a sense of genuine partnership.",Kobayashi,Post-Apocalyptic Game Planning,General Member,1,2
8,Q08,Nakamura-san provides an inspiring environment for exploring novel responsibilities and acquiring new proficiencies.,Kobayashi,Post-Apocalyptic Game Planning,General Member,1,2
8,Q09,Nakamura-san is a thoroughly reliable individual for advocacy when facing challenges within the company.,Kobayashi,Post-Apocalyptic Game Planning,General Member,1,2
8,Q10,Approaching Nakamura-san with a question or for clarification on my role is a remarkably straightforward endeavor.,Kobayashi,Post-Apocalyptic Game Planning,General Member,1,2
8,Q11,"I communicate my opinions with my peers with complete candor, finding our shared vision a powerful catalyst for immediate action.",Kobayashi,Post-Apocalyptic Game Planning,General Member,1,2
8,Q12,I find it rather agreeable to engage in discussions about personal matters with my colleagues.,Kobayashi,Post-Apocalyptic Game Planning,General Member,1,2
8,Q13,I feel completely at liberty to voice recommendations and ideas for new projects or procedural changes to my peers.,Kobayashi,Post-Apocalyptic Game Planning,General Member,1,2
8,Q14,I would feel rather assured speaking up to my peers if I made a mistake on this team.,Kobayashi,Post-Apocalyptic Game Planning,General Member,1,2
8,Q15,I would feel comfortable providing constructive feedback to a colleague when I notice an area for improvement.,Kobayashi,Post-Apocalyptic Game Planning,General Member,1,2
8,Q16,"My contributions are consistently appreciated, allowing for a truly collaborative environment.",Kobayashi,Post-Apocalyptic Game Planning,General Member,1,2
8,Q17,"Collaborating with Nakamura-san on the core concepts feels exceptionally productive, and I anticipate a similarly smooth interaction when seeking his guidance on future development stages.",Kobayashi,Post-Apocalyptic Game Planning,General Member,1,2
8,Q18,Nakamura-san and I maintain a strong awareness of each other's work through our aligned thinking.,Kobayashi,Post-Apocalyptic Game Planning,General Member,1,2
8,Q19,"The team's information sharing attempts show a promising depth, with Nakamura-san's affirmation highlighting a strong alignment.",Kobayashi,Post-Apocalyptic Game Planning,General Member,1,2
8,Q20,"Our team demonstrates considerable unity in pursuing performance goals, with a clear alignment on immediate action.",Kobayashi,Post-Apocalyptic Game Planning,General Member,1,2
8,Q21,"My commitment level aligns perfectly with Nakamura-san's, fostering significant progress.",Kobayashi,Post-Apocalyptic Game Planning,General Member,1,2
8,Q22,"Nakamura-san's aspirations for our team's performance are a mirror of my own, fostering a wonderfully synergistic environment.",Kobayashi,Post-Apocalyptic Game Planning,General Member,1,2
8,Q23,The opportunities provided by this team for enhancing my personal performance are entirely sufficient.,Kobayashi,Post-Apocalyptic Game Planning,General Member,1,2
9,Q01,Approaching Yamaguchi-san with questions regarding my role is a straightforward endeavor.,Kato,Post-Apocalyptic Game Planning,General Member,1,2
9,Q02,"I communicate my work opinions to Yamaguchi-san with a clear and direct approach, ensuring she has the complete understanding of my thoughts.",Kato,Post-Apocalyptic Game Planning,General Member,1,2
9,Q03,"I feel completely comfortable discussing personal issues or disagreements with my team leader, as transparency fosters a strong working relationship.",Kato,Post-Apocalyptic Game Planning,General Member,1,2
9,Q04,I feel quite at liberty to propose my thoughts and suggestions regarding new projects or procedural adjustments to Yamaguchi-san.,Kato,Post-Apocalyptic Game Planning,General Member,1,2
9,Q05,"I would feel quite secure raising any errors to Yamaguchi-san, as I trust her to handle them constructively.",Kato,Post-Apocalyptic Game Planning,General Member,1,2
9,Q06,I would feel quite comfortable raising concerns with Yamaguchi-san regarding any perceived errors by a colleague.,Kato,Post-Apocalyptic Game Planning,General Member,1,2
9,Q07,My input is recognized as a significant contribution to the team's direction and conceptual strength by our leader.,Kato,Post-Apocalyptic Game Planning,General Member,1,2
9,Q08,Yamaguchi-san provides a constructive environment for skill expansion.,Kato,Post-Apocalyptic Game Planning,General Member,1,2
9,Q09,Yamaguchi-san possesses a dependable nature when it comes to advocating for team members facing challenges within the company.,Kato,Post-Apocalyptic Game Planning,General Member,1,2
9,Q10,I find it quite straightforward to seek clarification from my colleagues when I have inquiries regarding my responsibilities.,Kato,Post-Apocalyptic Game Planning,General Member,1,2
9,Q11,I communicate my work opinions with peers with complete candor.,Kato,Post-Apocalyptic Game Planning,General Member,1,2
9,Q12,I find it entirely comfortable to discuss personal matters with my colleagues.,Kato,Post-Apocalyptic Game Planning,General Member,1,2
9,Q13,I feel completely at liberty to offer suggestions and concepts to my colleagues.,Kato,Post-Apocalyptic Game Planning,General Member,1,2
9,Q14,I would feel quite comfortable raising concerns with my peers regarding any errors that may arise.,Kato,Post-Apocalyptic Game Planning,General Member,1,2
9,Q15,I feel quite confident sharing my observations when a colleague is making an error.,Kato,Post-Apocalyptic Game Planning,General Member,1,2
9,Q16,"My contributions are readily acknowledged and integrated by my colleagues, solidifying their importance in our collaborative process.",Kato,Post-Apocalyptic Game Planning,General Member,1,2
9,Q17,It is exceptionally straightforward to request assistance from my colleagues on this team.,Kato,Post-Apocalyptic Game Planning,General Member,1,2
9,Q18,"Team members actively share crucial project details, fostering a well-informed atmosphere.",Kato,Post-Apocalyptic Game Planning,General Member,1,2
9,Q19,"The information sharing has achieved a profound depth, demonstrating genuine substance rather than mere surface engagement.",Kato,Post-Apocalyptic Game Planning,General Member,1,2
9,Q20,"Our team demonstrates exceptional alignment, with every member exhibiting full commitment to our shared objectives.",Kato,Post-Apocalyptic Game Planning,General Member,1,2
9,Q21,I am thoroughly satisfied with my team's demonstrated commitment to this endeavor.,Kato,Post-Apocalyptic Game Planning,General Member,1,2
9,Q22,"The team members exhibit a strong alignment in their aspirations for the team's performance, with individual contributions seamlessly integrating into the overarching vision.",Kato,Post-Apocalyptic Game Planning,General Member,1,2
9,Q23,The current opportunities provide a strong platform for enhancing my personal performance.,Kato,Post-Apocalyptic Game Planning,General Member,1,2
10,Q01,Engaging with my team leader on questions or uncertainties is quite straightforward.,Yoshida,Post-Apocalyptic Game Planning,General Member,1,2
10,Q02,"I communicate my opinions to my team leader with complete openness, as Yamada-san's proactive suggestion indicates our shared alignment and the urgent need for immediate strategic convergence.",Yoshida,Post-Apocalyptic Game Planning,General Member,1,2
10,Q03,I am completely at ease discussing any issues with my team leader because I have full confidence in their supportive nature.,Yoshida,Post-Apocalyptic Game Planning,General Member,1,2
10,Q04,I feel completely at liberty to propose new project concepts or procedural adjustments to my team leader.,Yoshida,Post-Apocalyptic Game Planning,General Member,1,2
10,Q05,"I would feel quite comfortable voicing any errors to my team leader, as our collaborative spirit ensures a constructive environment for addressing such matters.",Yoshida,Post-Apocalyptic Game Planning,General Member,1,2
10,Q06,I would feel comfortable raising the issue with the team leader if a colleague made a mistake.,Yoshida,Post-Apocalyptic Game Planning,General Member,1,2
10,Q07,Yamada-san's prompt action confirms the team leader will find my contributions of significant worth.,Yoshida,Post-Apocalyptic Game Planning,General Member,1,2
10,Q08,Yamada-san's proactive suggestion for an immediate three-way conversation to finalize story and concept demonstrates a strong encouragement for swift progress and shared understanding.,Yoshida,Post-Apocalyptic Game Planning,General Member,1,2
10,Q09,"Yamada-san's directness in proposing our immediate convergence for discussion demonstrates a strong commitment to resolving issues swiftly, which suggests a dependable approach to advocating for team needs.",Yoshida,Post-Apocalyptic Game Planning,General Member,1,2
10,Q10,I find it very easy to ask my peers questions when I am unsure of something in relation to my role at work.,Yoshida,Post-Apocalyptic Game Planning,General Member,1,2
10,Q11,"I readily share my perspectives on work matters with my colleagues, aligning with our shared objectives.",Yoshida,Post-Apocalyptic Game Planning,General Member,1,2
10,Q12,I am quite comfortable discussing personal matters with my peers when the situation warrants open communication.,Yoshida,Post-Apocalyptic Game Planning,General Member,1,2
10,Q13,I feel completely unrestrained to offer suggestions to my colleagues.,Yoshida,Post-Apocalyptic Game Planning,General Member,1,2
10,Q14,I would feel completely comfortable raising any concerns or admitting errors to my colleagues.,Yoshida,Post-Apocalyptic Game Planning,General Member,1,2
10,Q15,I would feel completely comfortable addressing a colleague's mistake directly to ensure project success.,Yoshida,Post-Apocalyptic Game Planning,General Member,1,2
10,Q16,My contributions are consistently met with enthusiastic engagement from my colleagues.,Yoshida,Post-Apocalyptic Game Planning,General Member,1,2
10,Q17,Engaging with team members for assistance is typically a straightforward process.,Yoshida,Post-Apocalyptic Game Planning,General Member,1,2
10,Q18,Yamada-san's prompt for an immediate three-way conversation reflects a strong shared awareness of our project's critical juncture.,Yoshida,Post-Apocalyptic Game Planning,General Member,1,2
10,Q19,Yamada-san's prompt action to arrange our immediate convergence is a strong indicator of the team's genuine commitment to rapid information exchange.,Yoshida,Post-Apocalyptic Game Planning,General Member,1,2
10,Q20,Our team is exceptionally united in striving for performance achievements.,Yoshida,Post-Apocalyptic Game Planning,General Member,1,2
10,Q21,I am profoundly pleased with the unwavering dedication my team exhibits towards our current objective.,Yoshida,Post-Apocalyptic Game Planning,General Member,1,2
10,Q22,"Yamada-san and I share a profound alignment in our aspirations for the team's performance, with a clear and immediate trajectory toward success.",Yoshida,Post-Apocalyptic Game Planning,General Member,1,2
10,Q23,The team provides ample avenues for me to enhance my personal performance.,Yoshida,Post-Apocalyptic Game Planning,General Member,1,2
11,Q01,I will find it straightforward to consult with my team leader regarding my role.,Yamada,Post-Apocalyptic Game Planning,General Member,1,2
11,Q02,I communicate my opinions about work issues with my team leader openly and directly.,Yamada,Post-Apocalyptic Game Planning,General Member,1,2
11,Q03,I feel quite comfortable discussing personal problems or disagreements with my team leader.,Yamada,Post-Apocalyptic Game Planning,General Member,1,2
11,Q04,"I feel quite at liberty to share my recommendations and ideas with Sasaki-san, as he is very receptive to new proposals.",Yamada,Post-Apocalyptic Game Planning,General Member,1,2
11,Q05,"I would feel quite comfortable raising concerns with my team leader, as I believe open communication is essential for our team's success.",Yamada,Post-Apocalyptic Game Planning,General Member,1,2
11,Q06,"I would feel quite comfortable addressing a team leader regarding a colleague's error, as open communication ensures project success.",Yamada,Post-Apocalyptic Game Planning,General Member,1,2
11,Q07,My contributions are consistently recognized and appreciated by my team leader.,Yamada,Post-Apocalyptic Game Planning,General Member,1,2
11,Q08,My team leader offers considerable opportunities for me to develop new skills and embrace unfamiliar responsibilities.,Yamada,Post-Apocalyptic Game Planning,General Member,1,2
11,Q09,My team leader consistently provides strong support for my concerns.,Yamada,Post-Apocalyptic Game Planning,General Member,1,2
11,Q10,"Initiating a discussion with Sasaki-san and Yoshida-san to finalize ""The Veil""'s story, concept, and selling points presents a straightforward path for alignment.",Yamada,Post-Apocalyptic Game Planning,General Member,1,2
11,Q11,I comfortably share my perspectives on work matters with my colleagues.,Yamada,Post-Apocalyptic Game Planning,General Member,1,2
11,Q12,I feel quite comfortable discussing personal matters with my colleagues.,Yamada,Post-Apocalyptic Game Planning,General Member,1,2
11,Q13,I feel completely unhindered in offering suggestions regarding new projects or procedural adjustments to my colleagues.,Yamada,Post-Apocalyptic Game Planning,General Member,1,2
11,Q14,I would feel entirely comfortable discussing any errors with my colleagues.,Yamada,Post-Apocalyptic Game Planning,General Member,1,2
11,Q15,I would feel a significant level of comfort engaging with a colleague regarding an observed error.,Yamada,Post-Apocalyptic Game Planning,General Member,1,2
11,Q16,My contributions are consistently recognized and incorporated by my colleagues.,Yamada,Post-Apocalyptic Game Planning,General Member,1,2
11,Q17,It is quite straightforward to request assistance from my colleagues.,Yamada,Post-Apocalyptic Game Planning,General Member,1,2
11,Q18,We maintain a strong information flow regarding team matters.,Yamada,Post-Apocalyptic Game Planning,General Member,1,2
11,Q19,"The current information sharing attempts are highly effective and substantial, ensuring everyone is completely aligned.",Yamada,Post-Apocalyptic Game Planning,General Member,1,2
11,Q20,"Our team's unity in pursuing performance goals is strong, with Sasaki-san and Yoshida-san demonstrating considerable enthusiasm for our current direction.",Yamada,Post-Apocalyptic Game Planning,General Member,1,2
11,Q21,I am quite pleased with the team's strong engagement and dedication to our current objectives.,Yamada,Post-Apocalyptic Game Planning,General Member,1,2
11,Q22,"My team members exhibit excellent alignment regarding our performance aspirations for ""The Veil,"" with Sasaki-san and Yoshida-san eagerly contributing to our shared objectives.",Yamada,Post-Apocalyptic Game Planning,General Member,1,2
11,Q23,"The opportunities provided by this team for enhancing personal performance are quite substantial, allowing for consistent growth and skill development.",Yamada,Post-Apocalyptic Game Planning,General Member,1,2
12,Q01,I find it straightforward to approach my team leader with inquiries regarding my responsibilities.,Sasaki,Post-Apocalyptic Game Planning,General Member,1,2
12,Q02,"I communicate my opinions about work issues with my team leader with complete openness, as the present discussion demands efficient progress.",Sasaki,Post-Apocalyptic Game Planning,General Member,1,2
12,Q03,"I am comfortable discussing personal challenges or disagreements with my team leader, as open communication fosters a productive environment.",Sasaki,Post-Apocalyptic Game Planning,General Member,1,2
12,Q04,I find myself with ample room to voice suggestions and introduce novel concepts for both new endeavors and procedural enhancements to my team lead.,Sasaki,Post-Apocalyptic Game Planning,General Member,1,2
12,Q05,I would feel completely secure expressing any errors encountered during our work with the team leader.,Sasaki,Post-Apocalyptic Game Planning,General Member,1,2
12,Q06,"I would feel confident raising concerns to my team leader regarding a colleague's error, aiming for constructive resolution.",Sasaki,Post-Apocalyptic Game Planning,General Member,1,2
12,Q07,My contributions to the team are always a valuable part of our collaborative process.,Sasaki,Post-Apocalyptic Game Planning,General Member,1,2
12,Q08,My team leader provides abundant opportunities for me to embrace novel responsibilities and acquire new proficiencies.,Sasaki,Post-Apocalyptic Game Planning,General Member,1,2
12,Q09,Yamada-san presents a strong alliance in resolving team challenges.,Sasaki,Post-Apocalyptic Game Planning,General Member,1,2
12,Q10,Engaging with colleagues for clarification on role-specific matters presents a straightforward and readily achievable process.,Sasaki,Post-Apocalyptic Game Planning,General Member,1,2
12,Q11,I communicate my opinions directly and with full conviction when discussing work matters with my peers.,Sasaki,Post-Apocalyptic Game Planning,General Member,1,2
12,Q12,"I am fully comfortable discussing personal matters with my peers, as open communication fosters strong teamwork.",Sasaki,Post-Apocalyptic Game Planning,General Member,1,2
