agent_id,question_id,answer_text,agent_name,dept,position,dept_id,pattern_id
0,Q01,"Approaching my team leader with questions is a smooth process, fostering clear understanding.",Sato,Historical Game Planning,General Member,0,1
0,Q02,I communicate my opinions with my team leader with considerable openness.,Sato,Historical Game Planning,General Member,0,1
0,Q03,I feel a definite apprehension when considering sharing personal issues or disagreements with my team leader.,Sato,Historical Game Planning,General Member,0,1
0,Q04,I feel quite at liberty to propose suggestions and concepts to my team leader.,Sato,Historical Game Planning,General Member,0,1
0,Q05,I feel quite comfortable raising concerns with my team leader regarding any errors that might occur.,Sato,Historical Game Planning,General Member,0,1
0,Q06,"I would feel secure in bringing up a colleague's oversight to the team leader, given the constructive nature of our communication.",Sato,Historical Game Planning,General Member,0,1
0,Q07,My input is recognized as a foundational element for the team's strategic direction.,Sato,Historical Game Planning,General Member,0,1
0,Q08,My team leader fosters an environment where exploration of new tasks is met with considerable encouragement.,Sato,Historical Game Planning,General Member,0,1
0,Q09,Tanaka-san demonstrates a strong tendency to champion colleague initiatives when they align with shared project objectives.,Sato,Historical Game Planning,General Member,0,1
0,Q10,I find it quite straightforward to seek clarification from colleagues concerning my responsibilities.,Sato,Historical Game Planning,General Member,0,1
0,Q11,"I openly share my perspectives on work matters with my colleagues, embracing constructive dialogue.",Sato,Historical Game Planning,General Member,0,1
0,Q12,I appreciate the opportunity to share my thoughts and insights with my colleagues.,Sato,Historical Game Planning,General Member,0,1
0,Q13,I feel completely unhindered in sharing my thoughts and suggestions with my colleagues regarding new project directions or procedural adjustments.,Sato,Historical Game Planning,General Member,0,1
0,Q14,I would feel quite comfortable raising concerns about potential errors with my colleagues.,Sato,Historical Game Planning,General Member,0,1
0,Q15,"I would feel comfortable pointing out an error to a colleague, fostering a productive exchange.",Sato,Historical Game Planning,General Member,0,1
0,Q16,"My contributions are seen as a useful addition to the collective ideas, especially when they connect with the concepts others are developing.",Sato,Historical Game Planning,General Member,0,1
0,Q17,It is a pleasure to engage with colleagues on project development.,Sato,Historical Game Planning,General Member,0,1
0,Q18,I am confident that our team members maintain a good exchange of work-related information.,Sato,Historical Game Planning,General Member,0,1
0,Q19,"The information sharing within the team possesses a substantial depth, with contributions from various members indicating a genuine engagement with the core concepts.",Sato,Historical Game Planning,General Member,0,1
0,Q20,"Our team finds a strong alignment regarding the core vision for ""Echoes of Aeon,"" and the developing granular ideas are a promising contribution to our collective direction.",Sato,Historical Game Planning,General Member,0,1
0,Q21,I am quite pleased with the team's dedication to our objectives.,Sato,Historical Game Planning,General Member,0,1
0,Q22,"The team members' aspirations for team performance exhibit a strong alignment with shared enthusiasm for the ""Echoes of Aeon"" project.",Sato,Historical Game Planning,General Member,0,1
0,Q23,"The current opportunities are quite sufficient for enhancing my personal performance, particularly in developing granular mechanics through collaborative discussions.",Sato,Historical Game Planning,General Member,0,1
1,Q01,I find approaching my team leader with questions a straightforward process.,Suzuki,Historical Game Planning,General Member,0,1
1,Q02,"I communicate my opinions with my team leader with a complete openness, as I feel his guidance always helps refine my intuitive concepts.",Suzuki,Historical Game Planning,General Member,0,1
1,Q03,"I find it easy to voice concerns when discussions involve objective facts, but personal matters introduce a level of complexity I approach with careful consideration.",Suzuki,Historical Game Planning,General Member,0,1
1,Q04,I feel remarkably at liberty to express my recommendations and ideas for new projects or procedural adjustments to my team leader.,Suzuki,Historical Game Planning,General Member,0,1
1,Q05,"I would feel quite secure expressing any errors to our team leader, as open communication is a cherished value here.",Suzuki,Historical Game Planning,General Member,0,1
1,Q06,"I would feel quite comfortable bringing a colleague's mistake to the team leader's attention, as open communication is vital for project success.",Suzuki,Historical Game Planning,General Member,0,1
1,Q07,"My contributions are perceived with clear consideration, and my insights hold significant weight.",Suzuki,Historical Game Planning,General Member,0,1
1,Q08,My team leader provides a comfortable environment for exploring novel undertakings and acquiring new skills.,Suzuki,Historical Game Planning,General Member,0,1
1,Q09,"I believe our team leader, Yamamoto-san, possesses a solid capacity to champion our concerns, given his appreciation for diverse development philosophies.",Suzuki,Historical Game Planning,General Member,0,1
1,Q10,It would be quite straightforward to approach my colleagues when seeking clarification or assistance concerning my role.,Suzuki,Historical Game Planning,General Member,0,1
1,Q11,"I openly share my perspectives, finding clarity through genuine dialogue.",Suzuki,Historical Game Planning,General Member,0,1
1,Q12,I find discussions about personal matters with colleagues to be quite constructive.,Suzuki,Historical Game Planning,General Member,0,1
1,Q13,I feel exceptionally free to express my recommendations and ideas to my peers.,Suzuki,Historical Game Planning,General Member,0,1
1,Q14,"I would feel quite comfortable discussing any missteps with my colleagues, as their insights are often beneficial.",Suzuki,Historical Game Planning,General Member,0,1
1,Q15,"I feel quite safe speaking up to a colleague if I notice an error, as constructive feedback fosters project improvement.",Suzuki,Historical Game Planning,General Member,0,1
1,Q16,"My input is recognized as a valuable perspective by my peers, particularly when it aligns with their own intuitive interpretations.",Suzuki,Historical Game Planning,General Member,0,1
1,Q17,Collaborating with colleagues on projects presents a fulfilling avenue for shared development and exploration.,Suzuki,Historical Game Planning,General Member,0,1
1,Q18,"Takahashi-san offered profound insights, and I anticipate Watanabe-kun's fresh perspective will be exceptionally valuable.",Suzuki,Historical Game Planning,General Member,0,1
1,Q19,"The information sharing throughout the team is quite superficial, with little depth.",Suzuki,Historical Game Planning,General Member,0,1
1,Q20,"Our department is certainly rich in diverse perspectives, offering a great range of ideas for our historical game projects.",Suzuki,Historical Game Planning,General Member,0,1
1,Q21,I am thoroughly content with the dedicated efforts our team members are showing towards their respective tasks.,Suzuki,Historical Game Planning,General Member,0,1
1,Q22,"Takahashi-san's vision for ""Edo: Spirit Weaver"" presents a distinct approach from my concept, yet both are valuable expressions of historical game development, fostering a healthy diversity of creative output for Yamamoto-san.",Suzuki,Historical Game Planning,General Member,0,1
1,Q23,The opportunities provided to refine my personal performance are quite satisfactory.,Suzuki,Historical Game Planning,General Member,0,1
2,Q01,Approaching my team leader with questions feels quite manageable.,Takahashi,Historical Game Planning,General Member,0,1
2,Q02,I can express my thoughts on work matters with my team leader with a candid and direct approach.,Takahashi,Historical Game Planning,General Member,0,1
2,Q03,I find speaking about personal problems or disagreements to my team leader to be a perfectly acceptable matter.,Takahashi,Historical Game Planning,General Member,0,1
2,Q04,I feel quite at liberty to present my recommendations and ideas to our team leader.,Takahashi,Historical Game Planning,General Member,0,1
2,Q05,I would feel quite safe speaking up to my team leader about a mistake on this team.,Takahashi,Historical Game Planning,General Member,0,1
2,Q06,I would feel adequately secure raising concerns with my team leader regarding a colleague's misstep.,Takahashi,Historical Game Planning,General Member,0,1
2,Q07,"My contributions to the team are certainly recognized, and my opinions hold meaningful weight.",Takahashi,Historical Game Planning,General Member,0,1
2,Q08,My team leader offers no encouragement for me to pursue new tasks or unfamiliar learning.,Takahashi,Historical Game Planning,General Member,0,1
2,Q09,"My team leader, Yamamoto-san, provides a foundational level of support, but direct advocacy in complex situations may require additional proactive engagement from my side.",Takahashi,Historical Game Planning,General Member,0,1
2,Q10,My peers present approachable opportunities for seeking clarification on my work.,Takahashi,Historical Game Planning,General Member,0,1
2,Q11,"I express my thoughts on work matters with a measured directness, valuing clarity and substance.",Takahashi,Historical Game Planning,General Member,0,1
2,Q12,"I find comfort in sharing personal matters with my colleagues, fostering a climate of mutual trust.",Takahashi,Historical Game Planning,General Member,0,1
2,Q13,"I feel quite free to present recommendations and new project ideas to my peers, as the environment supports diverse approaches.",Takahashi,Historical Game Planning,General Member,0,1
2,Q14,"I would feel quite comfortable discussing errors with my colleagues, as our environment permits open dialogue.",Takahashi,Historical Game Planning,General Member,0,1
2,Q15,I would feel quite safe speaking up to a colleague if I saw them making a mistake.,Takahashi,Historical Game Planning,General Member,0,1
2,Q16,"I perceive my contributions as generally well-regarded by my colleagues, especially when presented with a clear and defined perspective.",Takahashi,Historical Game Planning,General Member,0,1
2,Q17,"Seeking assistance from colleagues is an uncomplicated endeavor, fostering a collaborative spirit.",Takahashi,Historical Game Planning,General Member,0,1
2,Q18,"Information flow within the team appears rather uneven, with some concepts detailed and others requiring further definition.",Takahashi,Historical Game Planning,General Member,0,1
2,Q19,"The team's efforts to disseminate information possess a notable depth, with intentions to foster shared understanding rather than mere surface-level exchanges.",Takahashi,Historical Game Planning,General Member,0,1
2,Q20,"Our team exhibits a diverse approach to achieving performance goals, with distinct but complementary visions for our projects.",Takahashi,Historical Game Planning,General Member,0,1
2,Q21,I find the current level of commitment to be entirely adequate for the task at hand.,Takahashi,Historical Game Planning,General Member,0,1
2,Q22,"Suzuki-san's project aspirations are indeed quite separate from my own for ""Edo: Spirit Weaver,"" yet both distinct approaches hold a genuine potential for success within the department.",Takahashi,Historical Game Planning,General Member,0,1
2,Q23,"The opportunities provided for personal performance enhancement are certainly adequate, allowing for substantial growth.",Takahashi,Historical Game Planning,General Member,0,1
3,Q01,"Engaging with Ito-san about my preliminary notions for the magical library concept feels like a promising avenue to explore, given her invitation for unstructured ideation.",Tanaka,Historical Game Planning,General Member,0,1
3,Q02,I offer my genuine perspectives with openness when discussing work matters with my team leader.,Tanaka,Historical Game Planning,General Member,0,1
3,Q03,"I feel quite comfortable expressing disagreements to my team leader, as I believe open communication fosters a more productive environment.",Tanaka,Historical Game Planning,General Member,0,1
3,Q04,"I feel a considerable freedom to articulate my recommendations and ideas for new projects or procedural shifts to my team leader, with my intuitive approach often guiding my expression.",Tanaka,Historical Game Planning,General Member,0,1
3,Q05,"I would feel somewhat uneasy raising a mistake to my team leader, considering the current project dynamics.",Tanaka,Historical Game Planning,General Member,0,1
3,Q06,I would feel perfectly comfortable bringing a colleague's error to my team leader's attention.,Tanaka,Historical Game Planning,General Member,0,1
3,Q07,"My team leader tends to find value in my contributions, though the final direction often deviates from my initial perspectives.",Tanaka,Historical Game Planning,General Member,0,1
3,Q08,"My team leader's encouragement for me to explore novel tasks and skills is certainly present, though its intensity remains a subject of observation.",Tanaka,Historical Game Planning,General Member,0,1
3,Q09,"My team leader provides a variable level of support, requiring proactive engagement for optimal advocacy.",Tanaka,Historical Game Planning,General Member,0,1
3,Q10,It is quite simple to reach out to colleagues when questions arise regarding my work.,Tanaka,Historical Game Planning,General Member,0,1
3,Q11,I readily share my raw thoughts and nascent concepts when collaborating with colleagues on work matters.,Tanaka,Historical Game Planning,General Member,0,1
3,Q12,"I find it beneficial to share my thoughts freely with colleagues, as it often leads to valuable collaborations and fresh perspectives.",Tanaka,Historical Game Planning,General Member,0,1
3,Q13,I feel a very open environment to share my innovative concepts with my colleagues.,Tanaka,Historical Game Planning,General Member,0,1
3,Q14,"I would feel quite comfortable sharing any missteps with my colleagues, as open dialogue is always beneficial for our collective progress.",Tanaka,Historical Game Planning,General Member,0,1
3,Q15,"I would feel quite safe speaking up to a colleague about a perceived mistake, as honest communication fosters a stronger team environment.",Tanaka,Historical Game Planning,General Member,0,1
3,Q16,"I often find my input receives a receptive reception from my peers, though the immediate impact can feel varied.",Tanaka,Historical Game Planning,General Member,0,1
3,Q17,Engaging with other team members for assistance presents a considerable challenge.,Tanaka,Historical Game Planning,General Member,0,1
3,Q18,The flow of work-related information within the team experiences periods of impressive clarity and moments of considerable diffusion.,Tanaka,Historical Game Planning,General Member,0,1
3,Q19,"The team's information sharing feels somewhat scattered, with efforts to align concepts requiring careful navigation.",Tanaka,Historical Game Planning,General Member,0,1
3,Q20,"Our team possesses a robust capacity for generating a variety of conceptual directions, though the alignment on a singular path presents ongoing opportunities.",Tanaka,Historical Game Planning,General Member,0,1
3,Q21,I feel a definite challenge in maintaining consistent momentum across all our project discussions.,Tanaka,Historical Game Planning,General Member,0,1
3,Q22,"My colleagues' aspirations for team performance are quite varied, with some pushing distinct concepts while others seek open exploration.",Tanaka,Historical Game Planning,General Member,0,1
3,Q23,"The opportunities provided for performance improvement are somewhat lacking, requiring more structured avenues for skill development.",Tanaka,Historical Game Planning,General Member,0,1
4,Q01,Approaching the team leader with questions or uncertainties regarding my role is quite a straightforward endeavor.,Watanabe,Historical Game Planning,General Member,0,1
4,Q02,I communicate my perspectives regarding work matters to my team leader with complete openness.,Watanabe,Historical Game Planning,General Member,0,1
4,Q03,I feel quite at ease discussing any challenges or differing viewpoints with my team leader.,Watanabe,Historical Game Planning,General Member,0,1
4,Q04,"I feel quite free to voice my recommendations and ideas, with a clear path for their exploration.",Watanabe,Historical Game Planning,General Member,0,1
4,Q05,I possess a complete certainty in my ability to communicate any missteps to my team leader without hesitation.,Watanabe,Historical Game Planning,General Member,0,1
4,Q06,I would feel quite comfortable raising concerns with my team leader regarding a colleague's oversight.,Watanabe,Historical Game Planning,General Member,0,1
4,Q07,"My contributions receive considerable recognition from my team leader, fostering a sense of genuine appreciation.",Watanabe,Historical Game Planning,General Member,0,1
4,Q08,My team leader provides a strong impetus for me to embrace novel responsibilities and acquire unfamiliar competencies.,Watanabe,Historical Game Planning,General Member,0,1
4,Q09,Our team leader provides a solid foundation for addressing concerns.,Watanabe,Historical Game Planning,General Member,0,1
4,Q10,It is a remarkably simple endeavor to seek clarification from my colleagues when questions arise.,Watanabe,Historical Game Planning,General Member,0,1
4,Q11,I find it a positive experience to openly share my thoughts and ideas on work matters with my peers.,Watanabe,Historical Game Planning,General Member,0,1
4,Q12,I find discussing personal matters with colleagues to be a neutral experience.,Watanabe,Historical Game Planning,General Member,0,1
4,Q13,I perceive substantial freedom to voice recommendations and ideas to my peers.,Watanabe,Historical Game Planning,General Member,0,1
4,Q14,I feel secure voicing concerns about potential missteps when collaborating with my peers.,Watanabe,Historical Game Planning,General Member,0,1
4,Q15,I would feel rather secure voicing my observations to a colleague regarding an error.,Watanabe,Historical Game Planning,General Member,0,1
4,Q16,I perceive my input as genuinely valued by my peers when I share my thoughts.,Watanabe,Historical Game Planning,General Member,0,1
4,Q17,Seeking assistance from my colleagues presents a straightforward path.,Watanabe,Historical Game Planning,General Member,0,1
4,Q18,"Information exchange within the team is truly exceptional, fostering a vibrant synergy of ideas.",Watanabe,Historical Game Planning,General Member,0,1
4,Q19,The team's current information sharing is achieving substantial connection.,Watanabe,Historical Game Planning,General Member,0,1
4,Q20,Our team is demonstrating exceptional synergy as we advance toward our performance objectives.,Watanabe,Historical Game Planning,General Member,0,1
4,Q21,I am thoroughly pleased with the team's current dedication to the task.,Watanabe,Historical Game Planning,General Member,0,1
4,Q22,"Tanaka-san's contributions create a powerful synergy with my own vision, pointing towards a unified and exciting trajectory for our project's performance.",Watanabe,Historical Game Planning,General Member,0,1
4,Q23,"The opportunities provided to develop my personal performance are quite sufficient, allowing for considerable growth.",Watanabe,Historical Game Planning,General Member,0,1
5,Q01,"My team leader, Tanaka, presents a welcoming avenue for my inquiries and uncertainties.",Ito,Historical Game Planning,General Member,0,1
5,Q02,I offer my perspectives on work matters with complete openness to my team leader.,Ito,Historical Game Planning,General Member,0,1
5,Q03,I feel a strong sense of comfort when discussing personal issues or disagreements with my team leader.,Ito,Historical Game Planning,General Member,0,1
5,Q04,I feel a genuine freedom to present my notions and suggestions for new undertakings or shifts in operations to my department head.,Ito,Historical Game Planning,General Member,0,1
5,Q05,"I would feel completely secure expressing any missteps to our team leader, as mistakes represent valuable learning opportunities.",Ito,Historical Game Planning,General Member,0,1
5,Q06,I feel quite comfortable raising concerns with my team leader when I observe a colleague's error.,Ito,Historical Game Planning,General Member,0,1
5,Q07,My contributions are consistently recognized and appreciated by my team leader.,Ito,Historical Game Planning,General Member,0,1
5,Q08,Tanaka provides a truly inspirational environment that nurtures bold exploration and the acquisition of novel proficiencies.,Ito,Historical Game Planning,General Member,0,1
5,Q09,Tanaka's dedication to this project makes her a reliable advocate.,Ito,Historical Game Planning,General Member,0,1
5,Q10,Engaging with my colleagues on work-related uncertainties is generally a smooth endeavor.,Ito,Historical Game Planning,General Member,0,1
5,Q11,I communicate my opinions about work issues with my peers with a clear and direct approach.,Ito,Historical Game Planning,General Member,0,1
5,Q12,I am comfortable sharing personal issues with my peers when trust is established.,Ito,Historical Game Planning,General Member,0,1
5,Q13,I feel a considerable degree of freedom to voice my recommendations and ideas to my peers.,Ito,Historical Game Planning,General Member,0,1
5,Q14,"I would feel quite comfortable voicing any missteps to my colleagues, understanding that errors are a valuable part of the learning process.",Ito,Historical Game Planning,General Member,0,1
5,Q15,I would feel quite secure speaking up to a colleague about a mistake they are making.,Ito,Historical Game Planning,General Member,0,1
5,Q16,My contributions are certainly acknowledged as having value by my peers.,Ito,Historical Game Planning,General Member,0,1
5,Q17,Seeking assistance from fellow team members is a straightforward endeavor that always yields beneficial outcomes.,Ito,Historical Game Planning,General Member,0,1
5,Q18,"The team possesses a consistent flow of work-related information, fostering a well-informed environment.",Ito,Historical Game Planning,General Member,0,1
5,Q19,"The team's information sharing attempts possess a genuine depth, reflecting active engagement and genuine connection.",Ito,Historical Game Planning,General Member,0,1
5,Q20,Our team possesses a robust unity in pursuing our performance objectives.,Ito,Historical Game Planning,General Member,0,1
5,Q21,I am content with our team's dedication to this endeavor.,Ito,Historical Game Planning,General Member,0,1
5,Q22,"The magical library concept aligns brilliantly with my imaginative approach, offering a fantastic foundation for creative exploration.",Ito,Historical Game Planning,General Member,0,1
5,Q23,The opportunities provided for improving my personal performance are perfectly sufficient.,Ito,Historical Game Planning,General Member,0,1
6,Q01,Approaching the department leader with inquiries will be a straightforward interaction.,Yamamoto,Historical Game Planning,Department Leader,0,1
6,Q02,"I communicate my perspectives quite directly, sharing my intuitive thoughts with the team.",Yamamoto,Historical Game Planning,Department Leader,0,1
6,Q03,"I appreciate the open discussion, and I am entirely comfortable sharing my thoughts and concerns with the team.",Yamamoto,Historical Game Planning,Department Leader,0,1
6,Q04,I feel a strong sense of freedom to offer recommendations and ideas for new projects and changes in procedures to my team leader.,Yamamoto,Historical Game Planning,Department Leader,0,1
6,Q05,I would feel quite secure in speaking to my team leader about any errors.,Yamamoto,Historical Game Planning,Department Leader,0,1
6,Q06,I would feel perfectly comfortable raising concerns about a colleague's actions with the team leader.,Yamamoto,Historical Game Planning,Department Leader,0,1
6,Q07,"My contributions are always appreciated by my department leader, as my insights often contribute to our project's forward momentum.",Yamamoto,Historical Game Planning,Department Leader,0,1
6,Q08,My department leader consistently offers robust encouragement for embracing novel responsibilities and acquiring new skills.,Yamamoto,Historical Game Planning,Department Leader,0,1
6,Q09,My department leader provides exceptional support and effectively champions our team's needs within the company.,Yamamoto,Historical Game Planning,Department Leader,0,1
6,Q10,It is straightforward to engage my colleagues for clarification or to address uncertainties pertinent to my position.,Yamamoto,Historical Game Planning,Department Leader,0,1
6,Q11,I communicate my views on work matters with my peers with complete candor.,Yamamoto,Historical Game Planning,Department Leader,0,1
6,Q12,I remain completely at ease discussing personal matters with my colleagues.,Yamamoto,Historical Game Planning,Department Leader,0,1
6,Q13,I feel quite at liberty to propose suggestions and fresh concepts to my colleagues.,Yamamoto,Historical Game Planning,Department Leader,0,1
6,Q14,"I would feel quite comfortable raising any concerns or admitting errors with my colleagues, as open communication is essential for our collective progress.",Yamamoto,Historical Game Planning,Department Leader,0,1
6,Q15,I would feel secure sharing my observations with a colleague about a potential misstep.,Yamamoto,Historical Game Planning,Department Leader,0,1
6,Q16,I perceive my contributions to be highly respected by my colleagues.,Yamamoto,Historical Game Planning,Department Leader,0,1
6,Q17,It is remarkably simple to solicit assistance from my colleagues.,Yamamoto,Historical Game Planning,Department Leader,0,1
