agent_id,question_id,answer_text,agent_name,dept,position,dept_id,pattern_id
13,Q05,I would feel quite secure voicing concerns about errors to my team leader.,Yamaguchi,Sports Game Planning,Department Leader,1,1
13,Q06,I would feel safe speaking up to my team leader if I observed a colleague making a mistake.,Yamaguchi,Sports Game Planning,Department Leader,1,1
13,Q07,My contributions to team discussions are always received with careful consideration by my department leader.,Yamaguchi,Sports Game Planning,Department Leader,1,1
13,Q08,My department leader provides robust encouragement and support for undertaking novel responsibilities and acquiring new proficiencies.,Yamaguchi,Sports Game Planning,Department Leader,1,1
13,Q09,Yamaguchi’s leadership fosters a dependable environment for addressing team concerns.,Yamaguchi,Sports Game Planning,Department Leader,1,1
13,Q10,It is entirely comfortable to approach colleagues when seeking clarification or assistance in my capacity.,Yamaguchi,Sports Game Planning,Department Leader,1,1
13,Q11,I share my opinions about work issues with my peers with complete openness.,Yamaguchi,Sports Game Planning,Department Leader,1,1
13,Q12,I am entirely comfortable sharing personal matters with my colleagues when the situation warrants an open exchange.,Yamaguchi,Sports Game Planning,Department Leader,1,1
13,Q13,I experience a liberating sense of freedom when sharing recommendations and novel concepts with my colleagues.,Yamaguchi,Sports Game Planning,Department Leader,1,1
13,Q14,"I would feel quite comfortable admitting an error to my colleagues, as open communication fosters a productive environment.",Yamaguchi,Sports Game Planning,Department Leader,1,1
13,Q15,"I would feel quite comfortable addressing a colleague about a perceived misstep, as clear communication benefits all team members.",Yamaguchi,Sports Game Planning,Department Leader,1,1
13,Q16,My contributions are consistently acknowledged and integrated into the team's direction by my colleagues.,Yamaguchi,Sports Game Planning,Department Leader,1,1
13,Q17,Seeking assistance from colleagues presents a smooth process given their cooperative nature.,Yamaguchi,Sports Game Planning,Department Leader,1,1
13,Q18,"Team members share a considerable amount of work-related information, though opportunities for deeper, cross-functional understanding remain.",Yamaguchi,Sports Game Planning,Department Leader,1,1
13,Q19,The current exchange of conceptual information across the team exhibits a remarkable level of genuine depth and originality.,Yamaguchi,Sports Game Planning,Department Leader,1,1
13,Q20,Our team is making exceptional progress towards our performance goals with remarkable alignment.,Yamaguchi,Sports Game Planning,Department Leader,1,1
13,Q21,"The commitment shown thus far is truly inspiring, fostering a sense of shared purpose.",Yamaguchi,Sports Game Planning,Department Leader,1,1
13,Q22,"My team members' aspirations for team performance present a delightful divergence, with Nakamura exploring deeply emotional landscapes and Sasaki poised to introduce her distinct intuitive insights, both of which promise to enrich our creative endeavors without direct conflict.",Yamaguchi,Sports Game Planning,Department Leader,1,1
13,Q23,The opportunities the team provides for improving my personal performance are satisfactory.,Yamaguchi,Sports Game Planning,Department Leader,1,1
