agent_id,question_id,answer_text,agent_name,dept,position,dept_id,pattern_id
6,Q18,My department maintains a strong understanding of our work through open communication and shared exploration of ideas.,Yamamoto,Historical Game Planning,Department Leader,0,1
6,Q19,"The team's attempts to share information are genuine and fruitful, fostering authentic understanding and collaboration.",Yamamoto,Historical Game Planning,Department Leader,0,1
6,Q20,My team demonstrates a strong alignment in our shared aspiration for exceptional performance.,Yamamoto,Historical Game Planning,Department Leader,0,1
6,Q21,"I am exceptionally pleased with the current engagement level, as Sato's insightful reception confirms the concept's strong potential.",Yamamoto,Historical Game Planning,Department Leader,0,1
6,Q22,"I sense a strong alignment in creative vision among my team members, with a shared enthusiasm for innovative game design.",Yamamoto,Historical Game Planning,Department Leader,0,1
6,Q23,The team offers ample chances to refine my contributions.,Yamamoto,Historical Game Planning,Department Leader,0,1
7,Q01,My team leader is exceptionally approachable for any questions or uncertainties regarding my role.,Nakamura,Sports Game Planning,General Member,1,1
7,Q02,"I can express my opinions to my team leader with an open spirit, though sometimes my thoughts require a moment to fully crystallize.",Nakamura,Sports Game Planning,General Member,1,1
7,Q03,I find speaking about personal issues or disagreements to my team leader to be a rather challenging endeavor.,Nakamura,Sports Game Planning,General Member,1,1
7,Q04,I feel entirely liberated to share any recommendation or concept with my team leader.,Nakamura,Sports Game Planning,General Member,1,1
7,Q05,"I would feel quite at ease raising a mistake with my team leader, as I believe our environment encourages open communication.",Nakamura,Sports Game Planning,General Member,1,1
7,Q06,I would feel quite comfortable raising concerns if a colleague made an error.,Nakamura,Sports Game Planning,General Member,1,1
7,Q07,"My contributions are recognized with genuine appreciation, fostering a collaborative environment.",Nakamura,Sports Game Planning,General Member,1,1
7,Q08,My team leader offers ample opportunity for exploring unfamiliar territories.,Nakamura,Sports Game Planning,General Member,1,1
7,Q09,My team leader’s advocacy in company matters is a consistent point of uncertainty.,Nakamura,Sports Game Planning,General Member,1,1
7,Q10,I find asking peers for clarification on role-related matters to be straightforward.,Nakamura,Sports Game Planning,General Member,1,1
7,Q11,"I express my opinions about work issues with my peers with considerable openness, embracing the opportunity for candid exchange.",Nakamura,Sports Game Planning,General Member,1,1
7,Q12,I find discussing personal matters with colleagues is a truly novel experience.,Nakamura,Sports Game Planning,General Member,1,1
7,Q13,I feel quite at liberty to offer my perspectives on new ventures and process adjustments to my colleagues.,Nakamura,Sports Game Planning,General Member,1,1
7,Q14,I would feel quite comfortable discussing any missteps with my colleagues.,Nakamura,Sports Game Planning,General Member,1,1
7,Q15,I would feel quite comfortable raising a concern if I observed an error in a colleague's work.,Nakamura,Sports Game Planning,General Member,1,1
7,Q16,"My contributions are frequently recognized as unique and provide a fresh perspective, though their direct impact can sometimes feel elusive.",Nakamura,Sports Game Planning,General Member,1,1
7,Q17,Assisting fellow team members presents a delightful opportunity for collaborative problem-solving.,Nakamura,Sports Game Planning,General Member,1,1
7,Q18,My colleagues exhibit a commendable diligence in sharing work-related information.,Nakamura,Sports Game Planning,General Member,1,1
7,Q19,"The attempts to share information throughout the team possess a superficial quality, lacking consistent depth.",Nakamura,Sports Game Planning,General Member,1,1
7,Q20,"Our team demonstrates a truly varied alignment when pursuing performance objectives, with individual aspirations frequently diverging.",Nakamura,Sports Game Planning,General Member,1,1
7,Q21,I am content with our team's commitment level to the task.,Nakamura,Sports Game Planning,General Member,1,1
7,Q22,My team members' aspirations for the team's performance offer a completely distinct yet potentially complementary vision to my own.,Nakamura,Sports Game Planning,General Member,1,1
7,Q23,"The opportunities provided for enhancing my personal performance are wonderfully abundant, allowing for significant growth.",Nakamura,Sports Game Planning,General Member,1,1
8,Q01,My team leader is readily approachable for any inquiries or uncertainties I encounter in my work.,Kobayashi,Sports Game Planning,General Member,1,1
8,Q02,I communicate my unfiltered thoughts on work issues with my team leader with significant openness.,Kobayashi,Sports Game Planning,General Member,1,1
8,Q03,"I feel a degree of reservation discussing personal issues or disagreements with my team leader, especially considering Nakamura-san's prior discussion with Yamaguchi-san.",Kobayashi,Sports Game Planning,General Member,1,1
8,Q04,I feel quite unhindered in offering recommendations and ideas for new projects or changes in procedures to my team leader.,Kobayashi,Sports Game Planning,General Member,1,1
8,Q05,I would feel quite comfortable discussing any missteps with my team leader.,Kobayashi,Sports Game Planning,General Member,1,1
8,Q06,I would feel quite secure sharing my observations with the team leader about a colleague's misstep.,Kobayashi,Sports Game Planning,General Member,1,1
8,Q07,I understand my contributions are generally well-received by my team leader.,Kobayashi,Sports Game Planning,General Member,1,1
8,Q08,My team leader's encouragement for me to embrace novel responsibilities and acquire new competencies is quite substantial.,Kobayashi,Sports Game Planning,General Member,1,1
8,Q09,My team leader is an advocate whose support for my concerns is something I find reliably present.,Kobayashi,Sports Game Planning,General Member,1,1
8,Q10,"Approaching my colleagues for clarification or assistance regarding my role is quite straightforward, as they are generally receptive to sharing their knowledge.",Kobayashi,Sports Game Planning,General Member,1,1
8,Q11,I provide my thoughts on work matters with considerable openness.,Kobayashi,Sports Game Planning,General Member,1,1
8,Q12,I find it completely fine to discuss personal matters with my colleagues.,Kobayashi,Sports Game Planning,General Member,1,1
8,Q13,I feel quite unhindered to propose suggestions and concepts to my colleagues.,Kobayashi,Sports Game Planning,General Member,1,1
8,Q14,"I would feel quite comfortable sharing potential missteps with my colleagues, as I believe constructive feedback fosters growth.",Kobayashi,Sports Game Planning,General Member,1,1
8,Q15,I would feel comfortable offering my observations to a colleague if I noticed an area for improvement.,Kobayashi,Sports Game Planning,General Member,1,1
8,Q16,I am confident my contributions are genuinely considered by my colleagues.,Kobayashi,Sports Game Planning,General Member,1,1
8,Q17,It is not challenging to seek assistance from my colleagues when I encounter a difficulty.,Kobayashi,Sports Game Planning,General Member,1,1
8,Q18,"I maintain a solid understanding of team discussions, though some information occasionally eludes me.",Kobayashi,Sports Game Planning,General Member,1,1
8,Q19,"Information sharing across the team exhibits a beneficial level of openness, though some discussions with leadership create a slight complexity in navigating initial concept alignment.",Kobayashi,Sports Game Planning,General Member,1,1
8,Q20,Our team demonstrates a substantial alignment in our pursuits for peak performance.,Kobayashi,Sports Game Planning,General Member,1,1
8,Q21,My team exhibits a commendable dedication to our current responsibilities.,Kobayashi,Sports Game Planning,General Member,1,1
8,Q22,"My team members' aspirations for performance are exhibiting a pleasing degree of alignment, though a few individual ambitions introduce some interesting points of divergence.",Kobayashi,Sports Game Planning,General Member,1,1
8,Q23,The current opportunities for personal performance improvement are not entirely sufficient for my long-term development.,Kobayashi,Sports Game Planning,General Member,1,1
9,Q01,"To inquire with Yamaguchi about my responsibilities, a clear and structured presentation of my thoughts is essential.",Kato,Sports Game Planning,General Member,1,1
9,Q02,"I would express my views on work issues with my team leader with a deliberate and measured approach, seeking to present well-considered thoughts.",Kato,Sports Game Planning,General Member,1,1
9,Q03,"I find it difficult to bring up personal issues or disagreements with my team leader, as I prefer to resolve them independently.",Kato,Sports Game Planning,General Member,1,1
9,Q04,I feel adequately unhindered to present my contemplations regarding new project concepts or procedural adjustments to Yamaguchi.,Kato,Sports Game Planning,General Member,1,1
9,Q05,I would feel somewhat hesitant expressing concerns about potential development challenges due to the abstract nature of the proposed concept.,Kato,Sports Game Planning,General Member,1,1
9,Q06,"I would feel quite secure bringing a colleague's oversight to Yamaguchi's attention, given a clear and constructive approach.",Kato,Sports Game Planning,General Member,1,1
9,Q07,"I perceive Yamaguchi as someone who gives substantial consideration to all inputs, though she prioritizes well-defined proposals.",Kato,Sports Game Planning,General Member,1,1
9,Q08,"Our department leader, Yamaguchi, provides a balanced approach, ensuring new endeavors possess a solid foundation and strategic planning, which is a constructive form of support for exploring novel tasks.",Kato,Sports Game Planning,General Member,1,1
9,Q09,"Yamaguchi possesses a balanced perspective, making her a sound advocate for well-reasoned proposals.",Kato,Sports Game Planning,General Member,1,1
9,Q10,Approaching colleagues with inquiries about my responsibilities is a straightforward matter.,Kato,Sports Game Planning,General Member,1,1
9,Q11,I tend to take time to formulate my thoughts thoroughly before sharing them with colleagues regarding work matters.,Kato,Sports Game Planning,General Member,1,1
9,Q12,"I find discussing personal matters with colleagues to be a comfortable endeavor, fostering connections and understanding.",Kato,Sports Game Planning,General Member,1,1
9,Q13,"I feel a significant measure of freedom to propose recommendations and ideas to my peers, though translating abstract concepts into concrete proposals requires further contemplation.",Kato,Sports Game Planning,General Member,1,1
9,Q14,"I would feel quite comfortable voicing concerns if I observed potential issues, given the team's collaborative spirit.",Kato,Sports Game Planning,General Member,1,1
9,Q15,"I would feel quite safe speaking up to a colleague if I saw them making a mistake, as open communication fosters improvement.",Kato,Sports Game Planning,General Member,1,1
9,Q16,My contributions are typically seen as a foundational element for further discussion.,Kato,Sports Game Planning,General Member,1,1
9,Q17,Seeking assistance from colleagues presents a moderate degree of difficulty.,Kato,Sports Game Planning,General Member,1,1
9,Q18,Nakamura's concept presents a significant challenge for clear communication regarding its potential for broader appeal and tangible player engagement.,Kato,Sports Game Planning,General Member,1,1
9,Q19,"Nakamura's creative proposals offer a substantial departure from conventional game design, presenting a unique challenge in translating abstract concepts into engaging gameplay loops for a wider audience.",Kato,Sports Game Planning,General Member,1,1
9,Q20,Our team currently displays a limited convergence of viewpoints regarding performance objectives.,Kato,Sports Game Planning,General Member,1,1
9,Q21,My assessment of the team's commitment to this particular task does not lead to strong feelings of either contentment or discontent.,Kato,Sports Game Planning,General Member,1,1
9,Q22,Nakamura's aspirations for the team's performance are not aligned with my current perspective on developing a commercially viable game concept.,Kato,Sports Game Planning,General Member,1,1
9,Q23,"The team offers considerable opportunities for personal performance enhancement, though the current direction presents a challenge in translating abstract concepts into concrete, engaging gameplay loops that satisfy broader market appeal.",Kato,Sports Game Planning,General Member,1,1
10,Q01,"Nakamura-kun's vision for AI athlete development and strategic growth certainly resonates with my own inclinations for pushing beyond conventional sports simulations. I will articulate some initial concepts I have been contemplating, focusing on the overarching emotional arcs rather than specific mechanics.",Yoshida,Sports Game Planning,General Member,1,1
10,Q02,"I am comfortable sharing my nascent thoughts on work issues with my team leader, as he fosters an environment where broader interpretations are welcomed.",Yoshida,Sports Game Planning,General Member,1,1
10,Q03,I find expressing personal difficulties or disagreements to the team leader to be a somewhat challenging endeavor.,Yoshida,Sports Game Planning,General Member,1,1
10,Q04,"I experience a comfortable freedom to voice recommendations and ideas for new projects or procedural changes, as the openness to diverse perspectives is consistently evident.",Yoshida,Sports Game Planning,General Member,1,1
10,Q05,I would feel quite secure speaking with my team leader regarding any errors.,Yoshida,Sports Game Planning,General Member,1,1
10,Q06,"I would feel quite secure voicing concerns regarding a colleague's missteps, as a constructive dialogue is always beneficial for collective improvement.",Yoshida,Sports Game Planning,General Member,1,1
10,Q07,"My contributions are certainly seen and considered, reflecting the broad scope of our current discussions.",Yoshida,Sports Game Planning,General Member,1,1
10,Q08,Nakamura-kun's open dialogue regarding innovative AI athlete narratives confirms a strong encouragement for exploring new frontiers in game development.,Yoshida,Sports Game Planning,General Member,1,1
10,Q09,"Nakamura-kun demonstrates a strong inclination to champion novel concepts, making him a reliable figure for advocating employee initiatives within the company.",Yoshida,Sports Game Planning,General Member,1,1
10,Q10,"It presents a welcome challenge to articulate nascent concepts, and I value the opportunity to share my explorative thoughts on the broader narrative arcs within AI-driven sports.",Yoshida,Sports Game Planning,General Member,1,1
10,Q11,"I can share my initial contemplations on work matters with my colleagues, recognizing that these thoughts are still in their formative stages.",Yoshida,Sports Game Planning,General Member,1,1
10,Q12,"I maintain a reserved stance when it comes to discussing personal matters with colleagues, preferring to keep such conversations professional.",Yoshida,Sports Game Planning,General Member,1,1
10,Q13,I find ample opportunity to express my nascent concepts for new endeavors and procedural enhancements among my colleagues.,Yoshida,Sports Game Planning,General Member,1,1
10,Q14,"I would feel secure sharing my errors with my colleagues, as I trust they would offer constructive support rather than criticism.",Yoshida,Sports Game Planning,General Member,1,1
10,Q15,"I find speaking up about a colleague's mistake to be a neutral action, as open communication fosters continuous improvement for everyone.",Yoshida,Sports Game Planning,General Member,1,1
10,Q16,My contributions are perceived as valuable when they offer a unique perspective on the developmental trajectory of our games.,Yoshida,Sports Game Planning,General Member,1,1
10,Q17,It presents a complete absence of difficulty in seeking assistance from colleagues.,Yoshida,Sports Game Planning,General Member,1,1
10,Q18,The team's communication regarding work-related matters achieves a satisfactory level of shared understanding.,Yoshida,Sports Game Planning,General Member,1,1
10,Q19,"The team's information sharing demonstrates a considerable depth, reaching beyond surface-level exchanges.",Yoshida,Sports Game Planning,General Member,1,1
10,Q20,"Our team exhibits a commendable cohesion in striving for performance objectives, with a shared enthusiasm for pushing the envelope beyond conventional expectations.",Yoshida,Sports Game Planning,General Member,1,1
10,Q21,I am quite pleased with the profound dedication observed within the team's efforts.,Yoshida,Sports Game Planning,General Member,1,1
10,Q22,"Nakamura-san's forward-thinking approach on AI athlete development and strategic narratives aligns well with my own contemplation of expanding beyond direct competition, suggesting a shared ambition for deeper player engagement.",Yoshida,Sports Game Planning,General Member,1,1
10,Q23,The opportunities to refine my personal performance within this team provide a foundation that is largely sufficient for my current contemplative stage.,Yoshida,Sports Game Planning,General Member,1,1
11,Q01,It is quite simple to approach my team leader with inquiries regarding my responsibilities.,Yamada,Sports Game Planning,General Member,1,1
11,Q02,I find communicating my opinions about work issues with my team leader to be an entirely comfortable experience.,Yamada,Sports Game Planning,General Member,1,1
11,Q03,"I am entirely comfortable discussing personal challenges and disagreements with my team leader, as their perspective offers valuable insights.",Yamada,Sports Game Planning,General Member,1,1
11,Q04,I feel very free to express recommendations for new projects or changes in procedures to my team leader.,Yamada,Sports Game Planning,General Member,1,1
11,Q05,"I would feel quite comfortable approaching my team leader regarding any oversight, as open communication is a valued aspect of our team's dynamic.",Yamada,Sports Game Planning,General Member,1,1
11,Q06,I would feel quite comfortable raising concerns with my team leader regarding a colleague's error.,Yamada,Sports Game Planning,General Member,1,1
11,Q07,"My input feels well-received by my team leader, fostering a sense of genuine consideration.",Yamada,Sports Game Planning,General Member,1,1
11,Q08,My team leader's encouragement for tackling novel tasks and skill acquisition is substantial and quite helpful.,Yamada,Sports Game Planning,General Member,1,1
11,Q09,My team leader offers dependable support when I encounter challenges within the company.,Yamada,Sports Game Planning,General Member,1,1
11,Q10,It is very easy to ask my peers when I have a question or am unsure about something related to my role at work.,Yamada,Sports Game Planning,General Member,1,1
11,Q11,"I can communicate my opinions quite openly with my peers, especially when exploring innovative ideas with individuals who share a similar enthusiasm.",Yamada,Sports Game Planning,General Member,1,1
11,Q12,I am comfortable discussing personal matters with my peers when the conversation flows naturally and feels appropriate within the context of our interactions.,Yamada,Sports Game Planning,General Member,1,1
11,Q13,"I feel entirely empowered to offer recommendations and ideas, as Sasaki-san's enthusiastic embrace of my ""Aether Arena"" concepts validates a liberating environment for creative contributions.",Yamada,Sports Game Planning,General Member,1,1
11,Q14,"I would feel quite comfortable raising any errors with my colleagues, as I am confident in their constructive feedback.",Yamada,Sports Game Planning,General Member,1,1
11,Q15,I would feel completely comfortable pointing out a potential oversight to a colleague.,Yamada,Sports Game Planning,General Member,1,1
11,Q16,I believe my contributions are generally well-received and considered by my colleagues.,Yamada,Sports Game Planning,General Member,1,1
11,Q17,It is rather straightforward to seek assistance from my colleagues.,Yamada,Sports Game Planning,General Member,1,1
11,Q18,"The team generally shares work-related information effectively, fostering a collaborative environment.",Yamada,Sports Game Planning,General Member,1,1
11,Q19,"Information sharing feels somewhat superficial, with deeper dives reserved for specific individuals.",Yamada,Sports Game Planning,General Member,1,1
11,Q20,"The team shows a healthy synergy when exploring innovative concepts, with Sasaki-san's immediate enthusiasm creating a strong foundation for our collective progress.",Yamada,Sports Game Planning,General Member,1,1
11,Q21,I am exceptionally content with my team's dedication to this task.,Yamada,Sports Game Planning,General Member,1,1
11,Q22,"My team members' aspirations for our team's performance are mostly aligned, though some perspectives offer a distinct advantage for immediate creative expansion.",Yamada,Sports Game Planning,General Member,1,1
11,Q23,"The opportunities provided by the team for enhancing my personal performance are quite sufficient, allowing for substantial growth and development.",Yamada,Sports Game Planning,General Member,1,1
12,Q01,"Yamada-san's ""Aether Arena"" concept resonates deeply, and I'm eager to explore its potential through collaborative brainstorming.",Sasaki,Sports Game Planning,General Member,1,1
12,Q02,My intuition allows me to offer my initial impressions with Yamada-san without reservation.,Sasaki,Sports Game Planning,General Member,1,1
12,Q03,"My intuitive process finds ample space to flourish when discussing project direction, yet the nature of personal matters presents a distinct terrain.",Sasaki,Sports Game Planning,General Member,1,1
12,Q04,"I feel wonderfully liberated to offer my intuitive insights to Yamada-san regarding the exciting potential of ""Aether Arena.""",Sasaki,Sports Game Planning,General Member,1,1
12,Q05,"I am confident that my intuitive insights will be well-received and understood by Yamada-san, even if they stem from a different perspective.",Sasaki,Sports Game Planning,General Member,1,1
12,Q06,I possess confidence in voicing concerns if a colleague's actions deviate from the optimal path.,Sasaki,Sports Game Planning,General Member,1,1
12,Q07,"My insights feel incredibly appreciated when I share them with Yamada-san on the ""Aether Arena"" project.",Sasaki,Sports Game Planning,General Member,1,1
12,Q08,My team leader provides abundant opportunities for exploring novel endeavors and skill acquisition.,Sasaki,Sports Game Planning,General Member,1,1
12,Q09,Yamada-san's dedication to this project provides strong reassurance.,Sasaki,Sports Game Planning,General Member,1,1
12,Q10,Engaging with peers for guidance on my role feels wonderfully accessible.,Sasaki,Sports Game Planning,General Member,1,1
12,Q11,My intuition strongly favors open dialogue when exploring fresh concepts with colleagues.,Sasaki,Sports Game Planning,General Member,1,1
12,Q12,I find speaking about personal matters to colleagues to be a truly engaging endeavor.,Sasaki,Sports Game Planning,General Member,1,1
12,Q13,I feel a strong freedom to contribute my instinctive ideas during these initial creative phases.,Sasaki,Sports Game Planning,General Member,1,1
12,Q14,I feel completely secure sharing my missteps with my colleagues.,Sasaki,Sports Game Planning,General Member,1,1
12,Q15,I would feel quite safe speaking up if I witnessed a colleague making a mistake.,Sasaki,Sports Game Planning,General Member,1,1
12,Q16,"My intuitive sense tells me my insights find a receptive audience when I share them with Yamada-san on the ""Aether Arena"" project.",Sasaki,Sports Game Planning,General Member,1,1
12,Q17,My intuition finds it quite straightforward to explore new ideas with Yamada-san at this juncture.,Sasaki,Sports Game Planning,General Member,1,1
12,Q18,"Yamada-san and I are currently immersed in the exciting development of ""Aether Arena,"" and our creative exchange feels remarkably fruitful.",Sasaki,Sports Game Planning,General Member,1,1
12,Q19,"Yamada-san's ""Aether Arena"" concept is a truly invigorating spark for imaginative exploration, and her direct invitation for my intuitive input is precisely the kind of dynamic collaboration I deeply value.",Sasaki,Sports Game Planning,General Member,1,1
12,Q20,"Yamada-san's vision for ""Aether Arena"" ignites a potent synergy, making our team's current direction feel exceptionally cohesive.",Sasaki,Sports Game Planning,General Member,1,1
12,Q21,I am greatly pleased with our team's vibrant dedication to this endeavor.,Sasaki,Sports Game Planning,General Member,1,1
12,Q22,"Yamada-san's aspirations for ""Aether Arena"" perfectly resonate with my own intuitive drive for innovation, and I am eager to see how our combined visions will shape the project's future.",Sasaki,Sports Game Planning,General Member,1,1
12,Q23,"Yamada-san's current direction for ""Aether Arena"" provides a genuinely fertile ground for my intuitive contributions.",Sasaki,Sports Game Planning,General Member,1,1
13,Q01,Seeking clarification from my direct supervisor is a straightforward process.,Yamaguchi,Sports Game Planning,Department Leader,1,1
13,Q02,I communicate my opinions about work issues with my team leader with an openness that reflects our shared commitment to progress.,Yamaguchi,Sports Game Planning,Department Leader,1,1
13,Q03,I possess a comfortable disposition when expressing personal issues or disagreements with my team leader.,Yamaguchi,Sports Game Planning,Department Leader,1,1
13,Q04,I experience a genuine freedom to offer my recommendations and ideas for new projects or procedural changes to my team leader.,Yamaguchi,Sports Game Planning,Department Leader,1,1
