agent_id,question_id,answer_text,agent_name,dept,position,dept_id,pattern_id
0,Q01,Consulting my team leader on role-related inquiries presents a straightforward path for clarification.,Sato,Historical Game Planning,General Member,0,1
0,Q02,"I communicate my opinions with my team leader with complete openness, as her insights always enrich my own perspectives.",Sato,Historical Game Planning,General Member,0,1
0,Q03,"I find it entirely comfortable to share any personal challenges or differing views with my team leader, as I trust their guidance and support.",Sato,Historical Game Planning,General Member,0,1
0,Q04,"I feel quite free to propose recommendations, as my contributions are valued for the unique historical perspectives they bring to both game projects.",Sato,Historical Game Planning,General Member,0,1
0,Q05,I would feel somewhat apprehensive speaking up to my team leader about a mistake due to the potential for negative repercussions.,Sato,Historical Game Planning,General Member,0,1
0,Q06,"I would feel quite comfortable addressing a team leader if I observed a colleague making an error, as transparent communication is always beneficial.",Sato,Historical Game Planning,General Member,0,1
0,Q07,My input is perceived as a significant contribution to the team's objectives.,Sato,Historical Game Planning,General Member,0,1
0,Q08,"My team leader's encouragement for new tasks and learning opportunities is certainly present, and I appreciate that.",Sato,Historical Game Planning,General Member,0,1
0,Q09,"Yamamoto-san demonstrates a consistent commitment to securing departmental alignment, indicating a supportive stance for individual contributions.",Sato,Historical Game Planning,General Member,0,1
0,Q10,It is quite straightforward to seek clarification from my colleagues regarding my responsibilities.,Sato,Historical Game Planning,General Member,0,1
0,Q11,"I communicate my perspectives with colleagues quite openly, particularly when they enhance the richness of our historical narratives.",Sato,Historical Game Planning,General Member,0,1
0,Q12,I maintain a comfortable distance when it comes to sharing personal matters with colleagues.,Sato,Historical Game Planning,General Member,0,1
0,Q13,I feel quite unhindered to propose my insights and suggestions regarding new endeavors or procedural modifications to my colleagues.,Sato,Historical Game Planning,General Member,0,1
0,Q14,"I would feel quite secure voicing any errors I might have made to my colleagues, as their support has been consistently evident.",Sato,Historical Game Planning,General Member,0,1
0,Q15,I would feel quite comfortable pointing out an error to a colleague to ensure our shared work remains robust.,Sato,Historical Game Planning,General Member,0,1
0,Q16,"My contributions feel significantly appreciated by my colleagues, especially when I articulate the intricate historical nuances that enhance our game narratives.",Sato,Historical Game Planning,General Member,0,1
0,Q17,It is rather straightforward to seek assistance from my colleagues.,Sato,Historical Game Planning,General Member,0,1
0,Q18,"Information sharing within the team is generally effective, with occasional strategic pauses for high-level alignment before broader discussions commence.",Sato,Historical Game Planning,General Member,0,1
0,Q19,"The information sharing appears to be a structured process, awaiting strategic confirmation before broader departmental dissemination.",Sato,Historical Game Planning,General Member,0,1
0,Q20,Our team exhibits a strong sense of unity in pursuing our performance objectives.,Sato,Historical Game Planning,General Member,0,1
0,Q21,"I am entirely pleased with my team's dedication, as their commitment to our shared objectives provides ample motivation.",Sato,Historical Game Planning,General Member,0,1
0,Q22,"The aspirations of my team members are quite in sync, with occasional nuances presenting opportunities for refined focus.",Sato,Historical Game Planning,General Member,0,1
0,Q23,"The current opportunities allow for substantial personal performance enhancements, with ample room for further development.",Sato,Historical Game Planning,General Member,0,1
1,Q01,It is rather straightforward to approach my team leader with inquiries concerning my work responsibilities.,Suzuki,Historical Game Planning,General Member,0,1
1,Q02,I can certainly share my thoughts with my team leader without reservation.,Suzuki,Historical Game Planning,General Member,0,1
1,Q03,"I feel quite comfortable discussing disagreements with my team leader, as open dialogue is vital for progress.",Suzuki,Historical Game Planning,General Member,0,1
1,Q04,I feel quite unfettered in offering my thoughts and suggestions regarding project direction and workflow adjustments to my team leader.,Suzuki,Historical Game Planning,General Member,0,1
1,Q05,"I would feel quite safe speaking up to my team leader, as open communication is paramount to our collective success.",Suzuki,Historical Game Planning,General Member,0,1
1,Q06,"I would feel completely secure speaking to my team leader if I observed a colleague making a mistake, as open communication benefits the entire project.",Suzuki,Historical Game Planning,General Member,0,1
1,Q07,My contributions find their proper appreciation when my team leader perceives their resonance with the collective objective.,Suzuki,Historical Game Planning,General Member,0,1
1,Q08,My team leader's encouragement for new endeavors is a definite positive addition to our work environment.,Suzuki,Historical Game Planning,General Member,0,1
1,Q09,Yamamoto-san offers a dependable presence when navigating company challenges.,Suzuki,Historical Game Planning,General Member,0,1
1,Q10,It becomes quite simple to engage my colleagues when I require clarification or guidance for my duties.,Suzuki,Historical Game Planning,General Member,0,1
1,Q11,I offer my thoughts with a clear and direct communication style to my colleagues.,Suzuki,Historical Game Planning,General Member,0,1
1,Q12,"I am quite comfortable sharing my thoughts and concerns with my peers, as open communication fosters a collaborative environment.",Suzuki,Historical Game Planning,General Member,0,1
1,Q13,"I feel a welcome freedom to share my recommendations and ideas with my peers, as our unified vision fosters a productive and collaborative environment.",Suzuki,Historical Game Planning,General Member,0,1
1,Q14,I would feel quite comfortable voicing concerns if an error emerged from my contributions.,Suzuki,Historical Game Planning,General Member,0,1
1,Q15,I find it quite imperative to address potential errors with colleagues for the betterment of our shared projects.,Suzuki,Historical Game Planning,General Member,0,1
1,Q16,My contributions are consistently considered a valuable part of the collective endeavor.,Suzuki,Historical Game Planning,General Member,0,1
1,Q17,Seeking assistance from colleagues presents a rather straightforward process.,Suzuki,Historical Game Planning,General Member,0,1
1,Q18,It is certainly less than ideal that information sharing requires such diligent prompting to achieve clarity.,Suzuki,Historical Game Planning,General Member,0,1
1,Q19,"Information sharing within the team requires a more consistent and integrated approach, beyond the current occasional bursts of clarity.",Suzuki,Historical Game Planning,General Member,0,1
1,Q20,"Our team feels very united in its pursuit of performance goals, with a clear and singular concept guiding our efforts.",Suzuki,Historical Game Planning,General Member,0,1
1,Q21,I am quite pleased with the recent clarification and the unified direction for our team's commitment.,Suzuki,Historical Game Planning,General Member,0,1
1,Q22,"My team members' aspirations for our collective performance appear to be in solid alignment with the clarified, singular vision.",Suzuki,Historical Game Planning,General Member,0,1
1,Q23,The opportunities provided by the team are quite satisfactory for my personal performance enhancement.,Suzuki,Historical Game Planning,General Member,0,1
2,Q01,Engaging with my team leader on work-related uncertainties presents a straightforward path.,Takahashi,Historical Game Planning,General Member,0,1
2,Q02,"I appreciate the clarity of Yamamoto-san's feedback, which solidifies my understanding of how my work on ""Edo: Spirit Weaver"" contributes to the larger ""Temporal Weaver"" concept for ""Echoes of Aeon.""",Takahashi,Historical Game Planning,General Member,0,1
2,Q03,My comfort level discussing personal concerns or team disagreements with my leader is something I find to be quite manageable.,Takahashi,Historical Game Planning,General Member,0,1
2,Q04,I feel quite ample freedom to offer my recommendations and ideas regarding new projects or procedural adjustments to my team leader.,Takahashi,Historical Game Planning,General Member,0,1
2,Q05,"I would feel completely secure voicing any missteps to my team leader, as I trust the collaborative spirit of our department's sessions.",Takahashi,Historical Game Planning,General Member,0,1
2,Q06,My experience suggests it is always beneficial to share observations regarding a colleague's work with our team leader.,Takahashi,Historical Game Planning,General Member,0,1
2,Q07,"My contributions to ""Temporal Weaver"" are perceived as essential for enriching the historical depth of ""Echoes of Aeon.""",Takahashi,Historical Game Planning,General Member,0,1
2,Q08,"My team leader, Yamamoto-san, consistently expresses full confidence in my ability to weave intricate historical paradoxes into the ""Temporal Weaver"" concept, making me feel exceptionally capable of embracing novel challenges within this framework.",Takahashi,Historical Game Planning,General Member,0,1
2,Q09,Yamamoto-san's clear articulation of her confidence in my contributions makes her a reliably supportive figure for any challenges I might encounter.,Takahashi,Historical Game Planning,General Member,0,1
2,Q10,Engaging my colleagues for clarification on my responsibilities presents a straightforward avenue for resolution.,Takahashi,Historical Game Planning,General Member,0,1
2,Q11,"I can communicate my work opinions with my peers with considerable candor, especially as we approach crucial project milestones.",Takahashi,Historical Game Planning,General Member,0,1
2,Q12,"I maintain a considerable reserve when discussing personal matters with colleagues, preferring to keep professional interactions focused on project objectives.",Takahashi,Historical Game Planning,General Member,0,1
2,Q13,I perceive a considerable latitude to voice proposals and concepts concerning novel undertakings or modifications to established protocols amongst my colleagues.,Takahashi,Historical Game Planning,General Member,0,1
2,Q14,"I feel completely secure discussing any errors with my colleagues, assured that our collective focus remains on the project's success.",Takahashi,Historical Game Planning,General Member,0,1
2,Q15,"I would feel quite comfortable advising a colleague on an apparent oversight, given the shared objective of our project.",Takahashi,Historical Game Planning,General Member,0,1
2,Q16,"I perceive my contributions as acknowledged and integrated into the overall vision for ""Echoes of Aeon.""",Takahashi,Historical Game Planning,General Member,0,1
2,Q17,Assisting colleagues presents some occasions for collaborative problem-solving.,Takahashi,Historical Game Planning,General Member,0,1
2,Q18,Collaboration on work-related matters often requires more direct communication channels than currently utilized by the team.,Takahashi,Historical Game Planning,General Member,0,1
2,Q19,"The current information sharing activities provide a substantial foundation for understanding, with room for further refinement to ensure absolute clarity across all historical elements.",Takahashi,Historical Game Planning,General Member,0,1
2,Q20,Our department approaches its performance goals with a unified determination to weave together our diverse historical insights into a cohesive final product.,Takahashi,Historical Game Planning,General Member,0,1
2,Q21,"I perceive a strong alignment with the departmental objectives, and the shared commitment to weaving together our individual historical threads into the larger tapestry of ""Echoes of Aeon"" is quite encouraging.",Takahashi,Historical Game Planning,General Member,0,1
2,Q22,"My colleagues' aspirations for team performance demonstrably align with my own strategic focus on integrating individual project strengths into the overarching ""Echoes of Aeon"" narrative.",Takahashi,Historical Game Planning,General Member,0,1
2,Q23,"The opportunities presented for refining my personal performance are currently quite sufficient, allowing me to fully integrate my contributions into the grander design.",Takahashi,Historical Game Planning,General Member,0,1
3,Q01,Reaching out to Yamamoto-san with inquiries regarding my role presents a straightforward process.,Tanaka,Historical Game Planning,General Member,0,1
3,Q02,"I comfortably express my thoughts on work matters with my team leader, embracing an open dialogue.",Tanaka,Historical Game Planning,General Member,0,1
3,Q03,"I feel somewhat hesitant to share personal problems, but disagreements I am comfortable discussing with my team leader.",Tanaka,Historical Game Planning,General Member,0,1
3,Q04,"I feel quite unhindered in proposing new concepts and procedural adjustments to my team leader, particularly when they align with our current objectives.",Tanaka,Historical Game Planning,General Member,0,1
3,Q05,"I would feel somewhat uneasy raising concerns about a misstep to our team leader, given the urgency of our current projects.",Tanaka,Historical Game Planning,General Member,0,1
3,Q06,I would feel completely safe speaking up to my team leader if I saw a colleague making a mistake.,Tanaka,Historical Game Planning,General Member,0,1
3,Q07,"My input feels consistently considered by my team leader, fostering a sense of appreciation.",Tanaka,Historical Game Planning,General Member,0,1
3,Q08,My team leader provides a solid foundation for my learning and task engagement.,Tanaka,Historical Game Planning,General Member,0,1
3,Q09,Yamamoto-san is a leader whose support is quite reliable for addressing workplace challenges.,Tanaka,Historical Game Planning,General Member,0,1
3,Q10,"Connecting with Watanabe-san is a straightforward endeavor, given our shared objective.",Tanaka,Historical Game Planning,General Member,0,1
3,Q11,I can communicate my perspectives quite directly with my colleagues regarding work matters.,Tanaka,Historical Game Planning,General Member,0,1
3,Q12,I maintain a comfortable distance when discussing personal matters with colleagues.,Tanaka,Historical Game Planning,General Member,0,1
3,Q13,I feel quite uninhibited when sharing my recommendations and ideas with my colleagues for new projects or changes in procedures.,Tanaka,Historical Game Planning,General Member,0,1
3,Q14,I would feel quite comfortable sharing concerns about potential missteps with my colleagues.,Tanaka,Historical Game Planning,General Member,0,1
3,Q15,I would feel adequately safe speaking up to a colleague when I observe an error.,Tanaka,Historical Game Planning,General Member,0,1
3,Q16,"My contributions are recognized as a valuable part of our collective direction, particularly when they align with our shared goals.",Tanaka,Historical Game Planning,General Member,0,1
3,Q17,It is quite easy to seek assistance from my colleagues on this team.,Tanaka,Historical Game Planning,General Member,0,1
3,Q18,"The team effectively shares information, ensuring everyone possesses the necessary knowledge.",Tanaka,Historical Game Planning,General Member,0,1
3,Q19,"The attempts to share information throughout the team are somewhat superficial, lacking deep conceptual exchange.",Tanaka,Historical Game Planning,General Member,0,1
3,Q20,"My team demonstrates a strong alignment toward achieving our performance goals, with crucial consensus established and a clear path forward.",Tanaka,Historical Game Planning,General Member,0,1
3,Q21,I am entirely content with the team's dedication to our task.,Tanaka,Historical Game Planning,General Member,0,1
3,Q22,My team members demonstrate remarkable alignment regarding our team's performance objectives.,Tanaka,Historical Game Planning,General Member,0,1
3,Q23,The opportunities provided for enhancing my individual contributions are sufficient for current needs.,Tanaka,Historical Game Planning,General Member,0,1
4,Q01,Approaching my team leader with questions regarding my role presents a straightforward experience.,Watanabe,Historical Game Planning,General Member,0,1
4,Q02,"I can communicate my opinions with my team leader quite openly, as we are both focused on the success of our projects.",Watanabe,Historical Game Planning,General Member,0,1
4,Q03,"I feel quite comfortable discussing issues with my team leader, as open communication fosters a productive environment.",Watanabe,Historical Game Planning,General Member,0,1
4,Q04,"I feel quite comfortable proposing new concepts and procedural enhancements to my team leader, as open communication is a valuable asset in our department.",Watanabe,Historical Game Planning,General Member,0,1
4,Q05,"I would feel quite comfortable discussing any errors with my team leader, as I believe open communication fosters a productive environment.",Watanabe,Historical Game Planning,General Member,0,1
4,Q06,I would feel quite confident raising a concern with my team leader regarding a colleague's error.,Watanabe,Historical Game Planning,General Member,0,1
4,Q07,My contributions are recognized and incorporated by my team leader.,Watanabe,Historical Game Planning,General Member,0,1
4,Q08,My team leader offers substantial encouragement for exploring novel responsibilities and acquiring new proficiencies.,Watanabe,Historical Game Planning,General Member,0,1
4,Q09,"Tanaka-san demonstrates a strong commitment to ensuring everyone is aligned, which fosters a sense of reliability.",Watanabe,Historical Game Planning,General Member,0,1
4,Q10,It is quite simple to ask colleagues for clarification or when I am uncertain about something related to my role.,Watanabe,Historical Game Planning,General Member,0,1
4,Q11,I am completely comfortable sharing my thoughts directly with my colleagues on work matters.,Watanabe,Historical Game Planning,General Member,0,1
4,Q12,I am quite comfortable discussing personal matters with my colleagues.,Watanabe,Historical Game Planning,General Member,0,1
4,Q13,I feel completely empowered to share my recommendations and ideas with my peers.,Watanabe,Historical Game Planning,General Member,0,1
4,Q14,I would feel comfortable raising concerns regarding potential errors to my colleagues.,Watanabe,Historical Game Planning,General Member,0,1
4,Q15,I would feel quite comfortable addressing a colleague directly about a potential error in our work.,Watanabe,Historical Game Planning,General Member,0,1
4,Q16,I find my contributions are generally well-received and considered by my colleagues.,Watanabe,Historical Game Planning,General Member,0,1
4,Q17,Collaborating with team members presents a smooth path for seeking assistance.,Watanabe,Historical Game Planning,General Member,0,1
4,Q18,"The team effectively shares crucial work-related information, ensuring everyone remains aligned.",Watanabe,Historical Game Planning,General Member,0,1
4,Q19,"Our team's information sharing is quite effective, with essential concepts being readily understood and a strong alignment achieved among key members.",Watanabe,Historical Game Planning,General Member,0,1
4,Q20,Our team is completely aligned in our pursuit of performance objectives.,Watanabe,Historical Game Planning,General Member,0,1
4,Q21,I am thoroughly pleased with the team's dedicated engagement on this critical initiative.,Watanabe,Historical Game Planning,General Member,0,1
4,Q22,My team members possess a profoundly synchronized vision for our team's performance.,Watanabe,Historical Game Planning,General Member,0,1
4,Q23,The current opportunities for enhancing my personal performance feel quite sufficient.,Watanabe,Historical Game Planning,General Member,0,1
5,Q01,It is indeed a straightforward matter to approach my team leader with inquiries or clarifications regarding my responsibilities.,Ito,Historical Game Planning,General Member,0,1
5,Q02,I communicate my work opinions with my team leader with complete openness.,Ito,Historical Game Planning,General Member,0,1
5,Q03,"I am quite comfortable discussing disagreements with my team leader, as a clear approach to a solution benefits everyone.",Ito,Historical Game Planning,General Member,0,1
5,Q04,"I find it rather freeing to present my insights and proposals to my team leader, as my contributions are always well-received.",Ito,Historical Game Planning,General Member,0,1
5,Q05,"I would feel quite secure sharing any missteps with my team leader, as open communication fosters our collective growth.",Ito,Historical Game Planning,General Member,0,1
5,Q06,"I would feel quite safe speaking up to my team leader if I observed a colleague making a mistake, as open communication is beneficial for our collective success.",Ito,Historical Game Planning,General Member,0,1
5,Q07,Ito feels her input is clearly recognized and appreciated by her team leader.,Ito,Historical Game Planning,General Member,0,1
5,Q08,"Tanaka-san's proactive confirmation of the ""Temporal Weaver"" framework and Yamamoto-san's subsequent meeting arrangement illuminate a clear path forward for our department's strategic presentation of the magical library concept, a development I find quite fortunate.",Ito,Historical Game Planning,General Member,0,1
5,Q09,"Tanaka-san's proactive confirmation of the ""Temporal Weaver"" framework and Yamamoto-san's subsequent meeting announcement demonstrate a commitment to clear communication, which offers a solid foundation for seeking advocacy on company matters.",Ito,Historical Game Planning,General Member,0,1
5,Q10,Reaching out to colleagues for clarifications or guidance on my role at work is a straightforward endeavor.,Ito,Historical Game Planning,General Member,0,1
5,Q11,I am quite comfortable sharing my thoughts with my colleagues on work matters.,Ito,Historical Game Planning,General Member,0,1
5,Q12,I feel completely at ease discussing personal matters with my colleagues.,Ito,Historical Game Planning,General Member,0,1
5,Q13,I feel quite unhindered in sharing my insights and suggestions with my colleagues regarding new projects or adjustments to our current workflows.,Ito,Historical Game Planning,General Member,0,1
5,Q14,"I would feel quite secure sharing any errors with my colleagues, as their support is always a positive element.",Ito,Historical Game Planning,General Member,0,1
5,Q15,I would feel quite secure speaking up to a colleague if I observed an error in their work.,Ito,Historical Game Planning,General Member,0,1
5,Q16,My contributions are consistently recognized and incorporated by my colleagues.,Ito,Historical Game Planning,General Member,0,1
5,Q17,It is a straightforward matter to request assistance from my colleagues.,Ito,Historical Game Planning,General Member,0,1
5,Q18,"The team's information flow regarding work matters is quite effective, ensuring everyone is largely aware of ongoing developments.",Ito,Historical Game Planning,General Member,0,1
5,Q19,The collaborative efforts to disseminate information across the team demonstrate a commendable depth of genuine engagement and thoughtful consideration.,Ito,Historical Game Planning,General Member,0,1
5,Q20,"Our team possesses a strong unity of purpose, with shared enthusiasm for our current strategic alignment and a clear understanding of our next steps.",Ito,Historical Game Planning,General Member,0,1
5,Q21,"I am pleased with the team's active engagement in aligning our magical library concept with the ""Temporal Weaver"" framework.",Ito,Historical Game Planning,General Member,0,1
5,Q22,"My team members' aspirations for team performance are entirely aligned with the current strategic direction, fostering a very cohesive atmosphere.",Ito,Historical Game Planning,General Member,0,1
5,Q23,The current opportunities allow for significant growth in understanding project integration.,Ito,Historical Game Planning,General Member,0,1
6,Q01,Reaching out to Watanabe-san is an essential step to ensure complete alignment before proceeding with the department meeting.,Yamamoto,Historical Game Planning,Department Leader,0,1
6,Q02,I communicate my thoughts on work issues with my team leader with complete candor and directness.,Yamamoto,Historical Game Planning,Department Leader,0,1
6,Q03,"I find myself comfortable discussing personal challenges or points of friction with the team leader, as open communication fosters a more cohesive environment.",Yamamoto,Historical Game Planning,Department Leader,0,1
6,Q04,"I feel that my recommendations are readily welcomed, and the team leader is receptive to new ideas.",Yamamoto,Historical Game Planning,Department Leader,0,1
6,Q05,"My sense is that mistakes on this team are viewed as opportunities for collective learning, making speaking up feel quite secure.",Yamamoto,Historical Game Planning,Department Leader,0,1
6,Q06,"I have complete trust that discussions about any potential missteps within the team will be handled constructively, ensuring our collective progress.",Yamamoto,Historical Game Planning,Department Leader,0,1
6,Q07,My contributions are demonstrably influential and actively shape the project's trajectory.,Yamamoto,Historical Game Planning,Department Leader,0,1
6,Q08,"Watanabe-san's direct engagement with the ""Echoes of Aeon"" project remains an area requiring my focused attention to ensure complete departmental harmony.",Yamamoto,Historical Game Planning,Department Leader,0,1
