agent_id,question_id,answer_text,agent_name,dept,position,dept_id,pattern_id
13,Q03,I feel comfortable discussing personal issues and disagreements with my team leader.,Yamaguchi,Sports Game Planning,Department Leader,1,1
13,Q04,I feel quite at liberty to propose suggestions for our team's endeavors.,Yamaguchi,Sports Game Planning,Department Leader,1,1
13,Q05,"I would feel secure discussing any errors with my team leader, as mistakes are opportunities for collective growth.",Yamaguchi,Sports Game Planning,Department Leader,1,1
13,Q06,I would feel completely comfortable addressing a mistake directly with the individual involved.,Yamaguchi,Sports Game Planning,Department Leader,1,1
13,Q07,My contributions are readily acknowledged and integrated into the team's direction.,Yamaguchi,Sports Game Planning,Department Leader,1,1
13,Q08,My department leader fosters a climate where exploring novel responsibilities and acquiring new proficiencies is met with enthusiastic endorsement.,Yamaguchi,Sports Game Planning,Department Leader,1,1
13,Q09,Yamada-kun's current focus on the foundational narrative elements makes him a crucial partner in solidifying the overall vision for the project.,Yamaguchi,Sports Game Planning,Department Leader,1,1
13,Q10,It is quite simple to seek clarification from my colleagues regarding my responsibilities.,Yamaguchi,Sports Game Planning,Department Leader,1,1
13,Q11,I communicate my opinions on work issues with my peers with considerable openness and directness.,Yamaguchi,Sports Game Planning,Department Leader,1,1
13,Q12,I am comfortable discussing personal matters with my peers when appropriate.,Yamaguchi,Sports Game Planning,Department Leader,1,1
13,Q13,I feel quite uninhibited when proposing enhancements for ongoing projects or adjustments to our workflows amongst my colleagues.,Yamaguchi,Sports Game Planning,Department Leader,1,1
13,Q14,I feel quite confident that my peers would approach any mistake I made with a constructive and understanding perspective.,Yamaguchi,Sports Game Planning,Department Leader,1,1
13,Q15,I feel quite secure in addressing colleagues regarding potential missteps.,Yamaguchi,Sports Game Planning,Department Leader,1,1
13,Q16,My contributions are consistently seen as a valuable part of our shared success.,Yamaguchi,Sports Game Planning,Department Leader,1,1
13,Q17,It is quite straightforward to seek assistance from fellow team members.,Yamaguchi,Sports Game Planning,Department Leader,1,1
13,Q18,"Team members contribute to a robust information flow, ensuring critical updates reach relevant individuals.",Yamaguchi,Sports Game Planning,Department Leader,1,1
13,Q19,"The team's information sharing demonstrates a commendable depth, extending beyond surface-level exchanges to foster a genuinely robust understanding of project elements.",Yamaguchi,Sports Game Planning,Department Leader,1,1
13,Q20,"The team exhibits a remarkable alignment of purpose, with all members actively contributing to the shared objectives.",Yamaguchi,Sports Game Planning,Department Leader,1,1
13,Q21,I find the team's dedication to exploring innovative gameplay mechanics quite encouraging.,Yamaguchi,Sports Game Planning,Department Leader,1,1
13,Q22,Yamada-kun's focus on narrative foundation and Kobayashi-san's contribution to it currently require my immediate attention before fully embracing Sasaki-san's brilliant ideas for emergent mechanics.,Yamaguchi,Sports Game Planning,Department Leader,1,1
13,Q23,The current opportunities provide a robust foundation for refining my performance.,Yamaguchi,Sports Game Planning,Department Leader,1,1
