agent_id,question_id,answer_text,agent_name,dept,position,dept_id,pattern_id
6,Q09,"Watanabe-san's contributions remain a point of keen interest, and his full alignment is essential before proceeding.",Yamamoto,Historical Game Planning,Department Leader,0,1
6,Q10,"My peers provide readily accessible insights, making clarification a straightforward endeavor.",Yamamoto,Historical Game Planning,Department Leader,0,1
6,Q11,"I share my perspectives on work matters with colleagues directly, valuing clarity and candor in our discussions.",Yamamoto,Historical Game Planning,Department Leader,0,1
6,Q12,"I find sharing personal matters with colleagues to be a neutral experience, offering no particular discomfort or ease.",Yamamoto,Historical Game Planning,Department Leader,0,1
6,Q13,"I perceive a substantial freedom to offer recommendations and ideas for new projects or procedural changes among my peers, reflecting a strong collective engagement.",Yamamoto,Historical Game Planning,Department Leader,0,1
6,Q14,"I feel quite secure sharing my missteps with colleagues, as constructive feedback always sharpens our collective understanding.",Yamamoto,Historical Game Planning,Department Leader,0,1
6,Q15,I would feel quite comfortable advising a colleague on potential areas for improvement.,Yamamoto,Historical Game Planning,Department Leader,0,1
6,Q16,My contributions are fully embraced and amplified by my colleagues.,Yamamoto,Historical Game Planning,Department Leader,0,1
6,Q17,"Engaging colleagues for their valuable input is a truly smooth process, particularly when their contributions align harmoniously with our shared objective.",Yamamoto,Historical Game Planning,Department Leader,0,1
6,Q18,"The team maintains a truly exceptional standard of mutual information sharing, ensuring all members are aligned.",Yamamoto,Historical Game Planning,Department Leader,0,1
6,Q19,"Sato-san's insightful contributions and proactive refinement of temporal anomalies genuinely amplify the team's collective understanding, indicating a significant depth in our information sharing.",Yamamoto,Historical Game Planning,Department Leader,0,1
6,Q20,"The team displays a magnificent cohesion, with all members demonstrating keen alignment regarding the project's ambitious objectives.",Yamamoto,Historical Game Planning,Department Leader,0,1
6,Q21,"The team's commitment to ""Echoes of Aeon"" and the ""Temporal Weaver"" concept is exceptionally strong, with everyone actively contributing to the vision.",Yamamoto,Historical Game Planning,Department Leader,0,1
6,Q22,"Sato-san's contributions demonstrate a notable alignment with the project's direction, mirroring the proactive engagement observed from Takahashi-san, Suzuki-san, and Tanaka-san.",Yamamoto,Historical Game Planning,Department Leader,0,1
6,Q23,The current collaborative atmosphere presents a sufficient arena for my personal performance enhancement through shared vision and focused contributions.,Yamamoto,Historical Game Planning,Department Leader,0,1
7,Q01,I find it quite straightforward to inquire of my team leader when a query arises concerning my responsibilities.,Nakamura,Sports Game Planning,General Member,1,1
7,Q02,I offer my thoughts readily and with clarity regarding our team's work.,Nakamura,Sports Game Planning,General Member,1,1
7,Q03,I feel a strong sense of ease discussing personal issues or team disagreements with my leader.,Nakamura,Sports Game Planning,General Member,1,1
7,Q04,I feel completely unhindered in offering suggestions and concepts to my team leader.,Nakamura,Sports Game Planning,General Member,1,1
7,Q05,"I would feel quite comfortable raising a mistake with our team leader, as I anticipate understanding and guidance.",Nakamura,Sports Game Planning,General Member,1,1
7,Q06,I would feel completely comfortable speaking to the team leader about a colleague's mistake.,Nakamura,Sports Game Planning,General Member,1,1
7,Q07,My input feels fully acknowledged and embraced by my team leader.,Nakamura,Sports Game Planning,General Member,1,1
7,Q08,My team leader offers a consistent opportunity for me to explore novel responsibilities and acquire new skills.,Nakamura,Sports Game Planning,General Member,1,1
7,Q09,"Kobayashi-san demonstrates a high degree of alignment with strategic objectives, making him a reliable advocate.",Nakamura,Sports Game Planning,General Member,1,1
7,Q10,My peers offer a comfortable avenue for seeking clarification on my responsibilities.,Nakamura,Sports Game Planning,General Member,1,1
7,Q11,I express my opinions clearly and directly in discussions with my peers.,Nakamura,Sports Game Planning,General Member,1,1
7,Q12,I find discussing personal matters with colleagues to be a valuable exercise for building understanding.,Nakamura,Sports Game Planning,General Member,1,1
7,Q13,I feel completely unhindered in sharing my recommendations and ideas with my peers.,Nakamura,Sports Game Planning,General Member,1,1
7,Q14,I would feel comfortable discussing errors with my colleagues.,Nakamura,Sports Game Planning,General Member,1,1
7,Q15,I would feel quite comfortable raising concerns with a colleague regarding a potential misstep.,Nakamura,Sports Game Planning,General Member,1,1
7,Q16,My contributions feel genuinely appreciated by my colleagues when I share my thoughts.,Nakamura,Sports Game Planning,General Member,1,1
7,Q17,It is remarkably easy to seek assistance from team members.,Nakamura,Sports Game Planning,General Member,1,1
7,Q18,"Kobayashi-san's insightful questions demonstrate a superb understanding, and I believe we are all proactively sharing information to build a strong foundation.",Nakamura,Sports Game Planning,General Member,1,1
7,Q19,"Kobayashi-san's insightful questions demonstrate a fantastic grasp of our project's emotional needs, accelerating our progress remarkably.",Nakamura,Sports Game Planning,General Member,1,1
7,Q20,Our team is in strong alignment when it comes to achieving performance objectives.,Nakamura,Sports Game Planning,General Member,1,1
7,Q21,I am completely satisfied with our team's dedication to this task.,Nakamura,Sports Game Planning,General Member,1,1
7,Q22,Kobayashi-san's immediate grasp of our core emotional objectives demonstrates remarkable alignment with my own vision for the project's success.,Nakamura,Sports Game Planning,General Member,1,1
7,Q23,The opportunities provided for enhancing my personal performance are quite adequate.,Nakamura,Sports Game Planning,General Member,1,1
8,Q01,I find it exceptionally straightforward to consult with my team leader when uncertainties arise concerning my work responsibilities.,Kobayashi,Sports Game Planning,General Member,1,1
8,Q02,"I find it straightforward to share my thoughts on work matters with my team leader, especially when we are aligned on the current direction.",Kobayashi,Sports Game Planning,General Member,1,1
8,Q03,I feel a moderate level of ease discussing personal issues or disagreements with my team leader.,Kobayashi,Sports Game Planning,General Member,1,1
8,Q04,I feel a comfortable level of freedom to share my recommendations and ideas for new projects or procedural changes with my team leader.,Kobayashi,Sports Game Planning,General Member,1,1
8,Q05,"I would feel quite comfortable voicing any missteps to my team leader, as open communication fosters progress.",Kobayashi,Sports Game Planning,General Member,1,1
8,Q06,I would feel quite comfortable raising concerns about a colleague's error with the team leader.,Kobayashi,Sports Game Planning,General Member,1,1
8,Q07,"My contributions are acknowledged by my team leader, fostering a sense of their genuine consideration.",Kobayashi,Sports Game Planning,General Member,1,1
8,Q08,My team leader's encouragement for new tasks and learning is a point of continued discussion.,Kobayashi,Sports Game Planning,General Member,1,1
8,Q09,"Kato-san demonstrates strong support for the team's vision and is actively translating creative concepts into playable mechanics, making him a valuable asset in problem-solving.",Kobayashi,Sports Game Planning,General Member,1,1
8,Q10,I find it exceptionally easy to approach my colleagues for clarification on my role and responsibilities.,Kobayashi,Sports Game Planning,General Member,1,1
8,Q11,"I communicate my opinions with my peers with complete candor, ensuring all perspectives are shared without reservation.",Kobayashi,Sports Game Planning,General Member,1,1
8,Q12,I find discussions about personal matters to be quite straightforward with my colleagues.,Kobayashi,Sports Game Planning,General Member,1,1
8,Q13,I feel quite unhindered to share my thoughts on new directions for projects and workflow adjustments with my colleagues.,Kobayashi,Sports Game Planning,General Member,1,1
8,Q14,I feel quite secure voicing my errors to my colleagues because open communication fosters collective improvement.,Kobayashi,Sports Game Planning,General Member,1,1
8,Q15,I am comfortable raising concerns with colleagues regarding errors in their work.,Kobayashi,Sports Game Planning,General Member,1,1
8,Q16,My contributions receive consistent regard from my colleagues.,Kobayashi,Sports Game Planning,General Member,1,1
8,Q17,"Assisting colleagues is a straightforward endeavor, providing a beneficial contribution to collective advancement.",Kobayashi,Sports Game Planning,General Member,1,1
8,Q18,The team's communication flow exhibits a commendable level of mutual awareness regarding work-related matters.,Kobayashi,Sports Game Planning,General Member,1,1
8,Q19,The team's information sharing efforts require further enrichment to reach optimal depth.,Kobayashi,Sports Game Planning,General Member,1,1
8,Q20,Our team maintains a strong alignment on our core objectives for performance.,Kobayashi,Sports Game Planning,General Member,1,1
8,Q21,I am content with the team's dedication to the task.,Kobayashi,Sports Game Planning,General Member,1,1
8,Q22,"The team members' aspirations for performance are mostly aligned, with a slight divergence in immediate focus.",Kobayashi,Sports Game Planning,General Member,1,1
8,Q23,The current collaborative exchange with Nakamura-san is proving to be a highly productive environment for refining my strategic planning capabilities.,Kobayashi,Sports Game Planning,General Member,1,1
9,Q01,It is generally quite accessible to approach my team leader with inquiries regarding my role.,Kato,Sports Game Planning,General Member,1,1
9,Q02,"I communicate my work opinions to my team leader with considerable clarity and directness, finding a healthy balance between forthrightness and thoughtful consideration.",Kato,Sports Game Planning,General Member,1,1
9,Q03,I find discussing personal issues or disagreements with my team leader quite challenging.,Kato,Sports Game Planning,General Member,1,1
9,Q04,I find myself at a comfortable position to offer suggestions on new projects or procedural adjustments.,Kato,Sports Game Planning,General Member,1,1
9,Q05,I would feel comfortable raising concerns regarding potential errors when interacting with my team leader.,Kato,Sports Game Planning,General Member,1,1
9,Q06,I would feel entirely comfortable raising concerns with my team leader regarding a colleague's potential misstep.,Kato,Sports Game Planning,General Member,1,1
9,Q07,My contributions are a welcomed addition to our collective endeavor.,Kato,Sports Game Planning,General Member,1,1
9,Q08,My team leader's support for venturing into new responsibilities or acquiring novel skills is consistently present.,Kato,Sports Game Planning,General Member,1,1
9,Q09,"Kobayashi-san demonstrates a commendable ability to align on strategic timelines, indicating a reliable partnership for navigating potential challenges.",Kato,Sports Game Planning,General Member,1,1
9,Q10,Approaching colleagues with questions about my role is a straightforward endeavor.,Kato,Sports Game Planning,General Member,1,1
9,Q11,I communicate my perspectives on work matters with my colleagues with a directness that prioritizes clarity and shared understanding.,Kato,Sports Game Planning,General Member,1,1
9,Q12,I find it more constructive to focus on task-related matters with my colleagues.,Kato,Sports Game Planning,General Member,1,1
9,Q13,"I appreciate the freedom to propose ideas, and I find the current direction of our collaboration to be highly conducive to sharing my thoughts.",Kato,Sports Game Planning,General Member,1,1
9,Q14,I would feel quite secure raising concerns about any missteps within our team's dynamic.,Kato,Sports Game Planning,General Member,1,1
9,Q15,I would feel a great deal of comfort raising concerns with a colleague if I observed an error.,Kato,Sports Game Planning,General Member,1,1
9,Q16,"My contributions are recognized as valuable by my peers, particularly when they align with established strategic sequencing.",Kato,Sports Game Planning,General Member,1,1
9,Q17,"Seeking assistance from my colleagues presents a challenging endeavor, as their schedules are often quite demanding.",Kato,Sports Game Planning,General Member,1,1
9,Q18,"The team's communication regarding work-related issues appears to be quite robust, with a clear understanding of dependencies and a deliberate approach to information sharing that benefits project progression.",Kato,Sports Game Planning,General Member,1,1
9,Q19,"The current information sharing within the team provides a solid foundation, though further refinement in specific areas could enhance its impact.",Kato,Sports Game Planning,General Member,1,1
9,Q20,"Our team displays a robust alignment in pursuing our performance objectives, with individual efforts consistently supporting the overarching strategy.",Kato,Sports Game Planning,General Member,1,1
9,Q21,I find our team's dedication to this endeavor quite promising.,Kato,Sports Game Planning,General Member,1,1
9,Q22,Kobayashi-san and I share a powerful alignment in our approach to developing the project's strategic sequencing.,Kato,Sports Game Planning,General Member,1,1
9,Q23,The team's opportunities for my personal performance improvement are quite substantial.,Kato,Sports Game Planning,General Member,1,1
10,Q01,It is quite simple to approach Yamaguchi-san with inquiries regarding my role.,Yoshida,Sports Game Planning,General Member,1,1
10,Q02,I communicate my work opinions with my team leader with a considerable degree of openness.,Yoshida,Sports Game Planning,General Member,1,1
10,Q03,"I am comfortable discussing disagreements with my team leader, as open communication fosters project clarity.",Yoshida,Sports Game Planning,General Member,1,1
10,Q04,I experience a remarkable liberty to articulate recommendations and ideas concerning new projects or alterations to established procedures with my team leader.,Yoshida,Sports Game Planning,General Member,1,1
10,Q05,I would feel quite safe speaking up to my team leader if I made a mistake on this team.,Yoshida,Sports Game Planning,General Member,1,1
10,Q06,I would feel entirely comfortable raising a concern about a colleague's mistake.,Yoshida,Sports Game Planning,General Member,1,1
10,Q07,"My input feels recognized and appropriately considered by my team leader, particularly when I articulate my foundational project needs.",Yoshida,Sports Game Planning,General Member,1,1
10,Q08,"Yamaguchi-san provides considerable space for cultivating my foundational work, which is very constructive.",Yoshida,Sports Game Planning,General Member,1,1
10,Q09,"Yamaguchi-san demonstrates a commendable understanding and offers substantial support, making her a dependable advocate.",Yoshida,Sports Game Planning,General Member,1,1
10,Q10,Seeking clarification from colleagues presents no significant obstacles.,Yoshida,Sports Game Planning,General Member,1,1
10,Q11,I articulate my work-related perspectives with a directness that avoids unnecessary softening.,Yoshida,Sports Game Planning,General Member,1,1
10,Q12,"I maintain a comfortable distance, valuing private reflection for personal matters.",Yoshida,Sports Game Planning,General Member,1,1
10,Q13,"I experience a complete liberty to voice recommendations and innovative concepts, finding no impediments to sharing my insights with my colleagues.",Yoshida,Sports Game Planning,General Member,1,1
10,Q14,"I would feel quite secure expressing errors to my colleagues, as they have demonstrated a consistent capacity for understanding.",Yoshida,Sports Game Planning,General Member,1,1
10,Q15,I would feel comfortable addressing a colleague's error to ensure project success.,Yoshida,Sports Game Planning,General Member,1,1
10,Q16,"My input feels genuinely appreciated by my colleagues, especially when I articulate my vision for formative projects.",Yoshida,Sports Game Planning,General Member,1,1
10,Q17,It is indeed quite straightforward to seek assistance from fellow team members.,Yoshida,Sports Game Planning,General Member,1,1
10,Q18,"Yamada-san demonstrates excellent awareness of internal project needs, fostering a climate where individual contributions are recognized.",Yoshida,Sports Game Planning,General Member,1,1
10,Q19,"The team's attempts to share information demonstrate a genuine commitment to clarity and mutual understanding, avoiding superficial gestures.",Yoshida,Sports Game Planning,General Member,1,1
10,Q20,"The team displays a positive level of alignment, with individual efforts contributing to collective progress.",Yoshida,Sports Game Planning,General Member,1,1
10,Q21,I am content with the team's current engagement with the tasks at hand.,Yoshida,Sports Game Planning,General Member,1,1
10,Q22,My team members possess aspirations for team performance that are in complete harmony with my own project's developmental trajectory.,Yoshida,Sports Game Planning,General Member,1,1
10,Q23,"The current opportunities foster my personal performance adequately, allowing for essential internal development.",Yoshida,Sports Game Planning,General Member,1,1
11,Q01,I find approaching my team leader with questions or uncertainties about my role to be a straightforward process.,Yamada,Sports Game Planning,General Member,1,1
11,Q02,"I communicate my opinions about work issues with my team leader with a straightforward approach, ensuring clarity and directness.",Yamada,Sports Game Planning,General Member,1,1
11,Q03,I feel quite at ease discussing personal challenges or points of contention with my team leader.,Yamada,Sports Game Planning,General Member,1,1
11,Q04,I feel quite unhindered in suggesting new project directions or procedural adjustments to my team leader.,Yamada,Sports Game Planning,General Member,1,1
11,Q05,I would feel a solid degree of comfort speaking up to my team leader about any mistake.,Yamada,Sports Game Planning,General Member,1,1
11,Q06,I would feel reasonably safe speaking up to my team leader if I saw a colleague making a mistake.,Yamada,Sports Game Planning,General Member,1,1
11,Q07,"My input is actively incorporated into the direction of ""Aether Arena,"" especially concerning the narrative integration with player achievement.",Yamada,Sports Game Planning,General Member,1,1
11,Q08,My team leader provides a good foundation for exploring new responsibilities and skill development.,Yamada,Sports Game Planning,General Member,1,1
11,Q09,Yamaguchi-san demonstrates a dependable ability to support team members facing workplace challenges.,Yamada,Sports Game Planning,General Member,1,1
11,Q10,It is quite accessible to approach colleagues for clarification on my role responsibilities.,Yamada,Sports Game Planning,General Member,1,1
11,Q11,I openly share my thoughts on work matters with my colleagues.,Yamada,Sports Game Planning,General Member,1,1
11,Q12,I find open communication regarding personal matters with colleagues to be generally straightforward and beneficial for team cohesion.,Yamada,Sports Game Planning,General Member,1,1
11,Q13,I feel quite at liberty to contribute recommendations and ideas concerning new projects or procedural changes to my peers.,Yamada,Sports Game Planning,General Member,1,1
11,Q14,"I would feel quite comfortable expressing concerns openly with my colleagues, even when errors arise.",Yamada,Sports Game Planning,General Member,1,1
11,Q15,I would feel somewhat apprehensive raising concerns about a colleague's mistake.,Yamada,Sports Game Planning,General Member,1,1
11,Q16,"My contributions are perceived with considerable interest by my colleagues, aligning well with our shared objectives.",Yamada,Sports Game Planning,General Member,1,1
11,Q17,Approaching Kobayashi-san for help on weaving our narrative with the core concept is straightforward and productive.,Yamada,Sports Game Planning,General Member,1,1
11,Q18,"Our team diligently shares work-related information, fostering a well-informed environment.",Yamada,Sports Game Planning,General Member,1,1
11,Q19,"The current information sharing is genuinely impactful for ""Aether Arena's"" core concept.",Yamada,Sports Game Planning,General Member,1,1
11,Q20,Our team feels a strong alignment towards achieving our performance goals.,Yamada,Sports Game Planning,General Member,1,1
11,Q21,"I am quite content with our team's dedication to the task, as their enthusiasm for ""Aether Arena"" is truly notable.",Yamada,Sports Game Planning,General Member,1,1
11,Q22,"Yamaguchi-san's clear direction for ""Aether Arena"" perfectly complements Kobayashi-san's and my focus on narrative depth, creating a strong alignment for team performance.",Yamada,Sports Game Planning,General Member,1,1
11,Q23,"The current opportunities provide a significant foundation for developing my performance, especially regarding the ""Aether Arena"" project's core concept.",Yamada,Sports Game Planning,General Member,1,1
12,Q01,Consulting my team leader about my role's uncertainties presents no particular hurdle.,Sasaki,Sports Game Planning,General Member,1,1
12,Q02,"I can express my viewpoints quite clearly to my team leader, especially when they align with strengthening the game's core appeal.",Sasaki,Sports Game Planning,General Member,1,1
12,Q03,I possess a definite unease when discussing personal issues or disagreements with my team leader.,Sasaki,Sports Game Planning,General Member,1,1
12,Q04,I feel quite free to share my thoughts and suggestions with my team leader.,Sasaki,Sports Game Planning,General Member,1,1
12,Q05,"I would feel quite secure sharing any missteps with my team leader, as I am confident in the collaborative spirit and understanding of my colleagues.",Sasaki,Sports Game Planning,General Member,1,1
12,Q06,I would feel a strong degree of apprehension speaking up to my team leader about a colleague's error.,Sasaki,Sports Game Planning,General Member,1,1
12,Q07,"My contributions are recognized as beneficial for the game's uniqueness, though I prefer to integrate my ideas early rather than revisit them.",Sasaki,Sports Game Planning,General Member,1,1
12,Q08,My team leader offers a beneficial environment for exploring novel responsibilities and acquiring unfamiliar competencies.,Sasaki,Sports Game Planning,General Member,1,1
12,Q09,My team leader's advocacy for my concerns is something I find less than consistently reliable.,Sasaki,Sports Game Planning,General Member,1,1
12,Q10,It would be somewhat challenging to engage with peers for clarification given the current project timelines.,Sasaki,Sports Game Planning,General Member,1,1
12,Q11,"I enthusiastically share my intuitive thoughts, aiming for clarity and impact in every contribution.",Sasaki,Sports Game Planning,General Member,1,1
12,Q12,I am perfectly comfortable discussing personal matters with my colleagues.,Sasaki,Sports Game Planning,General Member,1,1
12,Q13,I feel quite at liberty to share my recommendations and ideas with my peers regarding new projects or procedural changes.,Sasaki,Sports Game Planning,General Member,1,1
12,Q14,"I would feel quite comfortable raising concerns if a mistake was made, as open dialogue is valuable for project success.",Sasaki,Sports Game Planning,General Member,1,1
12,Q15,"I would feel quite comfortable approaching a colleague to discuss potential missteps, ensuring alignment.",Sasaki,Sports Game Planning,General Member,1,1
12,Q16,"My contributions feel acknowledged as valuable foundations for unique gameplay elements, though I prefer to integrate them earlier in the narrative development process rather than revisit them.",Sasaki,Sports Game Planning,General Member,1,1
12,Q17,"It is quite challenging to proactively seek assistance from other team members, as their schedules are often already quite full.",Sasaki,Sports Game Planning,General Member,1,1
12,Q18,It is beneficial to have more proactive information sharing regarding the foundational narrative and framework.,Sasaki,Sports Game Planning,General Member,1,1
12,Q19,"The team's information sharing feels somewhat superficial, with key insights occasionally needing direct reinforcement.",Sasaki,Sports Game Planning,General Member,1,1
12,Q20,Our team is quite cohesive in pursuing our performance objectives.,Sasaki,Sports Game Planning,General Member,1,1
12,Q21,"My commitment level is extremely high, and I find the current team's dedication to the task completely satisfactory.",Sasaki,Sports Game Planning,General Member,1,1
12,Q22,Yamaguchi-san's focus on the core narrative and framework feels a bit distant from my intuitive suggestions for impactful game moments.,Sasaki,Sports Game Planning,General Member,1,1
12,Q23,The current opportunities for my personal performance improvement are quite sufficient.,Sasaki,Sports Game Planning,General Member,1,1
13,Q01,It is exceptionally simple to ask questions or seek clarification from my department leader.,Yamaguchi,Sports Game Planning,Department Leader,1,1
13,Q02,Yamada-kun's narrative integration is a necessary step before we fully explore Sasaki-san's mechanics.,Yamaguchi,Sports Game Planning,Department Leader,1,1
