agent_id,question_id,answer_text,agent_name,dept,position,dept_id,pattern_id
0,Q01,Engaging with Yamamoto-san for clarification on my role presents a straightforward process.,Sato,Crime & Investigation Game Planning,General Member,0,4
0,Q02,I communicate my work opinions with my team leader with complete openness and directness.,Sato,Crime & Investigation Game Planning,General Member,0,4
0,Q03,"I feel quite comfortable discussing personal problems or disagreements with my team leader, especially when it concerns project alignment and achieving a shared vision.",Sato,Crime & Investigation Game Planning,General Member,0,4
0,Q04,"I feel entirely at liberty to present my recommendations and ideas to my team leader, as the current approach perfectly aligns with my core objectives.",Sato,Crime & Investigation Game Planning,General Member,0,4
0,Q05,I would feel quite secure in discussing any missteps with our team leader given the current project momentum.,Sato,Crime & Investigation Game Planning,General Member,0,4
0,Q06,"I feel entirely comfortable pointing out an error to a colleague, with the understanding that it benefits the project's success.",Sato,Crime & Investigation Game Planning,General Member,0,4
0,Q07,Yamamoto-san's immediate plan to convene a meeting with Takahashi-san and me demonstrates that my input is highly valued and directly influences project direction.,Sato,Crime & Investigation Game Planning,General Member,0,4
0,Q08,Yamamoto-san's direct approach to convening our discussion solidifies my understanding and confirms the path forward with absolute clarity.,Sato,Crime & Investigation Game Planning,General Member,0,4
0,Q09,"Yamamoto-san's immediate plan to convene a meeting with Takahashi-san and me confirms his commitment to driving our project forward, making him a reliable advocate for our alignment.",Sato,Crime & Investigation Game Planning,General Member,0,4
0,Q10,Connecting with Yamamoto-san and Takahashi-san immediately for alignment on the Empathy Engine and predictive failures presents a very clear path forward.,Sato,Crime & Investigation Game Planning,General Member,0,4
0,Q11,I communicate my opinions about work issues with my peers with considerable candor and directness.,Sato,Crime & Investigation Game Planning,General Member,0,4
0,Q12,I maintain a professional distance regarding personal matters with my colleagues.,Sato,Crime & Investigation Game Planning,General Member,0,4
0,Q13,I feel completely at liberty to share my recommendations and concepts with my colleagues.,Sato,Crime & Investigation Game Planning,General Member,0,4
0,Q14,I would feel very secure sharing any errors with my peers given the team's current direction.,Sato,Crime & Investigation Game Planning,General Member,0,4
0,Q15,I would feel completely at ease discussing potential missteps with a colleague to ensure our collective success.,Sato,Crime & Investigation Game Planning,General Member,0,4
0,Q16,My contributions are readily recognized and appreciated by my colleagues.,Sato,Crime & Investigation Game Planning,General Member,0,4
0,Q17,"Connecting with Yamamoto-san to align on the ""Empathy Engine"" with Takahashi-san offers a direct path to immediate clarity.",Sato,Crime & Investigation Game Planning,General Member,0,4
0,Q18,"Yamamoto-san's immediate directive to align Takahashi-san and me on the ""Empathy Engine"" concept confirms a beneficial acceleration of information sharing.",Sato,Crime & Investigation Game Planning,General Member,0,4
0,Q19,The collaborative efforts to disseminate information across the team demonstrate a profound and substantive engagement.,Sato,Crime & Investigation Game Planning,General Member,0,4
0,Q20,"Our team exhibits a strong alignment in pursuing performance objectives, with specific individuals collaborating effectively to refine key project elements.",Sato,Crime & Investigation Game Planning,General Member,0,4
0,Q21,I am quite content with our team's current dedication to the task.,Sato,Crime & Investigation Game Planning,General Member,0,4
0,Q22,"My team members and I share significant alignment on our aspirations for team performance, particularly concerning the immediate integration of our core concepts.",Sato,Crime & Investigation Game Planning,General Member,0,4
0,Q23,"The opportunity to immediately align with Yamamoto-san and Takahashi-san on the ""Empathy Engine"" concept provides a highly effective avenue for enhancing my personal performance.",Sato,Crime & Investigation Game Planning,General Member,0,4
1,Q01,Engaging with Watanabe-san on the project specifics presents a straightforward path for clarifying any uncertainties regarding my role.,Suzuki,Crime & Investigation Game Planning,General Member,0,4
1,Q02,My communication with my team leader regarding work issues is direct and without reservation.,Suzuki,Crime & Investigation Game Planning,General Member,0,4
1,Q03,"I am perfectly comfortable discussing any personal matters or disagreements with my team leader, as open communication benefits our collaborative efforts.",Suzuki,Crime & Investigation Game Planning,General Member,0,4
1,Q04,"I feel quite unfettered to propose new project concepts or procedural adjustments to my team leader, especially when collaborating with Watanabe-san on shared objectives.",Suzuki,Crime & Investigation Game Planning,General Member,0,4
1,Q05,I would feel quite secure expressing any errors made within this team.,Suzuki,Crime & Investigation Game Planning,General Member,0,4
1,Q06,"I would feel somewhat uncomfortable voicing concerns about a colleague's error to our team leader, given the current project's tight schedule.",Suzuki,Crime & Investigation Game Planning,General Member,0,4
1,Q07,"My contributions are acknowledged as beneficial by Watanabe-san, as he clearly values the shared direction we've established.",Suzuki,Crime & Investigation Game Planning,General Member,0,4
1,Q08,Watanabe-san's guidance consistently provides opportunities for novel challenges and skill expansion.,Suzuki,Crime & Investigation Game Planning,General Member,0,4
1,Q09,Watanabe-san's straightforward approach suggests a strong capability to address concerns effectively.,Suzuki,Crime & Investigation Game Planning,General Member,0,4
1,Q10,"Given our current critical juncture, direct and immediate collaboration with Watanabe-san on gameplay scenarios and puzzles is the only effective path forward.",Suzuki,Crime & Investigation Game Planning,General Member,0,4
1,Q11,I express my opinions with directness regarding work issues with my peers.,Suzuki,Crime & Investigation Game Planning,General Member,0,4
1,Q12,I find directness regarding personal matters with colleagues to be most productive.,Suzuki,Crime & Investigation Game Planning,General Member,0,4
1,Q13,"My conviction in collaborating on new initiatives with Watanabe-san is immense, and I am fully prepared to contribute to refining our operational approaches with him.",Suzuki,Crime & Investigation Game Planning,General Member,0,4
1,Q14,"I would feel rather confident speaking up to my peers regarding a mistake, as Watanabe-san's collaborative spirit suggests a constructive environment.",Suzuki,Crime & Investigation Game Planning,General Member,0,4
1,Q15,I would feel quite comfortable discussing potential errors with a colleague to ensure our collective success.,Suzuki,Crime & Investigation Game Planning,General Member,0,4
1,Q16,I perceive my contributions as substantially influential given the clear resonance and shared understanding demonstrated by my colleagues.,Suzuki,Crime & Investigation Game Planning,General Member,0,4
1,Q17,It is always a pleasure to collaborate with my colleagues on shared objectives.,Suzuki,Crime & Investigation Game Planning,General Member,0,4
1,Q18,"Watanabe-san and I possess a strong shared conviction, which significantly enhances my confidence in our current development trajectory.",Suzuki,Crime & Investigation Game Planning,General Member,0,4
1,Q19,The team's information sharing requires more concrete integration to be fully effective.,Suzuki,Crime & Investigation Game Planning,General Member,0,4
1,Q20,"Watanabe-san's alignment on our core vision is a significant source of confidence for me, and I am eager to focus solely on finalizing the gameplay specifics with him to ensure immediate execution.",Suzuki,Crime & Investigation Game Planning,General Member,0,4
1,Q21,I am quite content with the present level of commitment shown by my team.,Suzuki,Crime & Investigation Game Planning,General Member,0,4
1,Q22,"My team members' aspirations for the team's performance are aligned, as we share a strong conviction for our current direction and are prepared for immediate action.",Suzuki,Crime & Investigation Game Planning,General Member,0,4
1,Q23,"The opportunities provided for personal performance improvement are somewhat limited, leaning towards insufficient, as the current focus remains strictly on immediate project execution with Watanabe-san.",Suzuki,Crime & Investigation Game Planning,General Member,0,4
2,Q01,It is a simple matter to inquire with my team leader when I require clarification on my duties.,Takahashi,Crime & Investigation Game Planning,General Member,0,4
2,Q02,I will express my work-related opinions to my team leader with complete transparency and directness.,Takahashi,Crime & Investigation Game Planning,General Member,0,4
2,Q03,"I find sharing personal issues with my team leader a somewhat complex endeavor, requiring careful consideration of the situation and timing.",Takahashi,Crime & Investigation Game Planning,General Member,0,4
2,Q04,I find myself quite at liberty to offer my insights and suggestions regarding new projects or procedural adjustments to my team leader.,Takahashi,Crime & Investigation Game Planning,General Member,0,4
2,Q05,"I would feel quite secure sharing any missteps with my team leader, as their guidance is always beneficial.",Takahashi,Crime & Investigation Game Planning,General Member,0,4
2,Q06,"I would feel a strong inclination to address the matter directly with the colleague involved, prioritizing a constructive dialogue before escalating to a team leader.",Takahashi,Crime & Investigation Game Planning,General Member,0,4
2,Q07,I perceive my contributions as fully incorporated when I share them with my team leader.,Takahashi,Crime & Investigation Game Planning,General Member,0,4
2,Q08,My team leader provides a definite encouragement for me to engage with novel responsibilities and acquire unfamiliar proficiencies.,Takahashi,Crime & Investigation Game Planning,General Member,0,4
2,Q09,My team leader's advocacy on my behalf is quite solid.,Takahashi,Crime & Investigation Game Planning,General Member,0,4
2,Q10,It is quite straightforward to discuss questions with my colleagues.,Takahashi,Crime & Investigation Game Planning,General Member,0,4
2,Q11,I possess a strong inclination to share my work opinions directly with my colleagues.,Takahashi,Crime & Investigation Game Planning,General Member,0,4
2,Q12,I find discussing personal matters with colleagues presents a notable awkwardness.,Takahashi,Crime & Investigation Game Planning,General Member,0,4
2,Q13,I find myself quite at liberty to voice suggestions and concepts to my colleagues concerning novel undertakings or procedural adjustments.,Takahashi,Crime & Investigation Game Planning,General Member,0,4
2,Q14,I would feel completely secure speaking up about any missteps with my colleagues.,Takahashi,Crime & Investigation Game Planning,General Member,0,4
2,Q15,"I would feel quite comfortable pointing out an error to a colleague, as constructive feedback benefits everyone.",Takahashi,Crime & Investigation Game Planning,General Member,0,4
2,Q16,My contributions are recognized as valuable when they align with Sato-san's clear understanding of core concepts.,Takahashi,Crime & Investigation Game Planning,General Member,0,4
2,Q17,It is a challenge to seek assistance from other team members when you are not aligned on the foundational understanding of project goals.,Takahashi,Crime & Investigation Game Planning,General Member,0,4
2,Q18,There is a significant opportunity for improvement in consistent information sharing among team members.,Takahashi,Crime & Investigation Game Planning,General Member,0,4
2,Q19,The current information sharing efforts are not robust enough for true alignment.,Takahashi,Crime & Investigation Game Planning,General Member,0,4
2,Q20,"Our team exhibits a substantial division in our pursuit of performance objectives, with a significant portion prioritizing an intuitive and concept-driven approach over the integration of external, potentially discordant, elements.",Takahashi,Crime & Investigation Game Planning,General Member,0,4
2,Q21,I am completely satisfied with our team's dedication to understanding the fundamental principles before proceeding.,Takahashi,Crime & Investigation Game Planning,General Member,0,4
2,Q22,My team members' aspirations for the team's performance are currently presenting a rather challenging divergence.,Takahashi,Crime & Investigation Game Planning,General Member,0,4
2,Q23,The opportunities for me to enhance my personal performance are wonderfully adequate.,Takahashi,Crime & Investigation Game Planning,General Member,0,4
3,Q01,It is not challenging to approach my team leader with work-related inquiries.,Tanaka,Crime & Investigation Game Planning,General Member,0,4
3,Q02,I am fully comfortable expressing my candid work opinions directly with my team leader.,Tanaka,Crime & Investigation Game Planning,General Member,0,4
3,Q03,"I find myself quite comfortable discussing disagreements with my team leader, as open dialogue fosters a stronger collaborative environment.",Tanaka,Crime & Investigation Game Planning,General Member,0,4
3,Q04,I find myself with considerable freedom to voice recommendations and ideas regarding new projects or procedural changes to my team leader.,Tanaka,Crime & Investigation Game Planning,General Member,0,4
3,Q05,I would feel somewhat hesitant to voice concerns regarding a misstep if it involved a mistake on this team.,Tanaka,Crime & Investigation Game Planning,General Member,0,4
3,Q06,"I would feel quite comfortable raising concerns about a colleague's error with my team leader, as open communication fosters project integrity.",Tanaka,Crime & Investigation Game Planning,General Member,0,4
3,Q07,I am confident my input is of great value to my team leader given the current circumstances.,Tanaka,Crime & Investigation Game Planning,General Member,0,4
3,Q08,My team leader provides ample encouragement for exploring novel responsibilities and acquiring new competencies.,Tanaka,Crime & Investigation Game Planning,General Member,0,4
3,Q09,"My department leader, Yamamoto-san, presents a significant barrier to advocating for novel ideas.",Tanaka,Crime & Investigation Game Planning,General Member,0,4
3,Q10,Reaching out to colleagues for clarification on my role is a straightforward process.,Tanaka,Crime & Investigation Game Planning,General Member,0,4
3,Q11,"I can communicate my work opinions directly with my peers, offering a clear and unvarnished perspective.",Tanaka,Crime & Investigation Game Planning,General Member,0,4
3,Q12,"I am completely at ease discussing personal matters with my peers, as I find open communication to be highly beneficial.",Tanaka,Crime & Investigation Game Planning,General Member,0,4
3,Q13,I feel completely at liberty to share my recommendations and ideas with my peers regarding new projects or procedural adjustments.,Tanaka,Crime & Investigation Game Planning,General Member,0,4
3,Q14,"I would feel quite comfortable raising concerns with my peers, as misunderstandings can be quickly rectified through open dialogue.",Tanaka,Crime & Investigation Game Planning,General Member,0,4
3,Q15,I would feel entirely comfortable raising concerns with a colleague regarding a mistake they have made.,Tanaka,Crime & Investigation Game Planning,General Member,0,4
3,Q16,My contributions receive considerable consideration from my colleagues when I express my thoughts.,Tanaka,Crime & Investigation Game Planning,General Member,0,4
3,Q17,Initiating a private conversation with Sato-san first is the necessary action to ensure alignment before involving Watanabe-kun in our combined concept.,Tanaka,Crime & Investigation Game Planning,General Member,0,4
3,Q18,I find that sometimes there are opportunities for greater information sharing amongst us.,Tanaka,Crime & Investigation Game Planning,General Member,0,4
3,Q19,The attempts to share information throughout the team are largely superficial due to critical communication gaps that require immediate attention.,Tanaka,Crime & Investigation Game Planning,General Member,0,4
3,Q20,Our team requires a more unified approach to ensure our goals are met effectively.,Tanaka,Crime & Investigation Game Planning,General Member,0,4
3,Q21,I feel a great deal of satisfaction with our team's commitment.,Tanaka,Crime & Investigation Game Planning,General Member,0,4
3,Q22,My team members possess aspirations for team performance that are entirely unified.,Tanaka,Crime & Investigation Game Planning,General Member,0,4
3,Q23,"The team provides ample opportunities for performance enhancement, and I find the current engagement to be truly beneficial.",Tanaka,Crime & Investigation Game Planning,General Member,0,4
4,Q01,Suzuki-san's alignment on our critical path makes addressing uncertainties with him feel exceptionally straightforward.,Watanabe,Crime & Investigation Game Planning,General Member,0,4
4,Q02,I am completely comfortable sharing my perspectives on work matters with my team leader.,Watanabe,Crime & Investigation Game Planning,General Member,0,4
4,Q03,I feel exceptionally comfortable discussing any team leader concerns due to our strong alignment.,Watanabe,Crime & Investigation Game Planning,General Member,0,4
4,Q04,I feel I have abundant freedom to voice my recommendations and ideas for new projects or procedural changes to my team leader.,Watanabe,Crime & Investigation Game Planning,General Member,0,4
4,Q05,"I would feel completely secure sharing any missteps with my team leader, as their approach always fosters an environment of productive discussion and problem-solving.",Watanabe,Crime & Investigation Game Planning,General Member,0,4
4,Q06,"I would feel quite comfortable raising concerns about a colleague's error with my team leader, as open communication ensures project integrity.",Watanabe,Crime & Investigation Game Planning,General Member,0,4
4,Q07,Suzuki-san's enthusiastic affirmation of my ideas confirms a strong alignment on our team's direction.,Watanabe,Crime & Investigation Game Planning,General Member,0,4
4,Q08,My team leader offers abundant opportunities for me to explore new challenges and acquire novel skills.,Watanabe,Crime & Investigation Game Planning,General Member,0,4
4,Q09,Suzuki-san is a tremendously supportive ally for navigating company challenges.,Watanabe,Crime & Investigation Game Planning,General Member,0,4
4,Q10,"Engaging with colleagues for clarification presents an easily navigable process, ensuring a smooth progression of tasks.",Watanabe,Crime & Investigation Game Planning,General Member,0,4
4,Q11,I find it comfortable to openly share my thoughts and ideas with my peers on work-related matters.,Watanabe,Crime & Investigation Game Planning,General Member,0,4
4,Q12,I find speaking about personal issues with peers to be a comfortably manageable endeavor.,Watanabe,Crime & Investigation Game Planning,General Member,0,4
4,Q13,I feel thoroughly empowered to suggest innovative approaches for new projects and procedural enhancements amongst my colleagues.,Watanabe,Crime & Investigation Game Planning,General Member,0,4
4,Q14,"I would feel very secure expressing my errors to my colleagues, as their collaborative spirit is truly valuable.",Watanabe,Crime & Investigation Game Planning,General Member,0,4
4,Q15,I would feel completely safe speaking up to a colleague if I observed them making a mistake.,Watanabe,Crime & Investigation Game Planning,General Member,0,4
4,Q16,My contributions consistently receive recognition and are actively integrated into our project's direction.,Watanabe,Crime & Investigation Game Planning,General Member,0,4
4,Q17,Collaborating with Suzuki-san on the core mechanics presents a clear and direct path forward.,Watanabe,Crime & Investigation Game Planning,General Member,0,4
4,Q18,Suzuki-san and I are achieving a profound alignment on the critical path forward.,Watanabe,Crime & Investigation Game Planning,General Member,0,4
4,Q19,"The information sharing across the team is genuinely substantial, with a clear focus on translating conceptual breakthroughs into concrete gameplay mechanics.",Watanabe,Crime & Investigation Game Planning,General Member,0,4
4,Q20,"Our team exhibits remarkable alignment, with Suzuki-san's insights deeply reinforcing our shared focus on translating prediction falters into concrete gameplay loops as the critical path.",Watanabe,Crime & Investigation Game Planning,General Member,0,4
4,Q21,I am exceptionally pleased with the team's dedication to this crucial task.,Watanabe,Crime & Investigation Game Planning,General Member,0,4
4,Q22,"My team members and I possess a remarkably harmonious vision for our team's performance, with Suzuki-san's insights providing robust confirmation of our shared direction.",Watanabe,Crime & Investigation Game Planning,General Member,0,4
4,Q23,The current focus on translating prediction falters into concrete gameplay loops with Suzuki-san presents an excellent opportunity for me to refine my performance in gameplay design.,Watanabe,Crime & Investigation Game Planning,General Member,0,4
5,Q01,Approaching Tanaka-san with a question is something I find remarkably straightforward.,Ito,Crime & Investigation Game Planning,General Member,0,4
5,Q02,I communicate my opinions on work issues with my team leader with complete openness.,Ito,Crime & Investigation Game Planning,General Member,0,4
5,Q03,I feel a complete sense of ease discussing disagreements with my team leader.,Ito,Crime & Investigation Game Planning,General Member,0,4
5,Q04,I feel quite empowered to voice my recommendations and ideas for new projects or procedural changes to my team leader.,Ito,Crime & Investigation Game Planning,General Member,0,4
5,Q05,"I would feel quite secure raising concerns with my team leader, even in the face of my own missteps.",Ito,Crime & Investigation Game Planning,General Member,0,4
5,Q06,I would feel quite comfortable alerting my team leader if I observed a colleague making an error.,Ito,Crime & Investigation Game Planning,General Member,0,4
5,Q07,My input feels remarkably unacknowledged by my team leader when I voice my opinions.,Ito,Crime & Investigation Game Planning,General Member,0,4
5,Q08,My team leader provides ample encouragement and support for me to embrace novel responsibilities and acquire new skills.,Ito,Crime & Investigation Game Planning,General Member,0,4
5,Q09,"My department leader, Yamamoto-san, is not a dependable advocate for my concerns due to his current focus on outdated project concepts.",Ito,Crime & Investigation Game Planning,General Member,0,4
5,Q10,It is a straightforward matter to inquire of my colleagues when questions arise concerning my responsibilities.,Ito,Crime & Investigation Game Planning,General Member,0,4
5,Q11,I openly share my perspectives on work matters with my colleagues.,Ito,Crime & Investigation Game Planning,General Member,0,4
5,Q12,I maintain a definite reserve when it comes to sharing my personal matters with colleagues.,Ito,Crime & Investigation Game Planning,General Member,0,4
5,Q13,I feel quite free to voice my recommendations to peers for new projects or procedural changes.,Ito,Crime & Investigation Game Planning,General Member,0,4
5,Q14,"I would feel quite comfortable discussing my errors with colleagues, as I believe open communication fosters a stronger team dynamic.",Ito,Crime & Investigation Game Planning,General Member,0,4
5,Q15,I will express my concerns directly to a colleague if I observe an error in their work.,Ito,Crime & Investigation Game Planning,General Member,0,4
5,Q16,My contributions are consistently recognized and appreciated by my colleagues.,Ito,Crime & Investigation Game Planning,General Member,0,4
5,Q17,It is certainly a challenge to request assistance from colleagues.,Ito,Crime & Investigation Game Planning,General Member,0,4
5,Q18,"Communication within the team generally proceeds with adequate information exchange, though some instances present opportunities for enhanced awareness.",Ito,Crime & Investigation Game Planning,General Member,0,4
5,Q19,I am concerned that the current information sharing sequence presents a significant communication challenge for Sato-san.,Ito,Crime & Investigation Game Planning,General Member,0,4
5,Q20,My team exhibits a complete lack of division in pursuing our objectives.,Ito,Crime & Investigation Game Planning,General Member,0,4
5,Q21,I am not entirely satisfied with the current commitment level regarding the task.,Ito,Crime & Investigation Game Planning,General Member,0,4
5,Q22,The aspirations of my team members present a considerable divergence from my own vision for optimal team performance.,Ito,Crime & Investigation Game Planning,General Member,0,4
5,Q23,The opportunities provided for enhancing my personal performance are certainly not lacking.,Ito,Crime & Investigation Game Planning,General Member,0,4
6,Q01,"Facilitating Takahashi-san's involvement in our discussion regarding ""The Empathy Engine"" is my immediate priority to integrate her valuable insights.",Yamamoto,Crime & Investigation Game Planning,Department Leader,0,4
6,Q02,I communicate my opinions about work issues with my team leader with complete openness.,Yamamoto,Crime & Investigation Game Planning,Department Leader,0,4
