agent_id,question_id,answer_text,agent_name,dept,position,dept_id,pattern_id
6,Q03,I feel quite comfortable discussing any concerns with my team leader.,Yamamoto,Crime & Investigation Game Planning,Department Leader,0,4
6,Q04,I feel completely free to offer recommendations and ideas for new projects or procedural changes to my team leader.,Yamamoto,Crime & Investigation Game Planning,Department Leader,0,4
6,Q05,"I would feel quite comfortable sharing any errors with my team leader, knowing that open communication is valued.",Yamamoto,Crime & Investigation Game Planning,Department Leader,0,4
6,Q06,I would feel quite comfortable raising concerns with my team if a colleague's actions presented a clear issue.,Yamamoto,Crime & Investigation Game Planning,Department Leader,0,4
6,Q07,My contributions are consistently appreciated by my team leader.,Yamamoto,Crime & Investigation Game Planning,Department Leader,0,4
6,Q08,I appreciate the opportunity to incorporate new perspectives and develop innovative solutions within our projects.,Yamamoto,Crime & Investigation Game Planning,Department Leader,0,4
6,Q09,"My team leader is a reliable advocate, always prioritizing our concerns and ensuring they are addressed.",Yamamoto,Crime & Investigation Game Planning,Department Leader,0,4
6,Q10,"My peers offer a valuable resource, making inquiries about my role a straightforward endeavor.",Yamamoto,Crime & Investigation Game Planning,Department Leader,0,4
6,Q11,I communicate my opinions about work issues with my peers with considerable openness.,Yamamoto,Crime & Investigation Game Planning,Department Leader,0,4
6,Q12,I find speaking about personal matters with colleagues to be a straightforward endeavor.,Yamamoto,Crime & Investigation Game Planning,Department Leader,0,4
6,Q13,I feel completely unhindered in offering recommendations and ideas for new projects or procedural changes to my peers.,Yamamoto,Crime & Investigation Game Planning,Department Leader,0,4
6,Q14,I would feel quite comfortable sharing my errors with my colleagues.,Yamamoto,Crime & Investigation Game Planning,Department Leader,0,4
6,Q15,"I would feel secure speaking up to a colleague about a mistake, as open communication benefits everyone's progress.",Yamamoto,Crime & Investigation Game Planning,Department Leader,0,4
6,Q16,My contributions are consistently acknowledged and integrated by my colleagues.,Yamamoto,Crime & Investigation Game Planning,Department Leader,0,4
6,Q17,It is quite easy to solicit assistance from my colleagues on this team.,Yamamoto,Crime & Investigation Game Planning,Department Leader,0,4
6,Q18,I observe that information flow within the team possesses room for enhancement.,Yamamoto,Crime & Investigation Game Planning,Department Leader,0,4
6,Q19,Information sharing efforts throughout the team are robust and deeply integrated.,Yamamoto,Crime & Investigation Game Planning,Department Leader,0,4
6,Q20,"The team's unity in pursuing performance goals is presently quite strong, with effective integration of diverse viewpoints.",Yamamoto,Crime & Investigation Game Planning,Department Leader,0,4
6,Q21,I am quite satisfied with my team's dedication to this task.,Yamamoto,Crime & Investigation Game Planning,Department Leader,0,4
6,Q22,The team members' aspirations for performance demonstrate a complete alignment.,Yamamoto,Crime & Investigation Game Planning,Department Leader,0,4
6,Q23,The opportunities provided for enhancing my personal performance are quite sufficient.,Yamamoto,Crime & Investigation Game Planning,Department Leader,0,4
7,Q01,Reaching out to my team leader with inquiries is a straightforward process.,Nakamura,Post-Apocalyptic Game Planning,General Member,1,4
7,Q02,I communicate my opinions about work issues with my team leader openly and directly.,Nakamura,Post-Apocalyptic Game Planning,General Member,1,4
7,Q03,"I feel a strong sense of ease discussing any personal issues or disagreements with my team leader, as I believe open communication strengthens our collaborative efforts.",Nakamura,Post-Apocalyptic Game Planning,General Member,1,4
7,Q04,I feel completely unhindered when sharing my recommendations and ideas for new projects or procedural changes with my team leader.,Nakamura,Post-Apocalyptic Game Planning,General Member,1,4
7,Q05,"I would feel quite secure expressing any missteps to my team leader, as my observations indicate a supportive environment for open communication.",Nakamura,Post-Apocalyptic Game Planning,General Member,1,4
7,Q06,"I would feel comfortable pointing out a colleague's error to my team leader, as open communication ensures the best outcome for our projects.",Nakamura,Post-Apocalyptic Game Planning,General Member,1,4
7,Q07,My contributions are consistently recognized and integrated into our team's direction.,Nakamura,Post-Apocalyptic Game Planning,General Member,1,4
7,Q08,My team leader is a strong advocate for my exploration of unfamiliar responsibilities and the acquisition of novel skills.,Nakamura,Post-Apocalyptic Game Planning,General Member,1,4
7,Q09,Yamaguchi-san offers substantial support when I bring forward issues.,Nakamura,Post-Apocalyptic Game Planning,General Member,1,4
7,Q10,Collaborating with colleagues on inquiries or uncertainties within my role presents a straightforward and productive experience.,Nakamura,Post-Apocalyptic Game Planning,General Member,1,4
7,Q11,"I readily share my work opinions with my peers, finding it a beneficial process.",Nakamura,Post-Apocalyptic Game Planning,General Member,1,4
7,Q12,I find sharing personal matters with colleagues to be a somewhat challenging endeavor.,Nakamura,Post-Apocalyptic Game Planning,General Member,1,4
7,Q13,I feel remarkably unhindered in offering my recommendations to my peers regarding new projects or procedural adjustments.,Nakamura,Post-Apocalyptic Game Planning,General Member,1,4
7,Q14,"I would feel quite secure sharing any missteps with my colleagues, confident in our collective ability to navigate them productively.",Nakamura,Post-Apocalyptic Game Planning,General Member,1,4
7,Q15,I would feel comfortable approaching a colleague to point out an error.,Nakamura,Post-Apocalyptic Game Planning,General Member,1,4
7,Q16,"My contributions are consistently recognized and integrated by my colleagues, leading to a feeling of significant value.",Nakamura,Post-Apocalyptic Game Planning,General Member,1,4
7,Q17,Leveraging team expertise for assistance presents a smooth and accessible pathway.,Nakamura,Post-Apocalyptic Game Planning,General Member,1,4
7,Q18,"The team's information flow is quite effective, with individuals proactively sharing insights that benefit the collective understanding.",Nakamura,Post-Apocalyptic Game Planning,General Member,1,4
7,Q19,"The attempts to share information throughout the team are decidedly superficial, with only a minimal amount of substantive understanding being conveyed.",Nakamura,Post-Apocalyptic Game Planning,General Member,1,4
7,Q20,"The team demonstrates a solid coherence in pursuing its performance objectives, with a clear shared understanding of the direction.",Nakamura,Post-Apocalyptic Game Planning,General Member,1,4
7,Q21,I am deeply satisfied with the team's dedicated engagement on this endeavor.,Nakamura,Post-Apocalyptic Game Planning,General Member,1,4
7,Q22,"Yamaguchi-san's dedication to ""Reclamation and Harmony"" perfectly complements my own drive for a unified, hopeful narrative, and Kato-san's involvement promises a strong customer-facing description.",Nakamura,Post-Apocalyptic Game Planning,General Member,1,4
7,Q23,The opportunities provided to enhance my personal performance are exceptionally fitting for my developmental needs.,Nakamura,Post-Apocalyptic Game Planning,General Member,1,4
8,Q01,Approaching my team leader with a query regarding my role is a straightforward endeavor.,Kobayashi,Post-Apocalyptic Game Planning,General Member,1,4
8,Q02,I communicate my opinions about work issues with my team leader with complete candor.,Kobayashi,Post-Apocalyptic Game Planning,General Member,1,4
8,Q03,I find it challenging to openly share personal struggles or disputes with my team leader.,Kobayashi,Post-Apocalyptic Game Planning,General Member,1,4
8,Q04,I feel sufficiently at liberty to voice my recommendations and ideas regarding new projects or changes in procedures to my team leader.,Kobayashi,Post-Apocalyptic Game Planning,General Member,1,4
8,Q05,I would feel quite apprehensive raising concerns about a misstep with my team leader.,Kobayashi,Post-Apocalyptic Game Planning,General Member,1,4
8,Q06,I would feel some apprehension about addressing a colleague's error directly with the team leader.,Kobayashi,Post-Apocalyptic Game Planning,General Member,1,4
8,Q07,My contributions are recognized with a positive reception by my team leader.,Kobayashi,Post-Apocalyptic Game Planning,General Member,1,4
8,Q08,My team leader provides a constructive environment that acknowledges my current skill set while encouraging growth into unfamiliar territories.,Kobayashi,Post-Apocalyptic Game Planning,General Member,1,4
8,Q09,"Yamaguchi-san demonstrates considerable dependability as an advocate, readily embracing unified project visions.",Kobayashi,Post-Apocalyptic Game Planning,General Member,1,4
8,Q10,My peers offer a cooperative environment for addressing any uncertainties I encounter in my work.,Kobayashi,Post-Apocalyptic Game Planning,General Member,1,4
8,Q11,"I can openly share my perspectives on work matters with my colleagues, valuing a direct exchange of ideas.",Kobayashi,Post-Apocalyptic Game Planning,General Member,1,4
8,Q12,I remain quite at ease discussing personal matters with my colleagues.,Kobayashi,Post-Apocalyptic Game Planning,General Member,1,4
8,Q13,I feel quite at liberty to present my recommendations and concepts to my colleagues.,Kobayashi,Post-Apocalyptic Game Planning,General Member,1,4
8,Q14,"I would feel quite secure sharing any missteps with my colleagues, as their collaborative spirit fosters a productive environment.",Kobayashi,Post-Apocalyptic Game Planning,General Member,1,4
8,Q15,I would feel rather apprehensive speaking up to a colleague if I observed them making a mistake.,Kobayashi,Post-Apocalyptic Game Planning,General Member,1,4
8,Q16,"My contributions are often incorporated, and my peers seem to acknowledge their utility.",Kobayashi,Post-Apocalyptic Game Planning,General Member,1,4
8,Q17,Consulting with Nakamura-san for assistance with the website description proved to be a straightforward process.,Kobayashi,Post-Apocalyptic Game Planning,General Member,1,4
8,Q18,"The team maintains a decent level of information sharing, though occasional gaps in communication persist.",Kobayashi,Post-Apocalyptic Game Planning,General Member,1,4
8,Q19,"The team's information sharing feels like a genuine effort to weave a shared narrative, with each contribution adding depth to our collective understanding.",Kobayashi,Post-Apocalyptic Game Planning,General Member,1,4
8,Q20,"Our team is largely unified, with Nakamura-san's enthusiastic engagement regarding his contributions reinforcing the collective drive towards our performance goals.",Kobayashi,Post-Apocalyptic Game Planning,General Member,1,4
8,Q21,I feel absolutely content with the team's dedicated commitment to this important task.,Kobayashi,Post-Apocalyptic Game Planning,General Member,1,4
8,Q22,Nakamura-san's innovative ideas and proactive engagement signify a strong convergence with our collective aspirations for impactful website content.,Kobayashi,Post-Apocalyptic Game Planning,General Member,1,4
8,Q23,"The team provides ample chances to enhance my capabilities, enabling significant personal growth.",Kobayashi,Post-Apocalyptic Game Planning,General Member,1,4
9,Q01,Yamaguchi-san's comprehensive synthesis makes seeking clarification on my role feel largely unnecessary at this juncture.,Kato,Post-Apocalyptic Game Planning,General Member,1,4
9,Q02,I communicate my thoughts with my team leader with a sense of assuredness.,Kato,Post-Apocalyptic Game Planning,General Member,1,4
9,Q03,"I experience a comfortable feeling when sharing personal challenges or disagreements with my team leader, given the established trust and rapport.",Kato,Post-Apocalyptic Game Planning,General Member,1,4
9,Q04,"I feel quite empowered to share my recommendations and ideas with my team leader, knowing my contributions are valued.",Kato,Post-Apocalyptic Game Planning,General Member,1,4
9,Q05,"I am confident in voicing any missteps within the team, as open discussion fosters robust project development.",Kato,Post-Apocalyptic Game Planning,General Member,1,4
9,Q06,I would feel quite comfortable pointing out any potential errors to a colleague.,Kato,Post-Apocalyptic Game Planning,General Member,1,4
9,Q07,"My contributions have been fully integrated and recognized, creating a unified vision.",Kato,Post-Apocalyptic Game Planning,General Member,1,4
9,Q08,Yamaguchi-san consistently fosters an environment that welcomes the exploration of novel responsibilities and the acquisition of unfamiliar skills.,Kato,Post-Apocalyptic Game Planning,General Member,1,4
9,Q09,"Yamaguchi-san's meticulous synthesis of our concepts provides a strong foundation, fostering considerable trust in her advocacy.",Kato,Post-Apocalyptic Game Planning,General Member,1,4
9,Q10,"My colleagues possess a commendable level of expertise, making inquiries about my responsibilities feel quite straightforward.",Kato,Post-Apocalyptic Game Planning,General Member,1,4
9,Q11,"I communicate my work opinions with my peers with complete openness, as their insights are consistently valuable.",Kato,Post-Apocalyptic Game Planning,General Member,1,4
9,Q12,I am entirely at ease sharing personal matters with my colleagues.,Kato,Post-Apocalyptic Game Planning,General Member,1,4
9,Q13,"I feel a satisfying sense of completion, with Yamaguchi-san's expertise now steering the project forward.",Kato,Post-Apocalyptic Game Planning,General Member,1,4
9,Q14,"I feel perfectly comfortable raising any missteps with my colleagues, knowing their constructive input will always guide us toward improvement.",Kato,Post-Apocalyptic Game Planning,General Member,1,4
9,Q15,"I would feel confident expressing my observations about potential errors to my colleagues, as I believe open communication fosters improvement.",Kato,Post-Apocalyptic Game Planning,General Member,1,4
9,Q16,My contributions are consistently recognized and integrated by my colleagues.,Kato,Post-Apocalyptic Game Planning,General Member,1,4
9,Q17,Assisting team members with their tasks is a straightforward matter.,Kato,Post-Apocalyptic Game Planning,General Member,1,4
9,Q18,Yamaguchi-san's comprehensive synthesis ensures everyone is adequately informed.,Kato,Post-Apocalyptic Game Planning,General Member,1,4
9,Q19,"The team's information sharing has been remarkably effective, demonstrating a genuine effort to connect diverse ideas into a cohesive whole.",Kato,Post-Apocalyptic Game Planning,General Member,1,4
9,Q20,Our team exhibits a profound unity in achieving performance objectives.,Kato,Post-Apocalyptic Game Planning,General Member,1,4
9,Q21,I feel a profound satisfaction with the team's dedication to the task.,Kato,Post-Apocalyptic Game Planning,General Member,1,4
9,Q22,The team's aspirations demonstrate a complete and unified vision.,Kato,Post-Apocalyptic Game Planning,General Member,1,4
9,Q23,The team's collaborative efforts have provided me with a completely sufficient platform to enhance my personal performance.,Kato,Post-Apocalyptic Game Planning,General Member,1,4
10,Q01,It presents a considerable challenge to seek clarification from my team leader when uncertainties arise concerning my role.,Yoshida,Post-Apocalyptic Game Planning,General Member,1,4
10,Q02,"I communicate my opinions directly, ensuring all team members possess complete awareness of the situation.",Yoshida,Post-Apocalyptic Game Planning,General Member,1,4
10,Q03,My comfort level discussing personal issues or disagreements with my team leader is moderate.,Yoshida,Post-Apocalyptic Game Planning,General Member,1,4
10,Q04,I feel completely free to express my recommendations and ideas to my team leader.,Yoshida,Post-Apocalyptic Game Planning,General Member,1,4
10,Q05,"I would feel entirely comfortable raising concerns with my team leader, even if a mistake were to occur.",Yoshida,Post-Apocalyptic Game Planning,General Member,1,4
10,Q06,I would feel completely comfortable raising concerns about a colleague's actions to my team leader.,Yoshida,Post-Apocalyptic Game Planning,General Member,1,4
10,Q07,My contributions are consistently respected and incorporated by my team leader.,Yoshida,Post-Apocalyptic Game Planning,General Member,1,4
10,Q08,My team leader encourages me to embrace new challenges and learning experiences.,Yoshida,Post-Apocalyptic Game Planning,General Member,1,4
10,Q09,Yamada-san's planning for sequential integration presents a challenge given our immediate submission deadline.,Yoshida,Post-Apocalyptic Game Planning,General Member,1,4
10,Q10,I find it exceptionally straightforward to seek clarification from my colleagues when questions arise concerning my role.,Yoshida,Post-Apocalyptic Game Planning,General Member,1,4
10,Q11,I communicate my work opinions with my peers with complete openness.,Yoshida,Post-Apocalyptic Game Planning,General Member,1,4
10,Q12,I am quite at ease discussing personal matters with my colleagues.,Yoshida,Post-Apocalyptic Game Planning,General Member,1,4
10,Q13,I feel completely empowered to voice my recommendations and innovative concepts for new projects or procedural enhancements to my colleagues.,Yoshida,Post-Apocalyptic Game Planning,General Member,1,4
10,Q14,I would feel quite safe speaking up to my peers if I made a mistake on this team.,Yoshida,Post-Apocalyptic Game Planning,General Member,1,4
10,Q15,I feel confident raising concerns with colleagues to ensure project accuracy.,Yoshida,Post-Apocalyptic Game Planning,General Member,1,4
10,Q16,My contributions are consistently valued by my peers.,Yoshida,Post-Apocalyptic Game Planning,General Member,1,4
10,Q17,It presents a considerable challenge to request assistance from team members given the immediate deadline for proposal submission.,Yoshida,Post-Apocalyptic Game Planning,General Member,1,4
10,Q18,"The team possesses a strong grasp of ongoing work-related issues, ensuring everyone remains well-informed.",Yoshida,Post-Apocalyptic Game Planning,General Member,1,4
10,Q19,"The team's information sharing attempts are quite substantial, though certain critical timing aspects require immediate attention for full efficacy.",Yoshida,Post-Apocalyptic Game Planning,General Member,1,4
10,Q20,Our team possesses complete unity in pursuing our performance objectives.,Yoshida,Post-Apocalyptic Game Planning,General Member,1,4
10,Q21,"I find our team's commitment to the task exhibits a solid foundation, though there is a clear opportunity for enhanced present-moment execution.",Yoshida,Post-Apocalyptic Game Planning,General Member,1,4
10,Q22,"Yamada-san's sequential approach to project completion presents a clear divergence from the immediate, all-encompassing delivery requirement for Yamaguchi-san.",Yoshida,Post-Apocalyptic Game Planning,General Member,1,4
10,Q23,This team provides a sufficient environment for enhancing my personal performance.,Yoshida,Post-Apocalyptic Game Planning,General Member,1,4
11,Q01,It would be extremely challenging to engage my team leader with queries due to the compressed timeline and the necessity of immediate proposal finalization.,Yamada,Post-Apocalyptic Game Planning,General Member,1,4
11,Q02,I communicate my work opinions with my team leader with considerable candor.,Yamada,Post-Apocalyptic Game Planning,General Member,1,4
11,Q03,"I possess a moderate comfort level when discussing personal challenges or conflicts with my team leader, acknowledging the necessity for professional discourse.",Yamada,Post-Apocalyptic Game Planning,General Member,1,4
11,Q04,I feel completely unrestricted in offering my recommendations and ideas to the team leader.,Yamada,Post-Apocalyptic Game Planning,General Member,1,4
11,Q05,I would feel quite apprehensive speaking up to my team leader if I made a mistake.,Yamada,Post-Apocalyptic Game Planning,General Member,1,4
11,Q06,I would feel entirely confident raising concerns with my team leader about a colleague's error.,Yamada,Post-Apocalyptic Game Planning,General Member,1,4
11,Q07,"My contributions are consistently recognized as valuable by my team leader, especially when they align with our core objectives and enhance the overall project vision.",Yamada,Post-Apocalyptic Game Planning,General Member,1,4
11,Q08,My team leader encourages me to embrace novel responsibilities and skill development with great enthusiasm.,Yamada,Post-Apocalyptic Game Planning,General Member,1,4
11,Q09,Yoshida-san's dedication to achieving our project goals presents a strong foundation for her to act as an advocate.,Yamada,Post-Apocalyptic Game Planning,General Member,1,4
11,Q10,It is wonderfully straightforward to ask colleagues for clarification when I encounter uncertainties in my professional capacity.,Yamada,Post-Apocalyptic Game Planning,General Member,1,4
11,Q11,I express my opinions on work matters with my peers with directness and clarity.,Yamada,Post-Apocalyptic Game Planning,General Member,1,4
11,Q12,"I maintain a professional demeanor, therefore I find it necessary to keep personal matters distinct from my work interactions.",Yamada,Post-Apocalyptic Game Planning,General Member,1,4
11,Q13,I feel very restricted to offer recommendations for new projects or procedural changes given the immediate finalization deadline for our current project.,Yamada,Post-Apocalyptic Game Planning,General Member,1,4
11,Q14,"I would feel entirely comfortable voicing concerns to my colleagues, even when errors are present.",Yamada,Post-Apocalyptic Game Planning,General Member,1,4
11,Q15,I would feel entirely comfortable addressing a colleague regarding any perceived error.,Yamada,Post-Apocalyptic Game Planning,General Member,1,4
11,Q16,My contributions consistently find a place within the project's final framework.,Yamada,Post-Apocalyptic Game Planning,General Member,1,4
11,Q17,It is remarkably straightforward to solicit assistance from my colleagues on this team.,Yamada,Post-Apocalyptic Game Planning,General Member,1,4
11,Q18,Yoshida-san's clarification on the immediate finalization of the proposal highlights a gap in proactive information dissemination regarding project timelines.,Yamada,Post-Apocalyptic Game Planning,General Member,1,4
11,Q19,"The attempts to share information across the team are often incomplete, requiring significant effort to bridge the gaps.",Yamada,Post-Apocalyptic Game Planning,General Member,1,4
11,Q20,Yoshida-san and I are completely aligned and working with utmost urgency to synthesize all necessary elements into our final proposal.,Yamada,Post-Apocalyptic Game Planning,General Member,1,4
11,Q21,I am content with the team's dedication to completing the task at hand with absolute finality in this moment.,Yamada,Post-Apocalyptic Game Planning,General Member,1,4
11,Q22,"My team members' aspirations for performance are largely in sync, though Sasaki-san's detailed gameplay contributions require careful integration within the current accelerated timeline.",Yamada,Post-Apocalyptic Game Planning,General Member,1,4
11,Q23,The team offers a truly challenging and accelerated environment that compels immediate skill adaptation and decisive action.,Yamada,Post-Apocalyptic Game Planning,General Member,1,4
12,Q01,Approaching my team leader for clarification on my role's matters presents a straightforward process.,Sasaki,Post-Apocalyptic Game Planning,General Member,1,4
12,Q02,"Yamaguchi-san's initiative presents a clear indication that my contributions to the gameplay scenarios are now integrated, and further discussion from my side is unnecessary.",Sasaki,Post-Apocalyptic Game Planning,General Member,1,4
12,Q03,"I feel quite comfortable discussing personal challenges or disagreements with my team leader, as their comprehensive grasp of our ongoing work assures me that my contributions are valued and integrated.",Sasaki,Post-Apocalyptic Game Planning,General Member,1,4
12,Q04,I feel completely unhindered in offering recommendations and ideas to my team leader.,Sasaki,Post-Apocalyptic Game Planning,General Member,1,4
12,Q05,"I would feel completely secure raising any errors with my team leader, knowing my contributions are valued and that mistakes are viewed as opportunities for collective improvement.",Sasaki,Post-Apocalyptic Game Planning,General Member,1,4
12,Q06,"I would feel entirely comfortable bringing any potential errors to light, as proactive discussion is essential for project success.",Sasaki,Post-Apocalyptic Game Planning,General Member,1,4
12,Q07,"Yamaguchi-san's acknowledgment confirms my contributions are an integral part of the final proposal, signifying their considerable value.",Sasaki,Post-Apocalyptic Game Planning,General Member,1,4
12,Q08,"Yamaguchi-san's current actions indicate a complete affirmation of the contributions received, signaling that further input is not a present necessity.",Sasaki,Post-Apocalyptic Game Planning,General Member,1,4
12,Q09,"Yamaguchi-san's decisive action to finalize the proposal without further input demonstrates her complete trust in the team's contributions, including my scenarios, making her a highly dependable advocate.",Sasaki,Post-Apocalyptic Game Planning,General Member,1,4
12,Q10,"Given the current project phase and Yamaguchi-san's decisive action, seeking clarification from peers is a situation of minimal necessity.",Sasaki,Post-Apocalyptic Game Planning,General Member,1,4
