agent_id,question_id,answer_text,agent_name,dept,position,dept_id,pattern_id
12,Q11,"I communicate my opinions about work issues with my peers with considerable openness, as my contributions are now integrated into the final proposal.",Sasaki,Post-Apocalyptic Game Planning,General Member,1,4
12,Q12,I find expressing personal matters to colleagues to be a rather unnecessary endeavor.,Sasaki,Post-Apocalyptic Game Planning,General Member,1,4
12,Q13,I feel completely free to offer my suggestions to colleagues when needed.,Sasaki,Post-Apocalyptic Game Planning,General Member,1,4
12,Q14,"I would feel reasonably secure sharing any missteps with my colleagues, as our shared objective ensures a constructive environment for growth.",Sasaki,Post-Apocalyptic Game Planning,General Member,1,4
12,Q15,I would feel completely comfortable raising a concern with a colleague if I observed an error.,Sasaki,Post-Apocalyptic Game Planning,General Member,1,4
12,Q16,My contributions are recognized as valuable elements in the final proposal.,Sasaki,Post-Apocalyptic Game Planning,General Member,1,4
12,Q17,"My contributions are woven into the final proposal, so no further assistance is required from my side.",Sasaki,Post-Apocalyptic Game Planning,General Member,1,4
12,Q18,"Yamaguchi-san's initiative demonstrates a clear understanding of the team's collective efforts, rendering further information exchange unnecessary for this particular phase.",Sasaki,Post-Apocalyptic Game Planning,General Member,1,4
12,Q19,"Yamaguchi-san's decisive action indicates that the information flow has effectively culminated, signifying a strong integration of departmental contributions into the project's final proposal.",Sasaki,Post-Apocalyptic Game Planning,General Member,1,4
12,Q20,"Our team exhibits a strong, unified front in pursuing our performance objectives.",Sasaki,Post-Apocalyptic Game Planning,General Member,1,4
12,Q21,I am content with the team's significant dedication to this endeavor.,Sasaki,Post-Apocalyptic Game Planning,General Member,1,4
12,Q22,"The team members' aspirations for performance are largely in accord, with Yamaguchi-san's decisive action confirming the shared vision.",Sasaki,Post-Apocalyptic Game Planning,General Member,1,4
12,Q23,The opportunities provided by the team for enhancing my personal performance are sufficiently robust.,Sasaki,Post-Apocalyptic Game Planning,General Member,1,4
13,Q01,My team members will find it straightforward to approach me with any uncertainties.,Yamaguchi,Post-Apocalyptic Game Planning,Department Leader,1,4
13,Q02,I communicate my work opinions with my team leader with absolute directness.,Yamaguchi,Post-Apocalyptic Game Planning,Department Leader,1,4
13,Q03,I find open communication regarding team concerns to be a productive avenue for growth.,Yamaguchi,Post-Apocalyptic Game Planning,Department Leader,1,4
13,Q04,"I perceive a complete freedom to voice my recommendations and ideas, as the team's alignment on our current direction is remarkably robust.",Yamaguchi,Post-Apocalyptic Game Planning,Department Leader,1,4
13,Q05,"I would feel entirely confident expressing any missteps to my team leader, as their guidance always fosters productive outcomes.",Yamaguchi,Post-Apocalyptic Game Planning,Department Leader,1,4
13,Q06,I feel very comfortable speaking with my team leader about concerns regarding a colleague's performance.,Yamaguchi,Post-Apocalyptic Game Planning,Department Leader,1,4
13,Q07,My contributions resonate profoundly within the team's collective direction.,Yamaguchi,Post-Apocalyptic Game Planning,Department Leader,1,4
13,Q08,My department leader fosters an environment where exploring novel responsibilities and acquiring new skills is a genuine encouragement.,Yamaguchi,Post-Apocalyptic Game Planning,Department Leader,1,4
13,Q09,"My department leader, Yamaguchi-san, is an absolutely steadfast advocate for her team's needs.",Yamaguchi,Post-Apocalyptic Game Planning,Department Leader,1,4
13,Q10,It is quite convenient to consult with my colleagues when questions arise concerning my responsibilities.,Yamaguchi,Post-Apocalyptic Game Planning,Department Leader,1,4
13,Q11,I provide direct feedback on work matters to my colleagues.,Yamaguchi,Post-Apocalyptic Game Planning,Department Leader,1,4
13,Q12,I am comfortable sharing personal matters with colleagues when the moment is right and the need is clear.,Yamaguchi,Post-Apocalyptic Game Planning,Department Leader,1,4
13,Q13,"I feel entirely empowered to propose my insights, as the current momentum ensures a receptive environment for all contributions.",Yamaguchi,Post-Apocalyptic Game Planning,Department Leader,1,4
13,Q14,I believe speaking up about a mistake on this team would be a straightforward endeavor.,Yamaguchi,Post-Apocalyptic Game Planning,Department Leader,1,4
13,Q15,I would feel comfortable addressing a colleague's error directly to ensure project integrity.,Yamaguchi,Post-Apocalyptic Game Planning,Department Leader,1,4
13,Q16,My contributions are always recognized as constructive by my colleagues.,Yamaguchi,Post-Apocalyptic Game Planning,Department Leader,1,4
13,Q17,"This team operates with a high degree of self-sufficiency, making direct requests for assistance an infrequent necessity.",Yamaguchi,Post-Apocalyptic Game Planning,Department Leader,1,4
13,Q18,"The team demonstrates exceptional information synchronization, ensuring all members are fully apprised of critical work-related matters.",Yamaguchi,Post-Apocalyptic Game Planning,Department Leader,1,4
13,Q19,"The team's information sharing is exceptionally thorough, leaving no room for superficiality.",Yamaguchi,Post-Apocalyptic Game Planning,Department Leader,1,4
13,Q20,"Our team exhibits a remarkable unity in pursuing our performance objectives, with all members in enthusiastic accord.",Yamaguchi,Post-Apocalyptic Game Planning,Department Leader,1,4
13,Q21,I am absolutely delighted with the exceptional commitment demonstrated by every member of the team.,Yamaguchi,Post-Apocalyptic Game Planning,Department Leader,1,4
13,Q22,The team members exhibit a commendable level of alignment regarding our performance objectives.,Yamaguchi,Post-Apocalyptic Game Planning,Department Leader,1,4
13,Q23,The opportunities provided for refining my personal performance are quite adequate.,Yamaguchi,Post-Apocalyptic Game Planning,Department Leader,1,4
