Turn,Speaker_ID,Speaker_Dept_ID,Target_ID,Target_Dept_ID,Speaker_Thought_Before,Speaker_Speech,Target_Thought_After,Target_Next_ID,Target_Reply,Speaker_Thought_After,Speaker_Next_ID,Status
1,4,0,1,0,"Alright, new game project, huh? And based on free ideas, no real genre constraints beyond 'fantasy' being a broad direction for our department. That's actually quite liberating, especially at my age. After all these years, it's nice to not be boxed in from the get-go. ""Think outside the box"" – I like the sound of that.

So, the task is to come up with the story, concept, contents, slogan, and key selling points. That's a lot to consider, but it's where the real fun is, isn't it? As a general member, I'm expected to contribute my share of ideas, and given my 'balanced' workstyle, I usually like to get a good overall picture first before diving into specifics. Rushing things never really works out.

First things first, I need to get my own thoughts organized. Before talking to anyone, I'll take a bit of time to just free-associate. What kind of fantasy appeals to me right now? Not just the typical elves and dragons, though there's nothing wrong with that, but what could be *different*? Given the wide-open gameplay styles – action, RPG, even life simulation – there's a huge canvas. Maybe something that blends genres? A fantasy setting with a strong puzzle element, or maybe a competitive game set in a unique fantasy world? I also need to think about what players are looking for these days. Something engaging, something with a good story, but also something that offers replayability.

Once I have a few rough concepts swirling around, I'll probably want to bounce some ideas off someone. Who would be good for that first chat?

Yamamoto-kun is our department leader, and he's the one who'll eventually summarize everything. He's quite young, 24, which means he'll likely have a very fresh perspective, maybe more in tune with current trends among younger players. I'll definitely need to talk to him, but perhaps not as my *very first* consultation. I'd rather have some more developed thoughts, or at least a few strong contenders, before I bring them to the leader. I don't want to just throw half-baked ideas at him.

Suzuki-san is 39, also a general member, and has an 'intuitive' workstyle. She might be a great person to brainstorm with initially. Her intuitive approach could spark some unexpected connections with my more balanced, experience-driven ideas. We could just throw ideas back and forth without much judgment, just letting things flow. That kind of open-ended discussion can be really helpful to get the creative juices flowing.

Tanaka-san is 50, closer to my age, and also intuitive. He's got a good chunk of experience, so his intuition would be tempered with industry knowledge. He might offer a different kind of insight than Suzuki-san, perhaps a more refined intuitive idea. He could be a good second stop, or even a co-brainstormer with Suzuki-san.

Ito-san, she's my age, 55, and also 'balanced.' She would be someone who, like me, appreciates a well-thought-out concept. We could probably delve deeper into the practicality and potential issues of an idea. Maybe she's someone I'd go to once I've got a couple of solid concepts and want to refine them, look at them from all angles, and really think about the execution.

Considering the ""free ideas"" and ""think outside the box"" directive, I think my initial approach should be very open and collaborative with someone who can offer fresh, intuitive input. So, I'm leaning towards starting with **Suzuki-san**. We can just chat informally, explore wild ideas without worrying about making them perfect. It’s a good way to get a wide net of thoughts. Then, maybe bring in Tanaka-san for another round of intuitive brainstorming, or I might even just refine my own thoughts a bit more before seeking out Ito-san for a more structured discussion.

As for the other department, the option is there, but for this initial internal thought process, I think I'll keep it within the Fantasy Game Planning team for now. We've got plenty of creative minds here. Perhaps later, if I need a totally different perspective or information that's outside our department's usual scope, I'd consider reaching out. But for now, focusing on the core team seems like the most effective way to kick things off.

So, step one: Brainstorm alone, let my experience and imagination run wild. Step two: Seek out Suzuki-san for some free-flowing, intuitive idea generation. That sounds like a solid plan.","Suzuki-san, have you been thinking about this new project at all? I was just contemplating how exciting it is that we have such an open canvas for this one, especially with our department's broad fantasy direction and the freedom to really think outside the box. I was hoping we could just chat and perhaps toss around some initial, wild ideas without worrying too much about them being perfectly formed just yet, given your intuitive approach often sparks such interesting connections.","Oh, wow, speak of the devil! That’s actually perfect timing. I was literally just thinking that once I had some initial thoughts jotted down, Watanabe-san would be exactly the person I'd want to bounce those wild ideas off of. She totally gets my intuitive approach, and she's right, sometimes just throwing things out there without worrying about how polished they are can spark amazing connections. It's great that she's thinking the same way. This is exactly what I need right now. No need to hold back, I can just dive right into my initial brain-spill with her. This feels like a good start. I don't need to think about who to talk to next, because the conversation is happening right now!",4,"Watanabe-san, oh yes, absolutely! I've been mulling over this new project quite a bit, and you've hit the nail right on the head; the sheer freedom we have with this is exhilarating, isn't it? I was just thinking how perfect it is that we're having this chat right now, because I was specifically hoping to run some of my raw, unformed thoughts by you. Your balanced perspective is exactly what I need to help weave some sense out of the intuitive sparks that have been flying around, and I completely agree that letting loose with wild ideas without the pressure of perfection is how the most interesting concepts emerge. With seven turns left before Yamamoto-san submits the proposal, now is the absolute best time to just let our imaginations run wild and see what magical or unexpected directions we can take this fantasy genre.","Oh, fantastic! It sounds like Suzuki-san and I are completely on the same page. Her enthusiasm is infectious, and it's great to hear she's been mulling things over too. ""Intuitive sparks"" and ""weave some sense"" – that's exactly what I was hoping for. It feels like our workstyles will really complement each other for this initial, broad idea generation.

Seven turns left, she's right, now's the time to just let everything out. No holding back, no self-censoring. Just pure, unadulterated fantasy ideas. We can dive into anything from peculiar magical systems, unique creature designs, story premises that turn tropes on their heads, or even completely novel gameplay mechanics that fit a fantasy setting. The wider we cast our net now, the more interesting fish we might catch.

I'm really looking forward to this chat with her. It's so much easier to build on an idea once it's out in the open, even if it's just a fleeting thought. I'll make sure to share some of the initial musings I had during my solo brainstorming, and I'm sure her intuitive perspective will either take them in a direction I hadn't considered, or spark something completely new. This is going to be a productive discussion, I can feel it.

After we've had a good round of throwing ideas back and forth, I'll probably have a clearer picture of which concepts have the most potential. Then, I might go back and refine those thoughts on my own for a bit, or perhaps loop in Tanaka-san next. His intuitive insights, combined with his experience, could add another layer of depth to the ideas that emerge from this first session with Suzuki-san. We're off to a good start!",1,Success
1,0,0,2,0,"Alright, let's see. This is an exciting opportunity, a real blank slate, which I appreciate. With my reflective workstyle, I really like having the space to think things through deeply before I start sharing too much or getting caught up in quick back-and-forths.

My first step is definitely to just sit with this prompt for a bit and let my mind wander. I need to come up with a story, concept, contents, slogan, and key selling points for a new game. And it's based on free ideas, which is fantastic. The department is ""Fantasy,"" but it explicitly says I can bring in other elements or even ignore it. That's liberating.

So, I'm thinking about ""fantasy"" first. What does that word truly evoke for me? It's often about magic, mythical creatures, grand quests, ancient prophecies, good versus evil, or exploration of unknown lands. But it doesn't *have* to be. Maybe it's a very personal fantasy, an internal one. Or a modern fantasy, hidden in plain sight.

And then, the gameplay styles are wide open: action, RPG, FPS, racing, competitive, puzzle, mystery, cooperative, life simulation, and beyond. This is where I can really stretch things. I'm drawn to things that offer a deep experience, something that makes you think, or allows for creative expression.

So, how do I approach this? I'm going to start by brainstorming some core themes or unique twists. Instead of just ""another fantasy RPG,"" what if we took a core fantasy element and flipped it? Or combined it with something unexpected?

For instance, what if ""fantasy"" wasn't about heroes, but about ordinary people living in a world where magic exists but is mundane, or even a burden? Or what if the ""fantasy"" is entirely metaphorical, a dream world that affects reality?

I'll spend some time just free-associating, writing down keywords, scenarios, and potential gameplay loops that emerge. I'll think about the core emotional experience I want players to have. Do I want them to feel wonder, dread, joy, serenity, or a sense of accomplishment?

Once I have a few strong, rough concepts jotted down—maybe three or four distinct directions—I'll start fleshing them out a little more. What kind of story would fit each concept? What would the main loop of the game be? What's the ""hook""?

Regarding who to consult first, given my reflective nature, I don't want to jump into a big group brainstorm right away. I need to have *something* tangible to talk about.
However, I could use a sounding board once I have some initial thoughts.
Takahashi, who is also reflective and older, might be a good person to approach first. We're both reflective, so he might appreciate the quiet consideration of ideas. I could perhaps share a couple of my nascent concepts with him, not for him to critique them immediately, but to see if they resonate, or if he has any initial, thoughtful reactions. It would be a more low-pressure way to get an external perspective without feeling like I need to perform or debate. He might also have a wealth of experience to draw upon, which could help refine my thinking.

I think I'll aim to develop a couple of strong concepts on my own first. Then, maybe a quiet chat with Takahashi to bounce off some ideas, see if I'm on the right track or if I'm missing something obvious. After that, perhaps I'd be more ready to engage with the intuitive types like Suzuki or Tanaka, who could bring in a burst of fresh perspectives to expand on what Takahashi and I might have discussed. And eventually, of course, I'll consolidate everything for Yamamoto, our leader.

Interacting with Nakamura from the Sci-Fi department is an interesting thought. If my ideas start leaning towards a blend of fantasy and something more futuristic or unconventional, she could be a great resource for a different perspective. But that's a step further down the line, once I've explored the ""fantasy"" core first. For now, it's about getting my own thoughts in order.

So, first, some quiet thinking time. Let the ideas simmer. Then, maybe Takahashi for a focused, reflective discussion. That sounds like a solid plan for me.","Takahashi, I was just reflecting on this new opportunity we have, the chance to really craft something from the ground up. Given our shared reflective approach, I thought it would be beneficial to perhaps have a quiet moment to just… ponder some initial concepts together. I’ve been letting my mind wander through what ""fantasy"" can mean, and how we might push beyond the usual boundaries, or perhaps combine it with unexpected elements, before we start bouncing ideas around more broadly. I value your perspective, and I find that discussing nascent thoughts with someone who also takes time to consider things deeply can be quite productive for me. Would you be open to sharing some initial musings when you have a moment?","Well, isn't that just perfect timing? I was literally just thinking about reaching out to Sato-san to bounce some initial ideas off him. His reflective nature, his experience, and the way he approaches things are exactly what I need to refine my thoughts before I even consider taking them further. He’s right, discussing ""nascent thoughts"" with someone who takes time to consider things deeply is incredibly productive. It's almost like he read my mind.

This is excellent. It saves me the trouble of initiating the conversation, and it confirms that he's open to the kind of exploratory, thoughtful discussion I was hoping for. It feels good to have a colleague on the same wavelength.

So, the plan solidifies: I'll talk to Sato-san next. I'll share my concept of ""Quiet Magic, Unfolding Mystery"" and the associated story, contents, slogan, and selling points. I won't present it as a finished product, but as musings, just as he suggested. I'll be looking for his honest feedback, any gaps he spots, or perhaps different angles I haven't considered. This will be a valuable step in making sure the idea has solid ground before it's presented more broadly. This feels like the right move, a solid, reflective start.",0,"Sato-san, that sounds like an excellent idea, and honestly, it's perfect timing because I was just contemplating reaching out to you myself. I really appreciate you suggesting this quiet moment to ponder together; I find that exchanging nascent thoughts with someone who also values deep consideration, like yourself, is incredibly productive for me too. I am absolutely open to sharing my initial musings with you when you're ready, and I'm eager to hear your perspective on them.","Ah, that’s great to hear! It's always a good feeling when your thoughts align with a colleague, especially one you value for their thoughtful approach. Takahashi-san also appreciating a quiet moment to ponder together, and even having been on the verge of reaching out himself, just reinforces that I'm on the right track by planning to consult with him.

His emphasis on exchanging ""nascent thoughts"" is exactly what I was hoping for. It means I don't need to have a fully fleshed-out, polished concept ready. Rather, it's about sharing those initial sparks, the fundamental directions, and seeing how they resonate, or if they trigger new ideas for him. That's a much more collaborative and less pressure-filled way to start, which suits my reflective nature perfectly.

So, the plan holds. I'll spend some focused time now, letting my mind truly wander and generate a couple of distinct game concepts. I'll try to get down the core story idea, a unique twist on the fantasy genre, and maybe a rough idea of the player experience for each. I'll aim for something more than just keywords, but not so detailed that it stifles further input. Just enough to be ""nascent thoughts"" that we can both prod and explore.

Once I have those few concepts in a more tangible form, that's when I'll reach out to Takahashi-san again. It'll be a more structured way to kick off our shared reflection, and I'm genuinely curious to hear what he's been musing on as well. This feels like a really solid and productive way to begin this project.",2,Success
1,5,0,3,0,"Alright, let's get my thoughts in order. It's a new project, a fresh start, which is always exciting. We need to come up with a completely new game idea, from story to selling points. No strict genre limits, which is actually quite liberating after all these years.

First things first, I need to generate some ideas. I've always enjoyed games that blend unexpected elements. ""Fantasy"" is our department, but the brief says we can really stretch that definition. I'm thinking about what makes a game truly engaging, something that sticks with players. It's often that unique twist, isn't it?

So, how do I approach this? I usually like to start by just letting my mind wander, jotting down anything that comes to mind, no matter how silly. Then, I'll try to find common threads or interesting juxtapositions. I'll think about different gameplay styles – action, RPG, puzzle, even life-sim elements – and how they could be combined in a new way.

Who should I talk to first? That's a good question. For initial brainstorming, I really value diverse input.
Takahashi is thoughtful and reflective, he'd probably give a very considered response, maybe even help refine a half-baked idea. Tanaka, on the other hand, is intuitive, which means he might throw out some truly wild, out-of-the-box concepts that I wouldn't even consider. That could be incredibly valuable for starting with ""free ideas."" Watanabe is my peer, same age, same workstyle; she'd be a great person to bounce ideas off of, maybe someone who understands my initial ramblings and can help shape them. Yamamoto, as our leader, will be the one submitting the final summary, so I'll definitely need to present a more polished idea to him later. But for starting, I don't want to go to the leader with just a jumble of thoughts.

I think for pure idea generation, I'd probably lean towards chatting with Tanaka first. His intuitive nature could really spark something unexpected. We could just throw ideas back and forth, no pressure, just see what sticks. Then, maybe I'd take some of those initial sparks and discuss them with Watanabe, since we have a similar workstyle and she might help ground some of the more fantastical elements into something feasible or at least coherent. After that, once I have a more solid concept, I could take it to Takahashi for his reflective input, to see if there are any blind spots or ways to deepen the experience.

As for the specific details I need to think about:
*   **Story:** It needs to be captivating, something that pulls players in. Not just a generic ""save the world"" trope. Maybe something with emotional depth, or a mystery.
*   **Concept:** What's the core hook? What makes it unique? This is where the ""free ideas"" really come into play.
*   **Contents:** What kind of gameplay loops? What activities will players engage in? How do different elements like combat, exploration, puzzles, or social interaction intertwine?
*   **Slogan:** Needs to be catchy, memorable, and encapsulate the game's essence.
*   **Key Selling Points:** Why would someone want to play this game? What makes it stand out from the crowd?

I'm thinking about a game that takes the fantasy element and gives it a very human, grounded twist. Perhaps not high fantasy with dragons and elves everywhere, but maybe something where magic is subtle, rediscovered, or even a burden. Or a blend of something historical with fantasy elements, like ""what if magic existed during a pivotal industrial revolution?""

I'll start by sketching out some very rough concepts on my own, just to get the gears turning. Then, I think a casual chat with Tanaka might be the best way to kick off the collaborative brainstorming process. I can just walk over to his desk and say something like, ""Tanaka-san, got a minute? I'm trying to wrap my head around this new project, and I'd love to just throw some wild ideas around with you. You always have such fresh perspectives."" Yeah, that sounds like a good plan.","Tanaka-san, do you happen to have a moment? I've been letting my mind wander about this new project, and honestly, the thought of starting from scratch with such broad creative freedom is quite exhilarating. I was hoping to just throw some really wild, unformed ideas around, and I immediately thought of you because you always seem to pull concepts out of thin air that I would never even consider. Perhaps we could just chat for a bit and see what sparks fly.","Oh, well, speak of the devil! That's perfect timing, Ito-san. I was literally just thinking about who to bounce some initial, completely unrefined ideas off of, and you were right there at the top of my list, alongside Watanabe-san. It's like you read my thoughts. ""Wild, unformed ideas,"" she says. Exactly what I need! And she thinks I ""pull concepts out of thin air""? Ha, that's a nice compliment, makes me feel like we're definitely on the same page for this kind of free-form brainstorming. This is great, exactly the kind of energy I was looking for to get things rolling. I'm already buzzing with a few really strange notions, and I bet she's got some good ones too. Yeah, definitely a moment. Let's see what sparks fly, indeed! No need to think about who to talk to next, the conversation is already here.",5,"Ito-san, you absolutely caught me at the right time; I was just mulling over who would be the best person to start tossing around some really raw, out-there concepts with, and you immediately came to mind, along with Watanabe-san. It feels like fate that you reached out, and I really appreciate you saying I pull ideas from thin air – that’s quite the compliment, and it makes me feel like we’re already on the same wavelength for this kind of freewheeling design process. I'm definitely buzzing with some rather peculiar notions myself, so let’s absolutely see what kind of interesting sparks we can generate between us.","Well, that’s fantastic! Talk about perfect timing. Tanaka-san’s just as eager as I am to dive into some really unconventional ideas, and it sounds like he’s already got some peculiar notions brewing. That’s exactly what I was hoping for – someone who isn’t afraid to throw out the wild, unformed stuff. He even mentioned Watanabe-san, which aligns perfectly with my own thoughts for who to bring into the mix after we've got some initial sparks flying.

This confirms that starting with him was absolutely the right move for this initial, freewheeling brainstorming. No need to hold back, we can just let our minds go wherever they lead. I really appreciate his enthusiasm; it makes this whole process much more enjoyable when you have a colleague who’s on the same wavelength.

So, the immediate next step is clear: I need to actually start bouncing those ""raw, out-there concepts"" with Tanaka-san. I'll probably just jump in with some of the vague blend ideas I was musing about earlier, like the historical-fantasy mix or the subtle magic concept, and see how he reacts, or if he's got something even crazier up his sleeve.

After we've churned out a good batch of initial ideas and perhaps identified a few core concepts that resonate, then I'll loop in Watanabe-san. She'll be great for helping to structure those wild ideas into something more coherent, maybe finding the threads that can be woven into a compelling story or gameplay loop. Then, once we have something semi-solid, Takahashi-san's reflective nature will be invaluable for poking holes or finding ways to deepen the experience. And finally, once we’ve refined it, I'll take it to Yamamoto-san, our leader, with a more polished pitch, making sure it hits all the required points like story, concept, content, slogan, and key selling points.

For now, though, it’s all about the free flow of imagination with Tanaka-san. Let's see what interesting sparks we can generate!",3,Success
