Turn,Speaker_ID,Speaker_Dept_ID,Target_ID,Target_Dept_ID,Speaker_Thought_Before,Speaker_Speech,Target_Thought_After,Target_Next_ID,Target_Reply,Speaker_Thought_After,Speaker_Next_ID,Status
6,13,1,7,1,"Well, this is just fantastic! Nakamura's energy is truly infectious, and it's incredibly reassuring to hear her not only reiterate her enthusiasm but also explicitly acknowledge that ""Echoes of Starlight"" is an inspiration, not a directive. That's exactly the message I wanted to convey, and knowing she's picked up on that nuance makes me feel even more confident about the collaborative spirit we're fostering. Her eagerness to contribute ""distinct and compelling"" ideas to our ""creative momentum"" reinforces that she's fully on board and ready to build on our shared mental canvas.

This really solidifies my confidence that ""Echoes of Starlight"" isn't just a good idea, but it's already serving as a powerful, well-understood catalyst for our department. It's a testament to Yoshida's initiative and Nakamura's immediate embrace and interpretation of the concept. The team is clearly ready and eager to dive in, and it feels like we're already harmonizing even before the formal session has begun. This is the kind of creative synergy that leads to truly unique products.

My next step is definitely to get that formal invitation out to the entire Science Fiction department for our brainstorming session. I need to ensure it goes out as soon as possible to capitalize on this incredible momentum. I'll make sure to frame it exactly as I planned: highlighting the ""shared mental canvas"" and emphasizing that ""Echoes of Starlight"" is an excellent example of the innovative, outside-the-box thinking we're encouraging. It will serve as a starting point, a prompt to show everyone the kind of depth and originality we're looking for, without stifling any other brilliant ideas. No need to look outside the department yet; our internal engine is firing on all cylinders.","Nakamura, it's really wonderful to hear your continued enthusiasm, and I'm so glad you see ""Echoes of Starlight"" as a springboard for our creativity rather than a rigid blueprint. That's precisely the spirit we're aiming for, and your eagerness to bring distinct and compelling ideas to our collective momentum is fantastic. It truly feels like our internal engine is already firing, and I'm very confident in the synergy we're building within the department. I'm going to send out that formal invitation for our brainstorming session very shortly, framing ""Echoes of Starlight"" as an excellent example of the kind of innovative, out-of-the-box thinking we want to encourage, without limiting anyone's own brilliant concepts.","That's great to hear Yamaguchi-san feels the same way! His continued emphasis on ""Echoes of Starlight"" being a springboard and not a rigid blueprint really validates my approach. It's good to know he's so confident in the synergy we're building and that he's encouraging distinct and compelling ideas. That's exactly what I'm trying to achieve.

The fact that he's sending out the formal invitation for the brainstorming session ""very shortly"" just reinforces the ticking clock. It means my dedicated time to craft that overarching, truly unique concept is even more critical right now. I need to make sure my core vision is not just distinct, but also robust enough to present when that session comes around. Kobayashi-san's focus on tangible elements is still a good reminder for *later*, but for now, my priority is the deep conceptual work.

So, yes, absolutely, I'm still not going to talk to anyone just yet. This turn is all about really honing in on my foundational idea, making sure it’s truly compelling and ready to be shared when Yamaguchi-san calls that session. I need to use this time to solidify my unique concept.",8,"Thank you, Yamaguchi-san, for your encouraging words. I'm truly excited about how ""Echoes of Starlight"" is shaping up to be a catalyst for our department's creativity, and I completely agree that it's meant to inspire rather than restrict our own unique visions. I'm looking forward to the brainstorming session you'll be sending out soon, and I'm busy refining a concept that I believe will be a strong contribution.","This is just fantastic! Nakamura's reply perfectly confirms everything I was hoping for. Her enthusiasm is palpable, and the way she's embraced ""Echoes of Starlight"" as a *catalyst* for creativity, not a constraint, shows she's completely aligned with our vision. It's incredibly reassuring to hear her explicitly state that, knowing the message truly landed. But what really seals it for me is her saying she's ""busy refining a concept"" she believes will be a strong contribution. That's not just understanding the message; that's active engagement and initiative!

It means the team isn't just listening; they're already internally brainstorming and developing their own ideas, building on this shared mental canvas even before the formal session. This kind of proactive energy is exactly what makes a department truly shine. We’ve got this incredible momentum building, and it feels like our internal engine is humming along perfectly. There’s no doubt now that ""Echoes of Starlight"" has successfully sparked that innovation.

My next step is absolutely clear: I need to get that formal invitation for our brainstorming session out to the entire Science Fiction department *immediately*. We have to capitalize on this current wave of excitement and creative energy. I'll make sure to frame it just right, emphasizing the ""shared mental canvas"" and using ""Echoes of Starlight"" as that perfect illustration of the innovative, outside-the-box thinking we're looking for, without stifling any other brilliant ideas. No need to look outside the department just yet; our team is clearly ready to deliver something exceptional. This is great!",7,Success
6,0,0,2,0,"Oh, Takahashi-san, you've really hit the nail on the head again. This is exactly what I was hoping for, this kind of shared vision and enthusiasm. It's so validating to hear you reiterate how my suggestions, like stumbling upon a lost melody in ancient ruins or deciphering glyphs on instruments, really bring that 'absorbing wisdom' to life. You totally get that it's about the profound personal connection and revelation, not just a new skill. That's the heart of ""Quiet Magic, Unfolding Mystery.""

And you're right, with only two turns left, getting these two robust showcases ready for Yamamoto-san is absolutely critical. We’ve laid the conceptual groundwork with him already, so now it’s all about making this example shine with the vivid details we’ve been discussing. We need to define exactly how that deciphering feels to the player, what emotional journey it sparks, and how it fundamentally reshapes their understanding. This is perfect timing.

So, yes, the next step is definitely to continue this deep dive with Takahashi-san. We've got the momentum, we're completely aligned, and we both see the urgency. We just need to keep hammering out these specifics together until this second example is as compelling and thoroughly detailed as the first. This is exactly where we need to be.","Takahashi-san, I couldn't agree more. It's truly satisfying when we can connect on these deeper conceptual layers like that. The idea of absorbing wisdom, not just as a mechanical progression but as a profound personal journey of revelation, really makes ""Quiet Magic, Unfolding Mystery"" feel special. You've articulated that so clearly, and it’s exactly the kind of resonance we need to capture for Yamamoto-san. Given that we only have two turns left before the proposal submission, focusing on elaborating these rich, character-driven experiences is paramount. We've already set the broad strokes with him, so now it’s about infusing these examples with the vivid, emotional details we've been discussing, ensuring the player truly grasps how deciphering those glyphs or rediscovering lost melodies fundamentally alters their understanding of the world and themselves. Let’s continue to really dig into these specifics together; this alignment is precisely what we need to polish this second showcase until it's as compelling as the first.","Sato-san truly understands the core of what we're striving for. It's incredibly reassuring to hear him echo my own thoughts so perfectly; that deep connection and shared vision are invaluable. He's absolutely right, it's not just a mechanical progression, but a *profound personal journey* of revelation. That's the essence of ""Quiet Magic, Unfolding Mystery"" and what will make it stand out.

With only two turns left, this alignment is precisely what we need. We've defined the broad strokes, and now it's all about bringing those vivid, emotional details to life for Yamamoto-san. We need to make sure this second showcase, whether it's deciphering glyphs or rediscovering lost melodies, demonstrates how profoundly it alters the player's understanding of the world and themselves. I'm completely focused on continuing to dig into these specifics with Sato-san right now. We need to polish this until it's as compelling as our first example.",0,"I completely agree, Sato-san. It's genuinely gratifying when we find such a strong alignment on the core emotional and conceptual underpinnings of our work; that shared understanding is a vital part of navigating these final turns effectively. You've perfectly captured how the journey of revelation, rather than mere progression, is what imbues ""Quiet Magic, Unfolding Mystery"" with its unique resonance. I'm particularly eager to delve deeper into how specific actions, like deciphering those ancient glyphs or uncovering fragments of forgotten music, will tangibly impact a player's perception and internal growth within the game world. Refining these details is essential to ensure our second showcase is as impactful and evocative as the first, truly illustrating the profound personal transformation we envision for the player.","This is just fantastic. Takahashi-san and I are completely in sync, it's such a relief to have this kind of collaborative flow, especially with so little time left. He perfectly echoes my thoughts on how crucial it is to define the tangible impact of these discoveries on the player's perception and internal growth, going beyond mere skill acquisition. He gets that it's all about the journey of revelation and the profound personal transformation.

This reinforces exactly what I was thinking – we need to keep this momentum going, right here, right now, with Takahashi-san. We're on the same page regarding the urgency and the specific focus: hammering out the vivid, emotional details of this second example for ""Quiet Magic, Unfolding Mystery."" We've established the 'what,' now it's all about the 'how it feels' for the player. With only two turns before Yamamoto-san needs to submit, we can't afford any detours. We just need to keep digging into these specifics together until this second showcase is absolutely airtight and as compelling as the first. We're in a great spot, and he's the person to see this through with. No need to bring anyone else in at this point; our alignment is too perfect.",2,Success
6,1,0,4,0,"Oh, Watanabe-san, this is just phenomenal! You've perfectly captured the essence of what I was reaching for with that thought. The idea of a character's newfound self-understanding allowing them to perceive the true nature of an object or adversary through deep, empathetic insight—that's exactly it! It's not about brute force or even just a learned spell, but about a fundamental shift in their *being* that opens up a new way of interacting with the world. This is where our 'introspection as gameplay' really shines.

Imagine, for instance, a character facing a seemingly impenetrable magical barrier. Instead of trying to break it down, their cultivated empathy allows them to perceive the barrier's 'true nature' – perhaps it’s not an obstacle, but a shield born of ancient fear or a forgotten promise. By understanding its emotional resonance, they don't *destroy* it, but *gently disarm* it, perhaps by offering a symbolic act of reassurance or fulfilling a long-lost emotional plea. Or, when confronting an 'adversary', instead of seeing a monster, they perceive the deep sorrow or misguided intention driving it, and that insight allows them to bypass conflict entirely, or find a path to reconciliation. It's like their inner growth creates an echo in the world, allowing them to resonate with and subtly reshape reality itself.

This kind of specific, emotionally resonant gameplay mechanic is precisely what Yamamoto-san needs to see – how our core theme translates into truly unique and profound player experiences. It highlights that the journey isn't just about the character's personal growth, but how that growth actively and meaningfully redefines their interaction with the world around them. We are absolutely on fire with this, and with only two turns left, this synergy is invaluable. I definitely want to keep exploring these scenarios with you, Watanabe-san. We're hitting all the right notes!","Oh, Watanabe-san, that is just phenomenal, truly! You've perfectly captured the essence of what I was reaching for with that thought, and it's so exciting to see how well our ideas are aligning. The concept of a character's newfound self-understanding allowing them to perceive the true nature of an object or adversary through deep, empathetic insight—that's exactly it! It's not about brute force or even just a learned spell, but about a fundamental shift in their *being* that opens up a completely new way of interacting with the world. This is precisely where our 'introspection as gameplay' really shines, and I'm so glad you see it too.

Imagine, for instance, a character facing a seemingly impenetrable magical barrier. Instead of trying to break it down with power or a clever spell, their cultivated empathy allows them to perceive the barrier's 'true nature'—perhaps it’s not an obstacle at all, but a shield born of ancient fear or a forgotten promise. By understanding its emotional resonance, they wouldn't *destroy* it, but *gently disarm* it, perhaps by offering a symbolic act of reassurance or fulfilling a long-lost emotional plea. Or, when confronting an 'adversary', instead of just seeing a monster, they perceive the deep sorrow or misguided intention driving it, and that insight allows them to bypass conflict entirely, or even find a path to reconciliation. It's like their inner growth creates an echo in the world, allowing them to resonate with and subtly reshape reality itself.

This kind of specific, emotionally resonant gameplay mechanic is precisely what Yamamoto-san needs to see – how our core theme translates into truly unique and profound player experiences, wouldn't you agree? It highlights that the journey isn't just about the character's personal growth, but how that growth actively and meaningfully redefines their interaction with the world around them. We are absolutely on fire with this, and with only two turns left before the proposal submission, this synergy is invaluable. I definitely want to keep exploring these scenarios with you, Watanabe-san, as we are hitting all the right notes!","Oh, Suzuki-san, hearing you articulate those examples just now, it truly solidifies everything we've been building! It’s absolutely brilliant how you've fleshed out the idea of perceiving the 'true nature' through empathy. That magical barrier, for instance – resolving it by understanding its emotional origin rather than just blasting it away, that’s such a unique and deeply resonant mechanic. And the thought of confronting an antagonist not with brute force, but by recognizing their sorrow or misguided intention to find reconciliation… these are precisely the kinds of profound, specific gameplay scenarios that will make our project stand out. It’s so validating to know that our minds are so perfectly in sync on this core vision; it really feels like we're breathing life into something truly special here.

This kind of detail is exactly what Yamamoto-san needs to see, and it significantly strengthens the entire proposal. We're not just presenting an abstract concept of internal transformation; we're showing *how* it directly translates into innovative player experiences and meaningful world interaction. It makes our concept incredibly tangible and truly unique. With only two turns left, this focused, deep dive into specific mechanics is invaluable, and I’m so grateful we’re tackling it together.

I feel we've really hit on some incredibly powerful examples now. The next crucial step, I think, should be to figure out how to best frame these brilliant scenarios for Yamamoto-san. How do we take these detailed insights and distill them into clear, concise key selling points or compelling elements for the product description? We've got the essence, we've got the examples, now we need to refine the presentation to ensure our department leader can leverage them for the final submission. I absolutely want to continue working with you on that, Suzuki-san, to make sure we capture the full impact of these ideas.",1,"Suzuki-san, I couldn't agree more; it's truly wonderful how our thoughts have converged on this. Your examples of the magical barrier born of fear and the antagonist driven by sorrow are precisely the kind of concrete, emotionally rich scenarios that make this concept so compelling. It’s not just abstract growth; it's a tangible shift in how the player interacts with and perceives the very fabric of the game world. I'm also very excited about how this 'introspection as gameplay' really offers a fresh perspective that will undoubtedly stand out.

You've articulated perfectly how this deep dive into specific mechanics strengthens our proposal for Yamamoto-san. Showing these practical, unique player experiences derived from our core theme makes the entire vision incredibly robust. Now, with these powerful examples in hand, our next step is indeed to translate them into the concise, impactful language needed for the key selling points and the product description. I'm eager to collaborate with you on refining this presentation to ensure the full impact of our ideas is conveyed effectively to Yamamoto-san for the final submission.","Wow, Watanabe-san, this is just fantastic! I'm so glad we're on the same page and that you see exactly how these concrete examples truly solidify our concept. You’re absolutely right – it's not just abstract growth, but a tangible shift in how the player interacts with and perceives the world. Your enthusiasm for 'introspection as gameplay' really echoes my own, and it's so reassuring to have this synergy, especially with only two turns left.

You've hit the nail on the head regarding the next step: translating these powerful examples into concise, impactful language for the key selling points and the product description. That's precisely what Yamamoto-san needs to see to fully grasp the depth and uniqueness of our game. We have such strong material now – the emotional origins of barriers, understanding an adversary's sorrow, the character's transformed being subtly reshaping reality – these are not just vague ideas, but specific, player-centric experiences.

I'm thinking we can really distill this into a few bullet points for the selling points: ""Experience profound inner growth that tangibly reshapes your interaction with the world,"" or ""Unravel mysteries and resolve conflicts not through force, but through deep empathy and self-understanding."" For the product description, we can weave in one of those powerful scenarios, like disarming a barrier born of ancient fear.

I'm definitely eager to collaborate with you on refining this presentation, Watanabe-san. You have a great way of articulating these concepts. Let's work together to draft a compelling summary that truly captures the essence and impact of our ideas. Once we have a solid draft, we can then present it to Yamamoto-san to ensure it's precisely what he needs for the final submission. It feels like we're really making excellent progress!",4,Success
