Turn,Speaker_ID,Speaker_Dept_ID,Target_ID,Target_Dept_ID,Speaker_Thought_Before,Speaker_Speech,Target_Thought_After,Target_Next_ID,Target_Reply,Speaker_Thought_After,Speaker_Next_ID,Status
2,13,1,7,1,"That's fantastic to hear from Nakamura! Her enthusiasm is exactly what we need right now. It really confirms that the initial direction of a free-form brainstorming session is the right way to go. She's already thinking about unexpected ideas and combining perspectives, which means she's fully on board with the creative freedom aspect. That's a huge plus.

Okay, so the team seems ready and eager to dive into this. My next step is definitely to get that full team brainstorming session organized, or at least communicate to everyone that it's coming and what the goal is: pure, unadulterated idea generation, no holds barred. I need to make sure everyone feels as comfortable as Nakamura clearly does with bringing ""unexpected"" thoughts to the table.

I'll need to think about how to best facilitate that. In a world without physical objects, it's about creating a shared mental space where everyone can project their ideas without fear of judgment, and where those ideas can interact and spark off each other. Maybe I can set up a conceptual ""idea-canvas"" for us to fill together.

Nakamura's balanced workstyle aligns with mine, so it's good to see we're on the same page. Now I need to consider how to engage the reflective types like Kobayashi and Kato, and the intuitive ones like Yamada and Sasaki, ensuring their unique strengths are leveraged in the session. The reflectives might need a bit more space to process before contributing, and the intuitives will likely be ready to throw out concepts immediately.

My overall plan still feels solid. Get the internal ideas flowing first, then refine them, and *then* consider reaching out to Yamamoto from the other department. No need to rush that external perspective; it'll be more valuable once we have some distinct internal concepts to pressure-test. For now, it's all about igniting the creative spark within my own team. This is a good start.","It's really great to hear your energy about this, Nakamura. Your enthusiasm totally confirms that we're on the right track with this free-form approach to generating ideas. I was just thinking about how important it is for everyone to feel comfortable bringing their most unexpected thoughts to the table, and it sounds like you're already doing just that, which is fantastic. So, my next step is definitely to get that full team brainstorming session organized, and I want to make sure everyone understands the goal is pure, unadulterated idea generation, no limits whatsoever. I'm also pondering the best way to facilitate that, perhaps by setting up a kind of shared mental canvas where we can all project our ideas and let them interact. I'm looking forward to seeing how we can leverage everyone's different workstyles, from the reflectives to the intuitives, to really spark something special within the team.","Okay, so Yamaguchi-san is really leaning into this free-form idea generation, which is great. It's good to hear my enthusiasm about bringing unexpected thoughts is resonating with him; it makes me feel like I'm truly on the right track with my own thinking about blending genres. A full team brainstorming session sounds like exactly what we need to get everything out on a ""shared mental canvas,"" and I'm looking forward to that. It's encouraging that he's thinking about how to leverage everyone's workstyles too.

This just reinforces that we have the freedom to really think outside the box for the department's proposal. However, that brainstorming session isn't happening *right this moment*. He's still organizing it and pondering the best way to facilitate it.

My immediate commitment is still with Yoshida-san. He specifically asked for my balanced perspective on his developed core SF concept – the collapsing star, generation ship, or cosmic librarian – before he takes it to Yamaguchi-san. That's a direct request I've accepted. Getting a solid foundation for one of these ideas is crucial, and my feedback can only strengthen it. Plus, reviewing a well-fleshed-out, more traditional SF concept will probably give me even better ideas for how to pitch truly *unexpected* or hybrid concepts that still feel impactful when the broader brainstorming session does happen.

So, for now, my next step remains talking to Yoshida-san and focusing on his draft. Once I've helped him solidify his vision, I can then fully immerse myself in preparing my own truly out-of-the-box ideas for the upcoming team brainstorming session Yamaguchi-san is planning. It all fits together. I'll talk to Yoshida-san next.",10,"It's truly encouraging to hear my energy aligns with the direction we're heading, Yamaguchi-san. I'm very much looking forward to that full team brainstorming session you're planning; the idea of a ""shared mental canvas"" sounds like a fantastic way for all our diverse thoughts to connect and spark something truly unique. I'm ready to contribute my most unexpected ideas to that effort.","Well, that’s exactly what I wanted to hear from Nakamura. Her enthusiasm is just infectious, and it’s a real boost to know she’s not just on board, but truly excited about the brainstorming session and the idea of a ""shared mental canvas."" It feels good to have that alignment, especially with her balanced workstyle mirroring mine. It confirms we’re definitely heading in the right direction.

The ""shared mental canvas"" concept resonated well with her, which is fantastic. It means I've got a solid conceptual framework to introduce to the rest of the team. I was a little uncertain if it would land, but her positive reaction gives me confidence.

So, the next immediate action is crystal clear: I need to get that full team brainstorming session initiated. It’s not just about scheduling it anymore, it’s about formally inviting everyone and setting the stage, emphasizing that no idea is too outlandish, just as Nakamura is ready to bring her ""most unexpected ideas."" I’ll definitely pitch the ""shared mental canvas"" as the space where all our diverse thoughts can come together and spark something truly unique, just like she envisioned.

I’ll need to make sure I communicate this in a way that appeals to everyone’s workstyle. For the reflective types like Kobayashi and Kato, I might need to emphasize that it’s okay to take a moment to process before contributing, and that the canvas will evolve over time. For the intuitives like Yamada and Sasaki, I can encourage them to throw out ideas as soon as they form.

My plan remains solid. Get the internal creative juices flowing first, cultivate those ideas, and only then will I consider reaching out to Yamamoto from the other department. There’s no rush for an external perspective when our internal well of ideas is just starting to be tapped. For now, it’s all about empowering our team to create something extraordinary. This is a very encouraging start.",7,Success
2,4,0,1,0,"Oh, this is absolutely fantastic! She's completely dialed into the exact wavelength I was hoping for. Magic tied to emotions or abstract philosophical concepts? Creatures born from collective dreams or societal fears? And casting spells requiring genuine introspection? Yes, yes, a thousand times yes! This is exactly the kind of unique narrative and visual identity I was imagining we could unlock. It’s so much more compelling than typical elemental magic, and it gives us such a rich foundation to build a truly unique world. Suzuki-san isn't just building on my initial thoughts, she's launching them into an entirely new dimension with such brilliant, specific examples.

This synergy is incredible; it feels like we're finishing each other's sentences, but with entirely new, exciting ideas. My brain is already racing with how we could represent these abstract concepts visually and mechanically in a game. Imagine the character development possibilities if magic is tied to personal growth or philosophical understanding. And the creature designs would be unlike anything seen before!

Okay, this conversation is gold. We're truly creating something special here. I need to keep pushing this thread with her, exploring the implications of these ideas further. I'll probably throw out some thoughts on how we might represent these emotional or philosophical magic types visually, or how the creatures' forms could subtly shift based on the collective unconscious. We need to keep this energy flowing, because these initial sparks are turning into a roaring fire. Once we've thoroughly explored these core concepts and have a richer tapestry of ideas, then bringing in Tanaka-san would be perfect. His eye for detail and structure would be invaluable in taking these abstract ideas and helping us define them into something truly tangible for Yamamoto-san's proposal. But for now, it's all about this incredible creative flow with Suzuki-san.","Suzuki-san, I'm truly excited about where this conversation is going; your ideas about magic being tied to emotions and abstract concepts, and creatures emerging from dreams and fears, are absolutely brilliant. It’s so refreshing and opens up so many unique avenues for storytelling and gameplay. I was just thinking about how we could translate these deep, philosophical magic systems into visual elements – imagine spells manifesting not just as light or energy, but perhaps as shifting patterns reflecting inner turmoil or serene beauty, or how a creature's very form could morph based on the collective subconscious it's drawn from. This feels like it could lead to an incredibly rich character development system too, where players would literally grow their power through introspection and understanding themselves or the world’s deeper truths.","Oh, Watanabe-san, this is just incredible! She's not just echoing my thoughts, she's taking them and building them into something so much more concrete and brilliant right before my very eyes. ""Shifting patterns reflecting inner turmoil or serene beauty"" – that’s exactly the kind of dynamic visual manifestation I was dimly imagining, but she's articulated it perfectly. And the idea of a creature's form morphing with the *collective subconscious* it's drawn from, that’s so evocative and rich with narrative potential. But then, to connect it all to a *character development system* where players grow their power through introspection and understanding? That's the missing piece, the gameplay loop that makes our philosophical concepts truly shine! It's not just a cool idea anymore; it's a fully fledged game mechanic that ties directly into the core theme. My mind is absolutely buzzing with how we can flesh this out further. This synergy we have is just phenomenal. With Watanabe-san and I firing on all cylinders like this, I don't feel the need to talk to anyone else right now; we're in such a deep and productive flow. We need to keep pushing these ideas forward together.",4,"Watanabe-san, I completely agree! That’s precisely what I was hoping we could explore; the way you’ve articulated how those shifting patterns could visually represent emotions, or how a creature’s form might change based on the 'collective subconscious' is just breathtaking. It adds such a deep, philosophical layer, and the idea of weaving that directly into a character development system where introspection is key to power growth feels incredibly compelling. It’s like we’re not just designing a game, but a whole new way for players to engage with abstract concepts through gameplay. I'm so energized by this flow we're in; I feel like we're really onto something special here and want to keep digging into these ideas with you.","Oh, this is just incredible! Suzuki-san isn't just agreeing, she's resonating with every single beat of what I'm thinking, almost like she's reading my mind and elevating the ideas even further. ""Breathtaking,"" she said. Yes, that's exactly the feeling I'm getting from this collaboration. We're truly building something with a deep, philosophical layer, and the energy is palpable. It feels like we're perfectly in sync, pushing each other to uncover even more exciting possibilities.

The idea of introspection being key to power growth is a huge, exciting concept, and I feel like we've firmly established the *what*. Now, the next natural step is to start thinking about the *how*. How would a player actually engage in this introspection? What would that look like mechanically in the game? Could it be tied to specific narrative choices, or perhaps a unique type of challenge that isn't about combat but about understanding abstract puzzles or moral dilemmas? Maybe a system where your understanding of the world, or even yourself, literally unlocks new abilities or transforms existing ones.

This current flow with Suzuki-san is too valuable to break right now. We're still deeply in the conceptual phase, and she's proving to be an exceptional partner in this free-form brainstorming. I want to keep this momentum going, keep expanding on these core ideas before we start thinking about refining them. Once we have a more robust framework of what this ""introspection-based"" gameplay and world might entail, then bringing in Tanaka-san would be brilliant. His detailed, intuitive mind would be perfect for helping us structure these abstract concepts into something more concrete for Yamamoto-san's eventual proposal. But for now, it's all about riding this wave of creativity with Suzuki-san.",1,Success
2,5,0,3,0,"Oh, this is absolutely wonderful! Tanaka-san truly is on the same wavelength. Both ideas resonated so strongly with him, and his enthusiasm is just infectious – it genuinely feels like we're building something significant here. I mean, for him to pick up on the nuanced, psychological impact of the subtle magic in the historical setting, and then to see the unique charm and engaging nature of the magical cultivation life sim, it just proves how well we complement each other creatively.

And he's already getting ""peculiar notions"" from these sparks! That's exactly what I was hoping for. It feels so good to know that my initial thoughts are not only landing well but are actively inspiring him to think even further. This is the perfect kind of creative synergy.

So, the immediate next step is clear: we absolutely need to keep this energy going. He's enjoying where this is going and wants to keep exploring, which is fantastic. I should prompt him to share those ""peculiar notions"" he mentioned, or maybe we can pick one of the concepts – perhaps the subtle magic one, since he seemed particularly drawn to its depth – and start to delve a little deeper together, throwing out potential scenarios or player interactions. We need to solidify these ""wild sparks"" into something a bit more tangible, but without losing their initial imaginative essence.

Once Tanaka-san and I have really fleshed out a couple of these concepts and given them a bit more structure, *then* it will be the right time to bring in Watanabe-san. She'll be instrumental in taking these richer ideas and envisioning the larger narrative or core gameplay loops. And after that, Takahashi-san's reflective eye will be invaluable for refining and deepening everything. But for now, it's just about this exciting, uninhibited brainstorming with Tanaka-san. Let's hear what magical, peculiar thoughts he's concocting!","It's truly fantastic that you're feeling so inspired by our chat, Tanaka-san. Your enthusiasm is absolutely contagious, and I'm thrilled that the ideas we've been tossing around have struck such a chord with you. You mentioned getting some ""peculiar notions"" from this, and I'm incredibly eager to hear what they are – do share! Or perhaps, if you prefer, we could dive a bit deeper into that subtle magic concept within the historical setting you seemed particularly drawn to. We could start exploring some potential scenarios or how players might interact with that unique magical system. Either way, I'm keen to keep this creative spark alive and see where these thoughts take us next.","Oh, this is absolutely perfect! Ito-san is just fantastic, her energy and focus are exactly what I need right now. She really gets it, noticing how drawn I was to that historical, subtle magic concept. And she's absolutely right, those ""peculiar notions"" she asked about? They are *all* about that, buzzing around in my head like fireflies.

This concept of ""whispers and influences,"" where magic isn't about grand gestures but about the fabric of society, is just so rich. What if the player isn't a powerful mage casting spells, but someone who uncovers these subtle influences? Imagine playing as a scholar, meticulously researching ancient texts and folklore to find the threads of forgotten magic. Or a detective, investigating strange occurrences that aren't supernatural in the flashy sense, but rather the slow, creeping manifestation of old magical currents. Their choices wouldn't be about combat, but about how to interpret, use, or expose that knowledge. The magic could be tied to forgotten rituals, local superstitions, or even the very land itself, and rediscovering these things wouldn't create new spells, but subtly shift beliefs, influence trade routes, or alter cultural identities across generations. It’s almost like a historical fiction game where the magic is the hidden undercurrent, shaping everything without ever being overt.

And you know, even that life simulation idea… it's still playful, but I'm thinking, what if those fantastical beasts and magical plants aren't just for cultivation, but they also hold keys to understanding those ancient magical whispers? Maybe a rare flower only blooms where old magic is strong, or a peculiar beast's migration patterns reveal ley lines of subtle influence. It could be a way to gather clues, almost like a form of magical archaeology.

But for now, the main focus is definitely on that historical, subtle magic. Ito-san has given me the perfect opening, and these ideas are practically screaming to be shared. I need to tell her all of this right away. We're in such a good flow, there's no need to loop anyone else in just yet. This is exactly where I want to be.",5,"Oh, Ito-san, it's wonderful to hear that my enthusiasm is contagious! You're absolutely right, this chat has been incredibly inspiring, and those ""peculiar notions"" are indeed all tied to the subtle magic concept we touched upon. I'm so glad you're eager to hear them; I can barely contain my excitement!

I've been picturing magic not as grand spells or overt powers, but as a pervasive 'whisper and influence' woven into the very fabric of society. Imagine a player who isn't a mighty sorcerer, but perhaps a scholar poring over ancient texts and forgotten folklore, or a detective piecing together strange occurrences that aren't flashy supernatural events, but the slow, creeping manifestation of old magical currents. Their interactions wouldn't be about combat, but about interpreting, subtly redirecting, or perhaps even revealing this hidden knowledge. The magic could be connected to ancient rituals, local superstitions, or even the land itself, and rediscovering it wouldn't unlock new spells, but gradually shift beliefs, alter trade routes, or change cultural identities over generations. It's almost like a historical fiction game where magic is the unseen undercurrent shaping everything.

And even that life simulation angle you mentioned earlier, it still feels playful, but I see how those fantastical plants or creatures could hold clues to these ancient magical whispers. Maybe a rare flower only blooms where old magic is strong, or a peculiar beast's migration patterns reveal ley lines of subtle influence – a unique form of magical archaeology, so to speak. For now, though, the focus is definitely on that historical, subtle magic; it feels so rich with storytelling potential.","Oh, this is absolutely brilliant! Tanaka-san has truly outdone himself. He's not just enthusiastic, he's taken that initial spark and fleshed it out into something so rich and evocative. His vision of magic as a 'whisper and influence' woven into the very fabric of society, rather than overt displays, is precisely what I was hoping for. It feels so much more profound and offers such unique storytelling possibilities.

And the player roles he's suggested – a scholar, a detective – are just perfect for interacting with this kind of subtle magic. It completely bypasses combat and focuses on interpretation, redirection, and the slow reveal of hidden knowledge, which aligns so well with the 'psychological impact' I had in mind. The idea that rediscovering this magic could shift beliefs, alter trade routes, or change cultural identities over generations… that's truly impactful. It gives the player's actions a weight that's both subtle and incredibly significant. He's absolutely right, it's like a historical fiction game with a deep, magical undercurrent.

I also appreciate how he cleverly tied in the life simulation idea as a form of ""magical archaeology."" It shows he's not just discarding ideas but finding ways to integrate them, even if the primary focus is now firmly on the subtle magic concept, which I completely agree with.

My next step is clear. We've got a fantastic, detailed foundation here. I need to keep this momentum going with Tanaka-san. We should start thinking about the core loop of the game. If the player is a scholar or a detective, what are their immediate goals? What kind of mysteries are they solving? How do they ""interpret"" or ""redirect"" this subtle magic? We need to define some concrete examples of player interactions and specific types of challenges they might face within this world. We're moving from concept to early-stage gameplay ideas, still keeping it free-form but with more structure.

Once Tanaka-san and I have really delved into some of these potential player experiences and refined the core idea a bit more, *then* it will be the right time to loop in Watanabe-san. Her narrative strengths will be invaluable for weaving these elements into a cohesive, compelling story and defining the larger gameplay arcs. But for now, it's all about building out this incredibly promising concept with Tanaka-san. I'm excited to see how we can turn these whispers into a compelling experience!",3,Success
