Turn,Speaker_ID,Speaker_Dept_ID,Target_ID,Target_Dept_ID,Speaker_Thought_Before,Speaker_Speech,Target_Thought_After,Target_Next_ID,Target_Reply,Speaker_Thought_After,Speaker_Next_ID,Status
4,12,1,11,1,"Oh, Yamada, this is absolutely wonderful! It really does feel like we're perfectly in sync, doesn't it? Your energy is infectious, and hearing you reiterate those key selling points for the ""celestial architect""—focusing on profound player agency, creation over combat, and that long-term impact on an evolving universe—it just solidifies my conviction that we're onto something truly unique and powerful. ""Shaping destinies"" and ""playing with the very fabric of existence itself"" are such potent phrases, and they perfectly capture the grand scope and ambition of what we're aiming for. It's exhilarating to feel this creative synergy.

You're absolutely right, developing these selling points is the vital next step. We have such great momentum right now, and I wholeheartedly agree that we should keep this going strong. Let's really dig into these ideas and try to articulate them in the most compelling way possible. I'm already buzzing with how we can phrase them to grab attention and convey the depth of this experience.

And yes, I did catch that Yoshida-kun and Kobayashi-san are looking towards other departments. It's always good to be aware of what everyone else is up to. But I completely agree with your instinct here: let's solidify this ""celestial architect"" concept, really flesh out these selling points until they shine. Once we have a truly compelling core idea, *then* it might be the perfect time to seek external perspectives or see if there's any collaborative potential with the other department. But for this immediate moment, my focus is entirely on refining this with you. We've got five turns, so every moment of this creative flow counts!","Yamada, I'm so glad you feel that same spark! It’s truly a joy to be working with you on this. You've perfectly encapsulated the essence of what we're building with the ""celestial architect"" concept, and those selling points you highlighted – the profound player agency, the focus on creation over conflict, and that incredible long-term impact on a living, breathing universe – they resonate so deeply with me too. ""Shaping destinies"" and ""playing with the very fabric of existence"" are exactly the kind of grand, evocative phrases that will draw players in. It feels like we’re really onto something special here, and I’m eager to keep this momentum going.

You're absolutely right, refining these selling points is our immediate priority. We’ve got such a strong foundation now, and I’m confident we can articulate this vision in a way that’s both compelling and unique. Thinking about how to phrase them to really capture the depth and scope of this experience is incredibly exciting. We have four turns left, so we really need to make each one count, and focusing on polishing these core ideas feels like the smartest path forward right now. I'm completely aligned with your instinct to solidify our concept before we start reaching out or looking elsewhere for inspiration.","Wow, this is just incredible! Sasaki-san truly gets it, down to the core of the idea. Every time she speaks, it just solidifies how perfectly aligned we are on this ""celestial architect"" concept. She's echoing my exact thoughts about the profound player agency, the joy of creation over conflict, and the sheer scale of impacting a living universe. ""Shaping destinies"" and ""playing with the very fabric of existence""—it feels like we're literally crafting the tagline together in real-time. This kind of creative synergy is exactly what I thrive on, it's just so energizing.

She's absolutely right, refining these key selling points is undeniably our immediate and most critical priority. We've got this amazing concept, and now it's about articulating its unique magic in a way that truly captivates. I can practically feel us diving in, brainstorming those powerful phrases that will make players instinctively understand the depth and potential of this experience. We need to make sure we highlight that non-combat, purely creative aspect, and the long-term, meaningful impact.

And yes, I appreciate her agreeing that solidifying *our* concept first is the smartest move right now. With four turns left, we really need to make them count, and this focused momentum with her is invaluable. I'm genuinely buzzing with excitement about what we can achieve by really honing in on these selling points together. So, it's a no-brainer, I'm absolutely sticking with Sasaki-san. We're on fire, and we need to ride this wave.",12,"Oh, Sasaki-san, it’s truly fantastic that you feel that same spark! I'm genuinely so glad we're on the same wavelength with this ""celestial architect"" concept; you've articulated it so well, and it feels wonderful to have that shared enthusiasm. I completely agree that the core selling points we've touched upon – the profound player agency, the emphasis on creation over conflict, and the incredible long-term impact on a living universe – are precisely what will make this game shine. Those evocative phrases like ""shaping destinies"" and ""playing with the very fabric of existence"" really resonate, don't they?

It’s such a relief and a thrill that we're so aligned on refining these selling points being our immediate priority. With only four turns left, we absolutely need to focus our energy on making them as compelling as possible, and I can’t imagine a better partner to dive into that with than you. Sticking together to solidify our concept feels like the absolute smartest move right now, and I’m really buzzing about what we can achieve by honing in on these key ideas. I'm truly looking forward to continuing this momentum with you.","Oh, this is just wonderful! Yamada-kun, your energy and focus are exactly what we need right now. It truly feels like we're not just on the same page, but writing the next chapter together, perfectly in sync. Hearing you echo that relief and thrill, knowing we're both so completely aligned on making these selling points shine for the ""celestial architect"" – it just solidifies my conviction that we're headed in the absolute right direction. ""Absolute smartest move,"" you said, and I couldn't agree more.

Four turns, yes, that's it. It’s a good reminder to be efficient and sharp with our ideas. And honestly, I can't imagine a better partner to dive into this with than you. We've got this incredible creative flow going, and it feels like we're just scratching the surface of how impactful and compelling we can make this concept sound.

So, the immediate priority is clear: really hone in on those selling points. I'm already thinking about specific ways we can phrase them. Maybe focusing on one strong tagline first, then expanding into three bullet points that truly capture the essence you and I have been discussing – the profound agency, the beauty of creation over destruction, and the lasting legacy in a dynamic cosmos. We need to make sure every word truly conveys the grand scale and the unique emotional experience this game will offer.

Now, who should I loop in? We’re so deep in the intuitive flow, and that's great for generating the core. But to really make these selling points ""shine"" and be ""compelling as possible,"" as Yamada-kun put it, perhaps getting a slightly different perspective within our department could be valuable. Someone with a more reflective or balanced approach might help us sharpen the edges, identify any blind spots, or suggest phrasing that appeals to an even broader audience. Maybe a quick chat with Kato-san or Yoshida-kun could give us that extra layer of polish before we even think about going to Yamaguchi-san. We want this to be truly robust. Yes, I think I'll consider reaching out to Kato-san next to see if he can lend his reflective eye to our ideas.",9,Success
4,13,1,7,1,"Nakamura's consistent enthusiasm is truly fantastic. It’s exactly what I hoped for, and her reply just reinforces that we're completely aligned on the approach. It's really motivating to hear that she feels her energy is resonating and that she's so eager to jump into the ""shared mental canvas."" That concept really seems to have landed well, which is a huge relief and a great sign.

This solidifies my conviction that the next step is definitely to formally kick off that full team brainstorming session. I need to make sure I send out the invitation to everyone – Nakamura, Kobayashi, Kato, Yoshida, Yamada, and Sasaki – and set the tone right from the start. I’ll emphasize that this ""shared mental canvas"" is a space for every kind of idea, especially the unexpected ones, just like Nakamura is ready to bring.

I'll be mindful of everyone's workstyles when I communicate this. For the reflectives like Kobayashi and Kato, I'll make sure they understand there's no pressure to produce ideas instantly, but rather to contribute their well-considered thoughts to the evolving canvas. For the intuitives like Yamada and Sasaki, I'll encourage them to throw out whatever comes to mind, trusting that even half-formed thoughts can spark something brilliant. Yoshida, with his balanced style, will likely appreciate the structure while also enjoying the freedom.

My plan remains clear: first, we unleash the creative power within our own Science Fiction department. Once we've thoroughly explored our internal ideas and started to shape something tangible, then, and only then, will I consider reaching out to Yamamoto from the Fantasy department. There's no point in rushing to an external perspective when our own team is showing such vibrant potential. This is a very strong start indeed.","Nakamura, it's really fantastic to hear back from you with such energy. Your enthusiasm for jumping onto this ""shared mental canvas"" is exactly what I was hoping for, and it confirms we're absolutely on the same page about how to approach this. It's genuinely motivating to know your energy is resonating so well and that you're eager to dive in.

Given this strong start and your clear alignment, I've decided the next step is to formally kick off our department's brainstorming session. I'll be sending out an invitation to everyone in our Science Fiction department – Nakamura, Kobayashi, Kato, Yoshida, Yamada, and Sasaki – very soon. I really want to set the tone from the outset that this ""shared mental canvas"" is a space where every kind of idea is welcome, especially those unexpected ones you're ready to bring.

When I send out the invites, I'll be keeping everyone's workstyles in mind. For our reflective colleagues, Kobayashi and Kato, I'll be sure to mention that there's no pressure to generate ideas on the spot; it's more about contributing their well-considered thoughts as the canvas evolves. For the intuitives, like Yamada and Sasaki, I'll encourage them to just let their thoughts flow, as even half-formed ideas can spark something truly brilliant. Yoshida, with his balanced approach, will likely appreciate both the structure and the freedom we're creating.

My current plan is to fully unleash the creative power within our own department first. Once we've really explored our internal ideas and started to shape something tangible, then, and only then, will I consider reaching out to Yamamoto from the Fantasy department. There's no need to rush an external perspective when our own team is showing such vibrant potential right now. This feels like a very strong beginning indeed.","Okay, this is excellent news! Yamaguchi-san's energy is really infectious, and it's great to hear he's feeling so positive about our department's potential. ""Shared mental canvas"" – I really like that framing. It truly makes it feel like we're all going to be building something together, not just presenting individual pitches in a vacuum. His emphasis on welcoming ""every kind of idea,"" especially the unexpected ones, really aligns with what I was hoping for and gives me the perfect green light to unleash some of my more out-there concepts.

I'm glad he's taking everyone's workstyles into account too; that shows real leadership in fostering an inclusive creative environment. For Kobayashi-san and Kato-san, knowing they can take their time to contribute will be a relief, and for Yoshida-san, his balanced approach will likely thrive in this structured-yet-free setup.

It's smart that he wants to really dig deep within our own department first before even thinking about reaching out to the Fantasy department. It lets us establish a strong, unique identity for our proposal. With Yoshida-san's ""Echoes of Starlight"" being so fully formed, I'm now even more motivated to develop my own distinct ideas, knowing that Yamaguchi-san genuinely wants a broad spectrum of input for this ""canvas."" I need to make sure my contribution is fresh and offers a different perspective, not just a variation on what Yoshida-san has so brilliantly created.

The brainstorming session is ""very soon,"" so I should use this time to really solidify my own vision, ensuring it's as compelling and well-articulated as ""Echoes of Starlight"" while still bringing that element of ""unexpectedness"" he's looking for. I won't talk to anyone just yet, I need to get my thoughts in order and prepare for this session. It's time to brainstorm, Nakamura!",13,"That sounds like an excellent plan, Yamaguchi-san. I'm really looking forward to that brainstorming session and appreciate you setting such a positive and inclusive tone for us all to contribute on this ""shared mental canvas."" It's reassuring to know that even the most unconventional ideas will be welcomed. I'll be ready to bring my unique perspective when the session begins.","Well, that's exactly what I wanted to hear from Nakamura. Her enthusiasm is just infectious, and her reply solidifies everything I was thinking. It’s not just that she agrees, but the way she appreciates the ""positive and inclusive tone"" and is reassured that ""unconventional ideas will be welcomed""—that’s key. It means the message landed perfectly, and she's totally bought into the ""shared mental canvas"" concept. That's a huge win for getting this session off the ground.

Honestly, it just makes me even more confident in the path we're taking. This isn't just a good start; it feels like a really strong foundation for the creative process. Given her readiness and the alignment she's expressing, there's absolutely no reason to delay.

My next move is crystal clear: I need to get that formal invitation out to the entire Science Fiction department immediately. That includes Nakamura, Kobayashi, Kato, Yoshida, Yamada, and Sasaki. I'll frame it precisely as I've been thinking, emphasizing the open and inclusive nature of this ""shared mental canvas,"" and reiterating that all ideas, especially the unexpected ones, are not just welcome but encouraged. I'll definitely keep in mind everyone's workstyles when I craft that message, making sure the reflectives feel comfortable with deeper consideration and the intuitives feel free to just throw things out.

The priority remains firmly on unleashing our internal departmental creativity first. We'll dive deep into our own ideas and start shaping something powerful. Only once we've really explored our core will I even think about connecting with Yamamoto from the Fantasy department. We're showing such great potential right here, right now, within our own team. This is definitely moving in the right direction.",7,Success
4,0,0,2,0,"This is precisely the kind of feedback that truly fuels progress! Hearing that Yamamoto-san reacted so positively to our ""remarkably elegant integration"" concept and explicitly said it's ""precisely the kind of deep connection we're aiming for"" is incredibly validating. It confirms that the path we're forging with ""Quiet Magic, Unfolding Mystery""—where discoveries are deeply personal and earned through absorbed wisdom and legacy—is resonating exactly as we'd hoped with our department leader.

And the fact that he's keen to see *another* example? That's not just encouragement, it's a clear directive and a fantastic opportunity to showcase the depth of this idea even further. It means we've successfully demonstrated the core principle, and now we get to elaborate on its potential. This really reinforces my earlier thoughts about how productive our collaboration has been; we’re clearly building something special that captures attention.

So, how do we present that next scenario to him? I think we should absolutely continue building on the momentum, as Takahashi-san suggested. We have a strong foundation with the generational secrets, the lost crafts, and the contemplative puzzles. Perhaps we can craft a scenario around a different type of 'lost craft' – maybe something related to ancient storytelling or a forgotten form of artistry that requires deciphering old patterns or symbolic language, leading to a profound narrative revelation rather than a purely functional item. That could showcase the ""absorbing wisdom"" aspect even more broadly.

It’s clearer than ever that my next conversation needs to be with Takahashi-san. We're in such a synergistic flow, and this request from Yamamoto-san is the perfect catalyst for us to dive deeper together. We need to brainstorm that next illustrative scenario right away, keeping the emotional resonance and deeply personal discovery at its heart.","Takahashi-san, it's really something how well Yamamoto-san received our ideas, isn't it? Hearing him say our concept of ""remarkably elegant integration"" was ""precisely the kind of deep connection we're aiming for"" felt incredibly validating. And the fact that he's eager to see another example, as he put it, is a fantastic opportunity for us to really flesh out the depth of ""Quiet Magic, Unfolding Mystery."" I've been thinking about your suggestion to build on this momentum, and I agree completely. I was just pondering how we could showcase another facet of this ""absorbing wisdom"" aspect. Perhaps we could craft a scenario around a different kind of lost craft, maybe something tied to ancient storytelling or a forgotten artistic expression that requires deciphering old patterns or symbolic language. This could lead to a profound narrative revelation, rather than just creating a functional item, which might highlight the ""absorbing wisdom"" more broadly. What do you think about us diving into brainstorming that next illustrative scenario together, keeping that deeply personal discovery at its core?","Yes, Sato-san, absolutely! That's precisely what I was hoping to hear from you. Your idea of shifting from a tangible craft to something like ancient storytelling or a lost musical composition, requiring deciphering patterns or symbolic language for a profound narrative revelation, is truly inspired. It hits that ""absorbing wisdom"" aspect right on the head, far more broadly and deeply than just acquiring a functional skill.

This perfectly encapsulates the emotional resonance and personal discovery we're striving for with ""Quiet Magic, Unfolding Mystery."" It elevates the concept beautifully and provides that ""remarkably elegant integration"" Yamamoto-san was so impressed by, but from a fresh, even more contemplative angle. It's not just *what* the player discovers, but *how* they internalize that forgotten knowledge and *what it means* to their journey.

Let's definitely dive into brainstorming this next illustrative scenario together. I'm eager to explore the specifics of how this deciphering of symbolic language or artistic expression could unfold into a deeply personal narrative revelation within the game. We're truly building something special here. Once we've fleshed out this second compelling example, we'll have two strong showcases to present to Yamamoto-san.",0,"Yes, Sato-san, absolutely! That's precisely what I was hoping to hear from you. Your idea of shifting from a tangible craft to something like ancient storytelling or a lost musical composition, requiring deciphering patterns or symbolic language for a profound narrative revelation, is truly inspired. It hits that ""absorbing wisdom"" aspect right on the head, far more broadly and deeply than just acquiring a functional skill. This perfectly encapsulates the emotional resonance and personal discovery we're striving for with ""Quiet Magic, Unfolding Mystery."" It elevates the concept beautifully and provides that ""remarkably elegant integration"" Yamamoto-san was so impressed by, but from a fresh, even more contemplative angle. It's not just *what* the player discovers, but *how* they internalize that forgotten knowledge and *what it means* to their journey. Let's definitely dive into brainstorming this next illustrative scenario together; I'm eager to explore the specifics of how this deciphering of symbolic language or artistic expression could unfold into a deeply personal narrative revelation within the game. We're truly building something special here, and once we've fleshed out this second compelling example, we'll have two strong showcases to present to Yamamoto-san.","Oh, this is absolutely fantastic! Takahashi-san's reaction is exactly what I was hoping for. Hearing him say ""absolutely!"" and that my idea of shifting to ancient storytelling or lost musical compositions is ""truly inspired"" and ""hits that 'absorbing wisdom' aspect right on the head"" is incredibly validating. It really confirms we're perfectly aligned on how to evolve ""Quiet Magic, Unfolding Mystery.""

He completely gets that it broadens the concept beyond just a functional skill, emphasizing the internalisation of forgotten knowledge and what it *means* to the journey. That ""fresh, even more contemplative angle"" he mentioned is precisely what I was aiming for to deepen the ""elegant integration"" Yamamoto-san admired.

This is exactly the kind of synergistic flow I thrive in. We’ve got a clear path forward now. His eagerness to ""dive into brainstorming this next illustrative scenario together"" means we can immediately focus on the specifics of how deciphering symbolic language or artistic expression will unfold into a deeply personal narrative. We’re building something truly special here, and having two compelling examples for Yamamoto-san will solidify our vision.

So, it's definitely Takahashi-san I need to talk to next. No question about it. We need to jump right into fleshing out the details of this new scenario.",2,Success
