agent_id,question_id,answer_text,agent_name,dept,position,dept_id,pattern_id
6,Q15,I would feel completely secure in addressing a colleague about a mistake I observed.,Yamamoto,Fantasy Game Planning,Department Leader,0,4
6,Q16,My contributions are acknowledged and considered by my peers during discussions.,Yamamoto,Fantasy Game Planning,Department Leader,0,4
6,Q17,"Engaging colleagues for assistance proves a straightforward process, a testament to our collective openness.",Yamamoto,Fantasy Game Planning,Department Leader,0,4
6,Q18,Colleagues successfully maintain a strong flow of information regarding project developments.,Yamamoto,Fantasy Game Planning,Department Leader,0,4
6,Q19,"The team's information sharing attempts demonstrate a substantive commitment to discussing emerging concepts, while simultaneously ensuring all individual contributions receive consideration.",Yamamoto,Fantasy Game Planning,Department Leader,0,4
6,Q20,"Our team demonstrates a constructive blend of independent exploration and shared purpose, ensuring diverse contributions while aligning with overarching objectives.",Yamamoto,Fantasy Game Planning,Department Leader,0,4
6,Q21,I am very pleased with the active engagement and thoughtful contributions demonstrated by the team.,Yamamoto,Fantasy Game Planning,Department Leader,0,4
6,Q22,"My team members exhibit a high degree of aspiration alignment for team performance, with only minor, easily managed divergences in approach.",Yamamoto,Fantasy Game Planning,Department Leader,0,4
6,Q23,The current opportunities allow for a positive progression in my personal performance.,Yamamoto,Fantasy Game Planning,Department Leader,0,4
7,Q01,Seeking clarification from my team leader would present a moderate challenge.,Nakamura,Science Fiction Game Planning,General Member,1,4
7,Q02,"I can communicate my work opinions with my team leader with a forthright approach, as long as the subject is constructive.",Nakamura,Science Fiction Game Planning,General Member,1,4
7,Q03,I feel a degree of apprehension when discussing personal challenges or differences with my department leader.,Nakamura,Science Fiction Game Planning,General Member,1,4
7,Q04,I experience a considerable degree of openness in sharing my recommendations and ideas with my team leader.,Nakamura,Science Fiction Game Planning,General Member,1,4
7,Q05,"I would feel quite secure speaking to my team leader about a mistake, knowing that open communication is valued.",Nakamura,Science Fiction Game Planning,General Member,1,4
7,Q06,"I would feel quite secure raising concerns about a colleague's error with my team leader, given the supportive environment cultivated by Yamaguchi-san.",Nakamura,Science Fiction Game Planning,General Member,1,4
7,Q07,I feel my contributions are consistently recognized and appreciated by my team leader.,Nakamura,Science Fiction Game Planning,General Member,1,4
7,Q08,Yamaguchi-san provides a strong impetus for us to explore novel concepts and develop new competencies.,Nakamura,Science Fiction Game Planning,General Member,1,4
7,Q09,Yamaguchi-san's encouragement for creative risks demonstrates a strong willingness to support novel approaches.,Nakamura,Science Fiction Game Planning,General Member,1,4
7,Q10,"Approaching Kobayashi-san or Kato-san for preliminary genre-blending ideas presents a reasonable avenue for refinement, despite the absence of direct fantasy department input.",Nakamura,Science Fiction Game Planning,General Member,1,4
7,Q11,"I communicate my work opinions to peers with considerable openness, though I carefully select my initial audience when exploring novel concepts.",Nakamura,Science Fiction Game Planning,General Member,1,4
7,Q12,I find discussing personal matters with colleagues to be a rather neutral experience.,Nakamura,Science Fiction Game Planning,General Member,1,4
7,Q13,"I feel quite empowered to share my recommendations and ideas with my peers, as open dialogue is a valued aspect of our company culture.",Nakamura,Science Fiction Game Planning,General Member,1,4
7,Q14,I would feel quite safe speaking up to my peers if I made a mistake on this team.,Nakamura,Science Fiction Game Planning,General Member,1,4
7,Q15,"I would feel quite comfortable addressing a colleague's error, aiming for a constructive exchange.",Nakamura,Science Fiction Game Planning,General Member,1,4
7,Q16,"I believe my peers in the Science Fiction Game Planning department value my contributions, though I am unsure how external departments perceive my input.",Nakamura,Science Fiction Game Planning,General Member,1,4
7,Q17,Engaging colleagues for assistance presents a discernible challenge due to current project focal points and limited direct inter-departmental access.,Nakamura,Science Fiction Game Planning,General Member,1,4
7,Q18,Information flow within the team presents opportunities for enhancement to ensure comprehensive awareness of all work-related matters.,Nakamura,Science Fiction Game Planning,General Member,1,4
7,Q19,"The current information sharing attempts possess a substantial depth, yet certain immediate collaborative avenues remain undeveloped.",Nakamura,Science Fiction Game Planning,General Member,1,4
7,Q20,Our team maintains a commendable synergy in pursuing performance objectives.,Nakamura,Science Fiction Game Planning,General Member,1,4
7,Q21,I find the current commitment level adequate for our objectives.,Nakamura,Science Fiction Game Planning,General Member,1,4
7,Q22,"My immediate objective requires external consultation unavailable at present, necessitating independent development of hybrid concepts before engaging departmental colleagues.",Nakamura,Science Fiction Game Planning,General Member,1,4
7,Q23,The current opportunities provide a suitable framework for enhancing my personal performance.,Nakamura,Science Fiction Game Planning,General Member,1,4
8,Q01,"Continuing our detailed conceptual discussions with Kato-san offers a profoundly beneficial path forward for solidifying the core mechanics of ""Stellar Bloom.""",Kobayashi,Science Fiction Game Planning,General Member,1,4
8,Q02,I communicate my opinions about work issues with my team leader with a spirit of open collaboration.,Kobayashi,Science Fiction Game Planning,General Member,1,4
8,Q03,"I possess a comfortable disposition when discussing personal problems or disagreements with my team leader, as I value open communication for a more productive workflow.",Kobayashi,Science Fiction Game Planning,General Member,1,4
8,Q04,"I find myself quite at liberty to express recommendations and ideas to our team leader, as the current collaborative environment allows for substantial exploration of concepts.",Kobayashi,Science Fiction Game Planning,General Member,1,4
8,Q05,"I would feel perfectly secure expressing any errors to Yamaguchi-san, as I trust in his guidance and support for team growth.",Kobayashi,Science Fiction Game Planning,General Member,1,4
8,Q06,"I feel quite comfortable sharing observations regarding colleague actions with Yamaguchi-san, as our team values open communication for project enhancement.",Kobayashi,Science Fiction Game Planning,General Member,1,4
8,Q07,"My contributions find excellent reception from Kato-san, underscoring a robust alignment in our conceptualization for ""Stellar Bloom.""",Kobayashi,Science Fiction Game Planning,General Member,1,4
8,Q08,Our department leader’s support for novel tasks and skill acquisition is quite present.,Kobayashi,Science Fiction Game Planning,General Member,1,4
8,Q09,Yamaguchi-san demonstrates a strong capacity for supporting team members when challenges arise within the company.,Kobayashi,Science Fiction Game Planning,General Member,1,4
8,Q10,Continuing this focused discussion with Kato-san feels most productive for solidifying our current direction.,Kobayashi,Science Fiction Game Planning,General Member,1,4
8,Q11,"I communicate my opinions about work issues with my peers openly, finding great synergy when ideas are built upon collaboratively.",Kobayashi,Science Fiction Game Planning,General Member,1,4
8,Q12,I find that sharing personal reflections during collaborative discussions can enrich our understanding of each other's perspectives and foster a deeper connection within the team.,Kobayashi,Science Fiction Game Planning,General Member,1,4
8,Q13,I experience a substantial freedom in proposing recommendations and ideas to my peers.,Kobayashi,Science Fiction Game Planning,General Member,1,4
8,Q14,"I would feel quite comfortable discussing any errors with my colleagues, as our interactions foster an environment of shared learning and constructive dialogue.",Kobayashi,Science Fiction Game Planning,General Member,1,4
8,Q15,I would feel quite comfortable addressing a colleague's error with them directly.,Kobayashi,Science Fiction Game Planning,General Member,1,4
8,Q16,"My contributions are appreciated, and my ideas find resonance with my colleagues during collaborative discussions.",Kobayashi,Science Fiction Game Planning,General Member,1,4
8,Q17,"Collaborating with Kato-san on the deeper conceptual aspects of ""Stellar Bloom"" is proving exceptionally productive, and I find that extending this focused discussion with him is the most beneficial path forward for now.",Kobayashi,Science Fiction Game Planning,General Member,1,4
8,Q18,The exchange of information regarding work-related matters within our team shows considerable preparedness.,Kobayashi,Science Fiction Game Planning,General Member,1,4
8,Q19,"Our current information sharing on ""Stellar Bloom"" is deeply substantive, with Kato-san demonstrating exceptional comprehension and constructive expansion of my conceptualizations.",Kobayashi,Science Fiction Game Planning,General Member,1,4
8,Q20,"Our team's unity in striving for performance goals remains strong, with a shared commitment to our objectives.",Kobayashi,Science Fiction Game Planning,General Member,1,4
8,Q21,"My collaboration with Kato-san on ""Stellar Bloom"" is currently yielding exceptional progress, making me quite content with our focused engagement.",Kobayashi,Science Fiction Game Planning,General Member,1,4
8,Q22,"Kato-san and I share a profound alignment in our aspirations for ""Stellar Bloom,"" focusing on deep emotional resonance and consequential strategic gameplay.",Kobayashi,Science Fiction Game Planning,General Member,1,4
8,Q23,The current collaborative flow with Kato-san offers a profoundly enriching avenue for developing my conceptual contributions.,Kobayashi,Science Fiction Game Planning,General Member,1,4
9,Q01,Approaching my team leader with questions or uncertainties regarding my role is a straightforward process.,Kato,Science Fiction Game Planning,General Member,1,4
9,Q02,I communicate my thoughts about work issues to my team leader with complete openness.,Kato,Science Fiction Game Planning,General Member,1,4
9,Q03,I experience a degree of reserve when addressing personal issues or conflicts with my team leader.,Kato,Science Fiction Game Planning,General Member,1,4
9,Q04,"I feel the freedom to offer recommendations and ideas to my team leader, especially when they align with the project's evolving vision.",Kato,Science Fiction Game Planning,General Member,1,4
9,Q05,"I would feel quite comfortable voicing concerns regarding an error, knowing my team leader values open dialogue and learning.",Kato,Science Fiction Game Planning,General Member,1,4
9,Q06,"I would feel quite comfortable discussing a colleague's error with the team leader, given the opportunity for thoughtful consideration.",Kato,Science Fiction Game Planning,General Member,1,4
9,Q07,"My contributions feel deeply acknowledged and integrated by Kobayashi-san, especially concerning the conceptual direction of ""Stellar Bloom.""",Kato,Science Fiction Game Planning,General Member,1,4
9,Q08,My team leader's encouragement for me to explore new tasks and skills is quite substantial.,Kato,Science Fiction Game Planning,General Member,1,4
9,Q09,"Kobayashi-san demonstrates a profound and unwavering commitment to advancing our shared creative vision, which inherently supports my contributions.",Kato,Science Fiction Game Planning,General Member,1,4
9,Q10,It would be quite simple to inquire with colleagues when questions arise concerning my work responsibilities.,Kato,Science Fiction Game Planning,General Member,1,4
9,Q11,I communicate my thoughts on work matters with my colleagues with considerable openness.,Kato,Science Fiction Game Planning,General Member,1,4
9,Q12,"I maintain a preference for discussing work-related matters, finding personal revelations within a peer group less conducive to my present focus.",Kato,Science Fiction Game Planning,General Member,1,4
9,Q13,I feel quite free to propose recommendations and ideas to my peers regarding new projects or changes in procedures.,Kato,Science Fiction Game Planning,General Member,1,4
9,Q14,"I would feel quite comfortable acknowledging errors with my colleagues, as our current collaboration fosters a productive environment for learning and growth.",Kato,Science Fiction Game Planning,General Member,1,4
9,Q15,"I would feel entirely safe speaking up to a colleague if I saw them making a mistake, as open communication benefits the project.",Kato,Science Fiction Game Planning,General Member,1,4
9,Q16,"My contributions are recognized and integrated by my colleagues, leading to a productive collaborative atmosphere.",Kato,Science Fiction Game Planning,General Member,1,4
9,Q17,"Collaborating with Kobayashi-san is exceptionally productive, and her contributions are invaluable to the ""Stellar Bloom"" project's conceptualization.",Kato,Science Fiction Game Planning,General Member,1,4
9,Q18,"Communication within the team is quite effective, with valuable insights frequently shared among members.",Kato,Science Fiction Game Planning,General Member,1,4
9,Q19,"Kobayashi-san's contributions exhibit substantial depth, weaving intricate layers into the project's conceptual framework.",Kato,Science Fiction Game Planning,General Member,1,4
9,Q20,"Our team exhibits remarkable unity in pursuing our performance objectives, with Kobayashi-san's contributions proving exceptionally synergistic with my vision for ""Stellar Bloom.""",Kato,Science Fiction Game Planning,General Member,1,4
9,Q21,"I am exceptionally pleased with the team's current commitment level, particularly Kobayashi-san's insightful contributions.",Kato,Science Fiction Game Planning,General Member,1,4
9,Q22,"Kobayashi-san's aspirations for ""Stellar Bloom"" are currently quite aligned with my own, providing a beneficial synergy for the project's progression.",Kato,Science Fiction Game Planning,General Member,1,4
9,Q23,The current opportunities to improve my personal performance are quite sufficient.,Kato,Science Fiction Game Planning,General Member,1,4
10,Q01,Consulting Nakamura-san for clarification on my role's contributions is a straightforward process due to her approachable nature.,Yoshida,Science Fiction Game Planning,General Member,1,4
10,Q02,I can provide direct and clear feedback to my team leader regarding work issues.,Yoshida,Science Fiction Game Planning,General Member,1,4
10,Q03,"I feel a comfortable level of ease discussing personal issues or disagreements with my team leader, as I trust their discretion and support.",Yoshida,Science Fiction Game Planning,General Member,1,4
10,Q04,I feel adequately free to offer my recommendations and ideas for new projects or changes in procedures to my team leader.,Yoshida,Science Fiction Game Planning,General Member,1,4
10,Q05,"I would feel quite comfortable communicating any missteps to my team leader, as I believe constructive discussion is paramount for our collective advancement.",Yoshida,Science Fiction Game Planning,General Member,1,4
10,Q06,"I would feel perfectly comfortable addressing a team member's error directly with them, and then escalating if further intervention becomes necessary.",Yoshida,Science Fiction Game Planning,General Member,1,4
10,Q07,"My contributions receive a beneficial reception from my team leader, fostering a constructive environment for developing game concepts.",Yoshida,Science Fiction Game Planning,General Member,1,4
10,Q08,My team leader's encouragement for tackling novel responsibilities and acquiring new skills is a definite positive aspect of my work experience.,Yoshida,Science Fiction Game Planning,General Member,1,4
10,Q09,"Nakamura-san offers a welcome balance to our discussions, and her input will greatly assist in refining our concepts.",Yoshida,Science Fiction Game Planning,General Member,1,4
10,Q10,I find it quite straightforward to approach colleagues when I have a query or require clarification regarding my responsibilities.,Yoshida,Science Fiction Game Planning,General Member,1,4
10,Q11,"I express my work-related thoughts with considerable directness, valuing clarity and efficiency in our collaborative efforts.",Yoshida,Science Fiction Game Planning,General Member,1,4
10,Q12,I maintain a professional distance regarding personal matters with colleagues.,Yoshida,Science Fiction Game Planning,General Member,1,4
10,Q13,"I appreciate the space to share my proposals, and I find the current environment quite supportive for introducing new concepts.",Yoshida,Science Fiction Game Planning,General Member,1,4
10,Q14,I would feel quite secure raising concerns about any missteps with my colleagues.,Yoshida,Science Fiction Game Planning,General Member,1,4
10,Q15,"I would feel quite safe speaking to a colleague about a mistake, as open communication fosters improvement.",Yoshida,Science Fiction Game Planning,General Member,1,4
10,Q16,"My contributions are consistently acknowledged by my colleagues, fostering a productive and respected dialogue.",Yoshida,Science Fiction Game Planning,General Member,1,4
10,Q17,Collaborating with my colleagues on these imaginative projects provides a straightforward avenue for acquiring assistance.,Yoshida,Science Fiction Game Planning,General Member,1,4
10,Q18,"Information exchange within the team is consistently effective, fostering a climate of shared awareness.",Yoshida,Science Fiction Game Planning,General Member,1,4
10,Q19,"The team's information sharing attempts are fundamentally substantial, with concepts receiving thorough exploration.",Yoshida,Science Fiction Game Planning,General Member,1,4
10,Q20,"Our team possesses a notable unity in pursuing performance objectives, with diverse concepts coexisting and individual development proceeding robustly towards shared aspirations.",Yoshida,Science Fiction Game Planning,General Member,1,4
10,Q21,I possess a deep satisfaction with our team's dedication to this endeavor.,Yoshida,Science Fiction Game Planning,General Member,1,4
10,Q22,Yamada-kun's drive for exploration and integration presents a unique challenge to my preference for sequential development of individual concepts.,Yoshida,Science Fiction Game Planning,General Member,1,4
10,Q23,The opportunities provided to enhance my personal performance are quite sufficient.,Yoshida,Science Fiction Game Planning,General Member,1,4
11,Q01,Approaching my team leader with questions is generally a straightforward process.,Yamada,Science Fiction Game Planning,General Member,1,4
11,Q02,I communicate my opinions about work issues to my team leader with considerable openness.,Yamada,Science Fiction Game Planning,General Member,1,4
11,Q03,"I find myself quite at ease discussing personal issues or disagreements with my team leader, particularly when seeking constructive resolutions.",Yamada,Science Fiction Game Planning,General Member,1,4
11,Q04,I feel quite at liberty to voice my recommendations and ideas to my team leader.,Yamada,Science Fiction Game Planning,General Member,1,4
11,Q05,I would feel completely safe speaking up to my team leader about a mistake.,Yamada,Science Fiction Game Planning,General Member,1,4
11,Q06,I would feel completely safe speaking up to my team leader if I saw a colleague making a mistake.,Yamada,Science Fiction Game Planning,General Member,1,4
11,Q07,I believe my contributions are generally acknowledged and considered by my team leader.,Yamada,Science Fiction Game Planning,General Member,1,4
11,Q08,My team leader provides a neutral stance on my pursuit of novel responsibilities or skill acquisition.,Yamada,Science Fiction Game Planning,General Member,1,4
11,Q09,"My team leader, Yoshida-kun, possesses a commendable capacity to champion my concerns, reflecting his balanced approach to team dynamics.",Yamada,Science Fiction Game Planning,General Member,1,4
11,Q10,It presents no difficulty to approach my colleagues when questions arise regarding my role.,Yamada,Science Fiction Game Planning,General Member,1,4
11,Q11,"I communicate my work opinions quite directly, valuing clear and upfront exchanges.",Yamada,Science Fiction Game Planning,General Member,1,4
11,Q12,I find discussing personal matters with colleagues to be a neutral experience.,Yamada,Science Fiction Game Planning,General Member,1,4
11,Q13,I feel quite at liberty to propose concepts and modifications to my colleagues.,Yamada,Science Fiction Game Planning,General Member,1,4
11,Q14,I would feel quite comfortable voicing any errors I might make to my colleagues.,Yamada,Science Fiction Game Planning,General Member,1,4
11,Q15,I would feel very safe speaking up to a colleague if I saw them making a mistake.,Yamada,Science Fiction Game Planning,General Member,1,4
11,Q16,My contributions are received with great consideration by my colleagues.,Yamada,Science Fiction Game Planning,General Member,1,4
11,Q17,Reaching out for assistance from my colleagues generally presents a straightforward process.,Yamada,Science Fiction Game Planning,General Member,1,4
11,Q18,"Information exchange between team members appears to be inconsistent, with certain individuals actively seeking diverse perspectives while others remain somewhat detached from broader departmental discussions.",Yamada,Science Fiction Game Planning,General Member,1,4
11,Q19,"The attempts to share information across the team appear to be somewhat superficial at this juncture, with Yoshida-kun's inquiry about a new individual suggesting exploration beyond immediate connections.",Yamada,Science Fiction Game Planning,General Member,1,4
11,Q20,Our team exhibits a promising degree of cohesion in our pursuit of performance objectives.,Yamada,Science Fiction Game Planning,General Member,1,4
11,Q21,I find Yoshida-kun's focused approach to his concept development to be entirely satisfactory at this juncture.,Yamada,Science Fiction Game Planning,General Member,1,4
11,Q22,"Yoshida-kun's intention to refine a concept first presents a constructive path, however, the introduction of an unknown ""Nakamura-san"" for a balanced perspective introduces a degree of uncertainty.",Yamada,Science Fiction Game Planning,General Member,1,4
11,Q23,"The opportunities provided for enhancing individual performance are quite sufficient, allowing for significant personal growth.",Yamada,Science Fiction Game Planning,General Member,1,4
12,Q01,I find it perfectly manageable to approach my team leader with inquiries or points of uncertainty regarding my work responsibilities.,Sasaki,Science Fiction Game Planning,General Member,1,4
12,Q02,I find it easy to share my perspectives with my team leader when the discussion encourages creative exploration.,Sasaki,Science Fiction Game Planning,General Member,1,4
12,Q03,I feel comfortable discussing issues with my team leader when it fosters a productive environment.,Sasaki,Science Fiction Game Planning,General Member,1,4
12,Q04,I find the current environment allows for a considerable degree of freedom when sharing my recommendations and ideas.,Sasaki,Science Fiction Game Planning,General Member,1,4
12,Q05,"I would feel quite comfortable discussing any missteps with my team leader, as I trust our open communication.",Sasaki,Science Fiction Game Planning,General Member,1,4
12,Q06,"I would feel quite comfortable raising concerns about a colleague's error with my team leader, as open communication is essential for project success.",Sasaki,Science Fiction Game Planning,General Member,1,4
12,Q07,My contributions are generally considered quite valuable by my team leader when I voice my opinions and ideas.,Sasaki,Science Fiction Game Planning,General Member,1,4
12,Q08,My team leader offers considerable encouragement and support for venturing into new tasks and acquiring unfamiliar skills.,Sasaki,Science Fiction Game Planning,General Member,1,4
12,Q09,Yamaguchi-san will be a dependable advocate for any problems that arise.,Sasaki,Science Fiction Game Planning,General Member,1,4
12,Q10,I find it exceptionally easy to approach my peers with questions or uncertainties in my role.,Sasaki,Science Fiction Game Planning,General Member,1,4
12,Q11,I express my thoughts with candor when discussing work matters with my colleagues.,Sasaki,Science Fiction Game Planning,General Member,1,4
12,Q12,I find sharing personal matters with colleagues to be a somewhat challenging experience.,Sasaki,Science Fiction Game Planning,General Member,1,4
12,Q13,"I feel quite free to express my ideas with my peers, particularly those who appreciate a fluid brainstorming process.",Sasaki,Science Fiction Game Planning,General Member,1,4
12,Q14,"I feel quite comfortable sharing my thoughts with my peers, even when exploring uncharted territory that might contain missteps.",Sasaki,Science Fiction Game Planning,General Member,1,4
12,Q15,I feel comfortable pointing out potential missteps when I observe them.,Sasaki,Science Fiction Game Planning,General Member,1,4
12,Q16,My contributions are consistently recognized and appreciated by my colleagues.,Sasaki,Science Fiction Game Planning,General Member,1,4
12,Q17,Seeking assistance from my colleagues feels rather straightforward.,Sasaki,Science Fiction Game Planning,General Member,1,4
