agent_id,question_id,answer_text,agent_name,dept,position,dept_id,pattern_id
12,Q18,"Information exchange within the team is adequately managed, allowing for the emergence of fresh concepts.",Sasaki,Science Fiction Game Planning,General Member,1,4
12,Q19,"The team's information sharing is somewhat superficial, not truly robust.",Sasaki,Science Fiction Game Planning,General Member,1,4
12,Q20,"Our team finds a strong connection in our pursuit of performance, fueled by shared intuitive leaps.",Sasaki,Science Fiction Game Planning,General Member,1,4
12,Q21,I am quite pleased with the current dedication to our task.,Sasaki,Science Fiction Game Planning,General Member,1,4
12,Q22,"My team members' aspirations for our team's performance seem to align quite effectively, fostering a productive atmosphere.",Sasaki,Science Fiction Game Planning,General Member,1,4
12,Q23,The team offers ample opportunities for me to refine my personal performance through collaborative exploration.,Sasaki,Science Fiction Game Planning,General Member,1,4
13,Q01,Approaching my department leader with questions about my role presents a straightforward path for clarification.,Yamaguchi,Science Fiction Game Planning,Department Leader,1,4
13,Q02,I communicate my work opinions to my team leader with complete openness.,Yamaguchi,Science Fiction Game Planning,Department Leader,1,4
13,Q03,I find speaking about personal problems or disagreements to my team leader to be quite comfortable.,Yamaguchi,Science Fiction Game Planning,Department Leader,1,4
13,Q04,"I feel completely at liberty to express my recommendations and ideas, as my department leader fosters an environment where all suggestions are welcomed and considered.",Yamaguchi,Science Fiction Game Planning,Department Leader,1,4
13,Q05,I would feel completely comfortable raising concerns about any missteps that occur within the team.,Yamaguchi,Science Fiction Game Planning,Department Leader,1,4
13,Q06,I would feel perfectly comfortable reporting a colleague's mistake to my team leader.,Yamaguchi,Science Fiction Game Planning,Department Leader,1,4
13,Q07,"My contributions are definitely recognized by my team, as the free-form brainstorming approach that Nakamura values so much aligns with my own balanced workstyle.",Yamaguchi,Science Fiction Game Planning,Department Leader,1,4
13,Q08,"My department leader, Yamaguchi, actively encourages exploring novel challenges and acquiring new skills.",Yamaguchi,Science Fiction Game Planning,Department Leader,1,4
13,Q09,"Yamaguchi is a dependable advocate, always ensuring everyone's contributions are considered and valued.",Yamaguchi,Science Fiction Game Planning,Department Leader,1,4
13,Q10,Engaging my peers for clarification on my role's intricacies presents a straightforward path.,Yamaguchi,Science Fiction Game Planning,Department Leader,1,4
13,Q11,I express my opinions regarding work matters with my peers with a good deal of openness.,Yamaguchi,Science Fiction Game Planning,Department Leader,1,4
13,Q12,I find speaking about personal matters with colleagues to be a comfortable experience.,Yamaguchi,Science Fiction Game Planning,Department Leader,1,4
13,Q13,"I feel fully empowered to share recommendations and ideas with my peers, fostering an environment where every contribution is valued.",Yamaguchi,Science Fiction Game Planning,Department Leader,1,4
13,Q14,"I feel quite secure sharing my missteps with colleagues, as open discussion fosters collective learning and progress.",Yamaguchi,Science Fiction Game Planning,Department Leader,1,4
13,Q15,I would feel quite comfortable addressing a colleague directly if I noticed an error.,Yamaguchi,Science Fiction Game Planning,Department Leader,1,4
13,Q16,"My contributions are generally well-regarded by my colleagues, fostering a productive exchange of ideas.",Yamaguchi,Science Fiction Game Planning,Department Leader,1,4
13,Q17,It is a pleasure to request assistance from my team members.,Yamaguchi,Science Fiction Game Planning,Department Leader,1,4
13,Q18,"The team's communication regarding work-related issues is largely effective, though opportunities exist for further proactive sharing.",Yamaguchi,Science Fiction Game Planning,Department Leader,1,4
13,Q19,"The team's information sharing is genuinely substantive, fostering authentic idea development.",Yamaguchi,Science Fiction Game Planning,Department Leader,1,4
13,Q20,"My team possesses a strong alignment in our pursuit of performance objectives, exhibiting a cohesive approach to our collective endeavors.",Yamaguchi,Science Fiction Game Planning,Department Leader,1,4
13,Q21,I am thoroughly pleased with the team's vibrant dedication to this endeavor.,Yamaguchi,Science Fiction Game Planning,Department Leader,1,4
13,Q22,"The team members demonstrate a strong alignment regarding aspirations for team performance, with everyone embracing the creative freedom and eager participation required for effective idea generation.",Yamaguchi,Science Fiction Game Planning,Department Leader,1,4
13,Q23,The current opportunities sufficiently support my personal performance improvement.,Yamaguchi,Science Fiction Game Planning,Department Leader,1,4
