agent_id,question_id,answer_text,agent_name,dept,position,dept_id,pattern_id
0,Q01,"It presents a challenge to approach my team leader with inquiries, as their focus remains intensely on project advancement.",Sato,Fantasy Game Planning,General Member,0,4
0,Q02,"I communicate my opinions about work issues with my team leader with considerable candor, aiming for clarity and constructive contribution.",Sato,Fantasy Game Planning,General Member,0,4
0,Q03,I find myself rather reserved when it comes to sharing personal issues or disagreements with my team leader.,Sato,Fantasy Game Planning,General Member,0,4
0,Q04,I feel quite free to present recommendations for new projects or procedural changes to my team leader.,Sato,Fantasy Game Planning,General Member,0,4
0,Q05,"I would feel quite comfortable raising any errors with my team leader, as I anticipate a supportive environment for growth.",Sato,Fantasy Game Planning,General Member,0,4
0,Q06,I feel assured that I could openly discuss a colleague's mistake with my team leader without apprehension.,Sato,Fantasy Game Planning,General Member,0,4
0,Q07,"My contributions are consistently appreciated by my team leader, fostering a sense of shared purpose.",Sato,Fantasy Game Planning,General Member,0,4
0,Q08,"My team leader offers a consistent environment where new challenges are welcomed, and the exploration of novel skills receives considerable encouragement.",Sato,Fantasy Game Planning,General Member,0,4
0,Q09,"My team leader is a solid supporter, always prepared to champion my concerns effectively.",Sato,Fantasy Game Planning,General Member,0,4
0,Q10,"My next conversation is scheduled with Takahashi-san to refine ""Quiet Magic, Unfolding Mystery,"" and I will engage with your hybrid concept subsequently.",Sato,Fantasy Game Planning,General Member,0,4
0,Q11,"I provide candid feedback to my peers on work matters, yet I prefer to refine my thoughts before extensive discussion.",Sato,Fantasy Game Planning,General Member,0,4
0,Q12,"I generally find discussing personal matters with colleagues to be a neutral experience, leaning towards a preference for keeping professional and personal spheres distinct.",Sato,Fantasy Game Planning,General Member,0,4
0,Q13,I feel quite unrestricted in sharing recommendations and ideas with my peers for new projects or procedural changes.,Sato,Fantasy Game Planning,General Member,0,4
0,Q14,My comfort level speaking about a misstep with colleagues resides firmly in the territory of assuredness.,Sato,Fantasy Game Planning,General Member,0,4
0,Q15,"I maintain a strong conviction that addressing errors with colleagues directly, with clarity and constructive intent, proves beneficial for our collective growth and project integrity.",Sato,Fantasy Game Planning,General Member,0,4
0,Q16,"My contributions are met with earnest consideration, fostering a collaborative environment where diverse perspectives genuinely advance our shared objectives.",Sato,Fantasy Game Planning,General Member,0,4
0,Q17,"Assisting colleagues with their tasks presents a degree of challenge, as my current focus remains on refining the nuanced fantasy concept with Takahashi-san.",Sato,Fantasy Game Planning,General Member,0,4
0,Q18,"The team demonstrates a commendable effort in sharing work-related information, with a solid foundation for further enhancement in collaborative communication.",Sato,Fantasy Game Planning,General Member,0,4
0,Q19,The attempts to share information throughout the team offer substantial insights rather than superficial exchanges.,Sato,Fantasy Game Planning,General Member,0,4
0,Q20,"My immediate focus remains on deepening the collaborative exploration of the ""Quiet Magic, Unfolding Mystery"" concept with Takahashi-san, which demands considerable attention before broadening our scope to hybrid genres.",Sato,Fantasy Game Planning,General Member,0,4
0,Q21,I am quite content with my team's dedication to our current fantasy concept.,Sato,Fantasy Game Planning,General Member,0,4
0,Q22,"My team members' aspirations for performance are largely aligned with my own, though some have a strong inclination towards immediate exploration of novel genre fusions.",Sato,Fantasy Game Planning,General Member,0,4
0,Q23,"The opportunities provided for personal performance improvement are sufficient for my current focus on the ""Quiet Magic, Unfolding Mystery"" project.",Sato,Fantasy Game Planning,General Member,0,4
1,Q01,"Watanabe-san and I are experiencing a wonderful creative alignment, making the prospect of needing guidance from our team leader less of a present concern.",Suzuki,Fantasy Game Planning,General Member,0,4
1,Q02,I find it most enjoyable to express my perspectives when a colleague is as receptive to unconventional ideas as Watanabe-san.,Suzuki,Fantasy Game Planning,General Member,0,4
1,Q03,I feel a certain resistance to discussing personal challenges or disagreements with my team leader.,Suzuki,Fantasy Game Planning,General Member,0,4
1,Q04,I feel a strong sense of freedom to express my recommendations and ideas for new projects or changes in procedures.,Suzuki,Fantasy Game Planning,General Member,0,4
1,Q05,I would feel quite comfortable bringing up any errors I encounter during our creative sessions.,Suzuki,Fantasy Game Planning,General Member,0,4
1,Q06,"I would feel entirely comfortable discussing a colleague's mistake with our team leader, as open communication aids the entire team's advancement.",Suzuki,Fantasy Game Planning,General Member,0,4
1,Q07,"I feel my input is fully appreciated when I articulate my thoughts to Watanabe-san, creating a highly collaborative environment for concept development.",Suzuki,Fantasy Game Planning,General Member,0,4
1,Q08,Watanabe-san provides ample encouragement for exploring novel tasks and acquiring new skills.,Suzuki,Fantasy Game Planning,General Member,0,4
1,Q09,Watanabe-san's collaborative spirit makes me feel that our shared creative vision is a strong foundation for resolving any potential issues.,Suzuki,Fantasy Game Planning,General Member,0,4
1,Q10,Collaborating with my peers on questions or uncertainties presents a remarkably straightforward path.,Suzuki,Fantasy Game Planning,General Member,0,4
1,Q11,"I enthusiastically share my thoughts when I encounter a creative connection, finding joy in the uninhibited flow of ideas.",Suzuki,Fantasy Game Planning,General Member,0,4
1,Q12,I find great ease discussing personal matters with peers who share a similar creative spirit and enthusiasm for imaginative exploration.,Suzuki,Fantasy Game Planning,General Member,0,4
1,Q13,"I feel completely at liberty to offer my untamed creative impulses to Watanabe-san, given our shared passion for imaginative exploration.",Suzuki,Fantasy Game Planning,General Member,0,4
1,Q14,I would feel completely at ease expressing concerns about potential errors to my colleagues.,Suzuki,Fantasy Game Planning,General Member,0,4
1,Q15,I feel completely at ease suggesting alternative approaches when a colleague's direction appears suboptimal.,Suzuki,Fantasy Game Planning,General Member,0,4
1,Q16,"My contributions feel exceptionally well-received when collaborating with Watanabe-san, creating a highly productive and stimulating exchange of ideas.",Suzuki,Fantasy Game Planning,General Member,0,4
1,Q17,"Watanabe-san's insights align perfectly with my creative process, making collaboration with her remarkably seamless and stimulating.",Suzuki,Fantasy Game Planning,General Member,0,4
1,Q18,"Watanabe-san and I are completely aligned, making additional information sharing feel unnecessary at this moment.",Suzuki,Fantasy Game Planning,General Member,0,4
1,Q19,"The attempts to share information feel rather superficial, as my current exchange with Watanabe-san provides all the imaginative fuel I require.",Suzuki,Fantasy Game Planning,General Member,0,4
1,Q20,"Our team exhibits remarkable alignment when exploring creative territories, fostering an environment where innovative ideas flourish without constraint.",Suzuki,Fantasy Game Planning,General Member,0,4
1,Q21,I am incredibly energized by Watanabe-san's insightful contributions and the shared creative momentum we are experiencing.,Suzuki,Fantasy Game Planning,General Member,0,4
1,Q22,"Watanabe-san and I share a wonderfully aligned vision for exploring unconventional creative avenues, which is precisely the imaginative space I flourish within.",Suzuki,Fantasy Game Planning,General Member,0,4
1,Q23,The current collaboration with Watanabe-san offers a perfect environment for my personal performance enhancement.,Suzuki,Fantasy Game Planning,General Member,0,4
2,Q01,Approaching Yamamoto-san with inquiries regarding my role presents a straightforward and uncomplicated process.,Takahashi,Fantasy Game Planning,General Member,0,4
2,Q02,I express my thoughts regarding work matters with Yamamoto-san with a complete lack of reservation.,Takahashi,Fantasy Game Planning,General Member,0,4
2,Q03,I find it conducive to share personal challenges or points of contention with our team leader when necessary for resolution.,Takahashi,Fantasy Game Planning,General Member,0,4
2,Q04,"I find the current environment conducive to expressing recommendations, as collaborative discussions lead to robust concepts.",Takahashi,Fantasy Game Planning,General Member,0,4
2,Q05,"I would feel quite confident communicating any missteps to Yamamoto-san, knowing he values transparency.",Takahashi,Fantasy Game Planning,General Member,0,4
2,Q06,"I would feel quite secure expressing concerns about a colleague's misstep to our team leader, ensuring a constructive approach.",Takahashi,Fantasy Game Planning,General Member,0,4
2,Q07,My contributions are perceived with significant consideration by the team leader.,Takahashi,Fantasy Game Planning,General Member,0,4
2,Q08,Yamamoto-san's support for venturing into uncharted responsibilities and skill acquisition is certainly not a hindrance.,Takahashi,Fantasy Game Planning,General Member,0,4
2,Q09,Yamamoto-san's dedication to the department's success provides a reliable foundation for advocacy on challenges.,Takahashi,Fantasy Game Planning,General Member,0,4
2,Q10,"Seeking clarification from colleagues is a generally straightforward endeavor, allowing for productive exchanges that refine my understanding.",Takahashi,Fantasy Game Planning,General Member,0,4
2,Q11,I find communicating my perspectives on work matters with colleagues to be a straightforward process.,Takahashi,Fantasy Game Planning,General Member,0,4
2,Q12,I maintain a certain reservation when discussing personal matters with colleagues.,Takahashi,Fantasy Game Planning,General Member,0,4
2,Q13,I experience significant latitude in proposing new concepts and procedural adjustments to my colleagues.,Takahashi,Fantasy Game Planning,General Member,0,4
2,Q14,"I would feel quite comfortable sharing my errors with my colleagues, as the environment fosters constructive dialogue.",Takahashi,Fantasy Game Planning,General Member,0,4
2,Q15,I would feel quite secure expressing my observations to a colleague when I encounter an error.,Takahashi,Fantasy Game Planning,General Member,0,4
2,Q16,"My contributions are perceived as quite meaningful, particularly when they align with detailed, reflective brainstorming.",Takahashi,Fantasy Game Planning,General Member,0,4
2,Q17,Engaging colleagues for assistance requires careful consideration of their current workload and preferred communication styles to ensure a productive exchange.,Takahashi,Fantasy Game Planning,General Member,0,4
2,Q18,My colleagues generally maintain a good level of awareness regarding work-related matters.,Takahashi,Fantasy Game Planning,General Member,0,4
2,Q19,"The information sharing throughout the team exhibits a commendable depth, fostering a robust exchange of ideas and fostering genuine understanding.",Takahashi,Fantasy Game Planning,General Member,0,4
2,Q20,"Our team demonstrates significant alignment in pursuing performance objectives, with only a minor divergence in specific strategic interpretations.",Takahashi,Fantasy Game Planning,General Member,0,4
2,Q21,I experience considerable satisfaction with the team's dedication to this endeavor.,Takahashi,Fantasy Game Planning,General Member,0,4
2,Q22,"The team's aspirations for performance are mostly aligned, with a strong resonance on the core concept and a shared desire for deep exploration.",Takahashi,Fantasy Game Planning,General Member,0,4
2,Q23,The opportunities provided to refine my individual capabilities are quite sufficient.,Takahashi,Fantasy Game Planning,General Member,0,4
3,Q01,It is quite straightforward to inquire with my team leader when any uncertainty arises regarding my responsibilities.,Tanaka,Fantasy Game Planning,General Member,0,4
3,Q02,I communicate my notions with my team leader with complete transparency.,Tanaka,Fantasy Game Planning,General Member,0,4
3,Q03,I feel comfortable sharing personal problems or disagreements with my team leader.,Tanaka,Fantasy Game Planning,General Member,0,4
3,Q04,I feel quite at liberty to offer my recommendations and ideas to my team leader.,Tanaka,Fantasy Game Planning,General Member,0,4
3,Q05,"I would feel quite comfortable communicating any errors to my team leader, as a transparent approach facilitates collective improvement.",Tanaka,Fantasy Game Planning,General Member,0,4
3,Q06,"I would feel somewhat hesitant to speak up to my team leader about a colleague's mistake, preferring to address it indirectly if possible.",Tanaka,Fantasy Game Planning,General Member,0,4
3,Q07,My input feels consistently recognized and appreciated by my team leader.,Tanaka,Fantasy Game Planning,General Member,0,4
3,Q08,My team leader offers considerable encouragement for exploring novel responsibilities and acquiring unfamiliar proficiencies.,Tanaka,Fantasy Game Planning,General Member,0,4
3,Q09,"My team leader, Ito-san, is a truly dependable advocate, consistently championing my contributions and ideas within the company.",Tanaka,Fantasy Game Planning,General Member,0,4
3,Q10,It is quite simple to ask my colleagues when I have inquiries related to my work.,Tanaka,Fantasy Game Planning,General Member,0,4
3,Q11,I can communicate my thoughts on work matters with my colleagues with an open and direct style.,Tanaka,Fantasy Game Planning,General Member,0,4
3,Q12,I am completely at ease discussing personal matters with my colleagues.,Tanaka,Fantasy Game Planning,General Member,0,4
3,Q13,I feel entirely unhindered when expressing my suggestions and thoughts to my colleagues.,Tanaka,Fantasy Game Planning,General Member,0,4
3,Q14,I would feel quite comfortable voicing any errors I might make to my colleagues on this team.,Tanaka,Fantasy Game Planning,General Member,0,4
3,Q15,"I would feel quite comfortable pointing out an error to a colleague, as open communication is essential for our collective progress.",Tanaka,Fantasy Game Planning,General Member,0,4
3,Q16,My contributions possess significant worth when I articulate my perspectives to my colleagues.,Tanaka,Fantasy Game Planning,General Member,0,4
3,Q17,Seeking assistance from team members is always straightforward and productive.,Tanaka,Fantasy Game Planning,General Member,0,4
3,Q18,Our team maintains a substantial awareness of work-related matters amongst members.,Tanaka,Fantasy Game Planning,General Member,0,4
3,Q19,"The information sharing between team members is quite substantial, with many productive exchanges occurring.",Tanaka,Fantasy Game Planning,General Member,0,4
3,Q20,Our team demonstrates complete synergy in its pursuit of performance objectives.,Tanaka,Fantasy Game Planning,General Member,0,4
3,Q21,I am very content with our team's dedication to this task.,Tanaka,Fantasy Game Planning,General Member,0,4
3,Q22,"My team member Ito-san's aspirations for our team's performance are entirely aligned with my own, fostering a wonderfully productive synergy.",Tanaka,Fantasy Game Planning,General Member,0,4
3,Q23,"The opportunities this team provides for enhancing my personal performance are more than adequate, offering ample room for growth.",Tanaka,Fantasy Game Planning,General Member,0,4
4,Q01,My team leader is a helpful resource for clarifying my role.,Watanabe,Fantasy Game Planning,General Member,0,4
4,Q02,"I express my opinions with complete openness, as Suzuki-san's collaborative spirit provides a truly receptive environment for unfettered idea generation.",Watanabe,Fantasy Game Planning,General Member,0,4
4,Q03,"I feel quite comfortable discussing issues with my team leader, as open communication is beneficial.",Watanabe,Fantasy Game Planning,General Member,0,4
4,Q04,"I feel completely at ease sharing my recommendations and ideas with my team leader, as our interactions foster an open environment for creative exploration.",Watanabe,Fantasy Game Planning,General Member,0,4
4,Q05,"I would feel quite comfortable discussing any missteps with my team leader, as open communication fosters significant growth.",Watanabe,Fantasy Game Planning,General Member,0,4
4,Q06,I would feel entirely comfortable sharing my observations with my team leader regarding a colleague's error.,Watanabe,Fantasy Game Planning,General Member,0,4
4,Q07,My input receives full consideration from my team leader.,Watanabe,Fantasy Game Planning,General Member,0,4
4,Q08,My team leader provides considerable encouragement and support for exploring new tasks and learning unfamiliar skills.,Watanabe,Fantasy Game Planning,General Member,0,4
4,Q09,"Suzuki-san is a leader who provides excellent support, fostering an environment where creative thoughts are consistently encouraged and valued.",Watanabe,Fantasy Game Planning,General Member,0,4
4,Q10,Engaging with colleagues on work-related inquiries presents a smooth and collaborative experience.,Watanabe,Fantasy Game Planning,General Member,0,4
4,Q11,"I communicate my opinions openly, finding it beneficial to share all initial thoughts without reservation.",Watanabe,Fantasy Game Planning,General Member,0,4
4,Q12,I find speaking about personal issues to peers to be a rather unnecessary endeavor.,Watanabe,Fantasy Game Planning,General Member,0,4
4,Q13,I find the environment quite conducive to sharing nascent concepts and unconventional notions with colleagues.,Watanabe,Fantasy Game Planning,General Member,0,4
4,Q14,"I feel quite secure sharing my thoughts with my peers, even when encountering challenges.",Watanabe,Fantasy Game Planning,General Member,0,4
4,Q15,I would feel completely at ease addressing a colleague's error with them directly.,Watanabe,Fantasy Game Planning,General Member,0,4
4,Q16,My input is consistently recognized and appreciated by my peers when I share my thoughts.,Watanabe,Fantasy Game Planning,General Member,0,4
4,Q17,"Collaborating with Suzuki-san on brainstorming is proving exceptionally easy, fostering a seamless exchange of uninhibited ideas.",Watanabe,Fantasy Game Planning,General Member,0,4
4,Q18,"Information exchange among team members is rather limited, unfortunately.",Watanabe,Fantasy Game Planning,General Member,0,4
4,Q19,"The attempts to share information throughout the team are genuinely valuable, fostering a truly collaborative spirit.",Watanabe,Fantasy Game Planning,General Member,0,4
4,Q20,"Our team's performance goals are met with a delightful alignment of thinking, making progress feel exceptionally smooth.",Watanabe,Fantasy Game Planning,General Member,0,4
4,Q21,I am content with our team's dedication to this task.,Watanabe,Fantasy Game Planning,General Member,0,4
4,Q22,"Suzuki-san and I share a wonderfully similar vision for our team's creative output, which fosters an exceptionally productive environment.",Watanabe,Fantasy Game Planning,General Member,0,4
4,Q23,The opportunities this team provides for enhancing personal performance are exceptionally ample.,Watanabe,Fantasy Game Planning,General Member,0,4
5,Q01,Addressing my team leader about role-related inquiries presents a completely manageable situation.,Ito,Fantasy Game Planning,General Member,0,4
5,Q02,I share my thoughts on work matters with my team leader with an open and direct communication style.,Ito,Fantasy Game Planning,General Member,0,4
5,Q03,I find it always constructive to share differing perspectives on project matters with my team leader.,Ito,Fantasy Game Planning,General Member,0,4
5,Q04,"I feel a considerable freedom to voice recommendations and ideas, fostering an environment where novel concepts are welcomed and explored.",Ito,Fantasy Game Planning,General Member,0,4
5,Q05,"I would feel quite secure expressing any missteps to my team leader, given our constructive collaboration.",Ito,Fantasy Game Planning,General Member,0,4
5,Q06,"I would feel safe speaking up to my team leader regarding a colleague's mistake, as open communication is essential for project success.",Ito,Fantasy Game Planning,General Member,0,4
5,Q07,I am confident my input is highly valued by my team leader when I voice my opinions.,Ito,Fantasy Game Planning,General Member,0,4
5,Q08,Tanaka-san consistently fosters an environment where exploring novel concepts and acquiring new skills is a welcomed endeavor.,Ito,Fantasy Game Planning,General Member,0,4
5,Q09,"Tanaka-san exhibits a truly commendable level of support and collaboration, making him a fantastic partner for idea generation and creative exploration.",Ito,Fantasy Game Planning,General Member,0,4
5,Q10,It is quite easy to seek clarification from my colleagues.,Ito,Fantasy Game Planning,General Member,0,4
5,Q11,I can offer my imaginative notions freely during the initial creative sparks with my peers.,Ito,Fantasy Game Planning,General Member,0,4
5,Q12,I find it a pleasure to engage in open dialogue regarding personal matters with my colleagues.,Ito,Fantasy Game Planning,General Member,0,4
5,Q13,"I feel quite uninhibited in sharing my suggestions with colleagues, as their collaborative spirit fosters an environment ripe for creative exchange.",Ito,Fantasy Game Planning,General Member,0,4
5,Q14,"I would feel quite comfortable sharing my thoughts with my peers, even when acknowledging an oversight.",Ito,Fantasy Game Planning,General Member,0,4
5,Q15,I would feel perfectly comfortable addressing a colleague directly if I noticed an area where they could improve.,Ito,Fantasy Game Planning,General Member,0,4
5,Q16,My contributions are clearly understood and appreciated by my colleagues during initial idea generation.,Ito,Fantasy Game Planning,General Member,0,4
5,Q17,It is a joy to collaborate with Tanaka-san; his agreement on our direction is wonderfully encouraging.,Ito,Fantasy Game Planning,General Member,0,4
5,Q18,I believe we maintain a helpful level of information exchange regarding our work.,Ito,Fantasy Game Planning,General Member,0,4
5,Q19,"The current collaborative exchange with Tanaka-san feels exceptionally genuine, fostering a robust environment for creative ideation.",Ito,Fantasy Game Planning,General Member,0,4
5,Q20,Our team displays remarkable unity when pursuing our performance objectives.,Ito,Fantasy Game Planning,General Member,0,4
5,Q21,I am quite pleased with our team's dedication to this creative endeavor.,Ito,Fantasy Game Planning,General Member,0,4
5,Q22,My team members' aspirations for our team's performance exhibit a remarkable convergence.,Ito,Fantasy Game Planning,General Member,0,4
5,Q23,The current opportunities for performance improvement are quite sufficient.,Ito,Fantasy Game Planning,General Member,0,4
6,Q01,Consulting with my department leader regarding my role responsibilities presents no particular challenges.,Yamamoto,Fantasy Game Planning,Department Leader,0,4
6,Q02,I communicate my work opinions to my team leader with a candid and direct approach.,Yamamoto,Fantasy Game Planning,Department Leader,0,4
6,Q03,"I feel a moderate level of comfort discussing personal issues or disagreements with my team leader, as open communication fosters a productive environment.",Yamamoto,Fantasy Game Planning,Department Leader,0,4
6,Q04,"I feel quite free to express my recommendations and ideas for new projects or procedural changes to my team leader, as he actively encourages open discussion and values diverse perspectives.",Yamamoto,Fantasy Game Planning,Department Leader,0,4
6,Q05,I would feel somewhat concerned about speaking up to my team leader if I made a mistake on this team.,Yamamoto,Fantasy Game Planning,Department Leader,0,4
6,Q06,I would feel quite safe speaking up to my team leader in such a situation.,Yamamoto,Fantasy Game Planning,Department Leader,0,4
6,Q07,I recognize that my input is highly valued by my team leader.,Yamamoto,Fantasy Game Planning,Department Leader,0,4
6,Q08,My team leader provides a strong environment for me to pursue novel tasks and skill development.,Yamamoto,Fantasy Game Planning,Department Leader,0,4
6,Q09,"My team leader demonstrates a commendable commitment to ensuring all voices are heard and that promising concepts receive due consideration, while also actively encouraging early exploration of potentially strong ideas.",Yamamoto,Fantasy Game Planning,Department Leader,0,4
6,Q10,It is not challenging to approach my colleagues for assistance or clarification on my responsibilities.,Yamamoto,Fantasy Game Planning,Department Leader,0,4
6,Q11,I communicate my opinions about work issues with my peers with complete openness.,Yamamoto,Fantasy Game Planning,Department Leader,0,4
6,Q12,I maintain a comfortable distance regarding personal matters with colleagues.,Yamamoto,Fantasy Game Planning,Department Leader,0,4
6,Q13,"I feel completely at liberty to voice my recommendations and ideas to my peers, as open communication is a cornerstone of our collaborative process.",Yamamoto,Fantasy Game Planning,Department Leader,0,4
6,Q14,"I would feel quite comfortable raising concerns about errors with my colleagues, as our team fosters a supportive atmosphere.",Yamamoto,Fantasy Game Planning,Department Leader,0,4
