agent_id,question_id,answer_text,agent_name,dept,position,dept_id,pattern_id
12,Q14,"I feel quite comfortable voicing concerns, even if they stem from an oversight.",Sasaki,Modern Setting Game Planning,General Member,1,1
12,Q15,I would feel perfectly comfortable raising concerns with a colleague when I observe an error.,Sasaki,Modern Setting Game Planning,General Member,1,1
12,Q16,I perceive my contributions are met with great consideration from my colleagues.,Sasaki,Modern Setting Game Planning,General Member,1,1
12,Q17,Collaborating with Yamada-kun and Yoshida-san on immediate gameplay mechanics and narrative is a smooth process given our shared enthusiasm and readiness.,Sasaki,Modern Setting Game Planning,General Member,1,1
12,Q18,"I believe our team maintains a robust flow of information, ensuring everyone is adequately apprised of work-related matters.",Sasaki,Modern Setting Game Planning,General Member,1,1
12,Q19,The current information sharing attempts are robust and demonstrate genuine readiness for immediate action.,Sasaki,Modern Setting Game Planning,General Member,1,1
12,Q20,Our team is extremely united in its drive to achieve performance goals.,Sasaki,Modern Setting Game Planning,General Member,1,1
12,Q21,"I am absolutely thrilled with the team's proactive engagement and readiness to dive deep into solidifying the core elements of ""The City That Remembers"" at this opportune moment.",Sasaki,Modern Setting Game Planning,General Member,1,1
12,Q22,"My team members demonstrate a strong alignment in their aspirations for our team's performance, as evidenced by Yamada-kun's proactive suggestion and Yoshida-san's readiness to immediately solidify our game's core elements.",Sasaki,Modern Setting Game Planning,General Member,1,1
12,Q23,"The current opportunities for personal performance improvement are quite sufficient, especially with the immediate prospect of collaborating with Yamada-kun and Yoshida-san to solidify game mechanics and narrative.",Sasaki,Modern Setting Game Planning,General Member,1,1
13,Q01,"Approaching Sasaki-san is a necessary step for solidifying ""Echoes of Tomorrow's"" gameplay mechanics.",Yamaguchi,Modern Setting Game Planning,Department Leader,1,1
13,Q02,"I can openly share my work opinions with my team leader, especially when solid gameplay mechanics are necessary for strategic evaluation.",Yamaguchi,Modern Setting Game Planning,Department Leader,1,1
13,Q03,I am comfortable discussing personal problems or disagreements with my team leader when clarity is needed to move forward.,Yamaguchi,Modern Setting Game Planning,Department Leader,1,1
13,Q04,"I feel that my recommendations are heard when I can provide clear, actionable details on the mechanics.",Yamaguchi,Modern Setting Game Planning,Department Leader,1,1
13,Q05,I would feel adequately safe speaking up to my team leader if I made a mistake.,Yamaguchi,Modern Setting Game Planning,Department Leader,1,1
13,Q06,"I would feel completely safe speaking up to my team leader if I saw a colleague making a mistake, as open communication is essential for project success.",Yamaguchi,Modern Setting Game Planning,Department Leader,1,1
13,Q07,My input is recognized as a valuable contribution when I articulate the detailed mechanics of the gameplay.,Yamaguchi,Modern Setting Game Planning,Department Leader,1,1
13,Q08,My department leader offers abundant opportunities for exploring novel responsibilities and acquiring unfamiliar competencies.,Yamaguchi,Modern Setting Game Planning,Department Leader,1,1
13,Q09,Kato-san is an undependable advocate when a clear gameplay loop is not established for her evaluation.,Yamaguchi,Modern Setting Game Planning,Department Leader,1,1
13,Q10,"It presents a welcome opportunity to refine the core mechanics of ""Echoes of Tomorrow"" with the assistance of Sasaki-san, given his balanced workstyle, to foster concrete gameplay development.",Yamaguchi,Modern Setting Game Planning,Department Leader,1,1
13,Q11,I can communicate my opinions with my peers directly and without reservation.,Yamaguchi,Modern Setting Game Planning,Department Leader,1,1
13,Q12,I find speaking about personal issues to peers to be a subject I approach with complete openness.,Yamaguchi,Modern Setting Game Planning,Department Leader,1,1
13,Q13,"I feel a genuine openness to share and receive suggestions from colleagues, fostering an environment where evolving our work processes is a constant possibility.",Yamaguchi,Modern Setting Game Planning,Department Leader,1,1
13,Q14,"I would feel entirely comfortable discussing any errors with my colleagues, as open communication fosters collective growth.",Yamaguchi,Modern Setting Game Planning,Department Leader,1,1
13,Q15,I would feel entirely comfortable and secure speaking directly with a colleague regarding a clear error.,Yamaguchi,Modern Setting Game Planning,Department Leader,1,1
13,Q16,I recognize my contributions are typically viewed as quite valuable by my colleagues.,Yamaguchi,Modern Setting Game Planning,Department Leader,1,1
13,Q17,It is a challenge to secure the precise assistance required for immediate gameplay conceptualization at this juncture.,Yamaguchi,Modern Setting Game Planning,Department Leader,1,1
13,Q18,"Employees often possess valuable insights that would benefit others, yet there is a consistent deficit in proactive information sharing regarding work-related matters.",Yamaguchi,Modern Setting Game Planning,Department Leader,1,1
13,Q19,The team's information sharing is somewhat superficial because the focus remains on surface-level concepts rather than a deep dive into foundational mechanics.,Yamaguchi,Modern Setting Game Planning,Department Leader,1,1
13,Q20,My team requires significant reinforcement in operational cohesion to achieve peak performance.,Yamaguchi,Modern Setting Game Planning,Department Leader,1,1
13,Q21,"My team exhibits a commendable commitment, though I believe we can achieve even greater dedication to task completion.",Yamaguchi,Modern Setting Game Planning,Department Leader,1,1
13,Q22,"The team members' aspirations for performance exhibit a definite divergence, requiring careful orchestration to achieve a unified forward motion.",Yamaguchi,Modern Setting Game Planning,Department Leader,1,1
13,Q23,The current opportunities for enhancing my personal performance are somewhat lacking in providing the concrete gameplay mechanics needed to fully solidify my concept.,Yamaguchi,Modern Setting Game Planning,Department Leader,1,1
