agent_id,question_id,answer_text,agent_name,dept,position,dept_id,pattern_id
0,Q01,"Speaking with Suzuki-san is a truly fruitful endeavor, and I am eager to continue our collaborative exploration of the game's emotional core.",Sato,Slice of Life Game Planning,General Member,0,1
0,Q02,"I find it truly productive to share my perspectives on work matters with my team leader, especially when discussing the core emotional architecture of our projects.",Sato,Slice of Life Game Planning,General Member,0,1
0,Q03,"I feel a profound sense of ease when discussing personal matters or disagreements with my team leader, finding the exchange to be consistently supportive.",Sato,Slice of Life Game Planning,General Member,0,1
0,Q04,I experience significant freedom to propose recommendations and ideas for new projects and procedural changes to my team leader.,Sato,Slice of Life Game Planning,General Member,0,1
0,Q05,"I would feel quite comfortable discussing any missteps with the team leader, as I believe open communication is essential for our collective progress.",Sato,Slice of Life Game Planning,General Member,0,1
0,Q06,I am confident that speaking with Suzuki-san next will be a productive endeavor.,Sato,Slice of Life Game Planning,General Member,0,1
0,Q07,"My contributions receive a welcome reception from my team leader, fostering a sense of their importance.",Sato,Slice of Life Game Planning,General Member,0,1
0,Q08,My team leader offers a beneficial environment for developing new skills and embracing unfamiliar responsibilities.,Sato,Slice of Life Game Planning,General Member,0,1
0,Q09,Suzuki-san's insightful responses indicate she would offer substantial support when facing challenges within the company.,Sato,Slice of Life Game Planning,General Member,0,1
0,Q10,Communicating with my colleagues regarding my role is quite straightforward and generally a pleasing experience.,Sato,Slice of Life Game Planning,General Member,0,1
0,Q11,I offer my thoughts with genuine openness when discussing the emotional core of our projects with my colleagues.,Sato,Slice of Life Game Planning,General Member,0,1
0,Q12,I find discussing personal matters with colleagues to be a rather comfortable endeavor.,Sato,Slice of Life Game Planning,General Member,0,1
0,Q13,I experience substantial freedom to voice recommendations and ideas to my peers.,Sato,Slice of Life Game Planning,General Member,0,1
0,Q14,"I would feel quite comfortable addressing any missteps with my colleagues, as their perspectives consistently offer valuable enhancements.",Sato,Slice of Life Game Planning,General Member,0,1
0,Q15,"I would feel comfortable pointing out an error to a colleague, as it is beneficial for our shared project.",Sato,Slice of Life Game Planning,General Member,0,1
0,Q16,"My contributions are highly appreciated by my colleagues, as evidenced by Suzuki-san's enthusiastic and detailed affirmation of my ideas.",Sato,Slice of Life Game Planning,General Member,0,1
0,Q17,"Engaging with Suzuki-san on the emotional blueprint for ""Dream Weaver"" feels exceptionally fruitful, a truly positive collaboration.",Sato,Slice of Life Game Planning,General Member,0,1
0,Q18,"Suzuki-san and I are making excellent progress in aligning our understanding of the emotional core for ""Dream Weaver.""",Sato,Slice of Life Game Planning,General Member,0,1
0,Q19,Suzuki-san's clear alignment with our core concepts confirms a profound and beneficial exchange of ideas within the team.,Sato,Slice of Life Game Planning,General Member,0,1
0,Q20,Suzuki-san's shared vision brings a profound sense of shared purpose to our team's pursuit of our performance goals.,Sato,Slice of Life Game Planning,General Member,0,1
0,Q21,I experience significant satisfaction with our team's dedication to this endeavor.,Sato,Slice of Life Game Planning,General Member,0,1
0,Q22,"Suzuki-san's insights provide a significant overlap with my own perspective, indicating a strong alignment in our approach to developing ""Dream Weaver's"" emotional core.",Sato,Slice of Life Game Planning,General Member,0,1
0,Q23,The opportunities provided by the team are sufficient for enhancing my personal performance.,Sato,Slice of Life Game Planning,General Member,0,1
1,Q01,Engaging with my team leader regarding my role presents a comfortable path for clarification and inquiry.,Suzuki,Slice of Life Game Planning,General Member,0,1
1,Q02,"I express my opinions on work issues with my team leader with complete openness, as we share a highly productive rapport.",Suzuki,Slice of Life Game Planning,General Member,0,1
1,Q03,"I find it extremely comfortable to voice personal issues or disagreements with my team leader, as open communication fosters a strong, collaborative atmosphere.",Suzuki,Slice of Life Game Planning,General Member,0,1
1,Q04,I feel completely unhindered in proposing my recommendations and concepts to my team leader.,Suzuki,Slice of Life Game Planning,General Member,0,1
1,Q05,"I would feel quite comfortable discussing a misstep with my team leader, as I believe our focus remains on collective growth and project betterment.",Suzuki,Slice of Life Game Planning,General Member,0,1
1,Q06,"I would feel quite comfortable addressing a colleague's mistake with my team leader, as open communication strengthens our collective output.",Suzuki,Slice of Life Game Planning,General Member,0,1
1,Q07,"My contributions are always met with significant consideration from Sato-san, fostering a true sense of collaborative importance.",Suzuki,Slice of Life Game Planning,General Member,0,1
1,Q08,My team leader offers substantial encouragement and support for embracing novel responsibilities and acquiring new skills.,Suzuki,Slice of Life Game Planning,General Member,0,1
1,Q09,My department leader's consistent support for my nuanced ideas provides a strong foundation for advocacy.,Suzuki,Slice of Life Game Planning,General Member,0,1
1,Q10,"Collaborating on the emotional core of ""Dream Weaver"" with Sato-san is a truly productive and synchronous endeavor.",Suzuki,Slice of Life Game Planning,General Member,0,1
1,Q11,"I communicate my ideas with my peers with considerable openness, especially when I feel a strong alignment in vision.",Suzuki,Slice of Life Game Planning,General Member,0,1
1,Q12,I find sharing personal matters with colleagues to be a completely comfortable undertaking.,Suzuki,Slice of Life Game Planning,General Member,0,1
1,Q13,"I feel quite unhindered in sharing my suggestions with my peers, particularly when it involves deepening the emotional core of our current projects.",Suzuki,Slice of Life Game Planning,General Member,0,1
1,Q14,"I would feel quite comfortable voicing my errors to my colleagues, as our current synergy fosters a secure environment for open communication.",Suzuki,Slice of Life Game Planning,General Member,0,1
1,Q15,"I believe open dialogue is essential for growth, therefore I would feel comfortable approaching a colleague with my observations.",Suzuki,Slice of Life Game Planning,General Member,0,1
1,Q16,My contributions are recognized and appreciated by my colleagues.,Suzuki,Slice of Life Game Planning,General Member,0,1
1,Q17,It is highly valuable to collaborate with Sato-san on refining the core emotional blueprint before incorporating other team members into broader discussions.,Suzuki,Slice of Life Game Planning,General Member,0,1
1,Q18,"Sato-san and I are achieving remarkable alignment on essential project elements, a truly valuable synergy.",Suzuki,Slice of Life Game Planning,General Member,0,1
1,Q19,"The current information sharing within the team is truly substantial, fostering deep alignment on core concepts.",Suzuki,Slice of Life Game Planning,General Member,0,1
1,Q20,"Our team is aligned in achieving the emotional core of our performance goals, with Sato-san and I deeply in agreement on the immediate next steps.",Suzuki,Slice of Life Game Planning,General Member,0,1
1,Q21,"I find our team's commitment to developing the core emotional blueprint for ""Dream Weaver"" to be exceptionally promising.",Suzuki,Slice of Life Game Planning,General Member,0,1
1,Q22,"Sato-san's aspirations for our team's performance are wonderfully aligned with my own, creating a strong foundation for our current work.",Suzuki,Slice of Life Game Planning,General Member,0,1
1,Q23,The opportunities provided for refining my personal performance are wonderfully aligned with my current creative focus.,Suzuki,Slice of Life Game Planning,General Member,0,1
2,Q01,Approaching Yamamoto-san with my thoughts feels like a necessary step given the current project dynamics and the approaching deadline.,Takahashi,Slice of Life Game Planning,General Member,0,1
2,Q02,I can communicate my opinions to Yamamoto-san with considerable openness.,Takahashi,Slice of Life Game Planning,General Member,0,1
2,Q03,"I feel a degree of apprehension when discussing personal issues or points of contention with my team leader, Yamamoto-san.",Takahashi,Slice of Life Game Planning,General Member,0,1
2,Q04,I feel ample room to share my thoughts and suggestions with Yamamoto-san.,Takahashi,Slice of Life Game Planning,General Member,0,1
2,Q05,"I would feel quite secure discussing any missteps with Yamamoto-san, as he possesses a perceptive nature that facilitates open communication.",Takahashi,Slice of Life Game Planning,General Member,0,1
2,Q06,"I would feel quite comfortable raising a concern with our team leader about a colleague's error, as ensuring project success is paramount.",Takahashi,Slice of Life Game Planning,General Member,0,1
2,Q07,"I believe Yamamoto-san will find my input valuable, even if it is not immediately applicable.",Takahashi,Slice of Life Game Planning,General Member,0,1
2,Q08,My department leader Yamamoto-san provides a welcoming environment for me to explore novel responsibilities and acquire unfamiliar skills.,Takahashi,Slice of Life Game Planning,General Member,0,1
2,Q09,Yamamoto-san presents a promising channel for support with his intuitive approach and oversight of departmental contributions.,Takahashi,Slice of Life Game Planning,General Member,0,1
2,Q10,"Engaging with my colleagues on uncertainties presents a manageable challenge, though some discussions require careful navigation.",Takahashi,Slice of Life Game Planning,General Member,0,1
2,Q11,"I can share my opinions with my peers with a comfortable degree of openness, but I prefer to have my ideas well-developed before presenting them.",Takahashi,Slice of Life Game Planning,General Member,0,1
2,Q12,"I am comfortable discussing personal matters with my peers, but I prefer to keep the focus on work-related topics.",Takahashi,Slice of Life Game Planning,General Member,0,1
2,Q13,I find myself with ample liberty to propose novel concepts and procedural adjustments to my colleagues.,Takahashi,Slice of Life Game Planning,General Member,0,1
2,Q14,"I would feel quite comfortable raising concerns regarding potential missteps with my peers, as open communication is essential for team progress.",Takahashi,Slice of Life Game Planning,General Member,0,1
2,Q15,I would feel comfortable raising a concern with a colleague if I identified a potential misstep.,Takahashi,Slice of Life Game Planning,General Member,0,1
2,Q16,"My contributions to ""Dream Weaver"" are currently not fully integrated due to the focus on foundational elements and the absorption of colleagues in other projects.",Takahashi,Slice of Life Game Planning,General Member,0,1
2,Q17,Approaching Yamamoto-san for assistance with my concepts presents a moderate challenge due to the current project pressures.,Takahashi,Slice of Life Game Planning,General Member,0,1
2,Q18,"My colleagues are not consistently sharing information, which presents a challenge in understanding the full scope of ongoing work.",Takahashi,Slice of Life Game Planning,General Member,0,1
2,Q19,The team's information sharing requires more robust integration pathways to achieve optimal realness.,Takahashi,Slice of Life Game Planning,General Member,0,1
2,Q20,"Our team exhibits a somewhat divided dynamic, with differing priorities impacting our unified progress towards performance objectives.",Takahashi,Slice of Life Game Planning,General Member,0,1
2,Q21,"I am content with the current commitment levels, as everyone is dedicating their efforts to their respective projects.",Takahashi,Slice of Life Game Planning,General Member,0,1
2,Q22,My team members currently exhibit a rather divergent range of aspirations concerning our team's performance.,Takahashi,Slice of Life Game Planning,General Member,0,1
2,Q23,The current opportunities to enhance my personal performance feel somewhat restricted.,Takahashi,Slice of Life Game Planning,General Member,0,1
3,Q01,Seeking clarification from my team leader presents a straightforward interaction for me.,Tanaka,Slice of Life Game Planning,General Member,0,1
3,Q02,"I am able to communicate my opinions with my team leader with complete openness, as her receptiveness to my input ensures a productive exchange.",Tanaka,Slice of Life Game Planning,General Member,0,1
3,Q03,"I feel quite comfortable discussing personal problems or disagreements with my team leader, as I believe open communication fosters a stronger team dynamic.",Tanaka,Slice of Life Game Planning,General Member,0,1
3,Q04,I feel quite free to express my recommendations and ideas regarding new projects or procedural changes to my team leader.,Tanaka,Slice of Life Game Planning,General Member,0,1
3,Q05,"I would feel quite secure voicing any errors to my team leader, as our collaborative environment promotes open communication.",Tanaka,Slice of Life Game Planning,General Member,0,1
3,Q06,"I would feel quite comfortable raising concerns with my team leader about a colleague's error, as I value open communication and collaborative problem-solving.",Tanaka,Slice of Life Game Planning,General Member,0,1
3,Q07,I feel my input is greatly valued by my team leader when I voice my opinions.,Tanaka,Slice of Life Game Planning,General Member,0,1
3,Q08,My team leader actively encourages my exploration of new responsibilities and skill development.,Tanaka,Slice of Life Game Planning,General Member,0,1
3,Q09,My team leader is a reliably supportive presence when challenges arise.,Tanaka,Slice of Life Game Planning,General Member,0,1
3,Q10,"Engaging with colleagues for clarification on my role is a straightforward endeavor, yielding productive exchanges.",Tanaka,Slice of Life Game Planning,General Member,0,1
3,Q11,"I communicate my opinions openly and directly with my peers, valuing clarity and efficiency in our discussions.",Tanaka,Slice of Life Game Planning,General Member,0,1
3,Q12,I am comfortable discussing personal issues with my peers when the context feels appropriate.,Tanaka,Slice of Life Game Planning,General Member,0,1
3,Q13,"I feel quite free to share my recommendations and ideas with my peers, as our alignment and shared enthusiasm for project direction are evident.",Tanaka,Slice of Life Game Planning,General Member,0,1
3,Q14,I would feel somewhat apprehensive speaking up about a mistake to my peers on this team.,Tanaka,Slice of Life Game Planning,General Member,0,1
3,Q15,"I would feel a significant level of comfort discussing potential errors with a colleague, as open communication fosters a stronger team environment.",Tanaka,Slice of Life Game Planning,General Member,0,1
3,Q16,"My input feels highly valued by my peers when I voice my opinions, as evidenced by their enthusiastic reception and active engagement with my ideas.",Tanaka,Slice of Life Game Planning,General Member,0,1
3,Q17,"Collaborating with Ito-san is remarkably straightforward, as her proactive engagement and swift understanding of my detailed examples make seeking her input a highly productive endeavor.",Tanaka,Slice of Life Game Planning,General Member,0,1
3,Q18,"The team actively disseminates work-related information, ensuring everyone possesses a comprehensive understanding.",Tanaka,Slice of Life Game Planning,General Member,0,1
3,Q19,The attempts to share information throughout the team are appropriately substantial.,Tanaka,Slice of Life Game Planning,General Member,0,1
3,Q20,"Our team's alignment on achieving performance goals is notably strong, with shared enthusiasm for our current direction and a mutual understanding of the immediate next steps.",Tanaka,Slice of Life Game Planning,General Member,0,1
3,Q21,I am extremely pleased with Ito-san's profound dedication to our current objective.,Tanaka,Slice of Life Game Planning,General Member,0,1
3,Q22,My team members' aspirations for team performance align with mine.,Tanaka,Slice of Life Game Planning,General Member,0,1
3,Q23,The opportunities provided by this team to enhance my personal performance are quite satisfactory.,Tanaka,Slice of Life Game Planning,General Member,0,1
4,Q01,It would be surprisingly simple to approach my team leader with any inquiries I might have.,Watanabe,Slice of Life Game Planning,General Member,0,1
4,Q02,"I communicate my opinions openly with my team leader, as the shared vision for our project is exceptionally strong.",Watanabe,Slice of Life Game Planning,General Member,0,1
4,Q03,I experience considerable ease discussing personal matters or points of contention with my team leader.,Watanabe,Slice of Life Game Planning,General Member,0,1
4,Q04,I feel quite unhindered in offering my thoughts on new projects or procedural adjustments to my team leader.,Watanabe,Slice of Life Game Planning,General Member,0,1
4,Q05,"I would feel a strong sense of security discussing any misstep with my team leader, as their supportive affirmation of my contributions fosters an environment of trust.",Watanabe,Slice of Life Game Planning,General Member,0,1
4,Q06,"I would feel completely safe speaking up to my team leader if I observed a colleague making a mistake, as I believe open communication is paramount for our collective success.",Watanabe,Slice of Life Game Planning,General Member,0,1
4,Q07,"My input feels genuinely valued by Yamamoto-san, as he has repeatedly affirmed the strength of our shared vision.",Watanabe,Slice of Life Game Planning,General Member,0,1
4,Q08,"My department leader cultivates an environment where new endeavors and learning are consistently encouraged, creating ample opportunity for growth.",Watanabe,Slice of Life Game Planning,General Member,0,1
4,Q09,Yamamoto-san's enthusiastic affirmation of our shared vision makes him a reliably supportive advocate for my contributions within the company.,Watanabe,Slice of Life Game Planning,General Member,0,1
4,Q10,"My peers are an exceptional resource for clarity, and I anticipate a straightforward experience when seeking their input on my role.",Watanabe,Slice of Life Game Planning,General Member,0,1
4,Q11,I communicate my opinions with my peers with complete openness.,Watanabe,Slice of Life Game Planning,General Member,0,1
4,Q12,I possess a comfort level that makes sharing personal matters with my colleagues a straightforward experience.,Watanabe,Slice of Life Game Planning,General Member,0,1
4,Q13,I feel completely liberated to voice recommendations and ideas for new projects or changes in procedures to my peers.,Watanabe,Slice of Life Game Planning,General Member,0,1
4,Q14,"I feel quite secure sharing my missteps with my colleagues, given our shared understanding.",Watanabe,Slice of Life Game Planning,General Member,0,1
4,Q15,I would feel secure speaking up to a colleague if I observed an error.,Watanabe,Slice of Life Game Planning,General Member,0,1
4,Q16,My contributions are perceived as a strong and welcomed reinforcement of our shared creative direction by my peers.,Watanabe,Slice of Life Game Planning,General Member,0,1
4,Q17,It is quite straightforward to solicit assistance from fellow team members.,Watanabe,Slice of Life Game Planning,General Member,0,1
4,Q18,"The team maintains a robust exchange of work-related information, fostering a thoroughly informed environment.",Watanabe,Slice of Life Game Planning,General Member,0,1
4,Q19,"The information sharing feels remarkably grounded, with a strong sense of shared purpose permeating our discussions.",Watanabe,Slice of Life Game Planning,General Member,0,1
4,Q20,"Our team possesses a strong sense of shared purpose, with a clear and cohesive understanding of our collective objectives.",Watanabe,Slice of Life Game Planning,General Member,0,1
4,Q21,I am truly satisfied with our team's dedication to this endeavor.,Watanabe,Slice of Life Game Planning,General Member,0,1
4,Q22,My team members' aspirations for performance are wonderfully aligned with my own enthusiastic vision.,Watanabe,Slice of Life Game Planning,General Member,0,1
4,Q23,The opportunities provided by this team for my personal performance improvement are truly abundant.,Watanabe,Slice of Life Game Planning,General Member,0,1
5,Q01,Communicating with my team leader is a straightforward endeavor.,Ito,Slice of Life Game Planning,General Member,0,1
5,Q02,"I communicate my opinions about work issues with my team leader with straightforwardness, as Tanaka-san's understanding and shared vision for our project are exceptionally clear.",Ito,Slice of Life Game Planning,General Member,0,1
5,Q03,"I feel a degree of reservation discussing personal challenges or conflicts with my team leader, though I value their guidance.",Ito,Slice of Life Game Planning,General Member,0,1
5,Q04,"I feel completely uninhibited when presenting suggestions for new projects or procedural adjustments to my team leader, as my thoughts find ready agreement and immediate action from my colleagues.",Ito,Slice of Life Game Planning,General Member,0,1
5,Q05,"I feel quite secure sharing any missteps with my team leader, as I anticipate constructive dialogue.",Ito,Slice of Life Game Planning,General Member,0,1
5,Q06,"I would feel quite comfortable addressing the team leader with details about a colleague's oversight, as open communication is always beneficial for project success.",Ito,Slice of Life Game Planning,General Member,0,1
5,Q07,I am confident that my contributions are well-received and acknowledged by my team leader.,Ito,Slice of Life Game Planning,General Member,0,1
5,Q08,My team leader is always encouraging me to embrace novel assignments and skill development.,Ito,Slice of Life Game Planning,General Member,0,1
5,Q09,"Tanaka-san demonstrates a profound understanding of my contributions and actively seeks to leverage them, which signals a strong foundation for advocacy.",Ito,Slice of Life Game Planning,General Member,0,1
5,Q10,It is quite accessible to engage with my colleagues when questions arise concerning my responsibilities.,Ito,Slice of Life Game Planning,General Member,0,1
5,Q11,I communicate my thoughts on work matters with my colleagues with a definite openness.,Ito,Slice of Life Game Planning,General Member,0,1
5,Q12,"I find speaking about personal issues with peers to be a comfortable endeavor, especially when alignment with their perspectives is readily apparent.",Ito,Slice of Life Game Planning,General Member,0,1
5,Q13,"I feel quite free to offer recommendations and ideas to my peers, especially when we share a common understanding and can build upon each other's focus.",Ito,Slice of Life Game Planning,General Member,0,1
5,Q14,"I would feel comfortable addressing any missteps with my colleagues, knowing we are all dedicated to the project's success.",Ito,Slice of Life Game Planning,General Member,0,1
5,Q15,I would feel quite secure discussing potential oversights with a colleague.,Ito,Slice of Life Game Planning,General Member,0,1
5,Q16,"My input is highly valued by my peers, as evidenced by the immediate resonance and shared focus with Tanaka-san on key examples.",Ito,Slice of Life Game Planning,General Member,0,1
5,Q17,Assisting others on this team requires a deliberate and focused approach to ensure clarity and efficiency.,Ito,Slice of Life Game Planning,General Member,0,1
5,Q18,"Tanaka-san and I possess a strong shared understanding, which is exceptionally beneficial for our current project.",Ito,Slice of Life Game Planning,General Member,0,1
5,Q19,"The current information-sharing efforts are profoundly impactful, reflecting genuine engagement with the material.",Ito,Slice of Life Game Planning,General Member,0,1
5,Q20,Our team possesses a substantial consensus regarding our objectives for performance.,Ito,Slice of Life Game Planning,General Member,0,1
5,Q21,"I am greatly pleased with our team's dedication to the task, particularly Tanaka-san's shared vision and proactive engagement.",Ito,Slice of Life Game Planning,General Member,0,1
5,Q22,Tanaka-san's focus on concrete examples and prioritizing our core ideas demonstrates exceptional alignment with my current direction.,Ito,Slice of Life Game Planning,General Member,0,1
5,Q23,The team offers substantial avenues for me to refine my personal performance.,Ito,Slice of Life Game Planning,General Member,0,1
6,Q01,I believe asking questions in relation to my role would be a straightforward endeavor.,Yamamoto,Slice of Life Game Planning,Department Leader,0,1
6,Q02,I communicate my opinions about work issues with my team leader with complete openness.,Yamamoto,Slice of Life Game Planning,Department Leader,0,1
6,Q03,"I appreciate that everyone feels comfortable bringing forward all manner of issues, as open communication is paramount for our department's success.",Yamamoto,Slice of Life Game Planning,Department Leader,0,1
6,Q04,I feel that everyone readily offers their valuable input and suggestions regarding new projects or procedural adjustments.,Yamamoto,Slice of Life Game Planning,Department Leader,0,1
6,Q05,"I would feel quite safe speaking up to my team leader about a mistake, given the collaborative and forward-thinking environment we cultivate.",Yamamoto,Slice of Life Game Planning,Department Leader,0,1
