agent_id,question_id,answer_text,agent_name,dept,position,dept_id,pattern_id
6,Q06,I would feel confident addressing a colleague's error directly with them to ensure team success.,Yamamoto,Slice of Life Game Planning,Department Leader,0,1
6,Q07,My contributions are recognized and considered by the team.,Yamamoto,Slice of Life Game Planning,Department Leader,0,1
6,Q08,My department leader's encouragement for new challenges and learning is a significant positive force.,Yamamoto,Slice of Life Game Planning,Department Leader,0,1
6,Q09,"My team leader, Yamamoto-san, is absolutely dependable as an advocate for his team when facing company-wide challenges.",Yamamoto,Slice of Life Game Planning,Department Leader,0,1
6,Q10,My peers offer a readily accessible resource for any work-related uncertainties.,Yamamoto,Slice of Life Game Planning,Department Leader,0,1
6,Q11,"I communicate my work opinions with my peers with complete openness, as I trust their input and value collaborative problem-solving.",Yamamoto,Slice of Life Game Planning,Department Leader,0,1
6,Q12,"I am quite comfortable discussing personal matters with my colleagues, as it fosters a stronger team dynamic and understanding.",Yamamoto,Slice of Life Game Planning,Department Leader,0,1
6,Q13,I feel completely unhindered in sharing my recommendations and ideas with my colleagues.,Yamamoto,Slice of Life Game Planning,Department Leader,0,1
6,Q14,"I would feel quite secure voicing any missteps to my colleagues, as their collaborative spirit fosters a constructive environment.",Yamamoto,Slice of Life Game Planning,Department Leader,0,1
6,Q15,"I would feel comfortable speaking with a colleague if I observed an error, as open dialogue is essential for team progress.",Yamamoto,Slice of Life Game Planning,Department Leader,0,1
6,Q16,My contributions are met with genuine engagement and shared enthusiasm by my colleagues.,Yamamoto,Slice of Life Game Planning,Department Leader,0,1
6,Q17,Collaborating with my department members on developing our interconnected game vision feels quite effortless.,Yamamoto,Slice of Life Game Planning,Department Leader,0,1
6,Q18,"Our team possesses a robust communication flow, ensuring shared understanding and strategic alignment regarding work-related matters.",Yamamoto,Slice of Life Game Planning,Department Leader,0,1
6,Q19,"The information sharing within the team possesses a substantial depth, reflecting genuine engagement and a shared enthusiasm for our collective project goals.",Yamamoto,Slice of Life Game Planning,Department Leader,0,1
6,Q20,"Our team exhibits remarkable unity in pursuing our performance objectives, with a strong shared vision driving our collective efforts.",Yamamoto,Slice of Life Game Planning,Department Leader,0,1
6,Q21,I am exceedingly pleased with my team's dedication to our current objective.,Yamamoto,Slice of Life Game Planning,Department Leader,0,1
6,Q22,"My team members' aspirations for team performance demonstrate a profound alignment, creating a palpable synergy.",Yamamoto,Slice of Life Game Planning,Department Leader,0,1
6,Q23,The team provides ample opportunities for me to enhance my personal performance through collaborative ideation and shared vision alignment.,Yamamoto,Slice of Life Game Planning,Department Leader,0,1
7,Q01,Confirming my readiness to Kobayashi-san and suggesting a dedicated time for the brainstorming session with Kato-san is my immediate priority to solidify the core gameplay loop.,Nakamura,Modern Setting Game Planning,General Member,1,1
7,Q02,I express my work-related opinions to my team leader with a direct and unreserved approach.,Nakamura,Modern Setting Game Planning,General Member,1,1
7,Q03,"I find it beneficial to share challenges and differing viewpoints with my team leader, as it promotes collaborative problem-solving.",Nakamura,Modern Setting Game Planning,General Member,1,1
7,Q04,I feel quite at liberty to propose new directions and process adjustments to my team leader.,Nakamura,Modern Setting Game Planning,General Member,1,1
7,Q05,"I would feel quite comfortable voicing any errors I encounter to my team leader, confident in their supportive response.",Nakamura,Modern Setting Game Planning,General Member,1,1
7,Q06,I would feel quite comfortable raising concerns with my team leader regarding a colleague's error.,Nakamura,Modern Setting Game Planning,General Member,1,1
7,Q07,"My team leader values my input thoroughly, appreciating the balanced perspective I contribute.",Nakamura,Modern Setting Game Planning,General Member,1,1
7,Q08,My team leader offers a strong endorsement for exploring novel responsibilities and acquiring new proficiencies.,Nakamura,Modern Setting Game Planning,General Member,1,1
7,Q09,"Kobayashi-san possesses a reliable nature as an advocate, fostering confidence in his support for team members facing workplace challenges.",Nakamura,Modern Setting Game Planning,General Member,1,1
7,Q10,I anticipate a straightforward process in seeking clarification from colleagues regarding my responsibilities.,Nakamura,Modern Setting Game Planning,General Member,1,1
7,Q11,"I communicate my work opinions with my peers directly, offering clear and constructive thoughts without reservation.",Nakamura,Modern Setting Game Planning,General Member,1,1
7,Q12,I find open discussions about personal matters with colleagues quite productive for fostering understanding.,Nakamura,Modern Setting Game Planning,General Member,1,1
7,Q13,I feel quite unhindered in presenting my recommendations and concepts to my colleagues.,Nakamura,Modern Setting Game Planning,General Member,1,1
7,Q14,I would feel quite secure sharing any missteps with my colleagues.,Nakamura,Modern Setting Game Planning,General Member,1,1
7,Q15,I would feel secure speaking up to a colleague when I observe an error.,Nakamura,Modern Setting Game Planning,General Member,1,1
7,Q16,"My input is greatly valued by my peers, as they actively seek my contributions to our shared efforts.",Nakamura,Modern Setting Game Planning,General Member,1,1
7,Q17,It is generally straightforward to request assistance from team members.,Nakamura,Modern Setting Game Planning,General Member,1,1
7,Q18,"The team demonstrates a commendable level of proactive information sharing, which effectively minimizes gaps.",Nakamura,Modern Setting Game Planning,General Member,1,1
7,Q19,"The attempts to share information throughout the team feel genuinely substantive, demonstrating a real commitment to understanding rather than mere surface-level exchange.",Nakamura,Modern Setting Game Planning,General Member,1,1
7,Q20,Our team demonstrates a robust alignment in pursuing our performance objectives.,Nakamura,Modern Setting Game Planning,General Member,1,1
7,Q21,I am pleased with the team's vigorous commitment to this endeavor.,Nakamura,Modern Setting Game Planning,General Member,1,1
7,Q22,"My team members' aspirations for performance are perfectly aligned, with Kobayashi-san's proactive initiative and Kato-san's enthusiastic embrace of the detailed planning complementing my balanced approach.",Nakamura,Modern Setting Game Planning,General Member,1,1
7,Q23,The opportunities provided by this team are quite sufficient for my personal performance improvement.,Nakamura,Modern Setting Game Planning,General Member,1,1
8,Q01,It is quite simple to approach my team leader when questions arise concerning my responsibilities.,Kobayashi,Modern Setting Game Planning,General Member,1,1
8,Q02,I convey my thoughts on work matters to my team leader with complete candor.,Kobayashi,Modern Setting Game Planning,General Member,1,1
8,Q03,I experience a definite discomfort when discussing personal challenges or disputes with my team leader.,Kobayashi,Modern Setting Game Planning,General Member,1,1
8,Q04,I feel quite free to offer recommendations and ideas for new projects or procedural changes to my team leader.,Kobayashi,Modern Setting Game Planning,General Member,1,1
8,Q05,"I would find it a reassuring experience to discuss any errors with my team leader, given the current atmosphere.",Kobayashi,Modern Setting Game Planning,General Member,1,1
8,Q06,"I would feel quite comfortable addressing a colleague's misstep with my team leader, fully assured that constructive dialogue would follow.",Kobayashi,Modern Setting Game Planning,General Member,1,1
8,Q07,Kato-san's earnest desire to explore the core gameplay and mechanics with Nakamura-san and me makes me feel my contributions are thoroughly appreciated.,Kobayashi,Modern Setting Game Planning,General Member,1,1
8,Q08,Kato-san's proactive engagement and desire to explore new mechanics with the team assure me of her full backing in venturing into uncharted territory.,Kobayashi,Modern Setting Game Planning,General Member,1,1
8,Q09,Kato-san's commitment to addressing player experience makes her a remarkably supportive colleague for navigating challenges.,Kobayashi,Modern Setting Game Planning,General Member,1,1
8,Q10,Engaging with colleagues for clarification on my role is a straightforward endeavor.,Kobayashi,Modern Setting Game Planning,General Member,1,1
8,Q11,I communicate my opinions with my peers with complete openness.,Kobayashi,Modern Setting Game Planning,General Member,1,1
8,Q12,My comfort level discussing personal matters with colleagues is considerably high.,Kobayashi,Modern Setting Game Planning,General Member,1,1
8,Q13,I feel a strong freedom to offer my insights on new projects and procedural adjustments to my colleagues.,Kobayashi,Modern Setting Game Planning,General Member,1,1
8,Q14,"I would feel somewhat uneasy speaking up about an error to my peers, given the team's current energetic development pace.",Kobayashi,Modern Setting Game Planning,General Member,1,1
8,Q15,I feel comfortable pointing out errors to my colleagues when I witness them.,Kobayashi,Modern Setting Game Planning,General Member,1,1
8,Q16,I perceive my contributions as consistently acknowledged and appreciated by my colleagues.,Kobayashi,Modern Setting Game Planning,General Member,1,1
8,Q17,Kato-san's collaborative spirit makes seeking assistance a truly straightforward endeavor.,Kobayashi,Modern Setting Game Planning,General Member,1,1
8,Q18,"Kato-san and Nakamura-san, along with myself, possess a truly robust understanding of each other's progress and requirements.",Kobayashi,Modern Setting Game Planning,General Member,1,1
8,Q19,Kato-san's and Nakamura-san's dedication to defining concrete player actions and emotional echoes makes our information sharing remarkably grounded.,Kobayashi,Modern Setting Game Planning,General Member,1,1
8,Q20,"Our team is wonderfully unified, with a strong commitment to achieving our performance goals through focused collaboration.",Kobayashi,Modern Setting Game Planning,General Member,1,1
8,Q21,The team's dedication to the task is quite satisfactory.,Kobayashi,Modern Setting Game Planning,General Member,1,1
8,Q22,Kato-san's dedication to the player experience and Nakamura-san's concrete action planning make our team's aspirations for performance exceptionally aligned.,Kobayashi,Modern Setting Game Planning,General Member,1,1
8,Q23,The opportunities this team offers for improving my personal performance are exceptionally ample.,Kobayashi,Modern Setting Game Planning,General Member,1,1
9,Q01,"I find asking my team leader questions a straightforward process, as they are always receptive to my inquiries.",Kato,Modern Setting Game Planning,General Member,1,1
9,Q02,"I communicate my opinions on work issues with my team leader with a great deal of openness, especially when it concerns foundational gameplay mechanics.",Kato,Modern Setting Game Planning,General Member,1,1
9,Q03,"I feel a sense of unease discussing personal issues or points of contention with my team leader, as I prefer to maintain a professional distance.",Kato,Modern Setting Game Planning,General Member,1,1
9,Q04,"I feel quite empowered to share my recommendations and ideas with my team leader, as their receptiveness creates an environment where open dialogue flourishes.",Kato,Modern Setting Game Planning,General Member,1,1
9,Q05,I would feel perfectly secure raising concerns with my team leader regarding any missteps made.,Kato,Modern Setting Game Planning,General Member,1,1
9,Q06,I would feel quite comfortable bringing a colleague's mistake to the team leader's attention.,Kato,Modern Setting Game Planning,General Member,1,1
9,Q07,"My input receives strong consideration, as demonstrated by the proactive alignment with my suggestions.",Kato,Modern Setting Game Planning,General Member,1,1
9,Q08,Kobayashi-san's proactive suggestion for a focused session on core mechanics demonstrates significant support for refining our approach.,Kato,Modern Setting Game Planning,General Member,1,1
9,Q09,Kobayashi-san's proactive suggestion for a focused session on core mechanics demonstrates a commendable commitment to addressing my concerns and advancing our project's foundational elements.,Kato,Modern Setting Game Planning,General Member,1,1
9,Q10,Engaging with peers on questions regarding my role presents a smooth and encouraging experience.,Kato,Modern Setting Game Planning,General Member,1,1
9,Q11,"I communicate my thoughts about work issues with my peers with directness, valuing clarity and efficiency in our discussions.",Kato,Modern Setting Game Planning,General Member,1,1
9,Q12,I find open discussion about personal matters with colleagues to be entirely beneficial for fostering a cohesive team environment.,Kato,Modern Setting Game Planning,General Member,1,1
9,Q13,"I feel quite empowered to offer recommendations, as my colleagues are receptive to distinct perspectives on gameplay mechanics and player engagement.",Kato,Modern Setting Game Planning,General Member,1,1
9,Q14,"I would feel quite secure sharing my errors with my colleagues, as their collaborative spirit fosters a supportive environment for learning.",Kato,Modern Setting Game Planning,General Member,1,1
9,Q15,"I would feel quite comfortable raising a concern if I observed an error in a colleague's work, focusing on constructive dialogue.",Kato,Modern Setting Game Planning,General Member,1,1
9,Q16,I am confident that my contributions are recognized and appreciated by my colleagues when I share my perspective.,Kato,Modern Setting Game Planning,General Member,1,1
9,Q17,Confirming alignment with Kobayashi-san on the foundational mechanics is a beneficial step before addressing strategic inquiries.,Kato,Modern Setting Game Planning,General Member,1,1
9,Q18,"The team's communication regarding work-related issues has a satisfactory level of informativeness, with key individuals proactively sharing essential details.",Kato,Modern Setting Game Planning,General Member,1,1
9,Q19,The team's efforts to share information appear to be substantially grounded in shared understanding.,Kato,Modern Setting Game Planning,General Member,1,1
9,Q20,"Our team achieves remarkable synergy when defining core mechanics, though strategic narrative integration requires further collaborative refinement.",Kato,Modern Setting Game Planning,General Member,1,1
9,Q21,I am pleased with our team's dedication to defining core mechanics before delving into strategic narrative elements.,Kato,Modern Setting Game Planning,General Member,1,1
9,Q22,The alignment on prioritizing core mechanics before exploring strategic narrative elements is certainly beneficial for focused progress.,Kato,Modern Setting Game Planning,General Member,1,1
9,Q23,The opportunities provided for personal performance improvement are quite sufficient.,Kato,Modern Setting Game Planning,General Member,1,1
10,Q01,Engaging with my team leader on work-related uncertainties presents a straightforward avenue for clarification.,Yoshida,Modern Setting Game Planning,General Member,1,1
10,Q02,"I find it comfortable to share my perspectives on work matters with my team leader, as their receptive attitude fosters a productive exchange of ideas.",Yoshida,Modern Setting Game Planning,General Member,1,1
10,Q03,I generally feel quite at ease discussing matters with my team leader.,Yoshida,Modern Setting Game Planning,General Member,1,1
10,Q04,I feel quite at liberty to offer suggestions for new projects or procedural adjustments to my team leader.,Yoshida,Modern Setting Game Planning,General Member,1,1
10,Q05,"I would feel quite comfortable sharing any oversight with my team leader, as I believe open communication fosters a stronger team environment.",Yoshida,Modern Setting Game Planning,General Member,1,1
10,Q06,"I would feel quite comfortable raising a concern to my team leader if I observed a colleague making an error, as open communication ensures project integrity.",Yoshida,Modern Setting Game Planning,General Member,1,1
10,Q07,My contributions are acknowledged with thorough consideration by my team leader.,Yoshida,Modern Setting Game Planning,General Member,1,1
10,Q08,My team leader's encouragement in venturing into novel tasks and skill acquisition is quite robust.,Yoshida,Modern Setting Game Planning,General Member,1,1
10,Q09,"Sasaki-san demonstrates a commendable willingness to engage with challenges and pursue resolutions, indicating a reliable presence when support is required.",Yoshida,Modern Setting Game Planning,General Member,1,1
10,Q10,"I find it quite simple to approach my colleagues with any queries I may have, as their willingness to assist is consistently apparent.",Yoshida,Modern Setting Game Planning,General Member,1,1
10,Q11,I am comfortable sharing my perspectives on work matters with my colleagues.,Yoshida,Modern Setting Game Planning,General Member,1,1
10,Q12,I maintain a reserved demeanor when discussing personal matters with colleagues.,Yoshida,Modern Setting Game Planning,General Member,1,1
10,Q13,I feel quite comfortable expressing my recommendations and ideas to my peers.,Yoshida,Modern Setting Game Planning,General Member,1,1
10,Q14,I would feel quite comfortable raising concerns about my own missteps to my colleagues.,Yoshida,Modern Setting Game Planning,General Member,1,1
10,Q15,"I would feel confident addressing a colleague about an observed error, ensuring clarity and constructive dialogue.",Yoshida,Modern Setting Game Planning,General Member,1,1
10,Q16,I perceive my contributions as earnestly considered by my colleagues.,Yoshida,Modern Setting Game Planning,General Member,1,1
10,Q17,I find it quite straightforward to seek assistance from my colleagues.,Yoshida,Modern Setting Game Planning,General Member,1,1
10,Q18,"I find that information is shared effectively within the team, fostering a collective understanding of our progress and objectives.",Yoshida,Modern Setting Game Planning,General Member,1,1
10,Q19,"The information sharing efforts feel substantial, with clear agreement and focused action on gameplay implications.",Yoshida,Modern Setting Game Planning,General Member,1,1
10,Q20,"Our team demonstrates strong unity, with shared enthusiasm for translating our concepts into tangible gameplay mechanics, particularly concerning the player's experience with Wi-Fi signals in mystical rituals and digital dead zones.",Yoshida,Modern Setting Game Planning,General Member,1,1
10,Q21,I find our team's commitment to this task to be exceptionally strong and highly motivating.,Yoshida,Modern Setting Game Planning,General Member,1,1
10,Q22,"Our team members exhibit a remarkable alignment in their aspirations for team performance, with a shared focus on translating concepts into tangible gameplay mechanics.",Yoshida,Modern Setting Game Planning,General Member,1,1
10,Q23,"The opportunities provided for personal performance enhancement are quite satisfactory, enabling focused development in key areas.",Yoshida,Modern Setting Game Planning,General Member,1,1
11,Q01,Engaging with my team leader regarding role-related inquiries presents no significant hindrance.,Yamada,Modern Setting Game Planning,General Member,1,1
11,Q02,"I can openly share my viewpoints with my team leader, appreciating the space for constructive dialogue.",Yamada,Modern Setting Game Planning,General Member,1,1
11,Q03,I maintain a high level of comfort discussing personal issues or disagreements with my team leader.,Yamada,Modern Setting Game Planning,General Member,1,1
11,Q04,I find ample latitude to propose novel concepts and procedural enhancements to my team leader.,Yamada,Modern Setting Game Planning,General Member,1,1
11,Q05,I would feel quite secure expressing any errors I encounter with the team leader.,Yamada,Modern Setting Game Planning,General Member,1,1
11,Q06,I would find it quite uncomfortable to speak up to my team leader about a colleague's mistake.,Yamada,Modern Setting Game Planning,General Member,1,1
11,Q07,My contributions are always given thorough consideration by my team leader.,Yamada,Modern Setting Game Planning,General Member,1,1
11,Q08,Sasaki-san's guidance provides substantial encouragement for venturing into novel responsibilities and acquiring unfamiliar proficiencies.,Yamada,Modern Setting Game Planning,General Member,1,1
11,Q09,"Sasaki-san's response indicates a strong alignment with the project's direction and a proactive approach to team collaboration, which suggests a good level of support.",Yamada,Modern Setting Game Planning,General Member,1,1
11,Q10,Approaching colleagues with inquiries regarding my responsibilities is a straightforward endeavor.,Yamada,Modern Setting Game Planning,General Member,1,1
11,Q11,I provide my perspectives directly to my colleagues on work-related matters.,Yamada,Modern Setting Game Planning,General Member,1,1
11,Q12,I maintain a comfortable stance when discussing personal matters with my colleagues.,Yamada,Modern Setting Game Planning,General Member,1,1
11,Q13,I experience a substantial sense of liberation in voicing my recommendations and concepts for novel initiatives or modifications to established procedures amongst my colleagues.,Yamada,Modern Setting Game Planning,General Member,1,1
11,Q14,I would feel a certain level of comfort speaking up to my peers about a mistake on this team.,Yamada,Modern Setting Game Planning,General Member,1,1
11,Q15,I would feel quite comfortable bringing up a potential oversight to a colleague.,Yamada,Modern Setting Game Planning,General Member,1,1
11,Q16,My contributions are consistently appreciated and considered by my colleagues.,Yamada,Modern Setting Game Planning,General Member,1,1
11,Q17,Collaborating with colleagues on this project is genuinely straightforward.,Yamada,Modern Setting Game Planning,General Member,1,1
11,Q18,"Sasaki-san's response indicates a robust flow of information, and his proactive suggestions about involving other team members demonstrate a well-informed approach to collaboration.",Yamada,Modern Setting Game Planning,General Member,1,1
11,Q19,"The team's information sharing attempts exhibit a substantial depth, with thoughtful consideration for individual strengths and strategic sequencing of contributions.",Yamada,Modern Setting Game Planning,General Member,1,1
11,Q20,Our team is experiencing robust alignment in pursuit of performance objectives.,Yamada,Modern Setting Game Planning,General Member,1,1
11,Q21,I am extremely pleased with the team's dedicated commitment to this task.,Yamada,Modern Setting Game Planning,General Member,1,1
11,Q22,"My team members' aspirations for the team's performance are in strong alignment, echoing my own enthusiasm for progress.",Yamada,Modern Setting Game Planning,General Member,1,1
11,Q23,The opportunities provided by this team for my personal performance improvement are certainly sufficient.,Yamada,Modern Setting Game Planning,General Member,1,1
12,Q01,Approaching my team leader with a question or uncertainty regarding my role presents a manageable endeavor.,Sasaki,Modern Setting Game Planning,General Member,1,1
12,Q02,"I can openly express my opinions about work issues with my team leader, ensuring clarity and directness in our discussions.",Sasaki,Modern Setting Game Planning,General Member,1,1
12,Q03,"I feel quite comfortable discussing disagreements with my team leader, as it's important for progress.",Sasaki,Modern Setting Game Planning,General Member,1,1
12,Q04,I feel quite comfortable suggesting new ideas and process improvements to my team leader.,Sasaki,Modern Setting Game Planning,General Member,1,1
12,Q05,"I would feel comfortable raising concerns about potential missteps to my team leader, as open communication fosters a productive environment for everyone.",Sasaki,Modern Setting Game Planning,General Member,1,1
12,Q06,"I would feel entirely comfortable voicing concerns about a colleague's actions to my team leader, as open communication ensures the best outcome for our projects.",Sasaki,Modern Setting Game Planning,General Member,1,1
12,Q07,My contributions receive considerable attention and are thoroughly considered by my team leader.,Sasaki,Modern Setting Game Planning,General Member,1,1
12,Q08,"My team leader, Yamaguchi-san, offers solid support for exploring novel responsibilities and skill acquisition.",Sasaki,Modern Setting Game Planning,General Member,1,1
12,Q09,Yamada-kun demonstrates a strong capacity for proactive engagement and a commitment to collaborative progress.,Sasaki,Modern Setting Game Planning,General Member,1,1
12,Q10,It is exceptionally easy to approach my peers for guidance or clarification regarding my role.,Sasaki,Modern Setting Game Planning,General Member,1,1
12,Q11,I communicate my thoughts on work issues directly and with clarity to my colleagues.,Sasaki,Modern Setting Game Planning,General Member,1,1
12,Q12,I maintain a professional distance when discussing personal matters with colleagues.,Sasaki,Modern Setting Game Planning,General Member,1,1
12,Q13,I feel entirely at liberty to propose my recommendations and concepts to my colleagues.,Sasaki,Modern Setting Game Planning,General Member,1,1
