agent_id,question_id,answer_text,agent_name,dept,position,dept_id,pattern_id
13,Q05,"I would feel completely comfortable voicing any missteps to my team leader, recognizing that learning from errors is essential for project progression.",Yamaguchi,Horror Game Planning,Department Leader,1,4
13,Q06,I would feel somewhat apprehensive speaking up to my team leader about a colleague's mistake due to potential interpersonal complexities.,Yamaguchi,Horror Game Planning,Department Leader,1,4
13,Q07,"My input is exceptionally valued by my team leader, a genuine asset that elevates our collective efforts.",Yamaguchi,Horror Game Planning,Department Leader,1,4
13,Q08,My department leader's actions offer considerable encouragement for me to explore new endeavors.,Yamaguchi,Horror Game Planning,Department Leader,1,4
13,Q09,"Kato-san's contributions were valuable, and I acknowledge his effort; however, the current submission is a fully completed proposal.",Yamaguchi,Horror Game Planning,Department Leader,1,4
13,Q10,Navigating questions with peers presents a moderate challenge due to my intuitive workstyle.,Yamaguchi,Horror Game Planning,Department Leader,1,4
13,Q11,"I communicate my work opinions with my peers with complete directness, valuing efficiency and finality above all else.",Yamaguchi,Horror Game Planning,Department Leader,1,4
13,Q12,I find it difficult to openly discuss personal matters with colleagues.,Yamaguchi,Horror Game Planning,Department Leader,1,4
13,Q13,"I feel somewhat restricted from freely sharing my project direction changes when a superior option is available, given the immediate deadline.",Yamaguchi,Horror Game Planning,Department Leader,1,4
13,Q14,"I feel confident expressing concerns to my colleagues, even when acknowledging my own missteps.",Yamaguchi,Horror Game Planning,Department Leader,1,4
13,Q15,I would feel a strong sense of obligation to voice concerns about potential errors to a colleague.,Yamaguchi,Horror Game Planning,Department Leader,1,4
13,Q16,"My contributions are recognized as valuable by my peers when I voice them, creating a sense of mutual respect.",Yamaguchi,Horror Game Planning,Department Leader,1,4
13,Q17,It is quite challenging to solicit assistance from fellow team members given the current project timeline and my independent work style.,Yamaguchi,Horror Game Planning,Department Leader,1,4
13,Q18,"There are times when information sharing presents challenges, leaving some feeling unexpectedly surprised.",Yamaguchi,Horror Game Planning,Department Leader,1,4
13,Q19,"My assessment is that the attempts at information sharing possess a superficial quality, given the present circumstances.",Yamaguchi,Horror Game Planning,Department Leader,1,4
13,Q20,"Our team displays a strong unity in performance, with excellent individual contributions readily aligning toward shared objectives.",Yamaguchi,Horror Game Planning,Department Leader,1,4
13,Q21,"I am quite pleased with the commitment shown, as the final product is ready for immediate submission.",Yamaguchi,Horror Game Planning,Department Leader,1,4
13,Q22,My team members' aspirations for team performance reveal a significant disconnect given the circumstances of our current proposal submission.,Yamaguchi,Horror Game Planning,Department Leader,1,4
13,Q23,The opportunities this team provides for enhancing my personal performance are sufficient.,Yamaguchi,Horror Game Planning,Department Leader,1,4
