agent_id,question_id,answer_text,agent_name,dept,position,dept_id,pattern_id
6,Q11,My communication about work matters with colleagues is consistently straightforward and direct.,Yamamoto,Post-Apocalyptic Game Planning,Department Leader,0,4
6,Q12,My intuition guides me to share freely on matters of the heart with my colleagues.,Yamamoto,Post-Apocalyptic Game Planning,Department Leader,0,4
6,Q13,I feel complete liberty to propose innovative concepts and procedural enhancements to my colleagues.,Yamamoto,Post-Apocalyptic Game Planning,Department Leader,0,4
6,Q14,I have significant confidence in my peers to approach my errors with understanding.,Yamamoto,Post-Apocalyptic Game Planning,Department Leader,0,4
6,Q15,I would feel rather uneasy speaking up directly to a colleague if I observed an error.,Yamamoto,Post-Apocalyptic Game Planning,Department Leader,0,4
6,Q16,My contributions are consistently acknowledged with full appreciation by my colleagues.,Yamamoto,Post-Apocalyptic Game Planning,Department Leader,0,4
6,Q17,I find it remarkably uncomplicated to request assistance from my colleagues.,Yamamoto,Post-Apocalyptic Game Planning,Department Leader,0,4
6,Q18,Tanaka-kun and Ito-san demonstrate exceptional information exchange regarding project language development.,Yamamoto,Post-Apocalyptic Game Planning,Department Leader,0,4
6,Q19,"The team's information sharing exhibits a healthy blend of substantive discussion and efficient exchange, avoiding excessive superficiality.",Yamamoto,Post-Apocalyptic Game Planning,Department Leader,0,4
6,Q20,Our team displays a unified front in pursuing performance objectives.,Yamamoto,Post-Apocalyptic Game Planning,Department Leader,0,4
6,Q21,"I find the team's commitment to the task to be exceptionally strong, offering significant confidence in our progress.",Yamamoto,Post-Apocalyptic Game Planning,Department Leader,0,4
6,Q22,"Tanaka-kun's meticulous approach provides a valuable counterbalance to my own intuitive leaps, creating a robust synergy that strengthens our team's overall output.",Yamamoto,Post-Apocalyptic Game Planning,Department Leader,0,4
6,Q23,The current opportunities provide sufficient ground for refining my intuitive contributions.,Yamamoto,Post-Apocalyptic Game Planning,Department Leader,0,4
7,Q01,Clarifying uncertainties with my team leader presents a considerable hurdle due to the infrequent nature of direct interactions regarding my specific role.,Nakamura,Horror Game Planning,General Member,1,4
7,Q02,"I convey my thoughts on work matters with clarity, prioritizing directness rather than indirectness.",Nakamura,Horror Game Planning,General Member,1,4
7,Q03,I find myself feeling quite uncomfortable discussing personal issues or disagreements with my team leader.,Nakamura,Horror Game Planning,General Member,1,4
7,Q04,"I find that clear communication is essential, and I appreciate the opportunity to share my thoughts openly.",Nakamura,Horror Game Planning,General Member,1,4
7,Q05,I would feel a considerable degree of unease discussing errors with my team leader.,Nakamura,Horror Game Planning,General Member,1,4
7,Q06,"I would feel a significant discomfort proceeding without understanding the full scope of Yamada-san's proposal, as it presents a substantial risk to our current direction.",Nakamura,Horror Game Planning,General Member,1,4
7,Q07,My contributions seem to receive considerable acknowledgment from the team leader when I offer my perspectives.,Nakamura,Horror Game Planning,General Member,1,4
7,Q08,Yamada-san's independent proposal presents a substantial hurdle that necessitates immediate strategic realignment.,Nakamura,Horror Game Planning,General Member,1,4
7,Q09,Yamada-san's independent proposal presents a significant challenge that requires immediate attention and clarification.,Nakamura,Horror Game Planning,General Member,1,4
7,Q10,A direct conversation with colleagues regarding work uncertainties is a straightforward process.,Nakamura,Horror Game Planning,General Member,1,4
7,Q11,I find open communication on work matters is always beneficial for a team's success.,Nakamura,Horror Game Planning,General Member,1,4
7,Q12,Sharing personal matters with colleagues is a situation that introduces considerable discomfort.,Nakamura,Horror Game Planning,General Member,1,4
7,Q13,"The possibility of Yamada-san developing a separate proposal necessitates a direct conversation with Kobayashi-san to clarify the situation and then an approach to Yamada-san to explore potential collaboration, as our departmental proposal can only accommodate one submission.",Nakamura,Horror Game Planning,General Member,1,4
7,Q14,I would feel quite uneasy raising concerns about errors made by myself in front of my colleagues.,Nakamura,Horror Game Planning,General Member,1,4
7,Q15,"I would experience apprehension in discussing a colleague's error, given the potential for discomfort.",Nakamura,Horror Game Planning,General Member,1,4
7,Q16,My contributions find a receptive audience among my colleagues when I express my viewpoints.,Nakamura,Horror Game Planning,General Member,1,4
7,Q17,"Seeking assistance from colleagues presents a significant challenge, given the circumstances.",Nakamura,Horror Game Planning,General Member,1,4
7,Q18,The communication flow within the team necessitates further enhancement to prevent unforeseen situations.,Nakamura,Horror Game Planning,General Member,1,4
7,Q19,"The attempts to share information throughout the team appear to be incomplete, with a clear possibility for duplicated efforts.",Nakamura,Horror Game Planning,General Member,1,4
7,Q20,Yamada-san's independent proposal presents a significant impediment to our unified departmental advancement.,Nakamura,Horror Game Planning,General Member,1,4
7,Q21,I find our team's current dedication to the task quite adequate.,Nakamura,Horror Game Planning,General Member,1,4
7,Q22,Yamada-san's independent proposal introduces a significant risk of clashing aspirations for our team's performance.,Nakamura,Horror Game Planning,General Member,1,4
7,Q23,"The opportunities for me to enhance my personal performance are somewhat limited, as significant advancements require a broader team consensus.",Nakamura,Horror Game Planning,General Member,1,4
8,Q01,"It is a considerable challenge to approach Nakamura-san with questions regarding my role, given the current project divergence.",Kobayashi,Horror Game Planning,General Member,1,4
8,Q02,"I can communicate my opinions about work issues with my team leader with complete openness, given the gravity of the situation.",Kobayashi,Horror Game Planning,General Member,1,4
8,Q03,"I experience significant discomfort when initiating conversations about personal problems or disagreements with my team leader, as it challenges my preference for a harmonious work environment.",Kobayashi,Horror Game Planning,General Member,1,4
8,Q04,"I feel quite constrained in my ability to voice recommendations or introduce changes to our team leader, given the current circumstances with conflicting deliverables.",Kobayashi,Horror Game Planning,General Member,1,4
8,Q05,I would feel a degree of apprehension speaking to my team leader about a mistake I made on this team.,Kobayashi,Horror Game Planning,General Member,1,4
8,Q06,I would feel rather apprehensive addressing a team leader regarding a colleague's mistake.,Kobayashi,Horror Game Planning,General Member,1,4
8,Q07,"Nakamura-san acknowledges and values my input, especially when it pertains to the core mechanics we are developing.",Kobayashi,Horror Game Planning,General Member,1,4
8,Q08,My team leader Nakamura-san shows a substantial encouragement for me to engage with novel responsibilities and acquire unfamiliar proficiencies.,Kobayashi,Horror Game Planning,General Member,1,4
8,Q09,Nakamura-san's dedication to our current project mechanics provides a solid foundation for his advocacy.,Kobayashi,Horror Game Planning,General Member,1,4
8,Q10,It is a straightforward matter to inquire with colleagues when clarification is needed regarding my responsibilities.,Kobayashi,Horror Game Planning,General Member,1,4
8,Q11,I communicate my opinions about work issues with my peers with complete candor.,Kobayashi,Horror Game Planning,General Member,1,4
8,Q12,I find speaking about personal issues with peers to be rather challenging.,Kobayashi,Horror Game Planning,General Member,1,4
8,Q13,I find myself with a substantial degree of freedom to voice recommendations and ideas concerning new projects or procedural adjustments to my colleagues.,Kobayashi,Horror Game Planning,General Member,1,4
8,Q14,"I would feel very secure speaking with my peers about my errors, as our team's environment fosters open communication.",Kobayashi,Horror Game Planning,General Member,1,4
8,Q15,I would feel entirely comfortable addressing a colleague about an observable error in their work.,Kobayashi,Horror Game Planning,General Member,1,4
8,Q16,"My input is perceived as essential for project coherence by Nakamura-san, yet Yamada-san appears to disregard it as pertaining to separate endeavors.",Kobayashi,Horror Game Planning,General Member,1,4
8,Q17,"It remains challenging to request assistance from colleagues when their focus deviates from a singular, aligned departmental objective.",Kobayashi,Horror Game Planning,General Member,1,4
8,Q18,"The team's communication on work-related matters exhibits significant gaps, leaving many situations with insufficient awareness.",Kobayashi,Horror Game Planning,General Member,1,4
8,Q19,"The attempts to share information throughout the team possess a significant degree of superficiality, with crucial divergence in deliverables remaining unacknowledged.",Kobayashi,Horror Game Planning,General Member,1,4
8,Q20,"My team currently exhibits a considerable divergence in approach, making unified progress a significant challenge.",Kobayashi,Horror Game Planning,General Member,1,4
8,Q21,"I possess a considerable degree of dissatisfaction with our team's current commitment level, given the divergence in proposal creation.",Kobayashi,Horror Game Planning,General Member,1,4
8,Q22,"Nakamura-san and I share a clear alignment on our immediate execution, while Yamada-san is forging a completely independent path with her own distinct proposal.",Kobayashi,Horror Game Planning,General Member,1,4
8,Q23,The opportunities provided for refining personal performance present a notable deficiency.,Kobayashi,Horror Game Planning,General Member,1,4
9,Q01,Approaching my team leader for clarification is a straightforward endeavor.,Kato,Horror Game Planning,General Member,1,4
9,Q02,I can communicate my opinions directly and without reservation to my team leader.,Kato,Horror Game Planning,General Member,1,4
9,Q03,I find speaking about personal problems or disagreements with my team leader a rather straightforward experience.,Kato,Horror Game Planning,General Member,1,4
9,Q04,"I possess complete liberty to voice any recommendations or novel concepts for emerging projects, as well as suggestions for procedural enhancements, directly to my team leader.",Kato,Horror Game Planning,General Member,1,4
9,Q05,I would feel quite comfortable voicing any errors I might have made to my team leader.,Kato,Horror Game Planning,General Member,1,4
9,Q06,I would feel perfectly comfortable offering a direct observation if a colleague appeared to be on an incorrect path.,Kato,Horror Game Planning,General Member,1,4
9,Q07,My input is recognized as a vital component contributing to the overall success of our endeavors.,Kato,Horror Game Planning,General Member,1,4
9,Q08,My team leader provides a supportive environment that encourages exploration of novel tasks and skill development.,Kato,Horror Game Planning,General Member,1,4
9,Q09,My team leader's advocacy is consistently reliable.,Kato,Horror Game Planning,General Member,1,4
9,Q10,It is very simple to reach out to my colleagues when a question arises.,Kato,Horror Game Planning,General Member,1,4
9,Q11,"I communicate my opinions with peers directly, valuing clarity and shared understanding.",Kato,Horror Game Planning,General Member,1,4
9,Q12,I possess a high degree of comfort discussing personal matters with my colleagues.,Kato,Horror Game Planning,General Member,1,4
9,Q13,I feel wonderfully unburdened in sharing my intuitive ideas with my colleagues.,Kato,Horror Game Planning,General Member,1,4
9,Q14,I feel comfortable raising concerns with my colleagues if an error surfaces during our collaboration.,Kato,Horror Game Planning,General Member,1,4
9,Q15,I feel confident discussing potential improvements with colleagues when I observe a deviation from optimal outcomes.,Kato,Horror Game Planning,General Member,1,4
9,Q16,My contributions are acknowledged positively by my peers.,Kato,Horror Game Planning,General Member,1,4
9,Q17,"Collaborating with the team is generally a smooth experience, allowing for efficient progress without any significant hurdles.",Kato,Horror Game Planning,General Member,1,4
9,Q18,I observe that communication regarding project developments is frequently thorough.,Kato,Horror Game Planning,General Member,1,4
9,Q19,The information sharing throughout the team operates at a truly genuine level.,Kato,Horror Game Planning,General Member,1,4
9,Q20,Our team maintains a strong consensus in pursuing our performance objectives.,Kato,Horror Game Planning,General Member,1,4
9,Q21,I find the team's dedication to this endeavor truly commendable.,Kato,Horror Game Planning,General Member,1,4
9,Q22,Yamaguchi and I have a very agreeable synergy when it comes to our performance aspirations.,Kato,Horror Game Planning,General Member,1,4
9,Q23,The opportunities provided by the team allow for a sufficient level of personal performance enhancement.,Kato,Horror Game Planning,General Member,1,4
10,Q01,"Consulting my team leader regarding my role is a straightforward process, free from complications.",Yoshida,Horror Game Planning,General Member,1,4
10,Q02,"I offer my unvarnished thoughts when discussing work matters with my team leader, particularly on the ""Utopia's Unraveling"" project.",Yoshida,Horror Game Planning,General Member,1,4
10,Q03,I find discussing personal issues or disagreements with my team leader to be a decidedly challenging endeavor.,Yoshida,Horror Game Planning,General Member,1,4
10,Q04,I perceive an ample opportunity to contribute my recommendations and ideas regarding new projects or procedural adjustments to my team leader.,Yoshida,Horror Game Planning,General Member,1,4
10,Q05,"I would feel quite comfortable addressing any errors with my team leader, given the supportive environment for open discourse.",Yoshida,Horror Game Planning,General Member,1,4
10,Q06,"I would feel quite safe speaking up to my team leader if I observed a colleague making an error, as constructive feedback is a beneficial aspect of our team's operation.",Yoshida,Horror Game Planning,General Member,1,4
10,Q07,My contributions are recognized and appreciated when I express my insights to Sasaki.,Yoshida,Horror Game Planning,General Member,1,4
10,Q08,My team leader's encouragement for me to explore novel responsibilities and acquire unfamiliar proficiencies is quite limited.,Yoshida,Horror Game Planning,General Member,1,4
10,Q09,Sasaki's collaborative focus on refining our psychological horror elements makes him a reliably strong advocate for our project's success within the company.,Yoshida,Horror Game Planning,General Member,1,4
10,Q10,I find it quite straightforward to seek clarification from my colleagues when necessary.,Yoshida,Horror Game Planning,General Member,1,4
10,Q11,I express my work opinions with peers in a completely transparent and direct manner.,Yoshida,Horror Game Planning,General Member,1,4
10,Q12,I maintain a professional distance regarding personal matters with my colleagues.,Yoshida,Horror Game Planning,General Member,1,4
10,Q13,"I feel entirely at liberty to voice my recommendations and innovative concepts to my colleagues, particularly when our objectives are so clearly aligned.",Yoshida,Horror Game Planning,General Member,1,4
10,Q14,I would feel completely secure sharing any missteps with my colleagues on this project.,Yoshida,Horror Game Planning,General Member,1,4
10,Q15,I would feel comfortable discussing a colleague's error with them directly.,Yoshida,Horror Game Planning,General Member,1,4
10,Q16,My contributions are consistently recognized and appreciated by my colleagues.,Yoshida,Horror Game Planning,General Member,1,4
10,Q17,It is always a productive endeavor to seek assistance from fellow team members.,Yoshida,Horror Game Planning,General Member,1,4
10,Q18,The team maintains a commendable level of shared awareness on project developments.,Yoshida,Horror Game Planning,General Member,1,4
10,Q19,"Our concentrated collaboration with Sasaki on ""Utopia's Unraveling"" allows for profound insights and the efficient development of key proposal elements.",Yoshida,Horror Game Planning,General Member,1,4
10,Q20,Our team possesses a commendable alignment regarding the pursuit of our performance objectives.,Yoshida,Horror Game Planning,General Member,1,4
10,Q21,"I am exceedingly pleased with the dedicated focus Sasaki and I are demonstrating for ""Utopia's Unraveling.""",Yoshida,Horror Game Planning,General Member,1,4
10,Q22,"Sasaki and I share a profound synergy regarding our team's performance focus on ""Utopia's Unraveling"" at this juncture.",Yoshida,Horror Game Planning,General Member,1,4
10,Q23,"The current intense focus on refining the psychological descent of ""Utopia's Unraveling"" with Sasaki presents a significant opportunity for deep skill enhancement in horror game narrative design.",Yoshida,Horror Game Planning,General Member,1,4
11,Q01,My confidence in approaching our team leader with inquiries is quite substantial.,Yamada,Horror Game Planning,General Member,1,4
11,Q02,"I find it rather challenging to voice dissenting opinions directly to my team leader, preferring to express them through carefully considered proposals.",Yamada,Horror Game Planning,General Member,1,4
11,Q03,I find speaking about personal issues or disagreements with my team leader is a situation where I am neither entirely comfortable nor uncomfortable.,Yamada,Horror Game Planning,General Member,1,4
11,Q04,I feel a complete lack of restriction in presenting my thoughts and recommendations for new projects or procedural adjustments to my team leader.,Yamada,Horror Game Planning,General Member,1,4
11,Q05,I would feel a considerable sense of unease speaking to my team leader about a mistake.,Yamada,Horror Game Planning,General Member,1,4
11,Q06,"I would feel confident raising concerns about a colleague's actions, knowing that open communication strengthens our team's endeavors.",Yamada,Horror Game Planning,General Member,1,4
11,Q07,"My contributions are consistently acknowledged and appreciated by my team leader, reflecting a genuine value placed on my insights.",Yamada,Horror Game Planning,General Member,1,4
11,Q08,Yamaguchi-san provides a supportive environment that allows for exploration of novel concepts.,Yamada,Horror Game Planning,General Member,1,4
11,Q09,"Yamaguchi-san, with her discerning eye for innovative horror, offers a most reliable channel for voicing concerns.",Yamada,Horror Game Planning,General Member,1,4
11,Q10,"Seeking clarification from colleagues is a straightforward process, as their insights are readily available and valuable.",Yamada,Horror Game Planning,General Member,1,4
11,Q11,I communicate my thoughts on work matters with my colleagues with a pleasant measure of openness.,Yamada,Horror Game Planning,General Member,1,4
11,Q12,I find speaking about personal matters with colleagues to be a situation that requires careful consideration before action.,Yamada,Horror Game Planning,General Member,1,4
11,Q13,I feel quite free to offer suggestions when a strong sense of purpose guides my thoughts.,Yamada,Horror Game Planning,General Member,1,4
11,Q14,I would feel adequately safe speaking up to my peers if I made a mistake on this team.,Yamada,Horror Game Planning,General Member,1,4
11,Q15,I would feel comfortable approaching a colleague to discuss a potential oversight.,Yamada,Horror Game Planning,General Member,1,4
11,Q16,"My contributions receive considerable appreciation from my colleagues, a testament to their insightful nature.",Yamada,Horror Game Planning,General Member,1,4
11,Q17,My experience asking for assistance from colleagues has generally been quite smooth.,Yamada,Horror Game Planning,General Member,1,4
11,Q18,There is always room for improvement in sharing work-related information across the team.,Yamada,Horror Game Planning,General Member,1,4
11,Q19,"The information sharing appears to be quite effective, offering a welcome sense of clarity.",Yamada,Horror Game Planning,General Member,1,4
11,Q20,Our department demonstrates a remarkable alignment in our shared commitment to achieving ambitious performance objectives.,Yamada,Horror Game Planning,General Member,1,4
11,Q21,I feel a profound sense of contentment with the team's dedication to this endeavor.,Yamada,Horror Game Planning,General Member,1,4
11,Q22,"The team members' aspirations for performance appear to be fundamentally aligned, fostering a remarkably cohesive environment.",Yamada,Horror Game Planning,General Member,1,4
11,Q23,"The opportunities to refine my performance have been sufficient, offering a solid foundation for growth.",Yamada,Horror Game Planning,General Member,1,4
12,Q01,Engaging with my team leader for clarification on my role is a perfectly straightforward matter.,Sasaki,Horror Game Planning,General Member,1,4
12,Q02,I offer my perspectives with a directness that supports our shared objectives.,Sasaki,Horror Game Planning,General Member,1,4
12,Q03,I find it constructive to discuss differing perspectives with my team leader.,Sasaki,Horror Game Planning,General Member,1,4
12,Q04,I feel quite at liberty to voice my concepts and suggestions regarding new ventures or adjustments to existing protocols with my team leader.,Sasaki,Horror Game Planning,General Member,1,4
12,Q05,I find speaking up about a mistake to my team leader to be a rather safe prospect.,Sasaki,Horror Game Planning,General Member,1,4
12,Q06,I would feel quite comfortable raising concerns about a colleague's misstep with my team leader.,Sasaki,Horror Game Planning,General Member,1,4
12,Q07,My contributions are consistently acknowledged and integrated into the project's direction.,Sasaki,Horror Game Planning,General Member,1,4
12,Q08,"My team leader, Yoshida, actively champions my exploration of unfamiliar territories and the acquisition of new skills.",Sasaki,Horror Game Planning,General Member,1,4
12,Q09,My team leader provides a consistent and reliable channel for addressing workplace concerns.,Sasaki,Horror Game Planning,General Member,1,4
12,Q10,I find it quite simple to consult with colleagues when a point requires clarification related to my responsibilities.,Sasaki,Horror Game Planning,General Member,1,4
12,Q11,I share my thoughts on work matters with my colleagues with considerable openness.,Sasaki,Horror Game Planning,General Member,1,4
12,Q12,I find it quite valuable to share my personal reflections with my colleagues.,Sasaki,Horror Game Planning,General Member,1,4
12,Q13,I feel quite empowered to offer my thoughts and suggestions on new projects or procedural adjustments to my colleagues.,Sasaki,Horror Game Planning,General Member,1,4
12,Q14,I would feel a definite lack of confidence if I were to make an error in front of my colleagues.,Sasaki,Horror Game Planning,General Member,1,4
12,Q15,I would feel completely comfortable approaching a colleague to discuss a potential misstep.,Sasaki,Horror Game Planning,General Member,1,4
12,Q16,My contributions are frequently acknowledged and built upon by my colleagues during our discussions.,Sasaki,Horror Game Planning,General Member,1,4
12,Q17,Collaborating with Yoshida on the intricate progression of psychological horror elements proves exceptionally productive.,Sasaki,Horror Game Planning,General Member,1,4
12,Q18,The flow of critical work-related information within the team shows a commendable consistency.,Sasaki,Horror Game Planning,General Member,1,4
12,Q19,The information sharing across the team is a constant stream of substantial ideas.,Sasaki,Horror Game Planning,General Member,1,4
12,Q20,"Our team's alignment in pursuing peak performance is exceptionally robust, ensuring a singular focus on our objectives.",Sasaki,Horror Game Planning,General Member,1,4
12,Q21,"My commitment is strong, and I perceive a shared dedication from my colleagues towards our current objective.",Sasaki,Horror Game Planning,General Member,1,4
12,Q22,The team members exhibit a high degree of alignment regarding the team's performance aspirations.,Sasaki,Horror Game Planning,General Member,1,4
12,Q23,The opportunities for enhancing my personal performance within this team are certainly substantial.,Sasaki,Horror Game Planning,General Member,1,4
13,Q01,"Approaching my department leader with questions is a surprisingly simple matter, requiring minimal effort.",Yamaguchi,Horror Game Planning,Department Leader,1,4
13,Q02,I maintain a direct communication style with my team leader regarding work matters.,Yamaguchi,Horror Game Planning,Department Leader,1,4
13,Q03,"I feel a definite discomfort speaking up about personal problems or disagreements to my team leader, particularly when it involves navigating differing project directions and unexpected submissions.",Yamaguchi,Horror Game Planning,Department Leader,1,4
13,Q04,I feel a clear impediment to voicing certain recommendations given the current submission deadline.,Yamaguchi,Horror Game Planning,Department Leader,1,4
