agent_id,question_id,answer_text,agent_name,dept,position,dept_id,pattern_id
6,Q11,"I am entirely comfortable sharing my perspectives on work matters with my colleagues, finding that direct communication fosters clarity and progress.",Yamamoto,Modern Setting Game Planning,Department Leader,0,3
6,Q12,"I find sharing personal matters with colleagues is a comfortable experience, as open communication builds stronger relationships.",Yamamoto,Modern Setting Game Planning,Department Leader,0,3
6,Q13,"I feel quite free to express recommendations and ideas to my peers, as the environment fosters open collaboration and diverse viewpoints are welcomed.",Yamamoto,Modern Setting Game Planning,Department Leader,0,3
6,Q14,I would feel adequately comfortable raising concerns about errors with my colleagues.,Yamamoto,Modern Setting Game Planning,Department Leader,0,3
6,Q15,I feel quite secure discussing potential errors with my colleagues.,Yamamoto,Modern Setting Game Planning,Department Leader,0,3
6,Q16,"My contributions are appreciated by my colleagues, creating a productive environment for idea exchange.",Yamamoto,Modern Setting Game Planning,Department Leader,0,3
6,Q17,Assisting team members feels like a straightforward process.,Yamamoto,Modern Setting Game Planning,Department Leader,0,3
6,Q18,"The current information flow within the team is quite effective, with team members actively sharing their progress and ideas.",Yamamoto,Modern Setting Game Planning,Department Leader,0,3
6,Q19,The current information sharing demonstrates a strong foundation of genuine engagement and thoughtful contribution.,Yamamoto,Modern Setting Game Planning,Department Leader,0,3
6,Q20,"The team exhibits a strong sense of unity, with shared enthusiasm for the diverse project directions.",Yamamoto,Modern Setting Game Planning,Department Leader,0,3
6,Q21,I am delighted with the team's robust dedication to our current tasks.,Yamamoto,Modern Setting Game Planning,Department Leader,0,3
6,Q22,"My team members demonstrate a truly remarkable alignment of aspirations, with each individual contributing distinct yet complementary visions for our team's performance.",Yamamoto,Modern Setting Game Planning,Department Leader,0,3
6,Q23,The current opportunities provide a sound foundation for my personal performance growth.,Yamamoto,Modern Setting Game Planning,Department Leader,0,3
7,Q01,My interactions with my team leader are usually quite straightforward when I have inquiries regarding my responsibilities.,Nakamura,Superhero Game Planning,General Member,1,3
7,Q02,I communicate my opinions regarding work issues to my team leader with an open and direct approach.,Nakamura,Superhero Game Planning,General Member,1,3
7,Q03,I feel completely at ease discussing any challenges or differing viewpoints with my team leader.,Nakamura,Superhero Game Planning,General Member,1,3
7,Q04,I feel entirely unhindered in proposing recommendations and new project ideas to my team leader.,Nakamura,Superhero Game Planning,General Member,1,3
7,Q05,I would feel quite secure voicing any errors to my team leader.,Nakamura,Superhero Game Planning,General Member,1,3
7,Q06,I would feel quite comfortable raising concerns about a colleague's error to our team leader.,Nakamura,Superhero Game Planning,General Member,1,3
7,Q07,"My contributions are appreciated, and my perspectives are frequently incorporated into our discussions.",Nakamura,Superhero Game Planning,General Member,1,3
7,Q08,My team leader offers consistent encouragement for exploring novel challenges and skill development.,Nakamura,Superhero Game Planning,General Member,1,3
7,Q09,"My team leader, while possessing good intentions, sometimes struggles to consistently champion my concerns within the company.",Nakamura,Superhero Game Planning,General Member,1,3
7,Q10,Speaking with my colleagues about my work provides me with clear guidance.,Nakamura,Superhero Game Planning,General Member,1,3
7,Q11,"I find that my communication with peers is generally direct, with a measured balance of forthrightness and consideration for differing viewpoints.",Nakamura,Superhero Game Planning,General Member,1,3
7,Q12,My comfort level speaking about personal matters with colleagues is entirely dependent on the situation and the individual.,Nakamura,Superhero Game Planning,General Member,1,3
7,Q13,I always feel a clear freedom to present my recommendations and ideas to my peers.,Nakamura,Superhero Game Planning,General Member,1,3
7,Q14,I would feel quite secure sharing any missteps with my colleagues on this team.,Nakamura,Superhero Game Planning,General Member,1,3
7,Q15,I would feel quite secure raising a concern with a colleague regarding an observable error.,Nakamura,Superhero Game Planning,General Member,1,3
7,Q16,My contributions are generally well-received and thoughtfully considered by my colleagues.,Nakamura,Superhero Game Planning,General Member,1,3
7,Q17,It presents a considerable challenge to solicit assistance from colleagues when their workflows present significant divergences.,Nakamura,Superhero Game Planning,General Member,1,3
7,Q18,"The team exchanges information with a commendable frequency, ensuring most relevant updates reach team members promptly.",Nakamura,Superhero Game Planning,General Member,1,3
7,Q19,"The team's information sharing reflects a genuine commitment to collaborative ideation, demonstrating substantive engagement rather than mere surface-level communication.",Nakamura,Superhero Game Planning,General Member,1,3
7,Q20,"Our team exhibits a remarkable synergy, with individual contributions consistently elevating our collective performance and driving us toward our ambitious objectives.",Nakamura,Superhero Game Planning,General Member,1,3
7,Q21,"I find the team's dedication to the project to be quite satisfactory, contributing to a promising development.",Nakamura,Superhero Game Planning,General Member,1,3
7,Q22,"Kato-san's proposals offer a substantial enhancement to our existing concepts, providing a valuable dimension to Elara's narrative.",Nakamura,Superhero Game Planning,General Member,1,3
7,Q23,The opportunities provided allow for ample growth in my personal performance.,Nakamura,Superhero Game Planning,General Member,1,3
8,Q01,I find it quite straightforward to consult with my team leader when I have inquiries regarding my responsibilities.,Kobayashi,Superhero Game Planning,General Member,1,3
8,Q02,"I express my perspectives with a directness that stems from my intuitive approach, and I find it generally productive to share my thoughts on work issues with my team leader.",Kobayashi,Superhero Game Planning,General Member,1,3
8,Q03,I feel perfectly at ease discussing personal matters or conflicts with my team leader.,Kobayashi,Superhero Game Planning,General Member,1,3
8,Q04,I experience a complete liberty to express my recommendations and ideas to my team leader.,Kobayashi,Superhero Game Planning,General Member,1,3
8,Q05,"I would feel quite secure addressing my team leader about an oversight, as our team functions with a remarkable level of trust and open communication.",Kobayashi,Superhero Game Planning,General Member,1,3
8,Q06,I would experience a strong inclination to address the situation with the team leader to ensure project integrity.,Kobayashi,Superhero Game Planning,General Member,1,3
8,Q07,"My input is always fully appreciated by my team leader, as he actively seeks out my suggestions and incorporates them into our discussions.",Kobayashi,Superhero Game Planning,General Member,1,3
8,Q08,My team leader's encouragement to embrace novel responsibilities and acquire new proficiencies remains consistently present.,Kobayashi,Superhero Game Planning,General Member,1,3
8,Q09,Yamada-san demonstrates a thoroughness in his approach that supports his reliability for problem-solving.,Kobayashi,Superhero Game Planning,General Member,1,3
8,Q10,"Seeking clarification from colleagues is a straightforward endeavor for me, as I value collaborative problem-solving.",Kobayashi,Superhero Game Planning,General Member,1,3
8,Q11,I offer my perspectives with a comfortable candor to my colleagues.,Kobayashi,Superhero Game Planning,General Member,1,3
8,Q12,I find discussing personal matters with colleagues a straightforward endeavor.,Kobayashi,Superhero Game Planning,General Member,1,3
8,Q13,"I possess a complete liberty to offer my recommendations and concepts to my colleagues, and I am quite enthusiastic about exploring new avenues for our projects.",Kobayashi,Superhero Game Planning,General Member,1,3
8,Q14,I would feel quite secure voicing any errors to my colleagues on this team.,Kobayashi,Superhero Game Planning,General Member,1,3
8,Q15,I would feel completely secure addressing a colleague about an obvious error in their work.,Kobayashi,Superhero Game Planning,General Member,1,3
8,Q16,"My contributions are appreciated, and my colleagues genuinely consider my viewpoints when they are shared.",Kobayashi,Superhero Game Planning,General Member,1,3
8,Q17,It is certainly possible to obtain assistance from my colleagues on this team.,Kobayashi,Superhero Game Planning,General Member,1,3
8,Q18,Communication concerning project matters provides adequate information flow within the team.,Kobayashi,Superhero Game Planning,General Member,1,3
8,Q19,I perceive a need for greater clarity regarding inter-departmental information exchange.,Kobayashi,Superhero Game Planning,General Member,1,3
8,Q20,"Yamada-san's deliberate approach to concept formulation, coupled with an unexpected consultation with Yoshida-san, presents a team dynamic that is not entirely cohesive in its immediate forward momentum.",Kobayashi,Superhero Game Planning,General Member,1,3
8,Q21,I find the current team's commitment level to be quite satisfactory.,Kobayashi,Superhero Game Planning,General Member,1,3
8,Q22,"Yamada-san's deliberate approach and his engagement with Yoshida-san present a distinct deviation from the immediate, collaborative brainstorming I envisioned for our team's performance.",Kobayashi,Superhero Game Planning,General Member,1,3
8,Q23,The opportunities this team provides for enhancing my personal performance are certainly sufficient.,Kobayashi,Superhero Game Planning,General Member,1,3
9,Q01,It is quite challenging to approach my team leader with inquiries when I lack a fundamental understanding of the subject matter.,Kato,Superhero Game Planning,General Member,1,3
9,Q02,I express my perspectives on work matters with my team leader with complete candor.,Kato,Superhero Game Planning,General Member,1,3
9,Q03,I feel a lack of ease discussing personal issues or conflicts with my team leader because directness can be challenging to navigate.,Kato,Superhero Game Planning,General Member,1,3
9,Q04,I feel quite unhindered in expressing suggestions for new projects or procedural adjustments to my team leader.,Kato,Superhero Game Planning,General Member,1,3
9,Q05,I would feel somewhat apprehensive speaking up to my team leader if I made a mistake on this team.,Kato,Superhero Game Planning,General Member,1,3
9,Q06,"I would feel hesitant to directly address a colleague's error with the team leader, preferring to offer support to the individual first.",Kato,Superhero Game Planning,General Member,1,3
9,Q07,My contributions are generally met with a receptive spirit by my team leader.,Kato,Superhero Game Planning,General Member,1,3
9,Q08,My team leader maintains a neutral stance regarding my exploration of novel responsibilities or skill acquisition.,Kato,Superhero Game Planning,General Member,1,3
9,Q09,My team leader is generally a reliable resource for support.,Kato,Superhero Game Planning,General Member,1,3
9,Q10,"It would be challenging to express uncertainty regarding ""The Unseen Architects"" given the apparent misunderstanding about my previous comments on Elara's development.",Kato,Superhero Game Planning,General Member,1,3
9,Q11,I readily share my perspectives on work matters with my colleagues.,Kato,Superhero Game Planning,General Member,1,3
9,Q12,I find it thoroughly uncomfortable to navigate discussions about personal matters with my colleagues.,Kato,Superhero Game Planning,General Member,1,3
9,Q13,I feel quite unrestricted when offering my thoughts on new ventures or process adjustments to my colleagues.,Kato,Superhero Game Planning,General Member,1,3
9,Q14,"I would feel perfectly comfortable addressing any misinterpretations with my peers, as open communication fosters a stronger team dynamic.",Kato,Superhero Game Planning,General Member,1,3
9,Q15,I would feel it is imperative to communicate to a colleague if I observed an error in their work.,Kato,Superhero Game Planning,General Member,1,3
9,Q16,I possess a clear understanding that my contributions are genuinely appreciated by my colleagues.,Kato,Superhero Game Planning,General Member,1,3
9,Q17,"Gathering clarity on ""The Unseen Architects"" from Sasaki-san is a necessary step before evaluating collaboration ease.",Kato,Superhero Game Planning,General Member,1,3
9,Q18,It remains a challenge for individuals to maintain consistent awareness of each other's ongoing project developments.,Kato,Superhero Game Planning,General Member,1,3
9,Q19,My understanding is that crucial project details are sometimes miscommunicated.,Kato,Superhero Game Planning,General Member,1,3
9,Q20,My team's current focus on achieving performance goals is somewhat scattered due to the introduction of an unfamiliar concept.,Kato,Superhero Game Planning,General Member,1,3
9,Q21,"I possess a distinct curiosity regarding Sasaki-san's concept of ""The Unseen Architects"" and its potential.",Kato,Superhero Game Planning,General Member,1,3
9,Q22,"Sasaki-san's enthusiasm for ""The Unseen Architects"" presents a welcome opportunity to explore novel concepts that could energize our collective creative output, even if the immediate alignment with existing project aspirations remains undefined.",Kato,Superhero Game Planning,General Member,1,3
9,Q23,The opportunities to refine my personal performance feel rather inadequate when I lack clarity on new project concepts introduced by colleagues.,Kato,Superhero Game Planning,General Member,1,3
10,Q01,Reaching out to my team leader with inquiries is generally a straightforward process.,Yoshida,Superhero Game Planning,General Member,1,3
10,Q02,"I am comfortable expressing my work opinions to my team leader, valuing constructive dialogue and a shared pursuit of excellence.",Yoshida,Superhero Game Planning,General Member,1,3
10,Q03,I find expressing personal difficulties or disagreements to my team leader to be a rather delicate matter.,Yoshida,Superhero Game Planning,General Member,1,3
10,Q04,I feel quite liberated to suggest new projects or procedural adjustments to my team leader.,Yoshida,Superhero Game Planning,General Member,1,3
10,Q05,"I would feel quite secure sharing any missteps with the team leader, as constructive feedback is a given.",Yoshida,Superhero Game Planning,General Member,1,3
10,Q06,I would feel completely comfortable raising concerns about a colleague's misstep with our team leader.,Yoshida,Superhero Game Planning,General Member,1,3
10,Q07,My contributions are consistently met with serious consideration from my team leader.,Yoshida,Superhero Game Planning,General Member,1,3
10,Q08,"My team leader provides a supportive environment, allowing ample space for individual exploration before collaborative refinement, which is excellent for my reflective work style.",Yoshida,Superhero Game Planning,General Member,1,3
10,Q09,Yamaguchi-san exhibits a strong capacity to support team members facing difficulties within the company.,Yoshida,Superhero Game Planning,General Member,1,3
10,Q10,"Seeking clarification from colleagues presents a truly seamless experience, as my independent exploration of concepts naturally leads to well-defined questions that facilitate productive discussions.",Yoshida,Superhero Game Planning,General Member,1,3
10,Q11,"I openly share my considered thoughts on work matters with my colleagues, valuing a deliberate exchange of perspectives.",Yoshida,Superhero Game Planning,General Member,1,3
10,Q12,I find discussing personal matters with colleagues to be quite agreeable.,Yoshida,Superhero Game Planning,General Member,1,3
10,Q13,"I appreciate the opportunity to share my thoughts. Regarding recommendations and ideas, I find the current environment to be quite conducive to sharing. I can confidently propose new concepts and suggest procedural adjustments, knowing that my colleagues are receptive.",Yoshida,Superhero Game Planning,General Member,1,3
10,Q14,"I would feel quite comfortable raising any missteps with my colleagues, knowing they value open discussion.",Yoshida,Superhero Game Planning,General Member,1,3
10,Q15,"I would feel quite comfortable addressing a colleague if I observed an error, as fostering open communication ensures the integrity of our work.",Yoshida,Superhero Game Planning,General Member,1,3
10,Q16,"I feel my individual contributions are deeply respected by my colleagues, fostering an environment where distinct perspectives are genuinely appreciated and integrated.",Yoshida,Superhero Game Planning,General Member,1,3
10,Q17,"Seeking assistance from colleagues feels like a wonderfully straightforward process, with ample avenues for support readily available.",Yoshida,Superhero Game Planning,General Member,1,3
10,Q18,The current information flow among team members is quite effective for fostering individual creative exploration before collaborative refinement.,Yoshida,Superhero Game Planning,General Member,1,3
10,Q19,"The attempts to share information throughout the team are quite superficial, lacking substantial depth or thoroughness.",Yoshida,Superhero Game Planning,General Member,1,3
10,Q20,"Our team maintains a wonderful synergy, with individuals valuing their distinct thinking periods before contributing to our collective vision.",Yoshida,Superhero Game Planning,General Member,1,3
10,Q21,I am very pleased with my team's high level of commitment to the task.,Yoshida,Superhero Game Planning,General Member,1,3
10,Q22,Yamada-kun and I share a commendable level of alignment regarding our team's performance aspirations.,Yoshida,Superhero Game Planning,General Member,1,3
10,Q23,"The current opportunities for enhancing my personal performance are quite fitting, offering ample space for my reflective work style.",Yoshida,Superhero Game Planning,General Member,1,3
11,Q01,It would be straightforward to seek clarification from my team leader regarding my role.,Yamada,Superhero Game Planning,General Member,1,3
11,Q02,I will communicate my opinions with my team leader once I have thoroughly considered them and developed well-formed concepts.,Yamada,Superhero Game Planning,General Member,1,3
11,Q03,"I possess a measure of comfort discussing team-related disagreements, finding the process of shared problem-solving constructive.",Yamada,Superhero Game Planning,General Member,1,3
11,Q04,"I feel a welcome freedom to share recommendations and ideas with my team leader, especially when the opportunity presents specific areas for constructive thought.",Yamada,Superhero Game Planning,General Member,1,3
11,Q05,"I would feel confident sharing my missteps with the team leader, as I value their guidance in refining my work.",Yamada,Superhero Game Planning,General Member,1,3
11,Q06,"I would feel comfortable addressing the situation with a constructive approach, as open communication benefits the team's overall performance.",Yamada,Superhero Game Planning,General Member,1,3
11,Q07,"I understand that my reflective input for ""Community Hero: Rebuilding Hope"" is highly valued by my team leader, Yamaguchi-san, as she specifically seeks my contribution to solidify key concepts.",Yamada,Superhero Game Planning,General Member,1,3
11,Q08,"Yamaguchi-san's explicit request for my input on solidifying ""Community Hero: Rebuilding Hope"" demonstrates a positive encouragement for me to engage with new tasks and apply my skills to areas I haven't previously focused on in such detail.",Yamada,Superhero Game Planning,General Member,1,3
11,Q09,Yamaguchi-san's leadership provides substantial assurance when addressing workplace challenges.,Yamada,Superhero Game Planning,General Member,1,3
11,Q10,It is not difficult to ask my peers questions when I need clarification on my role at work.,Yamada,Superhero Game Planning,General Member,1,3
11,Q11,"I am able to communicate my opinions about work issues with my peers with a considerable degree of directness, particularly when presented with concrete details and a clear request for input.",Yamada,Superhero Game Planning,General Member,1,3
11,Q12,I am entirely comfortable discussing personal issues with my peers.,Yamada,Superhero Game Planning,General Member,1,3
11,Q13,"I find a constructive environment exists for sharing recommendations, and I can engage in the process of formulating ideas.",Yamada,Superhero Game Planning,General Member,1,3
11,Q14,"I would feel quite comfortable discussing any missteps with my colleagues, as open dialogue facilitates collective growth.",Yamada,Superhero Game Planning,General Member,1,3
11,Q15,I would feel fully comfortable offering guidance to a colleague encountering a misstep.,Yamada,Superhero Game Planning,General Member,1,3
11,Q16,"My contributions are recognized as valuable when I present well-considered insights, particularly after thorough reflection.",Yamada,Superhero Game Planning,General Member,1,3
11,Q17,I find it challenging to request assistance from colleagues when I can develop solutions through dedicated introspection.,Yamada,Superhero Game Planning,General Member,1,3
11,Q18,"The team generally provides adequate information, though moments of complete clarity are infrequent.",Yamada,Superhero Game Planning,General Member,1,3
11,Q19,"Information sharing within the team exhibits a strong degree of substance and direct relevance, rather than being merely superficial.",Yamada,Superhero Game Planning,General Member,1,3
11,Q20,"My team possesses a solid alignment in pursuit of shared objectives, with a few divergent viewpoints emerging during the articulation of specific methodologies.",Yamada,Superhero Game Planning,General Member,1,3
11,Q21,"I find the team's current commitment level to be quite promising, offering a solid foundation for our collective efforts.",Yamada,Superhero Game Planning,General Member,1,3
11,Q22,"My team members' aspirations for team performance appear quite aligned with my own focus on developing well-structured game mechanics and narrative frameworks for ""Community Hero: Rebuilding Hope.""",Yamada,Superhero Game Planning,General Member,1,3
11,Q23,"The current opportunities provide a solid foundation for refining my performance, with particular value placed on my reflective contributions to ""Community Hero: Rebuilding Hope.""",Yamada,Superhero Game Planning,General Member,1,3
12,Q01,Seeking clarification from my team leader on work-related matters is a process I find quite straightforward.,Sasaki,Superhero Game Planning,General Member,1,3
12,Q02,I express my thoughts on work matters with my team leader with complete transparency.,Sasaki,Superhero Game Planning,General Member,1,3
12,Q03,I feel quite uncomfortable voicing disagreements concerning project direction to my team leader as it disrupts the established momentum.,Sasaki,Superhero Game Planning,General Member,1,3
12,Q04,"I feel quite constrained in expressing recommendations or ideas for new projects or procedural changes to my team leader, given the current misunderstanding.",Sasaki,Superhero Game Planning,General Member,1,3
12,Q05,I would feel somewhat uneasy speaking up to my team leader if I made a mistake.,Sasaki,Superhero Game Planning,General Member,1,3
12,Q06,"I would feel apprehensive speaking up to my team leader about a colleague's mistake, as it could create an uncomfortable dynamic within the team.",Sasaki,Superhero Game Planning,General Member,1,3
12,Q07,"My input appears to be disregarded by my team leader, as evidenced by the current misunderstanding of a foundational concept.",Sasaki,Superhero Game Planning,General Member,1,3
12,Q08,"My team leader's encouragement for me to explore new tasks or skills is quite substantial, preventing any hesitation in embracing novel challenges.",Sasaki,Superhero Game Planning,General Member,1,3
12,Q09,My team leader's dependable advocacy requires further observable instances.,Sasaki,Superhero Game Planning,General Member,1,3
12,Q10,It is definitely challenging to get clear confirmation when I have inquiries regarding my work.,Sasaki,Superhero Game Planning,General Member,1,3
12,Q11,"I approach work discussions with colleagues with absolute directness, ensuring clarity on project fundamentals.",Sasaki,Superhero Game Planning,General Member,1,3
12,Q12,I find it remarkably challenging to convey personal concerns to my colleagues.,Sasaki,Superhero Game Planning,General Member,1,3
12,Q13,I feel considerably restricted when expressing new project recommendations due to past misunderstandings.,Sasaki,Superhero Game Planning,General Member,1,3
12,Q14,I would feel somewhat uncomfortable raising my concerns when my peers demonstrate a lack of clear understanding regarding project specifics.,Sasaki,Superhero Game Planning,General Member,1,3
12,Q15,I would feel it is absolutely essential to address a colleague's mistake directly and clearly.,Sasaki,Superhero Game Planning,General Member,1,3
12,Q16,"My contributions feel like a fragile seedling in a gale, often swept away before it can take root.",Sasaki,Superhero Game Planning,General Member,1,3
12,Q17,It presents a considerable challenge to solicit assistance from my colleagues due to the evident communication discrepancies.,Sasaki,Superhero Game Planning,General Member,1,3
12,Q18,There are definite opportunities for enhancing mutual clarity on project specifics within the team.,Sasaki,Superhero Game Planning,General Member,1,3
