agent_id,question_id,answer_text,agent_name,dept,position,dept_id,pattern_id
12,Q19,The attempts to share information within the team currently fall short of achieving genuine mutual understanding.,Sasaki,Superhero Game Planning,General Member,1,3
12,Q20,Our team's alignment on performance objectives faces significant ambiguity due to misaligned foundational understanding.,Sasaki,Superhero Game Planning,General Member,1,3
12,Q21,I am finding the current commitment level quite a hindrance to progress.,Sasaki,Superhero Game Planning,General Member,1,3
12,Q22,Kato's aspirations for our team's performance are presently quite divergent from mine.,Sasaki,Superhero Game Planning,General Member,1,3
12,Q23,The current circumstances present a definite hurdle in advancing my personal performance due to a considerable need for re-establishing foundational concept clarity.,Sasaki,Superhero Game Planning,General Member,1,3
13,Q01,"Engaging the entire department in a comprehensive discussion about the ""Community Hero"" concept is the essential next step.",Yamaguchi,Superhero Game Planning,Department Leader,1,3
13,Q02,"I am happy to openly communicate my opinions about work issues with my team leader, especially when a project like ""Community Hero: Rebuilding Hope"" is developing so positively.",Yamaguchi,Superhero Game Planning,Department Leader,1,3
13,Q03,"I feel quite comfortable sharing personal issues or disagreements with my team leader, as I value open communication and constructive dialogue within the department.",Yamaguchi,Superhero Game Planning,Department Leader,1,3
13,Q04,I feel completely at liberty to share my recommendations and ideas with my team leader.,Yamaguchi,Superhero Game Planning,Department Leader,1,3
13,Q05,I would feel completely safe speaking up to my team leader if I made a mistake on this team.,Yamaguchi,Superhero Game Planning,Department Leader,1,3
13,Q06,"I would feel quite comfortable addressing any observed errors within the team, as constructive feedback is vital for our collective progress.",Yamaguchi,Superhero Game Planning,Department Leader,1,3
13,Q07,"My contributions are always appreciated by my team leader, and she actively seeks out diverse perspectives.",Yamaguchi,Superhero Game Planning,Department Leader,1,3
13,Q08,My department leader actively fosters an environment where exploring new tasks and acquiring novel skills is a distinct expectation.,Yamaguchi,Superhero Game Planning,Department Leader,1,3
13,Q09,"My team leader, Yamaguchi, is a highly dependable advocate for the team.",Yamaguchi,Superhero Game Planning,Department Leader,1,3
13,Q10,It is incredibly simple to ask my colleagues for their thoughts and insights.,Yamaguchi,Superhero Game Planning,Department Leader,1,3
13,Q11,"I am very comfortable expressing my opinions on work matters with my colleagues, always aiming for clear and direct communication to ensure project alignment and progress.",Yamaguchi,Superhero Game Planning,Department Leader,1,3
13,Q12,I am comfortable sharing personal issues with my peers when it supports a positive team dynamic and constructive collaboration.,Yamaguchi,Superhero Game Planning,Department Leader,1,3
13,Q13,I feel quite unhindered in sharing my recommendations and ideas with my colleagues.,Yamaguchi,Superhero Game Planning,Department Leader,1,3
13,Q14,"I would feel completely comfortable discussing any missteps with my colleagues, as our shared commitment to excellence ensures a constructive environment for growth.",Yamaguchi,Superhero Game Planning,Department Leader,1,3
13,Q15,I am confident in addressing colleagues directly about potential missteps.,Yamaguchi,Superhero Game Planning,Department Leader,1,3
13,Q16,My input is consistently recognized and appreciated by my colleagues.,Yamaguchi,Superhero Game Planning,Department Leader,1,3
13,Q17,Initiating a department-wide discussion is a critical next step to ensure comprehensive alignment and idea generation.,Yamaguchi,Superhero Game Planning,Department Leader,1,3
13,Q18,"The team actively shares updates, ensuring everyone possesses vital information regarding project developments.",Yamaguchi,Superhero Game Planning,Department Leader,1,3
13,Q19,"The current attempts to share information throughout the team are demonstrating genuine collaboration, with all members actively contributing their insights and perspectives to the ""Community Hero"" project.",Yamaguchi,Superhero Game Planning,Department Leader,1,3
13,Q20,"My department exhibits a robust alignment, with individuals enthusiastically contributing their distinct perspectives to achieve our shared objectives.",Yamaguchi,Superhero Game Planning,Department Leader,1,3
13,Q21,I am very pleased with the team's dedicated commitment to the task at hand.,Yamaguchi,Superhero Game Planning,Department Leader,1,3
13,Q22,My team members demonstrate exceptional alignment in their aspirations for the team's performance.,Yamaguchi,Superhero Game Planning,Department Leader,1,3
13,Q23,"The opportunities provided to enhance my personal performance are quite sufficient, fostering continued growth within the team.",Yamaguchi,Superhero Game Planning,Department Leader,1,3
