agent_id,question_id,answer_text,agent_name,dept,position,dept_id,pattern_id
0,Q01,Approaching my department leader with questions or uncertainties presents a straightforward opportunity for clarification.,Sato,Modern Setting Game Planning,General Member,0,3
0,Q02,"I communicate my work opinions with my team leader with considerable openness, as his positive feedback on my concept encourages me.",Sato,Modern Setting Game Planning,General Member,0,3
0,Q03,I feel a comfortable level of ease discussing personal matters or points of contention with my team leader.,Sato,Modern Setting Game Planning,General Member,0,3
0,Q04,I feel a welcome freedom to share my recommendations and ideas for new projects or procedural changes with my team leader.,Sato,Modern Setting Game Planning,General Member,0,3
0,Q05,"I would feel quite comfortable voicing any missteps to my team leader, given his supportive and encouraging demeanor.",Sato,Modern Setting Game Planning,General Member,0,3
0,Q06,I would feel quite secure expressing concerns about a colleague's missteps to my team leader.,Sato,Modern Setting Game Planning,General Member,0,3
0,Q07,"My input is recognized and appreciated by my team leader, fostering a sense of validation.",Sato,Modern Setting Game Planning,General Member,0,3
0,Q08,My department leader offers significant encouragement and support for pursuing new tasks and learning opportunities.,Sato,Modern Setting Game Planning,General Member,0,3
0,Q09,"Yamamoto-kun provides steadfast encouragement and views my contributions as a valuable asset, suggesting he is a very dependable advocate.",Sato,Modern Setting Game Planning,General Member,0,3
0,Q10,Seeking clarification from colleagues is a straightforward endeavor that yields valuable insights for my responsibilities.,Sato,Modern Setting Game Planning,General Member,0,3
0,Q11,"I offer my thoughts with a balanced and constructive approach, valuing clarity and mutual understanding in my discussions with colleagues.",Sato,Modern Setting Game Planning,General Member,0,3
0,Q12,"I find discussing personal matters with colleagues to be somewhat challenging, preferring to maintain a professional distance.",Sato,Modern Setting Game Planning,General Member,0,3
0,Q13,I feel quite unhindered in sharing my proposals and suggestions with my colleagues.,Sato,Modern Setting Game Planning,General Member,0,3
0,Q14,"I would feel quite comfortable sharing my thoughts and experiences with my colleagues, even if I encountered challenges.",Sato,Modern Setting Game Planning,General Member,0,3
0,Q15,"I would feel quite comfortable discussing a potential oversight with a colleague, ensuring we can resolve it together.",Sato,Modern Setting Game Planning,General Member,0,3
0,Q16,My contributions are recognized as a source of unique and heartwarming concepts.,Sato,Modern Setting Game Planning,General Member,0,3
0,Q17,Leveraging the expertise of colleagues for assistance is generally a straightforward endeavor.,Sato,Modern Setting Game Planning,General Member,0,3
0,Q18,There are some opportunities for more consistent information sharing across the team.,Sato,Modern Setting Game Planning,General Member,0,3
0,Q19,The information sharing attempts are generally quite effective in fostering understanding.,Sato,Modern Setting Game Planning,General Member,0,3
0,Q20,Our department is working with a palpable sense of shared purpose towards achieving our objectives.,Sato,Modern Setting Game Planning,General Member,0,3
0,Q21,"I am quite satisfied with the team's enthusiasm for my concept, particularly Yamamoto-kun's encouraging feedback.",Sato,Modern Setting Game Planning,General Member,0,3
0,Q22,My colleagues' aspirations for team performance demonstrate a substantial alignment with my own objectives.,Sato,Modern Setting Game Planning,General Member,0,3
0,Q23,The opportunities provided by the team for enhancing personal performance are quite substantial.,Sato,Modern Setting Game Planning,General Member,0,3
1,Q01,I would find it quite straightforward to approach my team leader with inquiries or uncertainties regarding my work responsibilities.,Suzuki,Modern Setting Game Planning,General Member,0,3
1,Q02,"I can communicate my opinions with my team leader with confidence, as long as the discussion remains constructive.",Suzuki,Modern Setting Game Planning,General Member,0,3
1,Q03,I feel a degree of comfort speaking about personal problems or disagreements to my team leader when the situation genuinely necessitates it.,Suzuki,Modern Setting Game Planning,General Member,0,3
1,Q04,I feel quite unhindered when proposing recommendations and ideas for new projects or procedural changes to my team leader.,Suzuki,Modern Setting Game Planning,General Member,0,3
1,Q05,"I would feel a significant degree of comfort discussing errors with my team leader, given our established rapport and the project's positive trajectory.",Suzuki,Modern Setting Game Planning,General Member,0,3
1,Q06,I would feel comfortable addressing a colleague's mistake with the team leader.,Suzuki,Modern Setting Game Planning,General Member,0,3
1,Q07,"I perceive my input as generally considered, though the immediate adoption of my suggestions is infrequent.",Suzuki,Modern Setting Game Planning,General Member,0,3
1,Q08,My team leader's encouragement for new tasks and learning is consistent and beneficial.,Suzuki,Modern Setting Game Planning,General Member,0,3
1,Q09,My team leader demonstrates a solid commitment to supporting team members through challenges.,Suzuki,Modern Setting Game Planning,General Member,0,3
1,Q10,I would find it quite simple to approach colleagues with inquiries related to my work responsibilities.,Suzuki,Modern Setting Game Planning,General Member,0,3
1,Q11,I convey my work opinions with a measure of openness that remains steadfast.,Suzuki,Modern Setting Game Planning,General Member,0,3
1,Q12,I find discussing personal matters with colleagues to be quite manageable.,Suzuki,Modern Setting Game Planning,General Member,0,3
1,Q13,"I feel quite free to voice recommendations and ideas to my peers, though I prioritize respecting ongoing discussions and commitments.",Suzuki,Modern Setting Game Planning,General Member,0,3
1,Q14,I would feel quite secure voicing any missteps to my colleagues on this team.,Suzuki,Modern Setting Game Planning,General Member,0,3
1,Q15,I would feel entirely comfortable offering constructive feedback to a colleague upon noticing an error.,Suzuki,Modern Setting Game Planning,General Member,0,3
1,Q16,"I perceive my input as considerably valued by my peers, fostering a strong sense of mutual respect and consideration.",Suzuki,Modern Setting Game Planning,General Member,0,3
1,Q17,Seeking assistance from colleagues presents a rather straightforward experience.,Suzuki,Modern Setting Game Planning,General Member,0,3
1,Q18,"Watanabe-san is actively seeking input on initial concepts, and Takahashi-san is proactively sharing exciting progress on a core game mechanic.",Suzuki,Modern Setting Game Planning,General Member,0,3
1,Q19,"The team's information sharing demonstrates a genuine effort to communicate across departments, with a clear drive to align on project directions.",Suzuki,Modern Setting Game Planning,General Member,0,3
1,Q20,Our team demonstrates remarkable unity in pursuing our performance objectives.,Suzuki,Modern Setting Game Planning,General Member,0,3
1,Q21,I am quite pleased with the dedicated engagement demonstrated by my colleagues.,Suzuki,Modern Setting Game Planning,General Member,0,3
1,Q22,"Watanabe-san's request for initial concept review is perfectly manageable before diving into the detailed scenario mapping for ""Urban Harmonizers"" with Takahashi-san.",Suzuki,Modern Setting Game Planning,General Member,0,3
1,Q23,The opportunities provided by the team for enhancing my personal performance feel quite appropriate.,Suzuki,Modern Setting Game Planning,General Member,0,3
2,Q01,Consulting my team leader is a process requiring careful consideration of the circumstances.,Takahashi,Modern Setting Game Planning,General Member,0,3
2,Q02,"I communicate my opinions with my team leader with a straightforward approach, prioritizing clarity and directness on work matters.",Takahashi,Modern Setting Game Planning,General Member,0,3
2,Q03,"I feel a definite discomfort speaking about personal problems or disagreements to my team leader, as it can impede our shared project progression.",Takahashi,Modern Setting Game Planning,General Member,0,3
2,Q04,I experience a substantial degree of latitude in presenting suggestions regarding new initiatives or adjustments to team protocols to my team leader.,Takahashi,Modern Setting Game Planning,General Member,0,3
2,Q05,"I feel confident speaking up about errors, as I believe in maintaining transparency within the team.",Takahashi,Modern Setting Game Planning,General Member,0,3
2,Q06,I would feel quite comfortable raising concerns about a colleague's actions with the team leader.,Takahashi,Modern Setting Game Planning,General Member,0,3
2,Q07,"I feel my contributions are heard, though sometimes the pacing requires adjustment.",Takahashi,Modern Setting Game Planning,General Member,0,3
2,Q08,My team leader's encouragement for new tasks and learning is rather limited.,Takahashi,Modern Setting Game Planning,General Member,0,3
2,Q09,"Suzuki-san's commitment to our project's success is undeniably present, though her immediate action to consult with Watanabe-san before fully engaging with our plans introduces a minor delay, creating a situation where her advocacy is somewhat impacted by external considerations.",Takahashi,Modern Setting Game Planning,General Member,0,3
2,Q10,I possess a strong readiness to consult colleagues when questions arise regarding my work responsibilities.,Takahashi,Modern Setting Game Planning,General Member,0,3
2,Q11,"I convey my professional perspectives with candor, though a degree of reservation surfaces when team momentum experiences interruption.",Takahashi,Modern Setting Game Planning,General Member,0,3
2,Q12,I find it quite straightforward to discuss personal matters with colleagues.,Takahashi,Modern Setting Game Planning,General Member,0,3
2,Q13,I experience considerable freedom to share recommendations and ideas with my peers.,Takahashi,Modern Setting Game Planning,General Member,0,3
2,Q14,I possess a high degree of assurance when voicing concerns about potential missteps within our team.,Takahashi,Modern Setting Game Planning,General Member,0,3
2,Q15,I feel it is important to proactively address potential missteps with colleagues to ensure project integrity.,Takahashi,Modern Setting Game Planning,General Member,0,3
2,Q16,My contributions are reliably considered by my colleagues.,Takahashi,Modern Setting Game Planning,General Member,0,3
2,Q17,"Seeking assistance from my colleagues presents a considerable challenge, given my preference for independent problem-solving and a belief in maximizing individual contributions before considering external input.",Takahashi,Modern Setting Game Planning,General Member,0,3
2,Q18,Information sharing amongst colleagues is adequately maintained.,Takahashi,Modern Setting Game Planning,General Member,0,3
2,Q19,The current information sharing practices present a clear opportunity for enhancement regarding their depth and consistency across the team.,Takahashi,Modern Setting Game Planning,General Member,0,3
2,Q20,"My team possesses a strong unity, with shared enthusiasm for our chosen path and a clear vision for ""Urban Harmonizers.""",Takahashi,Modern Setting Game Planning,General Member,0,3
2,Q21,"I acknowledge a minor disruption to our project's swift advancement, though my dedication to ""Urban Harmonizers"" remains quite strong.",Takahashi,Modern Setting Game Planning,General Member,0,3
2,Q22,"Suzuki-san's brief discussion with Watanabe-san presents a minor delay, but our shared excitement for ""Urban Harmonizers"" ensures continued strong alignment toward peak team performance.",Takahashi,Modern Setting Game Planning,General Member,0,3
2,Q23,"The current opportunities for personal performance improvement are rather minimal, leaving room for much greater development.",Takahashi,Modern Setting Game Planning,General Member,0,3
3,Q01,It is certainly not difficult to approach my team leader with inquiries or uncertainties regarding my role.,Tanaka,Modern Setting Game Planning,General Member,0,3
3,Q02,"I can communicate my opinions about work issues with my team leader with comfortable directness, while also valuing collaborative refinement.",Tanaka,Modern Setting Game Planning,General Member,0,3
3,Q03,I find discussing personal issues or disagreements with my team leader to be a somewhat challenging endeavor.,Tanaka,Modern Setting Game Planning,General Member,0,3
3,Q04,I feel quite unhindered to share my recommendations and ideas for new projects or procedural changes with my team leader.,Tanaka,Modern Setting Game Planning,General Member,0,3
3,Q05,I would feel quite safe speaking up to my team leader about a mistake.,Tanaka,Modern Setting Game Planning,General Member,0,3
3,Q06,I would feel relatively secure raising concerns about a colleague's misstep with my team leader.,Tanaka,Modern Setting Game Planning,General Member,0,3
3,Q07,"I believe my contributions are acknowledged, though the depth of their impact remains somewhat unclear.",Tanaka,Modern Setting Game Planning,General Member,0,3
3,Q08,"My team leader provides ample encouragement for acquiring new skills and undertaking novel responsibilities, fostering a supportive environment for growth.",Tanaka,Modern Setting Game Planning,General Member,0,3
3,Q09,"Our team leader demonstrates consistent support, making him a reliable advocate.",Tanaka,Modern Setting Game Planning,General Member,0,3
3,Q10,"It presents a mild challenge to articulate complex philosophical concepts to a broader audience, though I anticipate a collaborative discussion will yield substantial insights.",Tanaka,Modern Setting Game Planning,General Member,0,3
3,Q11,I will express my perspectives with a clear and direct approach when engaging with my colleagues on work-related matters.,Tanaka,Modern Setting Game Planning,General Member,0,3
3,Q12,I find discussing personal issues with peers to be a thoroughly awkward experience.,Tanaka,Modern Setting Game Planning,General Member,0,3
3,Q13,I feel adequately free to express recommendations and ideas regarding new projects or procedural changes with my peers.,Tanaka,Modern Setting Game Planning,General Member,0,3
3,Q14,I would feel entirely comfortable discussing any missteps with my colleagues.,Tanaka,Modern Setting Game Planning,General Member,0,3
3,Q15,I would feel entirely comfortable voicing my observations to a peer if I noticed a deviation from the intended path.,Tanaka,Modern Setting Game Planning,General Member,0,3
3,Q16,"I find my contributions are generally considered, though sometimes the alignment with the current project focus requires careful framing for immediate reception.",Tanaka,Modern Setting Game Planning,General Member,0,3
3,Q17,Collaborating for assistance presents a moderate challenge due to the diverse project focuses within the department.,Tanaka,Modern Setting Game Planning,General Member,0,3
3,Q18,It is necessary for us to enhance our proactive information sharing to ensure a consistent understanding of project developments across the team.,Tanaka,Modern Setting Game Planning,General Member,0,3
3,Q19,"The attempts to share information throughout the team are largely functional, facilitating necessary coordination without extensive depth.",Tanaka,Modern Setting Game Planning,General Member,0,3
3,Q20,"Our team is currently exploring diverse avenues, and our shared objective remains an exciting prospect.",Tanaka,Modern Setting Game Planning,General Member,0,3
3,Q21,I feel quite satisfied with the team's dedication to our task.,Tanaka,Modern Setting Game Planning,General Member,0,3
3,Q22,"My aspirations for ""Echo Net"" align constructively with Ito-san's focus on its philosophical depth.",Tanaka,Modern Setting Game Planning,General Member,0,3
3,Q23,The opportunities provided for performance improvement are quite sufficient for my current development trajectory.,Tanaka,Modern Setting Game Planning,General Member,0,3
4,Q01,Approaching the team leader with inquiries concerning my role presents a moderate degree of ease.,Watanabe,Modern Setting Game Planning,General Member,0,3
4,Q02,I approach discussions about work matters with my team leader with complete candor.,Watanabe,Modern Setting Game Planning,General Member,0,3
4,Q03,I find it a constructive exercise to communicate any concerns or differing viewpoints with my team leader.,Watanabe,Modern Setting Game Planning,General Member,0,3
4,Q04,I experience a comfortable degree of freedom when presenting new project recommendations and procedural adjustments to my team leader.,Watanabe,Modern Setting Game Planning,General Member,0,3
4,Q05,Speaking up about a mistake to my team leader is a task I find comfortably manageable.,Watanabe,Modern Setting Game Planning,General Member,0,3
4,Q06,I would feel somewhat apprehensive speaking to the team leader about a colleague's mistake.,Watanabe,Modern Setting Game Planning,General Member,0,3
4,Q07,My contributions are consistently recognized as meaningful by my team leader when I express my perspectives.,Watanabe,Modern Setting Game Planning,General Member,0,3
4,Q08,My team leader provides a solid environment for exploring novel responsibilities.,Watanabe,Modern Setting Game Planning,General Member,0,3
4,Q09,My team leader demonstrates a solid commitment to supporting team members facing challenges.,Watanabe,Modern Setting Game Planning,General Member,0,3
4,Q10,Approaching peers with questions on my role presents a straightforward path.,Watanabe,Modern Setting Game Planning,General Member,0,3
4,Q11,I offer my work opinions with a direct and clear communication style.,Watanabe,Modern Setting Game Planning,General Member,0,3
4,Q12,I feel completely at ease discussing personal matters with my colleagues.,Watanabe,Modern Setting Game Planning,General Member,0,3
4,Q13,I feel entirely at liberty to express my recommendations and concepts to my colleagues.,Watanabe,Modern Setting Game Planning,General Member,0,3
4,Q14,I would feel quite comfortable expressing my errors to my colleagues.,Watanabe,Modern Setting Game Planning,General Member,0,3
4,Q15,I would feel comfortable addressing a colleague's oversight to ensure our collective progress.,Watanabe,Modern Setting Game Planning,General Member,0,3
4,Q16,My contributions are generally perceived with a healthy level of consideration by my colleagues.,Watanabe,Modern Setting Game Planning,General Member,0,3
4,Q17,Seeking assistance from colleagues presents a clear path for gaining valuable perspectives.,Watanabe,Modern Setting Game Planning,General Member,0,3
4,Q18,"Suzuki-san possesses valuable insights into the ""Urban Harmonizers"" project, indicating a proactive approach to inter-departmental information exchange.",Watanabe,Modern Setting Game Planning,General Member,0,3
4,Q19,"Suzuki-san's proactive exploration with Takahashi-san on ""Urban Harmonizers"" showcases substantial information exchange, yet my unfamiliarity with Takahashi-san suggests some network gaps exist.",Watanabe,Modern Setting Game Planning,General Member,0,3
4,Q20,"Our team demonstrates a strong unity in pursuing performance goals, with diverse perspectives contributing to our collective efforts.",Watanabe,Modern Setting Game Planning,General Member,0,3
4,Q21,I am satisfied with the team's commitment to the task.,Watanabe,Modern Setting Game Planning,General Member,0,3
4,Q22,Suzuki-san's proactive engagement with a concept from another department suggests a divergent but potentially synergistic direction compared to Tanaka-san's foundational explorations.,Watanabe,Modern Setting Game Planning,General Member,0,3
4,Q23,"The team provides a reasonable platform for developing my personal performance, though further avenues for specialized skill enhancement would be beneficial.",Watanabe,Modern Setting Game Planning,General Member,0,3
5,Q01,"Approaching Yamamoto for clarification on my role presents a manageable challenge, and I anticipate a constructive exchange.",Ito,Modern Setting Game Planning,General Member,0,3
5,Q02,I find it most effective to share my work-related viewpoints with my team leader after I have thoroughly considered and refined them.,Ito,Modern Setting Game Planning,General Member,0,3
5,Q03,I generally experience a measure of discomfort when voicing personal issues or disputes to my team leader.,Ito,Modern Setting Game Planning,General Member,0,3
5,Q04,I feel completely free to offer my recommendations and ideas to my team leader.,Ito,Modern Setting Game Planning,General Member,0,3
5,Q05,I would feel somewhat apprehensive sharing my errors with our team leader.,Ito,Modern Setting Game Planning,General Member,0,3
5,Q06,"Speaking up to my team leader about a colleague's mistake feels quite safe, as fostering transparency and collective improvement is a core principle of our team.",Ito,Modern Setting Game Planning,General Member,0,3
5,Q07,"My input receives considerable consideration from my team leader, a fact I acknowledge with genuine appreciation.",Ito,Modern Setting Game Planning,General Member,0,3
5,Q08,Yamamoto provides a sensible encouragement for embracing novel responsibilities and skill development.,Ito,Modern Setting Game Planning,General Member,0,3
5,Q09,Yamamoto’s balanced approach offers a certain reliability for navigating company challenges.,Ito,Modern Setting Game Planning,General Member,0,3
5,Q10,Approaching colleagues with inquiries or uncertainties regarding my role is generally a straightforward endeavor.,Ito,Modern Setting Game Planning,General Member,0,3
5,Q11,"I openly share my work opinions with my peers, finding value in candid discussion.",Ito,Modern Setting Game Planning,General Member,0,3
5,Q12,I find myself neutral regarding sharing personal matters with colleagues.,Ito,Modern Setting Game Planning,General Member,0,3
5,Q13,I feel a fair degree of liberty to voice my suggestions regarding new projects or procedural adjustments to my colleagues.,Ito,Modern Setting Game Planning,General Member,0,3
5,Q14,I would feel quite safe speaking up to my peers if I made a mistake on this team.,Ito,Modern Setting Game Planning,General Member,0,3
5,Q15,"I would certainly feel hesitant to voice concerns to a colleague about a perceived error, given the potential for interpersonal friction.",Ito,Modern Setting Game Planning,General Member,0,3
5,Q16,My contributions are often overlooked in favor of the immediate needs of established projects.,Ito,Modern Setting Game Planning,General Member,0,3
5,Q17,"Engaging Yamamoto for his viewpoint on the current state of ""Echo Net"" presents a valuable opportunity to shape the proposal effectively.",Ito,Modern Setting Game Planning,General Member,0,3
5,Q18,Communication within the team sees a persistent absence of proactive updates regarding individual project statuses.,Ito,Modern Setting Game Planning,General Member,0,3
5,Q19,Information sharing throughout the team possesses a superficial quality at present.,Ito,Modern Setting Game Planning,General Member,0,3
5,Q20,"Our team demonstrates considerable cohesion in pursuing performance objectives, with a notable emphasis on collaborative development and the integration of diverse perspectives.",Ito,Modern Setting Game Planning,General Member,0,3
5,Q21,I find the team's current level of commitment to be quite satisfactory.,Ito,Modern Setting Game Planning,General Member,0,3
5,Q22,"The team members' aspirations for performance exhibit a pronounced alignment, with individual project focuses naturally contributing to the overarching team objectives.",Ito,Modern Setting Game Planning,General Member,0,3
5,Q23,The opportunities provided to me for enhancing my personal performance are generally adequate.,Ito,Modern Setting Game Planning,General Member,0,3
6,Q01,"Approaching my team leader with inquiries is a straightforward endeavor, facilitating prompt clarity and collaborative problem-solving.",Yamamoto,Modern Setting Game Planning,Department Leader,0,3
6,Q02,I communicate my opinions about work issues to my team leader with complete candor.,Yamamoto,Modern Setting Game Planning,Department Leader,0,3
6,Q03,I find it wholly comfortable to openly discuss personal problems or disagreements with my team leader.,Yamamoto,Modern Setting Game Planning,Department Leader,0,3
6,Q04,"I feel entirely free to propose recommendations and ideas to my team leader, as my contributions are consistently welcomed and valued.",Yamamoto,Modern Setting Game Planning,Department Leader,0,3
6,Q05,I feel a strong sense of assurance that speaking up about any mistakes would be received constructively by my team.,Yamamoto,Modern Setting Game Planning,Department Leader,0,3
6,Q06,I would feel quite comfortable raising concerns about a colleague's mistake with my team.,Yamamoto,Modern Setting Game Planning,Department Leader,0,3
6,Q07,My team's contributions are always met with thorough consideration and constructive engagement.,Yamamoto,Modern Setting Game Planning,Department Leader,0,3
6,Q08,My team leader provides a robust environment for exploring novel challenges and acquiring new competencies.,Yamamoto,Modern Setting Game Planning,Department Leader,0,3
6,Q09,My team is fortunate to have a leader who actively champions their concerns and fosters a supportive environment.,Yamamoto,Modern Setting Game Planning,Department Leader,0,3
6,Q10,I am confident in my ability to seek clarification from my colleagues when the need arises.,Yamamoto,Modern Setting Game Planning,Department Leader,0,3
