agent_id,question_id,answer_text,agent_name,dept,position,dept_id,pattern_id
12,Q15,"I would feel quite comfortable bringing a colleague's oversight to their attention, as it's crucial for project integrity.",Sasaki,Military / War Game Planning,General Member,1,4
12,Q16,"I am confident my contributions are valued within my department, and I will voice my thoughts with assurance.",Sasaki,Military / War Game Planning,General Member,1,4
12,Q17,"It is a simple matter to request assistance from my colleagues within the department, however, involving individuals from outside our immediate team necessitates careful consideration and prior consensus.",Sasaki,Military / War Game Planning,General Member,1,4
12,Q18,I believe our team could benefit from a more consistent exchange of information regarding work-related matters.,Sasaki,Military / War Game Planning,General Member,1,4
12,Q19,I perceive a need for greater clarity regarding team member identification to ensure effective information dissemination within our departmental scope.,Sasaki,Military / War Game Planning,General Member,1,4
12,Q20,"Our team possesses a considerable degree of alignment on performance objectives, although the inclusion of unfamiliar team members requires further clarification to ensure complete unity.",Sasaki,Military / War Game Planning,General Member,1,4
12,Q21,I am satisfied with our team's commitment to the task.,Sasaki,Military / War Game Planning,General Member,1,4
12,Q22,The current divergence regarding team member inclusion presents a challenge to immediate alignment on performance aspirations.,Sasaki,Military / War Game Planning,General Member,1,4
12,Q23,"The opportunities provided for performance enhancement are sufficient, yet room exists for further refinement.",Sasaki,Military / War Game Planning,General Member,1,4
13,Q01,Kobayashi's current contributions foster an environment where clarifying doubts feels entirely achievable.,Yamaguchi,Military / War Game Planning,Department Leader,1,4
13,Q02,I communicate my opinions with my team leader with complete openness and directness.,Yamaguchi,Military / War Game Planning,Department Leader,1,4
13,Q03,"I am completely at ease discussing personal issues or disagreements with my team leader, as open communication fosters a robust and productive environment.",Yamaguchi,Military / War Game Planning,Department Leader,1,4
13,Q04,I feel an abundant freedom to contribute my recommendations and concepts to our team leader.,Yamaguchi,Military / War Game Planning,Department Leader,1,4
13,Q05,I would feel completely safe speaking up to my team leader about a mistake.,Yamaguchi,Military / War Game Planning,Department Leader,1,4
13,Q06,I would feel entirely comfortable addressing a colleague's error directly with my team leader.,Yamaguchi,Military / War Game Planning,Department Leader,1,4
13,Q07,"Kobayashi's input is incredibly valued by me, serving as a vital catalyst for our creative process.",Yamaguchi,Military / War Game Planning,Department Leader,1,4
13,Q08,"Kobayashi's innovative proposals are a treasure trove, and I am actively fostering an environment where such boundary-pushing ideas are not only welcomed but enthusiastically embraced.",Yamaguchi,Military / War Game Planning,Department Leader,1,4
13,Q09,"My department leader demonstrates unwavering support, making my concerns a definite priority.",Yamaguchi,Military / War Game Planning,Department Leader,1,4
13,Q10,Consulting with my colleagues on role-related uncertainties is a simple process.,Yamaguchi,Military / War Game Planning,Department Leader,1,4
13,Q11,I communicate my opinions with my peers with complete openness.,Yamaguchi,Military / War Game Planning,Department Leader,1,4
13,Q12,I find it entirely beneficial to maintain a professional distance regarding personal matters with colleagues.,Yamaguchi,Military / War Game Planning,Department Leader,1,4
13,Q13,"I feel completely free to share recommendations and ideas with my peers, as our collaborative environment encourages a robust exchange of innovative concepts.",Yamaguchi,Military / War Game Planning,Department Leader,1,4
13,Q14,I am confident my peers will constructively engage with any errors I might present.,Yamaguchi,Military / War Game Planning,Department Leader,1,4
13,Q15,I would feel completely comfortable pointing out an error to a colleague because constructive feedback is beneficial for everyone's growth.,Yamaguchi,Military / War Game Planning,Department Leader,1,4
13,Q16,"My contributions resonate strongly with my immediate collaborators, fostering a shared drive for innovation.",Yamaguchi,Military / War Game Planning,Department Leader,1,4
13,Q17,"Engaging my team for assistance is typically a smooth and productive process, reflecting our shared commitment to project success.",Yamaguchi,Military / War Game Planning,Department Leader,1,4
13,Q18,"Kobayashi's enthusiastic ideation significantly benefits our shared understanding, while the rest of the department's subsequent analysis ensures thorough dissemination of finalized concepts.",Yamaguchi,Military / War Game Planning,Department Leader,1,4
13,Q19,Kobayashi's current concept generation is incredibly valuable and aligns perfectly with our brainstorming objectives.,Yamaguchi,Military / War Game Planning,Department Leader,1,4
13,Q20,"Kobayashi's innovative concepts provide a strong foundation, and my department's analytical skills will further solidify our project's direction.",Yamaguchi,Military / War Game Planning,Department Leader,1,4
13,Q21,Kobayashi's innovative concepts provide a remarkable foundation for our project.,Yamaguchi,Military / War Game Planning,Department Leader,1,4
13,Q22,"Kobayashi's aspirations for performance are entirely aligned with my own initial, unrestrained creative direction for the team.",Yamaguchi,Military / War Game Planning,Department Leader,1,4
13,Q23,The current brainstorming approach with Kobayashi offers ample opportunities for enhancing my intuitive ideation.,Yamaguchi,Military / War Game Planning,Department Leader,1,4
