agent_id,question_id,answer_text,agent_name,dept,position,dept_id,pattern_id
0,Q01,"My current focus is on generating delightfully outlandish ideas, so approaching my team leader with immediate questions is not my present priority.",Sato,Sports Game Planning,General Member,0,4
0,Q02,"I communicate my opinions with my team leader with complete openness, as his encouragement allows for wonderfully outlandish ideas.",Sato,Sports Game Planning,General Member,0,4
0,Q03,I find the prospect of sharing personal issues or disagreements with my team leader quite challenging.,Sato,Sports Game Planning,General Member,0,4
0,Q04,I feel completely at liberty to express my innovative concepts.,Sato,Sports Game Planning,General Member,0,4
0,Q05,"I feel completely secure sharing any missteps with my team leader, as constructive feedback is always a given.",Sato,Sports Game Planning,General Member,0,4
0,Q06,"I feel very safe speaking up to my team leader regarding a colleague's mistake, as open communication is actively encouraged.",Sato,Sports Game Planning,General Member,0,4
0,Q07,"My input is celebrated by my team leader, fostering an environment where creative freedom is enthusiastically encouraged.",Sato,Sports Game Planning,General Member,0,4
0,Q08,Yamamoto-kun provides abundant encouragement for embracing novel endeavors and expanding my skill set.,Sato,Sports Game Planning,General Member,0,4
0,Q09,"Yamamoto-kun is incredibly supportive, providing a truly encouraging environment for my creative endeavors.",Sato,Sports Game Planning,General Member,0,4
0,Q10,It is quite straightforward to seek assistance from my colleagues when I have a query or uncertainty regarding my responsibilities.,Sato,Sports Game Planning,General Member,0,4
0,Q11,"I feel completely comfortable sharing my wildest ideas with my colleagues, as Yamamoto-kun's enthusiasm for ""delightfully outlandish ideas"" certainly encourages a very free flow of thought.",Sato,Sports Game Planning,General Member,0,4
0,Q12,I am entirely comfortable sharing personal matters with my colleagues as the environment fosters open communication.,Sato,Sports Game Planning,General Member,0,4
0,Q13,I feel abundantly free to express my delightfully outlandish ideas to my peers.,Sato,Sports Game Planning,General Member,0,4
0,Q14,"I would feel comfortable voicing any errors, as Yamamoto-kun's encouragement cultivates a space where creative risks are appreciated.",Sato,Sports Game Planning,General Member,0,4
0,Q15,I feel entirely comfortable addressing a colleague's oversight when I observe it.,Sato,Sports Game Planning,General Member,0,4
0,Q16,My contributions are viewed with considerable appreciation when I present my distinctive concepts to the team.,Sato,Sports Game Planning,General Member,0,4
0,Q17,"The process to seek assistance from colleagues is quite straightforward, allowing for immediate engagement with emerging concepts.",Sato,Sports Game Planning,General Member,0,4
0,Q18,"Yamamoto-kun's enthusiastic support creates an environment where innovative ideas are openly welcomed, and the formal announcement for our upcoming brainstorming session is imminent.",Sato,Sports Game Planning,General Member,0,4
0,Q19,"Yamamoto-kun's enthusiastic encouragement creates a palpable sense of liberation, making the current information-sharing atmosphere feel exceptionally promising for creative exploration.",Sato,Sports Game Planning,General Member,0,4
0,Q20,"Yamamoto-kun's abundant encouragement fosters a wonderfully supportive atmosphere for generating truly outlandish ideas, which is precisely my immediate focus.",Sato,Sports Game Planning,General Member,0,4
0,Q21,I am absolutely delighted with the team's vibrant commitment to exploring imaginative concepts.,Sato,Sports Game Planning,General Member,0,4
0,Q22,"My team members' aspirations for team performance seem to be a vibrant tapestry of individual creative expression, perfectly aligned with the encouragement for delightfully outlandish ideas.",Sato,Sports Game Planning,General Member,0,4
0,Q23,The team provides plentiful room for my imaginative contributions to flourish.,Sato,Sports Game Planning,General Member,0,4
1,Q01,Approaching my team leader with questions or uncertainties regarding my role is a process I find straightforward and productive.,Suzuki,Sports Game Planning,General Member,0,4
1,Q02,"I appreciate the alignment in our thinking, Takahashi, and feel confident in openly sharing my developed concepts with you as we refine them.",Suzuki,Sports Game Planning,General Member,0,4
1,Q03,"My alignment with Takahashi on core concepts provides a solid foundation, making direct collaboration more productive than addressing potential personal issues at this juncture.",Suzuki,Sports Game Planning,General Member,0,4
1,Q04,"I feel quite free to express my recommendations, as our aligned thinking makes collaborative refinement highly productive.",Suzuki,Sports Game Planning,General Member,0,4
1,Q05,"I would feel quite secure sharing any missteps with the team leader, given our shared vision and the productive nature of our discussions.",Suzuki,Sports Game Planning,General Member,0,4
1,Q06,"I would feel quite comfortable expressing concerns about a colleague's error to my team leader, as open communication is beneficial.",Suzuki,Sports Game Planning,General Member,0,4
1,Q07,My contributions feel genuinely appreciated and incorporated by my team leader when I offer my perspectives.,Suzuki,Sports Game Planning,General Member,0,4
1,Q08,My team leader offers a neutral stance regarding my pursuit of novel responsibilities or skill acquisition.,Suzuki,Sports Game Planning,General Member,0,4
1,Q09,My team leader's advocacy in company matters is a subject that requires careful consideration.,Suzuki,Sports Game Planning,General Member,0,4
1,Q10,Engaging with colleagues on uncertainties proves to be a smooth process due to our shared understanding.,Suzuki,Sports Game Planning,General Member,0,4
1,Q11,I find it highly productive to share my perspectives on work matters with colleagues when our thinking aligns toward a shared objective.,Suzuki,Sports Game Planning,General Member,0,4
1,Q12,I find discussing personal matters with colleagues a truly constructive endeavor.,Suzuki,Sports Game Planning,General Member,0,4
1,Q13,"I experience a high degree of freedom in sharing recommendations and ideas with my peers, as our discussions frequently align and foster collaborative development.",Suzuki,Sports Game Planning,General Member,0,4
1,Q14,"I would feel quite comfortable voicing any missteps, as our shared understanding allows for open refinement.",Suzuki,Sports Game Planning,General Member,0,4
1,Q15,I find it completely fine to address a colleague if I observe an error in their work.,Suzuki,Sports Game Planning,General Member,0,4
1,Q16,"My contributions to discussions are consistently met with thoughtful consideration by my colleagues, fostering a collaborative environment.",Suzuki,Sports Game Planning,General Member,0,4
1,Q17,"Collaborating with Takahashi on these foundational concepts is proving exceptionally productive, and I am confident in our shared vision.",Suzuki,Sports Game Planning,General Member,0,4
1,Q18,"Team members possess a satisfactory level of mutual information sharing, with opportunities for further enhancement.",Suzuki,Sports Game Planning,General Member,0,4
1,Q19,The team's attempts at information sharing possess a substantial foundation of genuine connection.,Suzuki,Sports Game Planning,General Member,0,4
1,Q20,"Our team's focus on extracting the core competitive essence for performance is wonderfully aligned, making our collaborative efforts exceptionally effective.",Suzuki,Sports Game Planning,General Member,0,4
1,Q21,My team's commitment level presents a significant opportunity for enhancement.,Suzuki,Sports Game Planning,General Member,0,4
1,Q22,The team members exhibit exceptional alignment regarding the core aspirations for the team's performance.,Suzuki,Sports Game Planning,General Member,0,4
1,Q23,The opportunities provided to enhance my personal performance are quite sufficient.,Suzuki,Sports Game Planning,General Member,0,4
2,Q01,It would be completely manageable to discuss any uncertainties with my team leader regarding my role.,Takahashi,Sports Game Planning,General Member,0,4
2,Q02,"I can share the established conceptual direction for the project with my team leader, which aligns with our recent productive alignment.",Takahashi,Sports Game Planning,General Member,0,4
2,Q03,I find it challenging to openly discuss personal issues or disagreements with my team leader.,Takahashi,Sports Game Planning,General Member,0,4
2,Q04,"I perceive a distinct latitude for expressing proposals and concepts to my team leader, allowing for substantial input.",Takahashi,Sports Game Planning,General Member,0,4
2,Q05,"I would feel absolutely secure discussing any error with my team leader, as a constructive exchange is always beneficial for team advancement.",Takahashi,Sports Game Planning,General Member,0,4
2,Q06,"I would feel comfortable raising concerns about a colleague's actions with my team leader, as open communication is vital for project success.",Takahashi,Sports Game Planning,General Member,0,4
2,Q07,"My input is considered valuable, as my leader actively seeks out the core concepts that Suzuki and I have meticulously defined.",Takahashi,Sports Game Planning,General Member,0,4
2,Q08,My team leader consistently provides ample encouragement for embracing novel responsibilities and skill acquisition.,Takahashi,Sports Game Planning,General Member,0,4
2,Q09,My team leader's advocacy on my behalf presents a solid foundation for trust.,Takahashi,Sports Game Planning,General Member,0,4
2,Q10,Providing peers with clarification on my current conceptual direction is a straightforward endeavor.,Takahashi,Sports Game Planning,General Member,0,4
2,Q11,"I offer my perspectives on work topics with a deliberate and considered approach, focusing on providing actionable insights.",Takahashi,Sports Game Planning,General Member,0,4
2,Q12,"I am quite comfortable discussing personal matters with my peers, as I find shared experiences offer valuable perspectives.",Takahashi,Sports Game Planning,General Member,0,4
2,Q13,I feel adequately at liberty to express my notions concerning new ventures and operational adjustments to my colleagues.,Takahashi,Sports Game Planning,General Member,0,4
2,Q14,I would find expressing concerns about errors to my colleagues to be a challenging endeavor.,Takahashi,Sports Game Planning,General Member,0,4
2,Q15,I would feel comfortable offering constructive observations to a colleague when I notice an opportunity for refinement.,Takahashi,Sports Game Planning,General Member,0,4
2,Q16,My contributions are generally acknowledged by my colleagues.,Takahashi,Sports Game Planning,General Member,0,4
2,Q17,It presents a slight challenge to request assistance when in the midst of detailed personal ideation.,Takahashi,Sports Game Planning,General Member,0,4
2,Q18,"Information exchange among team members is generally functional, though there's a persistent opportunity for increased proactive communication.",Takahashi,Sports Game Planning,General Member,0,4
2,Q19,"Information sharing within the team presents a noticeable deficiency in proactive communication, though opportunistic exchanges do occur.",Takahashi,Sports Game Planning,General Member,0,4
2,Q20,Our team is operating with remarkable synergy as we pursue our performance objectives.,Takahashi,Sports Game Planning,General Member,0,4
2,Q21,I am content with the current level of team commitment to the task.,Takahashi,Sports Game Planning,General Member,0,4
2,Q22,"The aspirations for team performance present a clear divergence in approach, with some valuing methodical development and others favoring spontaneous ideation.",Takahashi,Sports Game Planning,General Member,0,4
2,Q23,The opportunities provided for enhancing individual capabilities are presently quite sufficient.,Takahashi,Sports Game Planning,General Member,0,4
3,Q01,Continuing my detailed exploration of this concept with Watanabe-san is my immediate priority.,Tanaka,Sports Game Planning,General Member,0,4
3,Q02,I communicate my work opinions with my team leader with a comfortable openness.,Tanaka,Sports Game Planning,General Member,0,4
3,Q03,"I feel quite comfortable discussing personal issues or disagreements with my team leader, as a thorough exploration of differing viewpoints often leads to valuable insights.",Tanaka,Sports Game Planning,General Member,0,4
3,Q04,I experience a comfortable sense of freedom to share my thoughts and recommendations with my team leader.,Tanaka,Sports Game Planning,General Member,0,4
3,Q05,"I would feel entirely comfortable discussing any missteps with my team leader, as our collaborative approach fosters an environment where thorough exploration of concepts is paramount.",Tanaka,Sports Game Planning,General Member,0,4
3,Q06,"I would feel comfortable addressing a colleague's mistake directly with our team leader, ensuring a constructive discussion.",Tanaka,Sports Game Planning,General Member,0,4
3,Q07,"My input is quite valued by my team leader when I voice my opinions, as demonstrated by the current collaborative focus on our shared ideas.",Tanaka,Sports Game Planning,General Member,0,4
3,Q08,"My team leader offers valuable guidance, encouraging exploration of novel responsibilities and skill acquisition.",Tanaka,Sports Game Planning,General Member,0,4
3,Q09,Watanabe-san's commitment to our focused discussion suggests a strong potential for her to advocate for our shared vision.,Tanaka,Sports Game Planning,General Member,0,4
3,Q10,It presents a favorable opportunity to engage with peers for clarification.,Tanaka,Sports Game Planning,General Member,0,4
3,Q11,"I communicate my opinions about work issues with my peers with complete candor, finding collaborative discussions exceptionally beneficial.",Tanaka,Sports Game Planning,General Member,0,4
3,Q12,"I find it beneficial to explore personal aspects of a project with my colleagues, especially when it strengthens our collaborative efforts.",Tanaka,Sports Game Planning,General Member,0,4
3,Q13,"I feel a strong sense of freedom to share my recommendations and ideas with my peers, especially Watanabe-san, as our collaborative exploration of new project concepts is proving remarkably fruitful.",Tanaka,Sports Game Planning,General Member,0,4
3,Q14,I would feel very comfortable voicing my errors to my colleagues.,Tanaka,Sports Game Planning,General Member,0,4
3,Q15,"I would feel quite safe speaking up to a colleague if I observed them making a mistake, as direct and honest communication is generally beneficial.",Tanaka,Sports Game Planning,General Member,0,4
3,Q16,"My contributions are acknowledged and carefully considered by my colleagues, especially when thoughtfully developed through focused discussion.",Tanaka,Sports Game Planning,General Member,0,4
3,Q17,Engaging with other team members for assistance presents a welcomed opportunity for collaborative growth and diverse input.,Tanaka,Sports Game Planning,General Member,0,4
3,Q18,"Our team maintains a robust exchange of work-related information, fostering a highly collaborative environment.",Tanaka,Sports Game Planning,General Member,0,4
3,Q19,"Our current information sharing, particularly between Watanabe-san and myself, feels genuinely substantive and allows for deep exploration before broader dissemination.",Tanaka,Sports Game Planning,General Member,0,4
3,Q20,"Our team demonstrates remarkable alignment in pursuing performance objectives, a synergy amplified by our shared reflective workstyles.",Tanaka,Sports Game Planning,General Member,0,4
3,Q21,I find our team's commitment to this task to be exceptionally strong and reassuring.,Tanaka,Sports Game Planning,General Member,0,4
3,Q22,"Watanabe-san and I share a strong alignment in our aspirations for the team's performance, stemming from our mutually beneficial reflective communication styles.",Tanaka,Sports Game Planning,General Member,0,4
3,Q23,"The current opportunities for improving personal performance are exceptionally adequate, fostering a deep and productive collaborative exploration of game concepts.",Tanaka,Sports Game Planning,General Member,0,4
4,Q01,It is somewhat challenging to ask my team leader when I have uncertainties regarding my work responsibilities.,Watanabe,Sports Game Planning,General Member,0,4
4,Q02,"I communicate my thoughts on work issues with my team leader with considerable openness, as I value direct and constructive dialogue.",Watanabe,Sports Game Planning,General Member,0,4
4,Q03,"I experience considerable difficulty in discussing personal issues or disagreements with my team leader, preferring to resolve such matters independently.",Watanabe,Sports Game Planning,General Member,0,4
4,Q04,"I feel quite comfortable sharing my suggestions, as my leader is always open to exploring novel concepts.",Watanabe,Sports Game Planning,General Member,0,4
4,Q05,I would feel quite comfortable raising concerns with my team leader regarding any missteps.,Watanabe,Sports Game Planning,General Member,0,4
4,Q06,"I would feel comfortable addressing a colleague's mistake with my team leader, as open discussion benefits our shared objectives.",Watanabe,Sports Game Planning,General Member,0,4
4,Q07,My contributions are consistently recognized and acted upon by my team leader.,Watanabe,Sports Game Planning,General Member,0,4
4,Q08,My team leader’s encouragement for me to undertake novel responsibilities or acquire new competencies is consistently present.,Watanabe,Sports Game Planning,General Member,0,4
4,Q09,Tanaka-san offers substantial support for our shared vision.,Watanabe,Sports Game Planning,General Member,0,4
4,Q10,It is quite easy to engage with colleagues for clarification regarding my responsibilities.,Watanabe,Sports Game Planning,General Member,0,4
4,Q11,"I offer my thoughts with a clear and direct approach, embracing a collaborative spirit with my peers.",Watanabe,Sports Game Planning,General Member,0,4
4,Q12,I find speaking about personal issues to my peers to be something I approach with considerable caution.,Watanabe,Sports Game Planning,General Member,0,4
4,Q13,I feel quite unhindered in sharing my suggestions and concepts with my colleagues regarding new projects or procedural adjustments.,Watanabe,Sports Game Planning,General Member,0,4
4,Q14,"I feel quite secure in expressing my errors to my colleagues, as our shared objective is the advancement of our projects.",Watanabe,Sports Game Planning,General Member,0,4
4,Q15,"I would feel very comfortable voicing concerns if I observed a colleague making an error, as collaborative problem-solving is beneficial.",Watanabe,Sports Game Planning,General Member,0,4
4,Q16,My contributions feel consistently appreciated and build upon the ideas of my colleagues.,Watanabe,Sports Game Planning,General Member,0,4
4,Q17,"Collaborating with Tanaka-san on the project's conceptualization is proving to be exceptionally productive, making further discussion with her the most logical and fruitful next step.",Watanabe,Sports Game Planning,General Member,0,4
4,Q18,"Tanaka-san and I are making excellent, shared progress on our current concepts, with her immediate engagement with my ideas proving particularly effective.",Watanabe,Sports Game Planning,General Member,0,4
4,Q19,"The current information sharing attempts present a substantial and valuable foundation for collaboration, especially with Tanaka-san.",Watanabe,Sports Game Planning,General Member,0,4
4,Q20,Our team is highly aligned in our shared objective of performance advancement.,Watanabe,Sports Game Planning,General Member,0,4
4,Q21,I am extremely pleased with Tanaka-san's profound engagement and the detailed exploration of our shared vision.,Watanabe,Sports Game Planning,General Member,0,4
4,Q22,"Tanaka-san and I demonstrate a superb alignment regarding our aspirations for the team's performance, indicating a strong shared vision for the project's success.",Watanabe,Sports Game Planning,General Member,0,4
4,Q23,"The opportunities provided for enhancing my personal performance are quite sufficient, allowing for meaningful growth and development.",Watanabe,Sports Game Planning,General Member,0,4
5,Q01,It is not challenging to approach Yamamoto with inquiries regarding my role.,Ito,Sports Game Planning,General Member,0,4
5,Q02,I can offer my perspectives with complete openness to my team leader regarding work matters.,Ito,Sports Game Planning,General Member,0,4
5,Q03,"I am perfectly comfortable discussing personal problems or disagreements with my team leader, as it facilitates a productive and transparent working environment.",Ito,Sports Game Planning,General Member,0,4
5,Q04,"I feel entirely unhindered in offering my suggestions for new projects or procedural modifications to my team leader, given the established collaborative environment.",Ito,Sports Game Planning,General Member,0,4
5,Q05,"I would feel quite safe speaking up to my team leader about a mistake, as I believe our team environment fosters open communication and learning from errors.",Ito,Sports Game Planning,General Member,0,4
5,Q06,"I would feel quite comfortable raising a concern about a colleague's mistake with the team leader, given the current project momentum.",Ito,Sports Game Planning,General Member,0,4
5,Q07,"Ito acknowledges Takahashi's proactive cross-departmental collaboration as an advantageous element for the project's conceptualization, finding it a fertile ground for his own intuitive ideation rather than a restrictive influence.",Ito,Sports Game Planning,General Member,0,4
5,Q08,Yamamoto's encouragement for new endeavors and learning opportunities is certainly present.,Ito,Sports Game Planning,General Member,0,4
5,Q09,Yamamoto's support is generally reliable for navigating company issues.,Ito,Sports Game Planning,General Member,0,4
5,Q10,It is exceptionally effortless to solicit guidance from my colleagues on matters pertaining to my professional responsibilities.,Ito,Sports Game Planning,General Member,0,4
5,Q11,"I can communicate my work opinions to my peers with an open disposition, embracing directness.",Ito,Sports Game Planning,General Member,0,4
5,Q12,I am quite comfortable expressing my thoughts on personal matters with my colleagues.,Ito,Sports Game Planning,General Member,0,4
5,Q13,"I feel comfortably empowered to share my thoughts with my peers, as their initial concept provides a stimulating, rather than limiting, foundation for my own intuitive contributions.",Ito,Sports Game Planning,General Member,0,4
5,Q14,"I would feel quite comfortable raising concerns with my peers, even if a misstep occurred during our collaborative efforts.",Ito,Sports Game Planning,General Member,0,4
5,Q15,I would feel completely comfortable highlighting a colleague's oversight if it impacts project progress.,Ito,Sports Game Planning,General Member,0,4
5,Q16,My contributions feel acknowledged and provide a useful foundation for further development.,Ito,Sports Game Planning,General Member,0,4
5,Q17,"Engaging with Takahashi and Suzuki for clarity on their ""intellectual sport"" concept is a promising avenue, and I anticipate their input will provide a solid foundation for my own intuitive ideation.",Ito,Sports Game Planning,General Member,0,4
5,Q18,People maintain a productive level of awareness regarding work-related developments.,Ito,Sports Game Planning,General Member,0,4
5,Q19,"The attempts to share information across the team demonstrate a significant level of proactive collaboration, especially with the cross-departmental engagement already underway, providing a robust foundation for further development.",Ito,Sports Game Planning,General Member,0,4
5,Q20,"Our department demonstrates a remarkable synergy in pursuing our performance objectives, with emerging collaborative sparks and a proactive approach to cross-functional ideation.",Ito,Sports Game Planning,General Member,0,4
5,Q21,I am satisfied with the team's commitment to exploring this unique concept.,Ito,Sports Game Planning,General Member,0,4
5,Q22,"My colleagues' aspirations for the team's performance are perfectly in sync with my own, offering a compelling path forward.",Ito,Sports Game Planning,General Member,0,4
5,Q23,"The opportunities provided are quite sufficient, offering a promising avenue for personal development.",Ito,Sports Game Planning,General Member,0,4
6,Q01,"Approaching my team leader with inquiries or uncertainties is a smooth process, fostering a productive environment.",Yamamoto,Sports Game Planning,Department Leader,0,4
6,Q02,I am fully comfortable expressing my opinions on work matters to my team leader.,Yamamoto,Sports Game Planning,Department Leader,0,4
6,Q03,"I feel quite comfortable discussing challenges with my team leader, as open communication fosters a productive environment.",Yamamoto,Sports Game Planning,Department Leader,0,4
6,Q04,I feel entirely unhindered in voicing recommendations and ideas for new projects or procedural changes to my team leader.,Yamamoto,Sports Game Planning,Department Leader,0,4
6,Q05,"I would feel quite safe speaking up to the team leader about a mistake, as honest communication fosters growth.",Yamamoto,Sports Game Planning,Department Leader,0,4
6,Q06,I would feel completely comfortable speaking to my department leader if I observed a colleague making an error.,Yamamoto,Sports Game Planning,Department Leader,0,4
6,Q07,"I appreciate the opportunity to share my insights; my department leader actively solicits and considers contributions from all team members, ensuring everyone's voice is heard.",Yamamoto,Sports Game Planning,Department Leader,0,4
6,Q08,My department leader fosters a climate where pursuing novel responsibilities and acquiring new skills is consistently encouraged.,Yamamoto,Sports Game Planning,Department Leader,0,4
