agent_id,question_id,answer_text,agent_name,dept,position,dept_id,pattern_id
6,Q09,My team leader provides valuable support when I encounter issues.,Yamamoto,Sports Game Planning,Department Leader,0,4
6,Q10,"My peers offer a reliable resource when questions arise, making collaboration straightforward.",Yamamoto,Sports Game Planning,Department Leader,0,4
6,Q11,I communicate my opinions about work issues with my peers with genuine openness.,Yamamoto,Sports Game Planning,Department Leader,0,4
6,Q12,I find it perfectly acceptable to discuss personal matters with my colleagues.,Yamamoto,Sports Game Planning,Department Leader,0,4
6,Q13,I feel quite at liberty to propose novel concepts and operational adjustments among my colleagues.,Yamamoto,Sports Game Planning,Department Leader,0,4
6,Q14,I would feel rather secure expressing my errors to my colleagues.,Yamamoto,Sports Game Planning,Department Leader,0,4
6,Q15,I would feel completely comfortable addressing a colleague about a mistake I observed.,Yamamoto,Sports Game Planning,Department Leader,0,4
6,Q16,I am confident that my contributions are highly regarded by my colleagues.,Yamamoto,Sports Game Planning,Department Leader,0,4
6,Q17,Facilitating a department-wide brainstorming session is the current focus to encourage open ideation.,Yamamoto,Sports Game Planning,Department Leader,0,4
6,Q18,"I observe a robust flow of information, fostering a collective understanding across the team.",Yamamoto,Sports Game Planning,Department Leader,0,4
6,Q19,The current information sharing efforts are genuinely conducive to a productive collaborative environment.,Yamamoto,Sports Game Planning,Department Leader,0,4
6,Q20,Our team demonstrates a strong sense of shared purpose and collaboration in achieving our performance objectives.,Yamamoto,Sports Game Planning,Department Leader,0,4
6,Q21,I am pleased with the high level of commitment our team is demonstrating.,Yamamoto,Sports Game Planning,Department Leader,0,4
6,Q22,"Our team members possess a unified aspiration for peak team performance, fostering an environment ripe for innovative contributions.",Yamamoto,Sports Game Planning,Department Leader,0,4
6,Q23,The opportunities this team provides for enhancing my personal performance are quite sufficient.,Yamamoto,Sports Game Planning,Department Leader,0,4
7,Q01,Clarifying the identity of Sasaki-san is a necessary step before proceeding with collaborative development.,Nakamura,Military / War Game Planning,General Member,1,4
7,Q02,"I will express my thoughts with candor, seeking clarification on team member identities to ensure collaborative understanding.",Nakamura,Military / War Game Planning,General Member,1,4
7,Q03,I maintain a considerable degree of reservation when it comes to discussing personal challenges or points of contention with my team leader.,Nakamura,Military / War Game Planning,General Member,1,4
7,Q04,I find myself with ample opportunity to share recommendations and ideas for new projects or procedural changes with my team leader.,Nakamura,Military / War Game Planning,General Member,1,4
7,Q05,I would feel a significant level of discomfort expressing an error to my team leader.,Nakamura,Military / War Game Planning,General Member,1,4
7,Q06,"It is prudent to ensure clarity on the specific individual involved in collaboration, especially when there is an unfamiliar name, before proceeding.",Nakamura,Military / War Game Planning,General Member,1,4
7,Q07,"My contributions receive substantial consideration from my team leader, fostering a productive dialogue.",Nakamura,Military / War Game Planning,General Member,1,4
7,Q08,My team leader offers substantial encouragement for exploring novel responsibilities and acquiring unfamiliar proficiencies.,Nakamura,Military / War Game Planning,General Member,1,4
7,Q09,The team leader's support in advocating for my concerns is something I find to be rather uncertain.,Nakamura,Military / War Game Planning,General Member,1,4
7,Q10,"Clarifying who Sasaki-san is, or if Yoshida-san was intended, is a necessary step for effective collaboration, and I am confident in asking Kato-san for this information to ensure we are all aligned.",Nakamura,Military / War Game Planning,General Member,1,4
7,Q11,"I communicate my opinions with my peers with a considerable degree of openness, especially when I recognize a shared analytical approach.",Nakamura,Military / War Game Planning,General Member,1,4
7,Q12,I prefer to maintain a professional distance regarding personal matters with colleagues.,Nakamura,Military / War Game Planning,General Member,1,4
7,Q13,I find myself with ample freedom to voice my recommendations and ideas regarding new projects and procedural adjustments among my peers.,Nakamura,Military / War Game Planning,General Member,1,4
7,Q14,"I would feel quite comfortable raising a mistake with my peers, as our shared reflective approach fosters an environment where learning from missteps is a valued part of our process.",Nakamura,Military / War Game Planning,General Member,1,4
7,Q15,I would feel comfortable pointing out a colleague's error to foster a more accurate outcome.,Nakamura,Military / War Game Planning,General Member,1,4
7,Q16,My contributions are certainly appreciated when my colleagues understand the underlying strategic reasoning.,Nakamura,Military / War Game Planning,General Member,1,4
7,Q17,"Clarifying the involvement of an unknown colleague like Sasaki-san presents a considerable challenge, though collaboration with familiar team members like Kato is remarkably straightforward.",Nakamura,Military / War Game Planning,General Member,1,4
7,Q18,A clear understanding of who is involved in discussions is essential for collaborative progress.,Nakamura,Military / War Game Planning,General Member,1,4
7,Q19,"The information sharing appears to possess significant depth, with a focus on aligning fundamental concepts before proceeding.",Nakamura,Military / War Game Planning,General Member,1,4
7,Q20,"My team demonstrates a solid alignment in its pursuit of performance objectives, with the occasional need for clarifying participant identities.",Nakamura,Military / War Game Planning,General Member,1,4
7,Q21,"I find the team's commitment to exploring the fundamental aspects of conflict and strategy quite encouraging, though I would prefer clarification on the individuals involved in our collaborative process.",Nakamura,Military / War Game Planning,General Member,1,4
7,Q22,"Kato's aspirations align agreeably with my own, though I will require clarification regarding the involvement of an individual named Sasaki.",Nakamura,Military / War Game Planning,General Member,1,4
7,Q23,The current opportunities provide a workable foundation for enhancing my performance through collaborative reflection with colleagues like Kato.,Nakamura,Military / War Game Planning,General Member,1,4
8,Q01,"My leader fosters an environment where I feel comfortable asking him questions, making it easy.",Kobayashi,Military / War Game Planning,General Member,1,4
8,Q02,"I communicate my opinions with Yamaguchi-san with exceptional openness, as our current brainstorming dynamic allows for complete unfiltered expression.",Kobayashi,Military / War Game Planning,General Member,1,4
8,Q03,"I am entirely comfortable discussing any personal issues or disagreements with my team leader, as I value open communication and collaborative problem-solving.",Kobayashi,Military / War Game Planning,General Member,1,4
8,Q04,"I feel a complete freedom to vocalize recommendations and ideas to my team leader, an environment that genuinely encourages exploration.",Kobayashi,Military / War Game Planning,General Member,1,4
8,Q05,I would feel completely safe speaking up to my team leader about a mistake; the atmosphere fosters open expression.,Kobayashi,Military / War Game Planning,General Member,1,4
8,Q06,I would feel quite comfortable raising concerns with Yamaguchi-san if I observed a colleague making an error.,Kobayashi,Military / War Game Planning,General Member,1,4
8,Q07,My contributions are clearly recognized and amplified by my team leader during our collaborative sessions.,Kobayashi,Military / War Game Planning,General Member,1,4
8,Q08,Yamaguchi-san actively cultivates an environment where we can explore novel concepts and expand our creative boundaries.,Kobayashi,Military / War Game Planning,General Member,1,4
8,Q09,"Yamaguchi-san's willingness to engage in unfiltered brainstorming indicates a strong advocacy for innovative ideas, suggesting he would be a dependable supporter.",Kobayashi,Military / War Game Planning,General Member,1,4
8,Q10,"My interaction with peers regarding questions or uncertainties is an unhindered flow, a testament to our shared project vision.",Kobayashi,Military / War Game Planning,General Member,1,4
8,Q11,"My communication with peers flows with a directness that embraces immediate, unfiltered ideation, especially when aligned with a shared creative momentum.",Kobayashi,Military / War Game Planning,General Member,1,4
8,Q12,I am perfectly at ease discussing personal matters with my peers.,Kobayashi,Military / War Game Planning,General Member,1,4
8,Q13,"I feel a profound sense of liberation when sharing recommendations and ideas with my peers, enabling a truly dynamic exchange.",Kobayashi,Military / War Game Planning,General Member,1,4
8,Q14,"I feel completely at ease sharing any missteps with my peers, as open discussion is essential for our collective advancement.",Kobayashi,Military / War Game Planning,General Member,1,4
8,Q15,I would feel completely comfortable raising concerns with a colleague when I observe an error.,Kobayashi,Military / War Game Planning,General Member,1,4
8,Q16,My input is consistently recognized and amplified by my peers when I share my thoughts.,Kobayashi,Military / War Game Planning,General Member,1,4
8,Q17,"Collaborating on concept generation with Yamaguchi-san feels remarkably fluid, and I anticipate that bringing in Nakamura-san, Kato-san, and Yamada-san later will add valuable depth to our ideas.",Kobayashi,Military / War Game Planning,General Member,1,4
8,Q18,"Yamaguchi-san and I possess a remarkable synergy, allowing for a highly effective and uninhibited exchange of ideas, which I find exceptionally invigorating.",Kobayashi,Military / War Game Planning,General Member,1,4
8,Q19,"The team's information sharing currently favors a more concentrated, collaborative approach between select individuals rather than broad dissemination.",Kobayashi,Military / War Game Planning,General Member,1,4
8,Q20,"Yamaguchi-san and I are currently experiencing a singular focus on generating uninhibited concepts, making our immediate collaboration exceptionally strong.",Kobayashi,Military / War Game Planning,General Member,1,4
8,Q21,I find our team's current commitment level exceedingly satisfactory.,Kobayashi,Military / War Game Planning,General Member,1,4
8,Q22,"My aspirations for team performance align exceptionally well with Yamaguchi-san's, fostering a rapid and creatively unrestrained initial phase.",Kobayashi,Military / War Game Planning,General Member,1,4
8,Q23,"The opportunities for improving my personal performance are wonderfully abundant, allowing for significant growth.",Kobayashi,Military / War Game Planning,General Member,1,4
9,Q01,Engaging with my team leader on inquiries or uncertainties within my role presents a straightforward interaction.,Kato,Military / War Game Planning,General Member,1,4
9,Q02,"I express my thoughts with confidence, appreciating the opportunity to share my perspectives with our team leader.",Kato,Military / War Game Planning,General Member,1,4
9,Q03,I feel a sense of unease sharing personal challenges with my team leader.,Kato,Military / War Game Planning,General Member,1,4
9,Q04,I find the environment provides ample space for me to voice my recommendations and ideas to my team leader.,Kato,Military / War Game Planning,General Member,1,4
9,Q05,I would feel completely secure sharing any error with my team leader given our current alignment.,Kato,Military / War Game Planning,General Member,1,4
9,Q06,I would feel somewhat hesitant to immediately speak up directly to a team leader about a colleague's mistake.,Kato,Military / War Game Planning,General Member,1,4
9,Q07,I perceive my contributions are well-regarded by my team leader when I articulate my perspectives.,Kato,Military / War Game Planning,General Member,1,4
9,Q08,My team leader provides consistent encouragement for exploring novel responsibilities and acquiring unfamiliar proficiencies.,Kato,Military / War Game Planning,General Member,1,4
9,Q09,My team leader offers dependable support when I encounter workplace challenges.,Kato,Military / War Game Planning,General Member,1,4
9,Q10,"I possess a certain confidence in my ability to discuss any queries with my colleagues, given our shared commitment to a thorough and considered approach.",Kato,Military / War Game Planning,General Member,1,4
9,Q11,"I am able to communicate my opinions with my peers with a significant degree of openness, as I value the collaborative synthesis of diverse viewpoints.",Kato,Military / War Game Planning,General Member,1,4
9,Q12,I find sharing personal matters with colleagues is a rather private affair.,Kato,Military / War Game Planning,General Member,1,4
9,Q13,I experience a significant degree of freedom when sharing my thoughts with my peers on project directions.,Kato,Military / War Game Planning,General Member,1,4
9,Q14,I would feel quite secure voicing any missteps to my colleagues given our shared commitment to a thoughtful and thorough development process.,Kato,Military / War Game Planning,General Member,1,4
9,Q15,I would feel quite secure voicing my observations regarding a colleague's potential misstep.,Kato,Military / War Game Planning,General Member,1,4
9,Q16,My contributions are met with genuine consideration from my colleagues.,Kato,Military / War Game Planning,General Member,1,4
9,Q17,Seeking assistance from Sasaki-san and Nakamura-san on this project presents a straightforward opportunity for shared understanding.,Kato,Military / War Game Planning,General Member,1,4
9,Q18,"Our team possesses a substantial capacity for sharing information, fostering a thorough understanding among members.",Kato,Military / War Game Planning,General Member,1,4
9,Q19,The team's information sharing efforts present a genuine and substantial foundation for collaboration.,Kato,Military / War Game Planning,General Member,1,4
9,Q20,"Our team exhibits a unified front in pursuit of our performance objectives, with a shared appreciation for a considered and collaborative approach.",Kato,Military / War Game Planning,General Member,1,4
9,Q21,I am quite content with our team's dedication to this endeavor.,Kato,Military / War Game Planning,General Member,1,4
9,Q22,"My colleagues' aspirations for team performance seem to harmonize with my own goals, creating a promising foundation for our collaborative efforts.",Kato,Military / War Game Planning,General Member,1,4
9,Q23,The current team structure provides a commendable platform for refining my performance.,Kato,Military / War Game Planning,General Member,1,4
10,Q01,"Approaching Yamaguchi-san with inquiries feels quite straightforward, fostering a productive dialogue.",Yoshida,Military / War Game Planning,General Member,1,4
10,Q02,I find it completely natural to express my views on work matters directly with our team leader.,Yoshida,Military / War Game Planning,General Member,1,4
10,Q03,I experience a substantial level of discomfort discussing personal issues or disagreements with our team leader.,Yoshida,Military / War Game Planning,General Member,1,4
10,Q04,"I feel entirely at liberty to propose novel concepts and procedural adjustments to my team leader, Yamaguchi-san.",Yoshida,Military / War Game Planning,General Member,1,4
10,Q05,"I would feel quite comfortable raising concerns about potential missteps with my team leader, as I believe open communication is a valuable asset for team progress.",Yoshida,Military / War Game Planning,General Member,1,4
10,Q06,"I would feel considerably secure discussing a colleague's error with our team leader, as transparency fosters improvement within the department.",Yoshida,Military / War Game Planning,General Member,1,4
10,Q07,My input is consistently acknowledged and considered by Yamaguchi-san.,Yoshida,Military / War Game Planning,General Member,1,4
10,Q08,Yamaguchi-san provides an environment that fosters growth and exploration of new challenges.,Yoshida,Military / War Game Planning,General Member,1,4
10,Q09,Yamaguchi-san's support for novel approaches is something I value.,Yoshida,Military / War Game Planning,General Member,1,4
10,Q10,It would be quite simple to approach colleagues with any uncertainties I might encounter in my position.,Yoshida,Military / War Game Planning,General Member,1,4
10,Q11,"I communicate my opinions with my peers with a comfortable openness, finding alignment on strategic concepts quite straightforward.",Yoshida,Military / War Game Planning,General Member,1,4
10,Q12,I generally find discussing personal matters with colleagues to be a comfortable experience.,Yoshida,Military / War Game Planning,General Member,1,4
10,Q13,I feel quite unhindered in sharing my recommendations with my peers.,Yoshida,Military / War Game Planning,General Member,1,4
10,Q14,"I would feel confident sharing my errors with my peers, as we are all working towards a common objective.",Yoshida,Military / War Game Planning,General Member,1,4
10,Q15,I would feel completely comfortable voicing my observations about a colleague's error.,Yoshida,Military / War Game Planning,General Member,1,4
10,Q16,"My contributions are perceived with significant appreciation by my colleagues, fostering a spirit of mutual respect.",Yoshida,Military / War Game Planning,General Member,1,4
10,Q17,Seeking assistance from colleagues presents a moderate challenge.,Yoshida,Military / War Game Planning,General Member,1,4
10,Q18,I find that communication regarding work-related issues within the team is rather sparse.,Yoshida,Military / War Game Planning,General Member,1,4
10,Q19,"Our team's information sharing possesses a profound depth, consistently illuminating genuine understanding.",Yoshida,Military / War Game Planning,General Member,1,4
10,Q20,"My team exhibits a remarkable unity in pursuing performance objectives, with a shared perspective on exploring nuanced aspects of conflict.",Yoshida,Military / War Game Planning,General Member,1,4
10,Q21,"I am immensely pleased with our team's dedication to this task, as our shared perspective guarantees efficient progress.",Yoshida,Military / War Game Planning,General Member,1,4
10,Q22,"My team members' aspirations for team performance are entirely aligned with my own, providing an excellent basis for our progress.",Yoshida,Military / War Game Planning,General Member,1,4
10,Q23,"The current opportunities provide a robust framework for enhancing my personal performance, particularly through synergistic alignment with Yamada-san's reflective approach.",Yoshida,Military / War Game Planning,General Member,1,4
11,Q01,I find it quite simple to approach my team leader with inquiries or uncertainties regarding my role.,Yamada,Military / War Game Planning,General Member,1,4
11,Q02,"I communicate my work opinions with my team leader with complete candor, finding no impediment to expressing my unfiltered thoughts.",Yamada,Military / War Game Planning,General Member,1,4
11,Q03,"I feel a great deal of comfort discussing personal issues or disagreements with my team leader, given our aligned perspectives and collaborative approach.",Yamada,Military / War Game Planning,General Member,1,4
11,Q04,I experience considerable freedom to voice recommendations and innovative concepts regarding new projects and procedural adjustments to my team leader.,Yamada,Military / War Game Planning,General Member,1,4
11,Q05,I would feel completely comfortable discussing any missteps with my team leader.,Yamada,Military / War Game Planning,General Member,1,4
11,Q06,"I would feel secure speaking up to my team leader if I observed a colleague making an error, as open communication is beneficial.",Yamada,Military / War Game Planning,General Member,1,4
11,Q07,"My input is genuinely appreciated by my team leader, fostering a comfortable environment for sharing ideas.",Yamada,Military / War Game Planning,General Member,1,4
11,Q08,Our team leader provides a constructive environment for exploring novel responsibilities and skill acquisition.,Yamada,Military / War Game Planning,General Member,1,4
11,Q09,"Yamaguchi-san possesses a dependable capacity to champion employee concerns, although her focus on project progression sometimes overshadows individual issues.",Yamada,Military / War Game Planning,General Member,1,4
11,Q10,"It is very easy for me to approach my colleagues with inquiries, as open communication is a constant in our department.",Yamada,Military / War Game Planning,General Member,1,4
11,Q11,I express my opinions to my peers with a directness that ensures clarity.,Yamada,Military / War Game Planning,General Member,1,4
11,Q12,"I find it preferable to maintain professional discourse, reserving personal matters for separate avenues.",Yamada,Military / War Game Planning,General Member,1,4
11,Q13,I feel entirely comfortable sharing recommendations and ideas with my peers.,Yamada,Military / War Game Planning,General Member,1,4
11,Q14,I would feel completely safe speaking up to my peers if I made a mistake on this team.,Yamada,Military / War Game Planning,General Member,1,4
11,Q15,"I would feel entirely comfortable pointing out an error to a colleague, as open communication fosters growth.",Yamada,Military / War Game Planning,General Member,1,4
11,Q16,"I perceive my contributions as highly regarded by my peers, particularly Yoshida-san, given our alignment in thought and approach.",Yamada,Military / War Game Planning,General Member,1,4
11,Q17,"Approaching Yoshida-san for assistance on project-related matters is a truly uncomplicated process, as our shared thinking styles create a remarkably synergistic environment for idea development.",Yamada,Military / War Game Planning,General Member,1,4
11,Q18,We cultivate a strong environment for sharing work-related information amongst ourselves.,Yamada,Military / War Game Planning,General Member,1,4
11,Q19,Our team's information sharing endeavors possess a truly profound and substantive quality.,Yamada,Military / War Game Planning,General Member,1,4
11,Q20,"Yoshida-san and I exhibit a strong synergy, fostering a highly cohesive environment for our project's progression.",Yamada,Military / War Game Planning,General Member,1,4
11,Q21,I am satisfied with the current level of commitment demonstrated by my team.,Yamada,Military / War Game Planning,General Member,1,4
11,Q22,Yoshida-san’s aspirations for team performance demonstrate complete alignment with my own reflective approach.,Yamada,Military / War Game Planning,General Member,1,4
11,Q23,The opportunities provided by this team are entirely sufficient for my personal performance enhancement.,Yamada,Military / War Game Planning,General Member,1,4
12,Q01,"It would be straightforward to engage my team leader with any work-related uncertainties, as I am accustomed to seeking clarification when needed.",Sasaki,Military / War Game Planning,General Member,1,4
12,Q02,"I express my perspectives directly, focusing on the collaborative establishment of our departmental foundation before introducing broader team involvement.",Sasaki,Military / War Game Planning,General Member,1,4
12,Q03,"I find discussing personal problems or disagreements with my team leader to be a neutral experience, as I prefer to address work-related issues directly and keep personal matters separate.",Sasaki,Military / War Game Planning,General Member,1,4
12,Q04,I feel quite a degree of freedom to voice my recommendations and ideas with Kato-san.,Sasaki,Military / War Game Planning,General Member,1,4
12,Q05,"I would feel somewhat apprehensive speaking up to my team leader about a mistake, as I prefer to thoroughly analyze situations before sharing.",Sasaki,Military / War Game Planning,General Member,1,4
12,Q06,I would feel quite comfortable expressing my observations regarding a colleague's potential misstep to our team leader.,Sasaki,Military / War Game Planning,General Member,1,4
12,Q07,My input feels valued when our core departmental direction is established first before exploring external collaborations.,Sasaki,Military / War Game Planning,General Member,1,4
12,Q08,My team leader offers substantial encouragement for embracing novel responsibilities and acquiring new skills.,Sasaki,Military / War Game Planning,General Member,1,4
12,Q09,The dependable nature of my team leader as an advocate for my concerns remains largely unknown to me at this juncture.,Sasaki,Military / War Game Planning,General Member,1,4
12,Q10,It is not difficult to seek clarification from my colleagues regarding my role.,Sasaki,Military / War Game Planning,General Member,1,4
12,Q11,I find it beneficial to first establish a shared understanding within our immediate department before expanding the discussion to external colleagues.,Sasaki,Military / War Game Planning,General Member,1,4
12,Q12,"I am perfectly comfortable sharing my personal issues with my peers, but only when the situation truly warrants it.",Sasaki,Military / War Game Planning,General Member,1,4
12,Q13,I feel quite unhindered to share my thoughts with my peers on project directions and process improvements.,Sasaki,Military / War Game Planning,General Member,1,4
12,Q14,"I would feel quite safe speaking up about a mistake, as open communication is a valuable asset.",Sasaki,Military / War Game Planning,General Member,1,4
