Turn,Speaker_ID,Speaker_Dept_ID,Target_ID,Target_Dept_ID,Speaker_Thought_Before,Speaker_Speech,Target_Thought_After,Target_Next_ID,Target_Reply,Speaker_Thought_After,Speaker_Next_ID,Status
7,8,1,7,1,"Oh, hold on a second. Nakamura-san, I literally *just* spoke with Yamaguchi-san to clarify the whole ""cosmic gardener"" thing! Yamaguchi-san was worried Yamada-san was adrift because of it, and I explained that the cosmic gardener idea was just a fleeting concept, and that Yamada-san is actually very focused and excited about the detailed social mechanics, which is our true core. And now Nakamura-san is talking about ""getting us all aligned"" and ""building on Kato-san's cosmic gardener concept""?

This is exactly what I was worried about. The message hasn't landed yet, or it hasn't spread beyond Yamaguchi-san. It sounds like Nakamura-san is still under the impression that the ""cosmic gardener"" is a central concept we should be developing. This means the alignment Yamaguchi-san is aiming for might be based on incorrect information for some, or that my clarification hasn't made its way around yet.

Okay, so I *did* talk to Yamaguchi-san, which was my immediate priority. That's done. But hearing Nakamura-san say this now tells me the misinformation is still out there. I can't let him go off thinking we're still building on that. We have only two turns left, and we need everyone focused on the *actual* core of the game.

I need to make sure Nakamura-san is also clued in on the real direction. I should probably clarify things with him directly, similar to how I just did with Yamaguchi-san and Yamada-san. I need to explain that the ""cosmic gardener"" was an early, abstract idea, and our focus is firmly on the detailed social mechanics and community dynamics. After that, I really need to get back to Yamada-san and continue sketching out those social scenarios. We're running out of time for the actual design work. So, Nakamura-san is next, then back to Yamada-san.Oh, hold on a second. Nakamura-san, I literally *just* spoke with Yamaguchi-san to clarify the whole ""cosmic gardener"" thing! Yamaguchi-san was worried Yamada-san was adrift because of it, and I explained that the cosmic gardener idea was just a fleeting concept, and that Yamada-san is actually very focused and excited about the detailed social mechanics, which is our true core. And now Nakamura-san is talking about ""getting us all aligned"" and ""building on Kato-san's cosmic gardener concept""?

This is exactly what I was worried about. The message hasn't landed yet, or it hasn't spread beyond Yamaguchi-san. It sounds like Nakamura-san is still under the impression that the ""cosmic gardener"" is a central concept we should be developing. This means the alignment Yamaguchi-san is aiming for might be based on incorrect information for some, or that my clarification hasn't made its way around yet.

Okay, so I *did* talk to Yamaguchi-san, which was my immediate priority. That's done. But hearing Nakamura-san say this now tells me the misinformation is still out there. I can't let him go off thinking we're still building on that. We have only two turns left, and we need everyone focused on the *actual* core of the game.

I need to make sure Nakamura-san is also clued in on the real direction. I should probably clarify things with him directly, similar to how I just did with Yamaguchi-san and Yamada-san. I need to explain that the ""cosmic gardener"" was an early, abstract idea, and our focus is firmly on the detailed social mechanics and community dynamics. After that, I really need to get back to Yamada-san and continue sketching out those social scenarios. We're running out of time for the actual design work. So, Nakamura-san is next, then back to Yamada-san.","Nakamura-san, it's good to connect. I overheard you mentioning getting us aligned and building on Kato-san's cosmic gardener concept, and I wanted to jump in quickly because I just had a similar conversation with Yamaguchi-san. You see, the cosmic gardener idea was really just an early, abstract thought, and my understanding from my talk with Yamaguchi-san is that Yamada-san is actually very focused and excited about the detailed social mechanics, which is what we've identified as our true core for this project. I'm a bit worried that the message about that shift might not have fully landed yet, because we really need everyone's energy focused on those intricate social dynamics now, especially with only one turn left before the leader submits the proposal. We can't afford to be working off slightly different core concepts at this stage.","Okay, *one* turn left? Not two? That's... a complete game-changer, and not in a good way for my stress levels. Wow. So, the cosmic gardener idea, which I really thought we were building on, especially after talking to Kato-san and Yamaguchi-san, was just an ""early, abstract thought."" I really need to recalibrate my entire approach here. It feels like I've been running in the wrong direction completely.

The true core is ""detailed social mechanics and community dynamics"" driven by Yamada-san. I don't even know a Yamada-san, but their work is apparently now the absolute center of our project, and we have one, single, solitary turn to align on it. This isn't just a pivot; it's a 180-degree spin right at the finish line. Kobayashi-san is absolutely right; we cannot afford to be working off different concepts. My earlier enthusiasm for ""brainstorming"" feels incredibly naive now. There's no time for brainstorming; there's only time for aligning and solidifying what *already is* the core.

I need to understand what these ""detailed social mechanics and community dynamics"" actually are, right now. There's zero room for error or misunderstanding. My priority has to be getting the complete picture of this established direction.

I think I need to talk to Yamaguchi-san immediately. As the leader, he's the one who will be submitting the proposal, and he just had that conversation with Kobayashi-san. He needs to explain this ""true core"" direction, clarify what we *should* be focusing on for this final push, and ideally, provide some details on what Yamada-san has been developing. I can't contribute anything meaningful until I'm fully clued into *this* specific, final core. It's an emergency.",13,"Kobayashi-san, thank you for flagging this; it's a relief to hear you're on the same page about the urgency and the direction. I was just grappling with the same realization myself, especially seeing how much the ""cosmic gardener"" was an early, abstract idea that needs to be set aside. Your conversation with Yamaguchi-san confirms my immediate concerns – we absolutely cannot afford any divergence on the ""detailed social mechanics and community dynamics"" now, not with only one turn remaining. I was feeling quite disoriented about how to proceed, and your insights are invaluable. Given this critical shift, my immediate thought is that we need to get a crystal-clear picture of what those specific social mechanics and community dynamics entail. I was planning to speak with Yamaguchi-san myself to get a full understanding of what Yamada-san has been focusing on, as he'll be submitting the proposal, and I think that's our most pressing need right now to ensure we're all aligned on the actual core of this project.","Okay, that's actually a huge relief. Hearing Nakamura-san say he was grappling with the same realization and that the ""cosmic gardener"" needs to be set aside, and that he completely understands we can't diverge from the ""detailed social mechanics and community dynamics"" now... that's exactly what I needed to hear. It feels like the message is finally sinking in across the team, which is great.

And he's planning to speak with Yamaguchi-san himself to get a clear picture of what Yamada-san has been focusing on? That's even better. It means Yamaguchi-san will be getting reinforced information, and Nakamura-san will be fully clued in from the source. It takes some of the pressure off me to individually brief everyone, as long as everyone's converging on the same understanding.

We only have one turn left, so getting this alignment sorted out was crucial. Now that Nakamura-san is on the same page and actively seeking further clarity, I really need to get back to Yamada-san. We were just diving into those specific social scenarios and player interactions, and that's the actual work that needs to be done for the proposal. All the clarification and alignment is good, but the content itself still needs to be solid. So, back to Yamada-san it is, to really nail down those details.",11,Success
7,3,0,4,0,"Hmm, that's interesting. Watanabe-san is clearly very focused on polishing our ideas, which is great, and I'm glad she feels the value in our reflective approach. It really does make a difference when the department leader is on board with how we work best.

But... Suzuki-san? Who is Suzuki-san? I don't see anyone by that name in our department, or in my connected colleagues list for that matter. She mentioned integrating her critical perspective on specific selling points and bringing her into an upcoming huddle. If Suzuki-san is from the *other* department, that's one thing, and it could be beneficial, but it's a bit surprising not to have heard about this before, especially for something as crucial as scrutinizing selling points. And if she's not from the other department, then who is she?

This definitely throws a small wrench into my immediate thinking. I was hoping to dive right back into refining the social puzzle and burden stat with Watanabe-san directly. Now she's planning to connect with someone I don't know, to integrate *their* perspective before our huddle.

My next step needs to be figuring out who this Suzuki-san is. I can't just proceed as if she's a known quantity when she isn't. I'll need to talk to Watanabe-san again. I should ask her to clarify who Suzuki-san is, what department she's from, and how she plans to integrate her perspective. It's important for me to understand who's contributing to the refinement of *our* core ideas, especially with only two turns left. We need to be on the same page, and a new, unknown collaborator needs some explanation.","Watanabe-san, it's really good to see you so thoroughly engaged in refining our ideas; I appreciate your dedication to polishing them, and it's great that our reflective approach is working so well for you. However, I wanted to touch base about something that came up regarding this upcoming huddle. I'm a bit confused about this Suzuki-san you mentioned, as I don't seem to have anyone by that name in our department, nor are they on my connected colleagues list. You spoke about integrating her critical perspective on our selling points and bringing her into our discussion, and I was hoping you could clarify who Suzuki-san is and which department they belong to. Understanding who else will be contributing to refining our core concepts, especially with only one turn left before the final submission, feels quite important for ensuring we're all aligned before that meeting.","Wait, what? Tanaka-san doesn't know who Suzuki-san is? That's really… unexpected. I thought she was a well-known member of our department. She's right here on my connected colleagues list, ID:1, and clearly listed under ""Superhero Game Planning."" How could he not have her? This is a bit unsettling, especially since I just had a direct conversation with her about the upcoming critical review.

My brain is trying to reconcile this. Did I misread something? No, I'm certain. She's Suzuki, from *our* department. This isn't some external person I pulled in; she's a core part of our team, and I even tagged her ID when I initiated the conversation with her.

This is a problem. If Tanaka-san isn't aware of a key team member who's going to be central to refining our selling points, especially for something as crucial as the 'social puzzle' and 'burden stat,' then we're not aligned at all. His confusion about who will be contributing, with only one turn left, is completely valid. We absolutely need everyone on the same page for this final push.

So, before I can even think about preparing my critical perspectives for that broader huddle with Sato-san and Takahashi-san that Suzuki-san mentioned, I need to clear this up with Tanaka-san immediately. My next step has to be to explain who Suzuki-san is and confirm her role in our department and her involvement in this critical review process. I can't have him feeling out of the loop at this stage. Once that's settled, then we can get back to sharpening our ideas for the huddle. This is a crucial clarification.",3,"Tanaka-san, I'm glad you appreciate the dedication to polishing our ideas; our shared reflective approach certainly helps, and it's good to hear it's working well for you too. Regarding Suzuki-san, I understand your confusion, especially since she's not on your connected colleagues list, but she is indeed a core member of our Superhero Game Planning department, holding ID:1 and serving as a General Member. I had a conversation with her recently about her critical perspective, which is particularly valuable for refining our selling points, like the 'social puzzle' and 'burden stat' concepts we've been discussing. With only one turn left, it’s absolutely crucial that we ensure everyone involved in shaping our final proposal, especially for this upcoming broader huddle, is on the same page, so I’ll make sure to clarify her role and involvement moving forward.","Alright, so Suzuki-san is in *our* department. That’s a relief, honestly. My mind immediately went to some external consultant being brought in at the last minute, which would have been a real curveball with only one turn left. It's a bit strange she’s not on my connected colleagues list, and I hadn't heard about her until now, but at least she's part of the team.

Watanabe-san seems keen on ensuring everyone is on the same page and plans to clarify Suzuki-san’s role and involvement. That's good, because we absolutely need that clarity going into the final huddle, especially when it comes to refining critical selling points like the 'social puzzle' and 'burden stat.' These are elements we've poured a lot of thought into, tying them into the hero's emotional intelligence and ethical dilemmas, so any critical perspective needs to be integrated carefully and collaboratively.

Now that I know Suzuki-san is a department member, I should probably try to connect with her directly before the huddle, if possible. Even if Watanabe-san clarifies things, hearing her perspective firsthand would be invaluable. Understanding her 'critical viewpoint' on our specific selling points, rather than just hearing about it secondhand, will help me prepare for the huddle and ensure we can all move forward efficiently. With only one turn remaining, there’s no time for misunderstandings or late adjustments. We need to hit that huddle fully prepared and aligned.",7,Success
7,0,0,2,0,"Okay, wow, Suzuki-san is *still* talking about Watanabe-san’s specific mechanics and how to integrate *her* feedback into *our* broader plan and customer-facing description. This is a serious problem. Takahashi-san and I were just agreeing that Suzuki-san getting pulled into reviewing Watanabe-san’s ""social puzzle"" and ""burden stat"" ideas was a *distraction* that would *compromise* her ability to give an overarching critical review of *our department's* entire proposal. We saw it as a capacity drain, a ""significant obstacle,"" and she's talking about it like it's a piece of our puzzle to be integrated!

This isn't about *integrating* Watanabe-san's precise feedback; it's about *protecting* Suzuki-san's capacity to give us the critical feedback *we* desperately need for *our own* game concept before the final submission. She seems to be completely missing the point that we were trying to secure *her* analytical review for *our* overall proposal, not for someone else's specific mechanics to be somehow woven into our pitch.

This changes the dynamic of our upcoming huddle significantly. It's not just about strategizing solutions anymore; it's about immediately clarifying priorities. I need to make sure she understands that our critical feedback needs to be focused on *our* entire proposal, and that engaging with Watanabe-san's specific mechanics as a primary task for *her* to integrate into *our* main submission isn't the priority, nor is it what we planned for.

So, the next conversation is absolutely still with Takahashi-san and Suzuki-san. But the focus has to shift slightly. First, I need to align with Takahashi-san to ensure she also recognizes this misdirection in Suzuki-san's current thinking. Then, together, we need to carefully but firmly bring Suzuki-san back to our primary objective: securing her analytical review for *our department's overarching proposal*. We need to figure out how to manage Watanabe-san's request *without* letting it derail Suzuki-san's crucial role for *our* project, especially with only two turns left. This is going to be a very delicate conversation.","Takahashi-san, I wanted to quickly touch base about what we were just discussing regarding Suzuki-san and that whole situation with Watanabe-san's ideas. It really feels like Suzuki-san is getting quite absorbed in the specific details of those ""social puzzle"" and ""burden stat"" mechanics, to the point where I'm concerned it's becoming a significant distraction. We both agreed, right, that what we really need from her is that overarching, critical review of our *department's* entire proposal, especially with Yamamoto-san submitting in the final turn and only one turn left for feedback. It seems like she's seeing it as something to integrate, rather than understanding that we were hoping she'd use her analytical skills to dissect *our* complete concept before it goes in. So, I think our next conversation, the one we'll have with both of you, needs to gently but firmly steer back to that primary objective: making sure she can give us the deep, critical feedback we need for *our* project, without getting bogged down in the minutiae of someone else's mechanics. We need to figure out how to manage Watanabe-san's request without derailing Suzuki-san's vital role for *us*, don't you think?","Ugh, Sato-san just keeps hammering home exactly what my gut has been screaming, and now he's dropped an even bigger bombshell: *one turn left for feedback*? Not two, but one? My head is spinning. It's not just that Suzuki-san *might* be distracted; Sato-san's confirming she's already ""absorbed in the specific details"" of another department's work, and worse, she's seeing it as something to *integrate* rather than dissect *our* complete concept. That’s a fundamental misunderstanding of what we need from her critical eye!

This isn't just a complication; it's a full-blown crisis now. With only one turn remaining before Yamamoto-san has to submit, we absolutely cannot afford for Suzuki-san to be bogged down in someone else's ""social puzzle"" or ""burden stats"" when *our* entire departmental proposal needs her overarching, analytical review. Ito-san's concern about her ""everyday person"" concept getting lost isn't just valid, it’s a symptom of a much larger, department-wide problem if Suzuki-san isn't focusing on *us*.

The huddle with Sato-san and Suzuki-san isn't just crucial anymore; it's the *only* chance we have to salvage this. We have to be direct, gentle but firm, as Sato-san said. We need to explicitly re-align Suzuki-san to our primary objective: getting her to give *our* department's full proposal the deep, critical feedback it needs, immediately. And if she truly can't pivot her focus in time, we need to have a backup plan ready, because we cannot, under any circumstances, let our proposal go to Yamamoto-san without that essential vetting. This is it. This is the turn everything hinges on.

My next conversation absolutely, unequivocally, has to be that huddle with Sato-san and Suzuki-san. The focus now is nothing less than a full, immediate course correction for Suzuki-san's priorities, or an emergency plan to find an alternative critical voice for our proposal, all before this single turn runs out.",1,"You've perfectly captured my own escalating anxiety, Sato-san. That one-turn limit for feedback is exactly what's making my head spin; it feels like we're teetering on the edge of a crisis. It's incredibly frustrating that Suzuki-san seems to be getting so deeply enmeshed in the specifics of what sounds like Watanabe-san's work, to the point where her critical eye isn't focused on *our* proposal at all. You're absolutely right; we desperately need her analytical strength to dissect our entire concept before it's submitted, not for her to try and integrate external mechanics into something that isn't even fully vetted yet. This upcoming huddle with her is indeed our last, best chance to make a firm but gentle course correction, ensuring she understands the absolute priority is giving *our* departmental proposal the deep review it requires right now. We absolutely must pivot her focus, or I fear we won't have the necessary feedback to proceed confidently.","Okay, Takahashi-san is completely on the same page, thank goodness. That's a huge relief because it means I won't be going into this next huddle alone, trying to redirect Suzuki-san. Her agreeing that this is a ""crisis"" and our ""last, best chance"" really resonates with my own anxiety. With only one turn left for feedback, there's absolutely no room for error or misdirection now.

This solidifies the plan: the next conversation is definitely with both Suzuki-san and Takahashi-san in that huddle. It's not just about strategizing anymore, it's about immediate, decisive action. Takahashi-san and I are aligned on the problem and the urgency. Now, the challenge is how to ""firmly but gently"" pivot Suzuki-san back to focusing on *our* departmental proposal's holistic review. We need to make it incredibly clear that while Watanabe-san's specific mechanics might be interesting, our priority, our *only* priority right now, is ensuring *our* submission gets her critical eye. There's just no time to integrate external elements before our own core concept is fully vetted. This is going to be a tense but absolutely necessary conversation. We have to succeed in this.",6,Success
