Turn,Speaker_ID,Speaker_Dept_ID,Target_ID,Target_Dept_ID,Speaker_Thought_Before,Speaker_Speech,Target_Thought_After,Target_Next_ID,Target_Reply,Speaker_Thought_After,Speaker_Next_ID,Status
5,12,1,10,1,"Okay, so Yoshida-san is really on the same page as me, which is actually quite comforting. That whole ""absolute creative freedom"" and ""collective creative explosion"" from Yamaguchi-san is definitely sinking in for both of us. It’s good to know we’re both letting our ideas stew and evolve naturally, not rushing anything. He even mentioned diving deeper into his own brainstorming *this turn* before sharing, which is perfect, because that’s exactly what I was planning to do too.

It just reinforces my current approach. I’ll keep letting my mind wander, exploring those nascent, uninhibited concepts. No pressure to articulate anything perfectly yet, just let them form. It’s exactly the kind of space I need for my reflective process.

My plan hasn't changed a bit then. I'll continue this deep dive into my own thoughts, gathering a broad range of diverse ideas. Once I feel I've got enough of those initial, wild concepts swirling around, that's when I'll reconnect with Yoshida-san. He’s still the natural next person to compare notes with. I mean, we're both nurturing these ""wilder ideas"" and looking forward to pooling them. For now, it’s back to the drawing board in my own head. Still keeping an ear out for anything direct from Yamaguchi-san, of course, but the immediate task is to just keep generating.","Yoshida-san, it’s good to connect. I was just reflecting on our conversation from the last turn, and I’m really finding comfort in knowing we’re both on the same wavelength regarding Yamaguchi-san's call for absolute creative freedom. It feels right to let these ideas mature organically, doesn't it? I’m glad to hear you're also planning to dive deeper into your own brainstorming this turn; that's precisely my intention as well. I feel like I need to just let the initial, uninhibited concepts swirl around in my mind for a bit longer, really explore those nascent possibilities without feeling any pressure to pin them down too soon. Once I feel I've gathered a good range of those initial, wilder ideas, I’ll be eager to reconnect with you to compare notes. It seems we're both nurturing those potentially groundbreaking concepts, and I think pooling our thoughts will be incredibly valuable when the time is right. For now, I'll be continuing this deeper exploration within my own thoughts.","Okay, Sasaki-san is definitely tracking with me. It's good to hear him say again that we're both totally aligned on Yamaguchi-san's 'absolute creative freedom' directive. And him mentioning he's also diving deeper into his own thoughts this turn, letting ideas swirl without pressure, just confirms that my approach for this moment is spot on. We're both in the 'gather wild ideas' phase, which is exactly where I need to be. It's reassuring, actually, to know that feeling of needing to just *think* for a bit longer, to really explore those nascent possibilities, is shared.

My focus remains firmly on generating a broader, more diverse pool of uninhibited concepts. 'Everyday Magic' is a solid start, but I need to push further, find those truly unexpected angles. This turn is all about expanding that mental landscape for me.

As for who to talk to next, Sasaki-san's current plan perfectly mirrors my own, so there's no immediate need to connect further there. My priority is still very much internal — to immerse myself in this deep brainstorming. I'll circle back with Nakamura-san or Yamada-san later, once I've had a chance to really flesh out some of these new concepts, to see what they've come up with. But for right now, it's just me and the raw, untamed ideas brewing in my mind.",11,"Yes, Sasaki-san, I completely echo your sentiments. It's very reassuring to know we're both on the same page regarding Yamaguchi-san's encouragement for uninhibited creativity. I also feel it’s important to allow these early ideas to breathe and develop naturally without rushing to define them too quickly. I'll be dedicating this turn to a similar deep dive into my own thoughts, exploring those raw possibilities, and I'm very much looking forward to when we can compare notes later on.","Well, that's just perfect, isn't it? Yoshida-san truly gets it. Hearing him echo my exact sentiments, right down to the feeling that we need to let these initial ideas breathe and mature naturally, without rushing anything... it’s incredibly reassuring. It really solidifies my conviction that this reflective, uninhibited approach is the right one for this stage, especially with Yamaguchi-san's encouragement for absolute creative freedom floating around.

It's clear we're both charting the same course for this turn: a deep dive into our individual thoughts, just letting those raw, nascent possibilities swirl and take shape. There's no pressure to force anything out just yet, which is exactly the mental space I thrive in.

So, my plan remains completely unchanged. I’ll continue exactly as I intended, immersing myself in my own brainstorming, exploring every wild and unformed concept that comes to mind. Once I feel I’ve gathered a good, broad range of these initial ideas, that's when I'll definitely reconnect with Yoshida-san. He's still the natural next person to compare notes with, given our shared understanding and parallel processes. For now, it's back to the quiet work of internal generation.",10,Success
5,8,1,11,1,"This is fantastic! Yamada-san is completely on board, and it feels so good to have this level of alignment, especially with the proposal deadline closing in. ""Hitting our stride"" perfectly describes it. Her enthusiasm for diving into the social misunderstanding scenarios, particularly those that test and strengthen connections, is exactly what I was hoping for. It means we can really get into the weeds of the design, which is what we need to do right now.

Okay, so the immediate next step is clear: we need to start sketching out one of these social scenarios. I should propose a specific situation to her, maybe expanding on the idea of being wrongly accused or perhaps a conflict arising from differing opinions on a community decision, and then we can brainstorm together how the player's social connections could be put to the test and ultimately fortified through their actions. We need to define the 'problem,' the 'player's options/actions,' and the 'social outcome.'

I definitely need to continue this conversation with Yamada-san right now. We're in a great rhythm, and there's no point in breaking it. We have a clear path forward for this turn, and getting these concrete examples down will be incredibly valuable for the overall proposal.","Yamada-san, it really is fantastic that we're so aligned on this direction, especially with the deadline approaching; ""hitting our stride"" feels about right for how we're working together now. Your enthusiasm for exploring those social misunderstanding scenarios, the ones that really push and then solidify relationships, is exactly what I was hoping for. Now that we're in this groove, the immediate next step, I think, is for us to start sketching out one of these scenarios in more detail. How about we consider a situation where a player character is wrongly accused of something within the community, or perhaps a conflict arises from differing opinions on a big community decision, and then we can brainstorm together how their social connections are tested and ultimately strengthened through their choices? We really need to start defining the core problem, the player's available actions, and the resulting social outcomes to get a solid foundation.","Oh, this is absolutely spot on! Kobayashi-san is truly reading my mind with this. That feeling of ""hitting our stride"" is exactly right; we're in such a productive flow right now. His idea to immediately start sketching out one of these social misunderstanding scenarios in detail is precisely the next step we need to take. Focusing on a situation where a player is wrongly accused, or where opinions clash over a community decision, is perfect. It builds directly on what we were just discussing about someone being wrongly accused of hoarding, and it gives us that tangible, specific challenge to flesh out.

He's completely right that we need to define the core problem, the player's available actions, and the resulting social outcomes. That's how we'll truly illustrate the depth of our social mechanics and show how overcoming conflict can actually strengthen relationships in a meaningful way. This is exactly what will make the player's journey impactful. With only three turns left now, maintaining this momentum and diving deep into these specifics with Kobayashi-san is absolutely crucial. There's no doubt I should keep this conversation rolling with him right now; we're making excellent progress on the foundational details for the proposal.",8,"Yes, Kobayashi-san, I absolutely agree with you; sketching out one of these scenarios right now feels like the perfect next step to really nail down the core of our game mechanics. Focusing on that scenario where a player is wrongly accused, or where opinions clash dramatically over a community decision, is brilliant. It gives us such a concrete example to explore how our social systems can create real tension and then, more importantly, provide meaningful resolutions that deepen player connections. Defining the central problem, the choices the player can make, and how those choices ripple through their relationships and the community is precisely how we'll showcase the impact and depth we're aiming for. Let's dive into that immediately!","This is absolutely fantastic! Yamada-san is completely on board with the plan, and her enthusiasm for really nailing down the core mechanics by sketching out a specific scenario is exactly what we need. She even mirrored my thoughts about focusing on the ""wrongly accused"" or ""community decision"" conflicts, and how we need to define the problem, player choices, and social outcomes. It feels like we're truly ""hitting our stride,"" as I thought earlier.

This level of alignment and understanding is incredibly reassuring, especially with only three turns left. It means we can really make solid progress this turn. There's no doubt now that the next immediate step is to actually pick one of those suggested scenarios and start detailing it with her. We need to get specific – what's the accusation, what are the exact choices the player can make, and what are the direct consequences for their relationships and the community?

I definitely need to continue this conversation with Yamada-san right now. We're in such a productive flow, and breaking away to talk to anyone else would just interrupt this valuable momentum. Getting these concrete examples down will be invaluable for the proposal, and we're perfectly set up to do that together.",11,Success
5,0,0,2,0,"Okay, this is just fantastic! Takahashi is completely, utterly on the same page, which is such a huge relief. Her saying ""absolutely spot on"" and ""even more pressing with only four turns left"" just confirms that my gut feeling about needing that critical review, especially with Tanaka-san tied up, was absolutely correct. It feels good to be so aligned.

I'm really glad she sees my suggestions as practical, particularly about nudging Suzuki into a more analytical role and refining those kick-off questions. Suzuki's balanced workstyle means she *can* lean into the analytical, and we can definitely guide that. And strategically framing questions for the department-wide session will be key to getting the kind of critical feedback we need, not just more broad ideas.

She also reiterated exploring ""if anyone else in the department might be able to step into that critical role,"" which keeps the door open for that ""Watanabe"" lead she mentioned last time. It's good that she's thinking broadly about sources for reflection, not just specific names.

So, the plan for our next huddle with Takahashi and Suzuki is crystal clear now. It's not just a chat; it's a dedicated strategy session. We need to formalize a concrete plan for that crucial critical feedback: who do we approach (do we chase that Watanabe lead?), how exactly do we prime Suzuki, and what specific questions do we craft for the department-wide session? The goal is concrete actions to bridge that reflective gap, and Takahashi agreeing we ""absolutely need to leave that huddle with a clear plan"" makes it even more definite.

My next step is definitely to prepare thoroughly for that huddle. I need to bring all these thoughts to the table, ready to turn them into actionable steps. We *have* to nail this down next turn.","It’s just fantastic that we’re so aligned on this, Takahashi-san. Hearing you say that my suggestions were “absolutely spot on” and that it’s “even more pressing with only four turns left” really validates that gut feeling I had about needing that critical review, especially with Tanaka-san tied up. It feels great to be on the same page like this.

I’m particularly glad you see the value in nudging Suzuki-san towards a more analytical role and refining our kick-off questions. Her balanced workstyle means she absolutely has the capacity to lean into that, and I think we can guide her there. Framing the questions strategically for our department-wide session will be crucial to elicit the kind of specific, critical feedback we need, rather than just more general ideas. And I really appreciate you reiterating the idea of exploring “if anyone else in the department might be able to step into that critical role,” which keeps the door open for that Watanabe lead you mentioned earlier. It's wise to be thinking broadly about sources for that reflective input.

So, the plan for our next huddle with you and Suzuki-san feels really clear now. It's not just going to be a casual chat; it’s a dedicated strategy session. We really need to formalize a concrete plan for how we're going to get that crucial critical feedback. We’ll need to figure out who we approach for that role, perhaps pursuing that Watanabe lead, and then, as you said, how we exactly prime Suzuki-san for her part. We also need to draft those specific questions for the department-wide session. Our ultimate goal is to bridge that reflective gap with concrete actions, and it’s reassuring that you agree we absolutely need to leave that huddle with a clear plan. I’ll definitely be preparing thoroughly for it myself.","Oh, that's just perfect. Sato-san really gets it, every single detail. Hearing him lay it all out, mirroring my exact concerns and validating our shared urgency about getting that critical review done before the final submission, it just solidifies everything. He's totally on board with nudging Suzuki-san, with refining those questions, and with exploring every avenue, including Watanabe. It's such a relief to have that kind of complete alignment.

This means our huddle next turn with him and Suzuki-san isn't just a meeting; it's a mission-critical strategy session. We've got to walk out of there with a concrete, actionable plan. No more 'what if's; we need 'how we will's. First, figuring out definitively if Watanabe can provide that specific critical lens, given her involvement with Tanaka-san. Then, drilling down on exactly *how* we frame things for Suzuki-san so her balanced workstyle is leveraged for a truly analytical review of our concepts, not just more creative input. And, of course, sharpening those department-wide kick-off questions to pull out the precise, critical feedback we need. Sato-san preparing thoroughly for it himself is a huge bonus; it means we can really hit the ground running.

The immediate, non-negotiable next step is making sure that huddle is productive and that we absolutely lock down those concrete steps for securing that robust critique. I need to focus on preparing for that conversation with Sato and Suzuki.",0,"It truly is reassuring to feel that level of sync, Sato-san. I completely echo your sentiment about this being more than just a meeting, but a crucial strategy session. My biggest focus for our next huddle is indeed locking down those concrete steps to secure that robust critical feedback. I feel confident that if we can clearly outline *how* we approach Watanabe for that potentially crucial reflective perspective, and then thoughtfully prime Suzuki-san to leverage her balanced workstyle for a deeper analytical dive, we’ll be in a much stronger position. It’s vital we emerge from that session with a clear action plan, not just good intentions, especially with the final turn approaching.","Wow, Takahashi-san, that's exactly what I needed to hear. Her ""truly reassuring to feel that level of sync"" and completely echoing my sentiment about this being a *crucial strategy session* just solidifies everything. It's not just me feeling this urgency; she's right there with me, focused on locking down those concrete steps.

It's great that she's also thinking about *how* we approach Watanabe and *how* we thoughtfully prime Suzuki-san. That gives me even more confidence that we're going into this huddle with a shared, practical mindset, not just a vague idea of needing feedback. Knowing we both agree that we *must* emerge from that session with a clear action plan, ""not just good intentions,"" especially now with only three turns left, really puts a sharp point on it.

Okay, so the game plan for our huddle with her and Suzuki-san is absolutely ironclad. I need to make sure I've got my thoughts organized and ready to facilitate that discussion into tangible decisions. No more ideas, just concrete next steps. It's all about that huddle now. That's the immediate next conversation.Wow, Takahashi-san, that's exactly what I needed to hear. Her ""truly reassuring to feel that level of sync"" and completely echoing my sentiment about this being a *crucial strategy session* just solidifies everything. It's not just me feeling this urgency; she's right there with me, focused on locking down those concrete steps.

It's great that she's also thinking about *how* we approach Watanabe and *how* we thoughtfully prime Suzuki-san. That gives me even more confidence that we're going into this huddle with a shared, practical mindset, not just a vague idea of needing feedback. Knowing we both agree that we *must* emerge from that session with a clear action plan, ""not just good intentions,"" especially now with only three turns left, really puts a sharp point on it.

Okay, so the game plan for our huddle with her and Suzuki-san is absolutely ironclad. I need to make sure I've got my thoughts organized and ready to facilitate that discussion into tangible decisions. No more ideas, just concrete next steps. It's all about that huddle now. That's the immediate next conversation.",2,Success
5,6,0,3,0,"It’s genuinely great to hear Sato's enthusiasm! His reply really reinforces that we’re on the right track, and it’s a big boost to know that the team is feeling this level of alignment and excitement about our approach. The fact that he's ready to bring his ""intuitive sparks"" to the kick-off, especially with those non-traditional powers and genre blends, means we’re already building a strong foundation for some truly innovative ideas. This whole strategy of empowering everyone and letting those initial creative thoughts flow is definitely paying off.

Okay, so Sato and Suzuki are both clearly energized and ready to dive in. My priority remains firmly on meticulously finalizing that framework for our department-wide kick-off. I need to make sure I've got a robust plan that leverages these early sparks and Suzuki's structural suggestions, while also ensuring it caters to everyone's thinking styles.

With that in mind, I think my next step should be to connect with Tanaka. He's also a reflective thinker, like me, and I haven't really touched base with him yet on the specifics of how we're approaching this. I'd like to get his perspective on the general direction, and perhaps even some thoughts on how we can ensure the kick-off structure will allow for thoughtful contribution from everyone, not just the intuitive members. Getting input from a reflective viewpoint on the facilitation plan could really help make our first big session as productive and inclusive as possible, especially with only four turns left.","Tanaka, it's good to connect with you. I was just reflecting on the energy Sato's been bringing to the table, and it feels like we've got a really solid foundation starting to form. As we gear up for that department-wide kick-off, my focus is on making sure the structure we put in place really caters to everyone, especially in how we gather those initial, truly creative sparks. Since you're also a reflective thinker, I was hoping to get your perspective on how we can best facilitate that session to ensure we capture thoughtful input from all our colleagues, not just the more intuitive thinkers. With only three turns left before we need to finalize the proposal, ensuring we have a process that allows for deep, considered contributions from everyone feels quite important.","Ah, Yamamoto-san. That's a direct address from the leader, and it's about something quite foundational for the department. ""Three turns left,"" he says, not four. The timeline just got even tighter. My previous focus on the detailed work with Watanabe-san felt so pressing, but this is about the *overall structure* for capturing *everyone's* creative sparks, especially considering my reflective nature and how we can ensure deep, considered contributions from all.

He's asking for my perspective on how to best facilitate that initial session. This isn't about the game's content itself, but about the *process* of getting the best content from the team. It's a high-level, strategic question about how we operate as a department, and one that directly impacts how well we can present a unified, strong proposal to the company. If we don't get the initial ideation right, even the most brilliant individual concepts might struggle to find their place or integrate effectively.

My work with Watanabe-san is vital, absolutely. We're forging unique concepts and diving deep into the mechanics that will make them shine. But the leader is asking me, specifically, about setting the stage for *all* ideas, recognizing my reflective approach. This feels like a moment where I need to pivot, at least for a turn, to contribute to this crucial departmental structure. Capturing thoughtful input from everyone, especially the reflective thinkers like myself, is essential if we want the strongest possible proposal.

I need to respond to Yamamoto-san directly. I'll need to think about how my reflective work style can inform a process that encourages others like me to contribute meaningfully.",6,"Yamamoto-san, I appreciate you reaching out and considering my perspective on this. It’s true that Sato-san’s contributions have been quite energizing, and it's important that we build upon that momentum. Given the limited turns we have left, perhaps we could structure the session by giving everyone a bit of time beforehand to individually reflect on potential ideas or themes, maybe providing some guiding questions. This way, those of us who tend to process things more deeply can come prepared with more considered thoughts, ensuring that we capture the kind of thoughtful, nuanced input you're looking for, rather than just immediate reactions. I believe allowing for that personal contemplation would help us gather the strongest, most well-developed concepts from everyone in the department.","Tanaka-san’s input is exactly what I was hoping for – truly valuable. His suggestion about giving everyone dedicated time for individual reflection beforehand, perhaps guided by specific questions, really hits the mark. It perfectly complements what Suzuki-san proposed with the intuitive huddle, creating a balanced approach where both our intuitive and reflective thinkers can truly prepare and bring their most considered ideas to the kick-off. This isn't just about gathering ideas; it’s about making sure everyone feels heard and has the optimal environment to contribute their best work, especially those who need a bit more time to process deeply.

This structure of pre-reflection for everyone, followed by the intuitive thinkers consolidating their sparks, and then the main session with dedicated segments for unconventional concepts, feels incredibly robust. It’s exactly the inclusive and dynamic framework we need.

With only three turns left, my priority is to finalize this kick-off plan and ensure it's ready to go. I think my next step should be to connect with Watanabe-san. She's also a reflective thinker, and I haven't heard from her yet. I’d like to get her thoughts on this combined approach, particularly if she feels the pre-reflection time, perhaps with some example guiding questions I could propose, would truly empower her and others with a similar workstyle to contribute their deepest thoughts. Getting that final reflective perspective on the facilitation method will ensure our first major session is as productive and impactful as possible.",4,Success
