Turn,Speaker_ID,Speaker_Dept_ID,Target_ID,Target_Dept_ID,Speaker_Thought_Before,Speaker_Speech,Target_Thought_After,Target_Next_ID,Target_Reply,Speaker_Thought_After,Speaker_Next_ID,Status
2,7,1,13,1,"Hmm, Yoshida-san is really fired up about ""Everyday Magic,"" and I do appreciate his enthusiasm for it. It's a genuinely good concept, very much in line with our department's general theme, and I've already expressed how much I like it. He's eager to dive straight into the gameplay mechanics with me, but... didn't Yamaguchi-san just confirm that he's setting up a big, broad brainstorming session with everyone, specifically to *generate fresh concepts* and *not feel confined* by existing ideas or genres yet? He really emphasized letting *all* ideas flow without immediate judgment, right?

If Yoshida-san and I start drilling down into the specific mechanics of ""Everyday Magic"" now, before that collective session even happens, it might feel a bit premature. Yamaguchi-san wants us to explore *any* genre or style, and while ""Everyday Magic"" is fantastic, we need to make sure we've fully explored all the *new* and *unforeseen* ideas that might emerge from the group. It feels more aligned with Yamaguchi-san's direction to bring ""Everyday Magic,"" alongside all our other thoughts, to that broad session first, to see how it fits into the wider departmental vision that we're collectively trying to build. We can definitely get into the nitty-gritty of its gameplay later, once we've had that initial creative explosion.

So, I need to respond to Yoshida-san in a way that acknowledges his momentum and the strength of his idea, but also gently steers the focus back to the department's immediate collective task as outlined by Yamaguchi-san. I'll need to explain why bringing it to the group first, as a fully formed concept to be discussed alongside others, is the most productive next step for *all* of us. After that, I'll just be waiting for Yamaguchi-san to set up that overall brainstorming session. No need to chase anyone else; the leader has the wheel for the next turn.","Yamaguchi-san, I wanted to follow up on our department's direction. I understand you're planning a broad brainstorming session soon, specifically to let all sorts of fresh concepts flow without immediate constraints, which I think is a great approach. Yoshida-san has been incredibly enthusiastic about a concept called ""Everyday Magic,"" and while I agree it's a strong idea very much in our department's vein, I was thinking it might be best to bring ""Everyday Magic,"" along with any other nascent ideas we have, to that larger group discussion first. My reasoning is that we need to ensure we've fully explored the landscape of *new* possibilities that could emerge from everyone's input before we start drilling down into the specifics of any single game, as per your guidance. We can certainly dive deep into its gameplay mechanics once we've had that initial collective creative explosion and see where all the ideas lead. I'm looking forward to the session you're organizing.","Nakamura-san's follow-up really solidifies my thinking. He completely gets it – bringing ""Everyday Magic"" and all those other early concepts into the big department-wide brainstorm first, before we start drilling down into any specifics. That's exactly what I wanted to ensure, that we get everyone's fresh, unconstrained input right from the start to truly explore the full landscape of possibilities. It’s reassuring to know he understands the importance of that collective creative explosion.

His reasoning about exploring new possibilities from everyone's input before focusing on a single idea perfectly aligns with my vision for this initial phase. It confirms that the team is on the same page regarding the process.

So, the plan remains unchanged, and in fact, it feels even more validated now. I need to get that department-wide brainstorming session set up without delay. The next step is definitely to reach out to Kobayashi, Kato, Yoshida, Yamada, and Sasaki to coordinate a time for us all to connect and let those ideas flow. Getting everyone together is the absolute priority right now.",8,"That's exactly the sentiment I was hoping for, Nakamura-san. Your understanding of bringing concepts like ""Everyday Magic"" to the larger group first, to ensure we capture all the new possibilities before focusing too narrowly, is spot on and perfectly aligns with what I had in mind. It's very reassuring to know we're on the same page about letting that collective creativity flow freely for everyone. My next immediate step is indeed to get Kobayashi-san, Kato-san, Yoshida-san, Yamada-san, and Sasaki-san together to find a time for that session to happen.","Ah, that's a relief! It's good to know Yamaguchi-san and I are completely on the same page about this. My thinking on bringing ""Everyday Magic"" and all those other nascent ideas to the big group session first, instead of drilling down too early, was spot on. It feels good to have that confirmed, especially after talking to Yoshida-san about it. I was a bit worried I might have been too subtle, but it seems I conveyed the message effectively to both of them.

So, for now, my part in steering the initial direction is done. Yamaguchi-san is now going to organize that collective brainstorming session with everyone. My next move is simply to wait for him to get that arranged. I'm really looking forward to seeing what kind of wild and wonderful ideas emerge once everyone, including Kobayashi-san, Kato-san, Yamada-san, and Sasaki-san, gets to throw their thoughts into the mix without any pressure. It's going to be interesting to see how it all shakes out. No need to chase anyone else; the ball's in Yamaguchi-san's court for setting up that meeting.",13,Success
2,8,1,11,1,"Okay, this is excellent! What a relief to hear Yamada-san reconfirm everything so clearly. It really solidifies our path forward. I was just trying to navigate Kato-san's fascinating but *very* different nebula idea, and while I gave her a polite and honest answer about being focused on our current discussions, it's good to have this clear endorsement from Yamada-san for our proposed flow.

Her enthusiasm for the ""blank slate"" and the space colony concept is genuinely energizing, and it feels great to be so aligned. She even specifically mentioned Kato-san as the *next* step after we lay our foundation, which is exactly what I was hoping for. It means my gentle deferral to Kato-san was appropriate and didn't throw a wrench into anything. We're on track, and our strategy of building a solid, sensible base with balanced thinkers like us before seeking out more intuitive, boundary-pushing ideas is now firmly established.

Six turns left, and we're starting strong with a clear direction. This feels very productive. My immediate focus is absolutely on diving into these early ideas with Yamada-san right now, exploring those compelling life experiences and genre blends within the space colony setting. We need to get some concrete concepts formed, as she said.

So, who to talk to next? It's definitely Yamada-san. We're in the middle of this collaborative brainstorming, and she just reaffirmed our plan. I need to keep this momentum going with her. We're setting the foundation, and that's the crucial next step before anyone else.","That's absolutely wonderful, Yamada-san. I'm so glad we're so much on the same page about this. Hearing you reconfirm our strategy, especially with your enthusiasm for the space colony setting and that ""blank slate"" idea, really gives me a boost. It feels like we're building a really solid foundation, just as you said, and I appreciate you clarifying the flow, making sure we focus on solidifying these core concepts before diving into more abstract territories. I agree completely that our next step is to really flesh out these initial ideas, exploring those compelling life experiences and how we can blend them with different genres within that space colony framework to create something truly engaging for players. Shall we start brainstorming some specific scenarios or core mechanics that could bring this setting to life?","Oh, this is just perfect! He's absolutely right, we are so completely on the same page. It's such a wonderful feeling to have this kind of alignment, especially with such a wide-open brief. His enthusiasm for the space colony idea and focusing on the ""blank slate"" approach truly makes me feel like we're on solid ground here. And yes, he perfectly understands that we need to build this strong foundation first, really solidifying our core concepts before we bring in Kato-san's unique, intuitive perspective. It’s so much more strategic this way, rather than just bouncing things off Yoshida-san or Sasaki-san without a clear direction.

He's ready to jump straight into brainstorming specific scenarios and mechanics, which is exactly what I was hoping for. No more preamble, no more just thinking about the *plan* to plan. It’s time to actually *do* it. We need to get some concrete ideas flowing about those compelling life experiences within that space colony framework, and explore how we can truly blend genres to make something special. We only have six turns, so getting this foundational work done efficiently and effectively with Kobayashi-san right now is paramount. He’s the person to talk to, immediately, right here, right now, for this brainstorming session. Kato-san can come later, after we’ve got something solid for her to twist and expand on. This is going to be productive.",8,"Yes, absolutely, Kobayashi-san! It's so refreshing to be on the same wavelength like this, especially with the boundless possibilities of a space colony setting. I completely agree that we need to dive right into those compelling life experiences and start sketching out some core mechanics. Perhaps we could begin by thinking about how daily routines might look on a colony – what kind of challenges or simple joys would players encounter? Maybe focusing on resource management of personal comfort or social connection in a confined environment, blending that with a touch of exploration or discovery within the colony itself? I'm eager to hear your thoughts on where to start first with the specifics.","Ah, this is great! Yamada-san is really on fire with ideas. It's so good to hear her throwing out specific starting points like that, diving right into the daily routines, the challenges, the simple joys of colony life. And the blend of resource management for personal comfort or social connection with a bit of exploration? That's exactly the kind of concrete brainstorming I was hoping for. It feels like we're really getting somewhere, moving beyond just the high-level concept to actual gameplay ideas. Her enthusiasm is definitely contagious, and it reinforces that we're absolutely on the right track.

This solidifies my thinking that sticking with Yamada-san right now is the most productive path. We're in the thick of it, bouncing ideas back and forth, and she just asked for my thoughts on where to start *first* with the specifics. That's a direct invitation to continue this deep dive with her. We need to build out these foundational ideas, get them robust and compelling, before we bring in anyone else, especially for those more intuitive leaps.

So yes, definitely Yamada-san. We're in a great flow here, and I need to keep that momentum going, responding to her suggestions and pushing these initial concepts further. This feels like a very strong start for the project.",11,Success
2,3,0,4,0,"Oh, this is excellent! Watanabe-san's still right there with me, and her enthusiasm for our shared path is really encouraging. It's such a relief to hear her confirm that my thoughts on a ""unique twist"" and the ""essence of heroism"" resonated so strongly. We're really in sync on exploring unconventional moral compasses and those complex, morally ambiguous situations. She's even started outlining conceptual premises and gameplay mechanics, which is exactly the kind of detailed thinking I thrive on. This momentum is exactly what we need.

It's a bit of a tricky situation with Ito-san's sudden input right before Watanabe-san's last comment. I mean, I *did* respond to Ito-san, acknowledging her idea, but now Watanabe-san has essentially picked up exactly where we left off, reinforcing our initial direction. This really solidifies my feeling that our conversation has a strong foundation and a clear, productive path forward.

My priority now has to be building on this fantastic momentum with Watanabe-san. We're clearly on to something good here, something thought-provoking, and she's already doing some deep outlining. I really want to dive into those concepts and mechanics she's started to brainstorm.

I'll have to figure out how to manage Ito-san's idea. It's not that I'm dismissing it entirely, but it's a very different path, and I don't want to lose what Watanabe-san and I are building. Perhaps there's a way to circle back, or suggest it as a parallel exploration, but for now, continuing with Watanabe-san feels like the most impactful use of my time, especially with only six turns left. We've got a solid start here.

So, I need to talk to Watanabe-san next, without a doubt, to continue this promising thread. I'll need to think about how to frame my response to her while subtly keeping Ito-san's earlier query in mind for later, without letting it derail our current progress.","Watanabe-san, it’s really wonderful to see that enthusiasm from you, and I'm so glad our thoughts on a unique twist to heroism, and really getting to the core of what makes a hero, are resonating so strongly with you too. It feels like we're perfectly in sync as we explore those unconventional moral compasses and the truly complex, morally ambiguous situations. I was particularly excited to hear you've already started outlining some conceptual premises and gameplay mechanics, because that detailed thinking is exactly what helps me build upon things. This momentum we have right now is precisely what we need. I'm eager to dive into those concepts and mechanics you've started brainstorming with you.","This is great, absolutely great. Tanaka-san is totally on board with these deeper, more nuanced ideas, and his enthusiasm for what I’ve already started outlining just makes me feel so much more confident about the direction we're heading. He really gets that it's about exploring those complex, morally ambiguous situations and not just simple heroics. It feels like we're truly building something solid here, laying down the groundwork together.

Okay, so I absolutely need to flesh out those conceptual premises and gameplay mechanics now. He's eager to hear them, and that's exactly what I should focus on. I was thinking more about that hero whose power isn't physical, but something like an acute emotional intelligence or the ability to subtly influence feelings. How would that play out? Maybe it's not about combat at all, but about navigating social situations, uncovering hidden truths through empathy, or even subtly shifting the emotional state of a crowd to prevent conflict. Picture a ""social puzzle"" game where the challenge isn't punching bad guys, but understanding their motivations and finding a path to de-escalation, or even changing their perspective.

And then there's the other idea, about a hero who perceives the ethical consequences of every choice, almost like seeing a branching tree of potential futures based on moral decisions. The gameplay could involve making choices that *feel* right in the short term, but reveal devastating long-term ripple effects, forcing players to truly grapple with the idea of the ""greater good"" in a world of compromises. It would be an RPG where your ""stats"" aren't strength or agility, but wisdom, empathy, and perhaps even 'burden,' accumulating from the difficult choices made.

I need to get these ideas really clear and concise, with a couple of strong examples for each to illustrate how they would translate into gameplay. This foundational discussion with Tanaka-san is proving incredibly productive, and with 6 turns left, we have the space to really dive deep into these concepts before we need to worry about broader presentations. My next step is definitely to organize all this for Tanaka-san. I won’t bother anyone else until I’ve had a chance to really solidify these thoughts and discuss them further with him.",3,"It's truly great to hear that you feel the same way, Tanaka-san. I'm really energized by how well our perspectives align on exploring the nuances of heroism and those complex ethical landscapes, and I'm eager to share the details I've been sketching out. I’ve been particularly focused on how these ideas could translate into distinct gameplay experiences, thinking about characters whose strengths lie less in physical prowess and more in their insight or their deep understanding of consequence. I’m looking forward to diving into the specifics with you and seeing how we can build upon this solid foundation we're laying down together.","Wow, this is just fantastic! Watanabe-san is really bringing it, and her latest message just solidifies everything I was feeling. It’s not just alignment on the abstract ideas now; she’s explicitly talking about the actual *gameplay experiences* and characters whose strengths are rooted in insight and consequences, not just brute force. That's exactly the level of detail and practical application I need to really get my teeth into. It's so encouraging to have someone who understands the nuances and is actively translating these high-level concepts into concrete game elements.

This momentum with her is genuinely invaluable. We’re not just talking conceptually; we’re moving towards defining what the game *is* and how it plays. There are only six turns left, and every conversation has to count. Building on this strong foundation with Watanabe-san feels like the most direct and effective path forward right now. We're clearly on a really promising trajectory here.

I still need to keep Ito-san's idea in mind, of course. It's an interesting concept, but it's a completely different direction, and I can't afford to jump between wildly different threads right now and lose this progress. Perhaps there’s a way to weave it in much later, or suggest it as a separate pitch if our department ends up needing a secondary idea, but for now, my focus absolutely has to be with Watanabe-san. We're developing something truly unique and deeply thought-out here.

So, yes, it's definitely Watanabe-san next. I need to acknowledge her specific points about gameplay and character strengths and push us even further into those specifics. I want to build on her momentum and really flesh out these elements together.",4,Success
