Turn,Speaker_ID,Speaker_Dept_ID,Target_ID,Target_Dept_ID,Speaker_Thought_Before,Speaker_Speech,Target_Thought_After,Target_Next_ID,Target_Reply,Speaker_Thought_After,Speaker_Next_ID,Status
1,4,0,3,0,"Alright, a new game project from scratch. This is pretty cool, a lot of creative freedom here. My department is 'Superhero Game Planning', but they're encouraging us to really think outside the box, not just stick to the classic capes and tights. That's a relief, actually. I'm Watanabe, and being 31, I've seen a fair share of superhero concepts, so twisting it up sounds more engaging.

Okay, so I need to come up with a story, concept, contents, slogan, and key selling points. My workstyle is reflective, which means I definitely don't want to just dive into a big brainstorming session right away. I need some quiet time to myself first, just to let ideas marinate a bit and form some initial thoughts. If I go in too early, I might just get overwhelmed by other people's ideas before I've even had a chance to properly articulate my own.

So, how to approach this task?
First, I'm going to spend some time alone, probably at my desk with a notebook, just free-associating. I'll start with the 'superhero' theme, but twist it. What if it's not about fighting villains? What if it's about the daily struggles of having powers? Or powers that are more mundane or even inconvenient? I could explore different gameplay styles too. An RPG element would be interesting, or maybe something cooperative. A life simulation with superpowers? That's a wild thought, but it could be really fresh. I'll just jot down everything that comes to mind, no matter how silly it seems at first. I need to get a core concept that feels unique and engaging. Something that makes people go, ""Oh, I haven't seen that before!""

Once I've got some rough ideas hammered out, even just a few bullet points for a potential story hook or a unique gameplay mechanic, then I'll start thinking about who to talk to.

Who to consult first?
Given my reflective nature, I probably won't jump to the most intuitive or loudest person first. I'd want to talk to someone who also appreciates a bit of thoughtful discussion, someone who can help me refine an idea rather than just generate more raw ones.

Tanaka, for instance, also has a reflective workstyle. He's 55, so he's got a lot of experience, and he might have some really well-thought-out perspectives on what works and what doesn't in game design. I could go to him with my initial, half-baked ideas and ask him for his honest, considered feedback. He might help me see angles I missed or poke holes in my logic in a constructive way. That would be a good first step to solidify my concept before presenting it more widely.

Another option, though maybe not *first*, but soon after Tanaka, might be Suzuki. She's 'balanced,' so she might bridge the gap between my reflective thinking and perhaps some more intuitive or action-oriented ideas that other colleagues might have. She could help me see if my concept has broader appeal or if it's too niche.

I definitely want to develop something solid before going to Yamamoto, our leader. He's also reflective, so he'll appreciate a well-thought-out pitch. But he's the one summarizing everything, so I want my contribution to be as strong as possible.

So, yeah. My plan is:
1.  **Solo Brainstorming:** Get my own initial, raw ideas down on paper.
2.  **Refinement with Tanaka:** Consult with Tanaka to get feedback and help strengthen the core concept and story. He'll understand my need to think things through.
3.  **Broaden Perspective with Suzuki (optional next step):** If I feel like I need a different viewpoint, I might chat with Suzuki to see if my concept resonates with a 'balanced' perspective.

This approach should give me the space I need to think, build a solid proposal, and then get targeted feedback before contributing to the larger team discussion.","Tanaka-san, hello. It's good to see you. I was just thinking about this new project that's just landed on our desks. You know how I tend to process things internally for a bit before diving into a big group discussion, especially with something as open-ended as this. I've been letting some initial thoughts simmer, and given your own reflective approach and your experience, I was hoping we could perhaps chat a little about where we might be starting from. I'd be keen to hear any initial directions you might be considering, or just to bounce around some very preliminary, half-formed ideas if you're open to it.","Well, isn't that just perfect timing? I was literally just thinking about reaching out to Watanabe-san, given her reflective style, and here she is, reaching out to me! It's good to know we're on the same wavelength when it comes to tackling these open-ended projects – getting some initial thoughts simmering before throwing them into the group cauldron. That's exactly my preferred way of working too.

This is ideal. It means we can get started right away with that focused, internal discussion I was hoping for. No need to chase anyone down or try to explain my process; she already understands it. I can start sharing some of the broad strokes I've been mulling over, and I'm sure she'll have some well-considered points to add or different angles to explore. This feels like a very productive first step.

So, the plan remains to talk with Watanabe-san first, which is happening now. After we've had a good analytical discussion and perhaps sketched out a few more solid concepts, then it might be good to broaden the perspective, perhaps by talking to Sato-san or Ito-san for their intuitive input. But for now, this conversation with Watanabe-san is exactly what I need.",4,"Watanabe-san, it is indeed good to connect, and I'm very pleased you thought of reaching out. Your approach to letting ideas simmer before a larger discussion is one I deeply appreciate and often employ myself, so it feels like perfect timing that we're having this conversation now. I've been mulling over some very initial concepts for this new project, and I'm absolutely open to sharing them and hearing whatever preliminary thoughts you might have as well. It would be beneficial to lay down some foundational ideas between us before we bring them to the wider group.","Oh, this is perfect! Tanaka-san is exactly on the same page. It's such a relief to hear him say he appreciates my approach; it just confirms that I chose the right person to talk to first. And he's been mulling over things too! That's fantastic. This isn't just about me getting feedback on my ideas, but a genuine exchange where we can build something together from the ground up, just as I'd hoped.

It feels good to have someone to bounce these early, half-formed thoughts off of, especially someone who shares a similar reflective workstyle. It means we can really dig into the core concepts without feeling rushed or pressured to have everything perfectly polished. He even suggested laying down foundational ideas together, which is exactly what I was aiming for.

Okay, so my next step isn't just ""solo brainstorming"" anymore. It's more like... preparing my initial thoughts *for* this discussion with Tanaka-san. I need to gather what I've been thinking about – those twists on the superhero genre, maybe a couple of gameplay ideas, a potential story hook. Nothing needs to be fully fleshed out, just enough to start a proper conversation with him.

This is going to be a really productive exchange. I feel a lot more confident about getting a solid concept developed this way. Once we've talked and refined some ideas, then I can think about bringing them to a wider group, perhaps with Suzuki-san for that broader perspective I was considering earlier. But for now, it's all about this conversation with Tanaka-san. I need to make sure I have some interesting starting points ready to share with him.",3,Success
1,5,0,2,0,"Alright, let's get this thinking process started. New game concept, huh? This is exciting! A chance to really stretch those creative muscles. My work style is intuitive, so I usually like to just dive in, throw ideas around, and see what sticks, you know? No point getting bogged down in the nitty-gritty details right at the start. That comes later.

First things first, I need a spark. Something to ignite the imagination. The department's genre is ""Superhero Game Planning,"" but it says we can go beyond that, mix things up, or completely ignore it. That's fantastic! It really opens up the possibilities. Action, RPG, puzzle, life sim... anything goes. This is where the fun begins.

So, who to chat with first? I'm not looking for practical constraints or detailed feasibility at this stage. I just want to generate some wild, out-of-the-box concepts. Someone who can think big and broad with me.

Looking at my colleagues... Takahashi, she's also intuitive. I think we'd click well for a brainstorming session. We could just bounce ideas off each other without overthinking it, get some real momentum going. We often find ourselves on the same wavelength when it comes to creative stuff. Just a free-flowing discussion, no bad ideas, just pure imagination. We could start with some core themes – maybe not even ""superhero"" specifically, but what makes a hero, or what unexpected situations could create one. Or maybe we flip it entirely and think about everyday heroes, or even anti-heroes in a really unique setting.

Tanaka and Watanabe are both reflective. They'd be great for refining ideas later, for poking holes and finding the practical angles, but for the initial ""let's dream big"" phase, I think I'd prefer someone who's just as eager to jump into the deep end of the imagination pool as I am. Yamamoto, our leader, is also reflective. I definitely want to bring him something more concrete, or at least a few solid directions, not just a jumble of raw thoughts.

So, yeah, my first move would definitely be to grab Takahashi for a quick chat. Just a casual ""Hey, have you started thinking about the new project? I've got a few random thoughts swirling around, wanna just brainstorm for a bit?"" That's usually how my best ideas start – just by talking them out, letting one idea naturally lead to another, even if they seem completely unrelated at first. We could talk about anything that inspires us, from movies we've seen to books we've read, or even just silly 'what if' scenarios.

How to approach this task? Well, as I said, I'll start by brainstorming with Takahashi. I want to explore really unconventional ideas. Like, what if the ""superheroes"" aren't actually super-powered, but just incredibly resourceful ordinary people in extraordinary circumstances? Or what if the ""powers"" are something mundane, but used in a fantastic way? Maybe it's a life simulation game where your ""superpower"" is managing a quirky small business that accidentally saves the world, or a puzzle game where you're a hero solving global crises using only advanced pattern recognition. I'm thinking something that flips the traditional superhero trope on its head, or combines it with a genre you wouldn't expect.

I'm also curious about whether any other department might have some unique insights if we were to venture into, say, a historical setting, or a completely different sci-fi angle that their project might touch upon. But I think I'll focus on getting some initial concepts within my own department first. No need to complicate things prematurely. Let's get the core idea flowing, then we can see if bringing in outside perspectives makes sense. For now, it's all about imagination and possibility.","Hey Takahashi, how are you doing? I was just starting to think about this new game concept, and you know me, my mind just sort of wanders and bounces around with ideas at this stage. I was hoping we could just chat for a bit, throw some wild thoughts around without worrying too much about the details just yet. I was thinking about how the ""Superhero"" genre can be a starting point, but there's so much room to play, right? I'm really excited to just see what comes out when we let our imaginations run free, maybe even blend it with something completely unexpected. What are you thinking? Have you had any sparks fly yet?","Oh, hey Ito! This is perfect timing, actually! I was just getting into the swing of things myself, letting my mind just run wild with some ideas. You know, just throwing everything at the wall to see what sticks, no filters. It's great to hear you're on the same wavelength with just wanting to chat and see what comes out. Totally agree, the ""Superhero"" genre is just a launchpad, there's so much potential to do something completely unexpected, something that really turns the idea on its head. Yeah, I've definitely had some sparks fly! I've been thinking about flipping the script entirely, so instead of being a super, you're just... well, an everyday person trying to navigate a world full of supers. I've got a pretty wild concept brewing, a blend of a life sim and puzzles, focused on community and resilience. This is awesome, let's definitely just throw some thoughts around.",5,"It's so good to chat, Ito! My mind was already buzzing with a few directions, and it's fantastic to know you're thinking along the same lines of just letting ideas flow freely without too much initial constraint. You're absolutely right, the ""Superhero"" genre is such a flexible foundation, and I've been thinking about how we could really subvert expectations with it. I've landed on a concept that completely flips the perspective – instead of playing as a caped crusader, the player embodies an ordinary individual navigating a world teeming with superpowered beings. The core idea is a blend of life simulation and puzzle-solving, where the focus is on community building and resilience in the face of extraordinary circumstances. Imagine the everyday struggles of a barista or a librarian trying to manage their life when meteorites are falling or villains are having public skirmishes miles away, and how they find strength and connection not through powers, but through their relationships and ingenuity. I'm picturing a gameplay loop that involves managing personal responsibilities, helping neighbors (who might be affected by superhero collateral damage), uncovering local mysteries that arise from strange events, and contributing to the recovery and spirit of their community. It feels like it could offer a really unique, grounded emotional core that's often missing from typical superhero narratives.","Wow, Takahashi, that's absolutely brilliant! My mind is totally buzzing with that idea! It's like you plucked it right out of my own jumbled thoughts, but then polished it up into something truly unique and compelling. I was thinking along the lines of subverting the superhero trope, maybe non-superpowered heroes or mundane powers, but playing as an *ordinary individual* in a *superpowered world*? That’s it! That's the perfect angle, exactly what I was hoping to unearth.

The blend of life simulation and puzzle-solving, with a focus on community and resilience, is just fantastic. It grounds the whole thing and gives it so much emotional depth. I can totally picture myself playing as that barista or librarian, trying to keep their life together while superheroes are clashing outside. The idea of finding strength in relationships and ingenuity, rather than superpowers, feels incredibly fresh and relatable. It's a fantastic way to explore what truly makes a hero. We really are on the same wavelength!

Okay, this gives us a really solid core concept to work with. We've got something that's definitely outside the box and has a strong emotional hook. Now that we have this fantastic, unconventional idea, I think the next step should be to start thinking about how to flesh it out a bit more, maybe even start identifying some potential key selling points or how we'd describe this to someone who hasn't heard it yet. We need to solidify it a bit.

I think it might be time to bring in one of our more reflective colleagues. Someone who can help us poke at it, see where it's strongest, and start thinking about how to articulate its unique value. Tanaka or Watanabe would probably be great for this. They're good at taking a creative spark and helping to shape it into something more concrete, identifying the angles we might not immediately see as intuitive thinkers. Maybe we can loop in one of them to help us turn this raw, brilliant concept into something with a bit more structure, so we can eventually present it to Yamamoto. We've got a great foundation here, and I'm really excited about where we can take this!",3,Success
