agent_id,question_id,answer_text,agent_name,dept,position,dept_id,pattern_id
5,Q19,The current information sharing within the team is quite substantial and feels genuinely collaborative.,Ito,Crime & Investigation Game Planning,General Member,0,1
5,Q20,"Our team is experiencing exceptional unity, as indicated by our shared momentum and Yamamoto-san's enthusiastic endorsement of our strategic focus.",Ito,Crime & Investigation Game Planning,General Member,0,1
5,Q21,I am completely content with our team's dedicated approach to this task.,Ito,Crime & Investigation Game Planning,General Member,0,1
5,Q22,"My team members' aspirations for the team's performance are incredibly aligned, showcasing a powerful synergy.",Ito,Crime & Investigation Game Planning,General Member,0,1
5,Q23,The team provides ample opportunities for me to refine my performance by encouraging a direct and aligned approach to project execution.,Ito,Crime & Investigation Game Planning,General Member,0,1
6,Q01,Engaging with my department leader on role-related inquiries presents a straightforward path.,Yamamoto,Crime & Investigation Game Planning,Department Leader,0,1
6,Q02,"My communication with my team leader regarding work issues is direct and confident, reflecting a shared understanding of our project goals.",Yamamoto,Crime & Investigation Game Planning,Department Leader,0,1
6,Q03,I find complete ease discussing personal challenges or disagreements with my team leader.,Yamamoto,Crime & Investigation Game Planning,Department Leader,0,1
6,Q04,I feel completely free to present my recommendations and ideas to my team leader.,Yamamoto,Crime & Investigation Game Planning,Department Leader,0,1
6,Q05,"I would feel entirely comfortable discussing any errors with my team, as our collaborative spirit ensures all input strengthens our shared objectives.",Yamamoto,Crime & Investigation Game Planning,Department Leader,0,1
6,Q06,I would feel confident addressing the situation directly with my colleague.,Yamamoto,Crime & Investigation Game Planning,Department Leader,0,1
6,Q07,My input is always received with exceptional consideration by my team leader.,Yamamoto,Crime & Investigation Game Planning,Department Leader,0,1
6,Q08,My department leader offers complete encouragement for exploring novel responsibilities and acquiring new competencies.,Yamamoto,Crime & Investigation Game Planning,Department Leader,0,1
6,Q09,Tanaka-san's commitment to refining mechanics and emotional depth makes him an exceptionally dependable collaborator for our current project.,Yamamoto,Crime & Investigation Game Planning,Department Leader,0,1
6,Q10,My peers present a source of clear and actionable information when I require it.,Yamamoto,Crime & Investigation Game Planning,Department Leader,0,1
6,Q11,I communicate my opinions about work issues with my peers with complete candor.,Yamamoto,Crime & Investigation Game Planning,Department Leader,0,1
6,Q12,I am comfortable discussing personal matters with my peers when it feels appropriate and beneficial to our shared understanding.,Yamamoto,Crime & Investigation Game Planning,Department Leader,0,1
6,Q13,I feel completely unhindered to propose new project concepts and procedural adjustments to my colleagues.,Yamamoto,Crime & Investigation Game Planning,Department Leader,0,1
6,Q14,"I would feel completely comfortable raising any errors with my peers, as their input consistently elevates our projects.",Yamamoto,Crime & Investigation Game Planning,Department Leader,0,1
6,Q15,I would feel completely comfortable bringing a mistake to a colleague's attention.,Yamamoto,Crime & Investigation Game Planning,Department Leader,0,1
6,Q16,"My input is highly regarded by my peers, particularly when it contributes to the project's momentum and conceptualization.",Yamamoto,Crime & Investigation Game Planning,Department Leader,0,1
6,Q17,"Collaborating with Tanaka-san and Ito-san on the game's core elements is a remarkably smooth and energizing process, and I am confident in their immediate contributions.",Yamamoto,Crime & Investigation Game Planning,Department Leader,0,1
6,Q18,"Our team maintains a high level of information exchange, ensuring everyone is consistently apprised of work-related developments.",Yamamoto,Crime & Investigation Game Planning,Department Leader,0,1
6,Q19,"The team's information sharing is profoundly concrete, with contributions from all members serving as solid foundations for our shared objectives.",Yamamoto,Crime & Investigation Game Planning,Department Leader,0,1
6,Q20,Our team is entirely unified in its pursuit of performance goals.,Yamamoto,Crime & Investigation Game Planning,Department Leader,0,1
6,Q21,I am exceptionally pleased with my team's profound dedication to this endeavor.,Yamamoto,Crime & Investigation Game Planning,Department Leader,0,1
6,Q22,"My team members' aspirations for the team's performance are perfectly aligned, creating a powerful synergy for our current objectives.",Yamamoto,Crime & Investigation Game Planning,Department Leader,0,1
6,Q23,The team provides ample avenues for me to elevate my personal performance.,Yamamoto,Crime & Investigation Game Planning,Department Leader,0,1
7,Q01,I find it straightforward to approach my team leader with inquiries or when clarification is needed regarding my work responsibilities.,Nakamura,Modern Setting Game Planning,General Member,1,1
7,Q02,I express my thoughts about work issues with my team leader with complete candor.,Nakamura,Modern Setting Game Planning,General Member,1,1
7,Q03,"I feel a strong sense of ease discussing personal matters and disagreements with my team leader, as it fosters a productive and understanding environment.",Nakamura,Modern Setting Game Planning,General Member,1,1
7,Q04,I feel quite empowered to share my recommendations and ideas with our team leader.,Nakamura,Modern Setting Game Planning,General Member,1,1
7,Q05,"I would feel comfortable discussing errors with my team leader, as open communication ensures project progress.",Nakamura,Modern Setting Game Planning,General Member,1,1
7,Q06,I would feel quite secure voicing concerns about a colleague's misstep to the team leader.,Nakamura,Modern Setting Game Planning,General Member,1,1
7,Q07,My contributions always find a welcome reception and prove useful to the team's direction.,Nakamura,Modern Setting Game Planning,General Member,1,1
7,Q08,My team leader provides a substantial amount of encouragement for venturing into new responsibilities and acquiring novel skills.,Nakamura,Modern Setting Game Planning,General Member,1,1
7,Q09,"Kobayashi-san's concrete examples are precisely what we require to solidify our proposal, and I have complete confidence in our ability to complete the remaining verbs with the same success.",Nakamura,Modern Setting Game Planning,General Member,1,1
7,Q10,I find it quite straightforward to seek input from my colleagues when I have inquiries or require clarification related to my responsibilities.,Nakamura,Modern Setting Game Planning,General Member,1,1
7,Q11,I share my viewpoints with colleagues with directness.,Nakamura,Modern Setting Game Planning,General Member,1,1
7,Q12,I am completely at ease discussing personal matters with my colleagues.,Nakamura,Modern Setting Game Planning,General Member,1,1
7,Q13,I feel completely at ease offering my thoughts and suggestions to my colleagues regarding new projects or procedural adjustments.,Nakamura,Modern Setting Game Planning,General Member,1,1
7,Q14,"I find it entirely comfortable to discuss any missteps with my colleagues, as we are all dedicated to the project's success.",Nakamura,Modern Setting Game Planning,General Member,1,1
7,Q15,I would feel adequately secure voicing concerns to a coworker about a perceived error.,Nakamura,Modern Setting Game Planning,General Member,1,1
7,Q16,My contributions are consistently recognized and actively integrated into our collaborative efforts.,Nakamura,Modern Setting Game Planning,General Member,1,1
7,Q17,"Collaborating with Kobayashi-san on these gameplay scenarios is incredibly productive, making the need to involve others for assistance feel completely unnecessary at this moment.",Nakamura,Modern Setting Game Planning,General Member,1,1
7,Q18,Kobayashi-san and I maintain a highly informed exchange regarding our project's immediate needs.,Nakamura,Modern Setting Game Planning,General Member,1,1
7,Q19,"The current information sharing is superficial; direct, intuitive exchanges yield the most impactful progress.",Nakamura,Modern Setting Game Planning,General Member,1,1
7,Q20,"Our team demonstrates a remarkable synergy, with each member contributing their unique strengths to achieve our shared objectives.",Nakamura,Modern Setting Game Planning,General Member,1,1
7,Q21,I am thoroughly satisfied with our team's energetic dedication to this assignment.,Nakamura,Modern Setting Game Planning,General Member,1,1
7,Q22,Our team members exhibit a remarkably harmonious alignment in their aspirations for peak team performance.,Nakamura,Modern Setting Game Planning,General Member,1,1
7,Q23,"The current opportunities to advance my personal performance are quite sufficient, showcasing impactful progress.",Nakamura,Modern Setting Game Planning,General Member,1,1
8,Q01,Approaching my team leader with questions about my role at work is a straightforward process.,Kobayashi,Modern Setting Game Planning,General Member,1,1
8,Q02,"I communicate my thoughts on work matters with directness, aiming for clarity and substantive outcomes.",Kobayashi,Modern Setting Game Planning,General Member,1,1
8,Q03,I find discussing personal problems or disagreements with my team leader entirely acceptable.,Kobayashi,Modern Setting Game Planning,General Member,1,1
8,Q04,"I find considerable latitude in proposing concepts to my team leader, ensuring our work maintains a strong, resonant impact.",Kobayashi,Modern Setting Game Planning,General Member,1,1
8,Q05,"I experience a measure of security when voicing errors to my team leader, given our collaborative dynamic.",Kobayashi,Modern Setting Game Planning,General Member,1,1
8,Q06,I would feel entirely secure voicing concerns about a coworker's misstep to the team leader.,Kobayashi,Modern Setting Game Planning,General Member,1,1
8,Q07,My contributions are consistently recognized and integrated into our project's direction by my team leader.,Kobayashi,Modern Setting Game Planning,General Member,1,1
8,Q08,Yamaguchi-san offers a consistent encouragement for my exploration of novel responsibilities.,Kobayashi,Modern Setting Game Planning,General Member,1,1
8,Q09,"Nakamura-san's current contributions to our proposal are of exceptional value, thus fostering a strong belief in his future advocacy.",Kobayashi,Modern Setting Game Planning,General Member,1,1
8,Q10,Approaching colleagues with inquiries regarding my duties is a straightforward endeavor.,Kobayashi,Modern Setting Game Planning,General Member,1,1
8,Q11,I express my thoughts on work matters directly and without reservation to my colleagues.,Kobayashi,Modern Setting Game Planning,General Member,1,1
8,Q12,I find discussing personal matters with colleagues to be largely unproblematic.,Kobayashi,Modern Setting Game Planning,General Member,1,1
8,Q13,I perceive a definite freedom to propose new directions and process adjustments to my colleagues.,Kobayashi,Modern Setting Game Planning,General Member,1,1
8,Q14,I would feel confident raising any concerns about missteps with my colleagues.,Kobayashi,Modern Setting Game Planning,General Member,1,1
8,Q15,"I would feel quite comfortable addressing a colleague directly when observing an error, as I value clear communication and timely resolution.",Kobayashi,Modern Setting Game Planning,General Member,1,1
8,Q16,My contributions are consistently recognized and integrated by my colleagues.,Kobayashi,Modern Setting Game Planning,General Member,1,1
8,Q17,It is quite straightforward to request assistance from team members.,Kobayashi,Modern Setting Game Planning,General Member,1,1
8,Q18,"Our team maintains a strong flow of information, ensuring everyone possesses the necessary work-related insights.",Kobayashi,Modern Setting Game Planning,General Member,1,1
8,Q19,"The team's information sharing feels genuinely substantive, not lacking in depth.",Kobayashi,Modern Setting Game Planning,General Member,1,1
8,Q20,Our team demonstrates a remarkable unity of purpose as we drive towards our performance objectives.,Kobayashi,Modern Setting Game Planning,General Member,1,1
8,Q21,I find our team's commitment to this task to be quite robust and productive.,Kobayashi,Modern Setting Game Planning,General Member,1,1
8,Q22,"The team members maintain a strong alignment in their performance aspirations, fostering a productive collaborative environment.",Kobayashi,Modern Setting Game Planning,General Member,1,1
8,Q23,"The opportunities for personal performance improvement are quite substantial, fostering considerable growth.",Kobayashi,Modern Setting Game Planning,General Member,1,1
9,Q01,Approaching my team leader with inquiries or uncertainties regarding my responsibilities is a straightforward process.,Kato,Modern Setting Game Planning,General Member,1,1
9,Q02,I share my thoughts about work issues with my team leader with full transparency.,Kato,Modern Setting Game Planning,General Member,1,1
9,Q03,I am comfortable sharing when there's a clear benefit to the project's direction.,Kato,Modern Setting Game Planning,General Member,1,1
9,Q04,I feel completely free to share my recommendations and ideas.,Kato,Modern Setting Game Planning,General Member,1,1
9,Q05,"I would feel quite secure conveying any errors to my team leader, as past interactions suggest a supportive environment.",Kato,Modern Setting Game Planning,General Member,1,1
9,Q06,"I would feel comfortable raising concerns about a colleague's error to my team leader, as open communication supports overall project success.",Kato,Modern Setting Game Planning,General Member,1,1
9,Q07,My input is consistently acknowledged as a valuable contribution to our team's endeavors.,Kato,Modern Setting Game Planning,General Member,1,1
9,Q08,My team leader offers a consistent level of encouragement for exploring novel tasks and acquiring new skills.,Kato,Modern Setting Game Planning,General Member,1,1
9,Q09,Yamaguchi-san's consistent encouragement indicates a strong likelihood of his support should I encounter any issues within the company.,Kato,Modern Setting Game Planning,General Member,1,1
9,Q10,I find it a quite straightforward matter to consult with my colleagues when questions arise concerning my responsibilities.,Kato,Modern Setting Game Planning,General Member,1,1
9,Q11,"I communicate my opinions about work issues with my peers with considerable directness, valuing clarity and swiftness in sharing my thoughts.",Kato,Modern Setting Game Planning,General Member,1,1
9,Q12,I find it most productive to keep my personal matters separate from my professional interactions.,Kato,Modern Setting Game Planning,General Member,1,1
9,Q13,I feel empowered to contribute my insights regarding new projects and procedural enhancements to my colleagues.,Kato,Modern Setting Game Planning,General Member,1,1
9,Q14,"I would feel comfortable discussing a mistake with my peers, as I trust their constructive feedback to help me improve.",Kato,Modern Setting Game Planning,General Member,1,1
9,Q15,I would feel somewhat uneasy bringing up a potential oversight to a coworker.,Kato,Modern Setting Game Planning,General Member,1,1
9,Q16,My contributions are consistently acknowledged and integrated by my colleagues.,Kato,Modern Setting Game Planning,General Member,1,1
9,Q17,It is exceptionally simple to seek assistance from my colleagues.,Kato,Modern Setting Game Planning,General Member,1,1
9,Q18,Information flows quite effectively within the team.,Kato,Modern Setting Game Planning,General Member,1,1
9,Q19,"The attempts to share information throughout the team are largely superficial, failing to establish deep understanding.",Kato,Modern Setting Game Planning,General Member,1,1
9,Q20,"Our team operates with a commendable alignment in pursuing our collective objectives, ensuring a unified front towards achieving peak performance.",Kato,Modern Setting Game Planning,General Member,1,1
9,Q21,I am pleased with the team's dedicated efforts toward completing this assignment.,Kato,Modern Setting Game Planning,General Member,1,1
9,Q22,My team members' aspirations for team performance present a challenging alignment with the current project's rapid progression.,Kato,Modern Setting Game Planning,General Member,1,1
9,Q23,This team offers ample avenues for my personal performance enhancement.,Kato,Modern Setting Game Planning,General Member,1,1
10,Q01,It is straightforward to approach the team leader with inquiries regarding my responsibilities.,Yoshida,Modern Setting Game Planning,General Member,1,1
10,Q02,"I can openly share my thoughts with Yamada-san, especially when her insights align perfectly with our game's core vision and require immediate expansion.",Yoshida,Modern Setting Game Planning,General Member,1,1
10,Q03,I generally find myself feeling a degree of discomfort when bringing up personal issues or disagreements with my team leader.,Yoshida,Modern Setting Game Planning,General Member,1,1
10,Q04,I feel quite at liberty to propose new concepts or procedural enhancements to my team leader.,Yoshida,Modern Setting Game Planning,General Member,1,1
10,Q05,"I would feel a bit hesitant to speak up about a mistake to my team leader, as I value presenting my work with accuracy.",Yoshida,Modern Setting Game Planning,General Member,1,1
10,Q06,"I would feel a strong inclination to address the situation proactively with my team leader, ensuring the integrity of our work.",Yoshida,Modern Setting Game Planning,General Member,1,1
10,Q07,My input feels like a significant contribution to our team's direction.,Yoshida,Modern Setting Game Planning,General Member,1,1
10,Q08,My team leader provides a sufficient environment for exploring new responsibilities and acquiring novel skills.,Yoshida,Modern Setting Game Planning,General Member,1,1
10,Q09,Yamada-san is a reliably strong advocate for the team's concerns within the company.,Yoshida,Modern Setting Game Planning,General Member,1,1
10,Q10,"Approaching colleagues with inquiries presents a straightforward process, fostering a collaborative environment where clarity is readily attained.",Yoshida,Modern Setting Game Planning,General Member,1,1
10,Q11,I communicate my thoughts on work matters with my peers with complete candor.,Yoshida,Modern Setting Game Planning,General Member,1,1
10,Q12,My comfort level discussing personal matters with colleagues sits firmly in the neutral zone.,Yoshida,Modern Setting Game Planning,General Member,1,1
10,Q13,"I feel quite unhindered in offering my thoughts and proposals to my colleagues, as our collaborative environment encourages such contributions.",Yoshida,Modern Setting Game Planning,General Member,1,1
10,Q14,"I would possess considerable reservation in voicing any errors to my colleagues, given the present circumstances.",Yoshida,Modern Setting Game Planning,General Member,1,1
10,Q15,I would find it necessary to address a colleague's error with them directly to ensure the project's success.,Yoshida,Modern Setting Game Planning,General Member,1,1
10,Q16,My contributions are recognized and appreciated by my colleagues.,Yoshida,Modern Setting Game Planning,General Member,1,1
10,Q17,Seeking assistance from fellow team members presents a straightforward endeavor.,Yoshida,Modern Setting Game Planning,General Member,1,1
10,Q18,"The team maintains a robust exchange of work-related information, ensuring everyone possesses comprehensive awareness.",Yoshida,Modern Setting Game Planning,General Member,1,1
10,Q19,"The team's information sharing efforts exhibit a commendable depth, consistently avoiding superficiality.",Yoshida,Modern Setting Game Planning,General Member,1,1
10,Q20,"Our team exhibits a commendable alignment in pursuing our performance objectives, with a shared enthusiasm for refining our strategic communication.",Yoshida,Modern Setting Game Planning,General Member,1,1
10,Q21,I feel a strong sense of satisfaction with the team's dedication to our current undertaking.,Yoshida,Modern Setting Game Planning,General Member,1,1
10,Q22,Yamada-san's insights provide a strong foundation for the team's performance aspirations.,Yoshida,Modern Setting Game Planning,General Member,1,1
10,Q23,The opportunities this team provides to enhance my personal performance are quite adequate.,Yoshida,Modern Setting Game Planning,General Member,1,1
11,Q01,Collaborating with Yoshida-san on these critical examples is proceeding with remarkable synergy.,Yamada,Modern Setting Game Planning,General Member,1,1
11,Q02,"I am comfortable conveying my perspectives on work matters with my team leader, particularly when those perspectives enhance our shared objectives.",Yamada,Modern Setting Game Planning,General Member,1,1
11,Q03,I find discussing personal matters or disagreements with my team leader to be a situation I approach with considerable deliberation.,Yamada,Modern Setting Game Planning,General Member,1,1
11,Q04,"I appreciate the opportunity to contribute my ideas, and I find that my suggestions are well-received when presented with thorough reasoning and clear examples.",Yamada,Modern Setting Game Planning,General Member,1,1
11,Q05,"I would feel quite comfortable discussing any errors with my team leader, as open communication is essential for our progress.",Yamada,Modern Setting Game Planning,General Member,1,1
11,Q06,I would feel entirely comfortable bringing a colleague's mistake to my team leader's attention.,Yamada,Modern Setting Game Planning,General Member,1,1
11,Q07,My contributions feel adequately acknowledged when I articulate my perspectives to my team leader.,Yamada,Modern Setting Game Planning,General Member,1,1
11,Q08,My team leader provides ample opportunity for me to engage with novel responsibilities and acquire new proficiencies.,Yamada,Modern Setting Game Planning,General Member,1,1
11,Q09,"Yamada-san: My team leader is generally a reliable person to have as an advocate, offering steady support when issues arise.",Yamada,Modern Setting Game Planning,General Member,1,1
11,Q10,"Collaborating on specific examples with Yoshida-san is an exceptionally smooth process, and I anticipate that clarity with Yamaguchi-san will follow readily once our joint efforts are complete.",Yamada,Modern Setting Game Planning,General Member,1,1
11,Q11,"I communicate my thoughts on work matters with my peers with considerable openness, especially when my ideas resonate with theirs.",Yamada,Modern Setting Game Planning,General Member,1,1
11,Q12,I maintain a guarded approach when sharing personal matters with colleagues.,Yamada,Modern Setting Game Planning,General Member,1,1
11,Q13,I feel quite liberated to share my recommendations and ideas with my peers.,Yamada,Modern Setting Game Planning,General Member,1,1
11,Q14,I would feel confident presenting my observations regarding any potential oversights to my colleagues.,Yamada,Modern Setting Game Planning,General Member,1,1
11,Q15,I would feel comfortable pointing out a colleague's error to ensure our collective success.,Yamada,Modern Setting Game Planning,General Member,1,1
11,Q16,"My contributions resonate constructively with my colleagues, particularly in shared brainstorming sessions.",Yamada,Modern Setting Game Planning,General Member,1,1
11,Q17,Engaging with other team members for assistance typically presents a smooth and productive experience.,Yamada,Modern Setting Game Planning,General Member,1,1
11,Q18,"I observe excellent information exchange and collaborative idea development between Yoshida-san and myself, which forms the immediate priority.",Yamada,Modern Setting Game Planning,General Member,1,1
11,Q19,"The attempts to share information throughout the team are largely superficial, with true depth of understanding remaining limited to specific collaborative pairings.",Yamada,Modern Setting Game Planning,General Member,1,1
11,Q20,Our team is exhibiting remarkable cohesion as we pursue our performance objectives.,Yamada,Modern Setting Game Planning,General Member,1,1
11,Q21,I am very pleased with the strong alignment and productive collaboration I am experiencing with Yoshida-san on refining the game's scope.,Yamada,Modern Setting Game Planning,General Member,1,1
11,Q22,"Yamada-san and Yoshida-san exhibit exceptional alignment, while a full convergence with Yamaguchi-san's perspective awaits refinement of current proposals.",Yamada,Modern Setting Game Planning,General Member,1,1
11,Q23,The opportunities provided for enhancing my personal performance are quite sufficient.,Yamada,Modern Setting Game Planning,General Member,1,1
12,Q01,"Seeking clarification from my team leader regarding my role at work presents a significant challenge, demanding considerable effort to navigate.",Sasaki,Modern Setting Game Planning,General Member,1,1
12,Q02,"I communicate my work opinions with my team leader in a direct and clear manner, valuing efficiency above all.",Sasaki,Modern Setting Game Planning,General Member,1,1
12,Q03,I generally feel secure discussing personal challenges or disagreements with my team leader.,Sasaki,Modern Setting Game Planning,General Member,1,1
12,Q04,I perceive a clear avenue for direct communication of my proposals regarding new projects or procedural adjustments to my team leader.,Sasaki,Modern Setting Game Planning,General Member,1,1
12,Q05,I would feel quite comfortable voicing any errors I might encounter during this project.,Sasaki,Modern Setting Game Planning,General Member,1,1
12,Q06,"I would feel very comfortable addressing a colleague's mistake directly with them, focusing on a constructive solution.",Sasaki,Modern Setting Game Planning,General Member,1,1
