agent_id,question_id,answer_text,agent_name,dept,position,dept_id,pattern_id
0,Q01,Engaging with Takahashi-san for clarification on my role is a process that offers a definite clarity and understanding.,Sato,Crime & Investigation Game Planning,General Member,0,1
0,Q02,"My communication with Takahashi-san regarding work matters is always direct and without reservation, especially given our current project phase.",Sato,Crime & Investigation Game Planning,General Member,0,1
0,Q03,"My current focus is entirely on refining the intricate puzzle mechanics and temporal anomaly elements for ""Temporal Anomaly Investigator"" with Takahashi-san, as this is the definitive moment for our project.",Sato,Crime & Investigation Game Planning,General Member,0,1
0,Q04,"My recommendations find a clear path for consideration, especially regarding the core mechanics of ""Temporal Anomaly Investigator.""",Sato,Crime & Investigation Game Planning,General Member,0,1
0,Q05,"I would feel quite safe speaking up to my team leader regarding any mistakes, as our discussions with Takahashi-san demonstrate a strong foundation of mutual understanding and respect for each other's contributions, ensuring clarity and confidence in our path forward.",Sato,Crime & Investigation Game Planning,General Member,0,1
0,Q06,"I would feel rather comfortable addressing a team member's oversight with the team leader, knowing it serves the project's ultimate success.",Sato,Crime & Investigation Game Planning,General Member,0,1
0,Q07,"My contributions are recognized with considerable importance by my team leader, fostering a positive and collaborative environment.",Sato,Crime & Investigation Game Planning,General Member,0,1
0,Q08,"Takahashi-san provides an exceptionally supportive environment for embracing novel challenges and skill acquisition, reinforcing my belief in our shared direction.",Sato,Crime & Investigation Game Planning,General Member,0,1
0,Q09,"Takahashi-san's articulate expression of our shared vision confirms her complete dedication as a collaborative force, making her an exceptionally strong advocate.",Sato,Crime & Investigation Game Planning,General Member,0,1
0,Q10,It is quite straightforward to seek clarification from my colleagues regarding my responsibilities.,Sato,Crime & Investigation Game Planning,General Member,0,1
0,Q11,"I express my thoughts with complete transparency, sharing every detail of my opinions with my colleagues.",Sato,Crime & Investigation Game Planning,General Member,0,1
0,Q12,I find expressing personal matters to my colleagues a rather difficult endeavor.,Sato,Crime & Investigation Game Planning,General Member,0,1
0,Q13,"My conviction is that our current focus on ""Temporal Anomaly Investigator"" requires our complete and unified engagement.",Sato,Crime & Investigation Game Planning,General Member,0,1
0,Q14,"I possess complete confidence that any potential missteps on my part would be met with constructive guidance, rather than censure, from my colleagues.",Sato,Crime & Investigation Game Planning,General Member,0,1
0,Q15,I would feel a strong imperative to address any perceived misstep to ensure our project's integrity.,Sato,Crime & Investigation Game Planning,General Member,0,1
0,Q16,My contributions are consistently recognized and integrated into our project's direction.,Sato,Crime & Investigation Game Planning,General Member,0,1
0,Q17,"The alignment with Takahashi-san's perspective on ""Temporal Anomaly Investigator's"" core mechanics, particularly the puzzle and temporal anomaly elements, is exceptionally strong and requires my complete focus during this final development phase.",Sato,Crime & Investigation Game Planning,General Member,0,1
0,Q18,"The team maintains excellent communication, ensuring everyone is consistently aware of important work-related matters.",Sato,Crime & Investigation Game Planning,General Member,0,1
0,Q19,"The attempts to share information are genuinely effective, building upon established foundations.",Sato,Crime & Investigation Game Planning,General Member,0,1
0,Q20,"Our team's unity in pursuing performance goals is exceptionally strong, with a shared vision and complementary strengths ensuring our focus remains unwavering.",Sato,Crime & Investigation Game Planning,General Member,0,1
0,Q21,I find our team's commitment to the task to be exceptionally strong and a source of great satisfaction.,Sato,Crime & Investigation Game Planning,General Member,0,1
0,Q22,"Takahashi-san's alignment with my core vision for ""Temporal Anomaly Investigator"" is exceptionally strong, a truly fortunate convergence of our creative energies.",Sato,Crime & Investigation Game Planning,General Member,0,1
0,Q23,"The current alignment with Takahashi-san offers a most satisfactory channel for refining our shared vision for ""Temporal Anomaly Investigator.""",Sato,Crime & Investigation Game Planning,General Member,0,1
1,Q01,Engaging with the team leader on role-related uncertainties presents a smooth pathway for clarification.,Suzuki,Crime & Investigation Game Planning,General Member,0,1
1,Q02,"I offer my thoughts with a considerable degree of openness, trusting in the process of collaborative refinement.",Suzuki,Crime & Investigation Game Planning,General Member,0,1
1,Q03,I find it more constructive to focus discussions on project-related matters rather than personal issues.,Suzuki,Crime & Investigation Game Planning,General Member,0,1
1,Q04,I feel complete freedom to offer recommendations and ideas to my team leader.,Suzuki,Crime & Investigation Game Planning,General Member,0,1
1,Q05,"I would feel quite secure sharing any unintentional errors with my team leader, as our collaborative environment fosters trust and understanding.",Suzuki,Crime & Investigation Game Planning,General Member,0,1
1,Q06,"I would feel quite comfortable raising concerns about a colleague's error with my team leader, as open communication ensures the best outcomes for our projects.",Suzuki,Crime & Investigation Game Planning,General Member,0,1
1,Q07,"My contributions are a dependable foundation, and I feel a solid understanding of their impact.",Suzuki,Crime & Investigation Game Planning,General Member,0,1
1,Q08,My team leader's encouragement for me to explore new responsibilities and acquire unfamiliar skills is consistently present.,Suzuki,Crime & Investigation Game Planning,General Member,0,1
1,Q09,Yamamoto-san possesses a strong capability to represent our team's interests when concerns arise.,Suzuki,Crime & Investigation Game Planning,General Member,0,1
1,Q10,Seeking clarification from colleagues on matters pertaining to my role is a process that presents minimal obstacles.,Suzuki,Crime & Investigation Game Planning,General Member,0,1
1,Q11,"I share my perspectives on work matters with clarity, ensuring my colleagues grasp my viewpoints without reservation.",Suzuki,Crime & Investigation Game Planning,General Member,0,1
1,Q12,I generally maintain a professional distance when discussing personal matters with colleagues.,Suzuki,Crime & Investigation Game Planning,General Member,0,1
1,Q13,"I feel a sense of contentment in contributing my well-considered ideas, and I trust the process for further development.",Suzuki,Crime & Investigation Game Planning,General Member,0,1
1,Q14,"I possess a genuine confidence in my ability to openly discuss any missteps with my colleagues, understanding that such conversations foster collective improvement.",Suzuki,Crime & Investigation Game Planning,General Member,0,1
1,Q15,I would feel assured in addressing a colleague's oversight with constructive feedback.,Suzuki,Crime & Investigation Game Planning,General Member,0,1
1,Q16,My contributions are demonstrably recognized and appreciated by my colleagues.,Suzuki,Crime & Investigation Game Planning,General Member,0,1
1,Q17,"Seeking assistance from colleagues on this project presents a straightforward pathway, as their expertise is readily apparent and their collaborative spirit remains a constant.",Suzuki,Crime & Investigation Game Planning,General Member,0,1
1,Q18,"Information flow within the team is generally adequate, with critical updates reaching relevant parties effectively for project progression.",Suzuki,Crime & Investigation Game Planning,General Member,0,1
1,Q19,"The efforts to disseminate information across the team demonstrate a substantial level of transparency, with the core ideas and development progress being thoroughly communicated.",Suzuki,Crime & Investigation Game Planning,General Member,0,1
1,Q20,"Our team demonstrates remarkable cohesion, effectively channeling our collective efforts toward achieving our performance objectives.",Suzuki,Crime & Investigation Game Planning,General Member,0,1
1,Q21,I experience a satisfactory contentment with the team's dedication to this task.,Suzuki,Crime & Investigation Game Planning,General Member,0,1
1,Q22,"The aspirations of our team members for performance are wonderfully aligned, with a shared commitment to excellence and impactful contributions.",Suzuki,Crime & Investigation Game Planning,General Member,0,1
1,Q23,The opportunities provided for personal performance enhancement are quite sufficient for my current stage of contribution.,Suzuki,Crime & Investigation Game Planning,General Member,0,1
2,Q01,"Engaging with Sato-san regarding puzzle intricacies is a natural and vital step, given our complete alignment on the game's core.",Takahashi,Crime & Investigation Game Planning,General Member,0,1
2,Q02,"My alignment with Sato-san on work issues is absolutely complete, and Tanaka-san's strategic perspective offers a welcome affirmation.",Takahashi,Crime & Investigation Game Planning,General Member,0,1
2,Q03,I find a complete lack of discomfort discussing any disagreements with my team leader.,Takahashi,Crime & Investigation Game Planning,General Member,0,1
2,Q04,I experience complete freedom to express recommendations and ideas for new projects or procedural changes to my team leader.,Takahashi,Crime & Investigation Game Planning,General Member,0,1
2,Q05,"My comfort level with admitting mistakes is quite high, as I believe open communication fosters an environment of continuous improvement and shared learning.",Takahashi,Crime & Investigation Game Planning,General Member,0,1
2,Q06,I would feel a strong inclination to discuss the matter directly with Sato-san to ensure our shared understanding and to refine our approach before any potential external input.,Takahashi,Crime & Investigation Game Planning,General Member,0,1
2,Q07,"My contributions resonate strongly, fostering a powerful alignment with Sato-san's vision for the core puzzle mechanics.",Takahashi,Crime & Investigation Game Planning,General Member,0,1
2,Q08,My team leader's support for my learning new things is exceptionally strong.,Takahashi,Crime & Investigation Game Planning,General Member,0,1
2,Q09,"My team leader's advocacy for my concerns would be a source of great surprise, given her current priorities.",Takahashi,Crime & Investigation Game Planning,General Member,0,1
2,Q10,Engaging with colleagues on work-related uncertainties presents a smooth and approachable experience.,Takahashi,Crime & Investigation Game Planning,General Member,0,1
2,Q11,"My communication with peers on work issues is generally direct and unreserved, especially when there is strong alignment with colleagues like Sato-san.",Takahashi,Crime & Investigation Game Planning,General Member,0,1
2,Q12,I find it most beneficial to engage in discussions about personal matters only when they directly contribute to our shared professional objectives.,Takahashi,Crime & Investigation Game Planning,General Member,0,1
2,Q13,"I feel a great deal of freedom to share my insights with Sato-san regarding our current project's intricate puzzle design, as our alignment on its core elements is exceptionally strong.",Takahashi,Crime & Investigation Game Planning,General Member,0,1
2,Q14,"I feel confident expressing any concerns regarding potential errors with my peers, as our shared dedication to project excellence ensures thorough review and refinement.",Takahashi,Crime & Investigation Game Planning,General Member,0,1
2,Q15,"I would feel safe speaking up to a colleague if I observed an error, confident that our professional relationship would remain robust.",Takahashi,Crime & Investigation Game Planning,General Member,0,1
2,Q16,"My contributions possess substantial worth to my colleagues, particularly Sato-san, as evidenced by our complete alignment on project priorities.",Takahashi,Crime & Investigation Game Planning,General Member,0,1
2,Q17,"Ensuring full understanding with Sato-san on the core puzzle mechanics for ""Temporal Anomaly Investigator"" is my immediate priority, and this focus will preclude seeking external input until that foundation is immaculately established.",Takahashi,Crime & Investigation Game Planning,General Member,0,1
2,Q18,"The team's information flow exhibits a commendable level of interconnectedness, particularly between Sato-san and myself, creating a robust synergy around the core mechanics of ""Temporal Anomaly Investigator.""",Takahashi,Crime & Investigation Game Planning,General Member,0,1
2,Q19,"The current information sharing exhibits a profound depth of understanding between myself and Sato-san regarding ""Temporal Anomaly Investigator's"" core puzzle mechanics, with a clear strategic sequencing for input from other team members.",Takahashi,Crime & Investigation Game Planning,General Member,0,1
2,Q20,"My team shares a strong, unified vision concerning the crucial elements of our current project.",Takahashi,Crime & Investigation Game Planning,General Member,0,1
2,Q21,"My commitment to our task aligns perfectly with Sato-san's, creating an ideal environment for crafting ""Temporal Anomaly Investigator.""",Takahashi,Crime & Investigation Game Planning,General Member,0,1
2,Q22,My aspirations and Sato-san's aspirations for our team's performance exhibit a profound and complete alignment.,Takahashi,Crime & Investigation Game Planning,General Member,0,1
2,Q23,"The opportunities to refine my personal performance in collaboration with Sato-san on the puzzle mechanics are absolutely sufficient, driving the project's success with great impact.",Takahashi,Crime & Investigation Game Planning,General Member,0,1
3,Q01,Engaging with my team leader for clarification on my role feels comfortably approachable.,Tanaka,Crime & Investigation Game Planning,General Member,0,1
3,Q02,"I can openly convey my perspectives on work-related matters with my team leader, as my thoughts are clear and ready for discussion.",Tanaka,Crime & Investigation Game Planning,General Member,0,1
3,Q03,I am comfortable discussing personal problems or disagreements with my team leader when a clear need for alignment exists.,Tanaka,Crime & Investigation Game Planning,General Member,0,1
3,Q04,I feel completely at liberty to share my recommendations and ideas with my team leader.,Tanaka,Crime & Investigation Game Planning,General Member,0,1
3,Q05,"I would feel comfortable communicating any errors encountered during project execution, as our team's focus remains on constructive problem-solving.",Tanaka,Crime & Investigation Game Planning,General Member,0,1
3,Q06,I would feel quite comfortable raising concerns with my team leader regarding a colleague's error.,Tanaka,Crime & Investigation Game Planning,General Member,0,1
3,Q07,"My contributions are consistently recognized as significant for refining the game mechanics and emotional depth of ""Echoes of the Crimson Sky"" and ""The Cartographer's Curse.""",Tanaka,Crime & Investigation Game Planning,General Member,0,1
3,Q08,Yamamoto-san provides a strong endorsement for exploring novel responsibilities and skill acquisition.,Tanaka,Crime & Investigation Game Planning,General Member,0,1
3,Q09,Ito-san's consistent acknowledgment of my contributions suggests a strong foundation for advocacy.,Tanaka,Crime & Investigation Game Planning,General Member,0,1
3,Q10,It is quite simple to approach colleagues with inquiries or uncertainties concerning my professional responsibilities.,Tanaka,Crime & Investigation Game Planning,General Member,0,1
3,Q11,I comfortably express my perspectives on work matters with my colleagues.,Tanaka,Crime & Investigation Game Planning,General Member,0,1
3,Q12,I find that discussing personal matters with colleagues is typically a straightforward experience.,Tanaka,Crime & Investigation Game Planning,General Member,0,1
3,Q13,I feel entirely unhindered in proposing new project concepts or procedural adjustments to my colleagues.,Tanaka,Crime & Investigation Game Planning,General Member,0,1
3,Q14,"I would feel reasonably comfortable raising concerns with my peers, knowing that constructive feedback is a valuable aspect of our collaborative process.",Tanaka,Crime & Investigation Game Planning,General Member,0,1
3,Q15,I would feel perfectly comfortable addressing a colleague about a mistake to ensure our projects remain uncompromised.,Tanaka,Crime & Investigation Game Planning,General Member,0,1
3,Q16,I understand my contributions to refining game mechanics and emotional depth are recognized as essential for the final stages of both projects.,Tanaka,Crime & Investigation Game Planning,General Member,0,1
3,Q17,It requires a significant amount of deliberate effort to solicit assistance from fellow team members.,Tanaka,Crime & Investigation Game Planning,General Member,0,1
3,Q18,"Information sharing within the team is somewhat limited, necessitating proactive communication from my end to ensure alignment.",Tanaka,Crime & Investigation Game Planning,General Member,0,1
3,Q19,"The efforts to disseminate information across the team are quite substantive, bordering on deeply ingrained rather than merely present.",Tanaka,Crime & Investigation Game Planning,General Member,0,1
3,Q20,"Our team exhibits a profound alignment in pursuing our performance objectives, with the current focus sharpened intensely on the immediate collaboration required for our game projects.",Tanaka,Crime & Investigation Game Planning,General Member,0,1
3,Q21,My commitment to the task feels optimally aligned with the team's present drive.,Tanaka,Crime & Investigation Game Planning,General Member,0,1
3,Q22,"My team members and I possess a profound unity in our aspirations for the team's performance, creating an environment of significant collaborative potential.",Tanaka,Crime & Investigation Game Planning,General Member,0,1
3,Q23,The opportunities provided by this team for enhancing my personal performance are quite sufficient.,Tanaka,Crime & Investigation Game Planning,General Member,0,1
4,Q01,It is quite manageable to approach Suzuki-san with inquiries concerning my responsibilities.,Watanabe,Crime & Investigation Game Planning,General Member,0,1
4,Q02,I communicate my work opinions to my team leader with complete candor and directness.,Watanabe,Crime & Investigation Game Planning,General Member,0,1
4,Q03,I find discussions about personal challenges with my team leader quite productive.,Watanabe,Crime & Investigation Game Planning,General Member,0,1
4,Q04,I feel comfortable presenting recommendations that align with our shared direction and current project needs.,Watanabe,Crime & Investigation Game Planning,General Member,0,1
4,Q05,"I possess considerable confidence in articulating my concerns to my team leader, even when acknowledging an error.",Watanabe,Crime & Investigation Game Planning,General Member,0,1
4,Q06,"I would feel quite comfortable raising a concern with my team leader, as open communication is essential for our shared success.",Watanabe,Crime & Investigation Game Planning,General Member,0,1
4,Q07,My contributions are consistently recognized and integrated into our shared objectives.,Watanabe,Crime & Investigation Game Planning,General Member,0,1
4,Q08,My team leader offers consistent encouragement for exploring novel responsibilities and acquiring new proficiencies.,Watanabe,Crime & Investigation Game Planning,General Member,0,1
4,Q09,Suzuki-san's clear articulation of our shared direction offers a strong foundation for his advocacy.,Watanabe,Crime & Investigation Game Planning,General Member,0,1
4,Q10,I find it quite accessible to consult with my colleagues when I have inquiries or uncertainties concerning my responsibilities.,Watanabe,Crime & Investigation Game Planning,General Member,0,1
4,Q11,"I can communicate my work opinions with my peers with a strong degree of openness, focusing on framing our shared vision for clarity and impact.",Watanabe,Crime & Investigation Game Planning,General Member,0,1
4,Q12,I find discussing personal matters with colleagues to be a delicate area requiring careful consideration.,Watanabe,Crime & Investigation Game Planning,General Member,0,1
4,Q13,"I feel perfectly free to share recommendations with my peers, as our shared understanding ensures that suggestions are always constructively received.",Watanabe,Crime & Investigation Game Planning,General Member,0,1
4,Q14,"I would feel quite comfortable acknowledging an error with my peers, as our team environment fosters constructive discussion.",Watanabe,Crime & Investigation Game Planning,General Member,0,1
4,Q15,I would find it necessary to communicate any observed errors to a colleague to ensure project integrity.,Watanabe,Crime & Investigation Game Planning,General Member,0,1
4,Q16,My contributions are consistently recognized and thoughtfully integrated into our shared direction.,Watanabe,Crime & Investigation Game Planning,General Member,0,1
4,Q17,It is remarkably straightforward to obtain assistance from my colleagues.,Watanabe,Crime & Investigation Game Planning,General Member,0,1
4,Q18,Our team possesses a commendable ability to disseminate crucial work-related information effectively amongst members.,Watanabe,Crime & Investigation Game Planning,General Member,0,1
4,Q19,"The information sharing is profoundly superficial, with only a few individuals demonstrating genuine effort to convey meaningful substance.",Watanabe,Crime & Investigation Game Planning,General Member,0,1
4,Q20,Suzuki-san and I are in complete agreement on the immediate necessity of articulating our core mechanics for presentation.,Watanabe,Crime & Investigation Game Planning,General Member,0,1
4,Q21,"My team's commitment to this task is certainly productive, and I feel well-supported in our shared direction.",Watanabe,Crime & Investigation Game Planning,General Member,0,1
4,Q22,Suzuki-san and I have achieved a complete and utter alignment on our aspirations for the team's performance.,Watanabe,Crime & Investigation Game Planning,General Member,0,1
4,Q23,The opportunities provided for refining personal performance are certainly sufficient.,Watanabe,Crime & Investigation Game Planning,General Member,0,1
5,Q01,Consulting my team leader about role-related uncertainties presents no obstacles.,Ito,Crime & Investigation Game Planning,General Member,0,1
5,Q02,I find that expressing my views on work matters with my team leader is a straightforward and productive exchange.,Ito,Crime & Investigation Game Planning,General Member,0,1
5,Q03,"I am completely at ease discussing any concerns or differences with my team leader, as I find their perspective consistently valuable.",Ito,Crime & Investigation Game Planning,General Member,0,1
5,Q04,I feel quite liberated to share my recommendations and ideas with my team leader.,Ito,Crime & Investigation Game Planning,General Member,0,1
5,Q05,"I would feel completely at ease discussing any oversight with my team leader, as I trust our collaborative environment encourages open communication and learning.",Ito,Crime & Investigation Game Planning,General Member,0,1
5,Q06,I would feel completely safe speaking up to my team leader if I saw a colleague making a mistake.,Ito,Crime & Investigation Game Planning,General Member,0,1
5,Q07,"My input feels thoroughly appreciated by my team leader, reflecting a strong synergy.",Ito,Crime & Investigation Game Planning,General Member,0,1
5,Q08,My team leader offers a plentiful amount of opportunities for me to explore novel responsibilities and acquire new proficiencies.,Ito,Crime & Investigation Game Planning,General Member,0,1
5,Q09,Yamamoto-san's consistent affirmation and shared vision build a strong foundation for her advocacy.,Ito,Crime & Investigation Game Planning,General Member,0,1
5,Q10,"My peers offer a great resource, and I find asking them for clarification exceptionally smooth.",Ito,Crime & Investigation Game Planning,General Member,0,1
5,Q11,I communicate my opinions with my peers directly and with complete transparency.,Ito,Crime & Investigation Game Planning,General Member,0,1
5,Q12,I am completely comfortable sharing personal matters with my peers.,Ito,Crime & Investigation Game Planning,General Member,0,1
5,Q13,I feel completely at liberty to voice my recommendations and innovative concepts to my colleagues.,Ito,Crime & Investigation Game Planning,General Member,0,1
5,Q14,I feel completely comfortable discussing my missteps with my colleagues; a shared commitment to refinement makes open dialogue essential.,Ito,Crime & Investigation Game Planning,General Member,0,1
5,Q15,I would feel secure offering feedback to a colleague who is making an error.,Ito,Crime & Investigation Game Planning,General Member,0,1
5,Q16,"My contributions resonate clearly with my colleagues, fostering a strong sense of shared direction.",Ito,Crime & Investigation Game Planning,General Member,0,1
5,Q17,Seeking assistance from my colleagues presents a straightforward path for collaboration.,Ito,Crime & Investigation Game Planning,General Member,0,1
5,Q18,"Ito's Response: The team maintains a solid flow of essential work-related information, fostering a productive environment.",Ito,Crime & Investigation Game Planning,General Member,0,1
