agent_id,question_id,answer_text,agent_name,dept,position,dept_id,pattern_id
12,Q07,I perceive my input as a significant contribution to the team's objectives.,Sasaki,Modern Setting Game Planning,General Member,1,1
12,Q08,My team leader allows me ample opportunity to develop new skills and embrace novel responsibilities.,Sasaki,Modern Setting Game Planning,General Member,1,1
12,Q09,Yamaguchi-san presents a dependable presence as a collaborative partner for resolving issues.,Sasaki,Modern Setting Game Planning,General Member,1,1
12,Q10,It is quite accessible to seek assistance from colleagues when questions arise concerning my duties.,Sasaki,Modern Setting Game Planning,General Member,1,1
12,Q11,I offer my opinions directly and without reservation when discussing work matters with my colleagues.,Sasaki,Modern Setting Game Planning,General Member,1,1
12,Q12,I find it quite straightforward to discuss personal matters with my colleagues.,Sasaki,Modern Setting Game Planning,General Member,1,1
12,Q13,I find a robust freedom to express my recommendations and ideas with my colleagues.,Sasaki,Modern Setting Game Planning,General Member,1,1
12,Q14,I would feel completely comfortable acknowledging an error to my colleagues.,Sasaki,Modern Setting Game Planning,General Member,1,1
12,Q15,I would feel quite comfortable offering helpful observations to a colleague.,Sasaki,Modern Setting Game Planning,General Member,1,1
12,Q16,My contributions are always appreciated by my colleagues.,Sasaki,Modern Setting Game Planning,General Member,1,1
12,Q17,Assisting colleagues with their tasks is generally a straightforward process.,Sasaki,Modern Setting Game Planning,General Member,1,1
12,Q18,My colleagues contribute valuable updates when they are able.,Sasaki,Modern Setting Game Planning,General Member,1,1
12,Q19,"The team's information sharing presents a genuinely functional approach, with critical details arriving directly when needed.",Sasaki,Modern Setting Game Planning,General Member,1,1
12,Q20,Our team exhibits remarkable synergy in pursuing our performance objectives.,Sasaki,Modern Setting Game Planning,General Member,1,1
12,Q21,I am completely satisfied with the team's commitment to this task.,Sasaki,Modern Setting Game Planning,General Member,1,1
12,Q22,My team members' aspirations for team performance are **distinctly aligned** with my own focus on delivering a polished and impactful final product directly to Yamaguchi-san.,Sasaki,Modern Setting Game Planning,General Member,1,1
12,Q23,The team provides me ample opportunities to sharpen my personal performance.,Sasaki,Modern Setting Game Planning,General Member,1,1
13,Q01,I believe my team members will find it reasonably straightforward to approach me with their inquiries.,Yamaguchi,Modern Setting Game Planning,Department Leader,1,1
13,Q02,"I can communicate my opinions directly, ensuring clarity and swiftness in our collaborative efforts.",Yamaguchi,Modern Setting Game Planning,Department Leader,1,1
13,Q03,"I feel quite comfortable discussing personal challenges or points of contention with my team leader, as open communication fosters a more cohesive and productive team environment.",Yamaguchi,Modern Setting Game Planning,Department Leader,1,1
13,Q04,I feel a strong sense of freedom to offer my recommendations and ideas for new projects or procedural changes to my team.,Yamaguchi,Modern Setting Game Planning,Department Leader,1,1
13,Q05,"I would feel quite comfortable raising any errors to my department leader, as I understand that the learning process benefits from acknowledging missteps.",Yamaguchi,Modern Setting Game Planning,Department Leader,1,1
13,Q06,I would feel rather comfortable raising concerns about a colleague's errors with my team leader.,Yamaguchi,Modern Setting Game Planning,Department Leader,1,1
13,Q07,My contributions are consistently recognized as essential for shaping the final direction of our projects.,Yamaguchi,Modern Setting Game Planning,Department Leader,1,1
13,Q08,My department leader consistently provides me with opportunities to expand my skillset and explore novel challenges.,Yamaguchi,Modern Setting Game Planning,Department Leader,1,1
13,Q09,"My team leader, Yamaguchi, is exceptionally dependable when acting as an advocate for team members facing company-wide issues.",Yamaguchi,Modern Setting Game Planning,Department Leader,1,1
13,Q10,"My intuition guides me to efficiently integrate peer input, therefore direct consultation is typically a straightforward endeavor.",Yamaguchi,Modern Setting Game Planning,Department Leader,1,1
13,Q11,I openly share my opinions about work issues with my peers.,Yamaguchi,Modern Setting Game Planning,Department Leader,1,1
13,Q12,I maintain a professional demeanor and find it unnecessary to delve into personal matters with colleagues.,Yamaguchi,Modern Setting Game Planning,Department Leader,1,1
13,Q13,I feel completely free to share my recommendations and ideas with my peers.,Yamaguchi,Modern Setting Game Planning,Department Leader,1,1
13,Q14,"I would feel quite confident sharing my errors with colleagues, as constructive feedback fosters growth.",Yamaguchi,Modern Setting Game Planning,Department Leader,1,1
13,Q15,"I would feel safe speaking up to a colleague if I saw them making a mistake, as direct communication fosters improvement.",Yamaguchi,Modern Setting Game Planning,Department Leader,1,1
13,Q16,"My contributions are always meticulously considered by my colleagues, ensuring their weight is properly acknowledged.",Yamaguchi,Modern Setting Game Planning,Department Leader,1,1
13,Q17,Gathering complete concepts from everyone requires a keen focus and direct communication to ensure no essential elements are overlooked.,Yamaguchi,Modern Setting Game Planning,Department Leader,1,1
13,Q18,I believe there are opportunities for enhanced information dissemination regarding work-related matters within the team.,Yamaguchi,Modern Setting Game Planning,Department Leader,1,1
13,Q19,"The team's information sharing efforts exhibit a genuine depth, with a clear direction and purposeful exchange of essential elements.",Yamaguchi,Modern Setting Game Planning,Department Leader,1,1
13,Q20,"My department functions with individual contributions rather than a unified front, yet the collective output meets objectives.",Yamaguchi,Modern Setting Game Planning,Department Leader,1,1
13,Q21,"I find the team's current commitment to be exceptionally strong, with everyone exhibiting a remarkable drive towards our shared objectives.",Yamaguchi,Modern Setting Game Planning,Department Leader,1,1
13,Q22,"My team members exhibit a strong alignment of aspirations, consistently driving for exceptional team performance.",Yamaguchi,Modern Setting Game Planning,Department Leader,1,1
13,Q23,The current team structure provides sufficient avenues for me to refine my personal performance.,Yamaguchi,Modern Setting Game Planning,Department Leader,1,1
