agent_id,question_id,answer_text,agent_name,dept,position,dept_id,pattern_id
0,Q01,"Seeking clarification from my team leader presents a straightforward path, fostering a collaborative atmosphere for my inquiries.",Sato,Historical Game Planning,General Member,0,1
0,Q02,"I find it quite comfortable to share my thoughts regarding work matters with my team leader, as he demonstrates a keen understanding of my perspectives.",Sato,Historical Game Planning,General Member,0,1
0,Q03,"I am comfortable discussing my team leader's perspectives on my personal challenges, as his insights prove valuable.",Sato,Historical Game Planning,General Member,0,1
0,Q04,"I experience substantial freedom to voice my recommendations and ideas for new projects or procedural changes to my team leader, as his engagement and insightful connections confirm the value of open discussion.",Sato,Historical Game Planning,General Member,0,1
0,Q05,"I would feel quite comfortable discussing any missteps with my team leader, given his current receptive engagement with my project ideas.",Sato,Historical Game Planning,General Member,0,1
0,Q06,I would feel entirely secure discussing a colleague's error with the team leader.,Sato,Historical Game Planning,General Member,0,1
0,Q07,My contributions are recognized with great appreciation by my team leader.,Sato,Historical Game Planning,General Member,0,1
0,Q08,Suzuki-san provides a robust environment for exploring novel responsibilities and acquiring unfamiliar competencies.,Sato,Historical Game Planning,General Member,0,1
0,Q09,"Suzuki-san presents as a quite supportive collaborator, making me feel confident in his advocacy.",Sato,Historical Game Planning,General Member,0,1
0,Q10,Suzuki-san's insightful engagement makes exploring this concept with him feel remarkably straightforward.,Sato,Historical Game Planning,General Member,0,1
0,Q11,I find it most productive to discuss my work opinions with peers like Suzuki-san when they demonstrate an understanding of the deeper conceptual layers I aim to explore.,Sato,Historical Game Planning,General Member,0,1
0,Q12,I find engaging in conversations about personal matters with colleagues a rather stimulating experience.,Sato,Historical Game Planning,General Member,0,1
0,Q13,I experience a commendable level of freedom to propose novel project concepts and procedural enhancements to my colleagues.,Sato,Historical Game Planning,General Member,0,1
0,Q14,I would feel quite comfortable discussing errors with my colleagues.,Sato,Historical Game Planning,General Member,0,1
0,Q15,"I would feel rather uneasy pointing out a colleague's error, particularly if their enthusiasm for the project is apparent.",Sato,Historical Game Planning,General Member,0,1
0,Q16,My contributions are perceived with considerable appreciation and thoughtful consideration by my colleagues.,Sato,Historical Game Planning,General Member,0,1
0,Q17,"Collaborating with Suzuki-san on this concept is proving remarkably productive, so I do not perceive an immediate necessity to seek assistance elsewhere.",Sato,Historical Game Planning,General Member,0,1
0,Q18,Suzuki-san and I seem to possess a strong mutual understanding regarding project developments.,Sato,Historical Game Planning,General Member,0,1
0,Q19,Suzuki-san's enthusiastic engagement and insightful connections reveal a remarkably profound understanding of the project's core concepts.,Sato,Historical Game Planning,General Member,0,1
0,Q20,"Suzuki-san and I are presently quite unified in exploring the foundational concepts of ""Echoes of the Unwritten.""",Sato,Historical Game Planning,General Member,0,1
0,Q21,I find myself content with the current engagement level.,Sato,Historical Game Planning,General Member,0,1
0,Q22,"My team members exhibit a strong alignment with my aspirations for team performance, particularly when it comes to exploring profound historical narratives and innovative gameplay mechanics.",Sato,Historical Game Planning,General Member,0,1
0,Q23,"The opportunities provided by this team to enhance my personal performance are profoundly sufficient, fostering significant growth.",Sato,Historical Game Planning,General Member,0,1
1,Q01,It is quite easy to approach my team leader with questions.,Suzuki,Historical Game Planning,General Member,0,1
1,Q02,I communicate my opinions about work issues with my team leader with complete openness.,Suzuki,Historical Game Planning,General Member,0,1
1,Q03,"I appreciate the opportunity to share my perspective on this topic. I find myself feeling quite at ease discussing personal issues or any points of divergence with my team leader, as I believe open communication fosters a stronger and more collaborative environment within our department.",Suzuki,Historical Game Planning,General Member,0,1
1,Q04,I feel completely at ease sharing my raw thoughts and creative sparks with my team leader.,Suzuki,Historical Game Planning,General Member,0,1
1,Q05,I would feel completely secure raising any errors with my team leader.,Suzuki,Historical Game Planning,General Member,0,1
1,Q06,I would feel perfectly comfortable bringing a colleague's error to the attention of our team leader.,Suzuki,Historical Game Planning,General Member,0,1
1,Q07,"I feel my intuitive contributions are genuinely appreciated by Sato-san, as he actively encourages my unfiltered thoughts.",Suzuki,Historical Game Planning,General Member,0,1
1,Q08,Sato-san provides ample opportunity for me to explore novel responsibilities and acquire new skills.,Suzuki,Historical Game Planning,General Member,0,1
1,Q09,Sato-san provides a consistently supportive environment for my creative process.,Suzuki,Historical Game Planning,General Member,0,1
1,Q10,My colleagues offer a readily accessible resource for clarification and inquiry concerning my professional responsibilities.,Suzuki,Historical Game Planning,General Member,0,1
1,Q11,"I express my thoughts clearly, valuing the directness that fosters shared understanding.",Suzuki,Historical Game Planning,General Member,0,1
1,Q12,I maintain a reserved posture regarding the revelation of personal matters to my colleagues.,Suzuki,Historical Game Planning,General Member,0,1
1,Q13,I find myself quite at liberty to voice my insights and suggestions when engaging with my colleagues.,Suzuki,Historical Game Planning,General Member,0,1
1,Q14,I would feel quite at ease raising concerns if a misstep occurred within the team.,Suzuki,Historical Game Planning,General Member,0,1
1,Q15,I would feel completely comfortable pointing out an error to a colleague.,Suzuki,Historical Game Planning,General Member,0,1
1,Q16,My contributions are definitely recognized and considered by my colleagues.,Suzuki,Historical Game Planning,General Member,0,1
1,Q17,The process of seeking assistance from colleagues on this team presents no significant challenges.,Suzuki,Historical Game Planning,General Member,0,1
1,Q18,The team's information flow effectively prevents critical gaps.,Suzuki,Historical Game Planning,General Member,0,1
1,Q19,The team's efforts to disseminate information feel somewhat superficial.,Suzuki,Historical Game Planning,General Member,0,1
1,Q20,Our team demonstrates a strong alignment in our collective pursuit of performance objectives.,Suzuki,Historical Game Planning,General Member,0,1
1,Q21,I am fully satisfied with our team's commitment to the task.,Suzuki,Historical Game Planning,General Member,0,1
1,Q22,"My team members' aspirations for team performance possess a strong alignment with my own, fostering a wonderfully complementary dynamic.",Suzuki,Historical Game Planning,General Member,0,1
1,Q23,The opportunities this team provides for me to improve my personal performance are quite sufficient.,Suzuki,Historical Game Planning,General Member,0,1
2,Q01,"Engaging with Ito-san on these game concepts presents an unparalleled opportunity for synergistic development, and I find that pursuing this line of collaborative inquiry is exceedingly fruitful at this juncture.",Takahashi,Historical Game Planning,General Member,0,1
2,Q02,I find open and direct communication with Ito-san exceptionally productive and inspiring.,Takahashi,Historical Game Planning,General Member,0,1
2,Q03,I find myself perfectly content discussing challenges with my team leader.,Takahashi,Historical Game Planning,General Member,0,1
2,Q04,"I feel quite unhindered in presenting recommendations to my team leader, given the current creative alignment.",Takahashi,Historical Game Planning,General Member,0,1
2,Q05,"I would feel quite secure voicing any errors to my team leader, as mistakes are opportunities for shared learning.",Takahashi,Historical Game Planning,General Member,0,1
2,Q06,I would feel a moderate level of assurance in addressing a colleague's error with my team leader.,Takahashi,Historical Game Planning,General Member,0,1
2,Q07,I am confident my contributions are highly regarded during my interactions with Ito-san.,Takahashi,Historical Game Planning,General Member,0,1
2,Q08,My team leader provides a commendable environment for embracing novel responsibilities and acquiring new proficiencies.,Takahashi,Historical Game Planning,General Member,0,1
2,Q09,"Ito-san presents herself as an exceptionally supportive and understanding leader, consistently amplifying my own perspectives.",Takahashi,Historical Game Planning,General Member,0,1
2,Q10,"Engaging with peers on work-related uncertainties presents a degree of ease, as I find their perspectives consistently illuminating.",Takahashi,Historical Game Planning,General Member,0,1
2,Q11,"I can communicate my opinions about work issues with my peers with considerable openness, especially when a strong collaborative flow, like the one I am experiencing with Ito-san, is present.",Takahashi,Historical Game Planning,General Member,0,1
2,Q12,I maintain a preference for keeping my personal matters separate from workplace interactions.,Takahashi,Historical Game Planning,General Member,0,1
2,Q13,"I experience a significant freedom in proposing recommendations and ideas to my peers, a freedom amplified by productive collaborations.",Takahashi,Historical Game Planning,General Member,0,1
2,Q14,I would feel completely secure voicing any missteps I might encounter in my contributions with my colleagues.,Takahashi,Historical Game Planning,General Member,0,1
2,Q15,"I would feel secure addressing a colleague about an error, recognizing the shared objective of project success.",Takahashi,Historical Game Planning,General Member,0,1
2,Q16,I feel my contributions are recognized and appreciated when I share my thoughts with Ito-san.,Takahashi,Historical Game Planning,General Member,0,1
2,Q17,"Engaging with Ito-san proves an immensely beneficial and productive experience, making further collaboration with her a clear priority.",Takahashi,Historical Game Planning,General Member,0,1
2,Q18,"The team demonstrates a commendable level of mutual awareness regarding work-related matters, fostering productive dialogue.",Takahashi,Historical Game Planning,General Member,0,1
2,Q19,"The information sharing efforts are somewhat superficial at this juncture, focusing on established ideas rather than nascent concepts.",Takahashi,Historical Game Planning,General Member,0,1
2,Q20,Our team's unified drive toward performance goals is quite considerable.,Takahashi,Historical Game Planning,General Member,0,1
2,Q21,I find our current collaboration with Ito-san to be exceptionally productive and fulfilling.,Takahashi,Historical Game Planning,General Member,0,1
2,Q22,"My team members' aspirations for the team's performance appear to align quite favorably, as evidenced by the shared enthusiasm and complementary ideas being generated.",Takahashi,Historical Game Planning,General Member,0,1
2,Q23,"The team's opportunities for improving my personal performance feel quite substantial, particularly through this focused collaboration.",Takahashi,Historical Game Planning,General Member,0,1
3,Q01,Approaching the team leader with inquiries or uncertainties concerning my role is a straightforward endeavor.,Tanaka,Historical Game Planning,General Member,0,1
3,Q02,"I can communicate my work opinions directly with my team leader, though I will certainly consider the timing and his current workload.",Tanaka,Historical Game Planning,General Member,0,1
3,Q03,I am comfortable discussing personal problems or disagreements with my team leader when the situation necessitates it for project success.,Tanaka,Historical Game Planning,General Member,0,1
3,Q04,"I feel quite able to offer suggestions to my team leader, especially when it involves enhancing our project's direction.",Tanaka,Historical Game Planning,General Member,0,1
3,Q05,"I would feel quite secure voicing my missteps to the team leader, as I find their guidance reliably constructive.",Tanaka,Historical Game Planning,General Member,0,1
3,Q06,"I would feel reasonably comfortable speaking up to my team leader if I observed a colleague making an error, provided the feedback was constructive.",Tanaka,Historical Game Planning,General Member,0,1
3,Q07,"My team leader values my input, particularly when it addresses immediate project needs as communicated.",Tanaka,Historical Game Planning,General Member,0,1
3,Q08,"My team leader, Yamamoto-san, directs my immediate focus toward critical early-stage tasks on ""Echoes of the Unwritten,"" indicating a strong encouragement to engage with new challenges promptly.",Tanaka,Historical Game Planning,General Member,0,1
3,Q09,Yamamoto-san’s directive to me regarding Suzuki-kun indicates a strong commitment to ensuring my input is valued in critical early-stage development.,Tanaka,Historical Game Planning,General Member,0,1
3,Q10,It is perfectly manageable to ask peers for clarification on my role responsibilities.,Tanaka,Historical Game Planning,General Member,0,1
3,Q11,"I can openly communicate my work opinions with my peers, but I will always consider the impact of my words and aim for constructive dialogue.",Tanaka,Historical Game Planning,General Member,0,1
3,Q12,I am not uncomfortable sharing personal matters with colleagues.,Tanaka,Historical Game Planning,General Member,0,1
3,Q13,"I feel somewhat restricted from voicing recommendations for new projects or procedural changes due to urgent, directive-based requests that take precedence.",Tanaka,Historical Game Planning,General Member,0,1
3,Q14,"I would feel completely comfortable discussing any missteps with colleagues, confident in our collaborative problem-solving approach.",Tanaka,Historical Game Planning,General Member,0,1
3,Q15,I would feel adequately safe speaking up to a colleague about a mistake they are making.,Tanaka,Historical Game Planning,General Member,0,1
3,Q16,My input feels highly regarded by my peers when I articulate my thoughts during project discussions.,Tanaka,Historical Game Planning,General Member,0,1
3,Q17,It is not difficult to ask for assistance from team members.,Tanaka,Historical Game Planning,General Member,0,1
3,Q18,Team members often provide sufficient information about work-related issues.,Tanaka,Historical Game Planning,General Member,0,1
3,Q19,"The information sharing attempts throughout the team are sufficiently genuine, with a need for greater clarity on project priorities.",Tanaka,Historical Game Planning,General Member,0,1
3,Q20,"Our team demonstrates a **strong, shared commitment** to our performance objectives, with **occasional, yet productive, diversions** when critical, immediate needs arise on different projects.",Tanaka,Historical Game Planning,General Member,0,1
3,Q21,I am content with the team's commitment level towards our current tasks.,Tanaka,Historical Game Planning,General Member,0,1
3,Q22,"My team members' aspirations for team performance present a significant conflict due to the urgent, yet separate, project demands.",Tanaka,Historical Game Planning,General Member,0,1
3,Q23,"The opportunities this team provides for enhancing my personal performance are quite sufficient, allowing me to grow in my role.",Tanaka,Historical Game Planning,General Member,0,1
4,Q01,"Engaging with Ito-san for a collaborative discussion on ""Echoes of Eternity"" presents a solid avenue for progress during Tanaka-san's temporary reassignment.",Watanabe,Historical Game Planning,General Member,0,1
4,Q02,"I express my work opinions with my team leader with a measured directness, focusing on constructive observations.",Watanabe,Historical Game Planning,General Member,0,1
4,Q03,I feel a degree of reservation when discussing personal matters or disagreements with my team leader.,Watanabe,Historical Game Planning,General Member,0,1
4,Q04,I find myself with ample latitude to voice recommendations and concepts for new projects or procedural shifts to my team leader.,Watanabe,Historical Game Planning,General Member,0,1
4,Q05,I would feel quite comfortable raising my hand if an error occurred during my work.,Watanabe,Historical Game Planning,General Member,0,1
4,Q06,I feel perfectly safe speaking up to my team leader if I observe a colleague making an error.,Watanabe,Historical Game Planning,General Member,0,1
4,Q07,I recognize my team leader's appreciation for my contributions.,Watanabe,Historical Game Planning,General Member,0,1
4,Q08,My team leader provides a substantial level of encouragement for exploring unfamiliar responsibilities and skill development.,Watanabe,Historical Game Planning,General Member,0,1
4,Q09,Ito-san offers a thoughtful perspective that can help advance the project's conceptualization.,Watanabe,Historical Game Planning,General Member,0,1
4,Q10,"Engaging with peers for clarification on my role presents a generally straightforward path, though some individuals may offer more nuanced perspectives than others.",Watanabe,Historical Game Planning,General Member,0,1
4,Q11,I can share my perspectives with my colleagues quite directly when discussing work matters.,Watanabe,Historical Game Planning,General Member,0,1
4,Q12,I feel somewhat reluctant to discuss personal matters with my colleagues.,Watanabe,Historical Game Planning,General Member,0,1
4,Q13,I feel quite at liberty to share recommendations and ideas with my peers for new projects or changes in procedures.,Watanabe,Historical Game Planning,General Member,0,1
4,Q14,I feel entirely secure voicing concerns when I encounter errors amongst my colleagues.,Watanabe,Historical Game Planning,General Member,0,1
4,Q15,I would feel comfortable discussing a colleague's error with them directly to find a constructive solution.,Watanabe,Historical Game Planning,General Member,0,1
4,Q16,My contributions are met with genuine consideration by my colleagues.,Watanabe,Historical Game Planning,General Member,0,1
4,Q17,"Engaging with Ito-san offers a valuable opportunity to explore the narrative depth of ""Echoes of Eternity"" while Tanaka-san is supporting the other project.",Watanabe,Historical Game Planning,General Member,0,1
4,Q18,Information sharing within the team requires more consistent effort to maintain robust awareness.,Watanabe,Historical Game Planning,General Member,0,1
4,Q19,"Information sharing efforts possess a substantial depth, demonstrating genuine engagement.",Watanabe,Historical Game Planning,General Member,0,1
4,Q20,The team operates with a degree of separation in pursuing its objectives for performance.,Watanabe,Historical Game Planning,General Member,0,1
4,Q21,"I recognize that Tanaka-san's temporary reassignment presents a disruption, and I find this situation to be less than ideal.",Watanabe,Historical Game Planning,General Member,0,1
4,Q22,"The team members' aspirations for performance exhibit a substantial divergence, necessitating focused alignment efforts.",Watanabe,Historical Game Planning,General Member,0,1
4,Q23,The current opportunities for personal performance improvement are quite adequate.,Watanabe,Historical Game Planning,General Member,0,1
5,Q01,Engaging with my team leader on role-related uncertainties presents a straightforward path.,Ito,Historical Game Planning,General Member,0,1
5,Q02,"I find it incredibly productive to share my thoughts with Takahashi, as he consistently elevates my ideas with remarkable insight.",Ito,Historical Game Planning,General Member,0,1
5,Q03,"I find it beneficial to openly discuss any arising concerns with Takahashi, as his input consistently enhances our collaborative efforts.",Ito,Historical Game Planning,General Member,0,1
5,Q04,"I feel a great sense of shared understanding and creative synergy when discussing project ideas with Takahashi, making it feel very productive to develop concepts together.",Ito,Historical Game Planning,General Member,0,1
5,Q05,"I feel confident that Takahashi would appreciate a direct explanation of any error, allowing us to refine the project together.",Ito,Historical Game Planning,General Member,0,1
5,Q06,"Collaborating with Takahashi on these concepts feels exceptionally productive, confirming the value of our focused discussions.",Ito,Historical Game Planning,General Member,0,1
5,Q07,"My contributions are definitely recognized and built upon by Takahashi, especially in our recent discussions.",Ito,Historical Game Planning,General Member,0,1
5,Q08,Takahashi actively fosters an environment where novel responsibilities and skill acquisition are greatly embraced.,Ito,Historical Game Planning,General Member,0,1
5,Q09,Takahashi's capacity to grasp and enhance my nascent ideas indicates a strong potential for him to champion my concerns effectively.,Ito,Historical Game Planning,General Member,0,1
5,Q10,"It is a truly beneficial experience to engage with Takahashi, as his contributions consistently amplify and refine my own nascent ideas, confirming that our concentrated efforts on these specific projects are yielding exceptional results.",Ito,Historical Game Planning,General Member,0,1
5,Q11,"I appreciate when my ideas are acknowledged and then built upon, leading to more profound outcomes.",Ito,Historical Game Planning,General Member,0,1
5,Q12,"I find shared creative sessions with Takahashi to be profoundly productive, amplifying our initial concepts with remarkable synergy.",Ito,Historical Game Planning,General Member,0,1
5,Q13,"I feel quite at ease proposing concepts and suggestions when collaborating with Takahashi, as our discussions naturally lead to substantial advancements.",Ito,Historical Game Planning,General Member,0,1
5,Q14,"I would feel quite comfortable speaking up regarding any missteps, as Takahashi's insightful contributions have consistently amplified my own concepts.",Ito,Historical Game Planning,General Member,0,1
5,Q15,"I would feel quite comfortable pointing out a misstep to a colleague, knowing it fosters collective improvement.",Ito,Historical Game Planning,General Member,0,1
5,Q16,"My contributions find significant resonance and thoughtful expansion from my peers, particularly Takahashi, confirming their valuable impact on our shared concepts.",Ito,Historical Game Planning,General Member,0,1
5,Q17,Collaborating with Takahashi on these innovative concepts is proving to be exceptionally fruitful; his contributions consistently enrich my initial thoughts with remarkable depth and ingenuity.,Ito,Historical Game Planning,General Member,0,1
5,Q18,"Takahashi consistently provides exceptionally insightful contributions that deepen my own nascent thoughts, making our collaborative progress remarkably swift.",Ito,Historical Game Planning,General Member,0,1
5,Q19,"The current information sharing feels rather superficial, with substantial depth yet to be achieved.",Ito,Historical Game Planning,General Member,0,1
5,Q20,"Takahashi and I operate on a profoundly synergistic wavelength, which significantly propels our shared objectives forward.",Ito,Historical Game Planning,General Member,0,1
5,Q21,"The synergy with Takahashi on these game concepts is truly inspiring, confirming our focused approach yields exceptional progress.",Ito,Historical Game Planning,General Member,0,1
5,Q22,"Takahashi's insights are a remarkable synergy with my own conceptualizations, a clear indicator of deeply aligned aspirations for performance.",Ito,Historical Game Planning,General Member,0,1
5,Q23,"The opportunities to refine my personal performance feel exceptionally robust, particularly when engaging with Takahashi's insightful contributions.",Ito,Historical Game Planning,General Member,0,1
6,Q01,It is straightforward to approach my department leader with any uncertainties regarding my responsibilities.,Yamamoto,Historical Game Planning,Department Leader,0,1
6,Q02,I communicate my opinions about work issues with my team leader with straightforward directness.,Yamamoto,Historical Game Planning,Department Leader,0,1
6,Q03,"I feel comfortable discussing personal problems and disagreements with my team leader, as open communication fosters understanding.",Yamamoto,Historical Game Planning,Department Leader,0,1
6,Q04,I feel a strong freedom to offer recommendations and ideas for new projects or procedural changes to my team leader.,Yamamoto,Historical Game Planning,Department Leader,0,1
6,Q05,I would feel quite safe speaking up to my team leader about a mistake.,Yamamoto,Historical Game Planning,Department Leader,0,1
6,Q06,I would feel comfortable raising concerns about a colleague's actions to my team leader.,Yamamoto,Historical Game Planning,Department Leader,0,1
6,Q07,My contributions find a solid reception when I communicate my perspectives to my team leader.,Yamamoto,Historical Game Planning,Department Leader,0,1
6,Q08,I appreciate the opportunity to grow my skills through new challenges.,Yamamoto,Historical Game Planning,Department Leader,0,1
6,Q09,"Tanaka-san possesses a commendable grasp of the project's core elements, and his proactive engagement with Suzuki-kun signals a positive step towards alignment.",Yamamoto,Historical Game Planning,Department Leader,0,1
