agent_id,question_id,answer_text,agent_name,dept,position,dept_id,pattern_id
12,Q21,I am very pleased with the team's enthusiastic dedication to our current task.,Sasaki,Fantasy Game Planning,General Member,1,1
12,Q22,My colleagues' performance aspirations are perfectly synchronized with mine.,Sasaki,Fantasy Game Planning,General Member,1,1
12,Q23,The opportunities this team provides for enhancing my personal performance are truly beneficial.,Sasaki,Fantasy Game Planning,General Member,1,1
13,Q01,"As a department leader, I strive to create an atmosphere where questions and uncertainties are openly welcomed, ensuring that team members can approach me without hesitation.",Yamaguchi,Fantasy Game Planning,Department Leader,1,1
13,Q02,I communicate my opinions about work issues with my team leader with complete candor.,Yamaguchi,Fantasy Game Planning,Department Leader,1,1
13,Q03,"I feel quite at ease discussing personal issues or disagreements with my team leader, as I trust their understanding.",Yamaguchi,Fantasy Game Planning,Department Leader,1,1
13,Q04,"I feel quite liberated to propose recommendations and ideas, as the atmosphere fosters open sharing and a welcoming reception to diverse viewpoints.",Yamaguchi,Fantasy Game Planning,Department Leader,1,1
13,Q05,"I would feel completely comfortable voicing any error, as the environment fosters open communication and growth.",Yamaguchi,Fantasy Game Planning,Department Leader,1,1
13,Q06,I would feel comfortable speaking to my team leader if I observed a colleague making an error.,Yamaguchi,Fantasy Game Planning,Department Leader,1,1
13,Q07,My input is consistently acknowledged and appreciated by my team leader.,Yamaguchi,Fantasy Game Planning,Department Leader,1,1
13,Q08,My team leader provides ample opportunities for me to explore novel responsibilities and acquire new skills.,Yamaguchi,Fantasy Game Planning,Department Leader,1,1
13,Q09,"My team leader is a dependable advocate, always ensuring our voices are heard and our concerns are addressed.",Yamaguchi,Fantasy Game Planning,Department Leader,1,1
13,Q10,It is quite accessible to approach my colleagues when I require clarification or have uncertainties regarding my responsibilities.,Yamaguchi,Fantasy Game Planning,Department Leader,1,1
13,Q11,I find it most comfortable to express my work opinions openly and directly with my peers.,Yamaguchi,Fantasy Game Planning,Department Leader,1,1
13,Q12,I am comfortable discussing personal issues with my peers when the situation genuinely calls for it.,Yamaguchi,Fantasy Game Planning,Department Leader,1,1
13,Q13,I perceive a distinctly open atmosphere for sharing recommendations and ideas among my peers.,Yamaguchi,Fantasy Game Planning,Department Leader,1,1
13,Q14,"I would feel completely secure sharing any missteps with my peers, as the team fosters an atmosphere where learning from errors is a genuine priority.",Yamaguchi,Fantasy Game Planning,Department Leader,1,1
13,Q15,I would feel completely comfortable speaking up to a colleague if I saw them making a mistake.,Yamaguchi,Fantasy Game Planning,Department Leader,1,1
13,Q16,My contributions are consistently met with attentive consideration from my colleagues.,Yamaguchi,Fantasy Game Planning,Department Leader,1,1
13,Q17,It is certainly straightforward to request assistance from my colleagues.,Yamaguchi,Fantasy Game Planning,Department Leader,1,1
13,Q18,"Team members are actively sharing promising new concepts, indicating a beneficial flow of information.",Yamaguchi,Fantasy Game Planning,Department Leader,1,1
13,Q19,The current information sharing initiatives are genuinely fostering a collaborative atmosphere.,Yamaguchi,Fantasy Game Planning,Department Leader,1,1
13,Q20,"Our team demonstrates a robust cohesion in pursuing performance objectives, with ongoing discussions between various members indicating promising collaborative currents.",Yamaguchi,Fantasy Game Planning,Department Leader,1,1
13,Q21,I am truly pleased with the team's enthusiastic embrace of imaginative concepts.,Yamaguchi,Fantasy Game Planning,Department Leader,1,1
13,Q22,The team members' aspirations for performance are wonderfully aligned with unique yet complementary concepts for exploration.,Yamaguchi,Fantasy Game Planning,Department Leader,1,1
13,Q23,The opportunities provided for enhancing my personal performance are completely satisfactory.,Yamaguchi,Fantasy Game Planning,Department Leader,1,1
