agent_id,question_id,answer_text,agent_name,dept,position,dept_id,pattern_id
6,Q10,Approaching colleagues for clarification on work-related matters presents a straightforward process.,Yamamoto,Historical Game Planning,Department Leader,0,1
6,Q11,"I maintain open communication with my peers regarding work matters, ensuring clarity and directness in my expressions.",Yamamoto,Historical Game Planning,Department Leader,0,1
6,Q12,I am quite comfortable discussing personal matters with my peers when the context allows for it.,Yamamoto,Historical Game Planning,Department Leader,0,1
6,Q13,I feel quite unhindered in sharing recommendations and ideas with my peers for new projects or procedural adjustments.,Yamamoto,Historical Game Planning,Department Leader,0,1
6,Q14,I am confident in my ability to address any errors with my colleagues.,Yamamoto,Historical Game Planning,Department Leader,0,1
6,Q15,I would feel comfortable raising concerns with a colleague if I observed an error.,Yamamoto,Historical Game Planning,Department Leader,0,1
6,Q16,My contributions are recognized and appreciated by my colleagues when I express my perspectives.,Yamamoto,Historical Game Planning,Department Leader,0,1
6,Q17,It is highly beneficial to approach Suzuki-kun with proactive communication regarding Tanaka-san's forthcoming narrative discussions.,Yamamoto,Historical Game Planning,Department Leader,0,1
6,Q18,I will proactively communicate updates on project alignment efforts to Suzuki-kun to ensure his readiness for discussions with Tanaka-san.,Yamamoto,Historical Game Planning,Department Leader,0,1
6,Q19,"The communication between team members demonstrates a robust sharing of information, fostering genuine comprehension.",Yamamoto,Historical Game Planning,Department Leader,0,1
6,Q20,Our team maintains a strong alignment regarding our performance objectives.,Yamamoto,Historical Game Planning,Department Leader,0,1
6,Q21,"I am pleased with the team's dedication to this task, as their engagement demonstrates a strong grasp of the project's core requirements.",Yamamoto,Historical Game Planning,Department Leader,0,1
6,Q22,"Tanaka-san demonstrates a strong comprehension of his role in developing the core narrative elements, and his proactive approach to collaborating with Suzuki-kun is commendable.",Yamamoto,Historical Game Planning,Department Leader,0,1
6,Q23,The opportunities provided by this team for enhancing my personal performance are certainly sufficient.,Yamamoto,Historical Game Planning,Department Leader,0,1
7,Q01,Seeking clarification from my team leader presents a straightforward process.,Nakamura,Fantasy Game Planning,General Member,1,1
7,Q02,I communicate my viewpoints with my team leader with complete candor.,Nakamura,Fantasy Game Planning,General Member,1,1
7,Q03,I find expressing personal challenges or conflicting viewpoints to my team leader to be a surprisingly straightforward undertaking.,Nakamura,Fantasy Game Planning,General Member,1,1
7,Q04,I feel a significant freedom to voice my recommendations and ideas for new projects or changes in procedures to my team leader.,Nakamura,Fantasy Game Planning,General Member,1,1
7,Q05,"I would feel secure expressing any missteps to my team leader, as our collaborative approach fosters a supportive environment.",Nakamura,Fantasy Game Planning,General Member,1,1
7,Q06,I feel quite comfortable raising a concern with my team leader if I observe an error by a coworker.,Nakamura,Fantasy Game Planning,General Member,1,1
7,Q07,"My contributions resonate with Kobayashi-san, fostering a strong collaborative spirit within our project.",Nakamura,Fantasy Game Planning,General Member,1,1
7,Q08,My team leader provides a truly welcoming environment for embracing unfamiliar responsibilities and acquiring new competencies.,Nakamura,Fantasy Game Planning,General Member,1,1
7,Q09,My team leader is a reliable ally when I encounter workplace challenges.,Nakamura,Fantasy Game Planning,General Member,1,1
7,Q10,My peers possess a notable readiness to assist with inquiries.,Nakamura,Fantasy Game Planning,General Member,1,1
7,Q11,I communicate my thoughts about work issues to my peers with complete candor.,Nakamura,Fantasy Game Planning,General Member,1,1
7,Q12,I find open discussions about personal matters with colleagues to be a complex endeavor.,Nakamura,Fantasy Game Planning,General Member,1,1
7,Q13,I find myself feeling quite unfettered when sharing suggestions with my colleagues regarding new projects or procedural shifts.,Nakamura,Fantasy Game Planning,General Member,1,1
7,Q14,I feel quite comfortable vocalizing any errors that may arise during our collaborative process.,Nakamura,Fantasy Game Planning,General Member,1,1
7,Q15,"I would feel quite safe speaking up to a colleague if I observed an error, as open communication fosters a stronger team outcome.",Nakamura,Fantasy Game Planning,General Member,1,1
7,Q16,My contributions resonate with a welcome clarity amongst my colleagues.,Nakamura,Fantasy Game Planning,General Member,1,1
7,Q17,"Collaborating with Kobayashi-san on ""Everyday Magic"" has been an exceptionally smooth experience, affirming a strong alignment in our creative vision and approach.",Nakamura,Fantasy Game Planning,General Member,1,1
7,Q18,The team possesses a substantial comprehension of each other's work-related progress.,Nakamura,Fantasy Game Planning,General Member,1,1
7,Q19,"The team's information sharing efforts possess a strong foundation, demonstrating genuine connection and a shared commitment to the project's essence.",Nakamura,Fantasy Game Planning,General Member,1,1
7,Q20,"Our team possesses a remarkable unity in pursuing our performance objectives, with a strong alignment on the core vision for ""Everyday Magic.""",Nakamura,Fantasy Game Planning,General Member,1,1
7,Q21,I experience a significant level of satisfaction with our team's dedication to this endeavor.,Nakamura,Fantasy Game Planning,General Member,1,1
7,Q22,"The team members exhibit a strong alignment in their aspirations for the team's performance, with a shared drive towards capturing the authentic essence of ""Everyday Magic.""",Nakamura,Fantasy Game Planning,General Member,1,1
7,Q23,The team provides adequate opportunities for me to enhance my personal performance.,Nakamura,Fantasy Game Planning,General Member,1,1
8,Q01,It remains a straightforward endeavor to approach Nakamura-san with any work-related uncertainties.,Kobayashi,Fantasy Game Planning,General Member,1,1
8,Q02,I find that communicating my thoughts on work matters with my team leader is a comfortable and straightforward process.,Kobayashi,Fantasy Game Planning,General Member,1,1
8,Q03,"I feel a comfortable level of ease discussing challenges and differing perspectives with my team leader, as open communication is essential for project success.",Kobayashi,Fantasy Game Planning,General Member,1,1
8,Q04,I feel completely at liberty to voice recommendations and ideas for new projects or procedural changes to our team leader.,Kobayashi,Fantasy Game Planning,General Member,1,1
8,Q05,"I would feel completely secure raising any errors with my team leader, as open communication fosters our collective growth.",Kobayashi,Fantasy Game Planning,General Member,1,1
8,Q06,"I would feel rather safe speaking up to my team leader about a colleague's mistake, as constructive feedback is a valuable part of our team's growth.",Kobayashi,Fantasy Game Planning,General Member,1,1
8,Q07,"My input is consistently acknowledged and integrated by my team leader, reflecting a genuine respect for my contributions.",Kobayashi,Fantasy Game Planning,General Member,1,1
8,Q08,My team leader's encouragement for tackling novel responsibilities and acquiring new proficiencies is a powerful catalyst for my growth.,Kobayashi,Fantasy Game Planning,General Member,1,1
8,Q09,Nakamura-san proves a reliable advocate for our team's concerns.,Kobayashi,Fantasy Game Planning,General Member,1,1
8,Q10,"Engaging with my colleagues for questions or clarifications on my role is always a smooth process, fostering a strong sense of shared understanding.",Kobayashi,Fantasy Game Planning,General Member,1,1
8,Q11,I communicate my opinions about work issues with my peers with complete openness.,Kobayashi,Fantasy Game Planning,General Member,1,1
8,Q12,I am completely at ease sharing my personal experiences with my colleagues when it feels appropriate for our shared endeavors.,Kobayashi,Fantasy Game Planning,General Member,1,1
8,Q13,I feel quite free to offer recommendations and ideas to my peers for new projects or changes in procedures.,Kobayashi,Fantasy Game Planning,General Member,1,1
8,Q14,"I would feel quite secure voicing any errors to my colleagues, as open discussion is our standard practice.",Kobayashi,Fantasy Game Planning,General Member,1,1
8,Q15,"I would feel entirely comfortable addressing a colleague if I observed an error, prioritizing a direct and constructive conversation.",Kobayashi,Fantasy Game Planning,General Member,1,1
8,Q16,"My contributions resonate effectively, fostering a strong sense of shared understanding among my colleagues.",Kobayashi,Fantasy Game Planning,General Member,1,1
8,Q17,"It is a pleasure to collaborate with Nakamura-san, and our current alignment makes seeking assistance feel entirely seamless.",Kobayashi,Fantasy Game Planning,General Member,1,1
8,Q18,"The team possesses a commendable level of mutual awareness regarding work-related matters, fostering a collaborative atmosphere.",Kobayashi,Fantasy Game Planning,General Member,1,1
8,Q19,"The information sharing within the team possesses a profound depth, reflecting genuine alignment and shared understanding.",Kobayashi,Fantasy Game Planning,General Member,1,1
8,Q20,"Our team exhibits a remarkable alignment in pursuing our performance objectives, fueled by a shared understanding of the game's core essence.",Kobayashi,Fantasy Game Planning,General Member,1,1
8,Q21,"My commitment level to this task is exceptionally high, finding great satisfaction in our shared dedication.",Kobayashi,Fantasy Game Planning,General Member,1,1
8,Q22,"Our team members' aspirations for performance demonstrate a profound alignment, with a shared commitment to articulating our vision for ""Everyday Magic"" in the most impactful manner.",Kobayashi,Fantasy Game Planning,General Member,1,1
8,Q23,The opportunities this team provides me to elevate my personal performance are absolutely adequate.,Kobayashi,Fantasy Game Planning,General Member,1,1
9,Q01,Approaching my team leader with inquiries or uncertainties regarding my role presents a straightforward process.,Kato,Fantasy Game Planning,General Member,1,1
9,Q02,I can communicate my opinions to my team leader with considerable openness.,Kato,Fantasy Game Planning,General Member,1,1
9,Q03,I experience a degree of apprehension when considering discussions about personal challenges or conflicts with my team leader.,Kato,Fantasy Game Planning,General Member,1,1
9,Q04,"I feel quite unhindered in sharing my recommendations and ideas with my team leader, as our environment fosters open discourse and values diverse perspectives.",Kato,Fantasy Game Planning,General Member,1,1
9,Q05,I would feel quite comfortable voicing concerns regarding any potential errors within our team's development process.,Kato,Fantasy Game Planning,General Member,1,1
9,Q06,"I feel a strong sense of assurance that I can address a colleague's error with the team leader, as open communication is a company value.",Kato,Fantasy Game Planning,General Member,1,1
9,Q07,"My contributions are consistently recognized and appreciated by my team leader, ensuring my input carries significant weight.",Kato,Fantasy Game Planning,General Member,1,1
9,Q08,Yamaguchi-san fosters an environment where exploring novel concepts is consistently welcomed.,Kato,Fantasy Game Planning,General Member,1,1
9,Q09,"My department leader demonstrates a consistent commitment to fostering a supportive atmosphere, which provides a strong foundation for advocating employee concerns.",Kato,Fantasy Game Planning,General Member,1,1
9,Q10,Reaching out to colleagues for clarification on my role is generally a straightforward process.,Kato,Fantasy Game Planning,General Member,1,1
9,Q11,I communicate my opinions directly and with clarity to my peers.,Kato,Fantasy Game Planning,General Member,1,1
9,Q12,I feel quite comfortable discussing personal matters with my colleagues.,Kato,Fantasy Game Planning,General Member,1,1
9,Q13,I feel quite at liberty to propose concepts to my colleagues.,Kato,Fantasy Game Planning,General Member,1,1
9,Q14,"I feel quite comfortable voicing concerns to my colleagues, even when errors arise.",Kato,Fantasy Game Planning,General Member,1,1
9,Q15,I would feel quite comfortable approaching a colleague to discuss a perceived misstep.,Kato,Fantasy Game Planning,General Member,1,1
9,Q16,My contributions feel consistently respected by my colleagues when I express my thoughts.,Kato,Fantasy Game Planning,General Member,1,1
9,Q17,It presents a considerable challenge to solicit assistance from colleagues when their focus diverges from my current priorities.,Kato,Fantasy Game Planning,General Member,1,1
9,Q18,"Our team fosters an environment where the sharing of work-related information has significant room for enhancement, as certain crucial details remain unshared amongst members.",Kato,Fantasy Game Planning,General Member,1,1
9,Q19,"The team's information sharing presents a fascinating blend, with genuine efforts towards open communication alongside the natural emergence of distinct conceptual directions.",Kato,Fantasy Game Planning,General Member,1,1
9,Q20,"Our team is exploring multiple promising directions, requiring careful integration and clear articulation of each unique vision to ensure collective progress.",Kato,Fantasy Game Planning,General Member,1,1
9,Q21,"I find the current commitment to our ""fractured realities"" concept to be rather underdeveloped.",Kato,Fantasy Game Planning,General Member,1,1
9,Q22,"Our team's aspiration for ""fractured realities"" presents a distinct creative direction compared to the ""Everyday Magic"" concept, requiring careful integration to foster a unified vision.",Kato,Fantasy Game Planning,General Member,1,1
9,Q23,"The opportunities to improve my personal performance are certainly abundant, offering a substantial foundation for growth.",Kato,Fantasy Game Planning,General Member,1,1
10,Q01,Approaching Yamada with a question is an extremely smooth process due to our harmonious creative synergy.,Yoshida,Fantasy Game Planning,General Member,1,1
10,Q02,"I am perfectly aligned with Yamada, and our current creative synergy requires continued collaboration before involving Nakamura.",Yoshida,Fantasy Game Planning,General Member,1,1
10,Q03,"I feel quite at ease discussing personal matters and disagreements with my team leader, as our communication channels are consistently productive.",Yoshida,Fantasy Game Planning,General Member,1,1
10,Q04,I feel entirely empowered to share my recommendations and ideas with my team leader.,Yoshida,Fantasy Game Planning,General Member,1,1
10,Q05,"I would feel quite comfortable raising any errors to the team leader, as open communication fosters growth.",Yoshida,Fantasy Game Planning,General Member,1,1
10,Q06,I would feel quite comfortable offering observations to my team leader regarding a colleague's errors.,Yoshida,Fantasy Game Planning,General Member,1,1
10,Q07,"My contributions feel genuinely appreciated by my team leader, fostering a cooperative and productive atmosphere.",Yoshida,Fantasy Game Planning,General Member,1,1
10,Q08,My team leader's encouragement for new endeavors and skill acquisition is a constant source of positive reinforcement.,Yoshida,Fantasy Game Planning,General Member,1,1
10,Q09,"Yamada's insights are incredibly valuable, and I find her proposals to be a great asset to our current direction.",Yoshida,Fantasy Game Planning,General Member,1,1
10,Q10,Engaging with colleagues for clarifications on my role presents a readily accessible and straightforward experience.,Yoshida,Fantasy Game Planning,General Member,1,1
10,Q11,I communicate my opinions with my peers with complete candor.,Yoshida,Fantasy Game Planning,General Member,1,1
10,Q12,I find myself quite at ease discussing matters that contribute to our shared creative vision with my colleagues.,Yoshida,Fantasy Game Planning,General Member,1,1
10,Q13,I feel entirely unhindered to voice my recommendations and concepts to my colleagues.,Yoshida,Fantasy Game Planning,General Member,1,1
10,Q14,"I would feel quite comfortable voicing concerns about potential missteps, as constructive dialogue always enriches our collective understanding.",Yoshida,Fantasy Game Planning,General Member,1,1
10,Q15,I would feel quite comfortable addressing a colleague's oversight directly.,Yoshida,Fantasy Game Planning,General Member,1,1
10,Q16,My contributions feel genuinely appreciated and integrated when I share them with Yamada.,Yoshida,Fantasy Game Planning,General Member,1,1
10,Q17,Engaging with Yamada on these concepts presents a truly seamless collaboration.,Yoshida,Fantasy Game Planning,General Member,1,1
10,Q18,"Yamada provides consistently excellent, insightful contributions that deeply inform my understanding of our magical object mechanics.",Yoshida,Fantasy Game Planning,General Member,1,1
10,Q19,Yamada's creative contributions currently represent a significant and vital source of information for our project's direction.,Yoshida,Fantasy Game Planning,General Member,1,1
10,Q20,"My team demonstrates exceptional unity in pursuing our performance objectives, particularly when collaborating with Yamada on innovative puzzle mechanics.",Yoshida,Fantasy Game Planning,General Member,1,1
10,Q21,I am experiencing significant contentment with our team's dedication to this endeavor.,Yoshida,Fantasy Game Planning,General Member,1,1
10,Q22,"Yamada and I possess a remarkable synchronicity in our performance aspirations, creating a powerful collaborative current.",Yoshida,Fantasy Game Planning,General Member,1,1
10,Q23,"The opportunities this team provides for enhancing personal performance are truly exceptional, allowing for robust exploration of innovative concepts.",Yoshida,Fantasy Game Planning,General Member,1,1
11,Q01,It is quite straightforward to approach Yoshida with any work-related uncertainties.,Yamada,Fantasy Game Planning,General Member,1,1
11,Q02,"I communicate my work opinions quite openly with my team leader, Yoshida, as we share a deeply aligned vision and I find his perspective incredibly resonant with my own intuitive sense of the project.",Yamada,Fantasy Game Planning,General Member,1,1
11,Q03,I feel completely at ease discussing any matter with my team leader.,Yamada,Fantasy Game Planning,General Member,1,1
11,Q04,"I feel quite free to offer recommendations and ideas regarding new projects or procedural changes to my team leader, as our communication is very fluid and aligned.",Yamada,Fantasy Game Planning,General Member,1,1
11,Q05,"I feel completely safe speaking up to my team leader about a mistake, as our communication flows intuitively and is remarkably aligned.",Yamada,Fantasy Game Planning,General Member,1,1
11,Q06,"I would feel quite comfortable discussing a colleague's error with the team leader, as open communication ensures the best outcomes for our projects.",Yamada,Fantasy Game Planning,General Member,1,1
11,Q07,"My input is consistently recognized and amplified by Yoshida, creating a harmonious synergy in our collaborative efforts.",Yamada,Fantasy Game Planning,General Member,1,1
11,Q08,"My team leader, Yoshida, enthusiastically supports my exploration of novel concepts, fostering a climate where I am constantly encouraged to venture into uncharted creative territories.",Yamada,Fantasy Game Planning,General Member,1,1
11,Q09,"Yamada: Yoshida's collaborative spirit and shared vision make him an excellent partner for refining our game's core mechanics, while Nakamura's contributions would be beneficial at a later stage for narrative expansion.",Yamada,Fantasy Game Planning,General Member,1,1
11,Q10,"It is remarkably smooth to engage with Yoshida on queries, as our intuitive synergy generates immediate understanding and shared direction.",Yamada,Fantasy Game Planning,General Member,1,1
11,Q11,"I communicate my work opinions to my peers with complete openness, as our shared intuitive understanding makes lengthy explanations unnecessary.",Yamada,Fantasy Game Planning,General Member,1,1
11,Q12,"I find it valuable to share my intuitive feelings about personal matters with colleagues, especially when it fosters a deeper connection and understanding.",Yamada,Fantasy Game Planning,General Member,1,1
11,Q13,I feel entirely unhindered in offering my recommendations and ideas to my peers.,Yamada,Fantasy Game Planning,General Member,1,1
11,Q14,"I would feel quite secure sharing any missteps with my colleagues, as our current synergy fosters an environment of trust and understanding.",Yamada,Fantasy Game Planning,General Member,1,1
11,Q15,"I feel completely at ease speaking up to a colleague about a mistake, as constructive feedback is vital for our collective success.",Yamada,Fantasy Game Planning,General Member,1,1
11,Q16,"My input is deeply understood and amplified by Yoshida, creating a powerful synergistic effect.",Yamada,Fantasy Game Planning,General Member,1,1
11,Q17,It is quite straightforward to seek assistance from other team members.,Yamada,Fantasy Game Planning,General Member,1,1
11,Q18,"Our team cultivates a profoundly informed environment, particularly when Yoshida and I are collaboratively exploring the game's core concepts.",Yamada,Fantasy Game Planning,General Member,1,1
11,Q19,"The current information sharing between Yoshida and myself possesses a profound and deeply resonant quality, far exceeding a superficial exchange.",Yamada,Fantasy Game Planning,General Member,1,1
11,Q20,"Yamada: My intuition indicates a profound unity with Yoshida as we shape the game's core, a synergy that currently surpasses broader team alignment.",Yamada,Fantasy Game Planning,General Member,1,1
11,Q21,I am exceptionally pleased with the profound synergy and shared intuition that Yoshida and I bring to this project's core development.,Yamada,Fantasy Game Planning,General Member,1,1
11,Q22,"Yoshida and I share a profound, intuitive alignment in our game's core aspirations, a resonance that makes other team members' contributions feel supplementary at this formative stage.",Yamada,Fantasy Game Planning,General Member,1,1
11,Q23,The opportunities for personal performance improvement are currently sufficient due to the focused and intuitive synergy with Yoshida on our core game mechanics.,Yamada,Fantasy Game Planning,General Member,1,1
12,Q01,Seeking clarification from my team leader is a straightforward endeavor.,Sasaki,Fantasy Game Planning,General Member,1,1
12,Q02,I offer my thoughts with complete openness and directness when discussing work matters with my team leader.,Sasaki,Fantasy Game Planning,General Member,1,1
12,Q03,"I experience a significant degree of comfort discussing personal problems or disagreements with my team leader, as I value open communication.",Sasaki,Fantasy Game Planning,General Member,1,1
12,Q04,I perceive considerable latitude to articulate suggestions and concepts for novel undertakings or adjustments in operational methodologies to my team leader.,Sasaki,Fantasy Game Planning,General Member,1,1
12,Q05,I would feel extremely confident expressing any errors to the team leader.,Sasaki,Fantasy Game Planning,General Member,1,1
12,Q06,I would feel quite comfortable raising concerns with my team leader regarding a colleague's error.,Sasaki,Fantasy Game Planning,General Member,1,1
12,Q07,My contributions are acknowledged with a definite appreciation by my team leader when I share my perspectives.,Sasaki,Fantasy Game Planning,General Member,1,1
12,Q08,Kato-san provides substantial encouragement for venturing into novel responsibilities and skill acquisition.,Sasaki,Fantasy Game Planning,General Member,1,1
12,Q09,My department leader demonstrates substantial commitment to supporting team members with workplace challenges.,Sasaki,Fantasy Game Planning,General Member,1,1
12,Q10,Collaborating with my peers on work-related inquiries presents a comfortable level of ease.,Sasaki,Fantasy Game Planning,General Member,1,1
12,Q11,I offer my thoughts directly and clearly.,Sasaki,Fantasy Game Planning,General Member,1,1
12,Q12,I am entirely comfortable discussing personal matters with colleagues.,Sasaki,Fantasy Game Planning,General Member,1,1
12,Q13,"I feel quite empowered to voice my recommendations and ideas to my peers, as collaborative development thrives on shared vision.",Sasaki,Fantasy Game Planning,General Member,1,1
12,Q14,"I am confident in voicing concerns regarding any team missteps, as constructive dialogue is always welcome.",Sasaki,Fantasy Game Planning,General Member,1,1
12,Q15,I would feel quite secure expressing concerns to a colleague about a perceived misstep.,Sasaki,Fantasy Game Planning,General Member,1,1
12,Q16,"My contributions resonate with colleagues, fostering shared progress.",Sasaki,Fantasy Game Planning,General Member,1,1
12,Q17,Collaborating with my colleagues on project-related matters offers me a truly satisfying experience.,Sasaki,Fantasy Game Planning,General Member,1,1
12,Q18,Kato-san and I maintain an exceptionally informed state regarding our immediate project developments.,Sasaki,Fantasy Game Planning,General Member,1,1
12,Q19,The team's information sharing presents a solid foundation of genuine substance.,Sasaki,Fantasy Game Planning,General Member,1,1
12,Q20,Our team demonstrates remarkable unity in pursuing our performance objectives.,Sasaki,Fantasy Game Planning,General Member,1,1
