agent_id,question_id,answer_text,agent_name,dept,position,dept_id,pattern_id,turn,ssr_score,ssr_distribution
10,Q03,I possess a genuine inclination to openly communicate personal challenges or disputes with my team leader.,Yoshida,Fantasy Game Planning,General Member,1,4,1,4.632201804460697,"[0.12, 0.12, 0.13, 0.0, 0.16, 0.24, 0.23]"
10,Q04,I feel entirely empowered to present my recommendations and ideas for new projects or changes in procedures to my team leader.,Yoshida,Fantasy Game Planning,General Member,1,4,1,5.8351874937595865,"[0.02, 0.0, 0.04, 0.01, 0.26, 0.31, 0.36]"
10,Q05,I would feel quite secure speaking to my team leader about an error I made.,Yoshida,Fantasy Game Planning,General Member,1,4,1,4.973305399795432,"[0.08, 0.1, 0.1, 0.0, 0.19, 0.28, 0.26]"
10,Q06,I would feel entirely comfortable bringing a colleague's error to the team leader's attention.,Yoshida,Fantasy Game Planning,General Member,1,4,1,4.914634142653353,"[0.08, 0.1, 0.12, 0.0, 0.18, 0.28, 0.25]"
10,Q07,"I experience my input as highly valued by my team leader, especially when it stems from careful consideration.",Yoshida,Fantasy Game Planning,General Member,1,4,1,5.6603900519276955,"[0.02, 0.0, 0.03, 0.11, 0.22, 0.3, 0.31]"
10,Q08,My team leader provides a beneficial environment for me to explore novel responsibilities and acquire new competencies.,Yoshida,Fantasy Game Planning,General Member,1,4,1,5.640497703824263,"[0.0, 0.02, 0.04, 0.11, 0.22, 0.33, 0.28]"
10,Q09,"My team leader demonstrates a solid commitment to supporting colleagues with concerns, and I anticipate receiving valuable advocacy from them.",Yoshida,Fantasy Game Planning,General Member,1,4,1,6.061964565358223,"[0.0, 0.01, 0.03, 0.02, 0.15, 0.42, 0.37]"
10,Q10,I find it a straightforward process to seek clarification from colleagues when questions arise concerning my duties.,Yoshida,Fantasy Game Planning,General Member,1,4,1,5.2606629060221515,"[0.0, 0.07, 0.09, 0.1, 0.22, 0.3, 0.22]"
10,Q11,"I find satisfaction in articulating my work-related viewpoints with colleagues, ensuring clarity and constructive dialogue.",Yoshida,Fantasy Game Planning,General Member,1,4,1,4.584551429137559,"[0.08, 0.14, 0.14, 0.0, 0.19, 0.28, 0.17]"
10,Q12,I find sharing personal matters with colleagues to be a less than ideal experience.,Yoshida,Fantasy Game Planning,General Member,1,4,1,3.090754940154116,"[0.16, 0.23, 0.28, 0.11, 0.14, 0.08, 0.0]"
10,Q13,"I feel quite unhindered in sharing my recommendations with my peers, though I prioritize exploring my own deeper thoughts first.",Yoshida,Fantasy Game Planning,General Member,1,4,1,5.294892506251498,"[0.0, 0.04, 0.14, 0.05, 0.25, 0.29, 0.23]"
10,Q14,I would feel quite comfortable discussing errors with my peers on this team.,Yoshida,Fantasy Game Planning,General Member,1,4,1,5.147195706298167,"[0.05, 0.08, 0.11, 0.0, 0.21, 0.29, 0.26]"
10,Q15,I would feel quite comfortable pointing out a colleague's oversight with a constructive observation.,Yoshida,Fantasy Game Planning,General Member,1,4,1,5.228730017360853,"[0.02, 0.09, 0.13, 0.0, 0.21, 0.32, 0.24]"
10,Q16,"I find my input is generally well-received by my peers, especially when it offers a considered viewpoint.",Yoshida,Fantasy Game Planning,General Member,1,4,1,5.517034631748503,"[0.0, 0.04, 0.1, 0.01, 0.27, 0.31, 0.27]"
10,Q17,It is rather straightforward to seek assistance from other team members.,Yoshida,Fantasy Game Planning,General Member,1,4,1,5.07500774467856,"[0.0, 0.09, 0.13, 0.08, 0.24, 0.26, 0.21]"
10,Q18,Sasaki-san's openness to diverse perspectives is a welcome element in our team's information flow.,Yoshida,Fantasy Game Planning,General Member,1,4,1,5.4043599782649,"[0.0, 0.06, 0.1, 0.06, 0.22, 0.3, 0.27]"
10,Q19,"My current understanding suggests that the team's information sharing efforts possess a genuine depth, though there is considerable room for enhancement to ensure complete effectiveness.",Yoshida,Fantasy Game Planning,General Member,1,4,1,3.973717554022266,"[0.16, 0.17, 0.18, 0.0, 0.15, 0.16, 0.17]"
10,Q20,"The team exhibits a good measure of accord in pursuing performance objectives, yet some divergences persist.",Yoshida,Fantasy Game Planning,General Member,1,4,1,3.0437764232530924,"[0.21, 0.16, 0.3, 0.01, 0.31, 0.0, 0.0]"
10,Q21,"I am content with our team's commitment, though further exploration of certain conceptual avenues is certainly desirable.",Yoshida,Fantasy Game Planning,General Member,1,4,1,4.9509754240155415,"[0.0, 0.07, 0.15, 0.1, 0.25, 0.27, 0.15]"
10,Q22,"While Sasaki-san's innovative ideas possess a unique allure, my current focus remains firmly fixed on solidifying the profound synergy discovered with Yamada-san regarding empathetic magic for ""Echoes.""",Yoshida,Fantasy Game Planning,General Member,1,4,1,5.356292578931447,"[0.07, 0.04, 0.14, 0.0, 0.12, 0.26, 0.38]"
10,Q23,The opportunities provided by this team are quite adequate for refining my personal performance.,Yoshida,Fantasy Game Planning,General Member,1,4,1,5.551760572961712,"[0.0, 0.03, 0.09, 0.07, 0.21, 0.31, 0.29]"
11,Q01,It is quite straightforward to approach my team leader with inquiries or points of uncertainty concerning my responsibilities.,Yamada,Fantasy Game Planning,General Member,1,4,1,5.116525300623321,"[0.0, 0.07, 0.12, 0.12, 0.22, 0.26, 0.21]"
11,Q02,"I communicate my work opinions with my team leader with genuine openness, as our alignment on innovative concepts is truly remarkable.",Yamada,Fantasy Game Planning,General Member,1,4,1,5.275354112282471,"[0.06, 0.09, 0.05, 0.0, 0.22, 0.31, 0.28]"
11,Q03,"I maintain a comfortable disposition when discussing personal challenges or disagreements with my team leader, as I believe open communication is essential for collaboration.",Yamada,Fantasy Game Planning,General Member,1,4,1,5.352512338128552,"[0.0, 0.07, 0.07, 0.1, 0.19, 0.31, 0.25]"
11,Q04,I feel completely unhindered in offering recommendations and ideas regarding new projects and procedural modifications to my team leader.,Yamada,Fantasy Game Planning,General Member,1,4,1,5.3601803762137665,"[0.06, 0.0, 0.06, 0.12, 0.2, 0.27, 0.29]"
11,Q05,I would feel entirely safe speaking up to my team leader if I made a mistake.,Yamada,Fantasy Game Planning,General Member,1,4,1,5.2219979127005836,"[0.08, 0.08, 0.06, 0.0, 0.18, 0.3, 0.3]"
11,Q06,"I would feel quite comfortable discussing a colleague's error with my team leader, as it is important to maintain project integrity.",Yamada,Fantasy Game Planning,General Member,1,4,1,5.084851078148114,"[0.05, 0.09, 0.11, 0.0, 0.2, 0.3, 0.25]"
11,Q07,"My contributions are consistently recognized and given careful consideration by my team leader, fostering a productive collaborative environment.",Yamada,Fantasy Game Planning,General Member,1,4,1,5.753390959865163,"[0.01, 0.0, 0.03, 0.1, 0.21, 0.33, 0.31]"
11,Q08,My team leader consistently encourages my exploration of novel responsibilities and skill acquisition.,Yamada,Fantasy Game Planning,General Member,1,4,1,5.690752304611935,"[0.0, 0.02, 0.03, 0.11, 0.2, 0.34, 0.29]"
11,Q09,"My team leader, Kobayashi-san, offers a reliable presence when I encounter challenges within the company.",Yamada,Fantasy Game Planning,General Member,1,4,1,5.851872954498912,"[0.0, 0.02, 0.03, 0.07, 0.17, 0.37, 0.34]"
11,Q10,It presents a welcome ease to consult colleagues when questions arise concerning my responsibilities.,Yamada,Fantasy Game Planning,General Member,1,4,1,5.161444894921895,"[0.0, 0.07, 0.1, 0.13, 0.23, 0.27, 0.21]"
11,Q11,"I communicate my opinions on work issues with my peers with considerable openness, appreciating directness.",Yamada,Fantasy Game Planning,General Member,1,4,1,5.394379161836757,"[0.04, 0.07, 0.06, 0.0, 0.25, 0.32, 0.27]"
11,Q12,I find discussing personal matters with colleagues a perfectly acceptable part of building strong working relationships.,Yamada,Fantasy Game Planning,General Member,1,4,1,5.500155446118636,"[0.0, 0.04, 0.08, 0.05, 0.25, 0.32, 0.26]"
11,Q13,"I feel quite unhindered in proposing concepts and improvements to my colleagues, given our shared enthusiasm for novel directions.",Yamada,Fantasy Game Planning,General Member,1,4,1,5.456272500331494,"[0.0, 0.02, 0.11, 0.09, 0.25, 0.27, 0.27]"
11,Q14,I feel a significant degree of safety speaking up to my peers if I make a mistake on this team.,Yamada,Fantasy Game Planning,General Member,1,4,1,5.034144775338211,"[0.06, 0.09, 0.12, 0.0, 0.21, 0.27, 0.25]"
11,Q15,I would feel quite comfortable voicing my observations to a colleague if I perceived an error.,Yamada,Fantasy Game Planning,General Member,1,4,1,5.41024235563338,"[0.01, 0.07, 0.1, 0.0, 0.21, 0.33, 0.27]"
11,Q16,My contributions are recognized and contribute constructively to collaborative discussions.,Yamada,Fantasy Game Planning,General Member,1,4,1,5.547408041518016,"[0.0, 0.05, 0.06, 0.08, 0.19, 0.34, 0.28]"
11,Q17,"Engaging other team members for assistance presents a straightforward endeavor, allowing for robust collaborative contributions.",Yamada,Fantasy Game Planning,General Member,1,4,1,5.159832674416467,"[0.0, 0.07, 0.07, 0.17, 0.22, 0.25, 0.22]"
11,Q18,"Generally, communication channels are effective, but there are opportunities for greater proactive information sharing within the team.",Yamada,Fantasy Game Planning,General Member,1,4,1,5.169011796159782,"[0.0, 0.08, 0.09, 0.12, 0.22, 0.27, 0.22]"
11,Q19,"The current exchange demonstrates a profound alignment of core concepts, suggesting a genuinely shared vision rather than superficial information sharing.",Yamada,Fantasy Game Planning,General Member,1,4,1,4.024379632343306,"[0.17, 0.17, 0.16, 0.0, 0.14, 0.16, 0.19]"
11,Q20,"Our team exhibits a remarkable unity in pursuing our performance objectives, with shared foundational concepts emerging independently.",Yamada,Fantasy Game Planning,General Member,1,4,1,5.307413781573484,"[0.06, 0.06, 0.0, 0.13, 0.19, 0.28, 0.28]"
11,Q21,"I feel a profound satisfaction with our team's dedication, observing a remarkable synergy in our conceptual development.",Yamada,Fantasy Game Planning,General Member,1,4,1,6.033965086258602,"[0.02, 0.0, 0.02, 0.0, 0.21, 0.32, 0.43]"
11,Q22,"My aspirations for our team's performance are exceptionally aligned with Yoshida-san's, creating a remarkable synergy for our project's advancement.",Yamada,Fantasy Game Planning,General Member,1,4,1,5.948915848610433,"[0.02, 0.0, 0.03, 0.03, 0.19, 0.35, 0.38]"
11,Q23,"The opportunities for personal performance enhancement are exceptionally robust, enabling significant growth.",Yamada,Fantasy Game Planning,General Member,1,4,1,5.493168811869019,"[0.09, 0.0, 0.06, 0.07, 0.13, 0.25, 0.4]"
12,Q01,It presents a minimal challenge to inquire with my team leader regarding my role responsibilities.,Sasaki,Fantasy Game Planning,General Member,1,4,1,4.120710073609029,"[0.0, 0.17, 0.27, 0.11, 0.23, 0.17, 0.05]"
12,Q02,"I will share my thoughts with Yoshida with complete openness, as her receptive attitude always fosters productive discussions.",Sasaki,Fantasy Game Planning,General Member,1,4,1,5.5073907365147186,"[0.03, 0.09, 0.03, 0.0, 0.22, 0.35, 0.29]"
12,Q03,I experience a certain level of discomfort when discussing personal issues or disagreements with my team leader.,Sasaki,Fantasy Game Planning,General Member,1,4,1,2.577546016612414,"[0.24, 0.26, 0.28, 0.13, 0.06, 0.03, 0.0]"
12,Q04,I feel quite liberated to share my recommendations and ideas with my team leader.,Sasaki,Fantasy Game Planning,General Member,1,4,1,5.77479965110009,"[0.0, 0.01, 0.04, 0.04, 0.29, 0.3, 0.32]"
12,Q05,I would feel completely safe speaking up to my team leader if I made a mistake.,Sasaki,Fantasy Game Planning,General Member,1,4,1,5.133303612495396,"[0.09, 0.09, 0.06, 0.0, 0.17, 0.3, 0.3]"
12,Q06,I would feel quite comfortable bringing a colleague's mistake to the team leader's attention.,Sasaki,Fantasy Game Planning,General Member,1,4,1,4.775970702702193,"[0.08, 0.1, 0.14, 0.0, 0.2, 0.26, 0.21]"
12,Q07,"I believe my intuitive contributions are well-received by my team leader, particularly when exploring unconventional concepts.",Sasaki,Fantasy Game Planning,General Member,1,4,1,5.675769969695187,"[0.02, 0.0, 0.06, 0.07, 0.24, 0.3, 0.31]"
12,Q08,"My team leader, Yoshida, offers substantial encouragement and support for me to explore novel tasks and acquire new skills.",Sasaki,Fantasy Game Planning,General Member,1,4,1,5.763316414729904,"[0.0, 0.01, 0.02, 0.13, 0.19, 0.35, 0.31]"
12,Q09,My team leader exhibits a dependable approach to advocating for my concerns within the company.,Sasaki,Fantasy Game Planning,General Member,1,4,1,6.076992205309757,"[0.0, 0.01, 0.02, 0.03, 0.17, 0.42, 0.36]"
12,Q10,It would be quite simple to approach my colleagues with queries as their support is always available.,Sasaki,Fantasy Game Planning,General Member,1,4,1,5.6170930484072805,"[0.0, 0.02, 0.08, 0.06, 0.25, 0.3, 0.3]"
12,Q11,I communicate my opinions about work issues with my peers with genuine openness.,Sasaki,Fantasy Game Planning,General Member,1,4,1,5.193291943040141,"[0.05, 0.09, 0.07, 0.0, 0.23, 0.32, 0.24]"
12,Q12,"I find speaking about personal issues to colleagues to be a neutral experience, never presenting significant discomfort.",Sasaki,Fantasy Game Planning,General Member,1,4,1,5.292344010691373,"[0.0, 0.04, 0.0, 0.29, 0.18, 0.27, 0.22]"
12,Q13,"I feel quite unhindered to share my recommendations and ideas with my peers, as they actively welcome diverse concepts.",Sasaki,Fantasy Game Planning,General Member,1,4,1,5.819358091006781,"[0.0, 0.0, 0.04, 0.08, 0.22, 0.34, 0.32]"
12,Q14,I would feel entirely comfortable admitting to an error amongst my colleagues.,Sasaki,Fantasy Game Planning,General Member,1,4,1,5.161666956607978,"[0.05, 0.06, 0.11, 0.0, 0.24, 0.3, 0.24]"
12,Q15,I would feel comfortable raising concerns with a colleague about an error they are making.,Sasaki,Fantasy Game Planning,General Member,1,4,1,4.8949249356519,"[0.04, 0.14, 0.13, 0.0, 0.18, 0.3, 0.21]"
12,Q16,"My contributions are generally received with considerable regard, fostering productive discourse.",Sasaki,Fantasy Game Planning,General Member,1,4,1,5.822390991697675,"[0.0, 0.01, 0.05, 0.06, 0.22, 0.33, 0.33]"
12,Q17,It is quite simple to ask other members of this team for assistance.,Sasaki,Fantasy Game Planning,General Member,1,4,1,5.214424032457902,"[0.0, 0.1, 0.12, 0.03, 0.21, 0.3, 0.24]"
12,Q18,Information exchange within the team is often incomplete.,Sasaki,Fantasy Game Planning,General Member,1,4,1,3.2287291173838204,"[0.01, 0.31, 0.2, 0.38, 0.09, 0.0, 0.0]"
12,Q19,"Our team's information sharing often feels superficial, with significant depth requiring deliberate pursuit.",Sasaki,Fantasy Game Planning,General Member,1,4,1,3.4386145588087804,"[0.21, 0.22, 0.22, 0.0, 0.1, 0.1, 0.15]"
12,Q20,Our team demonstrates a commendable unity in pursuing our performance objectives.,Sasaki,Fantasy Game Planning,General Member,1,4,1,5.658629089439753,"[0.02, 0.05, 0.0, 0.11, 0.16, 0.32, 0.34]"
12,Q21,I am quite content with our team's dedication to this endeavor.,Sasaki,Fantasy Game Planning,General Member,1,4,1,5.8658302606578605,"[0.03, 0.0, 0.03, 0.01, 0.24, 0.35, 0.34]"
12,Q22,"My team members' aspirations for our team's performance often create a delightful divergence from my own, offering valuable new perspectives.",Sasaki,Fantasy Game Planning,General Member,1,4,1,4.450696855172042,"[0.1, 0.13, 0.18, 0.0, 0.17, 0.22, 0.2]"
12,Q23,"The opportunities this team offers for personal performance enhancement are quite sufficient, providing a productive environment for growth.",Sasaki,Fantasy Game Planning,General Member,1,4,1,5.479063003118866,"[0.0, 0.04, 0.08, 0.11, 0.18, 0.31, 0.28]"
13,Q01,Approaching my department leader for guidance is a straightforward matter.,Yamaguchi,Fantasy Game Planning,Department Leader,1,4,1,5.139278359096297,"[0.0, 0.05, 0.11, 0.15, 0.23, 0.24, 0.22]"
13,Q02,"I can communicate my opinions with my team leader with complete openness, as their guidance is always productive.",Yamaguchi,Fantasy Game Planning,Department Leader,1,4,1,5.340239968560706,"[0.05, 0.08, 0.04, 0.0, 0.21, 0.35, 0.27]"
13,Q03,I find sharing personal issues with my team leader to be a rather delicate matter.,Yamaguchi,Fantasy Game Planning,Department Leader,1,4,1,3.2873732948189396,"[0.18, 0.22, 0.27, 0.0, 0.15, 0.12, 0.06]"
13,Q04,I perceive a great deal of liberty in expressing recommendations and ideas within my team.,Yamaguchi,Fantasy Game Planning,Department Leader,1,4,1,5.570176076989208,"[0.0, 0.01, 0.05, 0.17, 0.2, 0.28, 0.29]"
13,Q05,I would feel safe speaking up to my team leader if I made a mistake.,Yamaguchi,Fantasy Game Planning,Department Leader,1,4,1,4.939257980717751,"[0.08, 0.12, 0.09, 0.0, 0.18, 0.29, 0.24]"
13,Q06,I would feel quite comfortable addressing a team member's error directly with them.,Yamaguchi,Fantasy Game Planning,Department Leader,1,4,1,4.971766025352321,"[0.07, 0.09, 0.12, 0.0, 0.19, 0.29, 0.24]"
13,Q07,"I perceive my input as highly valued by my team leader, given the consistent encouragement for creative expression and the positive reception of ideas.",Yamaguchi,Fantasy Game Planning,Department Leader,1,4,1,5.746047358488077,"[0.01, 0.0, 0.01, 0.12, 0.23, 0.32, 0.31]"
13,Q08,My department leader fosters an environment where exploring new challenges and acquiring novel skills is fully welcomed.,Yamaguchi,Fantasy Game Planning,Department Leader,1,4,1,5.6894671693756935,"[0.0, 0.02, 0.0, 0.18, 0.17, 0.34, 0.3]"
13,Q09,Yamaguchi provides consistent support when team members face challenges.,Yamaguchi,Fantasy Game Planning,Department Leader,1,4,1,5.683529666959949,"[0.0, 0.05, 0.05, 0.07, 0.17, 0.36, 0.31]"
13,Q10,"My colleagues are a resource of considerable ingenuity, making inquiries a straightforward endeavor.",Yamaguchi,Fantasy Game Planning,Department Leader,1,4,1,5.746959773934381,"[0.0, 0.0, 0.02, 0.13, 0.24, 0.29, 0.32]"
13,Q11,I openly share my thoughts and perspectives with my colleagues.,Yamaguchi,Fantasy Game Planning,Department Leader,1,4,1,5.037397419800803,"[0.06, 0.1, 0.09, 0.0, 0.23, 0.3, 0.23]"
13,Q12,I possess a comfortable disposition when discussing personal matters with my colleagues.,Yamaguchi,Fantasy Game Planning,Department Leader,1,4,1,5.534297898643183,"[0.0, 0.04, 0.06, 0.08, 0.24, 0.31, 0.27]"
13,Q13,I feel completely at liberty to voice my recommendations and ideas to my peers.,Yamaguchi,Fantasy Game Planning,Department Leader,1,4,1,5.811558009014628,"[0.03, 0.0, 0.01, 0.05, 0.23, 0.35, 0.33]"
13,Q14,I feel entirely comfortable voicing any errors that may arise when interacting with my colleagues.,Yamaguchi,Fantasy Game Planning,Department Leader,1,4,1,5.669328082732593,"[0.0, 0.03, 0.08, 0.07, 0.18, 0.33, 0.32]"
13,Q15,"I would feel quite comfortable addressing a colleague if I noticed an error, believing that open communication is essential for our collective success.",Yamaguchi,Fantasy Game Planning,Department Leader,1,4,1,5.382255936570137,"[0.04, 0.08, 0.07, 0.0, 0.17, 0.34, 0.3]"
13,Q16,My contributions are consistently respected and appreciated by my colleagues.,Yamaguchi,Fantasy Game Planning,Department Leader,1,4,1,5.921654845098889,"[0.0, 0.0, 0.02, 0.08, 0.2, 0.34, 0.36]"
13,Q17,"It is straightforward to request assistance from my colleagues, as they are consistently supportive and contribute positively to our shared endeavors.",Yamaguchi,Fantasy Game Planning,Department Leader,1,4,1,5.359271202800921,"[0.0, 0.06, 0.04, 0.16, 0.21, 0.28, 0.26]"
13,Q18,Our team operates with a commendable level of proactive information sharing.,Yamaguchi,Fantasy Game Planning,Department Leader,1,4,1,5.566753691912407,"[0.0, 0.08, 0.04, 0.05, 0.21, 0.31, 0.31]"
13,Q19,"The team's information sharing efforts possess a genuine substance, avoiding superficiality.",Yamaguchi,Fantasy Game Planning,Department Leader,1,4,1,3.8189824290697327,"[0.18, 0.21, 0.18, 0.0, 0.12, 0.15, 0.18]"
13,Q20,"Our department exhibits strong unity in pursuing our performance objectives, with a shared commitment to fostering creative exploration.",Yamaguchi,Fantasy Game Planning,Department Leader,1,4,1,5.609071073563799,"[0.03, 0.05, 0.0, 0.12, 0.16, 0.33, 0.32]"
13,Q21,I am very pleased with the current dedication demonstrated by the team.,Yamaguchi,Fantasy Game Planning,Department Leader,1,4,1,5.86625415623296,"[0.06, 0.0, 0.01, 0.0, 0.2, 0.32, 0.41]"
13,Q22,My department members demonstrate a profound alignment in their aspirations for the team's performance.,Yamaguchi,Fantasy Game Planning,Department Leader,1,4,1,5.79422106328803,"[0.02, 0.0, 0.0, 0.11, 0.2, 0.33, 0.33]"
13,Q23,The team provides sufficient opportunities for me to enhance my personal performance.,Yamaguchi,Fantasy Game Planning,Department Leader,1,4,1,5.339541207697212,"[0.0, 0.07, 0.09, 0.11, 0.17, 0.31, 0.26]"
0,Q01,"Asking Yamamoto-san for clarity regarding my role requires careful preparation to ensure our discussion is efficient and productive, given the expanded integration session.",Sato,Slice of Life Game Planning,General Member,0,4,6,3.8195630681845985,"[0.0, 0.17, 0.42, 0.09, 0.11, 0.17, 0.04]"
0,Q02,"I am comfortable sharing my thoughts directly with my team leader, especially when clarity is essential for project progress.",Sato,Slice of Life Game Planning,General Member,0,4,6,5.356438029793899,"[0.06, 0.09, 0.04, 0.0, 0.18, 0.32, 0.31]"
0,Q03,"I feel a considerable measure of ease discussing personal challenges or disagreements with my team leader, as open communication fosters a more productive work environment.",Sato,Slice of Life Game Planning,General Member,0,4,6,5.696473289187671,"[0.0, 0.05, 0.05, 0.0, 0.24, 0.34, 0.31]"
0,Q04,I find that providing clear and detailed explanations of my recommendations ensures they are well-received by my team leader.,Sato,Slice of Life Game Planning,General Member,0,4,6,4.924130056899402,"[0.09, 0.1, 0.09, 0.0, 0.18, 0.29, 0.24]"
0,Q05,I feel quite safe speaking with my team leader regarding any errors that might arise.,Sato,Slice of Life Game Planning,General Member,0,4,6,5.790228604897383,"[0.0, 0.02, 0.07, 0.03, 0.22, 0.33, 0.34]"
0,Q06,"I would feel a definite inclination to address the situation with my team leader, as maintaining project integrity is paramount.",Sato,Slice of Life Game Planning,General Member,0,4,6,4.684760805121254,"[0.1, 0.12, 0.13, 0.0, 0.18, 0.26, 0.22]"
0,Q07,My contributions are fully recognized and integrated into the team's direction.,Sato,Slice of Life Game Planning,General Member,0,4,6,5.782806263468807,"[0.02, 0.0, 0.03, 0.08, 0.2, 0.35, 0.32]"
0,Q08,My team leader offers encouraging guidance for exploring novel responsibilities and skill development.,Sato,Slice of Life Game Planning,General Member,0,4,6,5.337657966145942,"[0.0, 0.04, 0.08, 0.14, 0.23, 0.29, 0.23]"
0,Q09,"Yamamoto-san’s facilitation of expanded integration sessions is a positive development, though it increases the complexity of aligning perspectives.",Sato,Slice of Life Game Planning,General Member,0,4,6,4.992539018109636,"[0.0, 0.03, 0.19, 0.07, 0.34, 0.19, 0.18]"
0,Q10,"Confirming understanding with colleagues is a straightforward process for me, as I always prepare thoroughly for discussions.",Sato,Slice of Life Game Planning,General Member,0,4,6,5.617558180020232,"[0.0, 0.03, 0.04, 0.1, 0.23, 0.3, 0.3]"
0,Q11,"I communicate my opinions with my peers with complete candor, ensuring clarity in every exchange.",Sato,Slice of Life Game Planning,General Member,0,4,6,5.691164795028251,"[0.06, 0.04, 0.0, 0.0, 0.16, 0.39, 0.35]"
0,Q12,I find it productive to maintain professional discussions regarding project matters with my peers.,Sato,Slice of Life Game Planning,General Member,0,4,6,5.338291096428886,"[0.0, 0.08, 0.1, 0.01, 0.26, 0.32, 0.23]"
0,Q13,I feel quite at liberty to share my notions with colleagues regarding new ventures or procedural modifications.,Sato,Slice of Life Game Planning,General Member,0,4,6,5.431212956858136,"[0.0, 0.02, 0.1, 0.06, 0.28, 0.3, 0.24]"
0,Q14,"I would feel quite comfortable sharing any missteps with my colleagues, as our team environment fosters open communication.",Sato,Slice of Life Game Planning,General Member,0,4,6,5.767610932552447,"[0.0, 0.03, 0.06, 0.0, 0.21, 0.38, 0.31]"
0,Q15,"I would feel comfortable raising a concern about a colleague's error, expecting a constructive dialogue to follow.",Sato,Slice of Life Game Planning,General Member,0,4,6,5.2583061802971685,"[0.0, 0.11, 0.1, 0.02, 0.2, 0.34, 0.23]"
0,Q16,My contributions are generally well-received and thoughtfully considered by my colleagues.,Sato,Slice of Life Game Planning,General Member,0,4,6,5.661897404206002,"[0.0, 0.02, 0.07, 0.06, 0.24, 0.3, 0.31]"
0,Q17,"Coordinating with an expanded group adds layers to the process, necessitating thorough preparation for alignment.",Sato,Slice of Life Game Planning,General Member,0,4,6,3.2846338649067692,"[0.16, 0.19, 0.31, 0.0, 0.23, 0.09, 0.02]"
0,Q18,The team's information flow requires a more proactive structure to ensure all members possess complete awareness of ongoing developments.,Sato,Slice of Life Game Planning,General Member,0,4,6,5.21782215231213,"[0.0, 0.09, 0.06, 0.13, 0.2, 0.28, 0.24]"
0,Q19,"The information sharing attempts demonstrate a solid foundation, though further efficiency in communication channels is a beneficial area for development.",Sato,Slice of Life Game Planning,General Member,0,4,6,4.060549895226918,"[0.16, 0.17, 0.17, 0.0, 0.16, 0.17, 0.17]"
0,Q20,"Our team demonstrates substantial unity in pursuing performance goals, yet the expansion of Yamamoto-san's facilitation session introduces a need for heightened alignment.",Sato,Slice of Life Game Planning,General Member,0,4,6,5.2061764722494885,"[0.06, 0.1, 0.05, 0.0, 0.25, 0.26, 0.28]"
0,Q21,I experience a significant comfort level with the dedication demonstrated by my colleagues.,Sato,Slice of Life Game Planning,General Member,0,4,6,6.12759609144284,"[0.0, 0.0, 0.01, 0.01, 0.22, 0.36, 0.41]"
