agent_id,question_id,answer_text,agent_name,dept,position,dept_id,pattern_id,turn,ssr_score,ssr_distribution
0,Q13,"I feel a degree of freedom to share recommendations and ideas with my peers, though I recognize the existing momentum of ""Echoes of Tomorrow"" presents a unique context for novel proposals.",Sato,Slice of Life Game Planning,General Member,0,4,2,5.060168443263553,"[0.0, 0.05, 0.13, 0.15, 0.26, 0.23, 0.18]"
0,Q14,I would feel a neutral sense of security discussing a misstep with my colleagues.,Sato,Slice of Life Game Planning,General Member,0,4,2,4.9483254647366035,"[0.0, 0.06, 0.13, 0.17, 0.25, 0.23, 0.16]"
0,Q15,I would feel quite comfortable addressing a colleague's error directly.,Sato,Slice of Life Game Planning,General Member,0,4,2,4.913907597360015,"[0.07, 0.1, 0.12, 0.0, 0.2, 0.28, 0.23]"
0,Q16,"I perceive my colleagues' receptiveness to my suggestions as generally positive, though their level of engagement varies with the novelty of the idea presented.",Sato,Slice of Life Game Planning,General Member,0,4,2,5.146409880800312,"[0.0, 0.07, 0.16, 0.03, 0.26, 0.27, 0.21]"
0,Q17,Consulting with Yamamoto-san is a most sensible first step to discern the current project landscape and any potential integration of ideas.,Sato,Slice of Life Game Planning,General Member,0,4,2,4.533285828652429,"[0.0, 0.16, 0.17, 0.12, 0.19, 0.25, 0.11]"
0,Q18,It appears there is a considerable gap in communication regarding ongoing project developments.,Sato,Slice of Life Game Planning,General Member,0,4,2,4.02788527374219,"[0.0, 0.17, 0.11, 0.4, 0.19, 0.09, 0.03]"
0,Q19,"It is imperative to ascertain the full scope of ""Echoes of Tomorrow"" and its integration potential before further developing our own concept.",Sato,Slice of Life Game Planning,General Member,0,4,2,4.66159142254962,"[0.13, 0.12, 0.16, 0.0, 0.09, 0.14, 0.36]"
0,Q20,It appears our team possesses differing paths toward our performance objectives.,Sato,Slice of Life Game Planning,General Member,0,4,2,2.703230200930521,"[0.24, 0.25, 0.27, 0.06, 0.14, 0.03, 0.0]"
0,Q21,"I require more information regarding the departmental landscape and the progress of ""Echoes of Tomorrow"" before forming an opinion on our team's commitment.",Sato,Slice of Life Game Planning,General Member,0,4,2,2.8952019824562436,"[0.18, 0.27, 0.25, 0.17, 0.04, 0.09, 0.0]"
0,Q22,"The aspirations of my team members for performance appear to be in a state of divergence due to the emergent information regarding ""Echoes of Tomorrow.""",Sato,Slice of Life Game Planning,General Member,0,4,2,3.663649020116096,"[0.14, 0.22, 0.22, 0.0, 0.18, 0.15, 0.09]"
0,Q23,The opportunities provided for personal performance improvement are quite sufficient.,Sato,Slice of Life Game Planning,General Member,0,4,2,5.658966752706288,"[0.0, 0.02, 0.05, 0.12, 0.17, 0.34, 0.3]"
1,Q01,It is quite straightforward to approach Yamamoto-san with any uncertainties regarding my duties.,Suzuki,Slice of Life Game Planning,General Member,0,4,2,5.100108990027845,"[0.0, 0.03, 0.12, 0.22, 0.22, 0.21, 0.21]"
1,Q02,I convey my workplace opinions with genuine clarity to my team leader.,Suzuki,Slice of Life Game Planning,General Member,0,4,2,4.878218228436675,"[0.09, 0.11, 0.09, 0.0, 0.19, 0.27, 0.25]"
1,Q03,"I generally find it comfortable to discuss personal issues or disagreements with my team leader, as open communication fosters a robust work environment.",Suzuki,Slice of Life Game Planning,General Member,0,4,2,5.576680223469129,"[0.0, 0.07, 0.05, 0.04, 0.21, 0.34, 0.29]"
1,Q04,I feel quite liberated to voice recommendations and ideas for new projects or procedural adjustments to my team leader.,Suzuki,Slice of Life Game Planning,General Member,0,4,2,5.531449121571559,"[0.0, 0.01, 0.08, 0.09, 0.28, 0.26, 0.28]"
1,Q05,"I would feel quite secure sharing any errors with Yamamoto-san, knowing he'd focus on collective learning.",Suzuki,Slice of Life Game Planning,General Member,0,4,2,5.715392854389423,"[0.01, 0.0, 0.03, 0.11, 0.22, 0.3, 0.32]"
1,Q06,I would feel quite comfortable raising concerns with my team leader if I observed a colleague making an error.,Suzuki,Slice of Life Game Planning,General Member,0,4,2,4.932082947585058,"[0.05, 0.11, 0.14, 0.0, 0.18, 0.29, 0.23]"
1,Q07,My input is recognized as a significant contribution to our team's projects.,Suzuki,Slice of Life Game Planning,General Member,0,4,2,5.819956632680446,"[0.03, 0.0, 0.03, 0.03, 0.23, 0.31, 0.36]"
1,Q08,"My team leader, Yamamoto-san, fully supports my initiative to explore and integrate new concepts, fostering a climate where fresh ideas are genuinely welcomed.",Suzuki,Slice of Life Game Planning,General Member,0,4,2,5.766998627222485,"[0.0, 0.02, 0.02, 0.12, 0.18, 0.35, 0.31]"
1,Q09,"Yamamoto-san's leadership is a sound basis for project advocacy, especially when embracing collaborative ideation.",Suzuki,Slice of Life Game Planning,General Member,0,4,2,5.944973736569188,"[0.0, 0.01, 0.04, 0.03, 0.21, 0.36, 0.35]"
1,Q10,I am very comfortable seeking input from my colleagues as their perspectives often illuminate paths I haven't considered.,Suzuki,Slice of Life Game Planning,General Member,0,4,2,5.622443649131811,"[0.0, 0.1, 0.0, 0.05, 0.16, 0.38, 0.3]"
1,Q11,"I possess a remarkable ability to articulate my work-related viewpoints with colleagues, finding it quite a straightforward process.",Suzuki,Slice of Life Game Planning,General Member,0,4,2,5.597306073576656,"[0.08, 0.02, 0.03, 0.0, 0.18, 0.37, 0.33]"
1,Q12,I find myself completely at ease discussing personal matters with my peers.,Suzuki,Slice of Life Game Planning,General Member,0,4,2,5.8325477448497285,"[0.03, 0.01, 0.02, 0.0, 0.25, 0.34, 0.35]"
1,Q13,"I feel quite liberated to share my recommendations with my peers, as discussions tend to build positively upon initial concepts.",Suzuki,Slice of Life Game Planning,General Member,0,4,2,5.619446098944531,"[0.0, 0.01, 0.06, 0.08, 0.28, 0.29, 0.28]"
1,Q14,I would feel exceptionally comfortable discussing my missteps with my colleagues.,Suzuki,Slice of Life Game Planning,General Member,0,4,2,5.0522199019083525,"[0.08, 0.07, 0.1, 0.0, 0.21, 0.28, 0.26]"
1,Q15,"I would feel safe speaking up to a colleague if I observed an error, as a constructive dialogue fosters collective improvement.",Suzuki,Slice of Life Game Planning,General Member,0,4,2,5.189326493982701,"[0.04, 0.12, 0.07, 0.0, 0.18, 0.33, 0.26]"
1,Q16,"I perceive my contributions as highly appreciated by my peers, particularly when they align with shared intuitive understanding.",Suzuki,Slice of Life Game Planning,General Member,0,4,2,5.8444125315675635,"[0.0, 0.0, 0.03, 0.07, 0.25, 0.33, 0.32]"
1,Q17,"Engaging with colleagues for assistance is a remarkably smooth process, yielding exceptional results.",Suzuki,Slice of Life Game Planning,General Member,0,4,2,5.342420084630364,"[0.07, 0.0, 0.04, 0.14, 0.21, 0.21, 0.33]"
1,Q18,"Team members actively share information, fostering a sense of shared understanding.",Suzuki,Slice of Life Game Planning,General Member,0,4,2,5.247097939710281,"[0.0, 0.11, 0.08, 0.07, 0.19, 0.3, 0.25]"
1,Q19,"The information sharing feels genuinely productive, with ideas building upon each other effectively.",Suzuki,Slice of Life Game Planning,General Member,0,4,2,4.2292577757824255,"[0.15, 0.15, 0.16, 0.0, 0.17, 0.18, 0.2]"
1,Q20,Our team is remarkably aligned in pursuing our performance objectives.,Suzuki,Slice of Life Game Planning,General Member,0,4,2,5.557366910170009,"[0.08, 0.04, 0.03, 0.0, 0.17, 0.3, 0.38]"
1,Q21,I am pleased with the team's commitment to the task.,Suzuki,Slice of Life Game Planning,General Member,0,4,2,5.929742918694371,"[0.0, 0.02, 0.03, 0.0, 0.24, 0.37, 0.34]"
1,Q22,My team members' aspirations for team performance present a cohesive and inspiring synergy.,Suzuki,Slice of Life Game Planning,General Member,0,4,2,5.571182725311329,"[0.0, 0.04, 0.05, 0.11, 0.17, 0.34, 0.29]"
1,Q23,The opportunities provided by this team for enhancing my personal performance are completely sufficient.,Suzuki,Slice of Life Game Planning,General Member,0,4,2,5.872123473041054,"[0.0, 0.01, 0.03, 0.12, 0.14, 0.31, 0.39]"
2,Q01,Engaging with my team leader on matters of uncertainty is a process that requires careful consideration and preparation.,Takahashi,Slice of Life Game Planning,General Member,0,4,2,3.2373327257807896,"[0.15, 0.23, 0.2, 0.19, 0.1, 0.13, 0.0]"
2,Q02,I find it beneficial to take time for reflection before sharing my perspectives on work matters with my team leader.,Takahashi,Slice of Life Game Planning,General Member,0,4,2,4.09316408071074,"[0.12, 0.19, 0.17, 0.0, 0.19, 0.2, 0.13]"
2,Q03,"I appreciate Suzuki-san's insightful contributions, and the clarity they bring to our project's direction.",Takahashi,Slice of Life Game Planning,General Member,0,4,2,5.616813225697689,"[0.0, 0.02, 0.09, 0.05, 0.23, 0.3, 0.31]"
2,Q04,I experience a comfortable freedom in offering my recommendations and ideas for new projects or procedural changes to my team leader.,Takahashi,Slice of Life Game Planning,General Member,0,4,2,5.508384541757614,"[0.0, 0.03, 0.06, 0.12, 0.25, 0.28, 0.27]"
2,Q05,"I would feel quite secure discussing any errors with my team leader, as I trust their understanding and guidance.",Takahashi,Slice of Life Game Planning,General Member,0,4,2,5.972278946490691,"[0.01, 0.01, 0.03, 0.0, 0.21, 0.36, 0.38]"
2,Q06,I possess confidence that my observations regarding colleagues' errors would be received constructively by my team leader.,Takahashi,Slice of Life Game Planning,General Member,0,4,2,5.421087327355005,"[0.02, 0.08, 0.08, 0.0, 0.19, 0.34, 0.29]"
2,Q07,"My contributions are genuinely perceived and integrated, bringing a solid structure to our shared vision.",Takahashi,Slice of Life Game Planning,General Member,0,4,2,5.645931968806191,"[0.02, 0.0, 0.05, 0.11, 0.22, 0.31, 0.3]"
2,Q08,My team leader actively encourages exploration into novel tasks and skill acquisition.,Takahashi,Slice of Life Game Planning,General Member,0,4,2,5.721552568196552,"[0.0, 0.01, 0.02, 0.13, 0.2, 0.34, 0.3]"
2,Q09,"Suzuki-san's advocacy for me has been consistently impressive, therefore I find him a dependable resource.",Takahashi,Slice of Life Game Planning,General Member,0,4,2,5.789098163903775,"[0.03, 0.0, 0.01, 0.1, 0.17, 0.33, 0.36]"
2,Q10,I find it quite straightforward to seek clarification from my colleagues when a query arises concerning my responsibilities.,Takahashi,Slice of Life Game Planning,General Member,0,4,2,5.192342178510765,"[0.0, 0.07, 0.1, 0.1, 0.23, 0.29, 0.21]"
2,Q11,"I express my viewpoints with a measured consideration, ensuring my contributions enhance the collective understanding.",Takahashi,Slice of Life Game Planning,General Member,0,4,2,3.915857165459488,"[0.15, 0.19, 0.18, 0.0, 0.16, 0.21, 0.12]"
2,Q12,I find sharing personal matters with colleagues a decidedly welcome experience.,Takahashi,Slice of Life Game Planning,General Member,0,4,2,5.530958663872527,"[0.0, 0.03, 0.1, 0.0, 0.3, 0.3, 0.27]"
2,Q13,I experience a complete liberty to propose suggestions and concepts for novel projects or modifications to existing procedures among my colleagues.,Takahashi,Slice of Life Game Planning,General Member,0,4,2,5.743932225054671,"[0.0, 0.01, 0.05, 0.07, 0.25, 0.33, 0.3]"
2,Q14,"I feel confident that I can express my thoughts openly, even if they pertain to errors, within this collaborative environment.",Takahashi,Slice of Life Game Planning,General Member,0,4,2,5.629769560184288,"[0.0, 0.04, 0.07, 0.04, 0.22, 0.34, 0.29]"
2,Q15,I feel completely secure voicing my observations when a colleague appears to be on an unproductive path.,Takahashi,Slice of Life Game Planning,General Member,0,4,2,5.33281520307378,"[0.0, 0.1, 0.04, 0.2, 0.07, 0.29, 0.31]"
2,Q16,"My contributions feel thoughtfully integrated, fostering a strong sense of shared creation.",Takahashi,Slice of Life Game Planning,General Member,0,4,2,5.593083284965507,"[0.0, 0.03, 0.07, 0.09, 0.21, 0.32, 0.28]"
2,Q17,Assisting colleagues with their tasks is a straightforward endeavor.,Takahashi,Slice of Life Game Planning,General Member,0,4,2,5.168433585943916,"[0.0, 0.03, 0.1, 0.21, 0.23, 0.22, 0.22]"
2,Q18,Team members broadly maintain a commendable level of mutual awareness regarding work-related matters.,Takahashi,Slice of Life Game Planning,General Member,0,4,2,5.297646309888668,"[0.0, 0.07, 0.09, 0.09, 0.22, 0.27, 0.26]"
2,Q19,The information sharing throughout the team possesses a substantial degree of authenticity.,Takahashi,Slice of Life Game Planning,General Member,0,4,2,4.399192747786847,"[0.13, 0.14, 0.13, 0.0, 0.18, 0.2, 0.21]"
2,Q20,The team's focus on achieving performance goals shows a truly commendable alignment.,Takahashi,Slice of Life Game Planning,General Member,0,4,2,5.758138057054753,"[0.05, 0.04, 0.0, 0.03, 0.16, 0.32, 0.39]"
2,Q21,I appreciate the substantial commitment demonstrated by the team to our current task.,Takahashi,Slice of Life Game Planning,General Member,0,4,2,5.412976211786,"[0.07, 0.05, 0.05, 0.0, 0.2, 0.29, 0.34]"
2,Q22,"Suzuki-san's innovative framing of our project around community rebuilding significantly enriches the conceptual foundation, and Ito-san's anticipated contribution promises valuable structure for translating these ideas into concrete gameplay.",Takahashi,Slice of Life Game Planning,General Member,0,4,2,5.585542641910328,"[0.04, 0.03, 0.09, 0.0, 0.13, 0.37, 0.33]"
2,Q23,The opportunities provided to enhance my personal performance are quite sufficient.,Takahashi,Slice of Life Game Planning,General Member,0,4,2,5.502090132593741,"[0.0, 0.05, 0.06, 0.14, 0.15, 0.31, 0.29]"
3,Q01,Seeking clarification from my team leader is a straightforward endeavor when questions arise regarding my responsibilities.,Tanaka,Slice of Life Game Planning,General Member,0,4,2,5.196006675950791,"[0.0, 0.11, 0.09, 0.07, 0.19, 0.32, 0.22]"
3,Q02,"I can openly share my perspectives on work matters with my team leader, believing that directness fosters productive collaboration.",Tanaka,Slice of Life Game Planning,General Member,0,4,2,5.696239522444001,"[0.0, 0.06, 0.02, 0.03, 0.25, 0.34, 0.3]"
3,Q03,"I experience a considerable level of ease discussing personal challenges or divergences with my team leader, ensuring a transparent and collaborative environment.",Tanaka,Slice of Life Game Planning,General Member,0,4,2,5.826588241966441,"[0.01, 0.03, 0.04, 0.0, 0.23, 0.34, 0.35]"
3,Q04,I feel adequately able to present suggestions for new projects or procedural adjustments to my team leader.,Tanaka,Slice of Life Game Planning,General Member,0,4,2,5.278456233328217,"[0.0, 0.04, 0.16, 0.01, 0.28, 0.3, 0.21]"
3,Q05,I would feel entirely secure discussing any error with my team leader due to our open communication.,Tanaka,Slice of Life Game Planning,General Member,0,4,2,5.771509548254629,"[0.06, 0.04, 0.0, 0.0, 0.14, 0.36, 0.39]"
3,Q06,I would feel comfortable discussing potential improvements if I observed a colleague's work needing refinement.,Tanaka,Slice of Life Game Planning,General Member,0,4,2,5.209377710960704,"[0.0, 0.06, 0.15, 0.03, 0.24, 0.29, 0.22]"
3,Q07,I perceive my input as somewhat sidelined when I share my opinions with my team leader.,Tanaka,Slice of Life Game Planning,General Member,0,4,2,3.04477109612034,"[0.18, 0.2, 0.25, 0.16, 0.16, 0.04, 0.0]"
3,Q08,My team leader cultivates an environment where exploring novel responsibilities and acquiring new competencies is certainly embraced.,Tanaka,Slice of Life Game Planning,General Member,0,4,2,5.615346302461134,"[0.0, 0.02, 0.03, 0.14, 0.21, 0.32, 0.28]"
3,Q09,My team leader is a strong advocate who always champions our department's interests within the company.,Tanaka,Slice of Life Game Planning,General Member,0,4,2,5.365746845596899,"[0.09, 0.07, 0.07, 0.0, 0.07, 0.34, 0.36]"
3,Q10,It remains a straightforward endeavor to seek clarification from colleagues regarding my professional responsibilities.,Tanaka,Slice of Life Game Planning,General Member,0,4,2,4.875951692701049,"[0.0, 0.16, 0.08, 0.1, 0.17, 0.36, 0.13]"
3,Q11,I possess a strong inclination to articulate my professional viewpoints with complete transparency to my colleagues.,Tanaka,Slice of Life Game Planning,General Member,0,4,2,5.579199623589224,"[0.06, 0.04, 0.03, 0.0, 0.21, 0.32, 0.34]"
3,Q12,I maintain a comfortable distance when discussing personal matters with colleagues.,Tanaka,Slice of Life Game Planning,General Member,0,4,2,4.750707227843195,"[0.0, 0.09, 0.15, 0.16, 0.23, 0.23, 0.13]"
3,Q13,I feel empowered to offer suggestions that enhance our shared objectives.,Tanaka,Slice of Life Game Planning,General Member,0,4,2,5.307221512952464,"[0.0, 0.05, 0.11, 0.06, 0.25, 0.3, 0.22]"
3,Q14,"I would feel comfortable discussing any errors with my peers, as our collaborative environment fosters growth.",Tanaka,Slice of Life Game Planning,General Member,0,4,2,5.61262320183318,"[0.0, 0.07, 0.07, 0.0, 0.2, 0.37, 0.29]"
3,Q15,"I would feel entirely comfortable pointing out an error to a colleague, as constructive feedback fosters growth and improves our collective output.",Tanaka,Slice of Life Game Planning,General Member,0,4,2,5.380475694629544,"[0.03, 0.08, 0.09, 0.0, 0.18, 0.34, 0.29]"
3,Q16,"My contributions are generally well-received and integrated into our collective progress, with occasional opportunities for further enhancement.",Tanaka,Slice of Life Game Planning,General Member,0,4,2,5.53647592547013,"[0.0, 0.02, 0.1, 0.06, 0.26, 0.29, 0.28]"
3,Q17,"It is quite straightforward to request assistance from my colleagues, as everyone demonstrates a strong willingness to contribute.",Tanaka,Slice of Life Game Planning,General Member,0,4,2,5.709545965479633,"[0.0, 0.03, 0.01, 0.13, 0.22, 0.28, 0.33]"
3,Q18,There is a consistent flow of shared information regarding work-related matters within the team.,Tanaka,Slice of Life Game Planning,General Member,0,4,2,5.173654478841059,"[0.0, 0.1, 0.09, 0.08, 0.23, 0.27, 0.23]"
3,Q19,"Sato-san's idea offers a rich thematic overlay, and we are actively incorporating player engagement through gameplay mechanics for ""Echoes of Tomorrow.""",Tanaka,Slice of Life Game Planning,General Member,0,4,2,5.142085944135911,"[0.0, 0.03, 0.15, 0.2, 0.18, 0.13, 0.3]"
3,Q20,"Our team is making remarkable progress on tangible gameplay mechanics, while also finding opportunities to integrate promising new conceptual additions.",Tanaka,Slice of Life Game Planning,General Member,0,4,2,4.441077556240197,"[0.11, 0.12, 0.18, 0.0, 0.2, 0.19, 0.2]"
3,Q21,"I find our team's dedication to fleshing out the tangible gameplay mechanics for ""Echoes of Tomorrow"" to be quite productive.",Tanaka,Slice of Life Game Planning,General Member,0,4,2,5.461650201771462,"[0.05, 0.04, 0.09, 0.0, 0.23, 0.27, 0.33]"
3,Q22,"Sato-san's concept offers potential synergy with our existing direction for ""Echoes of Tomorrow,"" yet requires careful integration to avoid disrupting our immediate focus on core mechanics.",Tanaka,Slice of Life Game Planning,General Member,0,4,2,4.825866738116734,"[0.0, 0.06, 0.28, 0.05, 0.17, 0.28, 0.16]"
3,Q23,The team provides sufficient avenues for me to enhance my capabilities.,Tanaka,Slice of Life Game Planning,General Member,0,4,2,5.437207699071974,"[0.0, 0.06, 0.06, 0.13, 0.14, 0.32, 0.28]"
4,Q01,"My team leader is approachable, making it easy to seek clarification on my role.",Watanabe,Slice of Life Game Planning,General Member,0,4,2,5.261061455498728,"[0.0, 0.07, 0.09, 0.11, 0.23, 0.28, 0.23]"
4,Q02,I am comfortable sharing my perspectives regarding work matters with my team leader.,Watanabe,Slice of Life Game Planning,General Member,0,4,2,4.490103219463741,"[0.09, 0.15, 0.14, 0.0, 0.2, 0.24, 0.17]"
4,Q03,"I feel quite comfortable discussing personal challenges or disagreements with my team leader, as open communication fosters a stronger working environment.",Watanabe,Slice of Life Game Planning,General Member,0,4,2,5.803566814386041,"[0.0, 0.05, 0.03, 0.01, 0.22, 0.36, 0.33]"
4,Q04,I feel quite empowered to share my recommendations and ideas with my team leader.,Watanabe,Slice of Life Game Planning,General Member,0,4,2,5.4800275138242815,"[0.04, 0.04, 0.07, 0.0, 0.26, 0.28, 0.31]"
4,Q05,"I would feel quite comfortable raising concerns about any missteps with my team leader, as I value open communication.",Watanabe,Slice of Life Game Planning,General Member,0,4,2,5.567853994472866,"[0.02, 0.07, 0.07, 0.0, 0.17, 0.35, 0.33]"
4,Q06,"I would feel quite comfortable addressing a colleague's error with the team leader, as open communication fosters improvement.",Watanabe,Slice of Life Game Planning,General Member,0,4,2,5.155262956539559,"[0.04, 0.09, 0.1, 0.0, 0.19, 0.32, 0.25]"
4,Q07,My contributions are consistently recognized and considered by my team leader.,Watanabe,Slice of Life Game Planning,General Member,0,4,2,5.762294883935694,"[0.02, 0.0, 0.02, 0.1, 0.22, 0.33, 0.31]"
4,Q08,My team leader consistently encourages exploration of novel responsibilities and skill acquisition.,Watanabe,Slice of Life Game Planning,General Member,0,4,2,5.649577155037347,"[0.0, 0.02, 0.04, 0.13, 0.2, 0.33, 0.29]"
4,Q09,My team leader is quite dependable in advocating for me when I encounter challenges.,Watanabe,Slice of Life Game Planning,General Member,0,4,2,6.149123774257523,"[0.0, 0.01, 0.01, 0.01, 0.16, 0.41, 0.4]"
4,Q10,Engaging colleagues for clarification on my responsibilities is generally a straightforward endeavor.,Watanabe,Slice of Life Game Planning,General Member,0,4,2,5.1876751907610394,"[0.0, 0.06, 0.09, 0.14, 0.22, 0.27, 0.21]"
4,Q11,"I communicate my opinions directly, with a preference for clear and constructive dialogue.",Watanabe,Slice of Life Game Planning,General Member,0,4,2,4.672588764115508,"[0.11, 0.13, 0.1, 0.0, 0.17, 0.28, 0.21]"
4,Q12,I feel perfectly at ease discussing personal matters with my colleagues.,Watanabe,Slice of Life Game Planning,General Member,0,4,2,5.927624872160121,"[0.0, 0.0, 0.02, 0.04, 0.25, 0.35, 0.34]"
4,Q13,I feel a high degree of freedom to offer suggestions for new projects or procedural changes to my colleagues.,Watanabe,Slice of Life Game Planning,General Member,0,4,2,5.555564937076754,"[0.0, 0.0, 0.07, 0.11, 0.27, 0.27, 0.28]"
4,Q14,"I would feel quite comfortable addressing any missteps with my colleagues, knowing we are all dedicated to refining our shared vision.",Watanabe,Slice of Life Game Planning,General Member,0,4,2,5.661257246511224,"[0.0, 0.04, 0.07, 0.04, 0.21, 0.35, 0.3]"
4,Q15,I would feel quite comfortable raising a concern with a colleague if I observed an error.,Watanabe,Slice of Life Game Planning,General Member,0,4,2,5.088841860185207,"[0.03, 0.1, 0.13, 0.0, 0.2, 0.3, 0.24]"
4,Q16,My contributions are consistently met with thoughtful consideration and active integration by my colleagues.,Watanabe,Slice of Life Game Planning,General Member,0,4,2,5.895462042893682,"[0.0, 0.01, 0.04, 0.06, 0.18, 0.35, 0.36]"
4,Q17,"It is remarkably straightforward to request assistance from colleagues, fostering a collaborative spirit.",Watanabe,Slice of Life Game Planning,General Member,0,4,2,5.595933383425569,"[0.02, 0.0, 0.03, 0.16, 0.23, 0.24, 0.32]"
4,Q18,Team members offer substantial contributions to each other's understanding of work-related matters.,Watanabe,Slice of Life Game Planning,General Member,0,4,2,5.3337598272069044,"[0.03, 0.06, 0.11, 0.0, 0.22, 0.28, 0.29]"
4,Q19,"The information sharing amongst the team feels genuinely substantive, avoiding unnecessary superficiality.",Watanabe,Slice of Life Game Planning,General Member,0,4,2,3.7552280239371245,"[0.19, 0.19, 0.2, 0.0, 0.12, 0.12, 0.18]"
4,Q20,Our team is experiencing a truly remarkable alignment in our pursuit of project objectives.,Watanabe,Slice of Life Game Planning,General Member,0,4,2,5.44053397633386,"[0.06, 0.06, 0.06, 0.0, 0.18, 0.32, 0.32]"
4,Q21,I am exceptionally pleased with the team's dedicated commitment to our shared objectives.,Watanabe,Slice of Life Game Planning,General Member,0,4,2,5.777538883291981,"[0.08, 0.01, 0.0, 0.03, 0.16, 0.3, 0.42]"
4,Q22,"Our team members exhibit exceptional alignment, with aspirations for team performance complementing each other remarkably well.",Watanabe,Slice of Life Game Planning,General Member,0,4,2,5.636226993748911,"[0.03, 0.0, 0.03, 0.13, 0.2, 0.3, 0.32]"
4,Q23,The opportunities this team provides for my personal performance enhancement are absolutely wonderful.,Watanabe,Slice of Life Game Planning,General Member,0,4,2,5.497658530655784,"[0.1, 0.0, 0.06, 0.03, 0.16, 0.25, 0.4]"
5,Q01,It presents a straightforward experience to approach my team leader with inquiries regarding my responsibilities.,Ito,Slice of Life Game Planning,General Member,0,4,2,5.1934623280648236,"[0.0, 0.08, 0.1, 0.11, 0.2, 0.29, 0.23]"
5,Q02,"I communicate my opinions about work issues with my team leader with complete openness, as I believe candid discussion is a cornerstone of productive collaboration.",Ito,Slice of Life Game Planning,General Member,0,4,2,5.507582043980261,"[0.03, 0.07, 0.03, 0.0, 0.24, 0.34, 0.29]"
5,Q03,I feel a moderate level of comfort discussing personal issues or disagreements with my team leader.,Ito,Slice of Life Game Planning,General Member,0,4,2,5.20336334880879,"[0.0, 0.04, 0.13, 0.08, 0.28, 0.26, 0.2]"
5,Q04,I feel quite unhindered in sharing my recommendations and ideas with my team leader.,Ito,Slice of Life Game Planning,General Member,0,4,2,5.845690950710107,"[0.0, 0.0, 0.05, 0.04, 0.24, 0.33, 0.34]"
5,Q05,"I would feel quite comfortable voicing any errors to my team leader, as I believe constructive feedback fosters growth.",Ito,Slice of Life Game Planning,General Member,0,4,2,5.474460871864306,"[0.03, 0.06, 0.08, 0.0, 0.19, 0.33, 0.31]"
5,Q06,"I would feel quite safe speaking with my team leader about a colleague's mistake, as I believe open communication fosters improvement.",Ito,Slice of Life Game Planning,General Member,0,4,2,5.651956987704987,"[0.02, 0.06, 0.04, 0.0, 0.19, 0.37, 0.32]"
