agent_id,question_id,answer_text,agent_name,dept,position,dept_id,pattern_id,turn,ssr_score,ssr_distribution
0,Q19,"Our team's information sharing exhibits a genuine and deep-seated quality, avoiding any superficiality in its execution.",Sato,Slice of Life Game Planning,General Member,0,4,7,3.7263595934338234,"[0.19, 0.21, 0.19, 0.0, 0.1, 0.12, 0.19]"
0,Q20,"The team's approach to securing critical integration sessions reflects a shared understanding of urgency, though the precise sequencing requires immediate consolidation.",Sato,Slice of Life Game Planning,General Member,0,4,7,4.384130966609263,"[0.1, 0.16, 0.14, 0.0, 0.23, 0.2, 0.17]"
0,Q21,I find the team's current commitment level satisfactory for our progress.,Sato,Slice of Life Game Planning,General Member,0,4,7,5.211675597153887,"[0.0, 0.08, 0.09, 0.06, 0.25, 0.33, 0.19]"
0,Q22,The team's aspirations for performance possess a significant divergence regarding the opportune timing for strategic discussions and subsequent actions.,Sato,Slice of Life Game Planning,General Member,0,4,7,3.7351209290031027,"[0.12, 0.22, 0.21, 0.0, 0.18, 0.22, 0.05]"
0,Q23,"The opportunities presented for refining my individual contributions feel quite sufficient, allowing for valuable personal development.",Sato,Slice of Life Game Planning,General Member,0,4,7,5.147894391988231,"[0.0, 0.08, 0.1, 0.13, 0.18, 0.29, 0.22]"
1,Q01,It is a straightforward process to seek guidance from my team leader when questions arise regarding my role.,Suzuki,Slice of Life Game Planning,General Member,0,4,7,5.294307506532299,"[0.0, 0.11, 0.07, 0.05, 0.2, 0.34, 0.24]"
1,Q02,I communicate my work opinions to my team leader with a high degree of openness.,Suzuki,Slice of Life Game Planning,General Member,0,4,7,5.344257544631112,"[0.05, 0.07, 0.04, 0.0, 0.25, 0.32, 0.27]"
1,Q03,"I maintain a comfortable disposition when discussing personal challenges or disagreements with my team leader, as clear communication supports our collective advancement.",Suzuki,Slice of Life Game Planning,General Member,0,4,7,5.415365220947249,"[0.0, 0.06, 0.07, 0.09, 0.2, 0.31, 0.26]"
1,Q04,I feel quite unhindered in offering my recommendations and ideas for new projects or procedural changes to my team leader.,Suzuki,Slice of Life Game Planning,General Member,0,4,7,5.447358117415089,"[0.0, 0.01, 0.09, 0.13, 0.25, 0.27, 0.25]"
1,Q05,I would feel completely safe speaking up to my team leader if I made a mistake on this team.,Suzuki,Slice of Life Game Planning,General Member,0,4,7,4.984585195194633,"[0.1, 0.1, 0.07, 0.0, 0.16, 0.28, 0.28]"
1,Q06,I would feel reasonably secure voicing concerns about a colleague's misstep to my team leader.,Suzuki,Slice of Life Game Planning,General Member,0,4,7,5.234663201571474,"[0.0, 0.09, 0.13, 0.01, 0.23, 0.31, 0.23]"
1,Q07,"My input feels valued when I present thoroughly developed concepts, fostering productive discussions.",Suzuki,Slice of Life Game Planning,General Member,0,4,7,5.726556361202103,"[0.02, 0.0, 0.01, 0.13, 0.2, 0.32, 0.32]"
1,Q08,My team leader provides ample opportunity for me to explore novel responsibilities and skill acquisition.,Suzuki,Slice of Life Game Planning,General Member,0,4,7,5.691434093253237,"[0.0, 0.01, 0.03, 0.13, 0.22, 0.33, 0.29]"
1,Q09,My team leader's advocacy is consistently reliable for addressing concerns.,Suzuki,Slice of Life Game Planning,General Member,0,4,7,6.096342105429038,"[0.03, 0.02, 0.0, 0.0, 0.11, 0.43, 0.41]"
1,Q10,It is straightforward to engage colleagues for clarification on role-related uncertainties.,Suzuki,Slice of Life Game Planning,General Member,0,4,7,5.069552068872692,"[0.0, 0.05, 0.13, 0.14, 0.24, 0.25, 0.19]"
1,Q11,"I maintain open communication with my peers regarding work issues, sharing my perspectives with clarity and directness.",Suzuki,Slice of Life Game Planning,General Member,0,4,7,5.546653913944938,"[0.0, 0.05, 0.04, 0.09, 0.22, 0.35, 0.26]"
1,Q12,I find discussions about personal matters with colleagues to be consistently unproblematic.,Suzuki,Slice of Life Game Planning,General Member,0,4,7,5.606590450993634,"[0.0, 0.04, 0.03, 0.12, 0.2, 0.34, 0.28]"
1,Q13,I find myself entirely at liberty to present recommendations and concepts to my colleagues.,Suzuki,Slice of Life Game Planning,General Member,0,4,7,5.563011851071754,"[0.03, 0.0, 0.04, 0.12, 0.22, 0.31, 0.28]"
1,Q14,I am confident that my peers would offer constructive feedback rather than judgment when I make an error.,Suzuki,Slice of Life Game Planning,General Member,0,4,7,5.471243653195806,"[0.0, 0.07, 0.07, 0.05, 0.21, 0.33, 0.27]"
1,Q15,I would feel quite safe speaking up to a colleague if I observed an error.,Suzuki,Slice of Life Game Planning,General Member,0,4,7,5.083339572466889,"[0.06, 0.1, 0.09, 0.0, 0.2, 0.29, 0.26]"
1,Q16,"My input feels quite valuable when I offer specific, fleshed-out concepts for integration.",Suzuki,Slice of Life Game Planning,General Member,0,4,7,5.59111398722584,"[0.04, 0.0, 0.06, 0.06, 0.24, 0.29, 0.32]"
1,Q17,It presents a certain challenge to solicit assistance from my colleagues.,Suzuki,Slice of Life Game Planning,General Member,0,4,7,2.938612766048428,"[0.19, 0.24, 0.25, 0.12, 0.12, 0.07, 0.0]"
1,Q18,"I find that our team operates with a degree of information asymmetry, requiring diligent personal efforts to ensure comprehensive understanding of work-related matters.",Suzuki,Slice of Life Game Planning,General Member,0,4,7,5.141597413983286,"[0.0, 0.05, 0.17, 0.08, 0.22, 0.21, 0.26]"
1,Q19,"The information sharing attempts possess a genuine depth, prioritizing foundational understanding before expanding.",Suzuki,Slice of Life Game Planning,General Member,0,4,7,3.751318371940961,"[0.19, 0.19, 0.19, 0.0, 0.13, 0.14, 0.16]"
1,Q20,My team possesses a significant level of internal coherence in pursuing our performance objectives.,Suzuki,Slice of Life Game Planning,General Member,0,4,7,5.798045327162866,"[0.05, 0.01, 0.03, 0.0, 0.24, 0.27, 0.4]"
1,Q21,I possess a complete contentment with our team's dedication to the assigned objective.,Suzuki,Slice of Life Game Planning,General Member,0,4,7,5.978222037746934,"[0.01, 0.01, 0.0, 0.03, 0.21, 0.36, 0.37]"
1,Q22,My team members' aspirations for the team's performance appear to be perfectly aligned with mine.,Suzuki,Slice of Life Game Planning,General Member,0,4,7,5.713773570034523,"[0.0, 0.01, 0.05, 0.09, 0.22, 0.31, 0.31]"
1,Q23,"The current opportunities allow for considerable refinement of my personal performance through focused, individual preparation.",Suzuki,Slice of Life Game Planning,General Member,0,4,7,5.684506190365727,"[0.0, 0.02, 0.09, 0.04, 0.21, 0.31, 0.33]"
2,Q01,Engaging Yamamoto-san with our refined proposal and the urgency for the integration session will require a focused and unified approach.,Takahashi,Slice of Life Game Planning,General Member,0,4,7,3.1574096734492634,"[0.12, 0.16, 0.28, 0.35, 0.09, 0.01, 0.0]"
2,Q02,I find it beneficial to articulate my thoughts on work matters with my team leader directly and without reservation.,Takahashi,Slice of Life Game Planning,General Member,0,4,7,4.728257945573723,"[0.06, 0.14, 0.13, 0.0, 0.21, 0.27, 0.19]"
2,Q03,My comfort level speaking about personal issues or disagreements with my team leader is one of quiet consideration.,Takahashi,Slice of Life Game Planning,General Member,0,4,7,4.601608032575839,"[0.0, 0.1, 0.16, 0.22, 0.18, 0.23, 0.1]"
2,Q04,"My recommendations are welcomed, and I feel quite at liberty to share my thoughts on project direction.",Takahashi,Slice of Life Game Planning,General Member,0,4,7,5.407597936271873,"[0.0, 0.0, 0.08, 0.17, 0.23, 0.28, 0.23]"
2,Q05,"My comfort level in discussing any missteps with our team leader is quite high, allowing for a clear and open exchange.",Takahashi,Slice of Life Game Planning,General Member,0,4,7,5.818527789953986,"[0.0, 0.02, 0.06, 0.02, 0.21, 0.36, 0.33]"
2,Q06,"I would feel rather unsafe bringing up a colleague's mistake to our team leader, as direct criticism can sometimes create an awkward atmosphere.",Takahashi,Slice of Life Game Planning,General Member,0,4,7,2.7050705332749585,"[0.22, 0.28, 0.29, 0.07, 0.06, 0.08, 0.0]"
2,Q07,"My contributions are generally well-received, as my perspective is thoughtfully considered.",Takahashi,Slice of Life Game Planning,General Member,0,4,7,5.376999737131781,"[0.02, 0.0, 0.08, 0.13, 0.25, 0.26, 0.25]"
2,Q08,Our leader provides a supportive environment for team members to explore and acquire new skills.,Takahashi,Slice of Life Game Planning,General Member,0,4,7,5.457857681204179,"[0.0, 0.03, 0.05, 0.16, 0.2, 0.3, 0.26]"
2,Q09,Sato-san possesses a strong ability to champion team members when challenges arise.,Takahashi,Slice of Life Game Planning,General Member,0,4,7,6.0197963559615015,"[0.02, 0.0, 0.04, 0.0, 0.18, 0.36, 0.4]"
2,Q10,"Considering my role, seeking clarification from colleagues presents a straightforward path.",Takahashi,Slice of Life Game Planning,General Member,0,4,7,5.217473290980135,"[0.0, 0.06, 0.1, 0.13, 0.22, 0.28, 0.22]"
2,Q11,My communication with peers regarding work issues is generally direct and unfettered.,Takahashi,Slice of Life Game Planning,General Member,0,4,7,5.60528520432364,"[0.0, 0.0, 0.01, 0.21, 0.2, 0.3, 0.27]"
2,Q12,I find that discussing personal matters with colleagues presents a considerable challenge.,Takahashi,Slice of Life Game Planning,General Member,0,4,7,3.494967648091225,"[0.19, 0.21, 0.23, 0.0, 0.15, 0.14, 0.09]"
2,Q13,I find my ability to offer suggestions for new endeavors or procedural adjustments to colleagues to be somewhat constrained due to my preference for thorough deliberation.,Takahashi,Slice of Life Game Planning,General Member,0,4,7,2.7747558982002274,"[0.19, 0.24, 0.33, 0.14, 0.06, 0.04, 0.0]"
2,Q14,"I would feel quite secure sharing any missteps with my colleagues, as our collaborative spirit fosters a supportive environment for learning and growth.",Takahashi,Slice of Life Game Planning,General Member,0,4,7,5.779004055334585,"[0.0, 0.03, 0.05, 0.04, 0.21, 0.36, 0.32]"
2,Q15,My experience suggests that direct and clear communication with colleagues regarding potential errors is always a beneficial approach.,Takahashi,Slice of Life Game Planning,General Member,0,4,7,5.5706618387042415,"[0.02, 0.06, 0.08, 0.0, 0.18, 0.35, 0.31]"
2,Q16,My contributions are often perceived as thoughtful by my colleagues.,Takahashi,Slice of Life Game Planning,General Member,0,4,7,5.616759032473954,"[0.0, 0.01, 0.1, 0.05, 0.26, 0.28, 0.3]"
2,Q17,"Seeking assistance from my colleagues presents a reasonable degree of ease, as their unique perspectives consistently enrich my own approach.",Takahashi,Slice of Life Game Planning,General Member,0,4,7,4.812033168054006,"[0.0, 0.08, 0.14, 0.16, 0.28, 0.19, 0.15]"
2,Q18,"Information exchange within the team tends to be compartmentalized, with specific details often reaching individuals only when directly pertinent to their tasks.",Takahashi,Slice of Life Game Planning,General Member,0,4,7,4.363052962030427,"[0.0, 0.2, 0.15, 0.16, 0.22, 0.12, 0.15]"
2,Q19,"Information sharing feels somewhat limited, requiring a more robust and consistent approach to truly connect everyone.",Takahashi,Slice of Life Game Planning,General Member,0,4,7,3.9421095733604883,"[0.17, 0.18, 0.17, 0.0, 0.15, 0.15, 0.17]"
2,Q20,Our team maintains a consistent alignment in pursuit of shared objectives.,Takahashi,Slice of Life Game Planning,General Member,0,4,7,5.398107620092504,"[0.0, 0.08, 0.04, 0.12, 0.18, 0.31, 0.26]"
2,Q21,My reflection indicates a substantial requirement for amplified engagement from our team members.,Takahashi,Slice of Life Game Planning,General Member,0,4,7,4.491266909250802,"[0.13, 0.16, 0.13, 0.0, 0.1, 0.22, 0.26]"
2,Q22,"The team members possess a remarkably unified vision for collective accomplishment, with individual aspirations contributing constructively to the overall trajectory.",Takahashi,Slice of Life Game Planning,General Member,0,4,7,5.725612028830387,"[0.02, 0.0, 0.0, 0.16, 0.16, 0.34, 0.32]"
2,Q23,The current opportunities for personal performance improvement are sufficient.,Takahashi,Slice of Life Game Planning,General Member,0,4,7,4.761741074595824,"[0.0, 0.14, 0.1, 0.18, 0.17, 0.27, 0.14]"
3,Q01,Seeking clarification from my team leader is a very straightforward process.,Tanaka,Slice of Life Game Planning,General Member,0,4,7,5.658590579656642,"[0.0, 0.04, 0.05, 0.06, 0.22, 0.32, 0.31]"
3,Q02,I can openly share my thoughts on work matters with my team leader.,Tanaka,Slice of Life Game Planning,General Member,0,4,7,5.266756835976978,"[0.04, 0.09, 0.06, 0.0, 0.27, 0.3, 0.25]"
3,Q03,"I find discussing personal problems or disagreements with my team leader to be an entirely comfortable experience, allowing for open and productive dialogue.",Tanaka,Slice of Life Game Planning,General Member,0,4,7,5.803956582019944,"[0.0, 0.03, 0.02, 0.06, 0.22, 0.35, 0.32]"
3,Q04,I feel quite at liberty to voice my recommendations and ideas regarding new projects or procedural adjustments to my team leader.,Tanaka,Slice of Life Game Planning,General Member,0,4,7,5.5017312771739055,"[0.0, 0.02, 0.09, 0.07, 0.26, 0.31, 0.25]"
3,Q05,I would feel quite secure speaking with my team leader about any missteps.,Tanaka,Slice of Life Game Planning,General Member,0,4,7,5.550323039517058,"[0.04, 0.05, 0.06, 0.0, 0.21, 0.32, 0.32]"
3,Q06,"I would feel quite comfortable addressing a colleague's error with my team leader, as open communication fosters project success.",Tanaka,Slice of Life Game Planning,General Member,0,4,7,5.321712342751768,"[0.04, 0.08, 0.08, 0.0, 0.19, 0.34, 0.28]"
3,Q07,My input is recognized as constructive and integral to our collaborative progress by my team leader.,Tanaka,Slice of Life Game Planning,General Member,0,4,7,5.903076382902943,"[0.0, 0.02, 0.01, 0.07, 0.2, 0.37, 0.34]"
3,Q08,Watanabe-san's clear direction and shared vision make embarking on the detailed player action mapping a most welcome and energizing endeavor.,Tanaka,Slice of Life Game Planning,General Member,0,4,7,5.856427985962216,"[0.02, 0.01, 0.0, 0.1, 0.16, 0.36, 0.35]"
3,Q09,Watanabe-san's alignment on our current approach provides substantial confidence in her advocacy.,Tanaka,Slice of Life Game Planning,General Member,0,4,7,5.540880147442361,"[0.04, 0.0, 0.06, 0.08, 0.23, 0.29, 0.3]"
3,Q10,It is incredibly simple to approach colleagues with any uncertainties regarding my work.,Tanaka,Slice of Life Game Planning,General Member,0,4,7,5.611654647034857,"[0.03, 0.0, 0.05, 0.09, 0.24, 0.27, 0.33]"
3,Q11,I communicate my work opinions with my peers with complete openness.,Tanaka,Slice of Life Game Planning,General Member,0,4,7,5.698325792069262,"[0.02, 0.05, 0.02, 0.0, 0.24, 0.38, 0.29]"
3,Q12,I find discussions about personal matters with colleagues to be perfectly suitable.,Tanaka,Slice of Life Game Planning,General Member,0,4,7,5.395135274885625,"[0.0, 0.03, 0.1, 0.06, 0.26, 0.31, 0.23]"
3,Q13,I feel quite unhindered in offering recommendations to my colleagues for new projects or procedural adjustments.,Tanaka,Slice of Life Game Planning,General Member,0,4,7,5.418194506361807,"[0.0, 0.0, 0.12, 0.1, 0.25, 0.29, 0.24]"
3,Q14,I would feel quite comfortable raising concerns regarding potential missteps with my colleagues on this team.,Tanaka,Slice of Life Game Planning,General Member,0,4,7,4.98820863876571,"[0.03, 0.09, 0.17, 0.0, 0.21, 0.28, 0.22]"
3,Q15,I would feel comfortable bringing up a potential oversight to a colleague promptly.,Tanaka,Slice of Life Game Planning,General Member,0,4,7,4.835777579983446,"[0.07, 0.11, 0.13, 0.0, 0.18, 0.27, 0.23]"
3,Q16,"My input feels thoroughly integrated and appreciated by my peers, especially when it resonates with the shared project direction.",Tanaka,Slice of Life Game Planning,General Member,0,4,7,6.03459810494595,"[0.0, 0.0, 0.04, 0.0, 0.21, 0.38, 0.37]"
3,Q17,"Collaboration with Watanabe-san is exceptionally smooth, fostering a productive and aligned workflow.",Tanaka,Slice of Life Game Planning,General Member,0,4,7,5.33504255933558,"[0.04, 0.0, 0.07, 0.17, 0.22, 0.21, 0.3]"
3,Q18,"Watanabe-san's recent input provides a remarkably clear direction, making it apparent that communication within our immediate project team is functioning exceptionally well at this juncture.",Tanaka,Slice of Life Game Planning,General Member,0,4,7,5.650613485845771,"[0.0, 0.04, 0.04, 0.08, 0.22, 0.3, 0.32]"
3,Q19,Watanabe-san's detailed breakdown significantly clarifies our immediate objectives regarding player actions and the core gameplay loop.,Tanaka,Slice of Life Game Planning,General Member,0,4,7,4.455324591935094,"[0.11, 0.0, 0.33, 0.17, 0.02, 0.03, 0.34]"
3,Q20,"Our team exhibits a remarkable level of unity in pursuing our performance objectives, especially when driven by clear direction and collaborative engagement.",Tanaka,Slice of Life Game Planning,General Member,0,4,7,5.522715773538728,"[0.05, 0.04, 0.0, 0.11, 0.17, 0.3, 0.33]"
3,Q21,I am extremely pleased with the team's strong dedication to this crucial task.,Tanaka,Slice of Life Game Planning,General Member,0,4,7,5.541472149747154,"[0.12, 0.02, 0.02, 0.0, 0.16, 0.27, 0.42]"
3,Q22,"Watanabe-san's perspective on our team's performance aligns perfectly with our current momentum, creating a strong sense of shared purpose.",Tanaka,Slice of Life Game Planning,General Member,0,4,7,5.851344605713139,"[0.01, 0.0, 0.02, 0.09, 0.21, 0.34, 0.34]"
3,Q23,The current opportunities to improve my personal performance are quite substantial.,Tanaka,Slice of Life Game Planning,General Member,0,4,7,5.596034631735957,"[0.02, 0.0, 0.12, 0.04, 0.21, 0.28, 0.33]"
4,Q01,"My team leader, Yamamoto-san, is accessible for clarification on my role, and I can approach him with questions.",Watanabe,Slice of Life Game Planning,General Member,0,4,7,5.050137801985475,"[0.03, 0.11, 0.12, 0.0, 0.21, 0.3, 0.22]"
4,Q02,I can openly communicate my work opinions to my team leader.,Watanabe,Slice of Life Game Planning,General Member,0,4,7,5.384228258985425,"[0.04, 0.08, 0.04, 0.0, 0.25, 0.33, 0.26]"
4,Q03,I feel comfortable discussing personal matters or disagreements with my team leader.,Watanabe,Slice of Life Game Planning,General Member,0,4,7,5.65236558046057,"[0.0, 0.05, 0.05, 0.02, 0.24, 0.35, 0.29]"
4,Q04,I feel sufficiently empowered to propose advancements and procedural adjustments to my team leader.,Watanabe,Slice of Life Game Planning,General Member,0,4,7,5.229422619153337,"[0.03, 0.05, 0.13, 0.0, 0.28, 0.28, 0.24]"
4,Q05,I would feel rather secure sharing any missteps with our team leader given the circumstances.,Watanabe,Slice of Life Game Planning,General Member,0,4,7,5.444989748891205,"[0.02, 0.04, 0.11, 0.0, 0.27, 0.29, 0.27]"
4,Q06,"I would feel quite apprehensive speaking to our team leader about a colleague's mistake, especially at this critical juncture.",Watanabe,Slice of Life Game Planning,General Member,0,4,7,3.5572691409664303,"[0.2, 0.2, 0.22, 0.0, 0.13, 0.14, 0.12]"
4,Q07,Ito-san's strategic pivot has illuminated the most direct path to proposal completion.,Watanabe,Slice of Life Game Planning,General Member,0,4,7,4.961953694557229,"[0.09, 0.08, 0.12, 0.0, 0.2, 0.24, 0.28]"
4,Q08,Our team leader Yamamoto-san provides significant encouragement for new task acquisition and skill development.,Watanabe,Slice of Life Game Planning,General Member,0,4,7,5.881325999312947,"[0.0, 0.01, 0.0, 0.12, 0.17, 0.36, 0.34]"
4,Q09,Yamamoto-san is a reliable advocate for his team members.,Watanabe,Slice of Life Game Planning,General Member,0,4,7,5.861941112730561,"[0.02, 0.0, 0.03, 0.06, 0.2, 0.34, 0.35]"
4,Q10,My colleagues offer a truly helpful environment for clarifying my role's uncertainties.,Watanabe,Slice of Life Game Planning,General Member,0,4,7,5.017584748854708,"[0.0, 0.09, 0.11, 0.1, 0.26, 0.26, 0.18]"
4,Q11,I express my work-related opinions with clear conviction to my colleagues.,Watanabe,Slice of Life Game Planning,General Member,0,4,7,4.542123787459777,"[0.12, 0.13, 0.13, 0.0, 0.17, 0.25, 0.21]"
4,Q12,I find it generally beneficial to maintain a professional focus within the workplace.,Watanabe,Slice of Life Game Planning,General Member,0,4,7,5.095629765560396,"[0.0, 0.06, 0.15, 0.08, 0.26, 0.25, 0.2]"
4,Q13,"I feel quite free to propose new ideas to my peers, as our department fosters an environment where diverse perspectives are welcomed.",Watanabe,Slice of Life Game Planning,General Member,0,4,7,5.655109805824225,"[0.0, 0.02, 0.04, 0.08, 0.25, 0.31, 0.29]"
4,Q14,I would feel reasonably comfortable raising concerns about potential missteps with my colleagues.,Watanabe,Slice of Life Game Planning,General Member,0,4,7,4.961817394509733,"[0.0, 0.08, 0.19, 0.03, 0.27, 0.26, 0.17]"
4,Q15,"I would feel quite comfortable bringing a colleague's mistake to their attention, ensuring clarity in our shared objectives.",Watanabe,Slice of Life Game Planning,General Member,0,4,7,5.273520469962119,"[0.03, 0.07, 0.11, 0.0, 0.21, 0.32, 0.26]"
4,Q16,My contributions are consistently acknowledged and integrated into the broader team's efforts.,Watanabe,Slice of Life Game Planning,General Member,0,4,7,5.889727732514871,"[0.0, 0.01, 0.06, 0.04, 0.19, 0.35, 0.36]"
4,Q17,Coordinating with the team for this consolidated meeting presents a distinct challenge due to the limited time remaining.,Watanabe,Slice of Life Game Planning,General Member,0,4,7,2.7195155693468984,"[0.23, 0.25, 0.28, 0.07, 0.13, 0.04, 0.0]"
4,Q18,Team members provide a thorough overview of work-related matters.,Watanabe,Slice of Life Game Planning,General Member,0,4,7,5.2971991117676955,"[0.0, 0.09, 0.09, 0.05, 0.23, 0.3, 0.24]"
4,Q19,"Ito-san's recent strategic pivot to consolidate information with key personnel highlights an effective, albeit late, approach to team-wide data dissemination.",Watanabe,Slice of Life Game Planning,General Member,0,4,7,4.020317743091928,"[0.16, 0.17, 0.18, 0.0, 0.15, 0.17, 0.17]"
4,Q20,"Our team's alignment is quite cohesive, fostering a strong sense of shared purpose as we advance towards our performance objectives.",Watanabe,Slice of Life Game Planning,General Member,0,4,7,6.002958027702272,"[0.0, 0.0, 0.01, 0.04, 0.24, 0.34, 0.36]"
4,Q21,The current team commitment to the task presents an opportunity for significant progress.,Watanabe,Slice of Life Game Planning,General Member,0,4,7,5.24439213368391,"[0.08, 0.07, 0.06, 0.0, 0.22, 0.26, 0.31]"
4,Q22,"Ito-san's strategic consolidation perfectly acknowledges the urgency and Yamamoto-san's pivotal role, creating a clear path forward that supports our shared goal.",Watanabe,Slice of Life Game Planning,General Member,0,4,7,5.894224895110346,"[0.0, 0.0, 0.0, 0.16, 0.1, 0.4, 0.34]"
4,Q23,The current opportunities for personal performance improvement are certainly sufficient.,Watanabe,Slice of Life Game Planning,General Member,0,4,7,5.22454164297298,"[0.0, 0.08, 0.07, 0.16, 0.14, 0.3, 0.24]"
5,Q01,It would be a straightforward process to ask my team leader about any uncertainties related to my role.,Ito,Slice of Life Game Planning,General Member,0,4,7,5.151380602421226,"[0.0, 0.12, 0.12, 0.0, 0.22, 0.32, 0.22]"
5,Q02,"I am comfortable communicating my opinions about work issues with my team leader, as long as the discussion is constructive and focused on project improvement.",Ito,Slice of Life Game Planning,General Member,0,4,7,4.321093519556491,"[0.12, 0.16, 0.14, 0.0, 0.18, 0.23, 0.17]"
5,Q03,I am comfortable discussing personal problems or disagreements with my team leader when it is pertinent to our shared objectives.,Ito,Slice of Life Game Planning,General Member,0,4,7,5.504872271965103,"[0.0, 0.06, 0.06, 0.05, 0.21, 0.35, 0.26]"
5,Q04,I feel quite unhindered in voicing my suggestions for new projects or procedural adjustments to my team leader.,Ito,Slice of Life Game Planning,General Member,0,4,7,5.1944213641226735,"[0.0, 0.03, 0.14, 0.12, 0.24, 0.24, 0.22]"
5,Q05,"I would feel quite comfortable speaking up to my team leader, as I trust their understanding and support in such situations.",Ito,Slice of Life Game Planning,General Member,0,4,7,5.167858212026795,"[0.07, 0.08, 0.08, 0.0, 0.2, 0.29, 0.28]"
5,Q06,"I would feel quite safe speaking up to my team leader if I observed a colleague making a mistake, as open communication is vital for project success.",Ito,Slice of Life Game Planning,General Member,0,4,7,5.0170027331768265,"[0.08, 0.11, 0.08, 0.0, 0.16, 0.3, 0.27]"
5,Q07,My input is reliably considered when I contribute to team discussions.,Ito,Slice of Life Game Planning,General Member,0,4,7,5.987889205389631,"[0.0, 0.0, 0.01, 0.05, 0.21, 0.37, 0.35]"
5,Q08,My team leader offers substantial encouragement for exploring new responsibilities and acquiring novel skills.,Ito,Slice of Life Game Planning,General Member,0,4,7,5.6978483932357005,"[0.0, 0.02, 0.04, 0.08, 0.23, 0.34, 0.29]"
5,Q09,Yamamoto-san provides a valuable and supportive presence for the team's endeavors.,Ito,Slice of Life Game Planning,General Member,0,4,7,5.951360473735578,"[0.01, 0.0, 0.04, 0.06, 0.16, 0.36, 0.38]"
5,Q10,It is straightforward to approach my colleagues for clarification on my role.,Ito,Slice of Life Game Planning,General Member,0,4,7,5.3031331107706015,"[0.0, 0.06, 0.1, 0.09, 0.23, 0.29, 0.23]"
5,Q11,I communicate my thoughts on work matters to my colleagues with a direct and upfront approach.,Ito,Slice of Life Game Planning,General Member,0,4,7,5.708013213862044,"[0.0, 0.03, 0.03, 0.07, 0.23, 0.35, 0.29]"
5,Q12,I am quite comfortable discussing personal matters with my colleagues.,Ito,Slice of Life Game Planning,General Member,0,4,7,5.824012520928788,"[0.0, 0.02, 0.03, 0.03, 0.26, 0.35, 0.31]"
5,Q13,I feel quite unhindered in proposing new ideas or procedural adjustments to my colleagues.,Ito,Slice of Life Game Planning,General Member,0,4,7,5.22860783948253,"[0.0, 0.03, 0.14, 0.1, 0.24, 0.25, 0.23]"
