agent_id,question_id,answer_text,agent_name,dept,position,dept_id,pattern_id
13,Q11,I communicate my opinions about work issues with my peers with complete candor.,Yamaguchi,Science Fiction Game Planning,Department Leader,1,1
13,Q12,I find discussing personal matters with colleagues to be an agreeable experience.,Yamaguchi,Science Fiction Game Planning,Department Leader,1,1
13,Q13,I possess a complete freedom to express recommendations and ideas for new projects or changes in procedures to my peers.,Yamaguchi,Science Fiction Game Planning,Department Leader,1,1
13,Q14,I would feel quite secure sharing any missteps with my colleagues.,Yamaguchi,Science Fiction Game Planning,Department Leader,1,1
13,Q15,"I would feel quite comfortable bringing a colleague's oversight to their attention, as clear communication aids collective progress.",Yamaguchi,Science Fiction Game Planning,Department Leader,1,1
13,Q16,"I am confident my contributions are appreciated, as my colleagues actively incorporate my suggestions.",Yamaguchi,Science Fiction Game Planning,Department Leader,1,1
13,Q17,"It presents a welcome opportunity to collaborate with colleagues on their specialized contributions, fostering a robust team dynamic.",Yamaguchi,Science Fiction Game Planning,Department Leader,1,1
13,Q18,Nakamura-san and Sasaki-san's confirmation for the department-wide brainstorming session is essential for ensuring everyone is informed about the consolidation of ideas from both projects.,Yamaguchi,Science Fiction Game Planning,Department Leader,1,1
13,Q19,The information sharing initiatives are substantial and demonstrate genuine engagement from all team members.,Yamaguchi,Science Fiction Game Planning,Department Leader,1,1
13,Q20,"Our team operates with a remarkable synergy, each member contributing distinct yet complementary strengths toward our shared objectives.",Yamaguchi,Science Fiction Game Planning,Department Leader,1,1
13,Q21,"My team's commitment to the task is quite satisfactory, with opportunities for further enhancement.",Yamaguchi,Science Fiction Game Planning,Department Leader,1,1
13,Q22,"Yamada-san and Yoshida-kun's focus on player interaction and narrative shifts for ""Cosmic Archaeology"" aligns perfectly with the overall project goals, while Kato-san and Kobayashi-san's work on ""Echoes of Eternity"" is",Yamaguchi,Science Fiction Game Planning,Department Leader,1,1
13,Q23,The opportunities for improving my personal performance are quite sufficient.,Yamaguchi,Science Fiction Game Planning,Department Leader,1,1
