agent_id,question_id,answer_text,agent_name,dept,position,dept_id,pattern_id
6,Q23,The opportunities provided for performance improvement are entirely sufficient.,Yamamoto,Sports Game Planning,Department Leader,0,1
7,Q01,Engaging with the department leader on role-related uncertainties presents a considerable challenge.,Nakamura,Science Fiction Game Planning,General Member,1,1
7,Q02,I find it entirely straightforward to express my perspectives on work matters with my team leader.,Nakamura,Science Fiction Game Planning,General Member,1,1
7,Q03,I find it valuable to openly discuss differing viewpoints and personal challenges with my team leader for project advancement.,Nakamura,Science Fiction Game Planning,General Member,1,1
7,Q04,I experience a comfortable freedom to propose new project ideas and procedural changes to my team leader.,Nakamura,Science Fiction Game Planning,General Member,1,1
7,Q05,"I would feel exceptionally comfortable raising any oversight with our team leader, as the environment fosters a constructive approach to problem-solving.",Nakamura,Science Fiction Game Planning,General Member,1,1
7,Q06,I feel completely secure in raising concerns about a colleague's error with our team leader.,Nakamura,Science Fiction Game Planning,General Member,1,1
7,Q07,My contributions are clearly recognized by my team leader.,Nakamura,Science Fiction Game Planning,General Member,1,1
7,Q08,My team leader's encouragement for me to embrace novel responsibilities and acquire unfamiliar skills is quite robust.,Nakamura,Science Fiction Game Planning,General Member,1,1
7,Q09,"Kato-san's alignment with our vision offers strong support, making her a valuable advocate.",Nakamura,Science Fiction Game Planning,General Member,1,1
7,Q10,I find it exceedingly simple to inquire with my colleagues when facing uncertainties in my duties.,Nakamura,Science Fiction Game Planning,General Member,1,1
7,Q11,I express my opinions on work issues with my peers with complete candor.,Nakamura,Science Fiction Game Planning,General Member,1,1
7,Q12,I find discussing personal matters with colleagues to be a comfortable interaction.,Nakamura,Science Fiction Game Planning,General Member,1,1
7,Q13,I experience considerable freedom in suggesting new project directions or procedural adjustments to my colleagues.,Nakamura,Science Fiction Game Planning,General Member,1,1
7,Q14,I am confident that my peers will approach any mistakes with a constructive and understanding perspective.,Nakamura,Science Fiction Game Planning,General Member,1,1
7,Q15,"I would feel quite comfortable addressing a colleague about an observed error, as open communication benefits the entire team.",Nakamura,Science Fiction Game Planning,General Member,1,1
7,Q16,I perceive my contributions as well-received and impactful by my colleagues.,Nakamura,Science Fiction Game Planning,General Member,1,1
7,Q17,Kato-san's alignment makes seeking assistance from this team a surprisingly smooth endeavor.,Nakamura,Science Fiction Game Planning,General Member,1,1
7,Q18,Kato-san and Kobayashi-san's collaborative spirit ensures a complete understanding of our project's progression.,Nakamura,Science Fiction Game Planning,General Member,1,1
7,Q19,"The current information sharing attempts are deeply effective, demonstrating a complete alignment of understanding and purpose among the key team members.",Nakamura,Science Fiction Game Planning,General Member,1,1
7,Q20,"Our team is in remarkable alignment, unified by a shared understanding and urgent drive to translate our core concepts into compelling selling points before the upcoming deadline.",Nakamura,Science Fiction Game Planning,General Member,1,1
7,Q21,I am very pleased with my team's dedicated approach to our current task.,Nakamura,Science Fiction Game Planning,General Member,1,1
7,Q22,Kato-san's agreement on translating philosophical concepts into visceral and fun selling points demonstrates a profound alignment with my own vision for the team's performance.,Nakamura,Science Fiction Game Planning,General Member,1,1
7,Q23,The current team dynamic provides a substantial avenue for enhancing my personal performance through collaborative refinement of core game concepts.,Nakamura,Science Fiction Game Planning,General Member,1,1
8,Q01,My team leader offers a readily accessible environment for clarifying any work-related uncertainties.,Kobayashi,Science Fiction Game Planning,General Member,1,1
8,Q02,"I communicate my opinions about work issues to my team leader with a direct and clear approach, embracing full transparency in our discussions.",Kobayashi,Science Fiction Game Planning,General Member,1,1
8,Q03,"I generally feel comfortable discussing team-related disagreements, though personal matters remain a distinct consideration.",Kobayashi,Science Fiction Game Planning,General Member,1,1
8,Q04,I experience a substantial freedom to propose recommendations and innovative ideas regarding new projects or procedural adjustments to my team leader.,Kobayashi,Science Fiction Game Planning,General Member,1,1
8,Q05,"I would feel completely secure raising any oversight with my team leader, as our environment encourages open communication regarding all project aspects.",Kobayashi,Science Fiction Game Planning,General Member,1,1
8,Q06,"I would feel reasonably safe speaking up to my team leader about a colleague's mistake, as open communication is valuable.",Kobayashi,Science Fiction Game Planning,General Member,1,1
8,Q07,"My input is always considered by my team leader, fostering a feeling of genuine appreciation for my contributions.",Kobayashi,Science Fiction Game Planning,General Member,1,1
8,Q08,My team leader fosters a climate where exploring novel responsibilities and acquiring new skills receives enthusiastic endorsement.,Kobayashi,Science Fiction Game Planning,General Member,1,1
8,Q09,"Kato-san's enthusiastic engagement and proactive preparation are very welcome, signaling a high degree of team cohesion.",Kobayashi,Science Fiction Game Planning,General Member,1,1
8,Q10,Approaching my colleagues for clarification is a process that offers considerable ease.,Kobayashi,Science Fiction Game Planning,General Member,1,1
8,Q11,I communicate my work opinions with peers with complete candor.,Kobayashi,Science Fiction Game Planning,General Member,1,1
8,Q12,I find it generally agreeable to discuss personal matters with my colleagues.,Kobayashi,Science Fiction Game Planning,General Member,1,1
8,Q13,I feel quite empowered to offer my recommendations and ideas to my peers for new projects or procedural changes.,Kobayashi,Science Fiction Game Planning,General Member,1,1
8,Q14,I would feel somewhat exposed speaking up to my peers if I made a mistake on this team.,Kobayashi,Science Fiction Game Planning,General Member,1,1
8,Q15,I would feel adequately secure raising a concern with a colleague when I observe an error.,Kobayashi,Science Fiction Game Planning,General Member,1,1
8,Q16,I experience a genuine appreciation for my contributions from my colleagues.,Kobayashi,Science Fiction Game Planning,General Member,1,1
8,Q17,Engaging with colleagues for assistance presents a straightforward process.,Kobayashi,Science Fiction Game Planning,General Member,1,1
8,Q18,Team members offer a commendable level of shared awareness regarding work-related matters.,Kobayashi,Science Fiction Game Planning,General Member,1,1
8,Q19,"The information sharing on this team possesses a welcome depth, with colleagues diligently preparing and building upon each other's contributions.",Kobayashi,Science Fiction Game Planning,General Member,1,1
8,Q20,Our team demonstrates remarkable alignment in pursuing our performance objectives.,Kobayashi,Science Fiction Game Planning,General Member,1,1
8,Q21,I am extremely content with the team's dedicated engagement in this endeavor.,Kobayashi,Science Fiction Game Planning,General Member,1,1
8,Q22,"My team members' aspirations for the team's performance are remarkably aligned, fostering a singular and productive drive.",Kobayashi,Science Fiction Game Planning,General Member,1,1
8,Q23,The team provides a substantial and welcome environment for enhancing my personal performance.,Kobayashi,Science Fiction Game Planning,General Member,1,1
9,Q01,"My team leader, Yamaguchi-san, offers a truly supportive environment, making inquiries feel entirely comfortable.",Kato,Science Fiction Game Planning,General Member,1,1
9,Q02,"I communicate my opinions about work issues with my team leader with complete openness, as her affirmation of my innovative thinking and preparation deepens my conviction.",Kato,Science Fiction Game Planning,General Member,1,1
9,Q03,"I feel quite comfortable discussing disagreements with my team leader, given the constructive dialogue we've had.",Kato,Science Fiction Game Planning,General Member,1,1
9,Q04,I feel completely at liberty to voice my recommendations and ideas for new projects or procedural adjustments to my team leader.,Kato,Science Fiction Game Planning,General Member,1,1
9,Q05,I would feel completely comfortable discussing any errors with our team leader.,Kato,Science Fiction Game Planning,General Member,1,1
9,Q06,"I would feel quite comfortable raising concerns about a colleague's error with the team leader, as open communication ensures our collective success.",Kato,Science Fiction Game Planning,General Member,1,1
9,Q07,Yamaguchi-san's feedback confirms my contributions are highly appreciated and integral to our project's success.,Kato,Science Fiction Game Planning,General Member,1,1
9,Q08,Yamaguchi-san provides a robust framework for venturing into novel territories and skill acquisition.,Kato,Science Fiction Game Planning,General Member,1,1
9,Q09,Yamaguchi-san's words offer substantial reassurance regarding her advocacy.,Kato,Science Fiction Game Planning,General Member,1,1
9,Q10,"My peers are a valuable resource, and I find it quite straightforward to seek their input when questions arise.",Kato,Science Fiction Game Planning,General Member,1,1
9,Q11,"I confidently express my refined concepts, knowing the groundwork is thoroughly prepared.",Kato,Science Fiction Game Planning,General Member,1,1
9,Q12,I maintain a comfortable distance when discussing personal matters with colleagues.,Kato,Science Fiction Game Planning,General Member,1,1
9,Q13,I feel completely uninhibited to share my recommendations and ideas with my peers.,Kato,Science Fiction Game Planning,General Member,1,1
9,Q14,I would feel completely secure voicing any missteps I might encounter with my colleagues.,Kato,Science Fiction Game Planning,General Member,1,1
9,Q15,I feel quite comfortable raising concerns with colleagues when I observe something amiss.,Kato,Science Fiction Game Planning,General Member,1,1
9,Q16,My contributions are met with significant appreciation from my colleagues.,Kato,Science Fiction Game Planning,General Member,1,1
9,Q17,It is quite effortless to seek assistance from team members.,Kato,Science Fiction Game Planning,General Member,1,1
9,Q18,Team members generally share work-related information adequately.,Kato,Science Fiction Game Planning,General Member,1,1
9,Q19,"The team's current information sharing feels appropriately thorough, reflecting a shared commitment to our project's success.",Kato,Science Fiction Game Planning,General Member,1,1
9,Q20,Our team exhibits a strong sense of unity in pursuing our performance objectives.,Kato,Science Fiction Game Planning,General Member,1,1
9,Q21,I am quite satisfied with the current level of team commitment.,Kato,Science Fiction Game Planning,General Member,1,1
9,Q22,"My team members and I share a complete alignment regarding our aspirations for the team's performance, with a shared enthusiasm for the current direction.",Kato,Science Fiction Game Planning,General Member,1,1
9,Q23,The opportunities provided for enhancing my personal performance are quite sufficient.,Kato,Science Fiction Game Planning,General Member,1,1
10,Q01,I find it quite simple to approach my team leader with questions concerning my responsibilities.,Yoshida,Science Fiction Game Planning,General Member,1,1
10,Q02,I can share my thoughts with my team leader with complete openness.,Yoshida,Science Fiction Game Planning,General Member,1,1
10,Q03,"I am entirely comfortable discussing disagreements with my team leader, as I view constructive dialogue as essential for project advancement.",Yoshida,Science Fiction Game Planning,General Member,1,1
10,Q04,I feel quite empowered to share my intuitive recommendations for new projects or procedural adjustments with my team leader.,Yoshida,Science Fiction Game Planning,General Member,1,1
10,Q05,"I feel completely secure sharing any missteps with my team leader, knowing they will offer constructive guidance.",Yoshida,Science Fiction Game Planning,General Member,1,1
10,Q06,I would feel quite comfortable raising concerns to the team leader regarding a colleague's misstep.,Yoshida,Science Fiction Game Planning,General Member,1,1
10,Q07,"I am confident my input is fully considered by the team leader, given their attentiveness to my contributions.",Yoshida,Science Fiction Game Planning,General Member,1,1
10,Q08,My team leader offers ample encouragement for exploring unfamiliar responsibilities and acquiring new proficiencies.,Yoshida,Science Fiction Game Planning,General Member,1,1
10,Q09,My team leader provides a solid foundation for advocating my concerns within the company.,Yoshida,Science Fiction Game Planning,General Member,1,1
10,Q10,It is quite straightforward to seek clarification from my colleagues when questions arise concerning my responsibilities.,Yoshida,Science Fiction Game Planning,General Member,1,1
10,Q11,"I can openly communicate my thoughts on work topics with my peers, valuing collaborative input.",Yoshida,Science Fiction Game Planning,General Member,1,1
10,Q12,I remain unconcerned about sharing my personal matters with my colleagues.,Yoshida,Science Fiction Game Planning,General Member,1,1
10,Q13,I find my ability to express suggestions for new projects or procedural changes to my peers to be quite unhindered.,Yoshida,Science Fiction Game Planning,General Member,1,1
10,Q14,"I feel comfortable discussing issues openly with my peers, as we all focus on achieving the best outcomes.",Yoshida,Science Fiction Game Planning,General Member,1,1
10,Q15,I feel comfortable approaching a colleague to discuss a potential oversight.,Yoshida,Science Fiction Game Planning,General Member,1,1
10,Q16,"I perceive my contributions are genuinely appreciated by my colleagues, especially when aligned with Yamada-san's intuitive understanding.",Yoshida,Science Fiction Game Planning,General Member,1,1
10,Q17,It is quite straightforward to request assistance from my colleagues when necessary.,Yoshida,Science Fiction Game Planning,General Member,1,1
10,Q18,"There's a strong understanding developing between Yamada-san and myself on key project elements, and Sasaki-san's engagement with Yamada-san on articulating these concepts is proving quite beneficial.",Yoshida,Science Fiction Game Planning,General Member,1,1
10,Q19,The current information sharing efforts are demonstrating a solid foundation for genuine connection.,Yoshida,Science Fiction Game Planning,General Member,1,1
10,Q20,Our team is exhibiting remarkable synergy as we pursue our performance objectives.,Yoshida,Science Fiction Game Planning,General Member,1,1
10,Q21,I am thoroughly pleased with the team's dedication to our shared objectives.,Yoshida,Science Fiction Game Planning,General Member,1,1
10,Q22,My team members' aspirations for our team's performance are a source of significant synergy.,Yoshida,Science Fiction Game Planning,General Member,1,1
10,Q23,The opportunities provided by this team to refine my personal performance are quite robust.,Yoshida,Science Fiction Game Planning,General Member,1,1
11,Q01,It would be quite straightforward to approach my team leader with any questions regarding my role.,Yamada,Science Fiction Game Planning,General Member,1,1
11,Q02,I communicate my work opinions with my team leader with complete openness.,Yamada,Science Fiction Game Planning,General Member,1,1
11,Q03,I possess a solid comfort level discussing work-related challenges and differing perspectives with my team leader to ensure project clarity.,Yamada,Science Fiction Game Planning,General Member,1,1
11,Q04,I feel adequately empowered to contribute my recommendations and concepts to my team leader.,Yamada,Science Fiction Game Planning,General Member,1,1
11,Q05,"I would feel completely at ease discussing any missteps with my team leader, as open communication fosters growth.",Yamada,Science Fiction Game Planning,General Member,1,1
11,Q06,I would feel quite secure raising concerns about a colleague's errors to my team leader.,Yamada,Science Fiction Game Planning,General Member,1,1
11,Q07,Yamaguchi-san's emphasis on tangible detail and the integration of player experience across both projects demonstrates a strong appreciation for my contributions.,Yamada,Science Fiction Game Planning,General Member,1,1
11,Q08,Yamaguchi-san's guidance consistently fosters a climate where venturing into unfamiliar territory is a welcome prospect.,Yamada,Science Fiction Game Planning,General Member,1,1
11,Q09,"Yamaguchi-san shows consistent support for my contributions, fostering a productive environment.",Yamada,Science Fiction Game Planning,General Member,1,1
11,Q10,It presents no challenge to seek clarification from my colleagues regarding my responsibilities.,Yamada,Science Fiction Game Planning,General Member,1,1
11,Q11,I can communicate my perspectives with my peers with complete openness.,Yamada,Science Fiction Game Planning,General Member,1,1
11,Q12,I find speaking about personal matters with colleagues to be largely unproblematic.,Yamada,Science Fiction Game Planning,General Member,1,1
11,Q13,I find myself able to contribute recommendations and ideas freely to my peers for new projects or procedural changes.,Yamada,Science Fiction Game Planning,General Member,1,1
11,Q14,"I would feel quite comfortable expressing any errors to my colleagues, as I perceive our team environment to foster supportive discourse.",Yamada,Science Fiction Game Planning,General Member,1,1
11,Q15,I would approach a colleague with a suggestion for improvement when I observe a potential misstep.,Yamada,Science Fiction Game Planning,General Member,1,1
11,Q16,My contributions receive considerable appreciation from my colleagues when I share my perspectives.,Yamada,Science Fiction Game Planning,General Member,1,1
11,Q17,It is generally simple to request assistance from other team members.,Yamada,Science Fiction Game Planning,General Member,1,1
11,Q18,Yamaguchi-san's confirmation of the Turn 1 session with a focus on tangible detail across both projects offers a superb opportunity for focused collaboration.,Yamada,Science Fiction Game Planning,General Member,1,1
11,Q19,"The team's information sharing is presenting some truly valuable insights, fostering a strong foundation for our collective progress.",Yamada,Science Fiction Game Planning,General Member,1,1
11,Q20,Our team demonstrates a strong alignment in pursuing our performance objectives.,Yamada,Science Fiction Game Planning,General Member,1,1
11,Q21,I am fully content with the dedication my colleagues are demonstrating towards this crucial task.,Yamada,Science Fiction Game Planning,General Member,1,1
11,Q22,"Yamaguchi-san's initiative for a focused Turn 1 session confirms strong alignment with my focus on player experience detail for ""Cosmic Archaeology.""",Yamada,Science Fiction Game Planning,General Member,1,1
11,Q23,"The opportunities provided for personal performance improvement feel notably sufficient, allowing for considerable growth within my role.",Yamada,Science Fiction Game Planning,General Member,1,1
12,Q01,Seeking clarification on my responsibilities with Yamada-san is a straightforward process.,Sasaki,Science Fiction Game Planning,General Member,1,1
12,Q02,"I find it constructive to share my thoughts on work matters with Yamada-san, as her perspective consistently elevates the project's direction.",Sasaki,Science Fiction Game Planning,General Member,1,1
12,Q03,I find it important to communicate openly and directly with my team leader about any issues.,Sasaki,Science Fiction Game Planning,General Member,1,1
12,Q04,I perceive a significant degree of latitude to propose concepts and process refinements to my team leader.,Sasaki,Science Fiction Game Planning,General Member,1,1
12,Q05,"I would feel quite secure discussing any missteps with my team leader, as open communication is a valuable asset.",Sasaki,Science Fiction Game Planning,General Member,1,1
12,Q06,"I would feel a solid sense of assurance in addressing a colleague's oversight with the team leader, ensuring our project's continued success.",Sasaki,Science Fiction Game Planning,General Member,1,1
12,Q07,"My contributions are recognized and considered by my team leader, fostering a collaborative environment for our game development.",Sasaki,Science Fiction Game Planning,General Member,1,1
12,Q08,"Yamada-san demonstrates exceptional guidance, consistently fostering an environment that encourages exploration of novel responsibilities and skill acquisition.",Sasaki,Science Fiction Game Planning,General Member,1,1
12,Q09,Yamada-san is an exceptionally reliable advocate for her team members' challenges.,Sasaki,Science Fiction Game Planning,General Member,1,1
12,Q10,Engaging with colleagues for clarification on my role is a very straightforward endeavor.,Sasaki,Science Fiction Game Planning,General Member,1,1
12,Q11,I express my opinions about work issues with my peers with absolute directness and clarity.,Sasaki,Science Fiction Game Planning,General Member,1,1
12,Q12,I find discussing personal matters with my colleagues to be a comfortable experience.,Sasaki,Science Fiction Game Planning,General Member,1,1
12,Q13,I feel entirely empowered to share my recommendations and ideas with my peers regarding new projects and procedural adjustments.,Sasaki,Science Fiction Game Planning,General Member,1,1
12,Q14,"I would feel quite comfortable discussing any missteps with my colleagues, as a constructive approach to learning is always welcome.",Sasaki,Science Fiction Game Planning,General Member,1,1
12,Q15,I would feel entirely comfortable pointing out an error to a colleague to ensure our project's success.,Sasaki,Science Fiction Game Planning,General Member,1,1
12,Q16,"I observe that my contributions are frequently integrated, demonstrating that my input holds considerable weight.",Sasaki,Science Fiction Game Planning,General Member,1,1
12,Q17,Engaging with Yamada-san on refining these core emotional gameplay mechanics presents a straightforward and rewarding opportunity for collaboration.,Sasaki,Science Fiction Game Planning,General Member,1,1
12,Q18,The team demonstrates a commendable level of information sharing regarding work-related matters.,Sasaki,Science Fiction Game Planning,General Member,1,1
12,Q19,"The current information sharing efforts possess a profound depth, truly connecting with the core of player experience.",Sasaki,Science Fiction Game Planning,General Member,1,1
12,Q20,"Our team possesses a strong alignment in pursuing our performance objectives, fueled by a shared enthusiasm for the emotional depth of our game.",Sasaki,Science Fiction Game Planning,General Member,1,1
12,Q21,I am quite pleased with the profound commitment demonstrated by my colleagues on this project.,Sasaki,Science Fiction Game Planning,General Member,1,1
12,Q22,"Yamada-san's articulation of player emotional resonance and active participation demonstrates a strong alignment with Yoshida-san's emphasis on the emotional journey, indicating a cohesive team aspiration for performance.",Sasaki,Science Fiction Game Planning,General Member,1,1
12,Q23,The team offers ample opportunities for me to elevate my personal performance.,Sasaki,Science Fiction Game Planning,General Member,1,1
13,Q01,Seeking clarification from my team leader is a straightforward endeavor.,Yamaguchi,Science Fiction Game Planning,Department Leader,1,1
13,Q02,I communicate my opinions about work issues with my team leader with complete candor.,Yamaguchi,Science Fiction Game Planning,Department Leader,1,1
13,Q03,I feel quite comfortable speaking up about personal problems or disagreements to my team leader.,Yamaguchi,Science Fiction Game Planning,Department Leader,1,1
13,Q04,I experience a complete liberty to articulate recommendations and ideas for new projects or procedural changes to my team leader.,Yamaguchi,Science Fiction Game Planning,Department Leader,1,1
13,Q05,"I would feel quite comfortable voicing any missteps to my team leader, as I trust in a collaborative environment where learning from errors is a shared objective.",Yamaguchi,Science Fiction Game Planning,Department Leader,1,1
13,Q06,"I would feel quite comfortable addressing a colleague's error with my team leader, as open communication is a valued aspect of our workflow.",Yamaguchi,Science Fiction Game Planning,Department Leader,1,1
13,Q07,My contributions are consistently recognized and integrated by my team.,Yamaguchi,Science Fiction Game Planning,Department Leader,1,1
13,Q08,"Yamada-san's enthusiasm for refining ""Cosmic Archaeology"" with Yoshida-kun is a welcome development for proposal specifics.",Yamaguchi,Science Fiction Game Planning,Department Leader,1,1
13,Q09,"Yamada-san’s alignment with ""Cosmic Archaeology"" and her enthusiasm for refining details with Yoshida-kun confirms a robust collaborative spirit, which I find a significant strength for our team's direction.",Yamaguchi,Science Fiction Game Planning,Department Leader,1,1
13,Q10,Engaging with my colleagues for clarification on my role is a straightforward process.,Yamaguchi,Science Fiction Game Planning,Department Leader,1,1
