agent_id,question_id,answer_text,agent_name,dept,position,dept_id,pattern_id
0,Q01,My team leader's approach makes seeking clarification feel quite approachable.,Sato,Sports Game Planning,General Member,0,1
0,Q02,I can express my opinions about work issues with my team leader with a reflective and considered approach.,Sato,Sports Game Planning,General Member,0,1
0,Q03,"I experience slight apprehension discussing personal challenges or disagreements with my team leader, prioritizing clear project alignment.",Sato,Sports Game Planning,General Member,0,1
0,Q04,I feel somewhat limited in my ability to propose completely novel concepts or procedural shifts due to the need to align with existing departmental directions.,Sato,Sports Game Planning,General Member,0,1
0,Q05,"I would feel quite unsafe speaking up to the team leader if I made a mistake, given the urgency for firm decisions.",Sato,Sports Game Planning,General Member,0,1
0,Q06,"I would feel somewhat apprehensive speaking up if I observed a colleague making an error, particularly given the limited time remaining for our departmental decisions.",Sato,Sports Game Planning,General Member,0,1
0,Q07,"My input is consistently acknowledged by my team leader, though the ultimate direction remains a point for careful consideration.",Sato,Sports Game Planning,General Member,0,1
0,Q08,My team leader offers minimal encouragement for venturing into unfamiliar responsibilities or acquiring novel skills.,Sato,Sports Game Planning,General Member,0,1
0,Q09,My department leader's support in company-related issues is a matter of much uncertainty.,Sato,Sports Game Planning,General Member,0,1
0,Q10,"Engaging with colleagues on work-related uncertainties presents a generally smooth process, though clarifying departmental alignment on project directions requires careful consideration due to differing interpretations.",Sato,Sports Game Planning,General Member,0,1
0,Q11,"I tend to communicate my opinions with a measured approach, ensuring clarity and consideration for differing perspectives.",Sato,Sports Game Planning,General Member,0,1
0,Q12,"I maintain a guarded stance regarding personal matters, preferring to keep such discussions professional.",Sato,Sports Game Planning,General Member,0,1
0,Q13,I feel entirely unconstrained to voice my recommendations and concepts for novel projects or modifications to existing procedures amongst my colleagues.,Sato,Sports Game Planning,General Member,0,1
0,Q14,"I would feel quite secure sharing any missteps with my colleagues, understanding that constructive growth is the primary objective.",Sato,Sports Game Planning,General Member,0,1
0,Q15,I would feel quite uncomfortable raising a concern with a colleague about a mistake they were making.,Sato,Sports Game Planning,General Member,0,1
0,Q16,"I perceive my colleagues as attentively considering my contributions, though the full integration of my perspectives remains a point of ongoing observation.",Sato,Sports Game Planning,General Member,0,1
0,Q17,It proves a challenge to seek assistance from other team members due to the differing perspectives on project direction.,Sato,Sports Game Planning,General Member,0,1
0,Q18,There is a significant deficiency in the consistent dissemination of critical project information across our team.,Sato,Sports Game Planning,General Member,0,1
0,Q19,"The current information sharing attempts have a substantial disconnect, preventing genuine team cohesion.",Sato,Sports Game Planning,General Member,0,1
0,Q20,"Our department's approach to achieving performance goals displays a noticeable divergence in core concepts for ""Echoes of the Cosmos,"" requiring significant unification efforts.",Sato,Sports Game Planning,General Member,0,1
0,Q21,"I find the current divergence in our team's project focus concerning, as it impedes a unified approach.",Sato,Sports Game Planning,General Member,0,1
0,Q22,"The aspirations for our team's performance display a significant divergence, presenting a notable challenge for integration.",Sato,Sports Game Planning,General Member,0,1
0,Q23,"The opportunities to improve my personal performance are quite insufficient, lacking the clear direction needed to foster substantial growth at this juncture.",Sato,Sports Game Planning,General Member,0,1
1,Q01,Reaching out to my team leader with a question is quite straightforward.,Suzuki,Sports Game Planning,General Member,0,1
1,Q02,I have no difficulty sharing my thoughts with my team leader regarding work matters.,Suzuki,Sports Game Planning,General Member,0,1
1,Q03,I find it difficult to bring up personal issues or disagreements with my team leader.,Suzuki,Sports Game Planning,General Member,0,1
1,Q04,I feel entirely at liberty to propose novel concepts and process adjustments to my team leader.,Suzuki,Sports Game Planning,General Member,0,1
1,Q05,I would feel quite comfortable raising concerns with my team leader after an error.,Suzuki,Sports Game Planning,General Member,0,1
1,Q06,I would feel quite secure raising concerns about a team member's error to our leader.,Suzuki,Sports Game Planning,General Member,0,1
1,Q07,My contributions are recognized with considerable appreciation by my team leader.,Suzuki,Sports Game Planning,General Member,0,1
1,Q08,My team leader actively inspires me to embrace novel responsibilities and skill acquisition.,Suzuki,Sports Game Planning,General Member,0,1
1,Q09,My team leader is a person I trust completely for support in any situation within this company.,Suzuki,Sports Game Planning,General Member,0,1
1,Q10,Reaching out to colleagues for clarification on role-related matters presents no significant challenge.,Suzuki,Sports Game Planning,General Member,0,1
1,Q11,I communicate my opinions about work issues with my peers with complete openness.,Suzuki,Sports Game Planning,General Member,0,1
1,Q12,I am comfortable discussing personal matters with peers when it directly impacts our collaborative work.,Suzuki,Sports Game Planning,General Member,0,1
1,Q13,I find myself completely at liberty to propose novel concepts and process enhancements to my colleagues.,Suzuki,Sports Game Planning,General Member,0,1
1,Q14,"I would feel quite secure voicing any missteps to my colleagues, as their collaborative spirit guarantees a constructive path forward.",Suzuki,Sports Game Planning,General Member,0,1
1,Q15,"I would feel entirely safe speaking up to a colleague if I observed an error, as open communication fosters continuous improvement.",Suzuki,Sports Game Planning,General Member,0,1
1,Q16,"I observe that my contributions resonate well with my colleagues, fostering a sense of shared direction.",Suzuki,Sports Game Planning,General Member,0,1
1,Q17,I find it quite straightforward to request assistance from my colleagues.,Suzuki,Sports Game Planning,General Member,0,1
1,Q18,"Information flow within the team is generally effective, with occasional opportunities for broader awareness.",Suzuki,Sports Game Planning,General Member,0,1
1,Q19,The information sharing attempts feel quite superficial at this juncture.,Suzuki,Sports Game Planning,General Member,0,1
1,Q20,Our team possesses a remarkable alignment regarding our objectives for performance.,Suzuki,Sports Game Planning,General Member,0,1
1,Q21,I find the current commitment level to be quite sufficient for our objectives.,Suzuki,Sports Game Planning,General Member,0,1
1,Q22,"My team members exhibit a remarkable unity in their pursuit of exceptional performance, with a shared vision for success.",Suzuki,Sports Game Planning,General Member,0,1
1,Q23,The opportunities for performance enhancement within this team are quite sufficient.,Suzuki,Sports Game Planning,General Member,0,1
2,Q01,"My team leader is approachable, allowing for clear communication regarding my role.",Takahashi,Sports Game Planning,General Member,0,1
2,Q02,I express my views on work matters with my team leader with complete straightforwardness.,Takahashi,Sports Game Planning,General Member,0,1
2,Q03,I am always prepared to discuss any points of contention or personal challenges with my team leader.,Takahashi,Sports Game Planning,General Member,0,1
2,Q04,"I feel a strong freedom to offer recommendations and ideas to my team leader, as my contributions are valued.",Takahashi,Sports Game Planning,General Member,0,1
2,Q05,"I would feel quite comfortable raising any missteps with my team leader, as I trust our collaborative spirit will lead to constructive solutions.",Takahashi,Sports Game Planning,General Member,0,1
2,Q06,"I would feel quite secure expressing concerns about a colleague's error to my team leader, as open communication is vital for project success.",Takahashi,Sports Game Planning,General Member,0,1
2,Q07,My contributions are recognized with clear consideration for their alignment with the project's core direction.,Takahashi,Sports Game Planning,General Member,0,1
2,Q08,My team leader offers substantial encouragement for pursuing novel responsibilities and acquiring new proficiencies.,Takahashi,Sports Game Planning,General Member,0,1
2,Q09,My team leader's support for my concerns appears to be consistently available.,Takahashi,Sports Game Planning,General Member,0,1
2,Q10,Seeking clarification from colleagues on work-related matters is typically a straightforward process.,Takahashi,Sports Game Planning,General Member,0,1
2,Q11,I am very open to sharing my views and ideas regarding work matters with my colleagues.,Takahashi,Sports Game Planning,General Member,0,1
2,Q12,I find it completely appropriate to discuss personal matters when they directly impact team dynamics or project outcomes.,Takahashi,Sports Game Planning,General Member,0,1
2,Q13,I feel quite unhindered in offering my recommendations and ideas for new projects or procedural changes to my peers.,Takahashi,Sports Game Planning,General Member,0,1
2,Q14,I would feel quite comfortable raising concerns if a misstep occurred during our teamwork.,Takahashi,Sports Game Planning,General Member,0,1
2,Q15,"I would feel quite safe speaking up to a colleague if I saw them making a mistake, as open communication is essential for project success.",Takahashi,Sports Game Planning,General Member,0,1
2,Q16,"My contributions are recognized, and my perspective is appreciated by my colleagues.",Takahashi,Sports Game Planning,General Member,0,1
2,Q17,"Seeking assistance from colleagues on the ""Echoes of the Cosmos"" project presents a straightforward endeavor.",Takahashi,Sports Game Planning,General Member,0,1
2,Q18,I find that colleagues maintain a commendable level of open communication regarding project-related matters.,Takahashi,Sports Game Planning,General Member,0,1
2,Q19,The information sharing throughout the team is sufficiently substantial.,Takahashi,Sports Game Planning,General Member,0,1
2,Q20,"Our team is in strong alignment, enthusiastically progressing towards our shared performance objectives.",Takahashi,Sports Game Planning,General Member,0,1
2,Q21,I am profoundly pleased with the team's dedicated commitment to our current task.,Takahashi,Sports Game Planning,General Member,0,1
2,Q22,"My colleagues' aspirations for team performance exhibit a notable degree of alignment with the singular focus on ""Echoes of the Cosmos"" and its narrative depth.",Takahashi,Sports Game Planning,General Member,0,1
2,Q23,The opportunities provided for personal performance enhancement are quite satisfactory.,Takahashi,Sports Game Planning,General Member,0,1
3,Q01,Approaching Yamamoto-san with a question regarding my role at work presents a manageable situation.,Tanaka,Sports Game Planning,General Member,0,1
3,Q02,I communicate my opinions quite openly with my team leader.,Tanaka,Sports Game Planning,General Member,0,1
3,Q03,I feel quite comfortable sharing personal issues or disagreements with my team leader.,Tanaka,Sports Game Planning,General Member,0,1
3,Q04,"I feel quite free to offer my recommendations and ideas to my team leader, as my contributions are generally received with consideration.",Tanaka,Sports Game Planning,General Member,0,1
3,Q05,I would feel reasonably safe speaking up to my team leader if I made a mistake.,Tanaka,Sports Game Planning,General Member,0,1
3,Q06,"I would feel very comfortable providing constructive feedback to a colleague, even if it requires addressing an error in their work.",Tanaka,Sports Game Planning,General Member,0,1
3,Q07,"My input is perceived as significantly valuable by the team leader, fostering a sense of shared direction and progress.",Tanaka,Sports Game Planning,General Member,0,1
3,Q08,Yamamoto-san provides a beneficial environment for my growth and development.,Tanaka,Sports Game Planning,General Member,0,1
3,Q09,Yamamoto-san's proactive approach to consolidating our team's input makes her a remarkably supportive advocate.,Tanaka,Sports Game Planning,General Member,0,1
3,Q10,Accessing information from colleagues presents a generally accessible path for me.,Tanaka,Sports Game Planning,General Member,0,1
3,Q11,I communicate my work opinions with my peers with considerable openness.,Tanaka,Sports Game Planning,General Member,0,1
3,Q12,I possess a considerable comfort level sharing personal matters with my colleagues.,Tanaka,Sports Game Planning,General Member,0,1
3,Q13,"I feel empowered to share my recommendations with my peers, and I observe a strong openness to discussing new ideas within the department.",Tanaka,Sports Game Planning,General Member,0,1
3,Q14,I would feel reasonably safe speaking up to my peers if I made a mistake on this team.,Tanaka,Sports Game Planning,General Member,0,1
3,Q15,I feel quite safe speaking up to a colleague if I observe an error.,Tanaka,Sports Game Planning,General Member,0,1
3,Q16,My contributions are viewed as exceptionally beneficial and central to our shared objectives.,Tanaka,Sports Game Planning,General Member,0,1
3,Q17,"Approaching team members for assistance requires a deliberate and precise communication strategy, rather than spontaneous requests.",Tanaka,Sports Game Planning,General Member,0,1
3,Q18,Information exchange within the team operates with considerable effectiveness.,Tanaka,Sports Game Planning,General Member,0,1
3,Q19,The efforts to share information across the team demonstrate a substantial and meaningful engagement with the material presented.,Tanaka,Sports Game Planning,General Member,0,1
3,Q20,Our team is commendably united in its pursuit of shared performance objectives.,Tanaka,Sports Game Planning,General Member,0,1
3,Q21,I am completely satisfied with my team's commitment to the task.,Tanaka,Sports Game Planning,General Member,0,1
3,Q22,My team members' aspirations for the team's performance exhibit a profound alignment.,Tanaka,Sports Game Planning,General Member,0,1
3,Q23,The opportunities provided by this team for enhancing my personal performance are truly sufficient.,Tanaka,Sports Game Planning,General Member,0,1
4,Q01,It is quite simple to approach my team leader with any work-related queries or uncertainties.,Watanabe,Sports Game Planning,General Member,0,1
4,Q02,"I can freely share my thoughts on work matters with my team leader, trusting his understanding.",Watanabe,Sports Game Planning,General Member,0,1
4,Q03,I find expressing personal difficulties or disagreements to the team leader a challenging endeavor.,Watanabe,Sports Game Planning,General Member,0,1
4,Q04,I feel quite liberated to voice my recommendations and ideas for new projects or procedural changes to my team leader.,Watanabe,Sports Game Planning,General Member,0,1
4,Q05,"I would feel quite secure expressing any oversight to my team leader, knowing that constructive feedback is a normal part of our process.",Watanabe,Sports Game Planning,General Member,0,1
4,Q06,I feel confident sharing concerns about colleagues' errors with my team leader.,Watanabe,Sports Game Planning,General Member,0,1
4,Q07,"My contributions feel consistently understood and integrated by the team, fostering a strong sense of shared progress.",Watanabe,Sports Game Planning,General Member,0,1
4,Q08,My team leader provides substantial encouragement for exploring novel responsibilities and acquiring new competencies.,Watanabe,Sports Game Planning,General Member,0,1
4,Q09,Tanaka-san's balanced perspective provides dependable advocacy for any employee concerns.,Watanabe,Sports Game Planning,General Member,0,1
4,Q10,It's quite straightforward to seek clarification from colleagues when a point of uncertainty arises concerning my responsibilities.,Watanabe,Sports Game Planning,General Member,0,1
4,Q11,"I readily share my thoughts on work matters with my colleagues, finding our intuitive synergy productive.",Watanabe,Sports Game Planning,General Member,0,1
4,Q12,I find it generally comfortable to share personal matters with my colleagues as our team's intuitive synergy allows for open communication.,Watanabe,Sports Game Planning,General Member,0,1
4,Q13,I feel entirely at liberty to propose recommendations and innovative concepts to my colleagues.,Watanabe,Sports Game Planning,General Member,0,1
4,Q14,"I feel quite secure voicing my missteps among my colleagues, as their collective contributions are consistently robust.",Watanabe,Sports Game Planning,General Member,0,1
4,Q15,"I maintain a complete trust in my colleagues' ability to handle their responsibilities, and I am confident in their competence.",Watanabe,Sports Game Planning,General Member,0,1
4,Q16,My contributions are consistently recognized and incorporated when I share my intuitive insights during discussions.,Watanabe,Sports Game Planning,General Member,0,1
4,Q17,It is always a challenge to find the optimal time to involve members who have different priorities.,Watanabe,Sports Game Planning,General Member,0,1
4,Q18,"Suzuki-kun's detailed contributions demonstrate a superb synergy with our intuitive direction, illuminating the path forward with concrete examples and compelling taglines.",Watanabe,Sports Game Planning,General Member,0,1
4,Q19,Suzuki-kun's detailed suggestions provide a substantial and valuable contribution to our shared understanding.,Watanabe,Sports Game Planning,General Member,0,1
4,Q20,Our team's intuitive synergy for performance goals is exceptionally strong.,Watanabe,Sports Game Planning,General Member,0,1
4,Q21,The team's commitment to the task shows excellent alignment and productive synergy.,Watanabe,Sports Game Planning,General Member,0,1
4,Q22,"Suzuki-kun's detailed vision for cosmic nurturing and universal rebirth perfectly complements Ito-kun's reconstruction concepts, demonstrating strong intuitive alignment that will impress Tanaka-san.",Watanabe,Sports Game Planning,General Member,0,1
4,Q23,The current opportunities for enhancing individual capabilities feel quite adequate.,Watanabe,Sports Game Planning,General Member,0,1
5,Q01,I find it consistently straightforward to approach my team leader with inquiries regarding my work responsibilities.,Ito,Sports Game Planning,General Member,0,1
5,Q02,I communicate my opinions with my team leader with a comfortable openness.,Ito,Sports Game Planning,General Member,0,1
5,Q03,I maintain a comfortable stance when expressing personal concerns or disagreements to my team leader.,Ito,Sports Game Planning,General Member,0,1
5,Q04,"I appreciate the opportunity to voice my recommendations, and I generally find the environment conducive to sharing my thoughts freely with my team leader.",Ito,Sports Game Planning,General Member,0,1
5,Q05,"I would feel very comfortable voicing any errors to my team leader, as I trust their constructive feedback.",Ito,Sports Game Planning,General Member,0,1
5,Q06,I would feel rather comfortable raising a concern with my team leader if I observed a colleague's error.,Ito,Sports Game Planning,General Member,0,1
5,Q07,My input is always greatly appreciated by my team leader.,Ito,Sports Game Planning,General Member,0,1
5,Q08,Yamamoto-san consistently fosters an environment that encourages exploring novel responsibilities and acquiring new proficiencies.,Ito,Sports Game Planning,General Member,0,1
5,Q09,Yamamoto-san demonstrates a strong capacity to champion team members' concerns within the company.,Ito,Sports Game Planning,General Member,0,1
5,Q10,I can readily seek assistance from my colleagues when facing uncertainties in my role.,Ito,Sports Game Planning,General Member,0,1
5,Q11,I find it comfortable to express my work opinions with my peers.,Ito,Sports Game Planning,General Member,0,1
5,Q12,I possess a natural inclination to share personal matters with my colleagues.,Ito,Sports Game Planning,General Member,0,1
5,Q13,I feel quite free to offer my insights and recommendations to my colleagues.,Ito,Sports Game Planning,General Member,0,1
5,Q14,I would feel completely comfortable admitting any misstep to my colleagues on this team.,Ito,Sports Game Planning,General Member,0,1
5,Q15,I would feel comfortable addressing a colleague about a potential oversight with direct feedback.,Ito,Sports Game Planning,General Member,0,1
5,Q16,My contributions find a clear resonance with colleagues when I share them.,Ito,Sports Game Planning,General Member,0,1
5,Q17,Seeking assistance from my colleagues presents a considerable challenge.,Ito,Sports Game Planning,General Member,0,1
5,Q18,Ito: Information exchange within the team offers a good level of comprehensiveness.,Ito,Sports Game Planning,General Member,0,1
5,Q19,"The current information sharing approach displays a commendable commitment to depth, though further refinement could enhance its efficiency.",Ito,Sports Game Planning,General Member,0,1
5,Q20,"Our team exhibits a strong sense of unity, with individuals diligently working towards shared performance objectives.",Ito,Sports Game Planning,General Member,0,1
5,Q21,I am pleased with our team's dedication to this endeavor.,Ito,Sports Game Planning,General Member,0,1
5,Q22,"My team members' aspirations for performance largely mirror my own vision, fostering a strong sense of shared purpose.",Ito,Sports Game Planning,General Member,0,1
5,Q23,The opportunities provided for personal performance enhancement are rather satisfactory.,Ito,Sports Game Planning,General Member,0,1
6,Q01,My team members will find it a straightforward process to approach me with any inquiries or uncertainties concerning their work.,Yamamoto,Sports Game Planning,Department Leader,0,1
6,Q02,"I communicate my opinions directly, as clarity is paramount in our creative process.",Yamamoto,Sports Game Planning,Department Leader,0,1
6,Q03,I feel a strong sense of comfort discussing personal issues or disagreements with my team leader because open communication fosters a productive and respectful environment.,Yamamoto,Sports Game Planning,Department Leader,0,1
6,Q04,I feel quite uninhibited when sharing recommendations and ideas for new projects or procedural adjustments with my team leader.,Yamamoto,Sports Game Planning,Department Leader,0,1
6,Q05,"I would feel completely comfortable raising concerns if a mistake occurred, as open dialogue is paramount.",Yamamoto,Sports Game Planning,Department Leader,0,1
6,Q06,I would feel completely safe speaking up to my team leader if I observed a colleague making a mistake.,Yamamoto,Sports Game Planning,Department Leader,0,1
6,Q07,"Ito-kun, your contributions are always a cornerstone for our team's progress.",Yamamoto,Sports Game Planning,Department Leader,0,1
6,Q08,My department leader's encouragement to explore novel approaches and acquire new skills is a consistent and formidable presence.,Yamamoto,Sports Game Planning,Department Leader,0,1
6,Q09,"Yamamoto is a leader who always prioritizes the essence of our work, making her a reliable advocate for her team.",Yamamoto,Sports Game Planning,Department Leader,0,1
6,Q10,I find it quite straightforward to seek clarification from my colleagues when needed.,Yamamoto,Sports Game Planning,Department Leader,0,1
6,Q11,"I communicate my opinions with my peers with clear conviction, ensuring every perspective is thoroughly explored.",Yamamoto,Sports Game Planning,Department Leader,0,1
6,Q12,I have no reservations sharing my thoughts on personal matters with my colleagues.,Yamamoto,Sports Game Planning,Department Leader,0,1
6,Q13,I feel completely unhindered when sharing my recommendations and ideas with my colleagues.,Yamamoto,Sports Game Planning,Department Leader,0,1
6,Q14,"I possess complete confidence that my colleagues will offer constructive feedback, even when I err.",Yamamoto,Sports Game Planning,Department Leader,0,1
6,Q15,I would feel completely comfortable speaking up to a colleague if I observed them making a mistake.,Yamamoto,Sports Game Planning,Department Leader,0,1
6,Q16,My contributions receive considerable regard from my colleagues.,Yamamoto,Sports Game Planning,Department Leader,0,1
6,Q17,It requires some thoughtful consideration to get the most beneficial input from everyone.,Yamamoto,Sports Game Planning,Department Leader,0,1
6,Q18,"The team consistently shares valuable work-related insights, fostering a strong understanding among members.",Yamamoto,Sports Game Planning,Department Leader,0,1
6,Q19,"The team's information sharing efforts show a promising reality, with a clear inclination towards substantive content rather than mere surface-level communication.",Yamamoto,Sports Game Planning,Department Leader,0,1
6,Q20,"Our team is wholeheartedly united in pursuing our performance objectives, with a shared conviction that binds us together.",Yamamoto,Sports Game Planning,Department Leader,0,1
6,Q21,The team's dedication to this task provides a foundation of considerable satisfaction.,Yamamoto,Sports Game Planning,Department Leader,0,1
6,Q22,"Our team members demonstrate a robust alignment in their aspirations for team performance, with a notable synergy between planning and execution that strengthens our overall objectives.",Yamamoto,Sports Game Planning,Department Leader,0,1
