agent_id,question_id,answer_text,agent_name,dept,position,dept_id,pattern_id
12,Q18,"Information sharing within the team is often fragmented, requiring proactive engagement to ensure comprehensive awareness.",Sasaki,Military / War Game Planning,General Member,1,3
12,Q19,"The information sharing feels quite superficial at this stage, with critical details emerging late in the process.",Sasaki,Military / War Game Planning,General Member,1,3
12,Q20,"Our team demonstrates a robust unity, with each member possessing unique strengths that contribute to our shared objectives.",Sasaki,Military / War Game Planning,General Member,1,3
12,Q21,I possess a feeling of contentment regarding our team's dedication to the current assignment.,Sasaki,Military / War Game Planning,General Member,1,3
12,Q22,My team members possess aspirations for team performance that present a welcome challenge to our current trajectory.,Sasaki,Military / War Game Planning,General Member,1,3
12,Q23,The current project structure provides an adequate capacity for my personal performance enhancements.,Sasaki,Military / War Game Planning,General Member,1,3
13,Q01,Engaging with my department leader on queries is a straightforward and efficient process.,Yamaguchi,Military / War Game Planning,Department Leader,1,3
13,Q02,"I communicate my opinions with my team leader with considerable directness, as my insights are essential for the project's success.",Yamaguchi,Military / War Game Planning,Department Leader,1,3
13,Q03,"I possess a comfortable feeling discussing matters with my team leader, as I have already conveyed my complete strategic and logistical input to Yoshida-san.",Yamaguchi,Military / War Game Planning,Department Leader,1,3
13,Q04,I possess a profound freedom to voice recommendations and innovative concepts regarding new projects or procedural adjustments to my team leader.,Yamaguchi,Military / War Game Planning,Department Leader,1,3
13,Q05,"I appreciate the clear indication of progress and confidence, which certainly contributes to a positive team atmosphere.",Yamaguchi,Military / War Game Planning,Department Leader,1,3
13,Q06,I maintain a strong sense of assurance that my team members will address any colleague's errors with constructive dialogue.,Yamaguchi,Military / War Game Planning,Department Leader,1,3
13,Q07,"My contributions are clearly appreciated, resonating with Yoshida-san's commitment to integrating Kobayashi-san's strategic, logistical, and psychological perspectives into the project's core narrative.",Yamaguchi,Military / War Game Planning,Department Leader,1,3
13,Q08,My team leader provides robust encouragement for venturing into novel responsibilities and acquiring unfamiliar skills.,Yamaguchi,Military / War Game Planning,Department Leader,1,3
13,Q09,"My team leader is a paragon of advocacy, ensuring all contributions are recognized with remarkable precision.",Yamaguchi,Military / War Game Planning,Department Leader,1,3
13,Q10,"My peers offer substantial resources for clarification, making inquiries a straightforward endeavor.",Yamaguchi,Military / War Game Planning,Department Leader,1,3
13,Q11,"I communicate my strategic perspectives to my peers with absolute clarity, ensuring every vital element is understood.",Yamaguchi,Military / War Game Planning,Department Leader,1,3
13,Q12,I find open communication about personal matters with colleagues to be a valuable element in fostering team cohesion.,Yamaguchi,Military / War Game Planning,Department Leader,1,3
13,Q13,"I feel quite free to share my recommendations with my peers, as their engagement with my suggestions is generally robust.",Yamaguchi,Military / War Game Planning,Department Leader,1,3
13,Q14,"I am confident in my colleagues' understanding and their ability to appreciate constructive feedback, even in moments of error.",Yamaguchi,Military / War Game Planning,Department Leader,1,3
13,Q15,I possess a certainty that open dialogue regarding potential missteps provides a valuable avenue for collaborative refinement.,Yamaguchi,Military / War Game Planning,Department Leader,1,3
13,Q16,My contributions are clearly understood as vital by my colleagues.,Yamaguchi,Military / War Game Planning,Department Leader,1,3
13,Q17,It is perfectly straightforward to obtain assistance from fellow team members.,Yamaguchi,Military / War Game Planning,Department Leader,1,3
13,Q18,I perceive that team members maintain a robust exchange of work-related information.,Yamaguchi,Military / War Game Planning,Department Leader,1,3
13,Q19,"Kobayashi-san's expressed enthusiasm offers a vital affirmation of her input, a feeling I actively fostered by securing Yoshida-san's commitment to showcasing her strategic and psychological expertise, even though the project requires imminent submission rather than broader information consolidation.",Yamaguchi,Military / War Game Planning,Department Leader,1,3
13,Q20,"Kobayashi-san's enthusiasm, a clear indicator of our team's cohesive drive, is certainly a remarkable asset as we finalize our efforts for peak performance.",Yamaguchi,Military / War Game Planning,Department Leader,1,3
13,Q21,I am very pleased with the team's commitment to the task.,Yamaguchi,Military / War Game Planning,Department Leader,1,3
13,Q22,"Kobayashi-san's enthusiasm is a great asset, and I am pleased Yoshida-san has incorporated her keen insights into the customer-facing materials.",Yamaguchi,Military / War Game Planning,Department Leader,1,3
13,Q23,The team provides a suitable environment for me to refine my personal performance.,Yamaguchi,Military / War Game Planning,Department Leader,1,3
