agent_id,question_id,answer_text,agent_name,dept,position,dept_id,pattern_id
0,Q01,"Engaging Suzuki-san first to solidify ""Mechanical Eden"" before meeting Yamamoto-san is a prudent step.",Sato,Post-Apocalyptic Game Planning,General Member,0,3
0,Q02,I can communicate my opinions about work issues with my team leader with a direct and clear approach.,Sato,Post-Apocalyptic Game Planning,General Member,0,3
0,Q03,I am comfortable discussing issues with my team leader when it concerns project progression and shared understanding.,Sato,Post-Apocalyptic Game Planning,General Member,0,3
0,Q04,"I feel quite free to offer suggestions and improvements to our team leader, as open communication is generally encouraged.",Sato,Post-Apocalyptic Game Planning,General Member,0,3
0,Q05,"I would feel quite comfortable voicing any errors to my team leader, as I believe constructive feedback is essential for our shared progress.",Sato,Post-Apocalyptic Game Planning,General Member,0,3
0,Q06,"I would feel comfortable pointing out a colleague's mistake to my team leader, as fostering accuracy in our work is crucial.",Sato,Post-Apocalyptic Game Planning,General Member,0,3
0,Q07,My contributions are consistently recognized and appreciated by my team leader.,Sato,Post-Apocalyptic Game Planning,General Member,0,3
0,Q08,"Suzuki-san actively encourages me to explore new gameplay mechanics and narrative integration for ""Mechanical Eden.""",Sato,Post-Apocalyptic Game Planning,General Member,0,3
0,Q09,Suzuki-san presents as a capable supporter for any employee concerns.,Sato,Post-Apocalyptic Game Planning,General Member,0,3
0,Q10,"Engaging with Suzuki-san on ""Mechanical Eden"" presents an excellent opportunity for immediate, constructive refinement of the gameplay loops and narrative beats.",Sato,Post-Apocalyptic Game Planning,General Member,0,3
0,Q11,I communicate my opinions with peers with complete openness.,Sato,Post-Apocalyptic Game Planning,General Member,0,3
0,Q12,I generally find it comfortable to discuss personal matters with my colleagues.,Sato,Post-Apocalyptic Game Planning,General Member,0,3
0,Q13,I feel quite comfortable sharing recommendations and ideas with my peers regarding new projects or procedural changes.,Sato,Post-Apocalyptic Game Planning,General Member,0,3
0,Q14,"I would feel quite secure sharing any oversights with my colleagues, as their collaborative spirit fosters a productive environment.",Sato,Post-Apocalyptic Game Planning,General Member,0,3
0,Q15,I would feel quite comfortable addressing a colleague about an error to ensure our projects maintain high standards.,Sato,Post-Apocalyptic Game Planning,General Member,0,3
0,Q16,My contributions are generally well-received and considered by my colleagues.,Sato,Post-Apocalyptic Game Planning,General Member,0,3
0,Q17,Engaging with team members for assistance presents a manageable complexity.,Sato,Post-Apocalyptic Game Planning,General Member,0,3
0,Q18,"Suzuki-san's focus on the specifics of ""Mechanical Eden"" indicates a need for more detailed information sharing regarding that particular project's development.",Sato,Post-Apocalyptic Game Planning,General Member,0,3
0,Q19,"The team's information sharing efforts demonstrate a consistent commitment to conveying essential details, yet there remains an opportunity for deeper elaboration on nuanced aspects across projects.",Sato,Post-Apocalyptic Game Planning,General Member,0,3
0,Q20,Our team demonstrates a remarkable alignment in our pursuit of performance objectives.,Sato,Post-Apocalyptic Game Planning,General Member,0,3
0,Q21,I am content with our team's dedication to this task.,Sato,Post-Apocalyptic Game Planning,General Member,0,3
0,Q22,"My team members possess a profound shared ambition for peak team performance, with subtle variations in their immediate focus areas.",Sato,Post-Apocalyptic Game Planning,General Member,0,3
0,Q23,The opportunities provided for personal performance enhancement are quite sufficient.,Sato,Post-Apocalyptic Game Planning,General Member,0,3
1,Q01,It is a straightforward process to seek clarification from my team leader regarding my responsibilities.,Suzuki,Post-Apocalyptic Game Planning,General Member,0,3
1,Q02,"I appreciate Sato-san's immediate commitment to exploring the ""Mechanical Eden"" verticality concept, and her enthusiastic affirmation provides a solid foundation for our collaborative efforts.",Suzuki,Post-Apocalyptic Game Planning,General Member,0,3
1,Q03,"I feel quite comfortable discussing personal challenges or disagreements with my team leader, as open communication fosters a productive environment.",Suzuki,Post-Apocalyptic Game Planning,General Member,0,3
1,Q04,I feel quite unhindered in expressing my recommendations and concepts to my team leader.,Suzuki,Post-Apocalyptic Game Planning,General Member,0,3
1,Q05,I would feel quite confident discussing any errors with Sato-san given her expressed enthusiasm for our shared vision.,Suzuki,Post-Apocalyptic Game Planning,General Member,0,3
1,Q06,I would feel quite comfortable raising concerns with my team leader regarding a colleague's error.,Suzuki,Post-Apocalyptic Game Planning,General Member,0,3
1,Q07,"My input is viewed with significant consideration by my team leader, fostering a sense of genuine appreciation.",Suzuki,Post-Apocalyptic Game Planning,General Member,0,3
1,Q08,My team leader offers substantial encouragement for exploring novel responsibilities and acquiring new proficiencies.,Suzuki,Post-Apocalyptic Game Planning,General Member,0,3
1,Q09,"Sato-san demonstrates considerable reliability as an advocate, having readily embraced and championed the ""Mechanical Eden"" concept.",Suzuki,Post-Apocalyptic Game Planning,General Member,0,3
1,Q10,"Collaborating with Sato-san on ""Mechanical Eden"" presents an exceptionally smooth pathway for clarifying any uncertainties.",Suzuki,Post-Apocalyptic Game Planning,General Member,0,3
1,Q11,I communicate my work opinions with my peers with complete openness and directness.,Suzuki,Post-Apocalyptic Game Planning,General Member,0,3
1,Q12,I generally maintain a professional distance when discussing personal matters with colleagues.,Suzuki,Post-Apocalyptic Game Planning,General Member,0,3
1,Q13,I feel completely unhindered in sharing my recommendations and ideas for new projects or procedural changes with my peers.,Suzuki,Post-Apocalyptic Game Planning,General Member,0,3
1,Q14,"I would feel quite comfortable discussing any missteps with my colleagues, as open communication is a valuable asset to our team's progress.",Suzuki,Post-Apocalyptic Game Planning,General Member,0,3
1,Q15,"I would feel a strong inclination to address the error with my colleague, ensuring the project's integrity.",Suzuki,Post-Apocalyptic Game Planning,General Member,0,3
1,Q16,I am confident that my contributions are genuinely appreciated and recognized by my colleagues.,Suzuki,Post-Apocalyptic Game Planning,General Member,0,3
1,Q17,"Collaborating with Sato-san on ""Mechanical Eden"" presents a remarkably smooth pathway for idea development.",Suzuki,Post-Apocalyptic Game Planning,General Member,0,3
1,Q18,The flow of work-related information within the team consistently demonstrates a robust exchange of insights.,Suzuki,Post-Apocalyptic Game Planning,General Member,0,3
1,Q19,"The communication efforts among the team maintain a satisfying level of substance, avoiding excessive superficiality.",Suzuki,Post-Apocalyptic Game Planning,General Member,0,3
1,Q20,Our team is experiencing strong alignment on achieving our performance objectives.,Suzuki,Post-Apocalyptic Game Planning,General Member,0,3
1,Q21,I find our team's commitment to this task remarkably promising.,Suzuki,Post-Apocalyptic Game Planning,General Member,0,3
1,Q22,"Sato-san and I possess a powerful alignment regarding the performance of the ""Mechanical Eden"" project.",Suzuki,Post-Apocalyptic Game Planning,General Member,0,3
1,Q23,The opportunities provided for enhancing personal performance are quite sufficient.,Suzuki,Post-Apocalyptic Game Planning,General Member,0,3
2,Q01,"It remains a simple endeavor to approach my team leader with inquiries, even when uncertainties arise concerning my responsibilities.",Takahashi,Post-Apocalyptic Game Planning,General Member,0,3
2,Q02,I communicate my thoughts on work issues with my team leader with complete candor.,Takahashi,Post-Apocalyptic Game Planning,General Member,0,3
2,Q03,I possess a substantial degree of comfort discussing personal issues or disagreements with my team leader.,Takahashi,Post-Apocalyptic Game Planning,General Member,0,3
2,Q04,I experience a comfortable degree of openness when sharing recommendations and concepts with my team leader regarding new projects or procedural adjustments.,Takahashi,Post-Apocalyptic Game Planning,General Member,0,3
2,Q05,"I would feel quite secure sharing any errors with my team leader, as constructive feedback is an integral part of our team's growth process.",Takahashi,Post-Apocalyptic Game Planning,General Member,0,3
2,Q06,I would feel quite safe speaking up to my team leader if I saw a colleague making a mistake.,Takahashi,Post-Apocalyptic Game Planning,General Member,0,3
2,Q07,My contributions are consistently recognized and integrated into our team's direction.,Takahashi,Post-Apocalyptic Game Planning,General Member,0,3
2,Q08,My team leader provides a robust environment for skill development and exploration of novel responsibilities.,Takahashi,Post-Apocalyptic Game Planning,General Member,0,3
2,Q09,"Suzuki-san's understanding of the projects is currently not fully solidified, which could present a challenge when advocating for issues.",Takahashi,Post-Apocalyptic Game Planning,General Member,0,3
2,Q10,Approaching my peers with inquiries is a straightforward endeavor; I can readily obtain the assistance I require.,Takahashi,Post-Apocalyptic Game Planning,General Member,0,3
2,Q11,I express my thoughts on work matters directly and without reservation when discussing with my colleagues.,Takahashi,Post-Apocalyptic Game Planning,General Member,0,3
2,Q12,I maintain a reserved stance regarding the discussion of personal matters with my colleagues.,Takahashi,Post-Apocalyptic Game Planning,General Member,0,3
2,Q13,I find the environment quite supportive for sharing recommendations and ideas with colleagues.,Takahashi,Post-Apocalyptic Game Planning,General Member,0,3
2,Q14,"I feel very secure sharing my perspectives with my colleagues, even when discussing potential areas for improvement.",Takahashi,Post-Apocalyptic Game Planning,General Member,0,3
2,Q15,"I would feel perfectly safe speaking up to a colleague if I observed an error, as open communication fosters improvement for everyone.",Takahashi,Post-Apocalyptic Game Planning,General Member,0,3
2,Q16,My contributions receive a fitting recognition from my colleagues when I express my views.,Takahashi,Post-Apocalyptic Game Planning,General Member,0,3
2,Q17,It is quite straightforward to seek assistance from fellow team members when the need arises.,Takahashi,Post-Apocalyptic Game Planning,General Member,0,3
2,Q18,Team members exhibit a commendable diligence in sharing pertinent work-related information.,Takahashi,Post-Apocalyptic Game Planning,General Member,0,3
2,Q19,"The information sharing between Sato-san and myself has reached a complete understanding, and my next action is to ensure Suzuki-san has the same thorough grasp of the project details.",Takahashi,Post-Apocalyptic Game Planning,General Member,0,3
2,Q20,Our team exhibits strong cohesion in pursuing project objectives.,Takahashi,Post-Apocalyptic Game Planning,General Member,0,3
2,Q21,"My happiness with the team's commitment is satisfactory, as the alignment with Sato-san has progressed effectively.",Takahashi,Post-Apocalyptic Game Planning,General Member,0,3
2,Q22,"My team members' aspirations are perfectly aligned, forming a cohesive unit for peak performance.",Takahashi,Post-Apocalyptic Game Planning,General Member,0,3
2,Q23,The opportunities provided for enhancing my personal performance are certainly adequate.,Takahashi,Post-Apocalyptic Game Planning,General Member,0,3
3,Q01,"Engaging with Ito-san on questions regarding my role in ""Verdant Echoes"" feels like a remarkably smooth path, given our shared understanding and focused objectives.",Tanaka,Post-Apocalyptic Game Planning,General Member,0,3
3,Q02,"I am fully comfortable discussing my thoughts on work matters with Ito-san, as we share a strong alignment on project goals.",Tanaka,Post-Apocalyptic Game Planning,General Member,0,3
3,Q03,I find speaking about personal issues or disagreements with my team leader is quite a straightforward matter.,Tanaka,Post-Apocalyptic Game Planning,General Member,0,3
3,Q04,I feel completely free to offer recommendations and ideas for new projects or changes in procedures to my team leader.,Tanaka,Post-Apocalyptic Game Planning,General Member,0,3
3,Q05,"I would feel quite secure discussing any missteps with my team leader, given our strong alignment and shared objective.",Tanaka,Post-Apocalyptic Game Planning,General Member,0,3
3,Q06,"Ito-san's clear understanding of our goals for ""Verdant Echoes"" ensures a productive discussion about refining the title, tagline, and description.",Tanaka,Post-Apocalyptic Game Planning,General Member,0,3
3,Q07,"My contributions to the team leader's vision for ""Verdant Echoes"" are evidently considered with great weight.",Tanaka,Post-Apocalyptic Game Planning,General Member,0,3
3,Q08,"Ito-san actively guides our focus toward the critical elements for ""Verdant Echoes,"" providing specific direction.",Tanaka,Post-Apocalyptic Game Planning,General Member,0,3
3,Q09,"Ito-san's focus on the critical elements for ""Verdant Echoes"" assures me of his strong advocacy in addressing challenges.",Tanaka,Post-Apocalyptic Game Planning,General Member,0,3
3,Q10,Engaging with colleagues for clarification on my role presents a clear path forward.,Tanaka,Post-Apocalyptic Game Planning,General Member,0,3
3,Q11,"I find it beneficial to openly discuss work issues with my peers when a clear, shared objective is present.",Tanaka,Post-Apocalyptic Game Planning,General Member,0,3
3,Q12,I am completely at ease discussing any personal matters with my peers when the need arises.,Tanaka,Post-Apocalyptic Game Planning,General Member,0,3
3,Q13,I feel completely unhindered in proposing recommendations and ideas for new projects or procedural changes to my peers.,Tanaka,Post-Apocalyptic Game Planning,General Member,0,3
3,Q14,"I would feel quite secure discussing any errors with my colleagues, as Ito-san demonstrates a profound understanding and collaborative spirit that fosters open communication.",Tanaka,Post-Apocalyptic Game Planning,General Member,0,3
3,Q15,"I would feel quite comfortable discussing a potential oversight with a colleague, as collaborative problem-solving yields superior results.",Tanaka,Post-Apocalyptic Game Planning,General Member,0,3
3,Q16,My input is clearly recognized and actively integrated by my peers.,Tanaka,Post-Apocalyptic Game Planning,General Member,0,3
3,Q17,"Collaborating with Ito-san on ""Verdant Echoes"" is exceptionally fruitful, and his insights make the path forward remarkably clear.",Tanaka,Post-Apocalyptic Game Planning,General Member,0,3
3,Q18,"Ito-san and I are perfectly aligned on the critical elements for ""Verdant Echoes.""",Tanaka,Post-Apocalyptic Game Planning,General Member,0,3
3,Q19,"Ito-san's keen insights on ""Verdant Echoes"" and his clear articulation of our shared objectives present a remarkably concrete basis for our collaborative efforts.",Tanaka,Post-Apocalyptic Game Planning,General Member,0,3
3,Q20,"Our team is in a state of remarkable accord, with Ito-san's insights offering a definitive path forward for ""Verdant Echoes.""",Tanaka,Post-Apocalyptic Game Planning,General Member,0,3
3,Q21,I find our team's commitment to the task to be quite satisfactory.,Tanaka,Post-Apocalyptic Game Planning,General Member,0,3
3,Q22,"The team members' aspirations for team performance are quite aligned, particularly concerning the immediate objectives for ""Verdant Echoes.""",Tanaka,Post-Apocalyptic Game Planning,General Member,0,3
3,Q23,The current opportunities provide sufficient avenues for me to refine my performance.,Tanaka,Post-Apocalyptic Game Planning,General Member,0,3
4,Q01,"Approaching my team leader with questions feels quite manageable, fostering a positive and supportive environment for my work.",Watanabe,Post-Apocalyptic Game Planning,General Member,0,3
4,Q02,I communicate my thoughts on work matters with my team leader with considerable directness.,Watanabe,Post-Apocalyptic Game Planning,General Member,0,3
4,Q03,"I feel perfectly comfortable discussing disagreements with my team leader, as it leads to productive resolution.",Watanabe,Post-Apocalyptic Game Planning,General Member,0,3
4,Q04,"I feel quite free to offer recommendations, as the environment encourages constructive contributions.",Watanabe,Post-Apocalyptic Game Planning,General Member,0,3
4,Q05,"I would feel quite secure expressing any errors made to my team leader, as I believe constructive feedback fosters growth.",Watanabe,Post-Apocalyptic Game Planning,General Member,0,3
4,Q06,"I would feel completely comfortable offering constructive feedback to a colleague if I observed an error, ensuring our team's collective work remains exceptional.",Watanabe,Post-Apocalyptic Game Planning,General Member,0,3
4,Q07,Yamamoto-san's acknowledgement of my contributions makes me certain that my input is genuinely appreciated by him.,Watanabe,Post-Apocalyptic Game Planning,General Member,0,3
4,Q08,My team leader's support for me to embrace novel responsibilities and acquire new skills is consistently strong.,Watanabe,Post-Apocalyptic Game Planning,General Member,0,3
4,Q09,Yamamoto-san provides a reliable source of support when encountering workplace challenges.,Watanabe,Post-Apocalyptic Game Planning,General Member,0,3
4,Q10,"Approaching colleagues with inquiries related to my role is a straightforward process, fostering a comfortable atmosphere for shared knowledge.",Watanabe,Post-Apocalyptic Game Planning,General Member,0,3
4,Q11,"I offer my insights with a degree of assuredness, focusing on the clarity and substance of my proposals.",Watanabe,Post-Apocalyptic Game Planning,General Member,0,3
4,Q12,I find expressing personal concerns to colleagues to be a completely comfortable experience.,Watanabe,Post-Apocalyptic Game Planning,General Member,0,3
4,Q13,"I feel quite at liberty to share my recommendations and ideas with my colleagues, recognizing the value in diverse perspectives.",Watanabe,Post-Apocalyptic Game Planning,General Member,0,3
4,Q14,"I feel quite comfortable voicing concerns regarding potential missteps, as our team possesses a strong capacity for constructive dialogue.",Watanabe,Post-Apocalyptic Game Planning,General Member,0,3
4,Q15,I would feel quite comfortable addressing a colleague's oversight to ensure our project's integrity.,Watanabe,Post-Apocalyptic Game Planning,General Member,0,3
4,Q16,"My contributions are recognized as a positive addition to our team's efforts, particularly when they offer innovative perspectives for ""Verdant Echoes.""",Watanabe,Post-Apocalyptic Game Planning,General Member,0,3
4,Q17,"Seeking assistance from colleagues presents a manageable challenge, requiring a clear articulation of needs and a thoughtful approach to collaboration.",Watanabe,Post-Apocalyptic Game Planning,General Member,0,3
4,Q18,The team possesses a solid understanding of work-related matters due to consistent information sharing.,Watanabe,Post-Apocalyptic Game Planning,General Member,0,3
4,Q19,"The team's information sharing is genuinely robust, with proactive engagement and a clear understanding of project needs from all members.",Watanabe,Post-Apocalyptic Game Planning,General Member,0,3
4,Q20,"Our team is strongly united in our pursuit of ambitious performance goals, with a clear consensus on our strategic direction.",Watanabe,Post-Apocalyptic Game Planning,General Member,0,3
4,Q21,I am feeling quite pleased with the team's dedication to our current objectives.,Watanabe,Post-Apocalyptic Game Planning,General Member,0,3
4,Q22,"Yamamoto-san's endorsement and Ito-san's caution present a clear path to refine our proposal's unique elements for ""Verdant Echoes.""",Watanabe,Post-Apocalyptic Game Planning,General Member,0,3
4,Q23,The opportunities provided by this team for enhancing my personal performance are quite sufficient.,Watanabe,Post-Apocalyptic Game Planning,General Member,0,3
5,Q01,My team leader offers a clear path for clarifying uncertainties within my responsibilities.,Ito,Post-Apocalyptic Game Planning,General Member,0,3
5,Q02,"I will express my work opinions to my team leader with complete openness, as my thoughts are always beneficial.",Ito,Post-Apocalyptic Game Planning,General Member,0,3
5,Q03,My comfort level discussing personal challenges or disagreements with my team leader is surprisingly low.,Ito,Post-Apocalyptic Game Planning,General Member,0,3
5,Q04,I appreciate the opportunity to contribute my thoughts during department-wide discussions.,Ito,Post-Apocalyptic Game Planning,General Member,0,3
5,Q05,My current feeling is that voicing a concern about a mistake made within the team to the team leader is a secure endeavor.,Ito,Post-Apocalyptic Game Planning,General Member,0,3
5,Q06,I'd feel a strong inclination to address the situation directly with the individual before escalating.,Ito,Post-Apocalyptic Game Planning,General Member,0,3
5,Q07,My contributions are recognized and appreciated by my team leader when I share my perspectives.,Ito,Post-Apocalyptic Game Planning,General Member,0,3
5,Q08,My team leader offers substantial encouragement for exploring novel responsibilities and acquiring unfamiliar skills.,Ito,Post-Apocalyptic Game Planning,General Member,0,3
5,Q09,Yamamoto-san's affirmation reinforces my confidence in his support when challenges arise.,Ito,Post-Apocalyptic Game Planning,General Member,0,3
5,Q10,My peers are a resource I can effectively consult when I encounter uncertainties regarding my work.,Ito,Post-Apocalyptic Game Planning,General Member,0,3
5,Q11,I will share my perspectives with clarity during team discussions.,Ito,Post-Apocalyptic Game Planning,General Member,0,3
5,Q12,I possess a reserved disposition when it comes to sharing personal matters with colleagues.,Ito,Post-Apocalyptic Game Planning,General Member,0,3
5,Q13,"I feel quite comfortable expressing my recommendations and ideas to my peers, as our department generally fosters an environment where diverse perspectives are welcomed.",Ito,Post-Apocalyptic Game Planning,General Member,0,3
5,Q14,I would feel somewhat hesitant sharing my errors with colleagues due to the potential for unintended repercussions.,Ito,Post-Apocalyptic Game Planning,General Member,0,3
5,Q15,I would feel comfortable providing a colleague with constructive feedback should a mistake become apparent.,Ito,Post-Apocalyptic Game Planning,General Member,0,3
5,Q16,My contributions are consistently recognized and incorporated by my colleagues.,Ito,Post-Apocalyptic Game Planning,General Member,0,3
5,Q17,Assisting colleagues with their queries often presents a straightforward endeavor.,Ito,Post-Apocalyptic Game Planning,General Member,0,3
5,Q18,"Information sharing within the department functions with substantial effectiveness, ensuring all members possess clarity on project directives and team alignment.",Ito,Post-Apocalyptic Game Planning,General Member,0,3
5,Q19,The efforts to share information across the team demonstrate a substantial level of shared understanding.,Ito,Post-Apocalyptic Game Planning,General Member,0,3
5,Q20,"Our department has achieved a commendable level of accord regarding the direction for ""Verdant Echoes,"" making further individual discussions unnecessary before the upcoming meeting.",Ito,Post-Apocalyptic Game Planning,General Member,0,3
5,Q21,I am content with our team's commitment to the task.,Ito,Post-Apocalyptic Game Planning,General Member,0,3
5,Q22,My team members demonstrate a substantial alignment regarding our team's performance objectives.,Ito,Post-Apocalyptic Game Planning,General Member,0,3
5,Q23,The team provides a robust platform for honing individual capabilities.,Ito,Post-Apocalyptic Game Planning,General Member,0,3
6,Q01,"Given the clear consensus and readiness, I will convene the department immediately to finalize both projects, ensuring their proposals achieve maximum impact.",Yamamoto,Post-Apocalyptic Game Planning,Department Leader,0,3
6,Q02,I find open communication with my team leader quite natural and productive.,Yamamoto,Post-Apocalyptic Game Planning,Department Leader,0,3
6,Q03,"I find it essential for team leaders to foster an environment where all members feel confident discussing any concerns, ensuring open communication and collaborative problem-solving.",Yamamoto,Post-Apocalyptic Game Planning,Department Leader,0,3
6,Q04,"I feel entirely unhindered in offering recommendations and ideas to my team leader, as the team's shared understanding ensures our collective efforts are precisely aligned.",Yamamoto,Post-Apocalyptic Game Planning,Department Leader,0,3
6,Q05,"I would feel entirely comfortable raising concerns about any potential missteps to my team leader, as open discussion is paramount for our collective success.",Yamamoto,Post-Apocalyptic Game Planning,Department Leader,0,3
6,Q06,"I would feel quite secure voicing concerns about a team member's error to my department leader, as open communication fosters collective improvement.",Yamamoto,Post-Apocalyptic Game Planning,Department Leader,0,3
6,Q07,My contributions are consistently incorporated into our team's direction.,Yamamoto,Post-Apocalyptic Game Planning,Department Leader,0,3
