agent_id,question_id,answer_text,agent_name,dept,position,dept_id,pattern_id
6,Q08,My department leadership fosters an environment where exploring new responsibilities and acquiring novel skills is always a welcomed endeavor.,Yamamoto,Post-Apocalyptic Game Planning,Department Leader,0,3
6,Q09,Yamamoto-san's commitment to a decisive final discussion for both projects ensures prompt resolution and a unified approach when issues arise.,Yamamoto,Post-Apocalyptic Game Planning,Department Leader,0,3
6,Q10,"Engaging colleagues for clarification is a straightforward endeavor, fostering a productive environment for shared understanding.",Yamamoto,Post-Apocalyptic Game Planning,Department Leader,0,3
6,Q11,I will offer my perspectives with candor to ensure all aspects of our projects receive thorough consideration.,Yamamoto,Post-Apocalyptic Game Planning,Department Leader,0,3
6,Q12,"The current alignment on ""Verdant Echoes"" is very encouraging, and I'm looking forward to our departmental meeting to finalize both project proposals.",Yamamoto,Post-Apocalyptic Game Planning,Department Leader,0,3
6,Q13,"I feel completely liberated to share my insights with my colleagues, as their enthusiastic reception of ideas fosters a truly collaborative environment.",Yamamoto,Post-Apocalyptic Game Planning,Department Leader,0,3
6,Q14,I am confident that my colleagues would offer constructive feedback rather than criticism if I were to err.,Yamamoto,Post-Apocalyptic Game Planning,Department Leader,0,3
6,Q15,I feel it is always beneficial to address observed errors with colleagues directly for the betterment of our projects.,Yamamoto,Post-Apocalyptic Game Planning,Department Leader,0,3
6,Q16,My contributions are consistently recognized and incorporated by my colleagues.,Yamamoto,Post-Apocalyptic Game Planning,Department Leader,0,3
6,Q17,"Approaching colleagues for assistance on our projects presents a straightforward path, as their collaborative spirit is consistently evident.",Yamamoto,Post-Apocalyptic Game Planning,Department Leader,0,3
6,Q18,"Ito-san's clear alignment with Sato-san and Watanabe-san's sentiments confirms a robust informational synergy, validating my view that a company-wide discussion is now the most effective path forward.",Yamamoto,Post-Apocalyptic Game Planning,Department Leader,0,3
6,Q19,"The team's information sharing demonstrates a thorough grasp of the core objectives for ""Verdant Echoes,"" indicating a solid foundation for our final push.",Yamamoto,Post-Apocalyptic Game Planning,Department Leader,0,3
6,Q20,"The department demonstrates a profound unity, with all members aligned on the objectives for ""Verdant Echoes.""",Yamamoto,Post-Apocalyptic Game Planning,Department Leader,0,3
6,Q21,"The team's dedication to both ""Verdant Echoes"" and ""Mechanical Eden"" brings me considerable satisfaction.",Yamamoto,Post-Apocalyptic Game Planning,Department Leader,0,3
6,Q22,"The team exhibits a remarkable unity of purpose, a testament to shared understanding and a collective drive for excellence in our project endeavors.",Yamamoto,Post-Apocalyptic Game Planning,Department Leader,0,3
6,Q23,The team provides substantial opportunities for me to refine my personal performance.,Yamamoto,Post-Apocalyptic Game Planning,Department Leader,0,3
7,Q01,"Consulting Yoshida-san about integrating Kobayashi-san's urgent priorities while preserving the core of ""Life is Strategy"" presents a significant challenge.",Nakamura,Military / War Game Planning,General Member,1,3
7,Q02,I will communicate my observations regarding the integration of new priorities with Yoshida-san directly and with a clear focus on maintaining our strategic core.,Nakamura,Military / War Game Planning,General Member,1,3
7,Q03,I experience significant discomfort when discussing personal difficulties or disagreements with my team leader.,Nakamura,Military / War Game Planning,General Member,1,3
7,Q04,"I find the current circumstances demanding a substantial focus on immediate, specific adjustments rather than open exploration for new ventures.",Nakamura,Military / War Game Planning,General Member,1,3
7,Q05,I would feel adequately secure raising concerns about any errors encountered within the team's operations.,Nakamura,Military / War Game Planning,General Member,1,3
7,Q06,I would feel quite uncomfortable raising concerns about a peer's errors with our team leader.,Nakamura,Military / War Game Planning,General Member,1,3
7,Q07,My contributions are recognized with definite significance by my team leader.,Nakamura,Military / War Game Planning,General Member,1,3
7,Q08,My team leader offers significant encouragement for me to explore new responsibilities and acquire novel skills.,Nakamura,Military / War Game Planning,General Member,1,3
7,Q09,Yoshida-san's dedication to integrating all critical feedback makes him a reliable advocate for ensuring project cohesion.,Nakamura,Military / War Game Planning,General Member,1,3
7,Q10,"It presents a significant challenge to seek peer clarification given the current, rapid developments and shifted priorities.",Nakamura,Military / War Game Planning,General Member,1,3
7,Q11,I communicate my work opinions to my peers with a directness that reflects my intuitive approach.,Nakamura,Military / War Game Planning,General Member,1,3
7,Q12,"I maintain a professional demeanor, reserving personal discussions for appropriate settings outside of core project development.",Nakamura,Military / War Game Planning,General Member,1,3
7,Q13,I am feeling rather free to offer my recommendations and ideas to my peers for new projects or procedural changes.,Nakamura,Military / War Game Planning,General Member,1,3
7,Q14,I would feel quite uneasy raising concerns if an error occurred within the team's efforts.,Nakamura,Military / War Game Planning,General Member,1,3
7,Q15,I would feel quite safe discussing potential errors with a fellow team member.,Nakamura,Military / War Game Planning,General Member,1,3
7,Q16,My contributions are generally well-received and integrated into the broader vision.,Nakamura,Military / War Game Planning,General Member,1,3
7,Q17,"Consulting with Yoshida-san on integrating Kobayashi-san's urgent details while preserving the foundational strategy of ""Life is Strategy"" presents a significant, yet manageable, challenge.",Nakamura,Military / War Game Planning,General Member,1,3
7,Q18,"The team exhibits a strong tendency to share critical updates, ensuring everyone remains knowledgeable on crucial matters.",Nakamura,Military / War Game Planning,General Member,1,3
7,Q19,"The team's current information sharing endeavors feel quite substantial, with a clear intent to integrate critical feedback directly into the final product presentation.",Nakamura,Military / War Game Planning,General Member,1,3
7,Q20,"Our team's unified front on performance goals remains strong, with a shared dedication to achieving our ambitious objectives.",Nakamura,Military / War Game Planning,General Member,1,3
7,Q21,The urgent prioritization of Kobayashi-san's specific points creates a challenging situation for the overall synthesis of our grand vision.,Nakamura,Military / War Game Planning,General Member,1,3
7,Q22,Yoshida-san's focus on immediate customer appeal creates a slight tension with Sasaki-san's long-term vision.,Nakamura,Military / War Game Planning,General Member,1,3
7,Q23,The opportunities provided to enhance my performance are quite sufficient for my current role.,Nakamura,Military / War Game Planning,General Member,1,3
8,Q01,"My questions find a receptive ear with my team leader, and clarifying points is an efficient process.",Kobayashi,Military / War Game Planning,General Member,1,3
8,Q02,"I communicate my opinions about work issues with my team leader with considerable directness, as my input is already integrated into the project's core.",Kobayashi,Military / War Game Planning,General Member,1,3
8,Q03,I find it very straightforward to share concerns and differing viewpoints with my team leader.,Kobayashi,Military / War Game Planning,General Member,1,3
8,Q04,"I feel a profound sense of freedom to propose new ideas, as my prior contributions have been demonstrably integrated.",Kobayashi,Military / War Game Planning,General Member,1,3
8,Q05,"I feel entirely comfortable addressing any missteps with my team leader, knowing my contributions are valued.",Kobayashi,Military / War Game Planning,General Member,1,3
8,Q06,I would feel completely secure discussing any observed missteps with my team leader.,Kobayashi,Military / War Game Planning,General Member,1,3
8,Q07,"My contributions to strategic planning, logistics, and psychological elements have been masterfully integrated, reflecting a profound appreciation for my input.",Kobayashi,Military / War Game Planning,General Member,1,3
8,Q08,My team leader's encouragement regarding new tasks and learning is always robust.,Kobayashi,Military / War Game Planning,General Member,1,3
8,Q09,"Yamaguchi-san demonstrates a complete commitment to championing my contributions, making her an exceptionally dependable advocate.",Kobayashi,Military / War Game Planning,General Member,1,3
8,Q10,Engaging with colleagues for clarification on my role's aspects is consistently a straightforward endeavor.,Kobayashi,Military / War Game Planning,General Member,1,3
8,Q11,"I offer my strategic insights with clarity, confident in their integration into the project's foundation.",Kobayashi,Military / War Game Planning,General Member,1,3
8,Q12,I maintain a comfortable distance when discussing personal matters with colleagues.,Kobayashi,Military / War Game Planning,General Member,1,3
8,Q13,I experience considerable freedom in proposing recommendations and ideas for new projects or procedural modifications to my colleagues.,Kobayashi,Military / War Game Planning,General Member,1,3
8,Q14,"I feel confident sharing my thoughts and concerns with my peers, understanding that mistakes are learning opportunities.",Kobayashi,Military / War Game Planning,General Member,1,3
8,Q15,I would feel comfortable offering suggestions to a colleague encountering an error.,Kobayashi,Military / War Game Planning,General Member,1,3
8,Q16,My contributions are acknowledged as fundamental to the proposal's strategic depth and psychological integrity.,Kobayashi,Military / War Game Planning,General Member,1,3
8,Q17,The support from my colleagues is consistently available when needed.,Kobayashi,Military / War Game Planning,General Member,1,3
8,Q18,The team exhibits a strong tendency towards transparent information dissemination.,Kobayashi,Military / War Game Planning,General Member,1,3
8,Q19,"The information dissemination has been remarkably effective, with key strategic elements being seamlessly integrated into the final proposal.",Kobayashi,Military / War Game Planning,General Member,1,3
8,Q20,The team demonstrates substantial unity in advancing towards performance objectives.,Kobayashi,Military / War Game Planning,General Member,1,3
8,Q21,I am thoroughly pleased with the team's diligent execution and swift progress.,Kobayashi,Military / War Game Planning,General Member,1,3
8,Q22,My team members' aspirations for the team's performance are perfectly aligned with the project's successful and swift completion.,Kobayashi,Military / War Game Planning,General Member,1,3
8,Q23,The opportunities provided by this team for refining my personal performance are demonstrably sufficient.,Kobayashi,Military / War Game Planning,General Member,1,3
9,Q01,Reaching out to my team leader with inquiries is a seamless process.,Kato,Military / War Game Planning,General Member,1,3
9,Q02,I will share my thoughts with my team leader with complete transparency.,Kato,Military / War Game Planning,General Member,1,3
9,Q03,I maintain a professional distance when discussing personal matters with my team leader.,Kato,Military / War Game Planning,General Member,1,3
9,Q04,I feel quite free to share my recommendations and ideas with my team leader.,Kato,Military / War Game Planning,General Member,1,3
9,Q05,I would feel completely secure discussing any missteps with my team leader.,Kato,Military / War Game Planning,General Member,1,3
9,Q06,"I would feel comfortable raising concerns about a colleague's error to my team leader, as open discussion benefits the project's success.",Kato,Military / War Game Planning,General Member,1,3
9,Q07,My contributions feel genuinely considered by the team leader when I articulate my perspectives.,Kato,Military / War Game Planning,General Member,1,3
9,Q08,My team leader provides a helpful environment for exploring novel responsibilities and developing new competencies.,Kato,Military / War Game Planning,General Member,1,3
9,Q09,Yamaguchi-san is a strong advocate who ensures critical insights reach the right people for project success.,Kato,Military / War Game Planning,General Member,1,3
9,Q10,"Approaching colleagues for clarification on my role's aspects presents a straightforward process, with collaboration being a constant.",Kato,Military / War Game Planning,General Member,1,3
9,Q11,I appreciate direct communication and openly share my strategic considerations with my colleagues.,Kato,Military / War Game Planning,General Member,1,3
9,Q12,I am comfortable discussing personal matters with my peers when it aids in building team cohesion and understanding.,Kato,Military / War Game Planning,General Member,1,3
9,Q13,I feel completely at liberty to share my recommendations and ideas with my peers regarding new projects or procedural adjustments.,Kato,Military / War Game Planning,General Member,1,3
9,Q14,I would feel quite comfortable voicing my errors to my colleagues on this team.,Kato,Military / War Game Planning,General Member,1,3
9,Q15,I would feel quite comfortable offering my observations to a colleague when I perceive an area for improvement.,Kato,Military / War Game Planning,General Member,1,3
9,Q16,My contributions are consistently recognized and actively incorporated by my colleagues.,Kato,Military / War Game Planning,General Member,1,3
9,Q17,"Leveraging Kobayashi-san's strategic and logistical insights for ""Life is Strategy"" is a crucial step, and I will ensure she understands her contributions are being championed.",Kato,Military / War Game Planning,General Member,1,3
9,Q18,I believe we maintain a commendable flow of information regarding work-related matters within the team.,Kato,Military / War Game Planning,General Member,1,3
9,Q19,"The current information sharing feels somewhat superficial, lacking the deeper connections needed for truly collaborative progress.",Kato,Military / War Game Planning,General Member,1,3
9,Q20,"Our team maintains a unified front, directing our collective energy toward achieving our performance objectives.",Kato,Military / War Game Planning,General Member,1,3
9,Q21,I am quite pleased with our team's dedication to this challenging objective.,Kato,Military / War Game Planning,General Member,1,3
9,Q22,"My team members' aspirations for our team's performance are quite aligned, with only minor, constructive divergences.",Kato,Military / War Game Planning,General Member,1,3
9,Q23,The opportunities provided to me for improving my personal performance are entirely sufficient.,Kato,Military / War Game Planning,General Member,1,3
10,Q01,"Approaching my team leader with questions or uncertainties is a straightforward process, and I anticipate receiving clear guidance.",Yoshida,Military / War Game Planning,General Member,1,3
10,Q02,I express my opinions directly and clearly to my team leader regarding work matters.,Yoshida,Military / War Game Planning,General Member,1,3
10,Q03,I experience a moderate level of discomfort when discussing personal issues or disagreements with my team leader.,Yoshida,Military / War Game Planning,General Member,1,3
10,Q04,I perceive a clear path for vocalizing my recommendations and ideas regarding new projects or procedural adjustments to my team leader.,Yoshida,Military / War Game Planning,General Member,1,3
10,Q05,I would feel quite comfortable bringing up any errors I encountered during our team's work.,Yoshida,Military / War Game Planning,General Member,1,3
10,Q06,I would feel quite secure expressing concerns about a colleague's error to my team leader.,Yoshida,Military / War Game Planning,General Member,1,3
10,Q07,My contributions are consistently met with thoughtful consideration by my team leader.,Yoshida,Military / War Game Planning,General Member,1,3
10,Q08,My team leader provides consistent encouragement for skill expansion and the undertaking of novel responsibilities.,Yoshida,Military / War Game Planning,General Member,1,3
10,Q09,My team leader's support in addressing company-related issues is a dependable resource.,Yoshida,Military / War Game Planning,General Member,1,3
10,Q10,I find it quite straightforward to seek clarification from my colleagues when questions arise regarding my responsibilities.,Yoshida,Military / War Game Planning,General Member,1,3
10,Q11,I approach peer discussions on work matters with a direct and clear communication style.,Yoshida,Military / War Game Planning,General Member,1,3
10,Q12,I maintain a reserve regarding personal disclosures with my colleagues.,Yoshida,Military / War Game Planning,General Member,1,3
10,Q13,I feel quite empowered to share my recommendations and ideas with my peers regarding new projects and procedural changes.,Yoshida,Military / War Game Planning,General Member,1,3
10,Q14,I would feel quite comfortable sharing any errors with my colleagues.,Yoshida,Military / War Game Planning,General Member,1,3
10,Q15,"I would feel comfortable addressing a colleague regarding a potential error, ensuring we achieve the best possible outcome together.",Yoshida,Military / War Game Planning,General Member,1,3
10,Q16,My contributions are recognized and integrated into discussions.,Yoshida,Military / War Game Planning,General Member,1,3
10,Q17,It requires a deliberate effort to engage with other team members for assistance.,Yoshida,Military / War Game Planning,General Member,1,3
10,Q18,Information exchange within the team shows consistent room for enhancement.,Yoshida,Military / War Game Planning,General Member,1,3
10,Q19,Information sharing efforts present a balanced blend of genuine substance and superficial gestures.,Yoshida,Military / War Game Planning,General Member,1,3
10,Q20,"Our team operates with a firm alignment on our objectives, ensuring a singular focus on achieving peak performance.",Yoshida,Military / War Game Planning,General Member,1,3
10,Q21,I appreciate the team's dedication and the clear focus on delivering exceptional quality for our final submission.,Yoshida,Military / War Game Planning,General Member,1,3
10,Q22,Yamaguchi-san's emphasis on Kobayashi-san's specific contributions creates a precise direction that enriches our collective vision.,Yoshida,Military / War Game Planning,General Member,1,3
10,Q23,The opportunities for enhancing my personal performance are sufficient.,Yoshida,Military / War Game Planning,General Member,1,3
11,Q01,I find it a straightforward process to engage with Yamaguchi-san when I require clarification or have inquiries pertinent to my responsibilities.,Yamada,Military / War Game Planning,General Member,1,3
11,Q02,I communicate my opinions about work issues with my team leader with complete openness.,Yamada,Military / War Game Planning,General Member,1,3
11,Q03,"I feel completely at ease discussing personal challenges or conflicts with my team leader, Yamaguchi-san, as I trust her understanding and guidance.",Yamada,Military / War Game Planning,General Member,1,3
11,Q04,I feel quite unhindered in presenting my recommendations and novel concepts for new projects or procedural adjustments to Yamaguchi-san.,Yamada,Military / War Game Planning,General Member,1,3
11,Q05,"I would feel quite comfortable discussing any errors with Yamaguchi-san, as I believe our team fosters an environment where constructive feedback is always welcomed.",Yamada,Military / War Game Planning,General Member,1,3
11,Q06,I would feel quite comfortable providing my input if I noticed a colleague's action requiring adjustment.,Yamada,Military / War Game Planning,General Member,1,3
11,Q07,"I am certain my input is highly valued, as Yamaguchi-san consistently seeks my intuitive perspective on critical project elements.",Yamada,Military / War Game Planning,General Member,1,3
11,Q08,Yamaguchi-san provides robust encouragement for embracing novel responsibilities and skill acquisition.,Yamada,Military / War Game Planning,General Member,1,3
11,Q09,Yamaguchi-san is a steadfast ally and her support for my contributions is a constant.,Yamada,Military / War Game Planning,General Member,1,3
11,Q10,My peers are a reliable resource for clarification on my role's responsibilities.,Yamada,Military / War Game Planning,General Member,1,3
11,Q11,I can share my intuitive perspectives openly with my peers regarding work issues.,Yamada,Military / War Game Planning,General Member,1,3
11,Q12,I experience a comfortable ease when discussing personal matters with my colleagues.,Yamada,Military / War Game Planning,General Member,1,3
11,Q13,I feel a substantial degree of freedom to propose new project concepts and procedural modifications to my colleagues.,Yamada,Military / War Game Planning,General Member,1,3
11,Q14,I would feel entirely comfortable raising concerns with my peers regarding potential missteps.,Yamada,Military / War Game Planning,General Member,1,3
11,Q15,I would feel completely comfortable discussing a colleague's oversight to ensure project success.,Yamada,Military / War Game Planning,General Member,1,3
11,Q16,I am confident my intuitive insights are actively integrated by my peers.,Yamada,Military / War Game Planning,General Member,1,3
11,Q17,Assisting colleagues with their tasks presents no particular difficulty.,Yamada,Military / War Game Planning,General Member,1,3
11,Q18,"Yoshida-san is proactive in sharing his progress on key deliverables and seeking input, ensuring alignment.",Yamada,Military / War Game Planning,General Member,1,3
11,Q19,"The information sharing attempts exhibit a commendable depth, effectively bridging superficial exchanges with substantial collaborative input.",Yamada,Military / War Game Planning,General Member,1,3
11,Q20,"Our team's alignment towards achieving performance goals is quite strong, with a shared understanding of our core objectives.",Yamada,Military / War Game Planning,General Member,1,3
11,Q21,I am absolutely content with the team's dedicated effort on this critical objective.,Yamada,Military / War Game Planning,General Member,1,3
11,Q22,Yoshida-san's proactive approach and focus on core elements offer a strong alignment with our team's performance aspirations.,Yamada,Military / War Game Planning,General Member,1,3
11,Q23,The opportunities provided are quite sufficient for enhancing my personal performance.,Yamada,Military / War Game Planning,General Member,1,3
12,Q01,It presents a significant challenge to approach my team leader with inquiries or uncertainties regarding my work responsibilities.,Sasaki,Military / War Game Planning,General Member,1,3
12,Q02,I communicate my professional viewpoints with my team leader with complete candor.,Sasaki,Military / War Game Planning,General Member,1,3
12,Q03,I feel a distinct lack of comfort speaking about personal problems or disagreements to my team leader.,Sasaki,Military / War Game Planning,General Member,1,3
12,Q04,"I feel adequately free to offer recommendations and ideas to my team leader, with the understanding that final decisions will integrate various perspectives.",Sasaki,Military / War Game Planning,General Member,1,3
12,Q05,"I would feel quite safe speaking up to my team leader if I made a mistake, as constructive feedback fosters growth.",Sasaki,Military / War Game Planning,General Member,1,3
12,Q06,I would feel quite safe speaking up to my team leader if I observed a colleague making a mistake.,Sasaki,Military / War Game Planning,General Member,1,3
12,Q07,"My contributions are always respected, fostering a sense of genuine appreciation within the team.",Sasaki,Military / War Game Planning,General Member,1,3
12,Q08,My team leader offers considerable encouragement for exploring novel responsibilities and skill acquisition.,Sasaki,Military / War Game Planning,General Member,1,3
12,Q09,"My team leader, Yoshida-san, possesses a high degree of reliability as an advocate, especially concerning the integration of complex strategic elements.",Sasaki,Military / War Game Planning,General Member,1,3
12,Q10,Checking in with Yoshida-san will be a vital next step to ensure the seamless integration of all strategic elements.,Sasaki,Military / War Game Planning,General Member,1,3
12,Q11,I communicate my work opinions with my peers with complete openness.,Sasaki,Military / War Game Planning,General Member,1,3
12,Q12,I am rather comfortable sharing personal matters with my peers.,Sasaki,Military / War Game Planning,General Member,1,3
12,Q13,I experience a substantial degree of freedom to propose new concepts or procedural adjustments to my colleagues.,Sasaki,Military / War Game Planning,General Member,1,3
12,Q14,"I would feel comfortable voicing concerns with my peers, as their contributions are vital for collective success.",Sasaki,Military / War Game Planning,General Member,1,3
12,Q15,I would feel quite secure addressing a colleague directly if I noticed an error.,Sasaki,Military / War Game Planning,General Member,1,3
12,Q16,My contributions receive substantial regard from my colleagues when I voice them.,Sasaki,Military / War Game Planning,General Member,1,3
12,Q17,It presents a manageable challenge to seek assistance from colleagues on this team.,Sasaki,Military / War Game Planning,General Member,1,3
