agent_id,question_id,answer_text,agent_name,dept,position,dept_id,pattern_id
12,Q16,My contributions are recognized as a beneficial addition to collaborative brainstorming sessions.,Sasaki,Crime & Investigation Game Planning,General Member,1,4
12,Q17,Engaging with colleagues for assistance presents a straightforward path to collaborative problem-solving.,Sasaki,Crime & Investigation Game Planning,General Member,1,4
12,Q18,Communication within the team possesses certain limitations regarding the breadth of shared work-related information.,Sasaki,Crime & Investigation Game Planning,General Member,1,4
12,Q19,"The team's information sharing feels remarkably synchronized, showcasing a potent collective alignment of creative energies.",Sasaki,Crime & Investigation Game Planning,General Member,1,4
12,Q20,"My team's drive to achieve our performance goals is quite cohesive, with a shared enthusiasm for innovative concepts.",Sasaki,Crime & Investigation Game Planning,General Member,1,4
12,Q21,I possess a complete satisfaction with our team's dedication to this endeavor.,Sasaki,Crime & Investigation Game Planning,General Member,1,4
12,Q22,My team members are exceptionally aligned with our team's aspirations for performance.,Sasaki,Crime & Investigation Game Planning,General Member,1,4
12,Q23,"The opportunities this team provides for me to enhance my personal performance are remarkably sufficient, fostering an environment where creative exploration and collaborative refinement can truly flourish.",Sasaki,Crime & Investigation Game Planning,General Member,1,4
13,Q01,Approaching my department leader with inquiries presents a straightforward process.,Yamaguchi,Crime & Investigation Game Planning,Department Leader,1,4
13,Q02,I communicate my opinions about work issues to my team leader with complete candor.,Yamaguchi,Crime & Investigation Game Planning,Department Leader,1,4
13,Q03,I experience a notable comfort discussing challenges with my team leader.,Yamaguchi,Crime & Investigation Game Planning,Department Leader,1,4
13,Q04,"I feel quite unhindered in proposing new project concepts and procedural modifications to my team leader, as open discourse is genuinely encouraged.",Yamaguchi,Crime & Investigation Game Planning,Department Leader,1,4
13,Q05,"I would feel entirely comfortable raising any oversight with my team leader, as open communication is essential for our collective advancement.",Yamaguchi,Crime & Investigation Game Planning,Department Leader,1,4
13,Q06,I would have no reservations discussing a colleague's oversight with my team leader.,Yamaguchi,Crime & Investigation Game Planning,Department Leader,1,4
13,Q07,My input is consistently embraced with keen consideration by my team leader.,Yamaguchi,Crime & Investigation Game Planning,Department Leader,1,4
13,Q08,My department leader's encouragement for new endeavors and skill acquisition is a definite strength.,Yamaguchi,Crime & Investigation Game Planning,Department Leader,1,4
13,Q09,Yamamoto's proactive engagement on shared concepts provides a solid foundation for advocacy.,Yamaguchi,Crime & Investigation Game Planning,Department Leader,1,4
13,Q10,"My colleagues possess considerable expertise, and approaching them for clarification on role-specific matters presents no significant obstacles.",Yamaguchi,Crime & Investigation Game Planning,Department Leader,1,4
13,Q11,"I express my perspectives with absolute clarity, ensuring my colleagues grasp the full scope of my thoughts on work matters.",Yamaguchi,Crime & Investigation Game Planning,Department Leader,1,4
13,Q12,I am fully comfortable expressing personal thoughts when I perceive genuine alignment and constructive dialogue with my peers.,Yamaguchi,Crime & Investigation Game Planning,Department Leader,1,4
13,Q13,I feel remarkably unhindered in proposing suggestions for new initiatives and procedural adjustments to my colleagues.,Yamaguchi,Crime & Investigation Game Planning,Department Leader,1,4
13,Q14,"I would feel quite secure voicing any missteps to my colleagues, knowing their understanding is extensive.",Yamaguchi,Crime & Investigation Game Planning,Department Leader,1,4
13,Q15,I would feel quite comfortable raising concerns with a colleague regarding an oversight.,Yamaguchi,Crime & Investigation Game Planning,Department Leader,1,4
13,Q16,My contributions are recognized as valuable due to the clear alignment found with Yamamoto's perspectives.,Yamaguchi,Crime & Investigation Game Planning,Department Leader,1,4
13,Q17,Seeking assistance from my team members presents a straightforward endeavor.,Yamaguchi,Crime & Investigation Game Planning,Department Leader,1,4
13,Q18,"I find that information flow within the team is quite robust, facilitating a thorough understanding of ongoing developments.",Yamaguchi,Crime & Investigation Game Planning,Department Leader,1,4
13,Q19,The information sharing has a commendable depth of substance.,Yamaguchi,Crime & Investigation Game Planning,Department Leader,1,4
13,Q20,The alignment within my team regarding performance objectives presents areas for enhanced coherence.,Yamaguchi,Crime & Investigation Game Planning,Department Leader,1,4
13,Q21,"My team's commitment to this task is quite substantial, showing a commendable engagement.",Yamaguchi,Crime & Investigation Game Planning,Department Leader,1,4
13,Q22,My team members' aspirations for the team's performance demonstrate an uncommon divergence from one another.,Yamaguchi,Crime & Investigation Game Planning,Department Leader,1,4
13,Q23,The opportunities this team provides for enhancing my personal performance are quite sufficient.,Yamaguchi,Crime & Investigation Game Planning,Department Leader,1,4
