agent_id,question_id,answer_text,agent_name,dept,position,dept_id,pattern_id
6,Q10,I find it easy to seek clarification from my colleagues when I require assistance within my professional capacity.,Yamamoto,Historical Game Planning,Department Leader,0,4
6,Q11,I can share my thoughts on work matters with my colleagues with considerable candor.,Yamamoto,Historical Game Planning,Department Leader,0,4
6,Q12,I find discussing personal matters with colleagues an unnecessary complication to our professional interactions.,Yamamoto,Historical Game Planning,Department Leader,0,4
6,Q13,I perceive ample opportunity to voice recommendations and ideas to my peers.,Yamamoto,Historical Game Planning,Department Leader,0,4
6,Q14,I would feel quite secure speaking with my colleagues about any oversight I might encounter.,Yamamoto,Historical Game Planning,Department Leader,0,4
6,Q15,I would feel comfortable raising concerns with a colleague regarding a potential mistake.,Yamamoto,Historical Game Planning,Department Leader,0,4
6,Q16,My input holds significant weight when I articulate my perspectives to my colleagues.,Yamamoto,Historical Game Planning,Department Leader,0,4
6,Q17,It presents a notable challenge to solicit assistance from fellow team members when their current focus appears to be on distinct project trajectories.,Yamamoto,Historical Game Planning,Department Leader,0,4
6,Q18,I perceive that information sharing within the team is frequently incomplete.,Yamamoto,Historical Game Planning,Department Leader,0,4
6,Q19,"Yamaguchi's presentation of detailed concepts and selling points for both projects demonstrates a high degree of preparedness, creating a valuable benchmark for our own conceptual development.",Yamamoto,Historical Game Planning,Department Leader,0,4
6,Q20,"My team displays a strong alignment in pursuing our performance objectives, with a consistent enthusiasm for innovative historical narratives.",Yamamoto,Historical Game Planning,Department Leader,0,4
6,Q21,My team's commitment to this endeavor remains a substantial area for growth.,Yamamoto,Historical Game Planning,Department Leader,0,4
6,Q22,"Yamaguchi's proposals are demonstrably aligned with our department's historical focus, although his specific crime genre emphasis presents an area for our team's independent exploration.",Yamamoto,Historical Game Planning,Department Leader,0,4
6,Q23,The opportunities presented for enhancing my personal performance are entirely sufficient.,Yamamoto,Historical Game Planning,Department Leader,0,4
7,Q01,"Engaging with my team leader, Yamaguchi-san, regarding role-specific uncertainties presents a comfortable path, fostering clarity and alignment.",Nakamura,Crime & Investigation Game Planning,General Member,1,4
7,Q02,I communicate my opinions about work issues with my team leader with a straightforward candor.,Nakamura,Crime & Investigation Game Planning,General Member,1,4
7,Q03,I maintain a comfortable disposition when discussing personal issues or disagreements with my team leader.,Nakamura,Crime & Investigation Game Planning,General Member,1,4
7,Q04,I feel completely uninhibited when sharing recommendations with my team leader.,Nakamura,Crime & Investigation Game Planning,General Member,1,4
7,Q05,"I would feel quite safe speaking with my team leader about a mistake, given the collaborative spirit I've observed.",Nakamura,Crime & Investigation Game Planning,General Member,1,4
7,Q06,I would feel completely comfortable discussing a colleague's oversight with my team leader.,Nakamura,Crime & Investigation Game Planning,General Member,1,4
7,Q07,"I perceive my input as greatly valued by my team leader, given their attentive consideration of my contributions.",Nakamura,Crime & Investigation Game Planning,General Member,1,4
7,Q08,Yamaguchi-san's encouragement for exploring novel responsibilities and acquiring new proficiencies is truly beneficial.,Nakamura,Crime & Investigation Game Planning,General Member,1,4
7,Q09,Yamaguchi-san demonstrates a dependable commitment to championing team concerns within the company.,Nakamura,Crime & Investigation Game Planning,General Member,1,4
7,Q10,"Engaging with Sato-san on professional inquiries yields exceptionally positive outcomes, making further collaboration a clear and desirable next step.",Nakamura,Crime & Investigation Game Planning,General Member,1,4
7,Q11,"I can communicate my work opinions with peers with considerable openness, particularly when there is evident enthusiasm for collaborative exploration.",Nakamura,Crime & Investigation Game Planning,General Member,1,4
7,Q12,I feel completely comfortable discussing personal matters with my peers when the context allows for genuine connection and shared understanding.,Nakamura,Crime & Investigation Game Planning,General Member,1,4
7,Q13,I feel completely at liberty to propose novel concepts and process enhancements to my colleagues.,Nakamura,Crime & Investigation Game Planning,General Member,1,4
7,Q14,I would feel quite comfortable discussing any missteps with my peers.,Nakamura,Crime & Investigation Game Planning,General Member,1,4
7,Q15,I would feel confident expressing my observations to a colleague when I notice an error.,Nakamura,Crime & Investigation Game Planning,General Member,1,4
7,Q16,My input is recognized as immensely valuable by my peers during collaborative discussions.,Nakamura,Crime & Investigation Game Planning,General Member,1,4
7,Q17,"Engaging with Sato-san on this is a genuinely productive path, and I plan to further our discussion.",Nakamura,Crime & Investigation Game Planning,General Member,1,4
7,Q18,Sato-san and I are engaging in exceptionally valuable information exchange.,Nakamura,Crime & Investigation Game Planning,General Member,1,4
7,Q19,"The present information sharing endeavors are demonstrating a substantial degree of superficiality, requiring deeper engagement.",Nakamura,Crime & Investigation Game Planning,General Member,1,4
7,Q20,Our team exhibits strong unity as we pursue our performance objectives.,Nakamura,Crime & Investigation Game Planning,General Member,1,4
7,Q21,"I am experiencing a profound sense of satisfaction with Sato-san's deep engagement and her capacity to align our conceptual frameworks, which fuels my own dedication.",Nakamura,Crime & Investigation Game Planning,General Member,1,4
7,Q22,"Sato-san's aspirations for team performance demonstrate a profound alignment with my own, fostering an environment of collaborative discovery.",Nakamura,Crime & Investigation Game Planning,General Member,1,4
7,Q23,"The opportunities for improving my personal performance are quite sufficient with Sato-san, and I anticipate excellent progress by further exploring our shared conceptual space.",Nakamura,Crime & Investigation Game Planning,General Member,1,4
8,Q01,"Approaching Yamaguchi with questions concerning my role presents a manageable challenge, as his guidance is consistently valuable.",Kobayashi,Crime & Investigation Game Planning,General Member,1,4
8,Q02,"I communicate my opinions about work issues with my team leader with genuine candor, offering direct insights and constructive suggestions.",Kobayashi,Crime & Investigation Game Planning,General Member,1,4
8,Q03,"I maintain a balanced approach and express concerns constructively to Yamaguchi when necessary, focusing on project objectives rather than personal matters.",Kobayashi,Crime & Investigation Game Planning,General Member,1,4
8,Q04,I feel considerable freedom to articulate recommendations for new projects or procedural changes to my team leader.,Kobayashi,Crime & Investigation Game Planning,General Member,1,4
8,Q05,I would feel adequately safe speaking to Yamaguchi about any mistakes made.,Kobayashi,Crime & Investigation Game Planning,General Member,1,4
8,Q06,I would feel perfectly secure raising concerns about a colleague's error with our team leader.,Kobayashi,Crime & Investigation Game Planning,General Member,1,4
8,Q07,"Yamaguchi-san consistently provides a receptive environment for my contributions, ensuring my input is a significant factor in our team's direction.",Kobayashi,Crime & Investigation Game Planning,General Member,1,4
8,Q08,Yamaguchi-san offers a solid foundation for us to explore novel challenges.,Kobayashi,Crime & Investigation Game Planning,General Member,1,4
8,Q09,"Yamaguchi is a reliable advocate, always demonstrating support for his team's concerns.",Kobayashi,Crime & Investigation Game Planning,General Member,1,4
8,Q10,I find asking my peers for clarification to be a perfectly straightforward endeavor.,Kobayashi,Crime & Investigation Game Planning,General Member,1,4
8,Q11,"I am quite open when sharing my work-related perspectives with colleagues, valuing direct discourse for efficient progress.",Kobayashi,Crime & Investigation Game Planning,General Member,1,4
8,Q12,I am comfortable sharing personal matters with trusted colleagues when the situation warrants it.,Kobayashi,Crime & Investigation Game Planning,General Member,1,4
8,Q13,I feel completely at liberty to propose novel concepts and suggest procedural adjustments to my colleagues.,Kobayashi,Crime & Investigation Game Planning,General Member,1,4
8,Q14,I would feel quite secure voicing any missteps I may encounter during our collaborative efforts.,Kobayashi,Crime & Investigation Game Planning,General Member,1,4
8,Q15,"I find speaking up to a colleague about a mistake to be entirely safe, as open communication fosters improvement.",Kobayashi,Crime & Investigation Game Planning,General Member,1,4
8,Q16,"My contributions are consistently acknowledged and integrated, demonstrating a genuine appreciation for my perspectives.",Kobayashi,Crime & Investigation Game Planning,General Member,1,4
8,Q17,Seeking assistance from my colleagues presents a straightforward and uncomplicated experience.,Kobayashi,Crime & Investigation Game Planning,General Member,1,4
8,Q18,"My assessment is that team members offer substantial information about work-related matters, fostering a well-informed environment.",Kobayashi,Crime & Investigation Game Planning,General Member,1,4
8,Q19,"The attempts to share information throughout the team are quite superficial, lacking depth in their current execution.",Kobayashi,Crime & Investigation Game Planning,General Member,1,4
8,Q20,"Our team demonstrates a commendable unity in pursuing performance objectives, with minimal discord observed.",Kobayashi,Crime & Investigation Game Planning,General Member,1,4
8,Q21,I am pleased with the diligent commitment our team demonstrates.,Kobayashi,Crime & Investigation Game Planning,General Member,1,4
8,Q22,"My team members' aspirations for our team's performance exhibit a positive alignment, with each individual bringing distinct strengths that enhance our collective capabilities.",Kobayashi,Crime & Investigation Game Planning,General Member,1,4
8,Q23,The opportunities the team provides for enhancing my personal performance are quite satisfactory.,Kobayashi,Crime & Investigation Game Planning,General Member,1,4
9,Q01,"It is a straightforward process to approach Yamaguchi-san with questions regarding my role, as he is always accessible for guidance.",Kato,Crime & Investigation Game Planning,General Member,1,4
9,Q02,"I communicate my opinions about work issues with my team leader directly, offering my candid thoughts.",Kato,Crime & Investigation Game Planning,General Member,1,4
9,Q03,"I feel quite at ease discussing any concerns with Yamaguchi-san, as a clear exchange of thoughts is always beneficial.",Kato,Crime & Investigation Game Planning,General Member,1,4
9,Q04,I feel entirely liberated to share my recommendations and ideas with my team leader.,Kato,Crime & Investigation Game Planning,General Member,1,4
9,Q05,I would feel secure sharing concerns with my team leader regarding any missteps made.,Kato,Crime & Investigation Game Planning,General Member,1,4
9,Q06,"I would feel quite comfortable discussing a colleague's misstep with our team leader, as open communication strengthens our collective efforts.",Kato,Crime & Investigation Game Planning,General Member,1,4
9,Q07,My input's value is always recognized by Yamaguchi-san when I articulate my observations and perspectives.,Kato,Crime & Investigation Game Planning,General Member,1,4
9,Q08,Yamaguchi-san offers a solid foundation for embracing novel responsibilities and skill acquisition within the team.,Kato,Crime & Investigation Game Planning,General Member,1,4
9,Q09,Yamaguchi-san's dedication to fostering innovative ideas ensures a robust platform for advocating team concepts.,Kato,Crime & Investigation Game Planning,General Member,1,4
9,Q10,It is remarkably simple to seek counsel from my colleagues when questions arise concerning my duties.,Kato,Crime & Investigation Game Planning,General Member,1,4
9,Q11,"I express my perspectives on work matters with colleagues quite openly, unreservedly sharing my intuitive insights.",Kato,Crime & Investigation Game Planning,General Member,1,4
9,Q12,I experience a profound sense of ease discussing personal matters with my colleagues.,Kato,Crime & Investigation Game Planning,General Member,1,4
9,Q13,I feel a strong sense of liberty to share novel concepts and proposals with my colleagues.,Kato,Crime & Investigation Game Planning,General Member,1,4
9,Q14,"I feel secure sharing my errors with colleagues, as constructive feedback aids our collective advancement.",Kato,Crime & Investigation Game Planning,General Member,1,4
9,Q15,I would feel quite comfortable bringing a colleague's error to their attention.,Kato,Crime & Investigation Game Planning,General Member,1,4
9,Q16,"My contributions to discussions are generally met with genuine consideration, fostering an environment where diverse viewpoints can flourish.",Kato,Crime & Investigation Game Planning,General Member,1,4
9,Q17,"Seeking assistance from colleagues is a straightforward endeavor, as everyone embraces collaboration.",Kato,Crime & Investigation Game Planning,General Member,1,4
9,Q18,"The team's information flow regarding work-related matters is generally quite effective, with enthusiastic sharing of emerging concepts.",Kato,Crime & Investigation Game Planning,General Member,1,4
9,Q19,"The team's information sharing endeavors are rather superficial, with a noticeable lack of genuine depth in our discussions.",Kato,Crime & Investigation Game Planning,General Member,1,4
9,Q20,My team finds substantial common ground in pursuing our performance objectives.,Kato,Crime & Investigation Game Planning,General Member,1,4
9,Q21,I find our team's commitment to this task to be remarkably strong and focused.,Kato,Crime & Investigation Game Planning,General Member,1,4
9,Q22,Our team members' aspirations for the team's performance show a wonderful convergence of enthusiasm and creative exploration.,Kato,Crime & Investigation Game Planning,General Member,1,4
9,Q23,The opportunities this team provides for personal performance enhancement are quite sufficient.,Kato,Crime & Investigation Game Planning,General Member,1,4
10,Q01,It presents no hardship for me to approach my team leader with any queries or uncertainties I may encounter in my professional capacity.,Yoshida,Crime & Investigation Game Planning,General Member,1,4
10,Q02,I express my views on work matters directly and without reservation to my team leader.,Yoshida,Crime & Investigation Game Planning,General Member,1,4
10,Q03,I maintain a stance of comfortable communication regarding any personal difficulties or disagreements with my team leader.,Yoshida,Crime & Investigation Game Planning,General Member,1,4
10,Q04,I experience a substantial degree of freedom in voicing recommendations and ideas for new projects or procedural changes to my team leader.,Yoshida,Crime & Investigation Game Planning,General Member,1,4
10,Q05,I would feel completely secure discussing any errors with my team leader.,Yoshida,Crime & Investigation Game Planning,General Member,1,4
10,Q06,I would feel rather secure speaking with my team leader about a colleague's mistake.,Yoshida,Crime & Investigation Game Planning,General Member,1,4
10,Q07,My contributions are often recognized with positive regard by Sasaki-san when I articulate my perspectives on new game concepts.,Yoshida,Crime & Investigation Game Planning,General Member,1,4
10,Q08,My team leader provides substantial encouragement for exploring novel responsibilities and acquiring new proficiencies.,Yoshida,Crime & Investigation Game Planning,General Member,1,4
10,Q09,My team leader is a reliable advocate for my concerns within the company.,Yoshida,Crime & Investigation Game Planning,General Member,1,4
10,Q10,My peers offer a dependable resource when I seek clarification or require assistance within my professional capacity.,Yoshida,Crime & Investigation Game Planning,General Member,1,4
10,Q11,"I offer my direct perspectives on work matters with my colleagues, ensuring clarity without any reservation.",Yoshida,Crime & Investigation Game Planning,General Member,1,4
10,Q12,I find speaking about personal issues to my peers to be a completely reasonable exchange.,Yoshida,Crime & Investigation Game Planning,General Member,1,4
10,Q13,I feel quite at liberty to share recommendations and ideas with my peers regarding new projects or procedural changes.,Yoshida,Crime & Investigation Game Planning,General Member,1,4
10,Q14,I would feel perfectly at ease discussing any missteps with my colleagues.,Yoshida,Crime & Investigation Game Planning,General Member,1,4
10,Q15,I would certainly speak up to a colleague if I perceived an error in their work.,Yoshida,Crime & Investigation Game Planning,General Member,1,4
10,Q16,My contributions are typically met with considerate engagement from colleagues who value diverse perspectives.,Yoshida,Crime & Investigation Game Planning,General Member,1,4
10,Q17,I find it quite simple to request assistance from my colleagues.,Yoshida,Crime & Investigation Game Planning,General Member,1,4
10,Q18,"Information sharing within the team is quite thorough, with all members keeping each other well-informed on work-related matters.",Yoshida,Crime & Investigation Game Planning,General Member,1,4
10,Q19,The team's efforts to share information are completely substantial and purposeful.,Yoshida,Crime & Investigation Game Planning,General Member,1,4
10,Q20,Our team exhibits significant synergy and a shared drive toward achieving our performance objectives.,Yoshida,Crime & Investigation Game Planning,General Member,1,4
10,Q21,"I hold considerable satisfaction with Sasaki-san's dedicated pursuit of ""Echoes of Time,"" her commitment is truly commendable.",Yoshida,Crime & Investigation Game Planning,General Member,1,4
10,Q22,"Sasaki-san's bold conceptualization for ""Echoes of Time"" presents a stimulating departure from conventional genre boundaries, and her proactive collaboration with Kato-san indicates a strong individual drive that is beneficial. My own interest in exploring the player'",Yoshida,Crime & Investigation Game Planning,General Member,1,4
10,Q23,The opportunities for improving my personal performance this team provides are entirely sufficient.,Yoshida,Crime & Investigation Game Planning,General Member,1,4
11,Q01,I possess a ready avenue for clarifying my role responsibilities.,Yamada,Crime & Investigation Game Planning,General Member,1,4
11,Q02,I can express my work opinions to my team leader with full transparency and directness.,Yamada,Crime & Investigation Game Planning,General Member,1,4
11,Q03,"I maintain a balanced comfort level discussing personal problems or disagreements with my team leader, finding it neither wholly easy nor entirely difficult.",Yamada,Crime & Investigation Game Planning,General Member,1,4
11,Q04,I feel a strong sense of openness to share recommendations and ideas for new projects and procedural changes with my team leader.,Yamada,Crime & Investigation Game Planning,General Member,1,4
11,Q05,I would feel reasonably safe speaking up to my team leader if I made a mistake on this team.,Yamada,Crime & Investigation Game Planning,General Member,1,4
11,Q06,I would feel somewhat hesitant to directly address a colleague's error with our team leader.,Yamada,Crime & Investigation Game Planning,General Member,1,4
11,Q07,I am certain my input receives considerable recognition from my team leader when I voice my opinions.,Yamada,Crime & Investigation Game Planning,General Member,1,4
11,Q08,My team leader offers substantial encouragement for me to pursue novel responsibilities and acquire unfamiliar proficiencies.,Yamada,Crime & Investigation Game Planning,General Member,1,4
11,Q09,"Sasaki-san appears to be a proactive and creative collaborator, demonstrating a willingness to explore unconventional ideas which supports her role as a potential advocate.",Yamada,Crime & Investigation Game Planning,General Member,1,4
11,Q10,Reaching out to my peers for clarification on my role is quite straightforward.,Yamada,Crime & Investigation Game Planning,General Member,1,4
11,Q11,I communicate my opinions about work issues with my peers with a direct and unvarnished approach.,Yamada,Crime & Investigation Game Planning,General Member,1,4
11,Q12,I find it entirely comfortable discussing personal matters with my colleagues.,Yamada,Crime & Investigation Game Planning,General Member,1,4
11,Q13,I feel a considerable openness to share recommendations and ideas with my peers for new projects and procedural changes.,Yamada,Crime & Investigation Game Planning,General Member,1,4
11,Q14,I would feel a secure atmosphere for sharing any missteps with my colleagues.,Yamada,Crime & Investigation Game Planning,General Member,1,4
11,Q15,I would feel quite comfortable raising concerns with a colleague who has made an error.,Yamada,Crime & Investigation Game Planning,General Member,1,4
11,Q16,My contributions are highly recognized by my colleagues when I share my perspectives.,Yamada,Crime & Investigation Game Planning,General Member,1,4
11,Q17,Seeking assistance from colleagues presents a straightforward path.,Yamada,Crime & Investigation Game Planning,General Member,1,4
11,Q18,There is considerable room for improvement regarding information dissemination among team members.,Yamada,Crime & Investigation Game Planning,General Member,1,4
11,Q19,"The current information sharing demonstrates substantial depth, and the initiation of cross-departmental collaboration before formal discussion confirms a promising foundation.",Yamada,Crime & Investigation Game Planning,General Member,1,4
11,Q20,"Our team exhibits a strong, cohesive front in pursuit of shared performance objectives.",Yamada,Crime & Investigation Game Planning,General Member,1,4
11,Q21,I am fully satisfied with the team's current level of commitment to the task.,Yamada,Crime & Investigation Game Planning,General Member,1,4
11,Q22,"The team members appear quite aligned in their aspirations for exceptional performance, with a shared enthusiasm for groundbreaking concepts.",Yamada,Crime & Investigation Game Planning,General Member,1,4
11,Q23,The opportunities provided by the team are quite sufficient for my personal performance improvement.,Yamada,Crime & Investigation Game Planning,General Member,1,4
12,Q01,"My team leader presents an approachable demeanor, making inquiries a straightforward interaction.",Sasaki,Crime & Investigation Game Planning,General Member,1,4
12,Q02,"I readily share my unvarnished thoughts on work matters with my team leader, believing a direct approach fosters essential clarity.",Sasaki,Crime & Investigation Game Planning,General Member,1,4
12,Q03,I feel a strong hesitation to bring up personal struggles or points of contention with my team leader.,Sasaki,Crime & Investigation Game Planning,General Member,1,4
12,Q04,"I experience a substantial latitude to voice recommendations and novel concepts to my team leader, fostering an environment where fresh initiatives are readily embraced.",Sasaki,Crime & Investigation Game Planning,General Member,1,4
12,Q05,"I feel secure discussing any missteps with my team leader, as constructive feedback is always beneficial.",Sasaki,Crime & Investigation Game Planning,General Member,1,4
12,Q06,"I would feel a degree of discomfort sharing a colleague's error with the team leader, but I understand the importance of addressing issues.",Sasaki,Crime & Investigation Game Planning,General Member,1,4
12,Q07,"My input is appreciated by my team leader, fostering a sense of genuine contribution.",Sasaki,Crime & Investigation Game Planning,General Member,1,4
12,Q08,My team leader provides ample opportunities for exploring novel responsibilities and acquiring new competencies.,Sasaki,Crime & Investigation Game Planning,General Member,1,4
12,Q09,My team leader provides a stable foundation of support when challenges arise.,Sasaki,Crime & Investigation Game Planning,General Member,1,4
12,Q10,Approaching peers with questions regarding my role is a process I find quite direct.,Sasaki,Crime & Investigation Game Planning,General Member,1,4
12,Q11,I openly share my intuitive ideas and enthusiastically seek collaborative input on challenging work issues.,Sasaki,Crime & Investigation Game Planning,General Member,1,4
12,Q12,I find expressing personal matters to colleagues to be a rather complex endeavor.,Sasaki,Crime & Investigation Game Planning,General Member,1,4
12,Q13,I feel quite at liberty to propose novel concepts and procedural adjustments to my colleagues.,Sasaki,Crime & Investigation Game Planning,General Member,1,4
12,Q14,"I would feel entirely secure sharing any missteps with my colleagues, as I am confident in their supportive nature.",Sasaki,Crime & Investigation Game Planning,General Member,1,4
12,Q15,I would feel completely comfortable voicing my observations if I noticed a colleague making an error.,Sasaki,Crime & Investigation Game Planning,General Member,1,4
