agent_id,question_id,answer_text,agent_name,dept,position,dept_id,pattern_id
0,Q01,Approaching my team leader with inquiries regarding my role at work presents a comfortable experience.,Sato,Historical Game Planning,General Member,0,4
0,Q02,"I communicate my opinions about work issues with my team leader with considerable candor, particularly when foundational concepts are at a nascent stage.",Sato,Historical Game Planning,General Member,0,4
0,Q03,I experience a positive comfort level discussing personal issues or disagreements with my team leader.,Sato,Historical Game Planning,General Member,0,4
0,Q04,I feel quite comfortable expressing suggestions for new projects or procedural adjustments to my team leader.,Sato,Historical Game Planning,General Member,0,4
0,Q05,"I would feel quite comfortable raising my mistakes with my team leader, as I believe open communication fosters a strong team environment.",Sato,Historical Game Planning,General Member,0,4
0,Q06,I would feel completely secure speaking with my team leader about a colleague's oversight.,Sato,Historical Game Planning,General Member,0,4
0,Q07,"I perceive my team leader greatly values my input when I voice my opinions, fostering a truly collaborative environment.",Sato,Historical Game Planning,General Member,0,4
0,Q08,My team leader maintains a helpful stance when I explore novel responsibilities.,Sato,Historical Game Planning,General Member,0,4
0,Q09,My team leader is entirely reliable to champion my concerns within the company.,Sato,Historical Game Planning,General Member,0,4
0,Q10,I find it quite manageable to inquire with colleagues when I require clarification regarding my responsibilities.,Sato,Historical Game Planning,General Member,0,4
0,Q11,I will openly share my thoughts on work matters with my colleagues.,Sato,Historical Game Planning,General Member,0,4
0,Q12,I generally find discussing personal matters with colleagues to be a comfortable experience.,Sato,Historical Game Planning,General Member,0,4
0,Q13,I experience a substantial liberty to voice my recommendations and ideas to my peers.,Sato,Historical Game Planning,General Member,0,4
0,Q14,"I would feel quite secure sharing my errors with colleagues, as constructive dialogue fosters growth.",Sato,Historical Game Planning,General Member,0,4
0,Q15,I would feel quite secure in addressing a colleague regarding an observed error.,Sato,Historical Game Planning,General Member,0,4
0,Q16,My contributions are often recognized and welcomed by my colleagues during the initial stages of concept development.,Sato,Historical Game Planning,General Member,0,4
0,Q17,It presents minimal difficulty to request assistance from colleagues when their input is beneficial.,Sato,Historical Game Planning,General Member,0,4
0,Q18,Information sharing amongst the team generally progresses with thoughtful consideration.,Sato,Historical Game Planning,General Member,0,4
0,Q19,"Suzuki-san's proactive request for input on his foundational concepts demonstrates a genuine commitment to collaborative ideation, which is absolutely vital for team synergy.",Sato,Historical Game Planning,General Member,0,4
0,Q20,Our department maintains a strong sense of shared purpose in advancing our project objectives.,Sato,Historical Game Planning,General Member,0,4
0,Q21,"I am very content with the team's commitment level, as everyone is contributing fresh and expansive ideas at this crucial juncture.",Sato,Historical Game Planning,General Member,0,4
0,Q22,"Suzuki-san's immediate request for input on his foundational concepts creates a slight divergence from my previously planned sequence, necessitating a focused collaborative exchange before I can fully engage with Nakamura-san's genre-blending ideas.",Sato,Historical Game Planning,General Member,0,4
0,Q23,"The opportunities this team provides for personal performance improvement are quite adequate, offering a positive environment for growth.",Sato,Historical Game Planning,General Member,0,4
1,Q01,Engaging my team leader with inquiries regarding my role presents a straightforward process.,Suzuki,Historical Game Planning,General Member,0,4
1,Q02,I find it beneficial to share my thoughts with my team leader once I have a well-developed perspective.,Suzuki,Historical Game Planning,General Member,0,4
1,Q03,"I experience a definite discomfort discussing personal difficulties or disagreements with my team leader, as I prefer to maintain professional boundaries.",Suzuki,Historical Game Planning,General Member,0,4
1,Q04,I find myself feeling quite unhindered in presenting suggestions for new projects or procedural adjustments to my team leader.,Suzuki,Historical Game Planning,General Member,0,4
1,Q05,"I would feel quite secure voicing any missteps to my team leader, given the supportive atmosphere fostered.",Suzuki,Historical Game Planning,General Member,0,4
1,Q06,"I would feel quite comfortable discussing a colleague's error with my team leader, as open communication fosters improvement.",Suzuki,Historical Game Planning,General Member,0,4
1,Q07,My input is valued by my team leader when it is presented with clear direction and potential for project advancement.,Suzuki,Historical Game Planning,General Member,0,4
1,Q08,My team leader provides a comfortable environment for exploring novel responsibilities and acquiring new skills.,Suzuki,Historical Game Planning,General Member,0,4
1,Q09,My team leader's support for my concerns appears to be somewhat limited.,Suzuki,Historical Game Planning,General Member,0,4
1,Q10,It is quite straightforward to seek clarification from my colleagues regarding my responsibilities.,Suzuki,Historical Game Planning,General Member,0,4
1,Q11,"I am quite comfortable expressing my perspectives on work matters with my colleagues, finding their input valuable for solidifying concepts.",Suzuki,Historical Game Planning,General Member,0,4
1,Q12,I find it comfortable to discuss personal matters with my peers as it fosters deeper understanding and connection.,Suzuki,Historical Game Planning,General Member,0,4
1,Q13,I feel an ample degree of freedom to articulate my recommendations and ideas to my peers.,Suzuki,Historical Game Planning,General Member,0,4
1,Q14,"I would feel quite comfortable raising concerns regarding potential missteps with my peers, recognizing that open communication fosters robust development.",Suzuki,Historical Game Planning,General Member,0,4
1,Q15,I would feel entirely comfortable discussing a perceived error with a peer.,Suzuki,Historical Game Planning,General Member,0,4
1,Q16,I feel my contributions are consistently acknowledged and given considerable weight by my colleagues.,Suzuki,Historical Game Planning,General Member,0,4
1,Q17,Reaching out to colleagues for assistance presents a welcome opportunity for shared progress.,Suzuki,Historical Game Planning,General Member,0,4
1,Q18,Sato-san's alignment with the project's direction and her appreciation for our complementary workstyles confirm that our current communication approach is productive.,Suzuki,Historical Game Planning,General Member,0,4
1,Q19,The information sharing attempts possess a genuinely superficial quality at this juncture.,Suzuki,Historical Game Planning,General Member,0,4
1,Q20,"My team exhibits a promising alignment concerning our performance objectives, with Sato-san's enthusiastic reception of our collaborative approach serving as a positive indicator.",Suzuki,Historical Game Planning,General Member,0,4
1,Q21,"I am content with the team's dedication, as it fosters a constructive environment for exploration.",Suzuki,Historical Game Planning,General Member,0,4
1,Q22,"My team members demonstrate considerable alignment in their aspirations for the team's performance, with only slight divergences regarding the breadth of our historical interpretation.",Suzuki,Historical Game Planning,General Member,0,4
1,Q23,"The opportunities provided by this team for enhancing my personal performance are quite sufficient, fostering a constructive environment for growth.",Suzuki,Historical Game Planning,General Member,0,4
2,Q01,Approaching Yamamoto-san for clarification or support on my role presents a welcome opportunity for informed guidance.,Takahashi,Historical Game Planning,General Member,0,4
2,Q02,"I am comfortable discussing my work opinions with my team leader, and I find direct communication to be productive for advancing our projects.",Takahashi,Historical Game Planning,General Member,0,4
2,Q03,I possess a disposition that prefers careful consideration before articulating personal matters or disagreements to my team leader.,Takahashi,Historical Game Planning,General Member,0,4
2,Q04,"I appreciate the opportunity to share my thoughts, and I will offer my perspective on the freedom I experience when proposing recommendations or changes to my team leader.

I find my ability to offer recommendations and ideas for new projects or changes in procedures to my team",Takahashi,Historical Game Planning,General Member,0,4
2,Q05,"I would feel rather comfortable discussing any errors with the team leader, as open communication fosters a productive environment.",Takahashi,Historical Game Planning,General Member,0,4
2,Q06,I would feel a distinct discomfort speaking up to my team leader about a colleague's error.,Takahashi,Historical Game Planning,General Member,0,4
2,Q07,My contributions are recognized with a considerable degree of consideration by my team leader when I articulate my perspectives.,Takahashi,Historical Game Planning,General Member,0,4
2,Q08,My team leader's support for me venturing into novel responsibilities or acquiring unfamiliar skills is a presence that fosters growth.,Takahashi,Historical Game Planning,General Member,0,4
2,Q09,Yamamoto-san demonstrates strong potential to serve as an effective advocate for team members facing company-wide issues.,Takahashi,Historical Game Planning,General Member,0,4
2,Q10,It presents a straightforward path to seek clarity from colleagues regarding my responsibilities.,Takahashi,Historical Game Planning,General Member,0,4
2,Q11,I offer my perspective with a sincere desire for the project's advancement.,Takahashi,Historical Game Planning,General Member,0,4
2,Q12,I maintain a cautious approach when discussing personal matters with colleagues.,Takahashi,Historical Game Planning,General Member,0,4
2,Q13,I feel a comfortable degree of freedom to offer my suggestions to my colleagues regarding new project directions and procedural adjustments.,Takahashi,Historical Game Planning,General Member,0,4
2,Q14,"I feel that open discussion regarding errors contributes to team growth, and I would approach peer interactions with a focus on collaborative problem-solving.",Takahashi,Historical Game Planning,General Member,0,4
2,Q15,"I would feel quite comfortable speaking with a colleague about a perceived error, as constructive feedback offers substantial learning opportunities.",Takahashi,Historical Game Planning,General Member,0,4
2,Q16,My contributions are acknowledged with thoughtful consideration by my colleagues.,Takahashi,Historical Game Planning,General Member,0,4
2,Q17,I find that coordinating assistance from colleagues outside my immediate focus requires a deliberate and thoughtful approach.,Takahashi,Historical Game Planning,General Member,0,4
2,Q18,"Information exchange within the team is moderately effective, with some areas showing particular strength.",Takahashi,Historical Game Planning,General Member,0,4
2,Q19,"The information sharing within the team shows a solid foundation of genuine connection, with hints of exploring deeper avenues.",Takahashi,Historical Game Planning,General Member,0,4
2,Q20,"Our team finds a solid foundation of shared direction, although individual contributions show some variation in approach.",Takahashi,Historical Game Planning,General Member,0,4
2,Q21,I appreciate the dedication evident in the team's engagement with the project's core concepts.,Takahashi,Historical Game Planning,General Member,0,4
2,Q22,"My team members' aspirations for our performance present a promising alignment with the core tenets of our project, with particular resonance found in the concept of historical preservation and intellectual engagement.",Takahashi,Historical Game Planning,General Member,0,4
2,Q23,The opportunities provided by the team to enhance my personal performance are adequate for my current needs.,Takahashi,Historical Game Planning,General Member,0,4
3,Q01,It is quite simple to approach my team leader with questions or uncertainties regarding my role.,Tanaka,Historical Game Planning,General Member,0,4
3,Q02,"I tend to express my work-related thoughts with a measured and considered approach, particularly when they are still in their early stages of development.",Tanaka,Historical Game Planning,General Member,0,4
3,Q03,"I feel quite comfortable discussing both personal challenges and disagreements with my team leader, as I believe open communication fosters a supportive environment.",Tanaka,Historical Game Planning,General Member,0,4
3,Q04,I experience a considerable latitude to voice recommendations and concepts for novel initiatives or procedural adjustments to my team leader.,Tanaka,Historical Game Planning,General Member,0,4
3,Q05,"I would feel quite comfortable speaking with my team leader about a mistake, as I am confident that constructive feedback is valued here.",Tanaka,Historical Game Planning,General Member,0,4
3,Q06,I would feel quite comfortable offering my observations to my team leader regarding a colleague's misstep.,Tanaka,Historical Game Planning,General Member,0,4
3,Q07,"I perceive my contributions as having a fair measure of consideration from my team leader, fostering an environment where my thoughts are generally acknowledged.",Tanaka,Historical Game Planning,General Member,0,4
3,Q08,My team leader offers abundant opportunity for me to embrace novel assignments and acquire unfamiliar competencies.,Tanaka,Historical Game Planning,General Member,0,4
3,Q09,Our department head provides a solid foundation of support.,Tanaka,Historical Game Planning,General Member,0,4
3,Q10,I find it quite straightforward to seek clarification from my colleagues on matters pertaining to my work.,Tanaka,Historical Game Planning,General Member,0,4
3,Q11,"I express my work opinions with peers with significant openness, finding satisfaction in sharing nascent thoughts.",Tanaka,Historical Game Planning,General Member,0,4
3,Q12,I prefer to keep personal matters separate from workplace discussions.,Tanaka,Historical Game Planning,General Member,0,4
3,Q13,"I feel a substantial freedom to voice my ideas and recommendations to my colleagues, appreciating the receptive atmosphere for new project concepts.",Tanaka,Historical Game Planning,General Member,0,4
3,Q14,"I feel entirely secure discussing any errors with colleagues, as I trust their constructive feedback will be beneficial.",Tanaka,Historical Game Planning,General Member,0,4
3,Q15,I would feel rather uneasy speaking up if I perceived a colleague's misstep.,Tanaka,Historical Game Planning,General Member,0,4
3,Q16,I perceive my contributions are generally well-received and considered by my colleagues.,Tanaka,Historical Game Planning,General Member,0,4
3,Q17,"It is a straightforward matter to approach colleagues for assistance, as their willingness to lend support is quite evident.",Tanaka,Historical Game Planning,General Member,0,4
3,Q18,"Information exchange within the team demonstrates substantial gaps in consistent, proactive dissemination.",Tanaka,Historical Game Planning,General Member,0,4
3,Q19,"Information sharing within the team possesses a notable depth, seldom appearing merely superficial.",Tanaka,Historical Game Planning,General Member,0,4
3,Q20,"Our team demonstrates a strong sense of unity, with a shared enthusiasm for discovering novel historical themes that enrich our projects.",Tanaka,Historical Game Planning,General Member,0,4
3,Q21,I am content with the team's present dedication to the endeavor.,Tanaka,Historical Game Planning,General Member,0,4
3,Q22,"Sato-san's enthusiasm for uncovering forgotten historical elements aligns well with our department's strengths, creating a promising foundation for team performance.",Tanaka,Historical Game Planning,General Member,0,4
3,Q23,The opportunities this team provides for enhancing my personal performance feel adequately sufficient.,Tanaka,Historical Game Planning,General Member,0,4
4,Q01,I find approaching my team leader with inquiries to be a remarkably straightforward process.,Watanabe,Historical Game Planning,General Member,0,4
4,Q02,"I express my professional perspectives with clarity and directness, valuing honest discourse.",Watanabe,Historical Game Planning,General Member,0,4
4,Q03,"I feel a significant level of comfort discussing personal problems and disagreements with my team leader, given their understanding and approachable demeanor.",Watanabe,Historical Game Planning,General Member,0,4
4,Q04,I feel entirely unhindered in offering recommendations and suggestions for new projects or procedural adjustments to my team leader.,Watanabe,Historical Game Planning,General Member,0,4
4,Q05,"I would feel quite confident discussing any missteps with my team leader, as I believe open communication fosters growth.",Watanabe,Historical Game Planning,General Member,0,4
4,Q06,I would feel secure in raising concerns with my team leader regarding a colleague's oversight.,Watanabe,Historical Game Planning,General Member,0,4
4,Q07,My contributions are considered with genuine interest by my team leader.,Watanabe,Historical Game Planning,General Member,0,4
4,Q08,My team leader provides adequate opportunities for learning new things.,Watanabe,Historical Game Planning,General Member,0,4
4,Q09,My team leader generally offers a dependable support system for workplace challenges.,Watanabe,Historical Game Planning,General Member,0,4
4,Q10,I find it quite straightforward to approach colleagues with any inquiries related to my duties.,Watanabe,Historical Game Planning,General Member,0,4
4,Q11,I express my opinions about work issues with my peers with complete candor.,Watanabe,Historical Game Planning,General Member,0,4
4,Q12,I find discussions of personal matters with colleagues to be something I approach with a certain reserve.,Watanabe,Historical Game Planning,General Member,0,4
4,Q13,I perceive a complete freedom to propose my recommendations and concepts to my colleagues.,Watanabe,Historical Game Planning,General Member,0,4
4,Q14,I feel quite secure expressing my errors to my colleagues.,Watanabe,Historical Game Planning,General Member,0,4
4,Q15,I would feel completely safe speaking up to a colleague if I observed an error.,Watanabe,Historical Game Planning,General Member,0,4
4,Q16,My contributions are generally met with consideration and are seen as a useful part of our collaborative process.,Watanabe,Historical Game Planning,General Member,0,4
4,Q17,I find it very simple to ask other team members for assistance when needed.,Watanabe,Historical Game Planning,General Member,0,4
4,Q18,The team demonstrates an adequate level of information sharing regarding work-related matters.,Watanabe,Historical Game Planning,General Member,0,4
4,Q19,"The team's information sharing efforts show a commendable depth, focusing on substantial conceptual discussions rather than surface-level exchanges.",Watanabe,Historical Game Planning,General Member,0,4
4,Q20,"Our team demonstrates significant unity in pursuing our performance objectives, with shared enthusiasm for the artifact concept driving our forward momentum.",Watanabe,Historical Game Planning,General Member,0,4
4,Q21,I am finding our team's dedication to this task quite satisfactory.,Watanabe,Historical Game Planning,General Member,0,4
4,Q22,My teammates' aspirations for team performance present a strong alignment with my own.,Watanabe,Historical Game Planning,General Member,0,4
4,Q23,The opportunities provided for enhancing my personal performance are definitely sufficient.,Watanabe,Historical Game Planning,General Member,0,4
5,Q01,Consulting my team leader on role-related uncertainties presents a straightforward path for clarity.,Ito,Historical Game Planning,General Member,0,4
5,Q02,I share my thoughts openly and with genuine enthusiasm when collaborating with Watanabe on our current projects.,Ito,Historical Game Planning,General Member,0,4
5,Q03,"I find I am quite at ease discussing challenges with my team leader, especially when it involves fostering the innovative spirit that Watanabe exemplifies.",Ito,Historical Game Planning,General Member,0,4
5,Q04,"I feel quite empowered to voice my innovative thoughts and recommendations to my team leader, especially when collaborating with colleagues like Watanabe.",Ito,Historical Game Planning,General Member,0,4
5,Q05,"I feel quite secure sharing any missteps with my team leader, as a constructive approach to errors is a valued aspect of our collaboration.",Ito,Historical Game Planning,General Member,0,4
5,Q06,"I would feel quite comfortable addressing a colleague's oversight directly with the team leader, given the circumstances.",Ito,Historical Game Planning,General Member,0,4
5,Q07,"My contributions find a welcoming reception with my team leader, encouraging further engagement.",Ito,Historical Game Planning,General Member,0,4
5,Q08,My team leader provides a supportive environment for exploring new tasks.,Ito,Historical Game Planning,General Member,0,4
5,Q09,Ito believes Watanabe's insightful contributions and collaborative spirit make their current brainstorming exceptionally fruitful.,Ito,Historical Game Planning,General Member,0,4
5,Q10,"It is quite straightforward to seek clarification from my colleagues, as their collaborative spirit fosters an environment of shared understanding.",Ito,Historical Game Planning,General Member,0,4
5,Q11,"I communicate my opinions about work issues with my peers quite directly, valuing clarity and open discussion.",Ito,Historical Game Planning,General Member,0,4
5,Q12,"I find discussing personal matters with colleagues to be a neutral experience, not causing any particular discomfort or ease.",Ito,Historical Game Planning,General Member,0,4
5,Q13,I feel a very comfortable freedom to contribute my insights and suggestions to my colleagues regarding new project directions and procedural enhancements.,Ito,Historical Game Planning,General Member,0,4
5,Q14,"I feel completely safe speaking up to my peers, even if I make a mistake.",Ito,Historical Game Planning,General Member,0,4
5,Q15,"I feel a profound sense of security discussing potential errors with a colleague, fostering an environment where we can refine our work collaboratively.",Ito,Historical Game Planning,General Member,0,4
5,Q16,"My contributions resonate strongly with Watanabe, fostering a sense of shared creation and original discovery.",Ito,Historical Game Planning,General Member,0,4
5,Q17,Seeking assistance from colleagues outside of my immediate departmental collaboration feels like a considerable endeavor.,Ito,Historical Game Planning,General Member,0,4
5,Q18,"Watanabe and I are achieving a superb level of shared understanding and forward momentum, with strategic consideration for involving others at an opportune juncture.",Ito,Historical Game Planning,General Member,0,4
5,Q19,"The team's efforts to share information feel genuinely substantive, connecting deeply with the core of our creative endeavors.",Ito,Historical Game Planning,General Member,0,4
5,Q20,"Our team is exceptionally united in the pursuit of performance goals, with Watanabe's innovative contributions greatly enhancing our collaborative synergy and pushing us toward original outcomes.",Ito,Historical Game Planning,General Member,0,4
5,Q21,"I find our team's commitment to this task to be exceptionally high, fostering a truly productive and inspiring atmosphere.",Ito,Historical Game Planning,General Member,0,4
5,Q22,"Watanabe's innovative spirit and constructive engagement create a truly synergistic environment, amplifying our shared pursuit of groundbreaking game concepts.",Ito,Historical Game Planning,General Member,0,4
5,Q23,"The opportunities this team provides for improving my personal performance are immensely valuable, allowing for significant growth.",Ito,Historical Game Planning,General Member,0,4
6,Q01,Yamaguchi's prepared submissions demonstrate considerable engagement with the project opportunities.,Yamamoto,Historical Game Planning,Department Leader,0,4
6,Q02,I offer my team leader my unfiltered thoughts when discussing work matters.,Yamamoto,Historical Game Planning,Department Leader,0,4
6,Q03,"I find discussing personal issues or disagreements with a team leader to be a matter requiring careful consideration, and I would approach such conversations with a measured perspective.",Yamamoto,Historical Game Planning,Department Leader,0,4
6,Q04,"I feel a great deal of openness to share my recommendations and ideas with my team leader, especially concerning new projects.",Yamamoto,Historical Game Planning,Department Leader,0,4
6,Q05,"I would feel very secure discussing any errors with my team leader, as their guidance is always constructive.",Yamamoto,Historical Game Planning,Department Leader,0,4
6,Q06,I would feel entirely comfortable addressing a team member about a potential oversight.,Yamamoto,Historical Game Planning,Department Leader,0,4
6,Q07,My input is consistently valued and considered by my team leader.,Yamamoto,Historical Game Planning,Department Leader,0,4
6,Q08,"Yamaguchi's detailed proposals demonstrate a strong commitment to exploring new avenues, and his approach provides a beneficial benchmark for conceptual development.",Yamamoto,Historical Game Planning,Department Leader,0,4
6,Q09,"Yamaguchi presents a commendable level of preparedness and insight, which bodes well for collaborative ventures.",Yamamoto,Historical Game Planning,Department Leader,0,4
