agent_id,question_id,answer_text,agent_name,dept,position,dept_id,pattern_id
0,Q01,I would find it quite straightforward to approach my team leader with any inquiries I might have regarding my responsibilities.,Sato,Post-Apocalyptic Game Planning,General Member,0,3
0,Q02,"I can communicate my opinions on work issues with my team leader with complete candor, as his reception of my detailed framework for interactive lore discovery indicates a strong alignment and mutual confidence in our project's direction.",Sato,Post-Apocalyptic Game Planning,General Member,0,3
0,Q03,"I possess a definite comfort in addressing disagreements with my team leader, finding their input instrumental for project progression.",Sato,Post-Apocalyptic Game Planning,General Member,0,3
0,Q04,"I feel quite free to present recommendations and ideas, as the current direction demonstrates a strong alignment with my contributions.",Sato,Post-Apocalyptic Game Planning,General Member,0,3
0,Q05,"I would feel quite safe speaking up to my team leader, as their feedback on my contributions indicates a supportive environment for innovative ideas.",Sato,Post-Apocalyptic Game Planning,General Member,0,3
0,Q06,"I feel quite safe speaking up to my team leader regarding a colleague's mistake, as open communication contributes to overall project success.",Sato,Post-Apocalyptic Game Planning,General Member,0,3
0,Q07,My input is perceived as forming a vital foundation for the project's current direction.,Sato,Post-Apocalyptic Game Planning,General Member,0,3
0,Q08,"Yamamoto-san provides significant encouragement for exploring novel approaches and developing new skills, contributing substantially to the project's direction.",Sato,Post-Apocalyptic Game Planning,General Member,0,3
0,Q09,Yamamoto-san's confidence in my contributions suggests he would be a dependable advocate.,Sato,Post-Apocalyptic Game Planning,General Member,0,3
0,Q10,I find it quite straightforward to seek clarification from my colleagues regarding my responsibilities.,Sato,Post-Apocalyptic Game Planning,General Member,0,3
0,Q11,"I openly share my detailed framework for interactive lore discovery, as it forms the backbone of our player experience.",Sato,Post-Apocalyptic Game Planning,General Member,0,3
0,Q12,"I am quite comfortable sharing personal matters with my peers, finding it beneficial for building strong professional connections.",Sato,Post-Apocalyptic Game Planning,General Member,0,3
0,Q13,"I feel quite unrestricted in sharing my recommendations and ideas with my peers, as the current framework allows for their effective integration.",Sato,Post-Apocalyptic Game Planning,General Member,0,3
0,Q14,"I would feel quite comfortable discussing any errors with my colleagues, as their contributions are constructive.",Sato,Post-Apocalyptic Game Planning,General Member,0,3
0,Q15,I would feel extremely comfortable pointing out an error to a colleague.,Sato,Post-Apocalyptic Game Planning,General Member,0,3
0,Q16,"My contributions to the project are clearly recognized and form a substantial basis for our current direction, leading to substantial positive outcomes.",Sato,Post-Apocalyptic Game Planning,General Member,0,3
0,Q17,Seeking assistance from colleagues generally presents a manageable process.,Sato,Post-Apocalyptic Game Planning,General Member,0,3
0,Q18,"The team actively shares work-related information, ensuring everyone maintains a solid understanding of project developments.",Sato,Post-Apocalyptic Game Planning,General Member,0,3
0,Q19,"The team's efforts to disseminate information are substantially grounded in tangible progress, exceeding mere surface-level exchanges.",Sato,Post-Apocalyptic Game Planning,General Member,0,3
0,Q20,"The team demonstrates a commendable alignment in pursuing project objectives, with substantial agreement on foundational mechanics.",Sato,Post-Apocalyptic Game Planning,General Member,0,3
0,Q21,I am completely satisfied with my team's dedication to this endeavor.,Sato,Post-Apocalyptic Game Planning,General Member,0,3
0,Q22,Yamamoto-san's explicit confidence in the established framework indicates a strong alignment with my detailed approach to interactive lore discovery.,Sato,Post-Apocalyptic Game Planning,General Member,0,3
0,Q23,"The opportunities provided for personal performance enhancement are highly sufficient, offering a solid foundation for growth.",Sato,Post-Apocalyptic Game Planning,General Member,0,3
1,Q01,I find it quite simple to approach my team leader with any uncertainties I encounter in my work.,Suzuki,Post-Apocalyptic Game Planning,General Member,0,3
1,Q02,I can readily share my perspectives on work matters with my team leader.,Suzuki,Post-Apocalyptic Game Planning,General Member,0,3
1,Q03,I experience a moderate level of unease when discussing personal issues or disagreements with my team leader.,Suzuki,Post-Apocalyptic Game Planning,General Member,0,3
1,Q04,I feel quite unhindered in presenting my suggestions and ideas regarding new projects or procedural adjustments to my team leader.,Suzuki,Post-Apocalyptic Game Planning,General Member,0,3
1,Q05,"I would feel quite comfortable discussing any missteps with my team leader, as open communication is crucial for our team's progress.",Suzuki,Post-Apocalyptic Game Planning,General Member,0,3
1,Q06,"I would feel quite comfortable raising a concern with my team leader if I observed a colleague making an error, as open communication is essential for project success.",Suzuki,Post-Apocalyptic Game Planning,General Member,0,3
1,Q07,I find my contributions are consistently appreciated by my team leader.,Suzuki,Post-Apocalyptic Game Planning,General Member,0,3
1,Q08,My team leader offers consistent encouragement for embracing new challenges and skill acquisition.,Suzuki,Post-Apocalyptic Game Planning,General Member,0,3
1,Q09,"Yamamoto-san possesses a strong commitment to fostering a supportive environment, making him a reliable advocate for his team.",Suzuki,Post-Apocalyptic Game Planning,General Member,0,3
1,Q10,I find seeking clarification from my colleagues to be a remarkably straightforward endeavor.,Suzuki,Post-Apocalyptic Game Planning,General Member,0,3
1,Q11,I communicate my opinions about work issues with my peers with a direct and candid approach.,Suzuki,Post-Apocalyptic Game Planning,General Member,0,3
1,Q12,I find it agreeable to discuss personal matters with my colleagues.,Suzuki,Post-Apocalyptic Game Planning,General Member,0,3
1,Q13,I feel quite empowered to share my recommendations and suggestions with my colleagues.,Suzuki,Post-Apocalyptic Game Planning,General Member,0,3
1,Q14,I would feel adequately safe speaking up to my peers if I made a mistake on this team.,Suzuki,Post-Apocalyptic Game Planning,General Member,0,3
1,Q15,I would feel quite comfortable pointing out a mistake to a colleague.,Suzuki,Post-Apocalyptic Game Planning,General Member,0,3
1,Q16,My input appears to be consistently regarded with significant attention by my colleagues.,Suzuki,Post-Apocalyptic Game Planning,General Member,0,3
1,Q17,It is quite challenging to request assistance from my colleagues on this team.,Suzuki,Post-Apocalyptic Game Planning,General Member,0,3
1,Q18,Team members communicate work-related issues with commendable clarity.,Suzuki,Post-Apocalyptic Game Planning,General Member,0,3
1,Q19,"Information sharing across the team feels genuinely substantial, not merely a surface-level endeavor.",Suzuki,Post-Apocalyptic Game Planning,General Member,0,3
1,Q20,The team shares a strong consensus regarding the core objectives of our current projects.,Suzuki,Post-Apocalyptic Game Planning,General Member,0,3
1,Q21,I am fully satisfied with the team's dedication to our objectives.,Suzuki,Post-Apocalyptic Game Planning,General Member,0,3
1,Q22,"My team members' aspirations for team performance align wonderfully, providing a solid foundation for our projects.",Suzuki,Post-Apocalyptic Game Planning,General Member,0,3
1,Q23,The opportunities provided for enhancing my personal performance are certainly welcome.,Suzuki,Post-Apocalyptic Game Planning,General Member,0,3
2,Q01,Engaging with our team leader regarding uncertainties within my role presents a straightforward path.,Takahashi,Post-Apocalyptic Game Planning,General Member,0,3
2,Q02,I find myself capable of articulating my viewpoints with considerable clarity when addressing the team leader on work-related matters.,Takahashi,Post-Apocalyptic Game Planning,General Member,0,3
2,Q03,"I feel quite comfortable discussing matters with my team leader, as open communication fosters a strong working environment.",Takahashi,Post-Apocalyptic Game Planning,General Member,0,3
2,Q04,I experience a significant degree of liberty in expressing recommendations and novel concepts for our team leader's consideration.,Takahashi,Post-Apocalyptic Game Planning,General Member,0,3
2,Q05,I would feel quite secure raising concerns about any errors I might make within the team.,Takahashi,Post-Apocalyptic Game Planning,General Member,0,3
2,Q06,"I would feel quite secure raising concerns about a colleague's error, as open dialogue contributes to our collective improvement.",Takahashi,Post-Apocalyptic Game Planning,General Member,0,3
2,Q07,"I perceive my contributions as thoroughly considered by my team leader, fostering a strong sense of their importance.",Takahashi,Post-Apocalyptic Game Planning,General Member,0,3
2,Q08,"My team leader's encouragement for me to venture into new tasks and acquire novel skills is a constant, robust presence that I deeply appreciate.",Takahashi,Post-Apocalyptic Game Planning,General Member,0,3
2,Q09,My team leader’s ability to champion my concerns is demonstrably sound.,Takahashi,Post-Apocalyptic Game Planning,General Member,0,3
2,Q10,My peers provide an accessible avenue for seeking clarification or assistance regarding my responsibilities.,Takahashi,Post-Apocalyptic Game Planning,General Member,0,3
2,Q11,I communicate my opinions with my peers with a directness that reflects my thorough consideration of the matter.,Takahashi,Post-Apocalyptic Game Planning,General Member,0,3
2,Q12,I find speaking about personal matters with colleagues to be a rather unproductive endeavor.,Takahashi,Post-Apocalyptic Game Planning,General Member,0,3
2,Q13,I experience considerable freedom to voice my recommendations and ideas to my peers concerning new projects or procedural changes.,Takahashi,Post-Apocalyptic Game Planning,General Member,0,3
2,Q14,"I would feel quite secure sharing any errors with my colleagues, as their constructive input is always beneficial.",Takahashi,Post-Apocalyptic Game Planning,General Member,0,3
2,Q15,"I would feel quite comfortable offering suggestions to a colleague when I perceive a misstep, as open dialogue benefits the entire team.",Takahashi,Post-Apocalyptic Game Planning,General Member,0,3
2,Q16,My contributions are perceived as having significant merit by my colleagues.,Takahashi,Post-Apocalyptic Game Planning,General Member,0,3
2,Q17,It presents a considerable challenge to seek assistance from other team members due to the current alignment of our development phases.,Takahashi,Post-Apocalyptic Game Planning,General Member,0,3
2,Q18,The team's commitment to sharing work-related information appears to be quite robust.,Takahashi,Post-Apocalyptic Game Planning,General Member,0,3
2,Q19,"The team's attempts to share information feel substantial, bordering on profound, as we meticulously sculpt the philosophical underpinnings of our game.",Takahashi,Post-Apocalyptic Game Planning,General Member,0,3
2,Q20,Our team finds a strong alignment on the core artistic aspirations for our game's performance.,Takahashi,Post-Apocalyptic Game Planning,General Member,0,3
2,Q21,I am quite pleased with the team's dedication to the task.,Takahashi,Post-Apocalyptic Game Planning,General Member,0,3
2,Q22,"My team members' aspirations for our team's performance are wonderfully aligned, fostering a shared commitment to excellence.",Takahashi,Post-Apocalyptic Game Planning,General Member,0,3
2,Q23,The current opportunities foster my personal performance with substantial room for continued growth.,Takahashi,Post-Apocalyptic Game Planning,General Member,0,3
3,Q01,It is quite simple to approach my team leader with inquiries regarding my responsibilities.,Tanaka,Post-Apocalyptic Game Planning,General Member,0,3
3,Q02,"I find my communications with my team leader to be perfectly aligned, affirming my ideas with a valuable perspective.",Tanaka,Post-Apocalyptic Game Planning,General Member,0,3
3,Q03,I feel absolutely secure in expressing my thoughts and any concerns I might have regarding personal matters or differing opinions with my team leader.,Tanaka,Post-Apocalyptic Game Planning,General Member,0,3
3,Q04,"I experience a profound sense of freedom to express my creative impulses for new projects, as my leader consistently validates and encourages my unique vision.",Tanaka,Post-Apocalyptic Game Planning,General Member,0,3
3,Q05,"I would feel quite secure voicing any errors to my team leader, as their encouragement for thorough development provides a robust foundation for open communication.",Tanaka,Post-Apocalyptic Game Planning,General Member,0,3
3,Q06,"I feel a comfortable certainty in addressing a colleague's misstep with my team leader, knowing transparency serves the collective good.",Tanaka,Post-Apocalyptic Game Planning,General Member,0,3
3,Q07,Yamamoto-san's affirmations strongly indicate my input is highly valued and precisely aligned with our project's aspirations.,Tanaka,Post-Apocalyptic Game Planning,General Member,0,3
3,Q08,My team leader offers a wonderfully permissive environment for my independent exploration of project elements.,Tanaka,Post-Apocalyptic Game Planning,General Member,0,3
3,Q09,"Yamamoto-san's support for my vision is incredibly strong, making him a highly reliable advocate.",Tanaka,Post-Apocalyptic Game Planning,General Member,0,3
3,Q10,Approaching colleagues for clarification on my role is a straightforward endeavor.,Tanaka,Post-Apocalyptic Game Planning,General Member,0,3
3,Q11,"I find my thoughts are often perfectly echoed and encouraged by Yamamoto-san, giving me ample confidence to fully develop my vision without needing external discourse.",Tanaka,Post-Apocalyptic Game Planning,General Member,0,3
3,Q12,I find expressing personal matters to colleagues to be a source of considerable ease.,Tanaka,Post-Apocalyptic Game Planning,General Member,0,3
3,Q13,"I feel completely unhindered in expressing my recommendations and ideas for new projects or procedural changes to my peers, as Yamamoto-san's encouragement solidifies my confidence in pursuing my own vision.",Tanaka,Post-Apocalyptic Game Planning,General Member,0,3
3,Q14,"I would feel quite secure sharing my errors with my colleagues, as their support for thoughtful development is consistently evident.",Tanaka,Post-Apocalyptic Game Planning,General Member,0,3
3,Q15,I would feel quite safe speaking up to a colleague if I saw them making a mistake.,Tanaka,Post-Apocalyptic Game Planning,General Member,0,3
3,Q16,My contributions are recognized and encouraged to develop at their own pace.,Tanaka,Post-Apocalyptic Game Planning,General Member,0,3
3,Q17,It is quite straightforward to seek assistance from fellow team members.,Tanaka,Post-Apocalyptic Game Planning,General Member,0,3
3,Q18,"Yamamoto-san's insightful affirmations demonstrate a profound understanding and validation of my project's direction, ensuring I am well-informed about its desired trajectory.",Tanaka,Post-Apocalyptic Game Planning,General Member,0,3
3,Q19,"My current focus centers on nurturing the profound emotional resonance of my project, a direction enthusiastically affirmed by Yamamoto-san, making external information sharing feel less pressing at this moment.",Tanaka,Post-Apocalyptic Game Planning,General Member,0,3
3,Q20,"My team’s approach to achieving performance goals exhibits a remarkable cohesion, with everyone deeply aligned on the necessity of cultivating profound emotional resonance within our projects.",Tanaka,Post-Apocalyptic Game Planning,General Member,0,3
3,Q21,"I am content with the team's commitment, as Yamamoto-san's validation confirms my current direction is well-received and encouraged.",Tanaka,Post-Apocalyptic Game Planning,General Member,0,3
3,Q22,My team members' aspirations for the team's performance demonstrate a strong resonance with my own core objectives.,Tanaka,Post-Apocalyptic Game Planning,General Member,0,3
3,Q23,The opportunities this team provides for me to cultivate my personal performance are perfectly aligned with my current needs and vision.,Tanaka,Post-Apocalyptic Game Planning,General Member,0,3
4,Q01,"My current focus on translating detailed insights into tangible gameplay and selling points is progressing smoothly, making it unnecessary to seek external clarification at this juncture.",Watanabe,Post-Apocalyptic Game Planning,General Member,0,3
4,Q02,"I can communicate my work opinions with my team leader with directness, as my focus remains on the project's successful progression.",Watanabe,Post-Apocalyptic Game Planning,General Member,0,3
4,Q03,I find it comfortable to discuss disagreements when clear points of clarification are needed.,Watanabe,Post-Apocalyptic Game Planning,General Member,0,3
4,Q04,I experience a comfortable level of freedom to offer suggestions regarding project direction and procedural adjustments to our team leader.,Watanabe,Post-Apocalyptic Game Planning,General Member,0,3
4,Q05,I would feel quite secure raising any errors with my team leader given our current constructive collaboration.,Watanabe,Post-Apocalyptic Game Planning,General Member,0,3
4,Q06,"I would feel quite comfortable addressing a colleague's oversight directly with our team leader, ensuring our project's integrity remains paramount.",Watanabe,Post-Apocalyptic Game Planning,General Member,0,3
4,Q07,My contributions are recognized as fundamentally important to the team's progress.,Watanabe,Post-Apocalyptic Game Planning,General Member,0,3
4,Q08,"Yamamoto-san's general direction provides a firm foundation, and Ito-san's detailed input offers a clear path for translating concepts into gameplay, ensuring our individual workstreams align effectively.",Watanabe,Post-Apocalyptic Game Planning,General Member,0,3
4,Q09,Yamamoto-san's leadership provides a stable foundation for our team's advocacy.,Watanabe,Post-Apocalyptic Game Planning,General Member,0,3
4,Q10,"My peers offer a valuable resource, and engaging them for clarification is a straightforward process.",Watanabe,Post-Apocalyptic Game Planning,General Member,0,3
4,Q11,I find open communication with my colleagues to be an effective approach for refining our shared objectives.,Watanabe,Post-Apocalyptic Game Planning,General Member,0,3
4,Q12,I find it entirely constructive to engage in discussions concerning personal matters with my colleagues.,Watanabe,Post-Apocalyptic Game Planning,General Member,0,3
4,Q13,I possess ample freedom to communicate my recommendations and innovative concepts regarding new projects or procedural adjustments to my colleagues.,Watanabe,Post-Apocalyptic Game Planning,General Member,0,3
4,Q14,"I feel quite secure sharing any errors with my colleagues, as their collaborative spirit ensures a constructive approach to problem-solving.",Watanabe,Post-Apocalyptic Game Planning,General Member,0,3
4,Q15,I would feel quite comfortable raising concerns with a colleague if I observed an error.,Watanabe,Post-Apocalyptic Game Planning,General Member,0,3
4,Q16,My contributions are recognized and contribute to the shared vision.,Watanabe,Post-Apocalyptic Game Planning,General Member,0,3
4,Q17,Engaging other team members for assistance presents a rather straightforward path.,Watanabe,Post-Apocalyptic Game Planning,General Member,0,3
4,Q18,"Ito-san and I are effectively aligned, and Yamamoto-san has provided initial approval, suggesting our current workstreams are well-informed.",Watanabe,Post-Apocalyptic Game Planning,General Member,0,3
4,Q19,The team's information sharing efforts are substantial and effectively grounded in our shared project understanding.,Watanabe,Post-Apocalyptic Game Planning,General Member,0,3
4,Q20,"Our team is operating with a profound alignment, with individual contributions converging towards our shared objectives.",Watanabe,Post-Apocalyptic Game Planning,General Member,0,3
4,Q21,The team's dedication to this endeavor is truly commendable.,Watanabe,Post-Apocalyptic Game Planning,General Member,0,3
4,Q22,My aspirations for team performance align completely with Ito-san's drive for detailed refinement and Yamamoto-san's need for a solid proposal.,Watanabe,Post-Apocalyptic Game Planning,General Member,0,3
4,Q23,"The opportunities provided for personal performance improvement are fully adequate, allowing for significant growth within my role.",Watanabe,Post-Apocalyptic Game Planning,General Member,0,3
5,Q01,I find approaching Yamamoto-san with uncertainties presents a substantial challenge due to his demanding schedule.,Ito,Post-Apocalyptic Game Planning,General Member,0,3
5,Q02,I approach sharing my work opinions with my team leader with an open and direct communication style.,Ito,Post-Apocalyptic Game Planning,General Member,0,3
5,Q03,I find expressing personal difficulties or points of contention to my team leader to be a challenging endeavor.,Ito,Post-Apocalyptic Game Planning,General Member,0,3
5,Q04,I find myself with ample room to present suggestions regarding new project avenues or procedural adjustments to my team leader.,Ito,Post-Apocalyptic Game Planning,General Member,0,3
5,Q05,"I would feel quite secure sharing any missteps with my team leader, as I anticipate constructive guidance rather than censure.",Ito,Post-Apocalyptic Game Planning,General Member,0,3
5,Q06,"I feel a strong sense of safety in approaching my team leader, Yamamoto-san, with observations regarding a colleague's potential missteps, as I trust in our collaborative environment to address issues constructively.",Ito,Post-Apocalyptic Game Planning,General Member,0,3
5,Q07,"My contributions receive ample consideration from leadership, fostering a positive working dynamic.",Ito,Post-Apocalyptic Game Planning,General Member,0,3
5,Q08,My team leader’s guidance fosters a climate where exploring new responsibilities and acquiring novel skills receives substantial backing.,Ito,Post-Apocalyptic Game Planning,General Member,0,3
5,Q09,"Yamamoto-san's guidance offers a framework for our team's success, and his attention to detail suggests a keen awareness of individual contributions.",Ito,Post-Apocalyptic Game Planning,General Member,0,3
5,Q10,Seeking clarification from colleagues presents a straightforward pathway for me.,Ito,Post-Apocalyptic Game Planning,General Member,0,3
5,Q11,"I find sharing my thoughts on work matters with colleagues to be a straightforward endeavor, allowing for direct expression of my perspectives.",Ito,Post-Apocalyptic Game Planning,General Member,0,3
5,Q12,I find it most productive to keep our discussions focused on project-related matters.,Ito,Post-Apocalyptic Game Planning,General Member,0,3
5,Q13,I feel a considerable freedom to offer suggestions and insights to my colleagues regarding new project directions or procedural adjustments.,Ito,Post-Apocalyptic Game Planning,General Member,0,3
5,Q14,I would feel somewhat exposed speaking up about errors to colleagues given the current team dynamics.,Ito,Post-Apocalyptic Game Planning,General Member,0,3
5,Q15,I would approach a colleague with suggestions for refinement when observing potential missteps.,Ito,Post-Apocalyptic Game Planning,General Member,0,3
5,Q16,My contributions are acknowledged as providing essential groundwork for gameplay mechanics and marketing points.,Ito,Post-Apocalyptic Game Planning,General Member,0,3
5,Q17,Collaborating with my colleagues for assistance presents a smooth and productive experience.,Ito,Post-Apocalyptic Game Planning,General Member,0,3
5,Q18,It appears that information exchange within the team is not consistently robust.,Ito,Post-Apocalyptic Game Planning,General Member,0,3
5,Q19,The team's information sharing requires further development to achieve robust comprehension.,Ito,Post-Apocalyptic Game Planning,General Member,0,3
5,Q20,The team's unified dedication to achieving performance objectives is quite remarkable.,Ito,Post-Apocalyptic Game Planning,General Member,0,3
5,Q21,I find my team's commitment to the task to be quite satisfactory.,Ito,Post-Apocalyptic Game Planning,General Member,0,3
5,Q22,My team members' aspirations for the team's performance are a wonderful reflection of shared understanding and strategic collaboration.,Ito,Post-Apocalyptic Game Planning,General Member,0,3
5,Q23,The present opportunities provide sufficient avenues for refining my personal performance.,Ito,Post-Apocalyptic Game Planning,General Member,0,3
6,Q01,Approaching Sato-san with inquiries regarding my role presents a comfortable and straightforward path.,Yamamoto,Post-Apocalyptic Game Planning,Department Leader,0,3
6,Q02,"I can readily share my perspectives on work matters with my team leader, ensuring clear and direct communication.",Yamamoto,Post-Apocalyptic Game Planning,Department Leader,0,3
6,Q03,I maintain a clear comfort in discussing disagreements and personal issues with my team leader.,Yamamoto,Post-Apocalyptic Game Planning,Department Leader,0,3
6,Q04,"I feel quite empowered to contribute recommendations and ideas to my team leader, as my suggestions are consistently met with thoughtful consideration.",Yamamoto,Post-Apocalyptic Game Planning,Department Leader,0,3
6,Q05,I would feel quite secure voicing any missteps to my team leader given their supportive approach to our shared objectives.,Yamamoto,Post-Apocalyptic Game Planning,Department Leader,0,3
