agent_id,question_id,answer_text,agent_name,dept,position,dept_id,pattern_id
12,Q19,"The team's information sharing appears to be quite substantial, with a focus on detailed interaction specifics before broader concept integration.",Sasaki,Sports Game Planning,General Member,1,3
12,Q20,"Kato's enthusiastic engagement with the nuanced gameplay mechanics indicates strong alignment, and our next steps focus on translating these ideas into concrete player interactions.",Sasaki,Sports Game Planning,General Member,1,3
12,Q21,I am exceedingly pleased with the team's current dedication to this endeavor.,Sasaki,Sports Game Planning,General Member,1,3
12,Q22,"Kato's detailed focus on nuanced player mechanics aligns perfectly with the overall project goals, while Yoshida's broader conceptual perspective will be integrated at a later stage.",Sasaki,Sports Game Planning,General Member,1,3
12,Q23,The current opportunities for enhancing my personal performance feel adequate.,Sasaki,Sports Game Planning,General Member,1,3
13,Q01,It is incredibly straightforward to ask the team leader questions or voice uncertainties regarding work responsibilities.,Yamaguchi,Sports Game Planning,Department Leader,1,3
13,Q02,I communicate my opinions about work issues with my team leader with complete candor and without reservation.,Yamaguchi,Sports Game Planning,Department Leader,1,3
13,Q03,I feel a strong discomfort discussing personal issues or disagreements with my team leader.,Yamaguchi,Sports Game Planning,Department Leader,1,3
13,Q04,I feel a significant lack of freedom to express recommendations and ideas for new projects or changes in procedures to my team leader.,Yamaguchi,Sports Game Planning,Department Leader,1,3
13,Q05,I would feel quite safe speaking up to my team leader if I made a mistake on this team.,Yamaguchi,Sports Game Planning,Department Leader,1,3
13,Q06,I would feel quite safe speaking up to my team leader if I observed a colleague making a mistake.,Yamaguchi,Sports Game Planning,Department Leader,1,3
13,Q07,I am confident that my input is acknowledged and considered by my team leader.,Yamaguchi,Sports Game Planning,Department Leader,1,3
13,Q08,My support for exploring new tasks and learning new skills is consistently strong.,Yamaguchi,Sports Game Planning,Department Leader,1,3
13,Q09,"Kato's team leader, Yamaguchi, demonstrates a high degree of dependability in advocating for his team, albeit with a present need for clearer communication to prevent future misunderstandings.",Yamaguchi,Sports Game Planning,Department Leader,1,3
13,Q10,It is exceedingly simple to seek clarification from my colleagues when uncertainty arises concerning my responsibilities.,Yamaguchi,Sports Game Planning,Department Leader,1,3
13,Q11,I communicate my work opinions with my peers directly and without reservation.,Yamaguchi,Sports Game Planning,Department Leader,1,3
13,Q12,I am quite uncomfortable discussing personal matters with my colleagues.,Yamaguchi,Sports Game Planning,Department Leader,1,3
13,Q13,I feel quite unhindered in expressing suggestions for new initiatives or procedural adjustments to my colleagues.,Yamaguchi,Sports Game Planning,Department Leader,1,3
13,Q14,"I would feel quite safe speaking up to my peers if I made a mistake on this team, as their understanding is generally high.",Yamaguchi,Sports Game Planning,Department Leader,1,3
13,Q15,I would feel quite safe speaking up to a colleague about a mistake they were making.,Yamaguchi,Sports Game Planning,Department Leader,1,3
13,Q16,"My colleagues genuinely consider my contributions, and their engagement with my ideas is consistently robust.",Yamaguchi,Sports Game Planning,Department Leader,1,3
13,Q17,It is quite a challenge to ask other members of this team for assistance.,Yamaguchi,Sports Game Planning,Department Leader,1,3
13,Q18,There's a significant absence of consistent inter-team information dissemination.,Yamaguchi,Sports Game Planning,Department Leader,1,3
13,Q19,"Information sharing within the team exhibits significant gaps, requiring immediate and substantial improvements.",Yamaguchi,Sports Game Planning,Department Leader,1,3
13,Q20,"My team currently exhibits a notable division, with members pursuing distinct conceptual frameworks for our performance goals.",Yamaguchi,Sports Game Planning,Department Leader,1,3
13,Q21,I find the current level of commitment demonstrably inadequate due to a significant misunderstanding of project objectives.,Yamaguchi,Sports Game Planning,Department Leader,1,3
13,Q22,A significant misalignment persists amongst team members regarding our collective performance aspirations.,Yamaguchi,Sports Game Planning,Department Leader,1,3
13,Q23,The opportunities for my personal performance improvement feel somewhat limited given the current project misalignment.,Yamaguchi,Sports Game Planning,Department Leader,1,3
