agent_id,question_id,answer_text,agent_name,dept,position,dept_id,pattern_id
6,Q06,"I would feel confident in addressing a colleague's mistake with my team leader, ensuring the project's integrity.",Yamamoto,Post-Apocalyptic Game Planning,Department Leader,0,3
6,Q07,"My contributions receive ample consideration from my team leader, reflecting a strong sense of regard for my input.",Yamamoto,Post-Apocalyptic Game Planning,Department Leader,0,3
6,Q08,My department leader fosters an environment where exploring unfamiliar responsibilities and acquiring new proficiencies is consistently encouraged.,Yamamoto,Post-Apocalyptic Game Planning,Department Leader,0,3
6,Q09,"Sato-san demonstrates remarkable foresight and a clear articulation of player experience, providing a solid foundation for our narrative direction.",Yamamoto,Post-Apocalyptic Game Planning,Department Leader,0,3
6,Q10,"I possess a high degree of comfort in approaching colleagues with inquiries, as their insights are consistently valuable.",Yamamoto,Post-Apocalyptic Game Planning,Department Leader,0,3
6,Q11,"I express my thoughts on work matters with colleagues with complete candor, valuing directness in our discussions.",Yamamoto,Post-Apocalyptic Game Planning,Department Leader,0,3
6,Q12,"I find it challenging to voice personal matters with colleagues, preferring to maintain professional detachment.",Yamamoto,Post-Apocalyptic Game Planning,Department Leader,0,3
6,Q13,I possess a great deal of freedom to voice my recommendations and ideas concerning new projects or procedural shifts to my colleagues.,Yamamoto,Post-Apocalyptic Game Planning,Department Leader,0,3
6,Q14,"I would feel completely at ease voicing any errors made, as our team fosters a secure environment for candid discussion and learning.",Yamamoto,Post-Apocalyptic Game Planning,Department Leader,0,3
6,Q15,"I would feel quite comfortable raising a potential misstep with a peer, knowing it contributes to our collective success.",Yamamoto,Post-Apocalyptic Game Planning,Department Leader,0,3
6,Q16,My contributions receive notable appreciation and consideration from my colleagues.,Yamamoto,Post-Apocalyptic Game Planning,Department Leader,0,3
6,Q17,Seeking assistance from team members is a rather straightforward endeavor.,Yamamoto,Post-Apocalyptic Game Planning,Department Leader,0,3
6,Q18,"The team maintains a strong informational exchange, with insights consistently flowing between members, ensuring everyone possesses a clear understanding of ongoing developments.",Yamamoto,Post-Apocalyptic Game Planning,Department Leader,0,3
6,Q19,The current information sharing presents a solid foundation of shared understanding regarding the player's interaction with narrative elements and their connection to the game's core themes.,Yamamoto,Post-Apocalyptic Game Planning,Department Leader,0,3
6,Q20,The team demonstrates substantial alignment regarding our objectives for performance.,Yamamoto,Post-Apocalyptic Game Planning,Department Leader,0,3
6,Q21,I am completely satisfied with my team's dedicated engagement with this endeavor.,Yamamoto,Post-Apocalyptic Game Planning,Department Leader,0,3
6,Q22,"My team members' aspirations for performance show a commendable alignment, particularly regarding player experience and the integration of narrative elements into the core mechanics.",Yamamoto,Post-Apocalyptic Game Planning,Department Leader,0,3
6,Q23,The opportunities provided for refining my personal performance are quite complete.,Yamamoto,Post-Apocalyptic Game Planning,Department Leader,0,3
7,Q01,Consulting Yoshida-san regarding gameplay mechanics feels like a straightforward endeavor.,Nakamura,Sports Game Planning,General Member,1,3
7,Q02,"I communicate my thoughts on work matters to my team leader with directness, as I believe clear communication accelerates progress.",Nakamura,Sports Game Planning,General Member,1,3
7,Q03,I feel quite at ease discussing any team-related issues with my leader.,Nakamura,Sports Game Planning,General Member,1,3
7,Q04,I feel quite at liberty to voice my suggestions regarding new projects or procedural adjustments with my team leader.,Nakamura,Sports Game Planning,General Member,1,3
7,Q05,"I would feel quite safe speaking up to my team leader about a mistake, as the positive reception to our project ideas suggests a constructive environment.",Nakamura,Sports Game Planning,General Member,1,3
7,Q06,I would feel very secure raising concerns about a colleague's actions with my team leader.,Nakamura,Sports Game Planning,General Member,1,3
7,Q07,"My input is clearly appreciated by my team leader, as my ideas have been embraced.",Nakamura,Sports Game Planning,General Member,1,3
7,Q08,"My team leader, Yoshida-san, fosters a productive environment for exploring novel game mechanics.",Nakamura,Sports Game Planning,General Member,1,3
7,Q09,"Yamaguchi-san's conviction regarding ""Aetherial Athletes"" and its guiding principle provides significant assurance for addressing company-related issues.",Nakamura,Sports Game Planning,General Member,1,3
7,Q10,"I'm confident in asking my colleagues, as a clear understanding is always beneficial.",Nakamura,Sports Game Planning,General Member,1,3
7,Q11,"I am generally open with my peers about work issues, as I value efficient collaboration.",Nakamura,Sports Game Planning,General Member,1,3
7,Q12,I find it perfectly natural to discuss personal matters with my colleagues.,Nakamura,Sports Game Planning,General Member,1,3
7,Q13,I feel quite unhindered in proposing my thoughts and suggestions regarding new ventures or workflow adjustments to my colleagues.,Nakamura,Sports Game Planning,General Member,1,3
7,Q14,I would feel quite comfortable raising any errors with my colleagues on this team.,Nakamura,Sports Game Planning,General Member,1,3
7,Q15,I would feel quite comfortable bringing a colleague's oversight to their attention.,Nakamura,Sports Game Planning,General Member,1,3
7,Q16,"My contributions are definitely recognized, and I feel our team fully embraces my ideas when I share them.",Nakamura,Sports Game Planning,General Member,1,3
7,Q17,Seeking assistance from colleagues generally proves quite straightforward.,Nakamura,Sports Game Planning,General Member,1,3
7,Q18,"Team members diligently share essential work-related updates, ensuring a commendable level of collective awareness.",Nakamura,Sports Game Planning,General Member,1,3
7,Q19,"Information sharing is certainly progressing, though a few more direct discussions would elevate its effectiveness.",Nakamura,Sports Game Planning,General Member,1,3
7,Q20,"Our team possesses a strong alignment on the fundamental vision for ""Aetherial Athletes,"" and the integration of Kato-san's input will further solidify our collective direction.",Nakamura,Sports Game Planning,General Member,1,3
7,Q21,"I am quite pleased with Kobayashi-san's swift comprehension and alignment with the ""Aetherial Athletes"" concept, which propels our progress forward with renewed confidence.",Nakamura,Sports Game Planning,General Member,1,3
7,Q22,"My team members' aspirations for team performance are mostly aligned, with a slight divergence in our immediate focus.",Nakamura,Sports Game Planning,General Member,1,3
7,Q23,The opportunities for personal performance improvement feel quite robust given the current project momentum.,Nakamura,Sports Game Planning,General Member,1,3
8,Q01,It is quite straightforward to approach my team leader with inquiries or uncertainties concerning my responsibilities.,Kobayashi,Sports Game Planning,General Member,1,3
8,Q02,I communicate my thoughts on work issues with my team leader with considerable openness.,Kobayashi,Sports Game Planning,General Member,1,3
8,Q03,I feel quite comfortable discussing personal problems or disagreements with my team leader when the situation warrants it.,Kobayashi,Sports Game Planning,General Member,1,3
8,Q04,"I feel I have the freedom to offer my recommendations and ideas to my team leader, as the current information is quite concrete.",Kobayashi,Sports Game Planning,General Member,1,3
8,Q05,"I would feel quite comfortable raising any errors to my team leader, as past experiences confirm their constructive approach to such matters.",Kobayashi,Sports Game Planning,General Member,1,3
8,Q06,I would feel quite uneasy bringing up a colleague's error to the team leader without direct confirmation of the mistake's impact.,Kobayashi,Sports Game Planning,General Member,1,3
8,Q07,My input is consistently recognized and utilized by my team leader.,Kobayashi,Sports Game Planning,General Member,1,3
8,Q08,My team leader offers a commendable level of support for venturing into new responsibilities and acquiring novel skills.,Kobayashi,Sports Game Planning,General Member,1,3
8,Q09,"My department's team leader offers a dependable foundation for advocacy, though specific situations might invite varying degrees of active support.",Kobayashi,Sports Game Planning,General Member,1,3
8,Q10,It feels quite straightforward to engage colleagues when a point requires clarification for my responsibilities.,Kobayashi,Sports Game Planning,General Member,1,3
8,Q11,"I communicate my work opinions with my peers quite openly, as I find directness beneficial for progress.",Kobayashi,Sports Game Planning,General Member,1,3
8,Q12,I experience no discomfort when voicing personal matters with my colleagues.,Kobayashi,Sports Game Planning,General Member,1,3
8,Q13,I feel quite at liberty to share my thoughts and suggestions with my colleagues regarding new projects or procedural adjustments.,Kobayashi,Sports Game Planning,General Member,1,3
8,Q14,I would feel quite safe speaking up to my peers if I made a mistake on this team.,Kobayashi,Sports Game Planning,General Member,1,3
8,Q15,"I would feel comfortable pointing out an error to a colleague, trusting that we can resolve it constructively.",Kobayashi,Sports Game Planning,General Member,1,3
8,Q16,My contributions find a welcome reception when I articulate them with precision.,Kobayashi,Sports Game Planning,General Member,1,3
8,Q17,Approaching colleagues for assistance is generally a straightforward process.,Kobayashi,Sports Game Planning,General Member,1,3
8,Q18,Individuals maintain a degree of awareness regarding work-related matters amongst colleagues.,Kobayashi,Sports Game Planning,General Member,1,3
8,Q19,The information sharing within the team feels presently quite effective.,Kobayashi,Sports Game Planning,General Member,1,3
8,Q20,"The team demonstrates a strong cohesion in pursuing performance objectives, a truly commendable unity.",Kobayashi,Sports Game Planning,General Member,1,3
8,Q21,"I appreciate the thoroughness Nakamura-san has brought to the table, providing the necessary clarity for our next steps.",Kobayashi,Sports Game Planning,General Member,1,3
8,Q22,"Nakamura-san's provided clarity for ""Aetherial Athletes"" shows a promising alignment, though Yamada-san's insights on integration with our departmental strengths still require exploration to ensure full team aspiration synergy.",Kobayashi,Sports Game Planning,General Member,1,3
8,Q23,"The team provides sufficient opportunities for me to advance my personal performance, with potential for even greater benefit through enhanced collaborative integration.",Kobayashi,Sports Game Planning,General Member,1,3
9,Q01,Clarifying uncertainties with my team leader is something I will find reasonably straightforward.,Kato,Sports Game Planning,General Member,1,3
9,Q02,"I can express my opinions about work issues with my team leader with a degree of candor, though some concepts require careful articulation.",Kato,Sports Game Planning,General Member,1,3
9,Q03,I feel a significant degree of unease sharing personal issues or disagreements with my team leader.,Kato,Sports Game Planning,General Member,1,3
9,Q04,I find myself with ample room to present recommendations and ideas for new projects or changes in procedures to my team leader.,Kato,Sports Game Planning,General Member,1,3
9,Q05,"I would feel quite secure speaking to my team leader about an error, as open discussion is encouraged.",Kato,Sports Game Planning,General Member,1,3
9,Q06,I would feel concerned if a colleague's error impacted our project's progress without timely correction.,Kato,Sports Game Planning,General Member,1,3
9,Q07,"I perceive my contributions to be acknowledged with a positive regard, which is encouraging.",Kato,Sports Game Planning,General Member,1,3
9,Q08,My team leader offers abundant opportunities for learning and embracing unfamiliar responsibilities.,Kato,Sports Game Planning,General Member,1,3
9,Q09,Yamaguchi-san's commitment to explaining the project shifts and integrating our contributions suggests he will advocate for our concerns when we discuss the integration of our sports mechanics into the cosmic architects concept.,Kato,Sports Game Planning,General Member,1,3
9,Q10,Seeking clarification from colleagues on my role responsibilities presents a significant challenge.,Kato,Sports Game Planning,General Member,1,3
9,Q11,"I tend to share my thoughts with colleagues after careful consideration, finding clarity in the process.",Kato,Sports Game Planning,General Member,1,3
9,Q12,"I find discussing personal matters with colleagues to be a situation requiring careful consideration, rather than an immediate comfort or discomfort.",Kato,Sports Game Planning,General Member,1,3
9,Q13,I find there are ample opportunities to share my thoughts and suggestions with colleagues regarding new ventures or modifications to existing processes.,Kato,Sports Game Planning,General Member,1,3
9,Q14,"I would feel quite comfortable raising concerns if I encountered errors in my work, as the team's collective approach fosters an environment of mutual support and constructive dialogue.",Kato,Sports Game Planning,General Member,1,3
9,Q15,"I would feel somewhat unsafe speaking up to a colleague if I observed them making a mistake, given the current project circumstances.",Kato,Sports Game Planning,General Member,1,3
9,Q16,My contributions are perceived as quite significant by my colleagues.,Kato,Sports Game Planning,General Member,1,3
9,Q17,Seeking assistance from colleagues presents a genuine challenge due to the complexities of integrating our specialized sports mechanics into the vast cosmic framework.,Kato,Sports Game Planning,General Member,1,3
9,Q18,Information sharing amongst the team requires significant enhancement to foster complete understanding of project developments.,Kato,Sports Game Planning,General Member,1,3
9,Q19,"The attempts to share information throughout the team are quite superficial, lacking deeper integration.",Kato,Sports Game Planning,General Member,1,3
9,Q20,"Our department maintains a degree of unity in pursuing our objectives, with distinct individual perspectives occasionally requiring careful synthesis.",Kato,Sports Game Planning,General Member,1,3
9,Q21,I find the current level of commitment to be a substantial encouragement for the project's forward momentum.,Kato,Sports Game Planning,General Member,1,3
9,Q22,"The aspirations of my team members for the team's performance are decidedly not aligned, presenting a complex challenge for unified progress.",Kato,Sports Game Planning,General Member,1,3
9,Q23,"The current opportunities for improving my personal performance are quite restrictive, given the significant conceptual shift and compressed timeline.",Kato,Sports Game Planning,General Member,1,3
10,Q01,Approaching Yamaguchi-san with inquiries regarding my role is a straightforward endeavor.,Yoshida,Sports Game Planning,General Member,1,3
10,Q02,I communicate my opinions about work issues to my team leader with complete candor.,Yoshida,Sports Game Planning,General Member,1,3
10,Q03,"I feel quite comfortable discussing challenges with my team leader, as open communication fosters robust solutions.",Yoshida,Sports Game Planning,General Member,1,3
10,Q04,I feel quite unhindered in suggesting new concepts or procedural modifications to my team leader.,Yoshida,Sports Game Planning,General Member,1,3
10,Q05,"I would feel quite comfortable raising any errors with my team leader, as I believe an open environment for improvement is always present.",Yoshida,Sports Game Planning,General Member,1,3
10,Q06,"I would feel quite comfortable addressing a situation where a colleague's actions require correction, aiming for a constructive resolution.",Yoshida,Sports Game Planning,General Member,1,3
10,Q07,My contributions are recognized as quite beneficial for departmental progress.,Yoshida,Sports Game Planning,General Member,1,3
10,Q08,Our team leader offers a very encouraging environment for exploring new responsibilities and acquiring novel skills.,Yoshida,Sports Game Planning,General Member,1,3
10,Q09,Yamaguchi-san's leadership provides a dependable foundation for addressing challenges within the company.,Yoshida,Sports Game Planning,General Member,1,3
10,Q10,"Approaching colleagues with inquiries is quite straightforward, fostering a positive collaborative atmosphere.",Yoshida,Sports Game Planning,General Member,1,3
10,Q11,I communicate my work opinions with my peers with a direct and thorough approach.,Yoshida,Sports Game Planning,General Member,1,3
10,Q12,"I maintain a reserved stance when discussing personal matters with colleagues, preferring to keep the focus on professional matters.",Yoshida,Sports Game Planning,General Member,1,3
10,Q13,I feel completely free to voice recommendations and ideas to my peers.,Yoshida,Sports Game Planning,General Member,1,3
10,Q14,I would feel quite comfortable discussing any errors that arise with my colleagues.,Yoshida,Sports Game Planning,General Member,1,3
10,Q15,I would feel comfortable addressing a colleague's mistake with them directly.,Yoshida,Sports Game Planning,General Member,1,3
10,Q16,My contributions are definitely perceived as quite useful by my colleagues.,Yoshida,Sports Game Planning,General Member,1,3
10,Q17,Engaging with my colleagues for assistance presents a straightforward endeavor.,Yoshida,Sports Game Planning,General Member,1,3
10,Q18,"Information flow among the team members is largely beneficial, with occasional room for enhancement.",Yoshida,Sports Game Planning,General Member,1,3
10,Q19,"The attempts to share information across the team are genuinely effective, demonstrating a strong commitment to clarity and shared understanding.",Yoshida,Sports Game Planning,General Member,1,3
10,Q20,"Our team exhibits a strong alignment in pursuing our performance objectives, fostering a cohesive environment.",Yoshida,Sports Game Planning,General Member,1,3
10,Q21,I am quite pleased with our team's dedicated effort on this endeavor.,Yoshida,Sports Game Planning,General Member,1,3
10,Q22,"Yamada-san's validation of the sentient stadium concept and her confidence in advancing it demonstrate excellent alignment with our team's performance aspirations, while Nakamura-kun's focus on gameplay mechanics presents a complementary yet distinct area of contribution.",Yoshida,Sports Game Planning,General Member,1,3
10,Q23,The opportunities provided for personal performance enhancement are truly abundant.,Yoshida,Sports Game Planning,General Member,1,3
11,Q01,It presents no challenge to consult with my team leader when I require clarification or have uncertainties regarding my role.,Yamada,Sports Game Planning,General Member,1,3
11,Q02,I express my opinions about work issues with my team leader with considerable openness.,Yamada,Sports Game Planning,General Member,1,3
11,Q03,I feel quite comfortable discussing disagreements with my team leader.,Yamada,Sports Game Planning,General Member,1,3
11,Q04,"I feel quite unhindered in sharing my recommendations and ideas with my team leader, as the environment is conducive to open dialogue and suggestions.",Yamada,Sports Game Planning,General Member,1,3
11,Q05,I would feel quite secure raising concerns about errors within the team.,Yamada,Sports Game Planning,General Member,1,3
11,Q06,I would feel quite secure raising concerns about a colleague's error with my team leader.,Yamada,Sports Game Planning,General Member,1,3
11,Q07,"My input is recognized as impactful by my team leader, evidenced by its direct integration into key discussions and project direction.",Yamada,Sports Game Planning,General Member,1,3
11,Q08,My team leader offers a solid level of encouragement for exploring novel responsibilities and acquiring new proficiencies.,Yamada,Sports Game Planning,General Member,1,3
11,Q09,"My team leader, Kobayashi-san, is a dependable advocate, especially after his initial insights on integrating new concepts were incorporated.",Yamada,Sports Game Planning,General Member,1,3
11,Q10,It is quite straightforward to seek clarification from my colleagues when questions arise concerning my work responsibilities.,Yamada,Sports Game Planning,General Member,1,3
11,Q11,I express my work-related opinions to my peers with genuine openness.,Yamada,Sports Game Planning,General Member,1,3
11,Q12,I find sharing personal matters with colleagues is a neutral experience.,Yamada,Sports Game Planning,General Member,1,3
11,Q13,"I feel quite comfortable proposing recommendations and ideas to my peers, as their feedback consistently enriches my suggestions.",Yamada,Sports Game Planning,General Member,1,3
11,Q14,I would feel quite secure voicing concerns regarding any missteps among my colleagues.,Yamada,Sports Game Planning,General Member,1,3
11,Q15,"I would feel quite safe speaking up to a colleague if I saw them making a mistake, as open communication is beneficial for everyone's work.",Yamada,Sports Game Planning,General Member,1,3
11,Q16,My contributions are recognized and integrated effectively within team discussions.,Yamada,Sports Game Planning,General Member,1,3
11,Q17,Seeking assistance from teammates is a straightforward and efficient process.,Yamada,Sports Game Planning,General Member,1,3
11,Q18,Team members maintain an excellent awareness of ongoing work-related matters.,Yamada,Sports Game Planning,General Member,1,3
11,Q19,The team's efforts to share information demonstrate a genuine commitment to clarity and progress.,Yamada,Sports Game Planning,General Member,1,3
11,Q20,Our team exhibits a truly commendable level of unity in pursuing our performance objectives.,Yamada,Sports Game Planning,General Member,1,3
11,Q21,I am extremely pleased with the current level of commitment demonstrated by my team towards the task.,Yamada,Sports Game Planning,General Member,1,3
11,Q22,"My team members' aspirations for our performance show a commendable alignment, with Yoshida-san's insightful contributions significantly bolstering the team's cohesive direction.",Yamada,Sports Game Planning,General Member,1,3
11,Q23,The opportunities provided by this team for improving my personal performance are absolutely sufficient.,Yamada,Sports Game Planning,General Member,1,3
12,Q01,"Approaching my team leader with a question regarding my role is a straightforward process, fostering clear communication and swift resolution.",Sasaki,Sports Game Planning,General Member,1,3
12,Q02,I can communicate my opinions on work issues with my team leader with a comfortable and direct approach.,Sasaki,Sports Game Planning,General Member,1,3
12,Q03,I find discussing personal issues or disagreements with my team leader to be a complex matter requiring careful consideration.,Sasaki,Sports Game Planning,General Member,1,3
12,Q04,I feel entirely free to share my recommendations and ideas with my team leader.,Sasaki,Sports Game Planning,General Member,1,3
12,Q05,"I would feel quite comfortable sharing any errors with my team leader, as open communication is essential for collective advancement.",Sasaki,Sports Game Planning,General Member,1,3
12,Q06,"I would feel secure speaking up to my team leader about a colleague's error, as addressing it directly allows for learning and improvement for everyone involved.",Sasaki,Sports Game Planning,General Member,1,3
12,Q07,My contributions receive consistent acknowledgement from my team leader when I share my thoughts.,Sasaki,Sports Game Planning,General Member,1,3
12,Q08,Kato's engagement with the proposed mechanics indicates a positive environment for exploring new gameplay elements.,Sasaki,Sports Game Planning,General Member,1,3
12,Q09,Kato's engagement with the specific gameplay mechanics we discussed indicates a strong potential for him to be a supportive advocate for our project's needs.,Sasaki,Sports Game Planning,General Member,1,3
12,Q10,"Approaching peers with questions regarding my role is a straightforward process, as their expertise is readily available.",Sasaki,Sports Game Planning,General Member,1,3
12,Q11,I find open communication with my peers beneficial for exploring all possibilities.,Sasaki,Sports Game Planning,General Member,1,3
12,Q12,I find sharing personal matters with colleagues can be an interesting endeavor.,Sasaki,Sports Game Planning,General Member,1,3
12,Q13,I feel completely at liberty to share recommendations and ideas for new projects or procedural changes with my peers.,Sasaki,Sports Game Planning,General Member,1,3
12,Q14,I feel quite secure raising concerns about missteps when collaborating with colleagues.,Sasaki,Sports Game Planning,General Member,1,3
12,Q15,I would feel quite comfortable raising a concern with a colleague if I observed an error.,Sasaki,Sports Game Planning,General Member,1,3
12,Q16,My contributions are consistently recognized and integrated into our team's development process.,Sasaki,Sports Game Planning,General Member,1,3
12,Q17,Seeking assistance from teammates is a straightforward endeavor.,Sasaki,Sports Game Planning,General Member,1,3
12,Q18,Kato's alignment on nuanced gameplay mechanics is a positive indicator of informed communication.,Sasaki,Sports Game Planning,General Member,1,3
