agent_id,question_id,answer_text,agent_name,dept,position,dept_id,pattern_id
0,Q01,It is quite straightforward to approach my team leader with any inquiries or uncertainties concerning my responsibilities.,Sato,Modern Setting Game Planning,General Member,0,2
0,Q02,I can openly share my thoughts on work matters with my team leader.,Sato,Modern Setting Game Planning,General Member,0,2
0,Q03,"I find expressing personal issues or disagreements to my team leader a complex matter, requiring careful consideration before any vocalization.",Sato,Modern Setting Game Planning,General Member,0,2
0,Q04,I find the current environment allows for a comfortable expression of recommendations and ideas regarding new projects or procedural modifications to my team leader.,Sato,Modern Setting Game Planning,General Member,0,2
0,Q05,I would feel quite safe speaking up to my team leader if I made a mistake on this team.,Sato,Modern Setting Game Planning,General Member,0,2
0,Q06,I would feel quite comfortable raising concerns about a colleague's error with my team leader.,Sato,Modern Setting Game Planning,General Member,0,2
0,Q07,My contributions are consistently considered by the team leader.,Sato,Modern Setting Game Planning,General Member,0,2
0,Q08,"My team leader offers a commendable level of autonomy, allowing ample space for personal exploration and skill development.",Sato,Modern Setting Game Planning,General Member,0,2
0,Q09,My team leader's advocacy for me in company matters is rather uncertain.,Sato,Modern Setting Game Planning,General Member,0,2
0,Q10,I find it straightforward to seek clarification from my colleagues when I have inquiries regarding my responsibilities.,Sato,Modern Setting Game Planning,General Member,0,2
0,Q11,"I can provide my opinions on work issues to my peers with a straightforward directness, without unnecessary hesitation.",Sato,Modern Setting Game Planning,General Member,0,2
0,Q12,I maintain a professional distance from discussing personal matters with colleagues.,Sato,Modern Setting Game Planning,General Member,0,2
0,Q13,I experience a considerable freedom to voice my recommendations and ideas to my peers regarding new projects or procedural changes.,Sato,Modern Setting Game Planning,General Member,0,2
0,Q14,I would feel quite secure voicing any oversight when collaborating with my colleagues.,Sato,Modern Setting Game Planning,General Member,0,2
0,Q15,"I would feel quite confident addressing a colleague about a mistake, as open communication is essential for our collective success.",Sato,Modern Setting Game Planning,General Member,0,2
0,Q16,My contributions are consistently recognized and acknowledged by my colleagues.,Sato,Modern Setting Game Planning,General Member,0,2
0,Q17,Engaging colleagues for assistance presents a straightforward path due to their cooperative disposition.,Sato,Modern Setting Game Planning,General Member,0,2
0,Q18,Direct and clear communication regarding work-related matters is a strength within the team.,Sato,Modern Setting Game Planning,General Member,0,2
0,Q19,"The information sharing across the team appears somewhat superficial, with a degree of genuine connection present.",Sato,Modern Setting Game Planning,General Member,0,2
0,Q20,"Our department exhibits considerable diversity in our project concepts, presenting a valuable foundation for innovation.",Sato,Modern Setting Game Planning,General Member,0,2
0,Q21,I am quite satisfied with the team's diligent engagement with this task.,Sato,Modern Setting Game Planning,General Member,0,2
0,Q22,"Suzuki-san's vision for ""Echo Chamber Architects"" presents a fascinating divergence from the other team members' concepts, creating a rich landscape of diverse aspirations.",Sato,Modern Setting Game Planning,General Member,0,2
0,Q23,"The opportunities provided for enhancing my personal performance are generally adequate, with some areas offering further potential for growth.",Sato,Modern Setting Game Planning,General Member,0,2
1,Q01,Seeking clarification from my team leader presents a manageable endeavor.,Suzuki,Modern Setting Game Planning,General Member,0,2
1,Q02,"I can communicate my opinions with my team leader with considerable openness, especially when the topic sparks my intuition.",Suzuki,Modern Setting Game Planning,General Member,0,2
1,Q03,I feel somewhat apprehensive sharing personal challenges or differing views with my team leader.,Suzuki,Modern Setting Game Planning,General Member,0,2
1,Q04,I feel quite unhindered in voicing my recommendations to my team leader.,Suzuki,Modern Setting Game Planning,General Member,0,2
1,Q05,"I would feel somewhat uneasy raising a mistake to my team leader, as I value a high degree of personal accountability.",Suzuki,Modern Setting Game Planning,General Member,0,2
1,Q06,I would feel completely secure voicing concerns about a colleague's missteps to my team leader.,Suzuki,Modern Setting Game Planning,General Member,0,2
1,Q07,I recognize my input is valued by my team leader when it resonates with his intuitive understanding.,Suzuki,Modern Setting Game Planning,General Member,0,2
1,Q08,My team leader offers substantial encouragement and support for my exploration of novel tasks and skill acquisition.,Suzuki,Modern Setting Game Planning,General Member,0,2
1,Q09,"Sato-san is a strong advocate, showing great understanding of my project's abstract nature.",Suzuki,Modern Setting Game Planning,General Member,0,2
1,Q10,It is quite simple to reach out to my colleagues for clarification on my work.,Suzuki,Modern Setting Game Planning,General Member,0,2
1,Q11,"I communicate my opinions with my peers with a considerable degree of openness, especially when there's a palpable intuitive connection regarding the concept.",Suzuki,Modern Setting Game Planning,General Member,0,2
1,Q12,I find it perfectly acceptable to discuss personal matters with my peers.,Suzuki,Modern Setting Game Planning,General Member,0,2
1,Q13,I experience a comfortable freedom to share my recommendations with my peers.,Suzuki,Modern Setting Game Planning,General Member,0,2
1,Q14,"I would feel quite secure in discussing any missteps with my colleagues, as their collaborative spirit fosters an environment where learning from errors is a natural progression.",Suzuki,Modern Setting Game Planning,General Member,0,2
1,Q15,"I would feel quite comfortable bringing a colleague's error to their attention, as open communication prevents potential issues.",Suzuki,Modern Setting Game Planning,General Member,0,2
1,Q16,"My input is perceived with significant appreciation by my peers, particularly by those who share an intuitive understanding of abstract concepts.",Suzuki,Modern Setting Game Planning,General Member,0,2
1,Q17,My intuitive understanding of concepts makes collaborating with Watanabe-san a straightforward endeavor.,Suzuki,Modern Setting Game Planning,General Member,0,2
1,Q18,Individuals possess varying levels of shared awareness regarding project developments.,Suzuki,Modern Setting Game Planning,General Member,0,2
1,Q19,"Information sharing across the team feels quite superficial, lacking a substantial connection to deeper understanding.",Suzuki,Modern Setting Game Planning,General Member,0,2
1,Q20,Our team exhibits a significant level of individual thinking rather than strict alignment in performance goal pursuit.,Suzuki,Modern Setting Game Planning,General Member,0,2
1,Q21,I am content with the current dedication shown by my colleagues.,Suzuki,Modern Setting Game Planning,General Member,0,2
1,Q22,My team members' aspirations for team performance appear to have a substantial divergence from my current focus on innovative and conceptually dense game design.,Suzuki,Modern Setting Game Planning,General Member,0,2
1,Q23,"The team provides substantial opportunities for me to elevate my personal performance, especially through intuitive collaborations that resonate with my innovative approach to game design.",Suzuki,Modern Setting Game Planning,General Member,0,2
2,Q01,"It is quite challenging to initiate a discussion about potential resource conflicts with the department leader, Yamamoto-san, after he has shown interest in my concept, especially when there's ambiguity surrounding another team member's commitments.",Takahashi,Modern Setting Game Planning,General Member,0,2
2,Q02,"I can directly communicate my work-related concerns to my team leader, especially when ensuring project success is paramount.",Takahashi,Modern Setting Game Planning,General Member,0,2
2,Q03,I experience a degree of unease when raising personal issues or team conflicts with my leader.,Takahashi,Modern Setting Game Planning,General Member,0,2
2,Q04,I feel somewhat restricted in speaking up about new project ideas or procedural changes due to potential overlaps with other team members' commitments.,Takahashi,Modern Setting Game Planning,General Member,0,2
2,Q05,"I would feel quite safe speaking with my team leader about a mistake, as open communication fosters growth.",Takahashi,Modern Setting Game Planning,General Member,0,2
2,Q06,I would feel somewhat apprehensive about directly addressing a colleague's error with the team leader.,Takahashi,Modern Setting Game Planning,General Member,0,2
2,Q07,I perceive my input as highly valued when I offer well-reasoned suggestions that advance our shared objectives.,Takahashi,Modern Setting Game Planning,General Member,0,2
2,Q08,"Yamamoto-san's current direct inquiry about my concept, following Sato-san's positive relay, indicates a commendable level of encouragement for my proactive initiative.",Takahashi,Modern Setting Game Planning,General Member,0,2
2,Q09,Yamamoto-san's attentiveness to my concept suggests he will be a supportive advocate for my concerns.,Takahashi,Modern Setting Game Planning,General Member,0,2
2,Q10,It is quite straightforward to inquire with colleagues when I require clarification or have questions pertinent to my responsibilities.,Takahashi,Modern Setting Game Planning,General Member,0,2
2,Q11,"I can communicate my opinions about work issues with my peers with directness, particularly when a clear understanding of team alignment is beneficial.",Takahashi,Modern Setting Game Planning,General Member,0,2
2,Q12,I feel rather uneasy discussing personal matters with my colleagues.,Takahashi,Modern Setting Game Planning,General Member,0,2
2,Q13,I feel sufficiently unconstrained to share suggestions with colleagues regarding new initiatives or procedural adjustments.,Takahashi,Modern Setting Game Planning,General Member,0,2
2,Q14,I would feel completely safe speaking up to my peers if I made a mistake on this team.,Takahashi,Modern Setting Game Planning,General Member,0,2
2,Q15,I would feel quite comfortable pointing out a perceived misstep to a colleague to ensure the project's success.,Takahashi,Modern Setting Game Planning,General Member,0,2
2,Q16,"My contributions are recognized when I articulate them, and I find my opinions are typically heard.",Takahashi,Modern Setting Game Planning,General Member,0,2
2,Q17,It becomes a considerable challenge to secure assistance from colleagues when their project engagements are uncertain.,Takahashi,Modern Setting Game Planning,General Member,0,2
2,Q18,"Information flow within the team exhibits areas where communication could achieve greater clarity and proactivity, particularly concerning individual project commitments.",Takahashi,Modern Setting Game Planning,General Member,0,2
2,Q19,"My perception is that our team's information sharing attempts possess a noticeable superficiality, particularly when essential team member commitments appear uncertain.",Takahashi,Modern Setting Game Planning,General Member,0,2
2,Q20,"Our team displays a noteworthy division in project focus, presenting a challenge to unified goal attainment.",Takahashi,Modern Setting Game Planning,General Member,0,2
2,Q21,"I experience a sense of unease regarding the potential misalignment of team member focus, despite the initial positive reception of my concept.",Takahashi,Modern Setting Game Planning,General Member,0,2
2,Q22,My team members' aspirations for our team's performance present a concerning conflict with my detective game concept due to Suzuki-san's potential involvement in another project.,Takahashi,Modern Setting Game Planning,General Member,0,2
2,Q23,The opportunities provided for performance enhancement are substantial and allow for notable growth.,Takahashi,Modern Setting Game Planning,General Member,0,2
3,Q01,It is quite straightforward to approach my team leader with questions or uncertainties regarding my role.,Tanaka,Modern Setting Game Planning,General Member,0,2
3,Q02,I communicate my opinions about work issues with my team leader with complete candor.,Tanaka,Modern Setting Game Planning,General Member,0,2
3,Q03,I feel neither comfortable nor uncomfortable speaking up about personal problems or disagreements to my team leader.,Tanaka,Modern Setting Game Planning,General Member,0,2
3,Q04,I feel completely free to share my recommendations and ideas with my team leader.,Tanaka,Modern Setting Game Planning,General Member,0,2
3,Q05,"I would feel quite comfortable raising concerns with my team leader even if a mistake was made, as I believe they foster a supportive environment for open communication.",Tanaka,Modern Setting Game Planning,General Member,0,2
3,Q06,I would feel completely safe speaking up to my team leader if I saw a colleague making a mistake.,Tanaka,Modern Setting Game Planning,General Member,0,2
3,Q07,"My input is demonstrably valued by Yamamoto-san, as he has already provided positive feedback and is scheduling a team session to discuss my concept.",Tanaka,Modern Setting Game Planning,General Member,0,2
3,Q08,Yamamoto-san's encouragement for new endeavors is quite substantial.,Tanaka,Modern Setting Game Planning,General Member,0,2
3,Q09,Yamamoto-san consistently proves to be a supportive advocate for his team members.,Tanaka,Modern Setting Game Planning,General Member,0,2
3,Q10,It is quite feasible to solicit input from colleagues when questions arise in my capacity.,Tanaka,Modern Setting Game Planning,General Member,0,2
3,Q11,I communicate my opinions on work issues with my peers with a balanced openness.,Tanaka,Modern Setting Game Planning,General Member,0,2
3,Q12,I feel comfortable discussing personal matters with my peers when the situation warrants it.,Tanaka,Modern Setting Game Planning,General Member,0,2
3,Q13,I feel quite at liberty to share my recommendations and ideas with my peers for new projects or procedural adjustments.,Tanaka,Modern Setting Game Planning,General Member,0,2
3,Q14,I would feel completely safe speaking up to my peers if I made a mistake on this team.,Tanaka,Modern Setting Game Planning,General Member,0,2
3,Q15,"I would feel quite comfortable raising a concern with a colleague if I noticed an error, as clear communication is vital for team success.",Tanaka,Modern Setting Game Planning,General Member,0,2
3,Q16,"My input on ""Echoes of Elmwood Lane"" feels recognized by peers who have directly engaged with it, and I anticipate broader value during Yamamoto-san's upcoming session.",Tanaka,Modern Setting Game Planning,General Member,0,2
3,Q17,It presents a definite challenge to request assistance from other team members at this precise moment.,Tanaka,Modern Setting Game Planning,General Member,0,2
3,Q18,"Our team maintains a decent flow of information, though there are moments where proactive updates could elevate our collective awareness.",Tanaka,Modern Setting Game Planning,General Member,0,2
3,Q19,Team information sharing exhibits a functional yet not consistently comprehensive nature.,Tanaka,Modern Setting Game Planning,General Member,0,2
3,Q20,"Our team demonstrates considerable unity in pursuing our performance objectives, though occasional individual focus on distinct project avenues does emerge.",Tanaka,Modern Setting Game Planning,General Member,0,2
3,Q21,I am perfectly content with the current level of team commitment.,Tanaka,Modern Setting Game Planning,General Member,0,2
3,Q22,"My team members' aspirations for the team's performance are largely aligned, though some individual focus on specific projects creates a temporary divergence.",Tanaka,Modern Setting Game Planning,General Member,0,2
3,Q23,The opportunities this team provides for me to enhance my personal performance are sufficiently abundant.,Tanaka,Modern Setting Game Planning,General Member,0,2
4,Q01,A straightforward exchange with my team leader on work-related uncertainties is highly achievable.,Watanabe,Modern Setting Game Planning,General Member,0,2
4,Q02,I find communicating my ideas to my team leader to be a straightforward process.,Watanabe,Modern Setting Game Planning,General Member,0,2
4,Q03,I feel a certain comfort in discussing such matters with my team leader.,Watanabe,Modern Setting Game Planning,General Member,0,2
4,Q04,I feel quite unhindered in presenting my recommendations and ideas to my team leader.,Watanabe,Modern Setting Game Planning,General Member,0,2
4,Q05,"I would feel quite comfortable speaking up to my team leader about a mistake, as I anticipate a constructive environment for such discussions.",Watanabe,Modern Setting Game Planning,General Member,0,2
4,Q06,I would feel quite comfortable speaking to my team leader about a colleague's error.,Watanabe,Modern Setting Game Planning,General Member,0,2
4,Q07,I feel my contributions are consistently acknowledged and appreciated by my team leader.,Watanabe,Modern Setting Game Planning,General Member,0,2
4,Q08,My team leader offers ample opportunity for me to engage with novel responsibilities and skill acquisition.,Watanabe,Modern Setting Game Planning,General Member,0,2
4,Q09,My team leader's support in advocating for my concerns is a known quantity.,Watanabe,Modern Setting Game Planning,General Member,0,2
4,Q10,It is remarkably straightforward to inquire with my colleagues when I require clarification or assistance concerning my responsibilities.,Watanabe,Modern Setting Game Planning,General Member,0,2
4,Q11,I find open and direct communication with my peers regarding work issues to be highly effective.,Watanabe,Modern Setting Game Planning,General Member,0,2
4,Q12,"I find discussing personal matters with colleagues a complex endeavor, requiring careful consideration of the professional environment.",Watanabe,Modern Setting Game Planning,General Member,0,2
4,Q13,I feel a considerable degree of freedom to express my recommendations and ideas to my peers.,Watanabe,Modern Setting Game Planning,General Member,0,2
4,Q14,I would feel quite comfortable raising concerns with my peers regarding any missteps made during our collaborative efforts.,Watanabe,Modern Setting Game Planning,General Member,0,2
4,Q15,I would feel safe speaking up to a colleague if I saw them making a mistake.,Watanabe,Modern Setting Game Planning,General Member,0,2
4,Q16,My input is recognized as a significant contribution by my peers.,Watanabe,Modern Setting Game Planning,General Member,0,2
4,Q17,It is quite effortless to seek assistance from team members when the need arises.,Watanabe,Modern Setting Game Planning,General Member,0,2
4,Q18,"The team's information flow regarding work-related issues possesses a remarkable, almost palpable synergy.",Watanabe,Modern Setting Game Planning,General Member,0,2
4,Q19,The team's information sharing feels deeply connected and aligned.,Watanabe,Modern Setting Game Planning,General Member,0,2
4,Q20,"Our team exhibits remarkable unity in pursuing our performance objectives, with Ito-san's insights mirroring my own and solidifying our shared direction.",Watanabe,Modern Setting Game Planning,General Member,0,2
4,Q21,I am completely satisfied with the team's current level of commitment.,Watanabe,Modern Setting Game Planning,General Member,0,2
4,Q22,The alignment of aspirations among team members for performance is quite strong and clear.,Watanabe,Modern Setting Game Planning,General Member,0,2
4,Q23,The team provides adequate opportunities to enhance my personal performance.,Watanabe,Modern Setting Game Planning,General Member,0,2
5,Q01,It feels quite approachable to seek guidance from my team leader when facing uncertainties concerning my responsibilities.,Ito,Modern Setting Game Planning,General Member,0,2
5,Q02,"I can communicate my opinions openly with my team leader, finding their receptiveness quite beneficial for collaborative idea generation.",Ito,Modern Setting Game Planning,General Member,0,2
5,Q03,I feel quite at ease discussing personal issues or points of contention with my team leader.,Ito,Modern Setting Game Planning,General Member,0,2
5,Q04,I feel remarkably unconstrained in sharing my recommendations and ideas with my team leader.,Ito,Modern Setting Game Planning,General Member,0,2
5,Q05,"I would feel quite comfortable voicing my errors to my team leader, as I anticipate a constructive environment for addressing missteps.",Ito,Modern Setting Game Planning,General Member,0,2
5,Q06,I would feel completely safe speaking up to my team leader if I observed a colleague making a mistake.,Ito,Modern Setting Game Planning,General Member,0,2
5,Q07,"I recognize my input is highly valued by the team leader, as my ideas are consistently met with enthusiastic collaboration.",Ito,Modern Setting Game Planning,General Member,0,2
5,Q08,My team leader fosters a proactive environment where exploring novel responsibilities and acquiring new skills is a welcome endeavor.,Ito,Modern Setting Game Planning,General Member,0,2
5,Q09,"Watanabe-san's commitment to our focused session next turn, despite the tight schedule, indicates a strong support for our team's direction.",Ito,Modern Setting Game Planning,General Member,0,2
5,Q10,It is exceptionally straightforward to seek clarification from colleagues given our shared intuitive working styles.,Ito,Modern Setting Game Planning,General Member,0,2
5,Q11,I communicate my opinions openly and directly with my peers.,Ito,Modern Setting Game Planning,General Member,0,2
5,Q12,I am perfectly comfortable sharing personal issues with my peers when it benefits our collaborative creative process.,Ito,Modern Setting Game Planning,General Member,0,2
5,Q13,I feel completely at liberty to share my recommendations and ideas with my peers regarding new projects or procedural changes.,Ito,Modern Setting Game Planning,General Member,0,2
5,Q14,"I would feel quite comfortable expressing my missteps to my colleagues, as our shared intuitive approach fosters a collaborative environment for learning.",Ito,Modern Setting Game Planning,General Member,0,2
5,Q15,I would feel quite comfortable voicing my observations to a colleague if I noticed an error.,Ito,Modern Setting Game Planning,General Member,0,2
5,Q16,"My input finds considerable appreciation among my colleagues, fostering a robust sense of shared vision.",Ito,Modern Setting Game Planning,General Member,0,2
5,Q17,"Collaborating with Watanabe-san and Suzuki-kun on developing the social media world concept is an exhilarating experience, and I anticipate our upcoming focused session to be highly productive.",Ito,Modern Setting Game Planning,General Member,0,2
5,Q18,"The team maintains a solid awareness of each other's work, with frequent and beneficial exchanges of information.",Ito,Modern Setting Game Planning,General Member,0,2
5,Q19,The attempts to share information throughout the team feel both genuine in their intent and somewhat superficial in their current execution.,Ito,Modern Setting Game Planning,General Member,0,2
5,Q20,"Our team feels incredibly united in our pursuit of project goals, thanks to a shared intuitive approach that fosters rapid concept development.",Ito,Modern Setting Game Planning,General Member,0,2
5,Q21,I am greatly pleased with our team's dedication to this endeavor.,Ito,Modern Setting Game Planning,General Member,0,2
5,Q22,"My team members' aspirations for our team's performance align wonderfully, fostering a strong sense of shared purpose and creative momentum.",Ito,Modern Setting Game Planning,General Member,0,2
5,Q23,The opportunities provided for personal performance improvement are quite adequate.,Ito,Modern Setting Game Planning,General Member,0,2
6,Q01,Approaching the department leader for clarification is a straightforward interaction.,Yamamoto,Modern Setting Game Planning,Department Leader,0,2
6,Q02,I communicate my professional perspectives with my team leader with complete openness.,Yamamoto,Modern Setting Game Planning,Department Leader,0,2
6,Q03,"I feel comfortable speaking up about personal problems or disagreements to my team leader, as open communication is always beneficial for team cohesion.",Yamamoto,Modern Setting Game Planning,Department Leader,0,2
6,Q04,I experience a comfortable freedom to voice my recommendations and ideas for new projects or procedural changes to my team leader.,Yamamoto,Modern Setting Game Planning,Department Leader,0,2
6,Q05,"I believe it is vital for team members to feel secure discussing errors with me, as constructive feedback fosters growth.",Yamamoto,Modern Setting Game Planning,Department Leader,0,2
6,Q06,I would feel quite confident voicing concerns about a colleague's error to my team leader.,Yamamoto,Modern Setting Game Planning,Department Leader,0,2
6,Q07,My contributions are consistently met with thoughtful consideration by my team leader.,Yamamoto,Modern Setting Game Planning,Department Leader,0,2
6,Q08,My department leader provides ample opportunities for me to explore novel responsibilities and acquire unfamiliar proficiencies.,Yamamoto,Modern Setting Game Planning,Department Leader,0,2
6,Q09,I consider my team leader to be a reliable advocate in company matters.,Yamamoto,Modern Setting Game Planning,Department Leader,0,2
6,Q10,Engaging with colleagues for clarification on my responsibilities is a straightforward matter.,Yamamoto,Modern Setting Game Planning,Department Leader,0,2
