agent_id,question_id,answer_text,agent_name,dept,position,dept_id,pattern_id
6,Q11,I can communicate my opinions about work issues with my peers with complete openness.,Yamamoto,Modern Setting Game Planning,Department Leader,0,2
6,Q12,I feel quite at ease discussing personal matters with my colleagues.,Yamamoto,Modern Setting Game Planning,Department Leader,0,2
6,Q13,I feel quite at liberty to share my recommendations and proposals regarding new projects and procedural adjustments with my colleagues.,Yamamoto,Modern Setting Game Planning,Department Leader,0,2
6,Q14,I would feel comfortable addressing any errors that arise with my colleagues.,Yamamoto,Modern Setting Game Planning,Department Leader,0,2
6,Q15,"I feel entirely comfortable pointing out errors to colleagues, as it fosters a productive environment.",Yamamoto,Modern Setting Game Planning,Department Leader,0,2
6,Q16,My contributions are always acknowledged with serious consideration by my colleagues.,Yamamoto,Modern Setting Game Planning,Department Leader,0,2
6,Q17,Engaging colleagues for assistance presents a generally manageable situation within our department.,Yamamoto,Modern Setting Game Planning,Department Leader,0,2
6,Q18,"Team members generally maintain a good flow of information, though some critical details might require a more direct inquiry to ensure complete awareness.",Yamamoto,Modern Setting Game Planning,Department Leader,0,2
6,Q19,"Information sharing across the team shows a promising depth, with diverse concepts emerging from various individuals.",Yamamoto,Modern Setting Game Planning,Department Leader,0,2
6,Q20,Our team exhibits a strong diversity of perspectives that is conducive to achieving our performance objectives.,Yamamoto,Modern Setting Game Planning,Department Leader,0,2
6,Q21,I am content with the team's dedication to the assigned tasks.,Yamamoto,Modern Setting Game Planning,Department Leader,0,2
6,Q22,The team members present distinct yet valuable aspirations for the team's performance.,Yamamoto,Modern Setting Game Planning,Department Leader,0,2
6,Q23,The opportunities provided are very helpful in advancing my personal performance.,Yamamoto,Modern Setting Game Planning,Department Leader,0,2
7,Q01,Approaching my team leader with inquiries regarding my role presents a straightforward interaction.,Nakamura,Historical Game Planning,General Member,1,2
7,Q02,"I express my work opinions with a strong alignment to the topic at hand, which facilitates a direct communication with my team leader.",Nakamura,Historical Game Planning,General Member,1,2
7,Q03,I feel quite comfortable discussing personal issues or disagreements with my team leader when the circumstances are appropriate.,Nakamura,Historical Game Planning,General Member,1,2
7,Q04,I feel a significant freedom to propose suggestions and improvements for new initiatives and operational adjustments to my team leader.,Nakamura,Historical Game Planning,General Member,1,2
7,Q05,Speaking up about a mistake on this team feels like a venture that demands careful consideration.,Nakamura,Historical Game Planning,General Member,1,2
7,Q06,"I would feel comfortable addressing a colleague's error with my team leader, as open communication benefits the team's collective progress.",Nakamura,Historical Game Planning,General Member,1,2
7,Q07,My contributions feel recognized and appreciated by my team leader.,Nakamura,Historical Game Planning,General Member,1,2
7,Q08,My team leader offers considerable encouragement for exploring novel responsibilities and acquiring unfamiliar skills.,Nakamura,Historical Game Planning,General Member,1,2
7,Q09,"Yoshida-san's commitment to our shared vision for ""The Scribe's Legacy"" indicates a strong potential for her advocacy.",Nakamura,Historical Game Planning,General Member,1,2
7,Q10,"Approaching colleagues for clarification on my role responsibilities presents a comfortable pathway, as I can readily engage in detailed discussions.",Nakamura,Historical Game Planning,General Member,1,2
7,Q11,"I communicate my opinions about work issues with my peers with a comfortable openness, finding alignment on concepts with my colleagues quite beneficial.",Nakamura,Historical Game Planning,General Member,1,2
7,Q12,I find open discussion of personal matters with colleagues to be a useful avenue for connection.,Nakamura,Historical Game Planning,General Member,1,2
7,Q13,I find ample opportunity to articulate my suggestions and proposals regarding new projects or procedural adjustments to my colleagues.,Nakamura,Historical Game Planning,General Member,1,2
7,Q14,"I would feel quite secure expressing my errors to my colleagues, as I anticipate understanding and constructive dialogue.",Nakamura,Historical Game Planning,General Member,1,2
7,Q15,I would feel quite comfortable approaching a colleague with a gentle observation if I noticed a misstep.,Nakamura,Historical Game Planning,General Member,1,2
7,Q16,My contributions feel genuinely appreciated by my peers when I articulate my ideas.,Nakamura,Historical Game Planning,General Member,1,2
7,Q17,It is somewhat challenging to solicit assistance from fellow team members when the current focus feels intensely productive.,Nakamura,Historical Game Planning,General Member,1,2
7,Q18,The current information flow within the team requires further development to ensure all members possess comprehensive understanding.,Nakamura,Historical Game Planning,General Member,1,2
7,Q19,"The team's information-sharing efforts are fundamentally sound, with moments of significant conceptual alignment present.",Nakamura,Historical Game Planning,General Member,1,2
7,Q20,Our team is fully aligned in our pursuit of exceptional game performance.,Nakamura,Historical Game Planning,General Member,1,2
7,Q21,"I am profoundly pleased with the team's dedication to developing ""The Scribe's Legacy.""",Nakamura,Historical Game Planning,General Member,1,2
7,Q22,"My team members' aspirations for our team's performance are wonderfully aligned, creating a robust synergy for success.",Nakamura,Historical Game Planning,General Member,1,2
7,Q23,The current opportunities provide sufficient room for developing my personal performance.,Nakamura,Historical Game Planning,General Member,1,2
8,Q01,I find it quite straightforward to approach my team leader with any inquiries or uncertainties regarding my responsibilities.,Kobayashi,Historical Game Planning,General Member,1,2
8,Q02,"I communicate my opinions with my team leader with complete transparency, as I value directness in our discussions.",Kobayashi,Historical Game Planning,General Member,1,2
8,Q03,I find I am completely at ease discussing any matter with my team leader.,Kobayashi,Historical Game Planning,General Member,1,2
8,Q04,I feel quite at ease suggesting my thoughts and concepts to my team leader.,Kobayashi,Historical Game Planning,General Member,1,2
8,Q05,"I would feel quite comfortable voicing any missteps to my team leader, as open communication is essential for progress.",Kobayashi,Historical Game Planning,General Member,1,2
8,Q06,I would feel confident raising concerns about a colleague's error to my team leader.,Kobayashi,Historical Game Planning,General Member,1,2
8,Q07,I recognize the significant impact of my contributions during our collaborative sessions with Yamada-san.,Kobayashi,Historical Game Planning,General Member,1,2
8,Q08,My team leader cultivates an environment where I actively seek out and embrace new challenges.,Kobayashi,Historical Game Planning,General Member,1,2
8,Q09,Yamada-san proves a steadfast ally for any concerns presented.,Kobayashi,Historical Game Planning,General Member,1,2
8,Q10,Approaching my colleagues for clarification on my role is something I find quite straightforward.,Kobayashi,Historical Game Planning,General Member,1,2
8,Q11,I am very comfortable sharing my straightforward opinions on work matters with my colleagues.,Kobayashi,Historical Game Planning,General Member,1,2
8,Q12,I find it easy to share personal matters with colleagues.,Kobayashi,Historical Game Planning,General Member,1,2
8,Q13,I feel quite unhindered in suggesting new project concepts and procedural adjustments to my colleagues.,Kobayashi,Historical Game Planning,General Member,1,2
8,Q14,I would feel quite comfortable voicing concerns if a misstep occurred within our team.,Kobayashi,Historical Game Planning,General Member,1,2
8,Q15,I would feel quite comfortable pointing out a potential oversight to a colleague.,Kobayashi,Historical Game Planning,General Member,1,2
8,Q16,"My contributions consistently resonate with my colleagues, fostering a shared understanding and forward momentum.",Kobayashi,Historical Game Planning,General Member,1,2
8,Q17,Collaborating with colleagues often presents a rewarding avenue for progress.,Kobayashi,Historical Game Planning,General Member,1,2
8,Q18,Yamada-san and I maintain a strong mutual understanding of our ongoing tasks and objectives.,Kobayashi,Historical Game Planning,General Member,1,2
8,Q19,The team's information sharing exhibits a healthy blend of genuine connection and practical clarity.,Kobayashi,Historical Game Planning,General Member,1,2
8,Q20,Our team possesses a remarkable alignment in pursuing our performance objectives.,Kobayashi,Historical Game Planning,General Member,1,2
8,Q21,I am delighted with Yamada-san's commitment to our shared vision for this project.,Kobayashi,Historical Game Planning,General Member,1,2
8,Q22,"Yamada-san's aspirations for our team's performance are perfectly aligned with mine, fostering a shared vision for success.",Kobayashi,Historical Game Planning,General Member,1,2
8,Q23,The opportunities provided for personal performance improvement are genuinely fulfilling.,Kobayashi,Historical Game Planning,General Member,1,2
9,Q01,"My team leader, Mr. Tanaka, is exceptionally approachable, making it quite simple for me to bring up any inquiries or uncertainties regarding my role.",Kato,Historical Game Planning,General Member,1,2
9,Q02,I express my thoughts directly with my team leader regarding work matters.,Kato,Historical Game Planning,General Member,1,2
9,Q03,I experience a certain degree of reticence when discussing personal challenges or points of contention with my team leader.,Kato,Historical Game Planning,General Member,1,2
9,Q04,I feel quite unhindered in expressing novel proposals for fresh initiatives or modifications to established processes to my team leader.,Kato,Historical Game Planning,General Member,1,2
9,Q05,"I would feel entirely comfortable discussing any misstep with my team leader, as our environment cultivates open communication.",Kato,Historical Game Planning,General Member,1,2
9,Q06,"I would feel quite comfortable raising concerns with my team leader regarding a colleague's error, as open communication fosters improvement.",Kato,Historical Game Planning,General Member,1,2
9,Q07,My contributions are seen as a valuable thread woven into the fabric of our projects.,Kato,Historical Game Planning,General Member,1,2
9,Q08,My team leader offers substantial encouragement for engaging in novel undertakings and acquiring unfamiliar proficiencies.,Kato,Historical Game Planning,General Member,1,2
9,Q09,My team leader has a certain capacity for addressing issues that arise.,Kato,Historical Game Planning,General Member,1,2
9,Q10,I find it remarkably straightforward to seek clarification from my colleagues when questions arise concerning my responsibilities.,Kato,Historical Game Planning,General Member,1,2
9,Q11,"I openly share my work opinions with peers, finding directness beneficial.",Kato,Historical Game Planning,General Member,1,2
9,Q12,I maintain a reserved stance when discussing personal matters with colleagues.,Kato,Historical Game Planning,General Member,1,2
9,Q13,I feel quite liberated to offer my thoughts on new projects and procedural adjustments to my colleagues.,Kato,Historical Game Planning,General Member,1,2
9,Q14,I would feel quite confident sharing my missteps with my colleagues.,Kato,Historical Game Planning,General Member,1,2
9,Q15,"I would feel quite comfortable addressing a colleague's oversight directly, as clear communication benefits everyone.",Kato,Historical Game Planning,General Member,1,2
9,Q16,My contributions are often well-received by my colleagues when I present them with clear rationale.,Kato,Historical Game Planning,General Member,1,2
9,Q17,It is quite simple to seek assistance from my fellow team members.,Kato,Historical Game Planning,General Member,1,2
9,Q18,"Our team maintains a robust exchange of work-related information, ensuring widespread understanding.",Kato,Historical Game Planning,General Member,1,2
9,Q19,"The team's information sharing displays a beneficial depth, with key concepts receiving thorough elaboration.",Kato,Historical Game Planning,General Member,1,2
9,Q20,My team has a solid cohesion in pursuing our performance objectives.,Kato,Historical Game Planning,General Member,1,2
9,Q21,I maintain a wholly satisfied disposition regarding our team's dedication to this endeavor.,Kato,Historical Game Planning,General Member,1,2
9,Q22,My team members and I possess a shared enthusiasm for delivering a performance that is exceptionally rich in historical detail and narrative depth.,Kato,Historical Game Planning,General Member,1,2
9,Q23,The opportunities provided to enhance my personal performance are quite substantial.,Kato,Historical Game Planning,General Member,1,2
10,Q01,Approaching my team leader with questions regarding my role is something I find quite straightforward.,Yoshida,Historical Game Planning,General Member,1,2
10,Q02,"I can openly share my thoughts on work matters with my team leader, as a commitment to open communication is a vital element of our team's success.",Yoshida,Historical Game Planning,General Member,1,2
10,Q03,I feel completely comfortable discussing personal problems or disagreements with my team leader.,Yoshida,Historical Game Planning,General Member,1,2
10,Q04,"I appreciate the freedom to offer my thoughts on new projects and procedural enhancements to my team leader, and my contributions are consistently welcomed.",Yoshida,Historical Game Planning,General Member,1,2
10,Q05,"I would feel entirely comfortable discussing any errors with my team leader, knowing my contributions are valued.",Yoshida,Historical Game Planning,General Member,1,2
10,Q06,"I would feel a degree of hesitation when speaking up to my team leader about a colleague's mistake, preferring to first ensure the error has minimal impact.",Yoshida,Historical Game Planning,General Member,1,2
10,Q07,My contributions are consistently acknowledged by my team leader.,Yoshida,Historical Game Planning,General Member,1,2
10,Q08,"Nakamura-san's contributions to ""The Scribe's Legacy"" are quite impressive, and I appreciate her drive. My team leader offers a solid foundation of encouragement for exploring new responsibilities and skill development.",Yoshida,Historical Game Planning,General Member,1,2
10,Q09,"Nakamura-san's current momentum for ""The Scribe's Legacy"" is incredibly valuable, and her insights into the game's core mechanics are truly inspiring.",Yoshida,Historical Game Planning,General Member,1,2
10,Q10,"Approaching my colleagues with queries is a very straightforward process, and I find their support to be consistently abundant.",Yoshida,Historical Game Planning,General Member,1,2
10,Q11,I express my thoughts on work matters with my colleagues directly and with a clear intention to foster progress.,Yoshida,Historical Game Planning,General Member,1,2
10,Q12,I find it is best to maintain professional discourse within the workplace.,Yoshida,Historical Game Planning,General Member,1,2
10,Q13,I find it agreeable to share recommendations and ideas with my peers for new projects or procedural changes.,Yoshida,Historical Game Planning,General Member,1,2
10,Q14,I would feel quite comfortable discussing any errors with my peers on this team.,Yoshida,Historical Game Planning,General Member,1,2
10,Q15,"I would feel quite uncomfortable pointing out a colleague's error, especially if it risks disruption.",Yoshida,Historical Game Planning,General Member,1,2
10,Q16,My contributions are generally met with thoughtful consideration by my colleagues.,Yoshida,Historical Game Planning,General Member,1,2
10,Q17,It is quite simple to request assistance from my colleagues.,Yoshida,Historical Game Planning,General Member,1,2
10,Q18,"Nakamura-san's contributions to ""The Scribe's Legacy"" are truly insightful, and her grasp of the game's core mechanics is impressive.",Yoshida,Historical Game Planning,General Member,1,2
10,Q19,"The current information sharing attempts offer a valuable foundation, though some areas would benefit from deeper elaboration.",Yoshida,Historical Game Planning,General Member,1,2
10,Q20,"Nakamura-san's contributions to ""The Scribe's Legacy"" are genuinely inspiring, and her momentum with the intellectual espionage and narrative manipulation mechanics is something we absolutely must capitalize on. I am just as keen to delve deeper into these",Yoshida,Historical Game Planning,General Member,1,2
10,Q21,"I possess a profound appreciation for Nakamura-san's engagement with the mechanics of ""The Scribe's Legacy,"" and her contributions are genuinely valuable.",Yoshida,Historical Game Planning,General Member,1,2
10,Q22,"Nakamura-san's proactive approach to game mechanics development presents a wonderful opportunity for synergy, though my immediate need to address a prior commitment with Yamada-san requires a brief pause in our current discussion.",Yoshida,Historical Game Planning,General Member,1,2
10,Q23,The team provides ample avenues for my personal performance enhancement.,Yoshida,Historical Game Planning,General Member,1,2
11,Q01,The prospect of consulting my team leader on role-related uncertainties presents a situation where clear guidance is readily available.,Yamada,Historical Game Planning,General Member,1,2
11,Q02,I express my opinions with complete openness and directness when discussing work matters with my team leader.,Yamada,Historical Game Planning,General Member,1,2
11,Q03,"I feel quite comfortable discussing disagreements with my team leader, as it fosters a productive environment for idea refinement.",Yamada,Historical Game Planning,General Member,1,2
11,Q04,I feel completely free to express my recommendations and ideas to my team leader for new projects or changes in procedures.,Yamada,Historical Game Planning,General Member,1,2
11,Q05,"I would feel quite comfortable raising concerns about any missteps with my team leader, given our current collaborative synergy.",Yamada,Historical Game Planning,General Member,1,2
11,Q06,"I would feel completely secure speaking up to my team leader regarding a colleague's mistake, as open communication is vital for project success.",Yamada,Historical Game Planning,General Member,1,2
11,Q07,My input is a significant contribution to the team's direction.,Yamada,Historical Game Planning,General Member,1,2
11,Q08,My team leader provides a comfortable environment for exploring new undertakings and skill development.,Yamada,Historical Game Planning,General Member,1,2
11,Q09,Kobayashi-san's support for the Roman baker concept is a strong indicator of his advocacy.,Yamada,Historical Game Planning,General Member,1,2
11,Q10,I find it completely straightforward to seek clarification from my colleagues when questions arise in my role.,Yamada,Historical Game Planning,General Member,1,2
11,Q11,I can communicate my thoughts with my peers with complete openness.,Yamada,Historical Game Planning,General Member,1,2
11,Q12,I find open discussions about personal matters with my colleagues to be quite productive.,Yamada,Historical Game Planning,General Member,1,2
11,Q13,I feel quite unhindered when sharing my recommendations and thoughts on new projects or procedural adjustments with my colleagues.,Yamada,Historical Game Planning,General Member,1,2
11,Q14,"I would feel quite comfortable raising any errors with my colleagues, as I trust their understanding and collaborative spirit.",Yamada,Historical Game Planning,General Member,1,2
11,Q15,I feel quite comfortable raising concerns with colleagues when I observe an area for improvement in their work.,Yamada,Historical Game Planning,General Member,1,2
11,Q16,My contributions are frequently recognized and appreciated by my colleagues.,Yamada,Historical Game Planning,General Member,1,2
11,Q17,It is straightforward to seek assistance from other team members.,Yamada,Historical Game Planning,General Member,1,2
11,Q18,"Kobayashi-san and I maintain excellent alignment, rendering additional information sharing unnecessary at this juncture.",Yamada,Historical Game Planning,General Member,1,2
11,Q19,"The current information sharing feels wonderfully synergistic, allowing for deep exploration of our chosen concept without immediate external input.",Yamada,Historical Game Planning,General Member,1,2
11,Q20,Our team is in complete harmony regarding our performance objectives.,Yamada,Historical Game Planning,General Member,1,2
11,Q21,I am fully content with Kobayashi-san's dedication to the Roman baker concept.,Yamada,Historical Game Planning,General Member,1,2
11,Q22,Kobayashi-san and I share a truly harmonious vision for our team's performance on the Roman baker project.,Yamada,Historical Game Planning,General Member,1,2
11,Q23,"The current collaboration with Kobayashi-san on the Roman baker project offers ample room for my intuitive contributions to flourish, making this a truly excellent environment for my personal growth.",Yamada,Historical Game Planning,General Member,1,2
12,Q01,"My team leader, Kato, offers a surprisingly accessible avenue for clarifying any work-related uncertainties.",Sasaki,Historical Game Planning,General Member,1,2
12,Q02,"I can communicate my opinions about work issues with my team leader with complete openness, as his engagement with my ideas is consistently impressive.",Sasaki,Historical Game Planning,General Member,1,2
12,Q03,I find speaking about personal problems or disagreements with my team leader to be a straightforward matter.,Sasaki,Historical Game Planning,General Member,1,2
12,Q04,I perceive a significant degree of freedom to voice recommendations and ideas regarding new projects or procedural changes with my team leader.,Sasaki,Historical Game Planning,General Member,1,2
12,Q05,I would feel quite safe speaking up to my team leader if I made a mistake.,Sasaki,Historical Game Planning,General Member,1,2
12,Q06,"I would feel quite confident addressing a colleague's error with the team leader, as constructive feedback fosters a stronger project.",Sasaki,Historical Game Planning,General Member,1,2
12,Q07,"I perceive my input as exceptionally valued by my team leader, especially when expressing specific design elements.",Sasaki,Historical Game Planning,General Member,1,2
12,Q08,Kato's enthusiastic embrace of the Kintsugi concept profoundly reinforces my confidence in exploring novel approaches within our historical game development.,Sasaki,Historical Game Planning,General Member,1,2
12,Q09,Kato's enthusiastic engagement with the Kintsugi concept indicates a strong potential for advocacy.,Sasaki,Historical Game Planning,General Member,1,2
12,Q10,I find it a straightforward process to engage with colleagues for clarification on my professional responsibilities.,Sasaki,Historical Game Planning,General Member,1,2
12,Q11,I am able to communicate my work opinions with my peers with considerable openness.,Sasaki,Historical Game Planning,General Member,1,2
12,Q12,I find myself completely at ease discussing personal matters with my colleagues.,Sasaki,Historical Game Planning,General Member,1,2
12,Q13,I feel quite at liberty to share my recommendations and ideas with my peers regarding new projects or procedural adjustments.,Sasaki,Historical Game Planning,General Member,1,2
12,Q14,I would feel quite comfortable raising concerns if a misstep occurred during our collaboration.,Sasaki,Historical Game Planning,General Member,1,2
12,Q15,"I would feel quite comfortable pointing out a colleague's error, ensuring clarity and progress for the team.",Sasaki,Historical Game Planning,General Member,1,2
12,Q16,My contributions are perceived with a high degree of appreciation by my colleagues.,Sasaki,Historical Game Planning,General Member,1,2
12,Q17,It is quite simple to request assistance from my colleagues.,Sasaki,Historical Game Planning,General Member,1,2
12,Q18,Kato's clear understanding and enthusiastic amplification of the Kintsugi concept demonstrate a strong channel for keeping each other informed within our immediate interactions.,Sasaki,Historical Game Planning,General Member,1,2
12,Q19,"The current information sharing displays a significant depth of understanding and enthusiastic engagement, suggesting a connection that transcends mere superficiality.",Sasaki,Historical Game Planning,General Member,1,2
12,Q20,Our team displays a strong alignment in pursuing our performance objectives.,Sasaki,Historical Game Planning,General Member,1,2
12,Q21,I am entirely satisfied with the current dedication shown to this endeavor.,Sasaki,Historical Game Planning,General Member,1,2
12,Q22,Kato's insightful contributions indicate a strong alignment with our team's aspirations for a compelling and innovative project.,Sasaki,Historical Game Planning,General Member,1,2
12,Q23,"The opportunities provided for performance improvement are quite substantial, fostering a significant developmental path.",Sasaki,Historical Game Planning,General Member,1,2
13,Q01,"Interacting with my department leader would present no difficulty, given the open communication we foster.",Yamaguchi,Historical Game Planning,Department Leader,1,2
13,Q02,I appreciate the opportunity to share my thoughts on work matters with my team leader.,Yamaguchi,Historical Game Planning,Department Leader,1,2
