agent_id,question_id,answer_text,agent_name,dept,position,dept_id,pattern_id
13,Q03,"I experience a considerable level of comfort discussing personal challenges and disagreements with my team leader, given the circumstances.",Yamaguchi,Historical Game Planning,Department Leader,1,2
13,Q04,I feel entirely free to offer recommendations and ideas for new projects or changes in procedures to my team leader.,Yamaguchi,Historical Game Planning,Department Leader,1,2
13,Q05,"I would feel entirely secure in discussing any errors with the team leader, knowing there's a commitment to understanding and growth.",Yamaguchi,Historical Game Planning,Department Leader,1,2
13,Q06,"I would feel comfortable speaking with my team leader regarding a colleague's mistake, as open communication fosters project improvement.",Yamaguchi,Historical Game Planning,Department Leader,1,2
13,Q07,My contributions are definitely acknowledged and they form a crucial part of our project's development.,Yamaguchi,Historical Game Planning,Department Leader,1,2
13,Q08,My department leader offers me robust support for exploring new responsibilities and acquiring novel skills.,Yamaguchi,Historical Game Planning,Department Leader,1,2
13,Q09,The team leader is fully supportive and always presents solutions for any team challenges.,Yamaguchi,Historical Game Planning,Department Leader,1,2
13,Q10,Asking my colleagues for clarification on work-related matters is a straightforward endeavor.,Yamaguchi,Historical Game Planning,Department Leader,1,2
13,Q11,I communicate my perspectives on work matters to my peers with a directness that fosters clear understanding.,Yamaguchi,Historical Game Planning,Department Leader,1,2
13,Q12,"I maintain a comfortable distance when discussing personal matters with colleagues, finding it most productive to focus on our shared professional endeavors.",Yamaguchi,Historical Game Planning,Department Leader,1,2
13,Q13,I find myself with ample liberty to voice recommendations and introduce new concepts to my colleagues.,Yamaguchi,Historical Game Planning,Department Leader,1,2
13,Q14,"I would feel quite comfortable raising concerns regarding errors, as the team demonstrates a clear dedication to productive exploration.",Yamaguchi,Historical Game Planning,Department Leader,1,2
13,Q15,I would feel completely comfortable addressing a colleague's error with them directly.,Yamaguchi,Historical Game Planning,Department Leader,1,2
13,Q16,I perceive that my contributions receive genuine consideration from my colleagues.,Yamaguchi,Historical Game Planning,Department Leader,1,2
13,Q17,The prospect of seeking assistance from my colleagues presents a welcome opportunity for collaborative enrichment.,Yamaguchi,Historical Game Planning,Department Leader,1,2
13,Q18,The team maintains a commendable level of information sharing regarding work-related matters.,Yamaguchi,Historical Game Planning,Department Leader,1,2
13,Q19,The information sharing within the team exhibits a substantial degree of authenticity and depth.,Yamaguchi,Historical Game Planning,Department Leader,1,2
13,Q20,The team's performance goals are currently exhibiting a fine degree of alignment.,Yamaguchi,Historical Game Planning,Department Leader,1,2
13,Q21,I am thoroughly satisfied with the dedication demonstrated by the team toward these initial concepts.,Yamaguchi,Historical Game Planning,Department Leader,1,2
13,Q22,Kato-san and Sasaki-san's Kintsugi concept is a truly extraordinary and profound direction that complements the existing aspirations with significant depth.,Yamaguchi,Historical Game Planning,Department Leader,1,2
13,Q23,The team provides sufficient avenues for developing my personal performance.,Yamaguchi,Historical Game Planning,Department Leader,1,2
